question,answer,contexts,persona_name,query_style,query_length,context_1hop,context_2hop,file_a,file_b,shared_themes,metadata_overlapped,keyphrases_overlapped,geval_Relevance_multi,geval_Agnosticism_multi,geval_Completeness_multi,geval_Accuracy_multi,geval_Reasonableness_multi,geval_情境連貫性,geval_跨文件必要性
國立中山大學管理學院的英語授課獎勵辦法如何促進國際學位學程的發展？並且國際碩士學程學生如何獲得中文能力測試的補助？,根據國立中山大學管理學院英語授課獎勵要點，該辦法旨在增廣管理學院國際學術交流的多元性，擴展英語課程和國際學位學程，提升學生因應全球化趨勢的能力，並增加外國籍學生修課或修讀學位的機會。英語授課課程由管院專任教師以英語授課，且需有至少5名外籍生修課，符合標準者可獲得3至5萬元新台幣的補助。另一方面，國際碩士學程（IBMBA和GHRM MBA）學生可申請中文能力測試（TOCFL）的報名費補助，申請需提交相關文件，補助僅限一次，旨在鼓勵學生提升中文能力。這兩項措施共同促進了國際學位學程的發展與學生的語言能力提升。,"[""<1-hop>  [202509051808420703.md]\n\n國立中山大學管理學院英語授課獎勵要點\n\nNational Sun-Yat sen University College of Management Regulation for Rewarding of English-Taught Courses\n\n第 8 次主管會議通過 (96.4.10)\n\nApproved by the 8 th Director's Council Meeting (April 10, 2007)\n\n97 學年度第 13 次主管會議修正 (98.4.29)\n\nAmended and Approved by the 13 th Director's Council Meeting (April 29, 2009)\n\n98 學年度第 1 次主管會議修正 (98.8.30)\n\nAmended and Approved by the 1 st Director's Council Meeting (August 80, 2009)\n\n99 學年度第 4 次國際學程會議修正 (99.12.30)\n\nAmended and Approved by the 4 th International Program Committee(December 30, 2010)\n\n一、 辦法宗旨：為增廣管理學院 ( 簡稱管院 ) 國際學術交流之多元性、擴展 管院英語課程和國際學位學程、提升管院學生因應全球化趨勢、以及增加 外國籍學生至管院修課或修讀學位之機會，特設此獎勵辦法。\n\nI.\n\nPurpose of this Regulation\n\nThis regulation was put in place to extend the College of Management's (hereon referred to as the 'College') diversity in terms of international academic exchange, to expand the College's English-taught courses and international programs, to better prepare our students against global trends and to increase the possibility for international students to take courses or pursue degree programs at our College.\n\n二、 開課程序：依據本校英語授課相關辦法及程序提報為英語授課程並提 供外籍生選課。\n\nII. Course opening process: The course shall be reported and processed as an English-taught course according to the university's guidelines regarding English-taught courses. The course shall be made available for international students to enroll in.\n\n三、 課程補助費：\n\n管院英語課程補助之標準須依照下列規定：\n\nIII. Course funding\n\nFunding for the College's English-taught courses must follow the rules below:\n\n( 一 ) 獎勵對象 : 管院專任教師；外院及兼任教師另議；不含國際教師。\n\n(1) Recipients: College of Management's full-time faculty. Other colleges and adjunct faculty shall be considered separately. Shall not include international faculty.\n\n( 二 ) 開課教師必須以英語授課 ( 含課綱、講授、教材、考試與課間討論 ) 。\n\n(2) Course faculty must teach in English (including syllabus, lecture, course material, exams and class discussions)\n\n( 三 ) 補助課程範圍 :\n\n(3) Scope of course funding:\n\ni.\n\n由學程主任邀請開課之課程。\n\nInvited by the program director to offer a new course\n\nii. 管院各系所開設之符合修課人數補助標準之英語課程。\n\nEach department of the College can offer English-taught courses that fulfill the standard for funding according to enrollment number.\n\n( 四 ) 修課人數補助標準：\n\n實際修課外籍生人數超過 ( 含 )5 人以上，綜合考量總修課人數，院 內專任教師每門課 ( 以三學分計算 ) 補助 3~5 萬元整 ( 如附件一 ) 。\n\n(4) Standard for funding according to enrollment number : At least five international students must be actually enrolled in the course. In consideration of the number of students enrolled in the course, a total of NTD $30,000-50,000 is funded to each course (3 credits) offered by fulltime faculty of the College (as listed in Attachment 1).\n\n( 五 ) 每學期加退選結束後，由院辦匯整課程資料確認開課，送請院長核定 獎勵。\n\n(5) Each semester after the course add/drop period, the College will collect and organize the course details and confirm the opening of the course, prior to obtaining the Dean's approval for the reward.\n\n四、 實施與修正：本辦法經管院國際學程委員會討論通過，院長同意後實 施，修正時亦同。\n\nIV.\n\nImplementation and Amendments\n\nThis regulation, as well as its amendments, shall be effective upon review and approval of the International Program Committee and the College Dean.\n\n附件一 -補助標準\n\nAttachment 1 - Funding Standards\n\n補助標準如下 :\n\n總人數 外籍生 30 人以下 30 人以上 5-14 3 4 15 以上 4 5\n\nThe Funding standards are as follows:\n\nTotal number of students Number of International people or less 30 people or more 30 students 5-14 3 4 15 or more 4 5\n\n補充 :\n\n(1) 外院教師由國際學程主任邀請至管院開設英語授課，比照管院教師。 (2)IPhD 課程，一律至少補助 3 萬。\n\nNote:\n\nFaculty from other colleges whom have been invited by the program director to offer English-taught courses in the College of Management shall be viewed in the same way as faculty of the College of Management.\n\nIPhD courses are all funded a minimum of NTD $30,000."", '<2-hop>  [202202211350450073.md]\n\nInternational Master Programs, College of Management, National Sun Yat-sen University\n\nRegulations Governing Awards & Subsidies for the Test of Chinese as a Foreign Language\n\nApproved by the 3 rd Program Affairs Meeting for the 2 nd Semester of Academic Year 2 0 1 8 / 1 9 on May 2 nd 2019.\n\nI. Aim:\n\nThese Regulations are enacted to encourage students studying the International Master Programs (IBMBA and GHRM MBA) to take the Test of Chinese as a Foreign Language (TOCFL), so as to strengthen and improve their Chinese proficiency.\n\nII.\n\nSource of funding: Tuition revenue for the IBMBA and GHRM MBA\n\nIII. Application criteria:\n\nIt is a one-time subsidy for IBMBA or GHRM MBA students who take the TOCFL at any level (preferably A2) during their studies.\n\nIV. Application documents:\n\n(1) TOCFL Registration Fee Subsidy Application Form\n\n(2) An original copy and a photocopy of the transcript (the original copy will be returned after verification)\n\n(3) Payment receipt (such as remittance or credit card payment details)\n\n(4) A photocopy of student ID\n\n(5) A photocopy of passport. Also, a photocopy entry/exit stamp on a passport is required if the applicant has been resided in the Republic of China for 183 days in the current year.\n\n(6) A photocopy of Alien Resident Certificate (ARC)\n\n(7) A photocopy of postal or bank passbook\n\nV. Item eligible for a subsidy:\n\nCategory Level Amount of Subsidy TOCFL Any level (preferably A2) Registration fee for Listening and Reading Tests\n\nVI. Application dates:\n\nFirst semester: From November 1 st to November 15 th every year\n\nSecond semester: From May 1 st\n\nto May 15 th every year\n\nVII. Number of subsidies given and method by which they are granted: Subsidies will only be given once to test takers, regardless of the level and the result of the test. Please download the application form from IBMBA and GHRM MBA website, fill in the form within the application period and submit the completed form to the Office of the IBMBA and GHRM MBA for review. The list of subsidy recipients will be announced after their applications have been approved.\n\nVIII. These Regulations will be implemented upon approval by the Program Affairs Meeting. Amendments to the Regulations shall be processed accordingly.']",teacher,Poor grammar,short,"<1-hop>  [202509051808420703.md]

國立中山大學管理學院英語授課獎勵要點

National Sun-Yat sen University College of Management Regulation for Rewarding of English-Taught Courses

第 8 次主管會議通過 (96.4.10)

Approved by the 8 th Director's Council Meeting (April 10, 2007)

97 學年度第 13 次主管會議修正 (98.4.29)

Amended and Approved by the 13 th Director's Council Meeting (April 29, 2009)

98 學年度第 1 次主管會議修正 (98.8.30)

Amended and Approved by the 1 st Director's Council Meeting (August 80, 2009)

99 學年度第 4 次國際學程會議修正 (99.12.30)

Amended and Approved by the 4 th International Program Committee(December 30, 2010)

一、 辦法宗旨：為增廣管理學院 ( 簡稱管院 ) 國際學術交流之多元性、擴展 管院英語課程和國際學位學程、提升管院學生因應全球化趨勢、以及增加 外國籍學生至管院修課或修讀學位之機會，特設此獎勵辦法。

I.

Purpose of this Regulation

This regulation was put in place to extend the College of Management's (hereon referred to as the 'College') diversity in terms of international academic exchange, to expand the College's English-taught courses and international programs, to better prepare our students against global trends and to increase the possibility for international students to take courses or pursue degree programs at our College.

二、 開課程序：依據本校英語授課相關辦法及程序提報為英語授課程並提 供外籍生選課。

II. Course opening process: The course shall be reported and processed as an English-taught course according to the university's guidelines regarding English-taught courses. The course shall be made available for international students to enroll in.

三、 課程補助費：

管院英語課程補助之標準須依照下列規定：

III. Course funding

Funding for the College's English-taught courses must follow the rules below:

( 一 ) 獎勵對象 : 管院專任教師；外院及兼任教師另議；不含國際教師。

(1) Recipients: College of Management's full-time faculty. Other colleges and adjunct faculty shall be considered separately. Shall not include international faculty.

( 二 ) 開課教師必須以英語授課 ( 含課綱、講授、教材、考試與課間討論 ) 。

(2) Course faculty must teach in English (including syllabus, lecture, course material, exams and class discussions)

( 三 ) 補助課程範圍 :

(3) Scope of course funding:

i.

由學程主任邀請開課之課程。

Invited by the program director to offer a new course

ii. 管院各系所開設之符合修課人數補助標準之英語課程。

Each department of the College can offer English-taught courses that fulfill the standard for funding according to enrollment number.

( 四 ) 修課人數補助標準：

實際修課外籍生人數超過 ( 含 )5 人以上，綜合考量總修課人數，院 內專任教師每門課 ( 以三學分計算 ) 補助 3~5 萬元整 ( 如附件一 ) 。

(4) Standard for funding according to enrollment number : At least five international students must be actually enrolled in the course. In consideration of the number of students enrolled in the course, a total of NTD $30,000-50,000 is funded to each course (3 credits) offered by fulltime faculty of the College (as listed in Attachment 1).

( 五 ) 每學期加退選結束後，由院辦匯整課程資料確認開課，送請院長核定 獎勵。

(5) Each semester after the course add/drop period, the College will collect and organize the course details and confirm the opening of the course, prior to obtaining the Dean's approval for the reward.

四、 實施與修正：本辦法經管院國際學程委員會討論通過，院長同意後實 施，修正時亦同。

IV.

Implementation and Amendments

This regulation, as well as its amendments, shall be effective upon review and approval of the International Program Committee and the College Dean.

附件一 -補助標準

Attachment 1 - Funding Standards

補助標準如下 :

總人數 外籍生 30 人以下 30 人以上 5-14 3 4 15 以上 4 5

The Funding standards are as follows:

Total number of students Number of International people or less 30 people or more 30 students 5-14 3 4 15 or more 4 5

補充 :

(1) 外院教師由國際學程主任邀請至管院開設英語授課，比照管院教師。 (2)IPhD 課程，一律至少補助 3 萬。

Note:

Faculty from other colleges whom have been invited by the program director to offer English-taught courses in the College of Management shall be viewed in the same way as faculty of the College of Management.

IPhD courses are all funded a minimum of NTD $30,000.","<2-hop>  [202202211350450073.md]

International Master Programs, College of Management, National Sun Yat-sen University

Regulations Governing Awards & Subsidies for the Test of Chinese as a Foreign Language

Approved by the 3 rd Program Affairs Meeting for the 2 nd Semester of Academic Year 2 0 1 8 / 1 9 on May 2 nd 2019.

I. Aim:

These Regulations are enacted to encourage students studying the International Master Programs (IBMBA and GHRM MBA) to take the Test of Chinese as a Foreign Language (TOCFL), so as to strengthen and improve their Chinese proficiency.

II.

Source of funding: Tuition revenue for the IBMBA and GHRM MBA

III. Application criteria:

It is a one-time subsidy for IBMBA or GHRM MBA students who take the TOCFL at any level (preferably A2) during their studies.

IV. Application documents:

(1) TOCFL Registration Fee Subsidy Application Form

(2) An original copy and a photocopy of the transcript (the original copy will be returned after verification)

(3) Payment receipt (such as remittance or credit card payment details)

(4) A photocopy of student ID

(5) A photocopy of passport. Also, a photocopy entry/exit stamp on a passport is required if the applicant has been resided in the Republic of China for 183 days in the current year.

(6) A photocopy of Alien Resident Certificate (ARC)

(7) A photocopy of postal or bank passbook

V. Item eligible for a subsidy:

Category Level Amount of Subsidy TOCFL Any level (preferably A2) Registration fee for Listening and Reading Tests

VI. Application dates:

First semester: From November 1 st to November 15 th every year

Second semester: From May 1 st

to May 15 th every year

VII. Number of subsidies given and method by which they are granted: Subsidies will only be given once to test takers, regardless of the level and the result of the test. Please download the application form from IBMBA and GHRM MBA website, fill in the form within the application period and submit the completed form to the Office of the IBMBA and GHRM MBA for review. The list of subsidy recipients will be announced after their applications have been approved.

VIII. These Regulations will be implemented upon approval by the Program Affairs Meeting. Amendments to the Regulations shall be processed accordingly.",202509051808420703.md,202202211350450073.md,"['International Master Programs', 'National Sun Yat-sen University', 'National Sun-Yat sen University College of Management', 'international programs']",管理學院↔管理學院,National Sun-Yat sen University College of Management↔National Sun Yat-sen University | international programs↔International Master Programs,5.0,5.0,4.99,5.0,5.0,2.0,5.0
研究生獎助學金經費的來源是什麼？研究生助學金的發放對象和方式有哪些？,根據提供的上下文，研究生獎助學金經費的來源是由本系研究生獎助學金經費項下提撥（<1-hop>）。研究生助學金的經費來源為每年度學生事務處分配之「學生公費暨獎助學金」、通識教育中心分配支援課程之助學金（<2-hop>）。助學金的發放對象以本校《研究生助學金分配及發放要點》之規定，且以本系未具專職學生為原則（<2-hop>）。助學金得作為獎學金直接發放、獎助生助學金，及勞僱型兼任助理薪資所得，包括教學助理、研究助理及工讀生（<2-hop>）。教學助理由授課教師自行遴選，且不得由修習該課程之學生擔任（<2-hop>）。工讀生則由系主任或其委託人遴選，薪資依工作屬性不同計酬（<2-hop>）。此外，獎學金及獎助生助學金保留若干數額鼓勵優秀學生就讀碩、博士班，獎勵條件及數額另以本系「優秀研究生新生獎學金辦法」辦理（<2-hop>）。,"['<1-hop>  [202106230909170291.md]\n\n國立中山大學資訊工程學系\n\n優秀研究生新生獎學金辦法\n\n民國 100 年 08 月 10 日系務會議訂定 民國 100 年 10 月 28 日系務會議修正通過 民國 104 年 02 月 12 日系務會議修正通過 民國 109 年 03 月 26 日系務會議修正通過\n\n一、為鼓勵優秀學生就讀本系碩、博士班，特訂定本辦法。\n\n二、本辦法所需經費由本系研究生獎助學金經費項下提撥。\n\n三、報考或甄試本系碩、博士班之考生，符合下列條件者，均可提出申 請：\n\n於資工相關學術研究領域有實際之成果，並擁有相關之著作者。\n\n參加國家級以上資工相關學術比賽獲獎者。\n\n本系學生學業成績傑出。\n\n國立大學院校資工相關科系班上學業成績前百分之十者。\n\n私立大學院校資工相關科系班上學業成績前百分之五者。\n\n外籍學生成績優秀者。\n\n四、申請方式：申請者須依下列規定時間內填妥本獎學金之申請表格， 並檢附相關證明文件影本提出申請。\n\n碩士班甄試或博士班考生：隨同招生考試之申請資料。\n\n碩士班筆試正取考生：本系辦理新生報到後兩個星期內。\n\n申請逕讀博士班學生：與申請入學學年度之次學年度博士班考試 同時間。\n\n五、本獎學金以獎勵單元核發，每個獎勵單元經費額度，由系主任衡酌 當年度經費狀況編列。獎學金發放一學年，獎學金之名額，博士新 生至多 5 名，每名每月 4 個獎勵單元；碩士新生至多 5 名，每名每 月 1 個獎勵單元，且獲本校其他獎學金者不得重複支領。\n\n六、獎助名單由本系相關招生考試委員會決定。\n\n七、本辦法經系務會議通過，送學務處備查，修正時亦同。', '<2-hop>  [202005140833370125.md]\n\n國立中山大學資訊工程學系\n\n研究生助學金發放辦法\n\n民國 86 年 10 月 15 日 所務會議訂定 民國 88 年 10 月 14 日 系務會議修正通過 民國 90 年 10 月 03 日 系務會議修正通過 民國 92 年 02 月 26 日 系務會議修正通過 民國 96 年 10 月 17 日 系務會議修正通過 民國 102 年 11 月 15 日 系務會議修正通過 民國 108 年 01 月 07 日 系務會議修正通過\n\n民國 109 年 3 月 9 日 系務會議修正通過\n\n第一條 為有效使用研究生助學金 ( 以下簡稱本助學金 ) ，訂定本辦法。\n\n第二條 本助學金之經費來源為每年度學生事務處分配之「學生公費暨獎助學 金」、通識教育中心分配支援課程之助學金。\n\n第三條 本助學金得發放期限及發放對象以本校 《研究生助學金分配及發放要點》 之規定，且以本系未具專職學生為原則。\n\n第四條 本助學金得作為獎學金直接發放、獎助生助學金，及勞僱型兼任助理薪 資所得。\n\n前項勞僱型兼任助理包含教學助理、研究助理及工讀生。\n\n第五條 教學助理 ( 會計分類 TA)\n\n一、各課程之教學助理由授課教師自行遴選為原則，惟擔任教學助理之 資格，須符合學校相關辦法之規定。\n\n二、教學助理不得由修習該課程之學生擔任，研究所「書報討論」課程 不在此限。\n\n三、每學期以 5 個月配發教學助理基數，上學期以 9 月至 1 月計，下學 期以 2 月至 6 月計。每月基數計算以每個學分每修課人計 1 個基 數，學士班實驗課程修課學生每人為 5 個基數，「專題」課程不分 配教學助理基數，學士班「專題製作實驗」課程修課學生每人為 0.5 個基數。\n\n四、修課人數不包含跨院選修課程之人數。\n\n五、每個基數對照金額，由系主任依本系當年度 「學生公費暨獎助學金」 總金額另訂之。\n\n六、授課教師須依教育部《專科以上學校獎助生權益保障指導原則》、 勞動部《專科以上學校兼任助理勞動權益保障指導原則》完成本校 聘僱行政程序及納保作業後始可發放教學助理薪資。\n\n七、前項納保作業所產生勞保、健保、勞工退休金等僱主負擔費用，全 數於各課程分配之教學助理經費額度內支用。納保後須符《身心障 礙者權益保障法》定額進用身心障礙者規定比例而未符者，授課教 師須自行負擔罰鍰，或配合工學院所訂處理措施執行相關處理程序。\n\n第六條 工讀生 ( 會計分類 PM)\n\n一、本系另聘研究生擔任教學及行政電腦管理、系網頁維護、教室管理， 及協助系務相關事務等工作。\n\n二、工讀生之遴選依不同工作性質，由系主任，或由系主任委託相關教、 職員遴選或指派。\n\n三、薪資依工作屬性之不同，以按月薪及時薪二種方式計酬，各擔任工 作之薪酬，由系主任依本系 「學生公費暨獎助學金」 總金額另訂之。\n\n四、應完備之本校聘僱行政程序及納保作業由系主任指派專人負責相 關事務。\n\n第七條 獎學金及獎助生助學金 ( 會計分類 PM)\n\n一、為鼓勵優秀學生就讀本系碩、博士班，保留若干數額做為獎學金之 用。獎勵條件、獎勵數額及獎勵人數，另以本系「優秀研究生新生 獎學金辦法」辦理。\n\n二、本辦法第五條之課程基數餘額及通識課程助學金未支餘額，得轉為 授課教師獎勵研究生之助學金，不限本系教師，授課教師申請時填寫 本系「研究生助學金發放名單」，由本系學術委員會執行審查。\n\n三、前項受領研究生助學金資格、獎勵金額由授課教師認定。\n\n四、本條獎助為直接發放，受領學生無須擔任兼任助理。\n\n第八條 研究助學金 ( 會計分類 RA)\n\n視需要由系主任以本系「學生公費暨獎助學金」總金額另訂之。\n\n第九條 本辦法經系務會議通過後實施，修正時亦同。']",teacher,Misspelled queries,short,"<1-hop>  [202106230909170291.md]

國立中山大學資訊工程學系

優秀研究生新生獎學金辦法

民國 100 年 08 月 10 日系務會議訂定 民國 100 年 10 月 28 日系務會議修正通過 民國 104 年 02 月 12 日系務會議修正通過 民國 109 年 03 月 26 日系務會議修正通過

一、為鼓勵優秀學生就讀本系碩、博士班，特訂定本辦法。

二、本辦法所需經費由本系研究生獎助學金經費項下提撥。

三、報考或甄試本系碩、博士班之考生，符合下列條件者，均可提出申 請：

於資工相關學術研究領域有實際之成果，並擁有相關之著作者。

參加國家級以上資工相關學術比賽獲獎者。

本系學生學業成績傑出。

國立大學院校資工相關科系班上學業成績前百分之十者。

私立大學院校資工相關科系班上學業成績前百分之五者。

外籍學生成績優秀者。

四、申請方式：申請者須依下列規定時間內填妥本獎學金之申請表格， 並檢附相關證明文件影本提出申請。

碩士班甄試或博士班考生：隨同招生考試之申請資料。

碩士班筆試正取考生：本系辦理新生報到後兩個星期內。

申請逕讀博士班學生：與申請入學學年度之次學年度博士班考試 同時間。

五、本獎學金以獎勵單元核發，每個獎勵單元經費額度，由系主任衡酌 當年度經費狀況編列。獎學金發放一學年，獎學金之名額，博士新 生至多 5 名，每名每月 4 個獎勵單元；碩士新生至多 5 名，每名每 月 1 個獎勵單元，且獲本校其他獎學金者不得重複支領。

六、獎助名單由本系相關招生考試委員會決定。

七、本辦法經系務會議通過，送學務處備查，修正時亦同。","<2-hop>  [202005140833370125.md]

國立中山大學資訊工程學系

研究生助學金發放辦法

民國 86 年 10 月 15 日 所務會議訂定 民國 88 年 10 月 14 日 系務會議修正通過 民國 90 年 10 月 03 日 系務會議修正通過 民國 92 年 02 月 26 日 系務會議修正通過 民國 96 年 10 月 17 日 系務會議修正通過 民國 102 年 11 月 15 日 系務會議修正通過 民國 108 年 01 月 07 日 系務會議修正通過

民國 109 年 3 月 9 日 系務會議修正通過

第一條 為有效使用研究生助學金 ( 以下簡稱本助學金 ) ，訂定本辦法。

第二條 本助學金之經費來源為每年度學生事務處分配之「學生公費暨獎助學 金」、通識教育中心分配支援課程之助學金。

第三條 本助學金得發放期限及發放對象以本校 《研究生助學金分配及發放要點》 之規定，且以本系未具專職學生為原則。

第四條 本助學金得作為獎學金直接發放、獎助生助學金，及勞僱型兼任助理薪 資所得。

前項勞僱型兼任助理包含教學助理、研究助理及工讀生。

第五條 教學助理 ( 會計分類 TA)

一、各課程之教學助理由授課教師自行遴選為原則，惟擔任教學助理之 資格，須符合學校相關辦法之規定。

二、教學助理不得由修習該課程之學生擔任，研究所「書報討論」課程 不在此限。

三、每學期以 5 個月配發教學助理基數，上學期以 9 月至 1 月計，下學 期以 2 月至 6 月計。每月基數計算以每個學分每修課人計 1 個基 數，學士班實驗課程修課學生每人為 5 個基數，「專題」課程不分 配教學助理基數，學士班「專題製作實驗」課程修課學生每人為 0.5 個基數。

四、修課人數不包含跨院選修課程之人數。

五、每個基數對照金額，由系主任依本系當年度 「學生公費暨獎助學金」 總金額另訂之。

六、授課教師須依教育部《專科以上學校獎助生權益保障指導原則》、 勞動部《專科以上學校兼任助理勞動權益保障指導原則》完成本校 聘僱行政程序及納保作業後始可發放教學助理薪資。

七、前項納保作業所產生勞保、健保、勞工退休金等僱主負擔費用，全 數於各課程分配之教學助理經費額度內支用。納保後須符《身心障 礙者權益保障法》定額進用身心障礙者規定比例而未符者，授課教 師須自行負擔罰鍰，或配合工學院所訂處理措施執行相關處理程序。

第六條 工讀生 ( 會計分類 PM)

一、本系另聘研究生擔任教學及行政電腦管理、系網頁維護、教室管理， 及協助系務相關事務等工作。

二、工讀生之遴選依不同工作性質，由系主任，或由系主任委託相關教、 職員遴選或指派。

三、薪資依工作屬性之不同，以按月薪及時薪二種方式計酬，各擔任工 作之薪酬，由系主任依本系 「學生公費暨獎助學金」 總金額另訂之。

四、應完備之本校聘僱行政程序及納保作業由系主任指派專人負責相 關事務。

第七條 獎學金及獎助生助學金 ( 會計分類 PM)

一、為鼓勵優秀學生就讀本系碩、博士班，保留若干數額做為獎學金之 用。獎勵條件、獎勵數額及獎勵人數，另以本系「優秀研究生新生 獎學金辦法」辦理。

二、本辦法第五條之課程基數餘額及通識課程助學金未支餘額，得轉為 授課教師獎勵研究生之助學金，不限本系教師，授課教師申請時填寫 本系「研究生助學金發放名單」，由本系學術委員會執行審查。

三、前項受領研究生助學金資格、獎勵金額由授課教師認定。

四、本條獎助為直接發放，受領學生無須擔任兼任助理。

第八條 研究助學金 ( 會計分類 RA)

視需要由系主任以本系「學生公費暨獎助學金」總金額另訂之。

第九條 本辦法經系務會議通過後實施，修正時亦同。",202106230909170291.md,202005140833370125.md,"['研究生獎助學金經費', '研究生助學金']",工學院↔工學院 | 資訊工程學系↔資訊工程學系,研究生獎助學金經費↔研究生助學金,5.0,5.0,5.0,5.0,5.0,2.0,5.0
根據國立中山大學的校園性別事件防治規定與性別友善宿舍入住原則，學校如何透過性別平等教育委員會推動性別平等及保障學生權益？並且在宿舍管理上有哪些具體措施來支持多元性別學生？,根據國立中山大學校園性別事件防治規定，學校依據性別平等教育法及校園性別事件防治準則，建立校園性別事件的預防與處理機制，並由性別平等教育委員會（性平會）負責相關案件的調查與處理。學校每年定期舉辦校園性別事件防治教育宣導活動，並對性平會及相關單位人員辦理在職進修，鼓勵參加校內外研習活動，並公告相關規定於教職員工聘約及學生手冊中。性平會在處理校園性別事件時，得成立調查小組，並依規定保密當事人資料，保障被害人權益，提供心理諮商、法律協助等多元協助措施。至於性別友善宿舍入住原則，學校尊重學生的生理性別、性別特質、性別認同及性傾向，跨性別者可依性別認同申請入住。宿舍房間安排以男女分層為原則，無空房時可安排男女同層不同寢。宿舍相關服務人員必須參加由性別平等教育委員會認可的性別講座或說明會。宿舍組負責性別友善宿舍的管理，並與宿委會協同執行宣導、處理問題及定期舉辦多元性別主題活動，並在宿服組網站傳遞性別友善及反歧視資訊。整體而言，學校透過性別平等教育委員會推動性別平等教育與事件防治，並在宿舍管理上實施具體措施支持多元性別學生，保障其權益與安全。,"['<1-hop>  [202503131723000197.md]\n\n國立中山大學校園性別事件防治規定\n\n94 年 6 月 22 日 93 學年度第 2 學期性別平等教育委員會議通過 96 年 1 月 4 日 95 學年度第 1 學期第 2 次性別平等教育委員會議修正通過 98 年 6 月 10 日 97 學年度第 2 學期第 2 次性別平等教育委員會議修正通過 99 年 10 月 5 日 99 學年度第 1 學期第 2 次性別平等教育委員會會議修正通過 100 年 6 月 9 日 99 學年度第 2 學期第 2 次性別平等教育委員會議修正通過 101 年 11 月 9 日 101 學年度第 1 學期第 1 次性別平等教育委員會議修正通過 101 年 12 月 28 日 101 學年度第 2 次校務會議修正通過 102 年 1 月 30 日 教育部臺教學（三）字第 1020008307 號書函準備查 102 年 12 月 20 日 102 學年度第 2 次校務會議修正通過通過 109 年 3 月 20 日 本校 108 學年度第 3 次校務會議修正通過 109 年 10 月 23 日 本校 109 學年度第 1 次校務會議修正通過 112 年 10 月 27 日 本校 112 學年度第 1 次校務會議修正通過\n\n113 年 12 月 20 日 本校 112 學年度第 1 次校務會議修正通過\n\n一、 為落實性別地位之實質平等，建立校園性別事件之預防措施與處理機制，特依據 性別平等教育法（以下簡稱性平法）及校園性別事件防治準則（以下簡稱防治準 則）訂定本規定。\n\n二、 本規定所謂校園性別事件為事件之一方為學校校長、教師、職員、工友或學生， 他方為學生，並有下列情形之一者：\n\n（一）性侵害：指性侵害犯罪防治法所稱性侵害犯罪之行為。\n\n（二）性騷擾：指符合下列情形之一，且未達性侵害之程度者：\n\n以明示或暗示之方式，從事不受歡迎且與性或性別有關之言詞或行為，致 影響他人之人格尊嚴、學習、或工作之機會或表現者。\n\n以性或性別有關之行為，作為自己或他人獲得、喪失或減損其學習或工作 有關權益之條件者。\n\n（三）性霸凌：指透過語言、肢體或其他暴力，對於他人之性別特徵、性別特 質、性傾向或性別認同進行貶抑、攻擊或威脅之行為且非屬性騷擾者。\n\n（四）校長或教職員工違反與性或性別有關之專業倫理行為：指校長或教職員 工與未成年學生發展親密關係，或利用不對等之權勢關係，於執行教 學、指導、訓練、評鑑、管理、輔導學生或提供學生工作機會時，在與 性或性別有關之人際互動上，發展有違專業倫理之關係。\n\n教師、職員、工友及學生定義如下：\n\n（一）教師：指專任教師、兼任教師、代理教師、代課教師、教官、運用於協 助教學之志願服務人員、實際執行教學之教育實習人員、實習場域之實 習指導人員及其他執行教學或研究之人員。\n\n（二）職員、工友：指前款教師以外，固定、定期執行學校事務人員、運用於 協助學校事務之志願服務人員、學生事務創新人員及其他經中央主管機 關指定者。\n\n（三）學生：指具有學籍、學制轉銜期間未具學籍者、接受進修推廣教育者、 交換學生、教育實習學生或研修生及其他經中央主管機關指定者。\n\n三、 本校積極推動校園性別事件防治教育，以提升教職員工生尊重他人與自己性或身 體自主之知能，並採取下列措施：\n\n（一）針對教職員工生，每年定期舉辦校園性別事件防治之教育宣導活動，並 評鑑其實施成效。\n\n（二）針對性別平等教育委員會（以下簡稱性平會）及負責校園性別事件處置 相關單位人員，每年定期辦理相關之在職進修活動。\n\n（三）鼓勵前款人員參加校內外校園性別事件處置研習活動，並予以公差登記 及經費補助。\n\n（四）利用多元管道，公告周知本規定所規範之事項，並納入教職員工聘約及 學生手冊。\n\n（五）鼓勵校園性別事件被害人或檢舉人儘早申請調查或檢舉，以利蒐證及調 查處理。\n\n四、 本校處理校園性別事件相關案件時，應由學務處主動提供下列資訊予相關人員：\n\n（一）校園性別事件之界定、類型及相關法規。\n\n（二）被害人之權益保障及學校所提供之必要協助。\n\n（三）申請調查、申復及救濟之機制。\n\n（四）相關之主管機關及權責單位。\n\n（五）提供資源協助之團體及網絡。\n\n（六）其他性平會認為必要之事項。\n\n五、 為防治校園性別事件，本校應採取下列措施改善校園危險空間：\n\n（一）應依空間配置、管理與保全、標示系統、求救系統與安全路線、照明與 空間穿透性及其他空間安全要素等，定期檢討校園空間與設施之規劃與 使用情形及檢視校園整體安全。\n\n（二）記錄校園內曾經發生校園性別事件之空間，並依實際需要，繪製校園安 全地圖。\n\n（三）應定期舉行校園空間安全檢視說明會，邀集專業空間設計者、教職員工 生及其他校園使用者參與，公告檢視成果及相關紀錄。\n\n前項措施之執行及校園危險空間改善進度，應列為性平會每學期工作報告事項。\n\n六、 本校教職員工生於進行校內外教學與活動、執行職務及人際互動時，應尊重多元 性別差異，消除性別歧視。\n\n七、 學生於校外為實習生，實習期間遭受性騷擾時，依性別平等工作法第二條第五項 規定辦理；事件之一方為實習場域之實習指導人員者，並適用性平法、防治準則 之規定。\n\n前項所稱實習場域之實習指導人員，指教導或提供學生專業知能、提供實務訓練 及指導學生實務操作訓練之人員。\n\n本校知悉實習生為校園性別事件被害人，應採取立即有效之糾正及補救措施，且 依本規定第四條提供相關資訊，並依其需求，提供心理諮商與輔導、保護措施、 法律協助或其他協助。\n\n八、 本校教職員工與未成年學生，在與性或性別有關之人際互動上，不得發展以性行 為或情感為基礎等有違專業倫理之關係。\n\n本校教職員工於執行教學、指導、訓練、評鑑、管理、輔導學生或提供學生工作 機會而有地位、知識、年齡、體力、身分、族群、或資源之不對等權勢關係時， 與成年學生在與性或性別有關之人際互動上，不得發展以性行為或情感為基礎等 有違專業倫理之關係。\n\n本校教職員工發現發現其與學生之關係有違反前二項專業倫理之虞，應主動迴避 及陳報學校處理。\n\n九、 本校教職員工生應尊重他人與自己之性或身體之自主，避免不受歡迎之追求行 為，並不得以強制或暴力手段處理與性或性別有關之衝突。\n\n十、 本校教職員工知悉發生疑似校園性別事件者，應立即以書面或其他通訊方式通報 本校校安防護組，由校安防護組向教育部通報，並視需要轉知諮商與健康促進組 依相關法律規定向社政主管機關通報，至遲不得超過二十四小時。\n\n依本點規定為通報時，除有調查必要、基於公共安全之考量或法規另有特別規定 者外，對於當事人及檢舉人之姓名或其他足以辨識其身分之資料，應予以保密。\n\n十一、 校園性別事件之行為人於行為發生時為本校教職員工生者，被害人、其法定代理 人或實際照顧者（以下簡稱申請人） 、檢舉人，得以言詞、書面或電子郵件向本校 申請調查或檢舉；其以言詞或電子郵件為之者，學生事務處應作成紀錄，經向申 請人或檢舉人朗讀或使閱覽，確認其內容無誤後，由其簽名或蓋章。\n\n前項書面或言詞、電子郵件作成之紀錄，應載明下列事項：\n\n（一）申請人或檢舉人姓名、身分證明文件字號、服務或就學之單位及職稱、 住居所、聯絡電話及申請調查日期。\n\n（二）申請人申請調查者，應載明被害人之出生年月日。\n\n（三）申請人委任代理人代為申請調查者，應檢附委任書，並載明其姓名、身 分證明文件字號、住居所、聯絡電話。\n\n（四）申請調查或檢舉之事實內容。如有相關證據，亦應記載或附卷。\n\n本校接獲申請調查或檢舉若無管轄權者，應將該案件於七個工作日內移送其他有 管轄權者，並通知當事人。\n\n本校知悉疑似校園性別事件有下列情形，應由所設性平會評估該事件對學生受教 權及校園安全之影響，經會議決議以檢舉案形式啟動調查程序，以釐清事實，採 取必要之措施維護學生之權益與校園安全：\n\n（一）二人以上被害人。\n\n（二）二人以上行為人。\n\n（三）行為人為校長或教職員工。\n\n（四）涉及校園安全議題。\n\n（五）其他經性平會認有以檢舉案形式啟動調查之必要者。\n\n十二、 本校校園性別事件申請調查或檢舉以學生事務處為收件單位。除有性平法第三十 二條第二項所定不受理事由外，應於三日內將該事件交由性平會校園性別事件防\n\n治組（以下簡稱防治組）調查處理。任何人不得另設調查機制，違反者其調查無 效。\n\n防治組之工作權責範圍包括審議受理與否、不受理事由之認定、是否成立調查小 組及成員組成、撤回申請調查後是否續為調查。\n\n經媒體報導之校園性別事件，或本校處理霸凌事件發現有疑似校園性別事件者， 視同檢舉，應交由性平會依第一項規定調查處理。疑似被害人不願配合調查時， 仍應提供必要之輔導或協助。\n\n十三、 本校接獲申請調查或檢舉後二十日內，應以書面通知申請人或檢舉人是否受理。 不受理之書面通知應敘明理由，並告知申請人或檢舉人申復之期限及受理單位。 申請人或檢舉人於前項之期限內未收到通知或接獲不受理通知之次日起二十日 內，得以書面具明理由，向本校秘書室提出申復；其以言詞為之者，本校秘書室 應作成紀錄，經向申請人或檢舉人朗讀或使閱覽，確認其內容無誤後，由其簽名 或蓋章。\n\n本校秘書室接獲申復後，應將申請調查或檢舉案交性平會重新討論受理事宜，並 於二十日內以書面通知申復人申復結果。申復有理由者，性平會應依法調查處 理。\n\n前項不受理之申復以一次為限。\n\n十四、 本校性平會處理校園性別事件時，得成立調查小組調查之。調查小組以三人或五 人為原則，其成員之組成，依性平法第三十三條及校園性別事件防治準則第二十 二條之規定。\n\n十五、 本校調查處理校園性別事件時，應依下列方式辦理：\n\n（一）行為人應親自出席接受調查；當事人為未成年者，接受調查時得由法定 代理人或實際照顧者陪同。\n\n（二）當事人持有各級主管機關核發之身心障礙證明或有效特殊教育學生鑑定 證明者，調查小組成員應有具備特殊教育專業者。\n\n（三）行為人與被害人、檢舉人或受邀協助調查之人有權力不對等之情形者， 應避免其對質。\n\n（四）就行為人、被害人、檢舉人或受邀協助調查之人之姓名及其他足以辨識 身分之資料，應予保密。但有調查之必要或基於公共安全考量者，不在 此限。\n\n（五）依性平法第三十三條第五項規定以書面通知當事人、相關人員或單位配 合調查及提供資料時，應記載調查目的、時間、地點及不到場所生之效 果。\n\n（六）前款通知應載明當事人不得私下聯繫或運用網際網路、通訊軟體或其他 管道散佈事件之資訊。\n\n（七）本校所屬人員不得以任何名義對案情進行瞭解或調查，且不得要求當事 人提交自述或切結文件。\n\n（八）基於調查之必要，得於不違反保密義務之範圍內另作成書面資料，交由\n\n行為人、被害人或受邀協助調查之人閱覽或告以要旨。\n\n（九）申請人撤回申請調查時，為釐清相關法律責任，得經防治組決議，或經 行為人請求，繼續調查處理。\n\n（十）當事人申請閱覽、抄寫、複印或攝影有關資料或卷宗，應依行政程序法 規定辦理。\n\n（十一）當事人調查訪談過程紀錄，得以錄音輔助，必要時得以錄影輔助；訪 談紀錄應向當事人朗讀或使閱覽，確認其內容無誤後，由其簽名或蓋 章。\n\n十六、 依前點第四款規定負有保密義務者，包括參與處理校園性別事件之所有人員。 依前項規定負保密義務者洩密時，應依刑法或其他相關法規處罰。\n\n本校就記載有當事人、檢舉人、證人姓名之原始文書應予封存，不得供閱覽或提 供予偵查、審判機關以外之人。但法律另有規定者，不在此限。\n\n除原始文書外，調查處理校園性別事件人員對外所另行製作之文書，應將當事\n\n人、檢舉人、證人之真實姓名及其他足以辨識身分之資料刪除，並以代號為之。\n\n十七、 為保障校園性別事件當事人之受教權或工作權，本校於必要時得為下列處置，並 報教育部備查：\n\n（一）彈性處理當事人之出缺勤紀錄或成績考核，並積極協助其課業或職務， 得不受請假、教師及學生成績考核相關規定之限制。\n\n（二）尊重被害人之意願，減低當事人雙方互動之機會，並得依被害人之申請 或由性平會評估該事件對學生受教權及校園安全之影響，中止當事人雙 方執行教學、指導、訓練、評鑑、管理、輔導學生或提供學生工作機會 之關係，或命行為人迴避。\n\n（三）避免報復情事。\n\n（四）預防、減低行為人再度加害之可能。\n\n（五）其他性平會認為必要之處置。\n\n當事人非本校之教職員工生時，應通知當事人所屬學校，依前項規定處理。 前項必要之處置，應經性平會決議通過後執行。\n\n十八、 本校應視當事人之身心狀況，主動轉介至各相關構，以提供必要之協助，但就該 事件仍應依本規定為調查處理。\n\n當事人非本校之人員時，應通知當事人所屬學校，依前項規定提供必要之協助。 十九、 本校於必要時應對於當事人提供下列適當協助：\n\n（一）心理諮商輔導。\n\n（二）法律諮詢管道。\n\n（三）課業協助。\n\n（四）經濟協助。\n\n（五）其他性平會認為必要之協助。\n\n當事人非本校之人員時，應通知當事人所屬學校，依前項規定提供適當協助。 前項協助得委請醫師、臨床心理師、諮商心理師、社會工作師或律師等專業人員\n\n為之。\n\n二十、 性平會之調查處理，不受該事件司法程序是否進行及處理結果之影響。\n\n前項之調查程序，不因行為人喪失原身分而中止。\n\n二十一、 基於尊重專業判斷及避免重複詢問原則，本校對於校園性別事件有關之事實認 定，應依據性平會之調查報告。\n\n性平會召開會議審議調查報告認定校園性別事件屬實，依其事實認定向本校提出 改變身分之處理建議者，本校應檢附經性平會審議通過之調查報告，通知行為人 於七日內提出書面陳述意見。\n\n前項行為人不於期限內提出書面陳述意見者，視為放棄陳述之機會；有書面陳述 意見者，性平會應再次召開會議審酌其書面陳述意見，除發現調查程序有重大瑕 疵或有足以影響原調查認定之新事實、新證據情形外，不得重新調查。\n\n本校決定議處之權責單位，於審議議處時，除有性平法第三十七條第三項所定之 情形外，不得要求性平會重新調查，亦不得自行調查。\n\n前項審議議處依相關法規應給予行為人陳述答辯意見時，應檢附經性平會審議通 過之調查報告。\n\n第四項議處決定前，權責單位應通知被害人、其法定代理人或實際照顧者於七日 內以書面或言詞提出陳述意見；其以言詞為之者，權責單位應作成紀錄，經向被 害人、其法定代理人或實際照顧者朗讀或使閱覽，確認其內容無誤後，由其簽名 或蓋章；未於期限內提出書面陳述意見者，視為放棄陳述之機會；有書面陳述意 見者，決定議處之權責單位應審酌其書面陳述意見。\n\n二十二、 校園性別事件經性平會調查屬實後，應移送權責單位懲處，對行為人予以申誡、 記過、解聘、停聘、不續聘、免職、終止契約關係、終止運用關係或其他適當之 懲處。其他機關依相關法律或法規有議處權限時，本校應將該事件移送其他機關 議處；其經證實證實有誣告之事實者，應依法對申請人或檢舉人為適當之懲處。 本校依性別平等教育法第二十六條規定為校園性別事件之懲處時，應命行為人接 受心理諮商與輔導之處置，並得命其為下列一款或數款之處置。但終身不得聘 任、任用、進用或運用之人員，不在此限：\n\n（一）經被害人、其法定代理人或實際照顧者之同意，向被害人道歉。法定代 理人或實際照顧者同意時，應以兒童及少年之最佳利益為優先考量，並 依其心智成熟程度權衡其意見。\n\n（二）接受八小時之性別平等教育相關課程。\n\n（三）其他符合教育目的之措施。\n\n前項處置，由性平會討論決定處置之性質、執行方式、執行期間及費用之支應事 宜，並由本校學務處執行，執行時應採取必要之措施，以確保行為人之配合遵 守；處置之性質、執行方式、執行期間及不配合執行之法律效果，應載明於處理 結果之書面通知中。\n\n前項第一款之處置，當事人均為學生時，本校得善用修復式正義或其他輔導策 略，促進修復關係。\n\n校園性騷擾、性霸凌、校長或教職員工違反與性或性別有關之專業倫理行為情節 輕微者，本校得僅依前項規定為必要之處置。\n\n二十三、 本校將處理結果（包含包括事實認定、處置措施及議處結果）以書面通知申請 人、被害人及行為人時，應一併提供調查報告，並告知申復之期限及受理單位。 申請人、被害人或行為人對處理結果不服者，得於收到書面通知次日起三十日 內，以書面具名理由向本校秘書室申復，並以一次為限。若以言詞為之者，本校 秘書室應作成紀錄，經向申請人或行為人朗讀或使閱覽，確認其內容無誤後，由 其簽名或蓋章。\n\n本校秘書室接獲申復後，依下列程序處理：\n\n（一）應即組成審議小組，並於三十日內作成附理由之決定，以書面通知申復 人申復結果。\n\n（二）前款審議小組應包括性別平等教育相關專家學者、法律專業人員三人或 五人，其小組成員中，女性人數比例應佔成員總數二分之一以上，具校 園性別事件調查專業素養之專家學者人數比例應佔成員總數三分之一以 上。\n\n（三）原性平會委員及原調查小組成員不得擔任審議小組成員。\n\n（四）審議小組召開會議時由小組成員推舉召集人，並主持會議。\n\n（五）審議會議進行時，得視需要給予申復人陳述意見之機會，並得邀請性平 會相關委員或調查小組成員列席說明。\n\n（六）申復有理由時，將申復決定通知相關權責單位，由其重為決定。有性平 法第三十七條第三項所定調查程序有重大瑕疵或有足以影響原調查認定 之新事實、新證據時，得要求性平會重新調查。\n\n（七）前款申復決定送達申復人前，申復人得準用前項規定撤回申復。 調查程序有重大瑕疵，指有下列情形之一者：\n\n（一）性平會或調查小組組織不適法。\n\n（二）未給予當事人任一方陳述意見之機會。\n\n（三）有應迴避而未迴避之情形。\n\n（四）有應調查之證據而未調查。\n\n（五）有證據取捨瑕疵而影響事實認定。\n\n（六）其他足以影響事實認定之重大瑕疵。\n\n校園性別事件之行為人為教職員工者，申請人或被害人得逕向教育部申復。申請 人或被害人向教育部申復時，倘行為人向本校申復，本校應即報請教育部併案審 議。\n\n性平會於接獲重新調查之要求時，應另組調查小組。\n\n二十四、 申請人、被害人及行為人對本校之申復結果不服，得於接獲申復結果書面通知書 之次日起三十日內，依性平法第三十九條規定提起救濟。\n\n二十五、 本校應建立之校園性別事件之檔案資料，並分為原始檔案與報告檔案，指定由學 務處保存二十五年；其以電子儲存媒體儲存者，必要時得採電子簽章或加密方式\n\n處理之。\n\n前項原始檔案應予保密，其內容包括下列資料：\n\n（一）事件發生之時間、樣態。\n\n（二）事件相關當事人（包括檢舉人、被害人、行為人） 。\n\n（三）事件處理人員、流程及紀錄。\n\n（四）事件處理所製作之文書、訪談過程之錄音檔案、取得之證據及其他相關 資料。\n\n（五）行為人之姓名、職稱或學籍資料等。\n\n（六）調查小組提交之調查報告初稿及性平會之會議紀錄。\n\n第一項報告檔案為經性平會議決通過之調查報告；其內容應包括下列資料：\n\n（一）申請調查事件之案由，包括當事人或檢舉之敘述。\n\n（二）調查訪談過程紀錄，包括日期及對象。\n\n（三）被申請調查人、申請調查人、證人與相關人士之陳述及答辯。\n\n（四）相關物證之查驗。\n\n（五）事實認定及理由。\n\n（六）處理建議。\n\n二十六、 本校於取得性平法第二十九條第三項所定事件相關事證資訊，經通知當事人陳述 意見後，應提交性平會查證審議。\n\n二十七、 本校依性平法第二十八條第二項及第三項規定為通報時，其通報內容應限於行為 人經查證屬實之校園性別事件時間、樣態、行為人姓名、職稱或學籍資料。 本校應視實際需要，將輔導、防治教育或相關處置措施及其他必要之資訊，提供 予次一就讀或服務之學校。行為人追蹤輔導後，評估無再犯情事者，得於第一項 通報內容註記行為人之改過現況。\n\n二十八、 性平會之委員均為無給職。惟本校教職員工擔任校園性別事件調查小組撰寫調查 報告時及非本校教職員工之外聘委員出席會議及撰寫調查報告書時，得支領費 用。\n\n二十九、 本規定若有未盡事宜，皆依「性別平等教育法」 、 「性別平等教育法施行細則」與 「校園性別事件防治準則」等相關規定辦理。\n\n三十、 本規定經性平會會議及校務會議通過後實施，修正時亦同。', '<2-hop>  [202509171642480752.md]\n\n國立中山大學性別友善宿舍入住原則\n\n113 年 5 月 8 日本校 112 學年度第 2 次學生事務會議通過\n\n一、 為提供性別友善之住宿環境，尊重及考量學生之不同生理性別、 性別特質、性別認同或性傾向，特訂定本原則。\n\n二、 跨性別者若欲入住，宜破除生理性別二分並依據其性別認同作 為性別判準。\n\n三、 申請者得個別提出申請或自行尋找室友一起申請。\n\n四、 房間安排以「男女分層」為原則，當特定性別樓層無空房時， 得安排「男女同層不同寢」。\n\n五、 有關處理學生住宿服務之相關人員，包括宿服組行政同仁、宿 舍服務員、工讀生、宿委會委員等，應參加至少一場由本校性 別平等教育委員會認可之性別講座或說明會。\n\n六、\n\n宿舍組負責規劃、執行與輔導性別友善宿舍之管理業務，並由 相關行政人員協同宿委會執行以下事項：\n\n( 一 ) 擔任宣導、處理及回應相關問題之對外窗口。\n\n( 二 ) 定期舉辦相關主題活動，以利住宿學生認識多元性別。\n\n( 三 )\n\n於宿服組網站明確傳遞性別友善、反歧視之相關資訊。\n\n七、 本原則由學務會議通過，修改時亦同。']",staff,Poor grammar,long,"<1-hop>  [202503131723000197.md]

國立中山大學校園性別事件防治規定

94 年 6 月 22 日 93 學年度第 2 學期性別平等教育委員會議通過 96 年 1 月 4 日 95 學年度第 1 學期第 2 次性別平等教育委員會議修正通過 98 年 6 月 10 日 97 學年度第 2 學期第 2 次性別平等教育委員會議修正通過 99 年 10 月 5 日 99 學年度第 1 學期第 2 次性別平等教育委員會會議修正通過 100 年 6 月 9 日 99 學年度第 2 學期第 2 次性別平等教育委員會議修正通過 101 年 11 月 9 日 101 學年度第 1 學期第 1 次性別平等教育委員會議修正通過 101 年 12 月 28 日 101 學年度第 2 次校務會議修正通過 102 年 1 月 30 日 教育部臺教學（三）字第 1020008307 號書函準備查 102 年 12 月 20 日 102 學年度第 2 次校務會議修正通過通過 109 年 3 月 20 日 本校 108 學年度第 3 次校務會議修正通過 109 年 10 月 23 日 本校 109 學年度第 1 次校務會議修正通過 112 年 10 月 27 日 本校 112 學年度第 1 次校務會議修正通過

113 年 12 月 20 日 本校 112 學年度第 1 次校務會議修正通過

一、 為落實性別地位之實質平等，建立校園性別事件之預防措施與處理機制，特依據 性別平等教育法（以下簡稱性平法）及校園性別事件防治準則（以下簡稱防治準 則）訂定本規定。

二、 本規定所謂校園性別事件為事件之一方為學校校長、教師、職員、工友或學生， 他方為學生，並有下列情形之一者：

（一）性侵害：指性侵害犯罪防治法所稱性侵害犯罪之行為。

（二）性騷擾：指符合下列情形之一，且未達性侵害之程度者：

以明示或暗示之方式，從事不受歡迎且與性或性別有關之言詞或行為，致 影響他人之人格尊嚴、學習、或工作之機會或表現者。

以性或性別有關之行為，作為自己或他人獲得、喪失或減損其學習或工作 有關權益之條件者。

（三）性霸凌：指透過語言、肢體或其他暴力，對於他人之性別特徵、性別特 質、性傾向或性別認同進行貶抑、攻擊或威脅之行為且非屬性騷擾者。

（四）校長或教職員工違反與性或性別有關之專業倫理行為：指校長或教職員 工與未成年學生發展親密關係，或利用不對等之權勢關係，於執行教 學、指導、訓練、評鑑、管理、輔導學生或提供學生工作機會時，在與 性或性別有關之人際互動上，發展有違專業倫理之關係。

教師、職員、工友及學生定義如下：

（一）教師：指專任教師、兼任教師、代理教師、代課教師、教官、運用於協 助教學之志願服務人員、實際執行教學之教育實習人員、實習場域之實 習指導人員及其他執行教學或研究之人員。

（二）職員、工友：指前款教師以外，固定、定期執行學校事務人員、運用於 協助學校事務之志願服務人員、學生事務創新人員及其他經中央主管機 關指定者。

（三）學生：指具有學籍、學制轉銜期間未具學籍者、接受進修推廣教育者、 交換學生、教育實習學生或研修生及其他經中央主管機關指定者。

三、 本校積極推動校園性別事件防治教育，以提升教職員工生尊重他人與自己性或身 體自主之知能，並採取下列措施：

（一）針對教職員工生，每年定期舉辦校園性別事件防治之教育宣導活動，並 評鑑其實施成效。

（二）針對性別平等教育委員會（以下簡稱性平會）及負責校園性別事件處置 相關單位人員，每年定期辦理相關之在職進修活動。

（三）鼓勵前款人員參加校內外校園性別事件處置研習活動，並予以公差登記 及經費補助。

（四）利用多元管道，公告周知本規定所規範之事項，並納入教職員工聘約及 學生手冊。

（五）鼓勵校園性別事件被害人或檢舉人儘早申請調查或檢舉，以利蒐證及調 查處理。

四、 本校處理校園性別事件相關案件時，應由學務處主動提供下列資訊予相關人員：

（一）校園性別事件之界定、類型及相關法規。

（二）被害人之權益保障及學校所提供之必要協助。

（三）申請調查、申復及救濟之機制。

（四）相關之主管機關及權責單位。

（五）提供資源協助之團體及網絡。

（六）其他性平會認為必要之事項。

五、 為防治校園性別事件，本校應採取下列措施改善校園危險空間：

（一）應依空間配置、管理與保全、標示系統、求救系統與安全路線、照明與 空間穿透性及其他空間安全要素等，定期檢討校園空間與設施之規劃與 使用情形及檢視校園整體安全。

（二）記錄校園內曾經發生校園性別事件之空間，並依實際需要，繪製校園安 全地圖。

（三）應定期舉行校園空間安全檢視說明會，邀集專業空間設計者、教職員工 生及其他校園使用者參與，公告檢視成果及相關紀錄。

前項措施之執行及校園危險空間改善進度，應列為性平會每學期工作報告事項。

六、 本校教職員工生於進行校內外教學與活動、執行職務及人際互動時，應尊重多元 性別差異，消除性別歧視。

七、 學生於校外為實習生，實習期間遭受性騷擾時，依性別平等工作法第二條第五項 規定辦理；事件之一方為實習場域之實習指導人員者，並適用性平法、防治準則 之規定。

前項所稱實習場域之實習指導人員，指教導或提供學生專業知能、提供實務訓練 及指導學生實務操作訓練之人員。

本校知悉實習生為校園性別事件被害人，應採取立即有效之糾正及補救措施，且 依本規定第四條提供相關資訊，並依其需求，提供心理諮商與輔導、保護措施、 法律協助或其他協助。

八、 本校教職員工與未成年學生，在與性或性別有關之人際互動上，不得發展以性行 為或情感為基礎等有違專業倫理之關係。

本校教職員工於執行教學、指導、訓練、評鑑、管理、輔導學生或提供學生工作 機會而有地位、知識、年齡、體力、身分、族群、或資源之不對等權勢關係時， 與成年學生在與性或性別有關之人際互動上，不得發展以性行為或情感為基礎等 有違專業倫理之關係。

本校教職員工發現發現其與學生之關係有違反前二項專業倫理之虞，應主動迴避 及陳報學校處理。

九、 本校教職員工生應尊重他人與自己之性或身體之自主，避免不受歡迎之追求行 為，並不得以強制或暴力手段處理與性或性別有關之衝突。

十、 本校教職員工知悉發生疑似校園性別事件者，應立即以書面或其他通訊方式通報 本校校安防護組，由校安防護組向教育部通報，並視需要轉知諮商與健康促進組 依相關法律規定向社政主管機關通報，至遲不得超過二十四小時。

依本點規定為通報時，除有調查必要、基於公共安全之考量或法規另有特別規定 者外，對於當事人及檢舉人之姓名或其他足以辨識其身分之資料，應予以保密。

十一、 校園性別事件之行為人於行為發生時為本校教職員工生者，被害人、其法定代理 人或實際照顧者（以下簡稱申請人） 、檢舉人，得以言詞、書面或電子郵件向本校 申請調查或檢舉；其以言詞或電子郵件為之者，學生事務處應作成紀錄，經向申 請人或檢舉人朗讀或使閱覽，確認其內容無誤後，由其簽名或蓋章。

前項書面或言詞、電子郵件作成之紀錄，應載明下列事項：

（一）申請人或檢舉人姓名、身分證明文件字號、服務或就學之單位及職稱、 住居所、聯絡電話及申請調查日期。

（二）申請人申請調查者，應載明被害人之出生年月日。

（三）申請人委任代理人代為申請調查者，應檢附委任書，並載明其姓名、身 分證明文件字號、住居所、聯絡電話。

（四）申請調查或檢舉之事實內容。如有相關證據，亦應記載或附卷。

本校接獲申請調查或檢舉若無管轄權者，應將該案件於七個工作日內移送其他有 管轄權者，並通知當事人。

本校知悉疑似校園性別事件有下列情形，應由所設性平會評估該事件對學生受教 權及校園安全之影響，經會議決議以檢舉案形式啟動調查程序，以釐清事實，採 取必要之措施維護學生之權益與校園安全：

（一）二人以上被害人。

（二）二人以上行為人。

（三）行為人為校長或教職員工。

（四）涉及校園安全議題。

（五）其他經性平會認有以檢舉案形式啟動調查之必要者。

十二、 本校校園性別事件申請調查或檢舉以學生事務處為收件單位。除有性平法第三十 二條第二項所定不受理事由外，應於三日內將該事件交由性平會校園性別事件防

治組（以下簡稱防治組）調查處理。任何人不得另設調查機制，違反者其調查無 效。

防治組之工作權責範圍包括審議受理與否、不受理事由之認定、是否成立調查小 組及成員組成、撤回申請調查後是否續為調查。

經媒體報導之校園性別事件，或本校處理霸凌事件發現有疑似校園性別事件者， 視同檢舉，應交由性平會依第一項規定調查處理。疑似被害人不願配合調查時， 仍應提供必要之輔導或協助。

十三、 本校接獲申請調查或檢舉後二十日內，應以書面通知申請人或檢舉人是否受理。 不受理之書面通知應敘明理由，並告知申請人或檢舉人申復之期限及受理單位。 申請人或檢舉人於前項之期限內未收到通知或接獲不受理通知之次日起二十日 內，得以書面具明理由，向本校秘書室提出申復；其以言詞為之者，本校秘書室 應作成紀錄，經向申請人或檢舉人朗讀或使閱覽，確認其內容無誤後，由其簽名 或蓋章。

本校秘書室接獲申復後，應將申請調查或檢舉案交性平會重新討論受理事宜，並 於二十日內以書面通知申復人申復結果。申復有理由者，性平會應依法調查處 理。

前項不受理之申復以一次為限。

十四、 本校性平會處理校園性別事件時，得成立調查小組調查之。調查小組以三人或五 人為原則，其成員之組成，依性平法第三十三條及校園性別事件防治準則第二十 二條之規定。

十五、 本校調查處理校園性別事件時，應依下列方式辦理：

（一）行為人應親自出席接受調查；當事人為未成年者，接受調查時得由法定 代理人或實際照顧者陪同。

（二）當事人持有各級主管機關核發之身心障礙證明或有效特殊教育學生鑑定 證明者，調查小組成員應有具備特殊教育專業者。

（三）行為人與被害人、檢舉人或受邀協助調查之人有權力不對等之情形者， 應避免其對質。

（四）就行為人、被害人、檢舉人或受邀協助調查之人之姓名及其他足以辨識 身分之資料，應予保密。但有調查之必要或基於公共安全考量者，不在 此限。

（五）依性平法第三十三條第五項規定以書面通知當事人、相關人員或單位配 合調查及提供資料時，應記載調查目的、時間、地點及不到場所生之效 果。

（六）前款通知應載明當事人不得私下聯繫或運用網際網路、通訊軟體或其他 管道散佈事件之資訊。

（七）本校所屬人員不得以任何名義對案情進行瞭解或調查，且不得要求當事 人提交自述或切結文件。

（八）基於調查之必要，得於不違反保密義務之範圍內另作成書面資料，交由

行為人、被害人或受邀協助調查之人閱覽或告以要旨。

（九）申請人撤回申請調查時，為釐清相關法律責任，得經防治組決議，或經 行為人請求，繼續調查處理。

（十）當事人申請閱覽、抄寫、複印或攝影有關資料或卷宗，應依行政程序法 規定辦理。

（十一）當事人調查訪談過程紀錄，得以錄音輔助，必要時得以錄影輔助；訪 談紀錄應向當事人朗讀或使閱覽，確認其內容無誤後，由其簽名或蓋 章。

十六、 依前點第四款規定負有保密義務者，包括參與處理校園性別事件之所有人員。 依前項規定負保密義務者洩密時，應依刑法或其他相關法規處罰。

本校就記載有當事人、檢舉人、證人姓名之原始文書應予封存，不得供閱覽或提 供予偵查、審判機關以外之人。但法律另有規定者，不在此限。

除原始文書外，調查處理校園性別事件人員對外所另行製作之文書，應將當事

人、檢舉人、證人之真實姓名及其他足以辨識身分之資料刪除，並以代號為之。

十七、 為保障校園性別事件當事人之受教權或工作權，本校於必要時得為下列處置，並 報教育部備查：

（一）彈性處理當事人之出缺勤紀錄或成績考核，並積極協助其課業或職務， 得不受請假、教師及學生成績考核相關規定之限制。

（二）尊重被害人之意願，減低當事人雙方互動之機會，並得依被害人之申請 或由性平會評估該事件對學生受教權及校園安全之影響，中止當事人雙 方執行教學、指導、訓練、評鑑、管理、輔導學生或提供學生工作機會 之關係，或命行為人迴避。

（三）避免報復情事。

（四）預防、減低行為人再度加害之可能。

（五）其他性平會認為必要之處置。

當事人非本校之教職員工生時，應通知當事人所屬學校，依前項規定處理。 前項必要之處置，應經性平會決議通過後執行。

十八、 本校應視當事人之身心狀況，主動轉介至各相關構，以提供必要之協助，但就該 事件仍應依本規定為調查處理。

當事人非本校之人員時，應通知當事人所屬學校，依前項規定提供必要之協助。 十九、 本校於必要時應對於當事人提供下列適當協助：

（一）心理諮商輔導。

（二）法律諮詢管道。

（三）課業協助。

（四）經濟協助。

（五）其他性平會認為必要之協助。

當事人非本校之人員時，應通知當事人所屬學校，依前項規定提供適當協助。 前項協助得委請醫師、臨床心理師、諮商心理師、社會工作師或律師等專業人員

為之。

二十、 性平會之調查處理，不受該事件司法程序是否進行及處理結果之影響。

前項之調查程序，不因行為人喪失原身分而中止。

二十一、 基於尊重專業判斷及避免重複詢問原則，本校對於校園性別事件有關之事實認 定，應依據性平會之調查報告。

性平會召開會議審議調查報告認定校園性別事件屬實，依其事實認定向本校提出 改變身分之處理建議者，本校應檢附經性平會審議通過之調查報告，通知行為人 於七日內提出書面陳述意見。

前項行為人不於期限內提出書面陳述意見者，視為放棄陳述之機會；有書面陳述 意見者，性平會應再次召開會議審酌其書面陳述意見，除發現調查程序有重大瑕 疵或有足以影響原調查認定之新事實、新證據情形外，不得重新調查。

本校決定議處之權責單位，於審議議處時，除有性平法第三十七條第三項所定之 情形外，不得要求性平會重新調查，亦不得自行調查。

前項審議議處依相關法規應給予行為人陳述答辯意見時，應檢附經性平會審議通 過之調查報告。

第四項議處決定前，權責單位應通知被害人、其法定代理人或實際照顧者於七日 內以書面或言詞提出陳述意見；其以言詞為之者，權責單位應作成紀錄，經向被 害人、其法定代理人或實際照顧者朗讀或使閱覽，確認其內容無誤後，由其簽名 或蓋章；未於期限內提出書面陳述意見者，視為放棄陳述之機會；有書面陳述意 見者，決定議處之權責單位應審酌其書面陳述意見。

二十二、 校園性別事件經性平會調查屬實後，應移送權責單位懲處，對行為人予以申誡、 記過、解聘、停聘、不續聘、免職、終止契約關係、終止運用關係或其他適當之 懲處。其他機關依相關法律或法規有議處權限時，本校應將該事件移送其他機關 議處；其經證實證實有誣告之事實者，應依法對申請人或檢舉人為適當之懲處。 本校依性別平等教育法第二十六條規定為校園性別事件之懲處時，應命行為人接 受心理諮商與輔導之處置，並得命其為下列一款或數款之處置。但終身不得聘 任、任用、進用或運用之人員，不在此限：

（一）經被害人、其法定代理人或實際照顧者之同意，向被害人道歉。法定代 理人或實際照顧者同意時，應以兒童及少年之最佳利益為優先考量，並 依其心智成熟程度權衡其意見。

（二）接受八小時之性別平等教育相關課程。

（三）其他符合教育目的之措施。

前項處置，由性平會討論決定處置之性質、執行方式、執行期間及費用之支應事 宜，並由本校學務處執行，執行時應採取必要之措施，以確保行為人之配合遵 守；處置之性質、執行方式、執行期間及不配合執行之法律效果，應載明於處理 結果之書面通知中。

前項第一款之處置，當事人均為學生時，本校得善用修復式正義或其他輔導策 略，促進修復關係。

校園性騷擾、性霸凌、校長或教職員工違反與性或性別有關之專業倫理行為情節 輕微者，本校得僅依前項規定為必要之處置。

二十三、 本校將處理結果（包含包括事實認定、處置措施及議處結果）以書面通知申請 人、被害人及行為人時，應一併提供調查報告，並告知申復之期限及受理單位。 申請人、被害人或行為人對處理結果不服者，得於收到書面通知次日起三十日 內，以書面具名理由向本校秘書室申復，並以一次為限。若以言詞為之者，本校 秘書室應作成紀錄，經向申請人或行為人朗讀或使閱覽，確認其內容無誤後，由 其簽名或蓋章。

本校秘書室接獲申復後，依下列程序處理：

（一）應即組成審議小組，並於三十日內作成附理由之決定，以書面通知申復 人申復結果。

（二）前款審議小組應包括性別平等教育相關專家學者、法律專業人員三人或 五人，其小組成員中，女性人數比例應佔成員總數二分之一以上，具校 園性別事件調查專業素養之專家學者人數比例應佔成員總數三分之一以 上。

（三）原性平會委員及原調查小組成員不得擔任審議小組成員。

（四）審議小組召開會議時由小組成員推舉召集人，並主持會議。

（五）審議會議進行時，得視需要給予申復人陳述意見之機會，並得邀請性平 會相關委員或調查小組成員列席說明。

（六）申復有理由時，將申復決定通知相關權責單位，由其重為決定。有性平 法第三十七條第三項所定調查程序有重大瑕疵或有足以影響原調查認定 之新事實、新證據時，得要求性平會重新調查。

（七）前款申復決定送達申復人前，申復人得準用前項規定撤回申復。 調查程序有重大瑕疵，指有下列情形之一者：

（一）性平會或調查小組組織不適法。

（二）未給予當事人任一方陳述意見之機會。

（三）有應迴避而未迴避之情形。

（四）有應調查之證據而未調查。

（五）有證據取捨瑕疵而影響事實認定。

（六）其他足以影響事實認定之重大瑕疵。

校園性別事件之行為人為教職員工者，申請人或被害人得逕向教育部申復。申請 人或被害人向教育部申復時，倘行為人向本校申復，本校應即報請教育部併案審 議。

性平會於接獲重新調查之要求時，應另組調查小組。

二十四、 申請人、被害人及行為人對本校之申復結果不服，得於接獲申復結果書面通知書 之次日起三十日內，依性平法第三十九條規定提起救濟。

二十五、 本校應建立之校園性別事件之檔案資料，並分為原始檔案與報告檔案，指定由學 務處保存二十五年；其以電子儲存媒體儲存者，必要時得採電子簽章或加密方式

處理之。

前項原始檔案應予保密，其內容包括下列資料：

（一）事件發生之時間、樣態。

（二）事件相關當事人（包括檢舉人、被害人、行為人） 。

（三）事件處理人員、流程及紀錄。

（四）事件處理所製作之文書、訪談過程之錄音檔案、取得之證據及其他相關 資料。

（五）行為人之姓名、職稱或學籍資料等。

（六）調查小組提交之調查報告初稿及性平會之會議紀錄。

第一項報告檔案為經性平會議決通過之調查報告；其內容應包括下列資料：

（一）申請調查事件之案由，包括當事人或檢舉之敘述。

（二）調查訪談過程紀錄，包括日期及對象。

（三）被申請調查人、申請調查人、證人與相關人士之陳述及答辯。

（四）相關物證之查驗。

（五）事實認定及理由。

（六）處理建議。

二十六、 本校於取得性平法第二十九條第三項所定事件相關事證資訊，經通知當事人陳述 意見後，應提交性平會查證審議。

二十七、 本校依性平法第二十八條第二項及第三項規定為通報時，其通報內容應限於行為 人經查證屬實之校園性別事件時間、樣態、行為人姓名、職稱或學籍資料。 本校應視實際需要，將輔導、防治教育或相關處置措施及其他必要之資訊，提供 予次一就讀或服務之學校。行為人追蹤輔導後，評估無再犯情事者，得於第一項 通報內容註記行為人之改過現況。

二十八、 性平會之委員均為無給職。惟本校教職員工擔任校園性別事件調查小組撰寫調查 報告時及非本校教職員工之外聘委員出席會議及撰寫調查報告書時，得支領費 用。

二十九、 本規定若有未盡事宜，皆依「性別平等教育法」 、 「性別平等教育法施行細則」與 「校園性別事件防治準則」等相關規定辦理。

三十、 本規定經性平會會議及校務會議通過後實施，修正時亦同。","<2-hop>  [202509171642480752.md]

國立中山大學性別友善宿舍入住原則

113 年 5 月 8 日本校 112 學年度第 2 次學生事務會議通過

一、 為提供性別友善之住宿環境，尊重及考量學生之不同生理性別、 性別特質、性別認同或性傾向，特訂定本原則。

二、 跨性別者若欲入住，宜破除生理性別二分並依據其性別認同作 為性別判準。

三、 申請者得個別提出申請或自行尋找室友一起申請。

四、 房間安排以「男女分層」為原則，當特定性別樓層無空房時， 得安排「男女同層不同寢」。

五、 有關處理學生住宿服務之相關人員，包括宿服組行政同仁、宿 舍服務員、工讀生、宿委會委員等，應參加至少一場由本校性 別平等教育委員會認可之性別講座或說明會。

六、

宿舍組負責規劃、執行與輔導性別友善宿舍之管理業務，並由 相關行政人員協同宿委會執行以下事項：

( 一 ) 擔任宣導、處理及回應相關問題之對外窗口。

( 二 ) 定期舉辦相關主題活動，以利住宿學生認識多元性別。

( 三 )

於宿服組網站明確傳遞性別友善、反歧視之相關資訊。

七、 本原則由學務會議通過，修改時亦同。",202503131723000197.md,202509171642480752.md,"['性別平等教育法', '性別平等教育委員會']",學生事務處↔學生事務處,性別平等教育法↔性別平等教育委員會,5.0,5.0,5.0,5.0,5.0,2.0,5.0
國立中山大學文學院的場地收費標準是如何區分院內單位、校內單位與校外單位？此外，文學院教師升等時參與跨域活動的要求是什麼？,根據國立中山大學文學院場地收費一覽表，場地費用依申請單位分為院內單位、校內單位與校外單位三種標準。院內單位使用部分場地不收費，如文學院院本部及一級研究中心舉辦活動使用會議室及教室不收費。校內單位與校外單位則依場地不同收費，校外單位收費最高，且校友以公司或機關團體申請租借場地以校外單位標準計算，但本學院校友可打八折，其他學院校友打九折。校外單位與非本院單位合辦活動以校外收費標準打八折，與本院單位合辦則以院內收費標準計算。申請特定場地需預付保證金，使用完畢無損壞者退還。非上班時間使用須支付管理員加班費。申請單位需負責場地整潔與安全維護。至於文學院教師升等服務績效，申請教師須參與本學院辦理之跨系所跨領域對話座談、跨校際對話座談、跨國際學術交流對話、文苑沙龍及院相關學程開設等相關活動，至少參與7場次，每場次計1分，最高7分，未達7場次依實際參與場次計分。申請教師需自行填列並檢附參與表格以利計分。,"['<1-hop>  [201908161730420215.md]\n\n國立中山大學文學院場地收費一覽表\n\n86.4.9本學院八十三學年度第三次院務會議通過\n\n90.1.16本學院八十九學年度第二次院務會議通過\n\n90.9.28本校九十學年度第一次行政會議通\n\n98.5.7本學院九十七學年度第六次院務會議通過\n\n98.5.27本校九十七學年度第八次行政會議通過\n\n100.11.10 本學院一百學年度第一次院務會議通過\n\n101.4.12本學院一百學年度第四次院務會議通過\n\n101.6.13本校一百學年度第八次行政會議通過\n\n場地名稱 空間 編號 容納 人數 場地費 /每小時(單位: 元) 收費標準 備註 場地名稱 空間 編號 容納 人數 院內單位 校內單位 校外單位 備註 大會議室 文 706 137 250 900 2,400 文學院大樓 表演廳 B103 144 250 1,500 3,000 階梯教室 B101 100 100 250 1,200 階梯教室 B102 100 100 250 1,200 會議室(中型) 文804 30 100 250 1,200 排練室 文501 25 100 500 1,000 一般教室 文101~104 50 200 500 1,000 會議室(小型) 文801 10 不收費 500 1,000 多媒體電腦教室 文112 50 500 1,000 2,000 數位媒體影像製 作中心拍攝教材 文702 10-15 1,600 1,600 人文情境教室 文806 30 250 550 1,200 藝術大樓演奏廳 藝B11 200 1,700 2,800 4,400 備註10-1/10-2 演講廳 藝427-428 100 500 2,000 4,000 專業教室 藝429 10 500 1,250 2,500 備註10-3/10-4 專業教室 藝430 30 不收費 600 1,200 專業教室 藝431 80 不收費 600 1,200\n\n場地名稱 空間 編號 容納 人數 場地費 /每小時(單位: 元) 收費標準 備註 場地名稱 空間 編號 容納 人數 院內單位 校內單位 校外單位 備註 專業教室 藝434 50 不收費 600 1,200 專業教室 藝509 20 不收費 600 1,200 專業教室 藝611 20 不收費 600 1,200 專業教室 藝434 50 不收費 600 1,200 編曲教室 藝425 3 500 800 1,600 備註10-3 /10-4 編曲教室 藝526 5 500 1,250 2,500 練習琴房 4、5樓 5 100 100 500\n\n備註：\n\n文學院院本部、及文學院一級研究中心舉辦活動使用會議室及教室不收費。\n\n非上班時間須另行支付管理員加班費用(依校方規定給付)，以協助門禁管制及相關設備使用及諮詢。\n\n本校學生組織及社團活動，在不影響院內教學、研究相關活動下，得以免費借用教室，惟需自行清潔 借用場地，並預先支付清潔保證金1,000元，依清潔狀況多退少補。\n\n校友如以公司或機關團體申請租借場地以校外單位標準計算，本學院校友打八折計算，其他學院校友 打九折計算。\n\n校外單位如與非本院單位合辦活動，以校外收費標準打八折計算；校外單位與本院單位合辦活動，以 院內收費標準計算。\n\n申請場地文112、文702、文806及文學院大樓表演廳均應預付保證金4,000元；申請藝術大樓演奏廳校 內單位應預付保證金3,000元，校外單位則為10,000元；藝425、藝429與藝526院外單位應預付保證金 8,000元，其他場地校內外單位皆為2,000元，使用完畢無損壞者，如數退還。\n\n院內申請之活動如需預演時，同意提供與借用時間相同之預演，不供應空調，如需空調則依照院內場 地費收費標準收費，非院內單位則依照場地收費標準收費。\n\n申請單位應負責教室內外整潔，非屬原場地內物品，使用後應立即清除或運離，本學院不負保管責任。\n\n申請單位或機構於借用期間對於場地及人員之安全維護應自行負責。\n\n藝術大樓相關場地使用原則:\n\n(1) 藝術大樓演奏廳之鋼琴調音由管理單位專人負責聯絡調音師，費用由申請單位負擔。\n\n(2) 藝術大樓演奏廳之鋼琴使用費每場次院內單位不收費，校內單位1,500元，校外單位3,000元。\n\n(3) 藝425、藝429 與藝 526 因有貴重器材，需有管理人員在場，方得借用。\n\n(4) 音樂系學生使用藝425、藝429、藝526及練習琴房不收費。\n\n本服務收入使用依學校相關規定辦理。', ""<2-hop>  [202509142240120737.md]\n\n國立中山大學文學院教師升等服務績效之各類跨域活動參與一覽表\n\nParticipation Form of Interdisciplinary Activities for Service Performance of Professorship Rank Promotion in the College of Liberal Arts\n\n系所（組） ：\n\n姓名：\n\n擬升等職級：\n\nDepartment/Institute Applicant's name Intended rank promotion\n\n場次 No. 活動日期 date (yyyy/mm/dd) 活動名稱 / 主辦 ( 協辦、參加 ) title of activity (organizer/co- organizer/participant) 系審核 approved by the department/institute 院審核 approved by the College 1 2 3 4 5 6 7\n\n申請教師簽章 Applicant's signature ：\n\n( 日期\n\nYYYY 年 MM 月 DD 日）\n\n註 Notes :\n\n一、 依國立中山大學文學院教師升等審查評分細則辦理，教師申請升等職級期間應完成 參與本學院辦理之「跨系所跨領域對話座談」 、 「跨校際對話座談」 、 「跨國際國際學 術交流對話」 、文苑沙龍及院相關學程開設等相關活動，至少 7 場次，每場次以 1 分 計，至多 7 分 ; 未達者 7 場次者，依實際參與場次數計算。\n\nAccording to Guidelines on the Detailed Implementation of the Evaluation of Professorship Rank Promotion , the faculty applying for rank promotion shall participate in at least seven College-organized activities at their current rank, such as interdepartmental or interdisciplinary dialogue forums, inter-university forums, international academic exchange events, and other related activities held by the College's affiliated units. Points shall be calculated based on the actual number of activities attended (one point each), with a maximum of 7 points granted.\n\n二、 本表請申請升等教師自行填列檢附，俾利計分。\n\nThe faculty applying for rank promotion shall complete and submit this form for accurate calculation.""]",curious student,Poor grammar,long,"<1-hop>  [201908161730420215.md]

國立中山大學文學院場地收費一覽表

86.4.9本學院八十三學年度第三次院務會議通過

90.1.16本學院八十九學年度第二次院務會議通過

90.9.28本校九十學年度第一次行政會議通

98.5.7本學院九十七學年度第六次院務會議通過

98.5.27本校九十七學年度第八次行政會議通過

100.11.10 本學院一百學年度第一次院務會議通過

101.4.12本學院一百學年度第四次院務會議通過

101.6.13本校一百學年度第八次行政會議通過

場地名稱 空間 編號 容納 人數 場地費 /每小時(單位: 元) 收費標準 備註 場地名稱 空間 編號 容納 人數 院內單位 校內單位 校外單位 備註 大會議室 文 706 137 250 900 2,400 文學院大樓 表演廳 B103 144 250 1,500 3,000 階梯教室 B101 100 100 250 1,200 階梯教室 B102 100 100 250 1,200 會議室(中型) 文804 30 100 250 1,200 排練室 文501 25 100 500 1,000 一般教室 文101~104 50 200 500 1,000 會議室(小型) 文801 10 不收費 500 1,000 多媒體電腦教室 文112 50 500 1,000 2,000 數位媒體影像製 作中心拍攝教材 文702 10-15 1,600 1,600 人文情境教室 文806 30 250 550 1,200 藝術大樓演奏廳 藝B11 200 1,700 2,800 4,400 備註10-1/10-2 演講廳 藝427-428 100 500 2,000 4,000 專業教室 藝429 10 500 1,250 2,500 備註10-3/10-4 專業教室 藝430 30 不收費 600 1,200 專業教室 藝431 80 不收費 600 1,200

場地名稱 空間 編號 容納 人數 場地費 /每小時(單位: 元) 收費標準 備註 場地名稱 空間 編號 容納 人數 院內單位 校內單位 校外單位 備註 專業教室 藝434 50 不收費 600 1,200 專業教室 藝509 20 不收費 600 1,200 專業教室 藝611 20 不收費 600 1,200 專業教室 藝434 50 不收費 600 1,200 編曲教室 藝425 3 500 800 1,600 備註10-3 /10-4 編曲教室 藝526 5 500 1,250 2,500 練習琴房 4、5樓 5 100 100 500

備註：

文學院院本部、及文學院一級研究中心舉辦活動使用會議室及教室不收費。

非上班時間須另行支付管理員加班費用(依校方規定給付)，以協助門禁管制及相關設備使用及諮詢。

本校學生組織及社團活動，在不影響院內教學、研究相關活動下，得以免費借用教室，惟需自行清潔 借用場地，並預先支付清潔保證金1,000元，依清潔狀況多退少補。

校友如以公司或機關團體申請租借場地以校外單位標準計算，本學院校友打八折計算，其他學院校友 打九折計算。

校外單位如與非本院單位合辦活動，以校外收費標準打八折計算；校外單位與本院單位合辦活動，以 院內收費標準計算。

申請場地文112、文702、文806及文學院大樓表演廳均應預付保證金4,000元；申請藝術大樓演奏廳校 內單位應預付保證金3,000元，校外單位則為10,000元；藝425、藝429與藝526院外單位應預付保證金 8,000元，其他場地校內外單位皆為2,000元，使用完畢無損壞者，如數退還。

院內申請之活動如需預演時，同意提供與借用時間相同之預演，不供應空調，如需空調則依照院內場 地費收費標準收費，非院內單位則依照場地收費標準收費。

申請單位應負責教室內外整潔，非屬原場地內物品，使用後應立即清除或運離，本學院不負保管責任。

申請單位或機構於借用期間對於場地及人員之安全維護應自行負責。

藝術大樓相關場地使用原則:

(1) 藝術大樓演奏廳之鋼琴調音由管理單位專人負責聯絡調音師，費用由申請單位負擔。

(2) 藝術大樓演奏廳之鋼琴使用費每場次院內單位不收費，校內單位1,500元，校外單位3,000元。

(3) 藝425、藝429 與藝 526 因有貴重器材，需有管理人員在場，方得借用。

(4) 音樂系學生使用藝425、藝429、藝526及練習琴房不收費。

本服務收入使用依學校相關規定辦理。","<2-hop>  [202509142240120737.md]

國立中山大學文學院教師升等服務績效之各類跨域活動參與一覽表

Participation Form of Interdisciplinary Activities for Service Performance of Professorship Rank Promotion in the College of Liberal Arts

系所（組） ：

姓名：

擬升等職級：

Department/Institute Applicant's name Intended rank promotion

場次 No. 活動日期 date (yyyy/mm/dd) 活動名稱 / 主辦 ( 協辦、參加 ) title of activity (organizer/co- organizer/participant) 系審核 approved by the department/institute 院審核 approved by the College 1 2 3 4 5 6 7

申請教師簽章 Applicant's signature ：

( 日期

YYYY 年 MM 月 DD 日）

註 Notes :

一、 依國立中山大學文學院教師升等審查評分細則辦理，教師申請升等職級期間應完成 參與本學院辦理之「跨系所跨領域對話座談」 、 「跨校際對話座談」 、 「跨國際國際學 術交流對話」 、文苑沙龍及院相關學程開設等相關活動，至少 7 場次，每場次以 1 分 計，至多 7 分 ; 未達者 7 場次者，依實際參與場次數計算。

According to Guidelines on the Detailed Implementation of the Evaluation of Professorship Rank Promotion , the faculty applying for rank promotion shall participate in at least seven College-organized activities at their current rank, such as interdepartmental or interdisciplinary dialogue forums, inter-university forums, international academic exchange events, and other related activities held by the College's affiliated units. Points shall be calculated based on the actual number of activities attended (one point each), with a maximum of 7 points granted.

二、 本表請申請升等教師自行填列檢附，俾利計分。

The faculty applying for rank promotion shall complete and submit this form for accurate calculation.",201908161730420215.md,202509142240120737.md,['國立中山大學文學院'],文學院↔文學院,國立中山大學文學院↔國立中山大學文學院,5.0,5.0,5.0,5.0,5.0,2.0,5.0
請問國立中山大學行銷傳播管理研究所碩士論文計畫書的提報流程是如何規定的？其中提報計畫書的格式要求包含哪些主要部分？此外，提報時需要注意哪些審核程序與規定？,"根據國立中山大學行銷傳播管理研究所的規定，碩士論文計畫書提報流程包括每學年上下學期各舉行一次口頭報告，上學期於10月底至11月初，下學期於3月底至4月初。學生在繳交提報計畫書前，必須先取得指導教授在「傳管所碩士論文計畫書提報申請 -指導教授簽核單」上的親筆簽名核可，並與計畫書一併繳交。計畫書以電子檔形式繳交，簽核單則為紙本。為尊重學術倫理並降低抄襲狀況，學生需先申請使用本校管院turnitin反抄襲系統，將計畫書全文上傳進行抄襲檢測，並將檢測結果第一頁數據與計畫書電子檔一併交回所辦公室存參。若發現大篇幅抄襲，該次審核結果即為不通過，情節嚴重者可能取消下次提報機會。評審委員包括所上教授、論文指導教授及推薦參與提報之教授，評分時會錯開指導教授與學生的場次，避免利益衝突。若更換已通過提報之論文主題，必須重新參加提報。

提報計畫書格式包含封面、摘要、本文與參考文獻四部分。封面需包含題目、學生姓名、指導老師姓名，且封面不加頁碼。摘要最多500字，需簡述研究背景與動機、明述研究問題、說明資料蒐集方法與步驟。本文包含緒論、相關文獻探討與研究方法三部分，緒論需包含研究背景與動機、研究問題、研究目的；相關文獻探討需回顧相關文獻、敘述先期研究發現與結論、分析所要檢驗假設；研究方法分為研究對象、研究工具與資料蒐集程序。參考文獻需依學術慣例（如APA或MLA格式）列出實際引用文獻，並可附計畫書附件。","['<1-hop>  [201909121147410909.md]\n\n國立中山大學行銷傳播管理研究所所碩士論文計畫書格式\n\n93.5.28\n\n96.3.8\n\n所務會議通過實施 所務會議修正通過實施\n\n103.5.16 所務會議修正通過\n\n行銷傳播所學生之碩士論文計畫書，提報時繳交書面文件之製作，可參考本所論 文提報格式。\n\n行銷傳播所論文提報格式，包含封面、摘要、本文與參考文獻等四部分。從摘要 頁起，以阿拉伯數字於頁尾置中，加註頁碼 ( 封面不加頁碼 ) 。論文電子檔繳交，\n\n採用 Word 之格式。\n\n1.\n\n封面\n\n封面應包含題目、學生姓名、指導老師姓名。封面之格式請參照附件一。\n\n2. 摘要\n\n摘要應以最多 500 字敘述以下部分：\n\n\uf06c 簡述研究背景與動機。\n\n\uf06c 明述論文之研究問題。\n\n\uf06c 說明論文將使用的資料蒐集方法與步驟，且須涵蓋資料蒐集之對象（包含對 象之取得、對象之特性） 、資料蒐集之步驟（包含資料之蒐集程序、時程，\n\n例如採量化研究之實驗、調查程序規劃，或採質性研究之資料蒐集計畫等） 。\n\n3. 本文\n\n本文應該包含緒論、相關文獻探討與研究方法等三部分。\n\n\uf06c 緒論應包含研究背景與動機、研究問題、研究目的。\n\nI. 研究背景與動機：請敘述論文研究問題之背景（例如研究問題發生之情 境，包含怎麼發生、為甚麼發生或如何發生等） 、研究動機（例如為甚 想要研究這個研究問題、甚麼原因驅使你解答這個研究、解答這個研究 問題能夠帶來甚麼用處等） 。\n\nII. 研究問題：以問句陳述論文之主要研究問題與次要 （附屬） 之研究問題， 並適當解釋研究問題之內涵。必要時，可加上名詞釋義來解釋研究問題\n\n中之變數。\n\nIII. 研究目的：簡述該論文研究「所要作的事情」 。陳述解答研究問題後， 所能夠達成的具體目的，包含所要檢驗的假設、所要操弄的變數與所期 望的結果。\n\n\uf06c 相關文獻探討應包含回顧相關文獻、敘述先期研究之發現與結論、所要檢驗 之假設之分析。\n\nI. 回顧相關文獻：陳述與論文研究問題相關之理論、相關論文之應用。\n\nII. 敘述先前研究的發現與結論：陳述先前文獻（過去學者之研究）與你目 前所欲進行的研究間的關連性、陳述過去相關研究之具體發現與結論、 拓展相關文獻的廣度與深度。\n\nIII. 所要檢驗假設之分析：對於研究問題與研究假設中之相關文獻、變數進 行分析。\n\n\uf06c 研究方法應分為研究對象、研究工具與資料蒐集程序三部分。\n\nI. 研究對象：當「人」或「物」為論文研究之參與者或研究對象時，應說 明他們如何被選擇（抽樣方式）與被指派（實驗）的程序。必要時，需 敘述研究對象的特質、與被選取的數量。\n\nII. 研究工具：採用實驗類別之研究，則說明實驗之器材、量表、研究架構 圖等；採用調查或問卷研究，則說明調查之面向、問項量表與問卷的建 構程序，並透過研究架構圖陳述變數間之關連性；必要時可附上問卷初 稿。若採用質性研究，則陳述田野準備程序、質化訪談之概略互動計畫 ( 訪談大綱 ) 或記錄觀察之準備程序等。\n\nIII. 資料蒐集程序：採用實驗類別之研究，則包含對參與者的指示與對於實 驗的操弄步驟說明。採用調查或問卷研究，則包含調查方式（郵寄、電 話、面訪或網路等等）與執行程序（如何聯繫研究對象、如何發放、如 何回收等） 。若採用質性研究，則需說明如何執行你的資料蒐集（觀察 方式、筆記撰寫、質性資料分析等） 。\n\n4. 參考文獻\n\n\uf06c 參考文獻後可另行附上計畫書之附件。\n\n\uf06c 參考文獻之撰寫，需依照學術慣例使用適當的體例 ( 如 APA 或 MLA 格 式 ) ，列出實際閱讀過且實際引用在本文中的文獻。\n\n國立中山大學行銷傳播管理研究所 ( 標楷體 18 號字 ) 碩士論文計畫書 ( 標楷體 18 號字 )\n\n。。。。。。。。。\n\n題目\n\n。。。。。。。。。\n\n。。。。。。。。。。。。。。。\n\n(16 號字，以下同 )\n\n研究生：。。。撰\n\n指導教授：。。。\n\n中華民國 。。。 年 。。月 )\n\n( 本論文論文計畫書封面上下左右邊緣至少留白一吋，即 2.54 公分', '<2-hop>  [201909121148240912.md]\n\n國立中山大學行銷傳播管理研究所畢業論文研究計劃書提報辦法\n\n95.12.28\n\n98.6.23\n\n98.12.2\n\n93.5.28 所務會議通過實施 所務會議修正通過 所務會議修正通過 所務會議修正通過\n\n103.5.16\n\n所務會議修正通過\n\n提報場次為每學年上下學期各舉行一次，以口頭報告方式進行。上學期於 10 月底至 11 月初之間舉行，下學期於 3 月底至 4 月初舉行。\n\n在繳交提報計畫書前，請指導教授在「傳管所碩士論文計畫書提報申請 -指導教 授簽核單」上親筆簽名核可並與計畫書一併繳交後，方得參與提報。 「傳管所 碩士論文計畫書提報申請 -指導教授簽核單」請繳交紙本、提報計畫書則以電子 檔形式繳件。\n\n為尊重學術倫理以及降低抄襲狀況，在繳交提報計畫書前，請先向所辦公室 申 請 協 助 開 通 本 校 管 院 turnitin 反 抄 襲 系 統 ( 網 址 ： http://www.cm.nsysu.edu.tw/files/11-1022-9333-1.php) 之文件上傳帳號密碼、再 自行就欲繳交之提報計畫書全文電子檔，上傳至該系統進行抄襲檢測、並將檢 測結果交給指導教授審閱，同時將檢測結果「第一頁」數據連同計畫書電子檔 交回所辦公室存參。\n\n若經提報審查委員檢視發現內文涉及大篇幅抄襲者，該次審核結果即以「不通 過」計算；情節嚴重者，經所務會議或提報審查委員會審核討論後，得取消該 生參與下次計畫書提報機會。\n\n所上教授、論文指導教授、以及論文指導教授推薦參與提報之教授均為參與提 報之評審委員；提報審核結果正式寄發前，先請所有出席之評審委員就彙整之 總成績進行討論與確認後再行公佈。\n\n為顧及提報審核公平性與讓學生多所學習不同教師（評審委員）提供之論文撰 寫建議，審核委員排定方式以「將指導學生與指導教授（評審委員）錯開排在 不同場次」為原則；若該場次由該場提報者之指導教授擔任評審委員，則請該 位委員（指導教授）不予評分。\n\n若因故更換已通過提報之論文主題者，則必須重新參加提報。\n\n行銷傳播所碩士論文計畫書提報申請\n\n指導教授簽核單\n\n申請人姓名：\n\n入學學年度 / 所屬班別：\n\n[ ] 學年度-□碩士班\n\n[ ] □碩士在職專班\n\n碩士論文指導教授姓名：\n\n系 / 所\n\n教授\n\n（ 1 ） 是否有共同指導教授-□是\n\n[ ] □否\n\n（ 2 ） 共同指導教授姓名：\n\n系 / 所\n\n教授\n\n碩士論文題目：\n\n申請參與碩士論文計畫書提報場次：\n\n年 月 日（ 學年度第 學期）\n\n申請本次提報前，是否參加過提報-□是\n\n[ ] □否\n\n（ 1 ）若參加過，請列出之前參加過之學年學期-\n\n學年度第\n\n學期\n\n（ 2 ）本次再參加提報之原因-（本項可視狀況複選）\n\n[ ] □上次提報未通過審核\n\n[ ] □更換指導教授\n\n[ ] □更換論文題目\n\n申請人簽名：\n\n指導教授簽名：\n\n傳管所辦公室核章：\n\n註 1 ：本單採「紙本」繳件；請務必於參與提報之當學期預定繳交計畫書電子檔之期限內一併 繳交。\n\n註 2 ：上述所有項目可用電腦打字與勾選； 「申請人」與「指導教授」簽名處，則請「親筆簽名」 。 註 3 ： 「指導教授」簽名處，請「主指導」教授簽名即可。']",teacher,Perfect grammar,long,"<1-hop>  [201909121147410909.md]

國立中山大學行銷傳播管理研究所所碩士論文計畫書格式

93.5.28

96.3.8

所務會議通過實施 所務會議修正通過實施

103.5.16 所務會議修正通過

行銷傳播所學生之碩士論文計畫書，提報時繳交書面文件之製作，可參考本所論 文提報格式。

行銷傳播所論文提報格式，包含封面、摘要、本文與參考文獻等四部分。從摘要 頁起，以阿拉伯數字於頁尾置中，加註頁碼 ( 封面不加頁碼 ) 。論文電子檔繳交，

採用 Word 之格式。

1.

封面

封面應包含題目、學生姓名、指導老師姓名。封面之格式請參照附件一。

2. 摘要

摘要應以最多 500 字敘述以下部分：

 簡述研究背景與動機。

 明述論文之研究問題。

 說明論文將使用的資料蒐集方法與步驟，且須涵蓋資料蒐集之對象（包含對 象之取得、對象之特性） 、資料蒐集之步驟（包含資料之蒐集程序、時程，

例如採量化研究之實驗、調查程序規劃，或採質性研究之資料蒐集計畫等） 。

3. 本文

本文應該包含緒論、相關文獻探討與研究方法等三部分。

 緒論應包含研究背景與動機、研究問題、研究目的。

I. 研究背景與動機：請敘述論文研究問題之背景（例如研究問題發生之情 境，包含怎麼發生、為甚麼發生或如何發生等） 、研究動機（例如為甚 想要研究這個研究問題、甚麼原因驅使你解答這個研究、解答這個研究 問題能夠帶來甚麼用處等） 。

II. 研究問題：以問句陳述論文之主要研究問題與次要 （附屬） 之研究問題， 並適當解釋研究問題之內涵。必要時，可加上名詞釋義來解釋研究問題

中之變數。

III. 研究目的：簡述該論文研究「所要作的事情」 。陳述解答研究問題後， 所能夠達成的具體目的，包含所要檢驗的假設、所要操弄的變數與所期 望的結果。

 相關文獻探討應包含回顧相關文獻、敘述先期研究之發現與結論、所要檢驗 之假設之分析。

I. 回顧相關文獻：陳述與論文研究問題相關之理論、相關論文之應用。

II. 敘述先前研究的發現與結論：陳述先前文獻（過去學者之研究）與你目 前所欲進行的研究間的關連性、陳述過去相關研究之具體發現與結論、 拓展相關文獻的廣度與深度。

III. 所要檢驗假設之分析：對於研究問題與研究假設中之相關文獻、變數進 行分析。

 研究方法應分為研究對象、研究工具與資料蒐集程序三部分。

I. 研究對象：當「人」或「物」為論文研究之參與者或研究對象時，應說 明他們如何被選擇（抽樣方式）與被指派（實驗）的程序。必要時，需 敘述研究對象的特質、與被選取的數量。

II. 研究工具：採用實驗類別之研究，則說明實驗之器材、量表、研究架構 圖等；採用調查或問卷研究，則說明調查之面向、問項量表與問卷的建 構程序，並透過研究架構圖陳述變數間之關連性；必要時可附上問卷初 稿。若採用質性研究，則陳述田野準備程序、質化訪談之概略互動計畫 ( 訪談大綱 ) 或記錄觀察之準備程序等。

III. 資料蒐集程序：採用實驗類別之研究，則包含對參與者的指示與對於實 驗的操弄步驟說明。採用調查或問卷研究，則包含調查方式（郵寄、電 話、面訪或網路等等）與執行程序（如何聯繫研究對象、如何發放、如 何回收等） 。若採用質性研究，則需說明如何執行你的資料蒐集（觀察 方式、筆記撰寫、質性資料分析等） 。

4. 參考文獻

 參考文獻後可另行附上計畫書之附件。

 參考文獻之撰寫，需依照學術慣例使用適當的體例 ( 如 APA 或 MLA 格 式 ) ，列出實際閱讀過且實際引用在本文中的文獻。

國立中山大學行銷傳播管理研究所 ( 標楷體 18 號字 ) 碩士論文計畫書 ( 標楷體 18 號字 )

。。。。。。。。。

題目

。。。。。。。。。

。。。。。。。。。。。。。。。

(16 號字，以下同 )

研究生：。。。撰

指導教授：。。。

中華民國 。。。 年 。。月 )

( 本論文論文計畫書封面上下左右邊緣至少留白一吋，即 2.54 公分","<2-hop>  [201909121148240912.md]

國立中山大學行銷傳播管理研究所畢業論文研究計劃書提報辦法

95.12.28

98.6.23

98.12.2

93.5.28 所務會議通過實施 所務會議修正通過 所務會議修正通過 所務會議修正通過

103.5.16

所務會議修正通過

提報場次為每學年上下學期各舉行一次，以口頭報告方式進行。上學期於 10 月底至 11 月初之間舉行，下學期於 3 月底至 4 月初舉行。

在繳交提報計畫書前，請指導教授在「傳管所碩士論文計畫書提報申請 -指導教 授簽核單」上親筆簽名核可並與計畫書一併繳交後，方得參與提報。 「傳管所 碩士論文計畫書提報申請 -指導教授簽核單」請繳交紙本、提報計畫書則以電子 檔形式繳件。

為尊重學術倫理以及降低抄襲狀況，在繳交提報計畫書前，請先向所辦公室 申 請 協 助 開 通 本 校 管 院 turnitin 反 抄 襲 系 統 ( 網 址 ： http://www.cm.nsysu.edu.tw/files/11-1022-9333-1.php) 之文件上傳帳號密碼、再 自行就欲繳交之提報計畫書全文電子檔，上傳至該系統進行抄襲檢測、並將檢 測結果交給指導教授審閱，同時將檢測結果「第一頁」數據連同計畫書電子檔 交回所辦公室存參。

若經提報審查委員檢視發現內文涉及大篇幅抄襲者，該次審核結果即以「不通 過」計算；情節嚴重者，經所務會議或提報審查委員會審核討論後，得取消該 生參與下次計畫書提報機會。

所上教授、論文指導教授、以及論文指導教授推薦參與提報之教授均為參與提 報之評審委員；提報審核結果正式寄發前，先請所有出席之評審委員就彙整之 總成績進行討論與確認後再行公佈。

為顧及提報審核公平性與讓學生多所學習不同教師（評審委員）提供之論文撰 寫建議，審核委員排定方式以「將指導學生與指導教授（評審委員）錯開排在 不同場次」為原則；若該場次由該場提報者之指導教授擔任評審委員，則請該 位委員（指導教授）不予評分。

若因故更換已通過提報之論文主題者，則必須重新參加提報。

行銷傳播所碩士論文計畫書提報申請

指導教授簽核單

申請人姓名：

入學學年度 / 所屬班別：

[ ] 學年度-□碩士班

[ ] □碩士在職專班

碩士論文指導教授姓名：

系 / 所

教授

（ 1 ） 是否有共同指導教授-□是

[ ] □否

（ 2 ） 共同指導教授姓名：

系 / 所

教授

碩士論文題目：

申請參與碩士論文計畫書提報場次：

年 月 日（ 學年度第 學期）

申請本次提報前，是否參加過提報-□是

[ ] □否

（ 1 ）若參加過，請列出之前參加過之學年學期-

學年度第

學期

（ 2 ）本次再參加提報之原因-（本項可視狀況複選）

[ ] □上次提報未通過審核

[ ] □更換指導教授

[ ] □更換論文題目

申請人簽名：

指導教授簽名：

傳管所辦公室核章：

註 1 ：本單採「紙本」繳件；請務必於參與提報之當學期預定繳交計畫書電子檔之期限內一併 繳交。

註 2 ：上述所有項目可用電腦打字與勾選； 「申請人」與「指導教授」簽名處，則請「親筆簽名」 。 註 3 ： 「指導教授」簽名處，請「主指導」教授簽名即可。",201909121147410909.md,201909121148240912.md,"['碩士論文計畫書提報', '國立中山大學行銷傳播管理研究所', '碩士論文計畫書格式']",管理學院↔管理學院 | 行銷傳播管理研究所↔行銷傳播管理研究所,國立中山大學行銷傳播管理研究所↔國立中山大學行銷傳播管理研究所 | 碩士論文計畫書格式↔碩士論文計畫書提報,5.0,5.0,5.0,5.0,5.0,4.71,5.0
根據國立中山大學學生社團輔導辦法與績優社團活動獎學金設置辦法，請問學生社團在申請社團活動時需要遵循哪些申請流程？此外，符合哪些條件的學生或社團可以申請績優社團活動獎學金？,根據國立中山大學學生社團輔導辦法，社團舉辦活動前（平時社課不在此限），應由社（團）長或各社團之幹部向校園組提出申請，申請流程如下：一、於國立中山大學學務綜合資訊平臺，登錄社團活動相關資料後，列印「國立中山大學學生活動申請表」，送請社團指導老師簽名。二、依申請表之規定，由社團長及社團指導老師簽名同意後，於活動前十日將申請表送校園組輔導老師。三、申請表簽核完畢後，始得申請借用場地、物品及器材等。四、活動結束後十日內將活動成果表送校園組輔導老師。至於績優社團活動獎學金的申請資格，個人申請者需符合以下條件：(1)學校「社團評鑑」成績80分以上社團，且擔任社團負責人、幹部職務一學期(含)以上者。(2)擔任社團負責人、幹部期間之學期學業成績不及格科目之學分數，未達該學期修習學分總數二分之一且未受記過以上懲處者。團體申請者則為有特殊貢獻之社團，經由學校各單位或校外相關單位推薦。,"['<1-hop>  [202204210903080158.md]\n\n第一條\n\n第二條\n\n國立中山大學績優社團活動獎學金設置辦法\n\n92 年 4 月 16 日 92 學年度第 5 次行政會議通過 97 年 6 月 18 日 96 學年度第 8 次行政會議通過 97 年 10 月 15 日 97 學年度第 3 次行政會議通過 111 年 3 月 30 日 本校 110 學年度第 2 學期第 4 次行政會議修正通過\n\n為鼓勵本校學生參與社團活動，積極培育社團之優秀幹部，並獎勵對學 校及社區有特殊貢獻之社團，特訂定本辦法。\n\n申請資格：\n\n一、個人：應符合下列條件\n\n(1)學校「社團評鑑」成績 80 分以上社團，且擔任社團負責\n\n人、幹部職務一學期(含)以上者。\n\n(2)擔任社團負責人、幹部期間之學期學業成績不及格科目 之學分數，未達該學期修習學分總數二分之一且未受記\n\n過以上懲處者。\n\n二、團體：有特殊貢獻之社團，經由學校各單位或校外相關單位推薦。\n\n第三條 獎金金額：\n\n一、個人：每人新臺幣陸仟元整。\n\n二、團體：每個社團新臺幣貳萬元整。\n\n第四條 申請時間：每年十月十五日至十月三十一日止。\n\n第五條 申請證件：\n\n一、個人：申請表、成績單、活動績效資料。\n\n二、社團：推薦表及活動績效資料。\n\n第六條 經費來源：\n\n由本校學生公費及獎助學金項下支應，每學年頒發總金額以新臺幣五十\n\n萬元為上限。\n\n第七條 審查程序：\n\n學務處校園生活與職涯發展組初審，本校獎學金管理委員會覆審；名額 得視實際需要調整。\n\n第八條 本辦法經行政會議通過，陳請校長核定後實施，修正時亦同。', '<2-hop>  [202308110945030309.md]\n\n國立中山大學學生社團輔導辦法\n\n97 年 04 月 11 日 96 學年度第 1 次學務臨時會議通過 100 年 06 月 28 日 99 學年度第 4 次學務會議修正通過 108 年 06 月 03 日 107 學年度第 2 次學務會議修正通過 109 年 07 月 03 日 108 學年度第 3 次學務會議修正通過 109 年 11 月 27 日 109 學年度第 1 次學務會議修正通過 111 年 03 月 30 日 110 學年度第 2 學期第 4 次行政會議修正通過\n\n112 年 06 月 09 日 111 學年度第 2 次學務會議修正通過\n\n第一條 （社團之宗旨）\n\n為輔導學生參加社團活動，以充實休閒生活，提高研究興趣，陶冶合\n\n群德性，培養領導人才，涵養服務情操，增進組織能力，訂定本辦法。\n\n第二條 （社團之屬性）\n\n社團，依其成立之宗旨，分為下列六種：\n\n一、 康樂性社團：以提倡休閒康樂活動為宗旨之社團。\n\n二、 學藝性社團：以研究技藝為宗旨之社團。\n\n三、 服務性社團：以推廣社會服務為宗旨之社團。\n\n四、 體育性社團：以提昇運動技術，養成終身運動習慣為宗旨之社團。\n\n五、 學術性社團：以研究學術為宗旨之社團。\n\n六、 音樂性社團：以倡導音樂之演出與欣賞，以愉悅身心為宗旨之社 團。\n\n各社團於申請成立時，可選擇其屬性，經學務處校園生活與職涯發展 組（以下簡稱校園組）同意後為之；社團成立後，若因經營之宗旨或 其他原因欲變更其社團屬性者，應經校園組同意後為之。\n\n第三條 （社團指導老師）\n\n因應社團之專長需求，各社團可向校園組申請聘任校內外專業人士為 社團指導老師，其聘任辦法另訂之，並每學年更新其資料，以利校園 組掌握各社團指導老師之情況。指導老師聘書於社團申請聘任時由校 園組製發。\n\n第四條 （社團之輔導及輔導老師）\n\n社團輔導老師由校園組組員擔任，若社團遭遇重大困難，應先呈報學 生會社團部後，再會同輔導老師依個案作特別輔導。\n\n第五條 （社（團）長及社團長大會）\n\n社（團）長對內為社團負責人，綜理社（團）務，並對社（團）員大 會負責，對外則代表學生社團。社（團）長之產生及任期，依各社團 組織章程或相關規定辦理。\n\n社團長大會為社團最高決策會議，由各社團之社（團）長所組成，開 會時應有二分之一以上社（團）長出席，並經出席社（團）長二分之 一以上同意做成決議。每學期期初或期末各召開一次為原則，由校園\n\n組或學生會召開。會議紀錄須交校園組備查。\n\n社團長大會召集目的為重大事項佈達、意見討論及社團相關委員會委 員之選任或其他與社團發展相關事項。\n\n第六條 （學生社團設立程序）\n\n社團之設立，申請程序如下：\n\n一、 發起人須填寫「國立中山大學學生社團成立申請表」 ，並召集至 少 15 人（含）以上之本校學生簽署連署書，送交校園組承辦人 辦理登記，始可開始籌組社團。\n\n二、 社團籌組期間，需擬訂「社團組織章程」之草案，送交校園組審 查通過後，始可召開社團成立大會。\n\n三、 社團成立大會，應有連署人三分之二以上出席，會同校園組、學 生會代表各一人列席，始得召開，會中應審議「社團組織章程」 草案及選任首任社（團）長。\n\n四、 社團成立大會結束後，應備齊會議紀錄、社團組織章程、簽到表 及幹部名冊，送交校園組承辦人，經校園組審查，且送學務處組 長會議通過後，方可成為觀察性社團。\n\n五、 前款觀察性社團於成立六個月後，應接受最近一次之社團評鑑， 若未滿六個月亦可主動申請參與社團評鑑。觀察性社團接受社團 評鑑後，總分達六十分以上，成為正式社團。\n\n第七條 （社團章程）\n\n社團章程，應記載下列事項：\n\n一、 社團正式中文及英文名稱。\n\n二、 社團成立宗旨。\n\n三、 組織與職掌。\n\n四、 社員入社、退社及除名之條件。\n\n五、 社員之權利及義務。\n\n六、 幹部名額、權限、任期、選任及解任。\n\n七、 會議召集及決議方式。\n\n八、 指導老師之擬聘。\n\n九、 經費之運用與管理。\n\n十、 章程修改方法。\n\n十一、 訂定章程之年月日。\n\n第八條 （學生社團解散程序）\n\n社團有下列行為之一者，應填具「國立中山大學學生社團停社或解散 填報表」解散其社團：\n\n一、 社團連續兩學年度社團評鑑未達六十分者。\n\n二、 社（團）員大會決議解散後向學生會及校園組報備。\n\n三、 因學務會議決議懲處解散社團。\n\n第九條 （學生社團停社）\n\n一、 社團運作有實際困難者，經社員大會決議，得申請停社；無法召 開社員大會時，應由社團長填具停社申請書並經社團指導老師簽 準後，申請停社。\n\n二、 社團申請停社應填具「國立中山大學學生社團停社或解散填報 表」向校園組申請停止其社團運作。\n\n三、 社團在停社三年內，若未依相關規定成功申請復社，該社團視同 解散。\n\n第十條 （學生社團解散後之財務管理）\n\n社團需整理造冊清點財產，包含文件資料、器材、財務資料、其他資 料等，並由社團長與校園組依以下原則處理：\n\n一、 器材：學校經費購置之器材，由校園組全權處理。\n\n二、 財務資料：帳戶資料由社團辦理結清，並繳交加蓋註銷章之存摺。\n\n三、 社團辦公室：需淨空歸還，並繳回鑰匙。\n\n第十一條 （學生社團停社後之財務管理）\n\n社團需整理造冊清點財產，包含文件資料、器材、財務資料、其他資 料等，並由社團長與校園組依以下原則處理：\n\n一、 文件資料：有傳承及可供復社參閱者，由校園組保存三年，屆時 無法復社者，將依個資法辦理文件銷毀。\n\n二、 器材：學校經費購置之器材，由校園組保存三年，屆時仍無法復 社者，將供其他社團認領，未認領之器材由校園組全權處理；完 全由社團經費自行購買之器材，由社團自行處理，未於規定期限 內處理者由校園組逕為處理。\n\n三、 財務資料：帳戶資料由社團辦理結清，並繳交加蓋註銷章之存摺。 四、 社團辦公室：需淨空歸還，並繳回鑰匙。\n\n第十二條 （學生社團之復社或變更社團屬性程序）\n\n學生社團申請復社須填寫「國立中山大學學生社團復社申請表」 ，並繳 交 8 人（含）以上之本校學生簽署連署書及社團長資料卡，經校園組 審查通過後，方可復社並成為觀察性社團。\n\n申請復社之社團於復社六個月後，應接受最近一次之社團評鑑，若未 滿六個月亦可主動申請參與社團評鑑，社團評鑑總分達六十分以上， 成為正式社團。\n\n學生社團申請變更社團屬性須填寫「國立中山大學學生社團屬性變更 申請表」 ，並繳交社員大會會議紀錄及簽到表，經校園組審查通過後， 方可變更社團屬性。\n\n第十三條 （活動申請）\n\n社團舉辦活動前（平時社課不在此限） ，應由社（團）長或各社團之幹 部向校園組提出申請，申請流程如下：\n\n一、 於國立中山大學學務綜合資訊平臺，登錄社團活動相關資料後， 列印「國立中山大學學生活動申請表」 ，送請社團指導老師簽名。\n\n二、 依申請表之規定，由社團長及社團指導老師簽名同意後，於活動 前十日將申請表送校園組輔導老師。\n\n三、 申請表簽核完畢後，始得申請借用場地、物品及器材等。\n\n四、 活動結束後十日內將活動成果表送校園組輔導老師。\n\n第十四條 （社團行文）\n\n如有對外行文需求，應先經校園組同意後，再依本校發文程序辦理。\n\n第十五條 （社團經費） 各社團所需經費以自籌為原則，社費之多寡由各社團自行酌定。辦理 活動時，得依「國立中山大學學生社團經費補助要點」向社團經費補 助審核委員會提出經費補助申請，並應依公告之結果於指定時間內檢 具相關資料及單據向校園組輔導老師辦理核銷，若為購置器材或物品 之經費核銷，則依本校相關規定辦理。\n\n社團經費補助要點另訂之。\n\n第十六條 （學生社團辦公室）\n\n正式社團得向校園組申請社團辦公室。\n\n社團公告，包括各社團之海報、通告、啟事或其他具宣傳、通知性之\n\n第十七條 （社團之公告） 文書，張貼應依各場館管理辦法辦理。\n\n社團應接受定期評鑑，其評鑑方式、時間及委員會之組成依「國立中\n\n第十八條 （社團評鑑） 山大學學生社團評鑑實施要點」辦理。\n\n第十九條 （社團之懲處） 社團活動如有違反法令、校規或公序良俗者應立即停止活動，並經學 生會或校園組決議後提學務會議予以懲處，懲處方式如下： 一、 停止經費補助或其他權益。\n\n二、 解散社團。\n\n第二十條 （社團懲處之申訴）\n\n社團對於依本辦法規定做成之處分有異議者，得於處分公佈後一個月 內由社（團）長向學生申訴評議委員會提出申訴。\n\n第二十一條 （施行細則）\n\n本辦法其他程序事項，得訂定要點另行規範之。\n\n第二十二條 （施行程序）\n\n本辦法經學務會議通過，校園組公告後實施，修正時亦同。']",teacher,Misspelled queries,medium,"<1-hop>  [202204210903080158.md]

第一條

第二條

國立中山大學績優社團活動獎學金設置辦法

92 年 4 月 16 日 92 學年度第 5 次行政會議通過 97 年 6 月 18 日 96 學年度第 8 次行政會議通過 97 年 10 月 15 日 97 學年度第 3 次行政會議通過 111 年 3 月 30 日 本校 110 學年度第 2 學期第 4 次行政會議修正通過

為鼓勵本校學生參與社團活動，積極培育社團之優秀幹部，並獎勵對學 校及社區有特殊貢獻之社團，特訂定本辦法。

申請資格：

一、個人：應符合下列條件

(1)學校「社團評鑑」成績 80 分以上社團，且擔任社團負責

人、幹部職務一學期(含)以上者。

(2)擔任社團負責人、幹部期間之學期學業成績不及格科目 之學分數，未達該學期修習學分總數二分之一且未受記

過以上懲處者。

二、團體：有特殊貢獻之社團，經由學校各單位或校外相關單位推薦。

第三條 獎金金額：

一、個人：每人新臺幣陸仟元整。

二、團體：每個社團新臺幣貳萬元整。

第四條 申請時間：每年十月十五日至十月三十一日止。

第五條 申請證件：

一、個人：申請表、成績單、活動績效資料。

二、社團：推薦表及活動績效資料。

第六條 經費來源：

由本校學生公費及獎助學金項下支應，每學年頒發總金額以新臺幣五十

萬元為上限。

第七條 審查程序：

學務處校園生活與職涯發展組初審，本校獎學金管理委員會覆審；名額 得視實際需要調整。

第八條 本辦法經行政會議通過，陳請校長核定後實施，修正時亦同。","<2-hop>  [202308110945030309.md]

國立中山大學學生社團輔導辦法

97 年 04 月 11 日 96 學年度第 1 次學務臨時會議通過 100 年 06 月 28 日 99 學年度第 4 次學務會議修正通過 108 年 06 月 03 日 107 學年度第 2 次學務會議修正通過 109 年 07 月 03 日 108 學年度第 3 次學務會議修正通過 109 年 11 月 27 日 109 學年度第 1 次學務會議修正通過 111 年 03 月 30 日 110 學年度第 2 學期第 4 次行政會議修正通過

112 年 06 月 09 日 111 學年度第 2 次學務會議修正通過

第一條 （社團之宗旨）

為輔導學生參加社團活動，以充實休閒生活，提高研究興趣，陶冶合

群德性，培養領導人才，涵養服務情操，增進組織能力，訂定本辦法。

第二條 （社團之屬性）

社團，依其成立之宗旨，分為下列六種：

一、 康樂性社團：以提倡休閒康樂活動為宗旨之社團。

二、 學藝性社團：以研究技藝為宗旨之社團。

三、 服務性社團：以推廣社會服務為宗旨之社團。

四、 體育性社團：以提昇運動技術，養成終身運動習慣為宗旨之社團。

五、 學術性社團：以研究學術為宗旨之社團。

六、 音樂性社團：以倡導音樂之演出與欣賞，以愉悅身心為宗旨之社 團。

各社團於申請成立時，可選擇其屬性，經學務處校園生活與職涯發展 組（以下簡稱校園組）同意後為之；社團成立後，若因經營之宗旨或 其他原因欲變更其社團屬性者，應經校園組同意後為之。

第三條 （社團指導老師）

因應社團之專長需求，各社團可向校園組申請聘任校內外專業人士為 社團指導老師，其聘任辦法另訂之，並每學年更新其資料，以利校園 組掌握各社團指導老師之情況。指導老師聘書於社團申請聘任時由校 園組製發。

第四條 （社團之輔導及輔導老師）

社團輔導老師由校園組組員擔任，若社團遭遇重大困難，應先呈報學 生會社團部後，再會同輔導老師依個案作特別輔導。

第五條 （社（團）長及社團長大會）

社（團）長對內為社團負責人，綜理社（團）務，並對社（團）員大 會負責，對外則代表學生社團。社（團）長之產生及任期，依各社團 組織章程或相關規定辦理。

社團長大會為社團最高決策會議，由各社團之社（團）長所組成，開 會時應有二分之一以上社（團）長出席，並經出席社（團）長二分之 一以上同意做成決議。每學期期初或期末各召開一次為原則，由校園

組或學生會召開。會議紀錄須交校園組備查。

社團長大會召集目的為重大事項佈達、意見討論及社團相關委員會委 員之選任或其他與社團發展相關事項。

第六條 （學生社團設立程序）

社團之設立，申請程序如下：

一、 發起人須填寫「國立中山大學學生社團成立申請表」 ，並召集至 少 15 人（含）以上之本校學生簽署連署書，送交校園組承辦人 辦理登記，始可開始籌組社團。

二、 社團籌組期間，需擬訂「社團組織章程」之草案，送交校園組審 查通過後，始可召開社團成立大會。

三、 社團成立大會，應有連署人三分之二以上出席，會同校園組、學 生會代表各一人列席，始得召開，會中應審議「社團組織章程」 草案及選任首任社（團）長。

四、 社團成立大會結束後，應備齊會議紀錄、社團組織章程、簽到表 及幹部名冊，送交校園組承辦人，經校園組審查，且送學務處組 長會議通過後，方可成為觀察性社團。

五、 前款觀察性社團於成立六個月後，應接受最近一次之社團評鑑， 若未滿六個月亦可主動申請參與社團評鑑。觀察性社團接受社團 評鑑後，總分達六十分以上，成為正式社團。

第七條 （社團章程）

社團章程，應記載下列事項：

一、 社團正式中文及英文名稱。

二、 社團成立宗旨。

三、 組織與職掌。

四、 社員入社、退社及除名之條件。

五、 社員之權利及義務。

六、 幹部名額、權限、任期、選任及解任。

七、 會議召集及決議方式。

八、 指導老師之擬聘。

九、 經費之運用與管理。

十、 章程修改方法。

十一、 訂定章程之年月日。

第八條 （學生社團解散程序）

社團有下列行為之一者，應填具「國立中山大學學生社團停社或解散 填報表」解散其社團：

一、 社團連續兩學年度社團評鑑未達六十分者。

二、 社（團）員大會決議解散後向學生會及校園組報備。

三、 因學務會議決議懲處解散社團。

第九條 （學生社團停社）

一、 社團運作有實際困難者，經社員大會決議，得申請停社；無法召 開社員大會時，應由社團長填具停社申請書並經社團指導老師簽 準後，申請停社。

二、 社團申請停社應填具「國立中山大學學生社團停社或解散填報 表」向校園組申請停止其社團運作。

三、 社團在停社三年內，若未依相關規定成功申請復社，該社團視同 解散。

第十條 （學生社團解散後之財務管理）

社團需整理造冊清點財產，包含文件資料、器材、財務資料、其他資 料等，並由社團長與校園組依以下原則處理：

一、 器材：學校經費購置之器材，由校園組全權處理。

二、 財務資料：帳戶資料由社團辦理結清，並繳交加蓋註銷章之存摺。

三、 社團辦公室：需淨空歸還，並繳回鑰匙。

第十一條 （學生社團停社後之財務管理）

社團需整理造冊清點財產，包含文件資料、器材、財務資料、其他資 料等，並由社團長與校園組依以下原則處理：

一、 文件資料：有傳承及可供復社參閱者，由校園組保存三年，屆時 無法復社者，將依個資法辦理文件銷毀。

二、 器材：學校經費購置之器材，由校園組保存三年，屆時仍無法復 社者，將供其他社團認領，未認領之器材由校園組全權處理；完 全由社團經費自行購買之器材，由社團自行處理，未於規定期限 內處理者由校園組逕為處理。

三、 財務資料：帳戶資料由社團辦理結清，並繳交加蓋註銷章之存摺。 四、 社團辦公室：需淨空歸還，並繳回鑰匙。

第十二條 （學生社團之復社或變更社團屬性程序）

學生社團申請復社須填寫「國立中山大學學生社團復社申請表」 ，並繳 交 8 人（含）以上之本校學生簽署連署書及社團長資料卡，經校園組 審查通過後，方可復社並成為觀察性社團。

申請復社之社團於復社六個月後，應接受最近一次之社團評鑑，若未 滿六個月亦可主動申請參與社團評鑑，社團評鑑總分達六十分以上， 成為正式社團。

學生社團申請變更社團屬性須填寫「國立中山大學學生社團屬性變更 申請表」 ，並繳交社員大會會議紀錄及簽到表，經校園組審查通過後， 方可變更社團屬性。

第十三條 （活動申請）

社團舉辦活動前（平時社課不在此限） ，應由社（團）長或各社團之幹 部向校園組提出申請，申請流程如下：

一、 於國立中山大學學務綜合資訊平臺，登錄社團活動相關資料後， 列印「國立中山大學學生活動申請表」 ，送請社團指導老師簽名。

二、 依申請表之規定，由社團長及社團指導老師簽名同意後，於活動 前十日將申請表送校園組輔導老師。

三、 申請表簽核完畢後，始得申請借用場地、物品及器材等。

四、 活動結束後十日內將活動成果表送校園組輔導老師。

第十四條 （社團行文）

如有對外行文需求，應先經校園組同意後，再依本校發文程序辦理。

第十五條 （社團經費） 各社團所需經費以自籌為原則，社費之多寡由各社團自行酌定。辦理 活動時，得依「國立中山大學學生社團經費補助要點」向社團經費補 助審核委員會提出經費補助申請，並應依公告之結果於指定時間內檢 具相關資料及單據向校園組輔導老師辦理核銷，若為購置器材或物品 之經費核銷，則依本校相關規定辦理。

社團經費補助要點另訂之。

第十六條 （學生社團辦公室）

正式社團得向校園組申請社團辦公室。

社團公告，包括各社團之海報、通告、啟事或其他具宣傳、通知性之

第十七條 （社團之公告） 文書，張貼應依各場館管理辦法辦理。

社團應接受定期評鑑，其評鑑方式、時間及委員會之組成依「國立中

第十八條 （社團評鑑） 山大學學生社團評鑑實施要點」辦理。

第十九條 （社團之懲處） 社團活動如有違反法令、校規或公序良俗者應立即停止活動，並經學 生會或校園組決議後提學務會議予以懲處，懲處方式如下： 一、 停止經費補助或其他權益。

二、 解散社團。

第二十條 （社團懲處之申訴）

社團對於依本辦法規定做成之處分有異議者，得於處分公佈後一個月 內由社（團）長向學生申訴評議委員會提出申訴。

第二十一條 （施行細則）

本辦法其他程序事項，得訂定要點另行規範之。

第二十二條 （施行程序）

本辦法經學務會議通過，校園組公告後實施，修正時亦同。",202204210903080158.md,202308110945030309.md,"['社團活動', '社團活動申請']",學生事務處↔學生事務處,社團活動↔社團活動申請,5.0,5.0,5.0,5.0,5.0,2.02,5.0
請問國立中山大學中國文學系的系主任在招生委員會中扮演什麼角色？此外，系主任導師在導師制度中有哪些具體職責？,根據國立中山大學中國文學系招生委員會設置要點，系主任為招生委員會的當然委員兼召集人，主持委員會一切事宜，並且在必要時召集臨時會議。至於系主任導師在導師制度中的職責包括協調導師輔導工作的實施，檢討並改進院、系、所導師的工作，以及出席本校召開的導師會議及輔導工作相關研習會。,"['<1-hop>  [202005141626100298.md]\n\n國立中山大學中國文學系招生委員會設置要點\n\n99.10.26 99 學年度第 1 次系務會議修正通過 99.12.02 99 學年度第 2 次院務會議修訂通過 100.03.15 100 學年度碩博士班招生委員會第 3 次會議核備通過 107.06.28 中教發字第 1070700598 號國立中山大學教務處書函逕行修訂\n\n第一條 為辦理招生相關事宜，依據本校「招生規定」第二條設置「中國 文學系招生委員會」(以下簡稱本會)。\n\n第二條 本會置委員七人，系主任為當然委員兼召集人，主持本會一切事 宜，其餘委員分學術思想、文學、語言文字三個領域各兩人，由 本系所屬專任講師以上教師推選，委員皆為無給職。\n\n第三條 本會之委員任期為一年，得連任一次。\n\n第四條 本會之職掌如左：\n\n1、 議定招生簡章。\n\n2、 擬定各類班(組)別招生名額。\n\n3、 議定有關命題及閱卷相關事宜。\n\n4、 議定有關審查及面試相關事宜。\n\n5、 議定錄取標準及錄取名額。\n\n6、 研商其他招生相關事宜。\n\n第五條 本會依權責所通過之各項決議案，必要時應送系務會議審議。\n\n第六條 本會每學年度招收新生前召開會議，必要時可召開臨時會議，由 系所主管召集之。\n\n第七條 本會會議須有全體委員過半數之出席，方可開會，其決議需出席\n\n委員過半數之同意方可執行。\n\n第八條 未盡事宜，悉依本校相關規定辦理。\n\n第九條 本辦法提經系務會議通過，經院務會議審議，送校招生委員會核 備，修正時亦同。', '<2-hop>  [201909051454270360.md]\n\n國立中山大學中國文學系導師制度實施細則\n\n90.05.09 八十九學年度中國文學系第六次系務會議通過 99.03.24 九十八學年度中國文學系第五次系務會議修訂通過\n\n第一條 本細則依據「國立中山大學導師制度實施辦法」第十三條之規定，訂定 本細則。\n\n第二條 本系導師編制：\n\n一、系主任導師。\n\n二、導師。\n\n第三條 導師之聘用方式如下：\n\n一、大一由繫上安排，大二、三、四學生由學生選擇本系教師為該學 年度之導師，每位導師每學年至多輔導30名學生為原則。\n\n二、研究生亦由學生自由選擇導師，原則上由論文指導教授擔任導師； 學生尚未選指導教授者由繫上安排導師人選。\n\n三、本系得依實際需要商請本校共同科教師或具有輔導知能之師母、 職員等擔任一般導師人選，供學生選擇。\n\n四、導師因特殊原因未能按本辦法執行導師職責時，由系所主任導師 另聘適當人選擔任之。\n\n第四條 每位導師輔導學生之固定時間為每週導師時間，並列入課程表公告實施。 第五條 系主任導師之職責如下：\n\n一、協調導師輔導工作之實施，檢討並改進院、系、所導師之工作。\n\n二、出席本校召開之導師會議及輔導工作之相關研習會。 第六條 導師之職責如下：\n\n一、導師對於學生之性向、興趣、特長、學習態度及家庭環境等，應 有充分之瞭解。\n\n二、輔導學生註冊選課及參加課外活動，協助學生解決有關課業、生 活、人際及心理等適應問題。\n\n三、除「導師時間」外，導師宜利用時間參加導生之旅行、露營、參 觀、訪問、野餐、交誼、討論、座談、社會服務等活動，並隨機 予以指導。\n\n四、導師每學期應與導生個別談話兩次以上，並將要點記載於「學生 綜合資訊平臺」。學生發生重大問題，應立即依據「諮商輔導組 危機個案與導師合作處理流程」會同學務處安排個案處理。\n\n五、應於每學期學期考試前，依規定完成學生操行成績考評並登錄至 「學生綜合資訊平臺」。\n\n六、出席所屬導生之個案會議及各項導師會議。\n\n七、導師對學生之優良事蹟或嚴重過失，可簽請學務處獎懲。\n\n八、導師於辦理導生活動前後應指導學生完成「導生活動申請表」及 「導生活動成果表」，並送學務處諮商輔導組彙辦。\n\n九、導師應參加教育部或本校辦理之導師輔導知能研習活動，以增加 輔導專業智能。\n\n十、為維護學生權益之其他交辦事項。\n\n第七條 每學年由本系學生票選本系優良導師，薦選至文學院優良導師甄選委員 會議，依本校「優良導師獎勵辦法」予以獎勵。\n\n第八條 本細則經系務會議通過，並送學務處核備後實施，其修正時亦同。']",staff,Web search like queries,long,"<1-hop>  [202005141626100298.md]

國立中山大學中國文學系招生委員會設置要點

99.10.26 99 學年度第 1 次系務會議修正通過 99.12.02 99 學年度第 2 次院務會議修訂通過 100.03.15 100 學年度碩博士班招生委員會第 3 次會議核備通過 107.06.28 中教發字第 1070700598 號國立中山大學教務處書函逕行修訂

第一條 為辦理招生相關事宜，依據本校「招生規定」第二條設置「中國 文學系招生委員會」(以下簡稱本會)。

第二條 本會置委員七人，系主任為當然委員兼召集人，主持本會一切事 宜，其餘委員分學術思想、文學、語言文字三個領域各兩人，由 本系所屬專任講師以上教師推選，委員皆為無給職。

第三條 本會之委員任期為一年，得連任一次。

第四條 本會之職掌如左：

1、 議定招生簡章。

2、 擬定各類班(組)別招生名額。

3、 議定有關命題及閱卷相關事宜。

4、 議定有關審查及面試相關事宜。

5、 議定錄取標準及錄取名額。

6、 研商其他招生相關事宜。

第五條 本會依權責所通過之各項決議案，必要時應送系務會議審議。

第六條 本會每學年度招收新生前召開會議，必要時可召開臨時會議，由 系所主管召集之。

第七條 本會會議須有全體委員過半數之出席，方可開會，其決議需出席

委員過半數之同意方可執行。

第八條 未盡事宜，悉依本校相關規定辦理。

第九條 本辦法提經系務會議通過，經院務會議審議，送校招生委員會核 備，修正時亦同。","<2-hop>  [201909051454270360.md]

國立中山大學中國文學系導師制度實施細則

90.05.09 八十九學年度中國文學系第六次系務會議通過 99.03.24 九十八學年度中國文學系第五次系務會議修訂通過

第一條 本細則依據「國立中山大學導師制度實施辦法」第十三條之規定，訂定 本細則。

第二條 本系導師編制：

一、系主任導師。

二、導師。

第三條 導師之聘用方式如下：

一、大一由繫上安排，大二、三、四學生由學生選擇本系教師為該學 年度之導師，每位導師每學年至多輔導30名學生為原則。

二、研究生亦由學生自由選擇導師，原則上由論文指導教授擔任導師； 學生尚未選指導教授者由繫上安排導師人選。

三、本系得依實際需要商請本校共同科教師或具有輔導知能之師母、 職員等擔任一般導師人選，供學生選擇。

四、導師因特殊原因未能按本辦法執行導師職責時，由系所主任導師 另聘適當人選擔任之。

第四條 每位導師輔導學生之固定時間為每週導師時間，並列入課程表公告實施。 第五條 系主任導師之職責如下：

一、協調導師輔導工作之實施，檢討並改進院、系、所導師之工作。

二、出席本校召開之導師會議及輔導工作之相關研習會。 第六條 導師之職責如下：

一、導師對於學生之性向、興趣、特長、學習態度及家庭環境等，應 有充分之瞭解。

二、輔導學生註冊選課及參加課外活動，協助學生解決有關課業、生 活、人際及心理等適應問題。

三、除「導師時間」外，導師宜利用時間參加導生之旅行、露營、參 觀、訪問、野餐、交誼、討論、座談、社會服務等活動，並隨機 予以指導。

四、導師每學期應與導生個別談話兩次以上，並將要點記載於「學生 綜合資訊平臺」。學生發生重大問題，應立即依據「諮商輔導組 危機個案與導師合作處理流程」會同學務處安排個案處理。

五、應於每學期學期考試前，依規定完成學生操行成績考評並登錄至 「學生綜合資訊平臺」。

六、出席所屬導生之個案會議及各項導師會議。

七、導師對學生之優良事蹟或嚴重過失，可簽請學務處獎懲。

八、導師於辦理導生活動前後應指導學生完成「導生活動申請表」及 「導生活動成果表」，並送學務處諮商輔導組彙辦。

九、導師應參加教育部或本校辦理之導師輔導知能研習活動，以增加 輔導專業智能。

十、為維護學生權益之其他交辦事項。

第七條 每學年由本系學生票選本系優良導師，薦選至文學院優良導師甄選委員 會議，依本校「優良導師獎勵辦法」予以獎勵。

第八條 本細則經系務會議通過，並送學務處核備後實施，其修正時亦同。",202005141626100298.md,201909051454270360.md,"['系主任', '系主任導師']",文學院↔文學院 | 中國文學系↔中國文學系,系主任↔系主任導師,5.0,5.0,5.0,5.0,5.0,2.0,5.0
請問國立中山大學文學院教師升等計分表中，學術產學研究績效的計分方式是如何分配的？並且根據中國文學系教師升等審查辦法，學術研究類與教學研究類的初審計分比例分別是什麼？,根據國立中山大學文學院教師升等計分表，學術產學研究績效分為A1與A2兩部分，A1為學術研究成果外審成績，A2為七年內本職級研究計畫獎助及學術成就。學術產學研究績效的滿分為70分，A1佔70％，其中A1占75％，A2占25％。根據國立中山大學中國文學系教師升等審查辦法，學術研究類的初審計分比例為學術研究佔70％、教學績效佔20％、服務成績佔10％；教學研究類的初審計分比例為教學研究佔60％、教學績效佔30％、服務成績佔10％。,"['<1-hop>  [202509142218250731.md]\n\n國立中山大學文學院教師升等計分表 -劇藝系專用\n\n112 年 4 月 27 日 111 學年度第 422 次校教評會審議通過，並自 111 學年度第 2 學期生效\n\n系所（組） ：\n\n姓名：\n\n擬升等職級：\n\n現任職級生效日：\n\n各類升等\n\nA. 學術產學研究績效 (A1+A2):\n\n(1) 一般研究類：滿分\n\n70 分\n\n(2) 技術應用類：滿分\n\n70 分\n\n(3) 教學研究類：滿分\n\n60 分\n\n(4) 展演藝術類：滿分\n\n70 分\n\nA1: 學術研究成果外審成績：\n\n(a) 一般研究類：滿分\n\n52.5 分\n\n(b) 技術應用類：滿分\n\n28 分\n\n(c) 教學研究類：滿分\n\n36 分\n\n(d) 展演藝術類 :\n\n滿分 52.5 分\n\nA2: 七年內本職級研究計畫獎助及學術成就：\n\n(a) 一般研究類：滿分\n\n17.5 分\n\n(b) 技術應用類：滿分\n\n42.0 分\n\n(c) 教學研究類：滿分\n\n24 分\n\n(d) 展演藝術類 : 滿分 17.5\n\n(4) 所有積分均僅採計現職級之績效，上一職級之研究產學績效不得計入； 有跨職級之績效，只可在其中一次升等計分。\n\n(5) 以經費計分之項目，金額不含本校相關配合款及移撥至校外共同主持人 之部分經費。\n\nB. 教學績效 :\n\n(1) 一般研究類 :\n\n滿分 20 分\n\n(2) 技術應用類 :\n\n滿分 20 分\n\n(3) 教學研究類 :\n\n滿分 30 分\n\n(4) 展演藝術類 :\n\n滿分 20 分\n\nC. 服務績效 : 滿分 10 分\n\n擬申請升等類型：□一般研究類\n\n[ ] □技術應用類\n\n[ ] □教學研究類\n\n[ ] □展演藝術類\n\n申請教師簽章：\n\n[ ] （ 日期\n\n範例]\n\n不予計分\n\n案例五\n\n50分\n\n8分\n\n案例四\n\n42分[技術應用上限]\n\n12分\n\n案例三\n\n30分\n\n12.5分\n\n案例二\n\n17.5分 [一般研究上限]\n\n7.5分\n\n案例一\n\n10分\n\n10\n\n20\n\n30\n\n40\n\n50\n\n(累計得分)\n\nA. 學術產學研究績效 (A1+A2) A1. 學術研究成果外審成績 項目 評分原則 - 以絕對分數採計 自評 審核 A1a 外審成績：審查人員（一） 依本校教師升等計分表、教師升等審查辦法、教師升等著作審查意見表及文學院教師 升等審查要點換算 A1b 外審成績：審查人員（二） A1c 外審成績：審查人員（三） A1d 外審成績：審查人員（四） A1e 外審成績：審查人員（五） 五位審查人員外審成績總和 總平均分數 總平均分數 A1. 小計 ( 以絕對分數採計 ) □ (1) 一般研究類： A1 滿分 52.5 分（ A 佔 70 ％； A1:75% ， A2:25 ％） □ (2) 技術應用類： A1 滿分 28 分（ A 佔 70 ％； A1: 40% ， A2:60 ％） □ (3) 教學研究類： A1 滿分 36 分（ A 佔 60 ％； A1: 60% ， A2:40 ％） □ (4) 展演藝術類： A1 滿分 52.5 分（ A 佔 70 ％； A1:75% ， A2:25 ％）\n\nA2. 七年內本職級研究計畫獎助及學術成就 項目 評分原則 - 以絕對分數採計 自評 審核 (1) 「國家科 學及技術 (1) 「國家科學及技術委員會」專題研究計畫：研發處依計畫核定清單認定之。 (a) 個別型研究計畫：計畫執行六個月 ( 含 ) 以上，每年第一件得 2 分，第二件得 3 分。計畫執行未達六個月，每件 1 分。 (b) 整合型研究計畫（多張核定清單）： I. 總主持人：每件 3 分。\n\nA2. 七年內本職級研究計畫獎助及學術成就 委員會」 專題計畫 II. 子計畫主持人 ( 不包括總主持人 ) ：每件 2 分。 (c) 單一整合型研究計畫（單張核定清單）：研發處依計畫核定清單認定之，本項總計最高 8 分為上限。 補助經費累計達 100 萬元，得 1 分；超過 100 萬元之部分，每 50 萬元得 0.5 分。每件計畫共同主持人配分必須於計畫核定後 3 個月內，由所有主持人簽名確認個人貢獻，依比例分配計分，且不得再變更分配比例。 (2) 「國家科 學及技術 委員會」 人文社會 實踐計畫 註：同一計畫在 A2 之第 (1) 項、第 (2) 項、第 (6) 項、第 (7) 項僅能擇一計分。 (2) 「國家科學及技術委員會」人文社會實踐計畫 : 研發處依計畫核定清單認定之，本項總計最高 8 分為上限。 補助經費累計達 100 萬元，得 1 分；超過 100 萬元之部分，每 50 萬元得 0.5 分。每件計畫共同主持人配分必須於計畫核定後 3 個月內，由所有主持人簽名確認個人貢獻，依比例分配計分，且不得再變更分配比例。 註：同一計畫在 A2 之第 (1) 項、第 (2) 項、第 (6) 項、第 (7) 項僅能擇一計分。 (3) 教育部專 題研究計 畫 (3) 教育部專題研究計畫 : 研發處依計畫核定清單認定之。本項總計最高以 8 分為上限。 計畫執行六個月 ( 含 ) 以上，每年第一件得 2 分，第二件得 3 分。計畫執行未達六個月，每件 1 分。 註：同一計畫在 A2 之第 (3) 項與第 (12) 項、第 (13) 項僅能擇一計分。 (4) (4) 學術榮譽 : 研發處認定之。同一獎項最多採計二次 (a) 總統級及政府院級學術類獎項，每次得 15 分 (b) 教育部學術獎，每次得 14 分 (c) 「國家科學及技術委員會」傑出研究獎，每次得 12 分 (d) 年度高被引用學者，每次得 5 分 (e) 除「國家科學及技術委員會」與教育部之外，其他行政院所屬中央二級機關學術類獎項，每次得 5 分 (f) 國際知名學會 ( 會員人數 1 萬人以上 ) 獎項，每次得 5 分 (g) 中央研究院年輕學者研究著作獎，每次得 4 分 (h) 「國家科學及技術委員會」吳大猷先生紀念獎，每次得 4 分 (i) 國內財團法人獎項 ( 獎項成立 10 年以上 ) ，每次得 1~3 分 (j) 國內學會獎項 ( 學會成立 20 年以上 ) ，每次得 2 分 (k) 本校傑出教師 ( 學術研究類 ) 獎勵，每次得 2 分 (l) 本校績優教師 ( 學術研究類 ) 獎勵，每次得 1 分 學術榮譽 (5) 出版學術 研究專書 (5) 出版學術研究專書 ( 有國際標準書號 ISBN) ：應檢附學術審查證明，經研發處召開專家審查委員會認定之。本項總計最高 4 分為上限。 (a) 個人學術著作專書：外文每一本 1~4 分、中文每一本 1~3 分 (b) 翻譯著作：每一本 1~2 分 註 : 多人著作：同一本著作依個人貢獻比例分配計分，且須由所有作者簽名確認個人貢獻，經委員會認定後不得再變更貢獻 比例。\n\nA2. 七年內本職級研究計畫獎助及學術成就 (6) 「國家科 學及技術 委員會」 產學合作 研究計畫 (6) 「國家科學及技術委員會」產學合作研究計畫及文化部計畫：產學處依計畫核定清單認定之。 (a) 「國家科學及技術委員會」產學合作個人型研究計畫及文化部計畫 ( 限文學院 ): 計畫執行六個月 ( 含 ) 以上，每年第一件得 2 分，第二件得 3 分。計畫執行未達六個月，每件 1 分。 (b) 「國家科學及技術委員會」產學合作整合型研究計畫 ( 多張核定清單 ): I. 總主持人 : 每件 3 分。 II. 共同主持人 ( 不包含總主持人 ): 每件 2 分。 (c) 「國家科學及技術委員會」產學合作單一整合型研究計畫 ( 單張核定清單 ) ：本項總計最高 8 分為上限。 補助經費累計達 100 萬元，得 1 分；超過 100 萬元之部分，每 50 萬元得 0.5 分。每件計畫共同主持人配分必須於計畫核定 後 3 個月內，由所有主持人簽名確認個人貢獻，依比例分配計分，且不得再變更分配比例。 註 : 同一計畫在 A2 之第 (1) 項、第 (2) 項、第 (6) 項、第 (7) 項僅能擇一計分。 (7) 政府機關 產學合作 計畫 (7) 政府機關產學合作計畫 ( 不含「國家科學及技術委員會」產學計畫 ): 產學處依計畫核定清單認定之。 (a) 文 ( 劇藝系及音樂系除外 ) 、管、社、醫 ( 醫學人文及教育教師 ) 、西灣學院，及海科院具有人文、法政、社經、管理專 長等之政府機關委託產學合作計畫：計畫累計金額達 40 萬元者得 1 分，超過 40 萬元之部份，每 10 萬元得 0.1 分。 (b) 文 ( 限劇藝系及音樂系 ) 之政府機關委託產學合作計畫：計畫累計金額達 20 萬元者得 0.5 分，超過 20 萬元之部份，每 5 萬 元得 0.1 分。 (c) 理、工、醫 ( 一般教師 ) 、海科院之政府機關委託產學合作計畫：計畫累計金額達 75 萬元者得 1 分，超過 75 萬元之部份， 每 15 萬元得 0.1 分。 註： I. 同一計畫在 A2 之第 (1) 項、第 (2) 項、第 (6) 項、第 (7) 項僅能擇一計分。 II. 每件計畫共同主持人配分必須於計畫核定後 3 個月內，由所有主持人簽名確認個人貢獻，依比例分配計分，且計畫執行 期間不得再變更分配比例。 (8) 非政府產 學合作計 畫 (8) 非政府機關 ( 企業與法人 ) 委託產學合作計畫 : 產學處依委託合約書認定之。 (a) 文 ( 劇藝系及音樂系除外 ) 、管、社、醫 ( 醫學人文及教育教師 ) 、西灣學院，及海科院具有人文、法政、社經、管理專 長等之非政府機關委託產學合作計畫：計畫累計金額達 40 萬元者，得 1 分，超過 40 萬元之部份，每 10 萬元得 0.2 分。 (b) 文 ( 限劇藝系及音樂系 ) 之非政府機關委託產學合作計畫：計畫累計金額達 20 萬元者得 0.5 分，超過 20 萬元之部份，每 5 萬元得 0.125 分。 (c) 理、工、醫 ( 一般教師 ) 、海科院之非政府機關委託產學合作計畫：計畫累計金額達 75 萬元者得 1 分，超過 75 萬元之部 份，每 15 萬元得 0.2 分。 註：每件計畫共同主持人配分必須於計畫核定後 3 個月內，由所有主持人簽名確認個人貢獻，依比例分配計分，且計畫執行 期間不得再變更分配比例。 (9) 技術移轉 或著作授 權 (9) 技術移轉或著作授權 : 產學處依技轉合約認定之，主要發明人與產業界 ( 含企業與法人 ) 辦理技術移轉或著作授權，本項總計 最高 8 分為限。 (a) 以職務成果技術移轉或著作授權 : 累計授權金額達 20 萬元者，得 0.5 分；超過 20 萬元之部份，每 10 萬元得 0.2 分。 (b) 以中華民國獲證之發明或設計專利授權 : 累計授權金額達 20 萬元者，得 1 分；超過 20 萬元之部份，每 10 萬元得 0.2 分。 (c) 以美、日、歐盟等國外專利授權 : 累計授權金額達 20 萬元者得 1.5 分，超過 20 萬元之部份，每 10 萬元得 0.4 分。 (10) (10) 專利 : 經產學處依發明專利證書認定之，主要發明人之研究成果以學校名義申請，獲得發明或設計專利；或以個人名義申 請，獲得之發明或設計專利讓與學校。以上與廠商共同申請者，皆不列計。本項總計最高 3 分為限。 (a) 中華民國專利 : 每件 0.5 分。 (b) 美、日、歐盟專利 : 每件 1 分。 (c) 其他國家專利，由產學處認定之，每件 0.1~0.5 分。 專利\n\nA2. 七年內本職級研究計畫獎助及學術成就 (11) 產學榮譽 (11) 產學榮譽 : 產學處認定之。 (a) 總統級及政府院級產學類獎項；每次加 15 分。 (b) 「國家科學及技術委員會」傑出技術移轉貢獻獎，每次加 7.5 分。 (c) 經濟部國家產業創新獎，加 7.5 分。 (d) 經濟部智慧局國家發明創作獎，每次加 4 分。 (e) 除「國家科學及技術委員會」與經濟部之外，其他行政院所屬中央二級機關產學類獎項，每次得 3-4 分。 (f) 未來科技 ( 突破 ) 獎，每次加 2 分。 (g) 國家新創獎，每次加 2 分。 (h) 學術創業先鋒獎，每次加 2 分。 (i) 本校產學傑出獎或傑出教師 ( 產學研究類 ) 獎勵，每次得 2 分。 (j) 本校績優教師 ( 產學研究類 ) 獎勵，每次得 1 分。 註： I. 同一獎項最多採計二次。 II. 每一獎項共同主持人配分必須於獎項核定後 3 個月內，由所有主持人簽名確認個人貢獻，依比例分配計分，且不得再 變更分配比例。 (12) 教育部教學相關計畫 : 教務處依計畫核定清單認定之，本項總計最高以 8 分為上限。 (12) 教育部教 學相關計 畫 (a) 個別型教學計畫主持人：計畫執行六個月 ( 含 ) 以上，每年第一件得 2 分，第二件得 3 分。計畫執行未達六個月，每件 1 分。 (b) 整合型教學計畫： I. 總主持人：每件 3 分。 II. 共同主持人 ( 不包括總主持人 ) ：每件 2 分。 III. 計畫參與教師（不含總主持人及共同主持人）：補助金額 600 萬元以上之計畫，每超過 50 萬元得採計 0.5 分，至多採 計 3 分，並依教師貢獻比例分配給計畫參與教師，每位至多 1.5 分。 註：同一計畫在 A2 之第 (3) 項、第 (12) 項、第 (13) 項僅能擇一計分。 (13) 教育部教 學實踐研 究計畫 (13) 教育部教學實踐研究計畫 : 教務處依計畫核定清單認定之。 每年每件得 2 分；若計畫獲教育部頒績優獎項者，再加 1 分。 註：同一計畫在 A2 之第 (3) 項、第 (12) 項、第 (13) 項僅能擇一計分。 (14) （ 14 ）本職級未送外審之展演作品 :( 未送外審之展演與設計作品 ) 本職級未 送外審之 展演作品 一級展演作品發表 3 分 二級展演作品發表 1.5 分\n\nA2. 七年內本職級研究計畫獎助及學術成就 (15) 傑出 文藝成就 傑出文藝成就獎項計分標準 區分等級 項次 學術成就獎名稱 核發獎項單位 得分 ( 院教評會審核 ) A 級 1 2 國家文藝獎 葛萊美獎 國家文藝基金管理委員會 美國錄音學院 14 分 B 級 3 吳三連文藝獎 吳三連獎基金會 5 分 C 級 4 行政院文化獎 （含原文建會翻譯獎） 文化部 4 分 C 級 5 金曲獎 文化部 4 分 C 級 6 金馬獎 文化部 4 分 C 級 7 金鐘獎 文化部 4 分 C 級 8 金鼎獎 文化部 4 分 D 級 9 教育部文藝創作獎 教育部 3 分 D 級 10 高雄市文藝獎各類首獎 高雄市文化基金會 3 分 (16) 其他 學術（含 文藝）成 就 11 時報文學獎首獎 中國時報 (16) 其他學術或展演（含文藝）成就（由院教評會審議，至多 4.2 分） A2. 小計 □ (1) 一般研究類： A2 滿分 17.5 分（ A 佔 70 ％； A1:75% ， A2:25 ％） □ (2) 技術應用類： A2 滿分 42 分（ A 佔 70 ％； A1: 40% ， A2:60 ％） □ (3) 教學研究類： A2 滿分 24 分（ A 佔 60 ％； A1: 60% ， A2:40 ％） □ (4) 展演藝術類： A1 滿分 17.5 分（ A 佔 70 ％； A1:75% ， A2:25 ％） A. 學術 產學研 究績效 小計 學術產學研究績效（ A1+A2 ）小計 □ (1) 一般研究類： A 滿分 70 分 □ (2) 技術應用類： A 滿分 70 分 □ (3) 教學研究類： A 滿分 60 分 □ (4) 展演藝術類： A 滿分 70 分 小計 小計\n\nB. 教學績效 指標項目 評分原則（以絕對分數採計） 各項目採計上限 自評 審核 指標項目 □(1)一般研究類 : 滿分 20 分 □(2)技術應用類 : 滿分 20 分 □(3)教學研究類 : 滿分 30 分 □ (4) 展演藝術類：滿分 20 分 □一般研究類 : □技術應用類 : □展演藝術類 : 滿分 20 分 □教學研究類 : 滿分 30 分 (1) 教學年資 在本校升等時職級滿三年為 7 分；超過三年部分每增加授課一學期加 0.2 分。他校年 資及育嬰留職停薪期間之年資折半計算。 8 分 8 分 (2) 教學貢獻 度 (a) 升等時職級近五年內學期平均授課時數： 每一時數得 0.5 分，主管或其他可抵減時數應加回計算，至多 5 分。（專班課程 時數併入計算。） (b) 教學當量： 教師於現職職級之平均教學當量達各學院前 10 ％者，每學期加計 0.2 分。 (c) 開設基礎必修課程 *: 教師開設大學部必修課程 ( 不含通識課程 ) ，每開一門加計 0.2 分，多人合授依授 課比例合計給 0.2 分。 (d) 開設通識課程 * ： I. 西灣學院主聘教師開設通識課程 ( 採計跨院選修、博雅及專業服務學習、必修 運動與健康課程、語文課程 ) ，每開一門加計 0.2 分；多人合授依授課比例合 計給 0.2 分。 ( 該項最多 2 分 ) II. 非西灣學院主聘教師支援開設通識課程 ( 採計博雅及專業服務學習課程、語 文課程 ) ，每開一門加計 0.4 分；多人合授依授課比例合計給 0.4 分。 ( 該項最 多 2 分 ) III. 非西灣學院主聘教師支援開設跨院選修通識課程，每開一門加計 0.2 分；多 人合授依授課比例合計給 0.2 分。 ( 該項最多 2 分 ) (e) 出版教科書 ( 有國際標準書號 ISBN) ，經院教評會認定，每本 1-2 分。 註：多人著作：同一本著作依個人貢獻比例分配計分，且須由所有作者簽名確 認個人貢獻，經院教評會認定後不得再變更貢獻比例。 7 分 8 分 (3) 教學榮譽 教學榮譽：教務處認定之。 (a) 教育部師鐸獎，每次 7.5 分。 (b) 教育部全國傑出通識教育教師獎，每次 7.5 分。 (c) 本校傑出教學獎 ( 教學傑出教師 ) ，每次 2 分。 (d) 本校優良教學獎 ( 教學績優教師 ) ，每次 1 分。 (e) 全國教育類貢獻獎（例如：教育部教育奉獻獎、社會教育貢獻獎、藝術教育貢獻 獎等），每次 5 分。 (f) 通識教育學會： I. 「終身成就榮譽」，每次 2 分 II. 「典範通識教師」，每次 1.5 分。 註：同一獎項最多採計二次 15 分 15 分\n\nB. 教學績效 教學優良 課程 獲頒校級教學優良課程，每門課程加 0.2 分。 2 分 3 分 (4) (5) 全英語授 課課程 * (a) 外文系專任教師每開一門全英語講授類課程，加 0.2 分；多人合授依授課比例合 計給 0.2 分。 ( 該項最多 2 分 ) (b) 非外文系專任教師每開一門全英語講授類課程，加 0.4 分；多人合授依授課比例 合計給 0.4 分。 ( 該項最多 4 分 ) 4 分 4 分 (6) 數位學習 課程績效 推動數位學習課程 ( 下面各項不重複計分 ) (a) 獲得教育部數位學習教材及課程認證： 每科教材或每門課程加 1 分；多人合製一門 ( 科 ) 依授課比例合計給 1 分。 (b) 通過本校數位課程認證： 每門課程加 0.5 分；多人合製一門 ( 科 ) 依授課比例合計給 0.5 分；教師開設開放 式課程，每門課程加 0.2 分；多人合製一門 ( 科 ) 依授課比例合計給 0.2 分。 (c) 國際合作 EMI 數位課程： 與國外教師合作開設 EMI 數位學分課程，每門課 0.5 分。 3 分 4 分 (7) 指導學生 研究績效 (a) 指導研究生論文得獎 指導研究生之碩博士學位論文得獎，由教務處認定，每件加計 1 分。 (b) 指導大專學生研究計畫 指導學生獲「國家科學及技術委員會」大專學生研究計畫，由研發處認定，每 件加 0.2 分。若計畫獲大專學生研究創作獎，每件再加 0.5 分。 4 分 4 分 (8) 執行卓越 教學計畫 與高教深 耕教學創 新計畫 （含擔任 學分學程 負責人） (9) (a) 執行由教務處審查之卓越教學計畫與高教深耕教學創新計畫案，每年每件 0.2 分。 (b) 擔任學分學程負責人，每學期每學程 0.1 分。若學程當學期在校修讀人數高於平 均值，加計 0.1 分；若學程當學年度領證人數高於平均值，再加計 0.1 分。 (c) 擔任全英語微學程及學分學程負責人，以上開 2 倍計分。 2 分 4 分 協助教師 提升教學 知能 (a) 擔任教學研習、工作坊等教學活動之主講者，或領航教師有實際輔導事實者，由 教務處認定，每場次 0.2 分。 (b) 擔任全英語教學研習、工作坊等教學活動之主講者，或經教務處推薦為教學觀摩 教師且有實際觀摩事實者，每場次 0.3 分。 (c) 對本校或各學院推動教學創新貢獻卓著者（如推動本校雙語教學計畫），經校內 程序簽核通過，由教務處認定，每件加計 0.2~0.5 分。 3 分 3 分\n\nB. 教學績效\n\n(10) 自我提升 教學知能 (a) 申請觀課服務教師：（本項最高 3 分） 申請觀課服務教師（含 EMI ）經教務處核准，且實際有觀課事實者，每次 0.3 分，若同儕觀課評量平均滿意度 6 分以上（七分量表），加計 0.3 分。 (b) 於本校任職後取得 EMI 教師培訓認證，並符合本校 EMI 教師培訓計畫者，每證 書 1 分（各級證書僅可採計一次），本項最高 3 分。 (c) 參與教學知能提升：（本項最高 2 分） 參與校內教學知能研習、工作坊或教師社群有具體事實者，由教務處認定，每 場次 0.1 分。 3 分 4 分 (11) 其他明顯 教學優良 或教學不 力，有具 體證據者 (11) ：其他明顯教學優良或教學不力，有具體證據者，由教評會適度加減分，最多 不得超過限分 0.6 分 0.9 分 B. 教學績 效小計 B. 教學績效 (1)-(11) 小計 □(1)一般研究類 : 滿分 20 分 □(2)技術應用類 : 滿分 20 分 □(3)教學研究類 : 滿分 30 分 □ (4) 展演藝術類：滿分 20 分 小計 小計 備註： 1.* 有關「通識課程」、「全英語授課課程」及「基礎必修課程」依據「本校教學意見調查追蹤改善精進教學辦法」所訂，符合下列任 一條件者，不予計分： (1) 教學意見調查滿意度在 4.2 分以下（七分量表）。 (2) 教學意見調查滿意度在 4.9 分以下（七分量表），且該課程授課教師兩年內「畢業生對系所與任課教師滿意度問卷」回收卷數達 10 份以上，其對教師滿意度在 3.5 分以下（五分量表）或 4.9 分以下（七分量表）。 2. 所有積分均僅採計現職職級，上一職級之教學貢獻不得計入。\n\nC. 服務績效 評分原則（絕對分數） 各項目採計上限 自評 審核 項目 服務評分 : （滿分 10 分） 滿分 10 分 (1) 校級會議代表 校級會議代表每學年 0.1 分 分 (2) 院級會議代表 院級會議代表每學年 0.1 分 分 (3) 校級服務 ( 由 (3-1)-(3-11) 加 總計分 ) 分 (3) 小計 (3) 小計 (3-1) 擔任編制內行政、學 術主管 (3-1) 擔任編制內行政、學術主管 : 擔任編制內一級主管每學期加 1 分，二級主管每學期加 0.5 分 ( 未滿一學期，以一 學期計算 ) 。如同時擔任二個以上行政或學術主管者，依上開標準分別採計計 分。 分 (3-2) 支援推廣教育課程 (3-2) 開設推廣教育課程，由全球產學營運及推廣處認定。 (a) 教師以講授推廣教育課程，累積收入達 100 萬元或累積貢獻校管理費達 10 萬元，得 0.5 分。收入超過 50 萬元或管理費超過 10 萬元，依比例計算。 (b) 教師開設隨班附讀課程且有學生修習者，每門課得計 0.1 分。 每門推廣教育課程不得重複計分，若為共授課程，必須由所有參與教師 簽名確認個人貢獻，依比例分配計分。 分 (3-3) 支援高中生多元學習 (3-3) 支援高中生多元學習 : 由教務處認定。 (a) 協助招生專業化相關事項，如擔任學系種子教師、於高中端交流活動擔 任主講人、審查高中學生自主學習計畫等，每件 0.1 分。 (b) 開放本校實驗室指導高中學生並有實際指導事實者 ( 若未透過教務處媒 介，則經系所認定，教務處複查 ) ，每學期 0.2 分。 ( 該項最多 2 分 ) (c) 教師支援高中特色課程（含 6 週以上之微課程），每開一門加計 0.5 分， 多人合授一門合計給 0.5 分。 ( 該項最多 2 分 ) 分\n\nC. 服務績效 (3-4) 指導學生參與競賽獲 獎 (3-4) (a) 國際競賽 : 指導本校學生參加國際競賽獲前三名，每件加 3 分，獲佳 作及得獎者每 件加 0.5 分。 (b) 政府單位舉辦之國內學術、產學與展演等競賽 : 指導本校學生參加國內學術、產學與展演等競賽，獲前三名每件加 1.5 分，獲佳作及得獎者每件加 0.25 分。 (C) 指導本校學生參加全國大專運動會及大專校院運動聯賽，獲前三名每次加 1.5 分，進入決賽未獲前三名每次加 0.25 分。 分 (3-5) 支援招生工作 (3-5) 支援招生工作 : 由教務處認定。 (a) 擔任教務處主辦之校內外招生宣導活動主講者，每次 0.1 分。 (b) 支援大考中心或企業委辦本校招生考試或本校自辦招生考試之相關工作 ( 含命題、入闈、監考、審查、口試等 ) ，每次 0.1 分。 分 (3-6) 推動性別平等教育 (3-6) 推動性別平等教育 : 由學務處認定。 推動性別平等教育工作，友善校園，每學年 0.2 分。 分 (3-7) 本校優良導師獎 (3-7) 本校優良導師獎，每次 1 分。 分 (3-8) 推動社團活動 : (3-8) 輔導社團活動及學生自治性組織 : 由學務處認定。 (a) 擔任學生會、宿委會、校內社團之指導老師或學生運動代表隊教練，每學 年 0.3 分。 (b) 擔任國際化和英語化學生社團之指導老師，每學年 0.4 分。 分 (3-9) 推動雙語校園 (3-9) 推動雙語校園， (a) 指標由教務處認定，其餘由國際處認定。 (a) 推動 English Corner 計畫，成效良好者。 ( 每學期 0.4 分 ) (b) 代表本校接洽校級國際合作聯盟 ( 例如 AIT 、 BRITISH COUNCIL 、 OSUN) 有 定期參與及合作成果者，可依其擔任本校代表之時間給予獎勵，每學期 0.5 分。 (c) 擔任校院系雙語化公文及會議資料之行政窗口，每學期 0.5 分。 分 （ 3-10 ） 推動校園藝文活動 (3-10) 主辦校級大型藝文活動（如：校慶等） ：由秘書室認定。 每次加 0.5 分。 分\n\nC. 服務績效 (3-11) 國際化指標 (3-11) 國際化指標，由國際處認定。 (a) 促成本校與外國學校洽簽雙聯學位教師 I. 外國學校排名在本校之前者， 每校 1 分。 II. 外國學校排名在本校之後者，每校 0.5 分。 (b) 國際招生活動 I. 教師自行聯繫參訪，每次 0.5 分。 II. 教師參與國際處安排招生展或參訪，每次 0.2 分。 III. 教師參與線上招生 Webinar ，每次 0.1 分。 (c) 指導外籍碩博士學位生 I. 每位博士生畢業，每人 0.5 分。 II. 每位畢業碩士生畢業，每人 0.2 分。 (d) 其他國際合作 I. 辦理跨國研習活動 ( 如 workshop, training 等 ) ，每場 0.2 分。 II. 參與國際合作計畫 ( 非研究類，如參與辦理國際大型活動、帶領學生 參與國際志工或活動等 ) ，每場 0.2 分。 III. 選送學生至國外合作單位學習，每人 0.2 分。 分 (4) 大型會議或活動 之籌備小組成員 大型會議或活動之籌備小組成員 每次 0.1-0.2 分（院教評會評定，至多 1 分） 1 分 (5) 院優良導師獎 院優良導師獎，每次 0.5 分 分 (6) 校外服務 校外服務（至多 0.8 分，院教評會評定） 0.8 分 C. 服務績效小計 C. 服務績效 (1)-(6) 及各類跨域活動參與至多 7 分 ( 依「國立中山大學文學 院教師升等審查評分細則」達基本門檻者 ) ，滿分 10 分 分 小計 小計 總分 (=A+B+C) 分', '<2-hop>  [202005141641090311.md]\n\n國立中山大學中國文學系教師升等審查辦法\n\n83.01.14 82 學年度中文系所教師評審委員會議通過 85.12.11 85 學年度第 4 次系務會議修正通過 89.10.04 89 學年度第 1 次系務會議修正通過 89.12.13 89 學年度第 2 次系務會議修正通過 89.12.21 89 學年度第 6 次院教評會通過 90.09.26 90 學年度第 1 次系務會議修正通過 91.03.26 90 學年度第 6 次院教評會通過 93.04.21 92 學年度第 4 次系務會議修正通過 93.06.01 92 學年度第 5 次系務會議修正通過 93.06.08 92 學年度第 11 次院教評會通過 97.06.19 96 學年度第 6 次系務會議修正通過 97.10.02 97 學年度第 1 次院教評會通過 102.09.25 102 學年度第 1 次系務會議修正通過 102.10.18 102 學年度第 2 次院教評會修正通過 103.02.27 102 學年度第 6 次院教評會修正通過 103.05.21 102 學年度第 8 次院教評會修正通過 106.03.01 105 學年度第 5 次系教評會修正通過 學年度第 6 次系務會議修正通過 106.04.20 105 學年度第 6 次院教評會修正通過 107.05.15 105 學年度第 7 次系教評會修正通過 107.05.16 106 學年度第 8 次系務會議修正通過 107.06.14 106 學年度第 8 次院教評會修正通過 107.07.06 陳核通過\n\n一、本系為辦理教師升等，依據本校「教師評審委員會設置辦法」第二條之規定及本校、本 院教師升等審查相關法規，訂定本辦法。\n\n二、凡符合本校與文學院教師升等審查辦法規定之教師，得於每學期正式上課日一週前向 系主任申請升等，並提交下列資料：\n\n（一） 「國立中山大學教師升等送審資料項目表」所列初審應繳資料及表件。\n\n（二）文學院教師升等初審作業規定之表件。\n\n（三） 「國立中山大學中國文學系教師升等計分表」 （學術研究類或教學研究類）及相 關資料。\n\n（四）送審著作一式四份。\n\n三、系主任接獲教師升等之申請後，將上述資料公開陳列（一週） ，供全系教師閱覽，隨後召 開系教師評審委員會進行資格審查。並於當學期正式上課後十日內，將通過資格審查者 資料彙送文學院教師評審委員會辦理著作審查。\n\n四、擬升等教師所提送審著作應符合文學院教師升等審查辦法第二條之規定。著作審查由院 長聘請校外適格之學者專家三人審查。審查人選由系教評會擬提具有充分專業能力之校 外學者專家七人以上（院長得增列審查人選） ，簽請院長召集院教評會委員若幹人圈定三 人後，由文學院辦理著作外審，外審成績結果送回本系初審。外審學者應迴避申請人原 畢業學校之教授。\n\n五、依據本校「教師及研究人員升等審查辦法」第四條規定，本系教師評審委員會應就升 等教師之學術研究或教學研究、教學、服務等三項評定成績，成績總分達七十分（含） 以上者通過初審。本系教師升等初審其計分比例與項目如下：\n\n（一）學術研究類：學術研究佔百分之七十、教學績效佔百分之二十、服務成績佔百分 之十。\n\n學術研究與教學績效計分方式依「國立中山大學文學院教師升等計分表－學術研 究類」所列項目計分。服務成績計分方式依「國立中山大學中國文學系教師升等 服務成績評分原則」所列項目計分。\n\n（二）教學研究類：教學研究佔百分之六十、教學績效佔百分之三十、服務成績佔百分 之十。\n\n教學研究與教學績效計分方式依「國立中山大學文學院教師升等計分表－教學研 究類」所列項目計分。服務成績計分方式依「國立中山大學中國文學系教師升等 服務成績評分原則」所列項目計分。\n\n六、初審結果若不通過，系教師評審委員會召集人應以書面敘明理由通知申請人。申請人對 於初審結果若有異議，得依本校相關辦法及程序提出申復（或申訴） 。\n\n七、本辦法經系務會議通過，送院教評會審議通過，送請校長核定後實施，修正時亦同。']",staff,Poor grammar,long,"<1-hop>  [202509142218250731.md]

國立中山大學文學院教師升等計分表 -劇藝系專用

112 年 4 月 27 日 111 學年度第 422 次校教評會審議通過，並自 111 學年度第 2 學期生效

系所（組） ：

姓名：

擬升等職級：

現任職級生效日：

各類升等

A. 學術產學研究績效 (A1+A2):

(1) 一般研究類：滿分

70 分

(2) 技術應用類：滿分

70 分

(3) 教學研究類：滿分

60 分

(4) 展演藝術類：滿分

70 分

A1: 學術研究成果外審成績：

(a) 一般研究類：滿分

52.5 分

(b) 技術應用類：滿分

28 分

(c) 教學研究類：滿分

36 分

(d) 展演藝術類 :

滿分 52.5 分

A2: 七年內本職級研究計畫獎助及學術成就：

(a) 一般研究類：滿分

17.5 分

(b) 技術應用類：滿分

42.0 分

(c) 教學研究類：滿分

24 分

(d) 展演藝術類 : 滿分 17.5

(4) 所有積分均僅採計現職級之績效，上一職級之研究產學績效不得計入； 有跨職級之績效，只可在其中一次升等計分。

(5) 以經費計分之項目，金額不含本校相關配合款及移撥至校外共同主持人 之部分經費。

B. 教學績效 :

(1) 一般研究類 :

滿分 20 分

(2) 技術應用類 :

滿分 20 分

(3) 教學研究類 :

滿分 30 分

(4) 展演藝術類 :

滿分 20 分

C. 服務績效 : 滿分 10 分

擬申請升等類型：□一般研究類

[ ] □技術應用類

[ ] □教學研究類

[ ] □展演藝術類

申請教師簽章：

[ ] （ 日期

範例]

不予計分

案例五

50分

8分

案例四

42分[技術應用上限]

12分

案例三

30分

12.5分

案例二

17.5分 [一般研究上限]

7.5分

案例一

10分

10

20

30

40

50

(累計得分)

A. 學術產學研究績效 (A1+A2) A1. 學術研究成果外審成績 項目 評分原則 - 以絕對分數採計 自評 審核 A1a 外審成績：審查人員（一） 依本校教師升等計分表、教師升等審查辦法、教師升等著作審查意見表及文學院教師 升等審查要點換算 A1b 外審成績：審查人員（二） A1c 外審成績：審查人員（三） A1d 外審成績：審查人員（四） A1e 外審成績：審查人員（五） 五位審查人員外審成績總和 總平均分數 總平均分數 A1. 小計 ( 以絕對分數採計 ) □ (1) 一般研究類： A1 滿分 52.5 分（ A 佔 70 ％； A1:75% ， A2:25 ％） □ (2) 技術應用類： A1 滿分 28 分（ A 佔 70 ％； A1: 40% ， A2:60 ％） □ (3) 教學研究類： A1 滿分 36 分（ A 佔 60 ％； A1: 60% ， A2:40 ％） □ (4) 展演藝術類： A1 滿分 52.5 分（ A 佔 70 ％； A1:75% ， A2:25 ％）

A2. 七年內本職級研究計畫獎助及學術成就 項目 評分原則 - 以絕對分數採計 自評 審核 (1) 「國家科 學及技術 (1) 「國家科學及技術委員會」專題研究計畫：研發處依計畫核定清單認定之。 (a) 個別型研究計畫：計畫執行六個月 ( 含 ) 以上，每年第一件得 2 分，第二件得 3 分。計畫執行未達六個月，每件 1 分。 (b) 整合型研究計畫（多張核定清單）： I. 總主持人：每件 3 分。

A2. 七年內本職級研究計畫獎助及學術成就 委員會」 專題計畫 II. 子計畫主持人 ( 不包括總主持人 ) ：每件 2 分。 (c) 單一整合型研究計畫（單張核定清單）：研發處依計畫核定清單認定之，本項總計最高 8 分為上限。 補助經費累計達 100 萬元，得 1 分；超過 100 萬元之部分，每 50 萬元得 0.5 分。每件計畫共同主持人配分必須於計畫核定後 3 個月內，由所有主持人簽名確認個人貢獻，依比例分配計分，且不得再變更分配比例。 (2) 「國家科 學及技術 委員會」 人文社會 實踐計畫 註：同一計畫在 A2 之第 (1) 項、第 (2) 項、第 (6) 項、第 (7) 項僅能擇一計分。 (2) 「國家科學及技術委員會」人文社會實踐計畫 : 研發處依計畫核定清單認定之，本項總計最高 8 分為上限。 補助經費累計達 100 萬元，得 1 分；超過 100 萬元之部分，每 50 萬元得 0.5 分。每件計畫共同主持人配分必須於計畫核定後 3 個月內，由所有主持人簽名確認個人貢獻，依比例分配計分，且不得再變更分配比例。 註：同一計畫在 A2 之第 (1) 項、第 (2) 項、第 (6) 項、第 (7) 項僅能擇一計分。 (3) 教育部專 題研究計 畫 (3) 教育部專題研究計畫 : 研發處依計畫核定清單認定之。本項總計最高以 8 分為上限。 計畫執行六個月 ( 含 ) 以上，每年第一件得 2 分，第二件得 3 分。計畫執行未達六個月，每件 1 分。 註：同一計畫在 A2 之第 (3) 項與第 (12) 項、第 (13) 項僅能擇一計分。 (4) (4) 學術榮譽 : 研發處認定之。同一獎項最多採計二次 (a) 總統級及政府院級學術類獎項，每次得 15 分 (b) 教育部學術獎，每次得 14 分 (c) 「國家科學及技術委員會」傑出研究獎，每次得 12 分 (d) 年度高被引用學者，每次得 5 分 (e) 除「國家科學及技術委員會」與教育部之外，其他行政院所屬中央二級機關學術類獎項，每次得 5 分 (f) 國際知名學會 ( 會員人數 1 萬人以上 ) 獎項，每次得 5 分 (g) 中央研究院年輕學者研究著作獎，每次得 4 分 (h) 「國家科學及技術委員會」吳大猷先生紀念獎，每次得 4 分 (i) 國內財團法人獎項 ( 獎項成立 10 年以上 ) ，每次得 1~3 分 (j) 國內學會獎項 ( 學會成立 20 年以上 ) ，每次得 2 分 (k) 本校傑出教師 ( 學術研究類 ) 獎勵，每次得 2 分 (l) 本校績優教師 ( 學術研究類 ) 獎勵，每次得 1 分 學術榮譽 (5) 出版學術 研究專書 (5) 出版學術研究專書 ( 有國際標準書號 ISBN) ：應檢附學術審查證明，經研發處召開專家審查委員會認定之。本項總計最高 4 分為上限。 (a) 個人學術著作專書：外文每一本 1~4 分、中文每一本 1~3 分 (b) 翻譯著作：每一本 1~2 分 註 : 多人著作：同一本著作依個人貢獻比例分配計分，且須由所有作者簽名確認個人貢獻，經委員會認定後不得再變更貢獻 比例。

A2. 七年內本職級研究計畫獎助及學術成就 (6) 「國家科 學及技術 委員會」 產學合作 研究計畫 (6) 「國家科學及技術委員會」產學合作研究計畫及文化部計畫：產學處依計畫核定清單認定之。 (a) 「國家科學及技術委員會」產學合作個人型研究計畫及文化部計畫 ( 限文學院 ): 計畫執行六個月 ( 含 ) 以上，每年第一件得 2 分，第二件得 3 分。計畫執行未達六個月，每件 1 分。 (b) 「國家科學及技術委員會」產學合作整合型研究計畫 ( 多張核定清單 ): I. 總主持人 : 每件 3 分。 II. 共同主持人 ( 不包含總主持人 ): 每件 2 分。 (c) 「國家科學及技術委員會」產學合作單一整合型研究計畫 ( 單張核定清單 ) ：本項總計最高 8 分為上限。 補助經費累計達 100 萬元，得 1 分；超過 100 萬元之部分，每 50 萬元得 0.5 分。每件計畫共同主持人配分必須於計畫核定 後 3 個月內，由所有主持人簽名確認個人貢獻，依比例分配計分，且不得再變更分配比例。 註 : 同一計畫在 A2 之第 (1) 項、第 (2) 項、第 (6) 項、第 (7) 項僅能擇一計分。 (7) 政府機關 產學合作 計畫 (7) 政府機關產學合作計畫 ( 不含「國家科學及技術委員會」產學計畫 ): 產學處依計畫核定清單認定之。 (a) 文 ( 劇藝系及音樂系除外 ) 、管、社、醫 ( 醫學人文及教育教師 ) 、西灣學院，及海科院具有人文、法政、社經、管理專 長等之政府機關委託產學合作計畫：計畫累計金額達 40 萬元者得 1 分，超過 40 萬元之部份，每 10 萬元得 0.1 分。 (b) 文 ( 限劇藝系及音樂系 ) 之政府機關委託產學合作計畫：計畫累計金額達 20 萬元者得 0.5 分，超過 20 萬元之部份，每 5 萬 元得 0.1 分。 (c) 理、工、醫 ( 一般教師 ) 、海科院之政府機關委託產學合作計畫：計畫累計金額達 75 萬元者得 1 分，超過 75 萬元之部份， 每 15 萬元得 0.1 分。 註： I. 同一計畫在 A2 之第 (1) 項、第 (2) 項、第 (6) 項、第 (7) 項僅能擇一計分。 II. 每件計畫共同主持人配分必須於計畫核定後 3 個月內，由所有主持人簽名確認個人貢獻，依比例分配計分，且計畫執行 期間不得再變更分配比例。 (8) 非政府產 學合作計 畫 (8) 非政府機關 ( 企業與法人 ) 委託產學合作計畫 : 產學處依委託合約書認定之。 (a) 文 ( 劇藝系及音樂系除外 ) 、管、社、醫 ( 醫學人文及教育教師 ) 、西灣學院，及海科院具有人文、法政、社經、管理專 長等之非政府機關委託產學合作計畫：計畫累計金額達 40 萬元者，得 1 分，超過 40 萬元之部份，每 10 萬元得 0.2 分。 (b) 文 ( 限劇藝系及音樂系 ) 之非政府機關委託產學合作計畫：計畫累計金額達 20 萬元者得 0.5 分，超過 20 萬元之部份，每 5 萬元得 0.125 分。 (c) 理、工、醫 ( 一般教師 ) 、海科院之非政府機關委託產學合作計畫：計畫累計金額達 75 萬元者得 1 分，超過 75 萬元之部 份，每 15 萬元得 0.2 分。 註：每件計畫共同主持人配分必須於計畫核定後 3 個月內，由所有主持人簽名確認個人貢獻，依比例分配計分，且計畫執行 期間不得再變更分配比例。 (9) 技術移轉 或著作授 權 (9) 技術移轉或著作授權 : 產學處依技轉合約認定之，主要發明人與產業界 ( 含企業與法人 ) 辦理技術移轉或著作授權，本項總計 最高 8 分為限。 (a) 以職務成果技術移轉或著作授權 : 累計授權金額達 20 萬元者，得 0.5 分；超過 20 萬元之部份，每 10 萬元得 0.2 分。 (b) 以中華民國獲證之發明或設計專利授權 : 累計授權金額達 20 萬元者，得 1 分；超過 20 萬元之部份，每 10 萬元得 0.2 分。 (c) 以美、日、歐盟等國外專利授權 : 累計授權金額達 20 萬元者得 1.5 分，超過 20 萬元之部份，每 10 萬元得 0.4 分。 (10) (10) 專利 : 經產學處依發明專利證書認定之，主要發明人之研究成果以學校名義申請，獲得發明或設計專利；或以個人名義申 請，獲得之發明或設計專利讓與學校。以上與廠商共同申請者，皆不列計。本項總計最高 3 分為限。 (a) 中華民國專利 : 每件 0.5 分。 (b) 美、日、歐盟專利 : 每件 1 分。 (c) 其他國家專利，由產學處認定之，每件 0.1~0.5 分。 專利

A2. 七年內本職級研究計畫獎助及學術成就 (11) 產學榮譽 (11) 產學榮譽 : 產學處認定之。 (a) 總統級及政府院級產學類獎項；每次加 15 分。 (b) 「國家科學及技術委員會」傑出技術移轉貢獻獎，每次加 7.5 分。 (c) 經濟部國家產業創新獎，加 7.5 分。 (d) 經濟部智慧局國家發明創作獎，每次加 4 分。 (e) 除「國家科學及技術委員會」與經濟部之外，其他行政院所屬中央二級機關產學類獎項，每次得 3-4 分。 (f) 未來科技 ( 突破 ) 獎，每次加 2 分。 (g) 國家新創獎，每次加 2 分。 (h) 學術創業先鋒獎，每次加 2 分。 (i) 本校產學傑出獎或傑出教師 ( 產學研究類 ) 獎勵，每次得 2 分。 (j) 本校績優教師 ( 產學研究類 ) 獎勵，每次得 1 分。 註： I. 同一獎項最多採計二次。 II. 每一獎項共同主持人配分必須於獎項核定後 3 個月內，由所有主持人簽名確認個人貢獻，依比例分配計分，且不得再 變更分配比例。 (12) 教育部教學相關計畫 : 教務處依計畫核定清單認定之，本項總計最高以 8 分為上限。 (12) 教育部教 學相關計 畫 (a) 個別型教學計畫主持人：計畫執行六個月 ( 含 ) 以上，每年第一件得 2 分，第二件得 3 分。計畫執行未達六個月，每件 1 分。 (b) 整合型教學計畫： I. 總主持人：每件 3 分。 II. 共同主持人 ( 不包括總主持人 ) ：每件 2 分。 III. 計畫參與教師（不含總主持人及共同主持人）：補助金額 600 萬元以上之計畫，每超過 50 萬元得採計 0.5 分，至多採 計 3 分，並依教師貢獻比例分配給計畫參與教師，每位至多 1.5 分。 註：同一計畫在 A2 之第 (3) 項、第 (12) 項、第 (13) 項僅能擇一計分。 (13) 教育部教 學實踐研 究計畫 (13) 教育部教學實踐研究計畫 : 教務處依計畫核定清單認定之。 每年每件得 2 分；若計畫獲教育部頒績優獎項者，再加 1 分。 註：同一計畫在 A2 之第 (3) 項、第 (12) 項、第 (13) 項僅能擇一計分。 (14) （ 14 ）本職級未送外審之展演作品 :( 未送外審之展演與設計作品 ) 本職級未 送外審之 展演作品 一級展演作品發表 3 分 二級展演作品發表 1.5 分

A2. 七年內本職級研究計畫獎助及學術成就 (15) 傑出 文藝成就 傑出文藝成就獎項計分標準 區分等級 項次 學術成就獎名稱 核發獎項單位 得分 ( 院教評會審核 ) A 級 1 2 國家文藝獎 葛萊美獎 國家文藝基金管理委員會 美國錄音學院 14 分 B 級 3 吳三連文藝獎 吳三連獎基金會 5 分 C 級 4 行政院文化獎 （含原文建會翻譯獎） 文化部 4 分 C 級 5 金曲獎 文化部 4 分 C 級 6 金馬獎 文化部 4 分 C 級 7 金鐘獎 文化部 4 分 C 級 8 金鼎獎 文化部 4 分 D 級 9 教育部文藝創作獎 教育部 3 分 D 級 10 高雄市文藝獎各類首獎 高雄市文化基金會 3 分 (16) 其他 學術（含 文藝）成 就 11 時報文學獎首獎 中國時報 (16) 其他學術或展演（含文藝）成就（由院教評會審議，至多 4.2 分） A2. 小計 □ (1) 一般研究類： A2 滿分 17.5 分（ A 佔 70 ％； A1:75% ， A2:25 ％） □ (2) 技術應用類： A2 滿分 42 分（ A 佔 70 ％； A1: 40% ， A2:60 ％） □ (3) 教學研究類： A2 滿分 24 分（ A 佔 60 ％； A1: 60% ， A2:40 ％） □ (4) 展演藝術類： A1 滿分 17.5 分（ A 佔 70 ％； A1:75% ， A2:25 ％） A. 學術 產學研 究績效 小計 學術產學研究績效（ A1+A2 ）小計 □ (1) 一般研究類： A 滿分 70 分 □ (2) 技術應用類： A 滿分 70 分 □ (3) 教學研究類： A 滿分 60 分 □ (4) 展演藝術類： A 滿分 70 分 小計 小計

B. 教學績效 指標項目 評分原則（以絕對分數採計） 各項目採計上限 自評 審核 指標項目 □(1)一般研究類 : 滿分 20 分 □(2)技術應用類 : 滿分 20 分 □(3)教學研究類 : 滿分 30 分 □ (4) 展演藝術類：滿分 20 分 □一般研究類 : □技術應用類 : □展演藝術類 : 滿分 20 分 □教學研究類 : 滿分 30 分 (1) 教學年資 在本校升等時職級滿三年為 7 分；超過三年部分每增加授課一學期加 0.2 分。他校年 資及育嬰留職停薪期間之年資折半計算。 8 分 8 分 (2) 教學貢獻 度 (a) 升等時職級近五年內學期平均授課時數： 每一時數得 0.5 分，主管或其他可抵減時數應加回計算，至多 5 分。（專班課程 時數併入計算。） (b) 教學當量： 教師於現職職級之平均教學當量達各學院前 10 ％者，每學期加計 0.2 分。 (c) 開設基礎必修課程 *: 教師開設大學部必修課程 ( 不含通識課程 ) ，每開一門加計 0.2 分，多人合授依授 課比例合計給 0.2 分。 (d) 開設通識課程 * ： I. 西灣學院主聘教師開設通識課程 ( 採計跨院選修、博雅及專業服務學習、必修 運動與健康課程、語文課程 ) ，每開一門加計 0.2 分；多人合授依授課比例合 計給 0.2 分。 ( 該項最多 2 分 ) II. 非西灣學院主聘教師支援開設通識課程 ( 採計博雅及專業服務學習課程、語 文課程 ) ，每開一門加計 0.4 分；多人合授依授課比例合計給 0.4 分。 ( 該項最 多 2 分 ) III. 非西灣學院主聘教師支援開設跨院選修通識課程，每開一門加計 0.2 分；多 人合授依授課比例合計給 0.2 分。 ( 該項最多 2 分 ) (e) 出版教科書 ( 有國際標準書號 ISBN) ，經院教評會認定，每本 1-2 分。 註：多人著作：同一本著作依個人貢獻比例分配計分，且須由所有作者簽名確 認個人貢獻，經院教評會認定後不得再變更貢獻比例。 7 分 8 分 (3) 教學榮譽 教學榮譽：教務處認定之。 (a) 教育部師鐸獎，每次 7.5 分。 (b) 教育部全國傑出通識教育教師獎，每次 7.5 分。 (c) 本校傑出教學獎 ( 教學傑出教師 ) ，每次 2 分。 (d) 本校優良教學獎 ( 教學績優教師 ) ，每次 1 分。 (e) 全國教育類貢獻獎（例如：教育部教育奉獻獎、社會教育貢獻獎、藝術教育貢獻 獎等），每次 5 分。 (f) 通識教育學會： I. 「終身成就榮譽」，每次 2 分 II. 「典範通識教師」，每次 1.5 分。 註：同一獎項最多採計二次 15 分 15 分

B. 教學績效 教學優良 課程 獲頒校級教學優良課程，每門課程加 0.2 分。 2 分 3 分 (4) (5) 全英語授 課課程 * (a) 外文系專任教師每開一門全英語講授類課程，加 0.2 分；多人合授依授課比例合 計給 0.2 分。 ( 該項最多 2 分 ) (b) 非外文系專任教師每開一門全英語講授類課程，加 0.4 分；多人合授依授課比例 合計給 0.4 分。 ( 該項最多 4 分 ) 4 分 4 分 (6) 數位學習 課程績效 推動數位學習課程 ( 下面各項不重複計分 ) (a) 獲得教育部數位學習教材及課程認證： 每科教材或每門課程加 1 分；多人合製一門 ( 科 ) 依授課比例合計給 1 分。 (b) 通過本校數位課程認證： 每門課程加 0.5 分；多人合製一門 ( 科 ) 依授課比例合計給 0.5 分；教師開設開放 式課程，每門課程加 0.2 分；多人合製一門 ( 科 ) 依授課比例合計給 0.2 分。 (c) 國際合作 EMI 數位課程： 與國外教師合作開設 EMI 數位學分課程，每門課 0.5 分。 3 分 4 分 (7) 指導學生 研究績效 (a) 指導研究生論文得獎 指導研究生之碩博士學位論文得獎，由教務處認定，每件加計 1 分。 (b) 指導大專學生研究計畫 指導學生獲「國家科學及技術委員會」大專學生研究計畫，由研發處認定，每 件加 0.2 分。若計畫獲大專學生研究創作獎，每件再加 0.5 分。 4 分 4 分 (8) 執行卓越 教學計畫 與高教深 耕教學創 新計畫 （含擔任 學分學程 負責人） (9) (a) 執行由教務處審查之卓越教學計畫與高教深耕教學創新計畫案，每年每件 0.2 分。 (b) 擔任學分學程負責人，每學期每學程 0.1 分。若學程當學期在校修讀人數高於平 均值，加計 0.1 分；若學程當學年度領證人數高於平均值，再加計 0.1 分。 (c) 擔任全英語微學程及學分學程負責人，以上開 2 倍計分。 2 分 4 分 協助教師 提升教學 知能 (a) 擔任教學研習、工作坊等教學活動之主講者，或領航教師有實際輔導事實者，由 教務處認定，每場次 0.2 分。 (b) 擔任全英語教學研習、工作坊等教學活動之主講者，或經教務處推薦為教學觀摩 教師且有實際觀摩事實者，每場次 0.3 分。 (c) 對本校或各學院推動教學創新貢獻卓著者（如推動本校雙語教學計畫），經校內 程序簽核通過，由教務處認定，每件加計 0.2~0.5 分。 3 分 3 分

B. 教學績效

(10) 自我提升 教學知能 (a) 申請觀課服務教師：（本項最高 3 分） 申請觀課服務教師（含 EMI ）經教務處核准，且實際有觀課事實者，每次 0.3 分，若同儕觀課評量平均滿意度 6 分以上（七分量表），加計 0.3 分。 (b) 於本校任職後取得 EMI 教師培訓認證，並符合本校 EMI 教師培訓計畫者，每證 書 1 分（各級證書僅可採計一次），本項最高 3 分。 (c) 參與教學知能提升：（本項最高 2 分） 參與校內教學知能研習、工作坊或教師社群有具體事實者，由教務處認定，每 場次 0.1 分。 3 分 4 分 (11) 其他明顯 教學優良 或教學不 力，有具 體證據者 (11) ：其他明顯教學優良或教學不力，有具體證據者，由教評會適度加減分，最多 不得超過限分 0.6 分 0.9 分 B. 教學績 效小計 B. 教學績效 (1)-(11) 小計 □(1)一般研究類 : 滿分 20 分 □(2)技術應用類 : 滿分 20 分 □(3)教學研究類 : 滿分 30 分 □ (4) 展演藝術類：滿分 20 分 小計 小計 備註： 1.* 有關「通識課程」、「全英語授課課程」及「基礎必修課程」依據「本校教學意見調查追蹤改善精進教學辦法」所訂，符合下列任 一條件者，不予計分： (1) 教學意見調查滿意度在 4.2 分以下（七分量表）。 (2) 教學意見調查滿意度在 4.9 分以下（七分量表），且該課程授課教師兩年內「畢業生對系所與任課教師滿意度問卷」回收卷數達 10 份以上，其對教師滿意度在 3.5 分以下（五分量表）或 4.9 分以下（七分量表）。 2. 所有積分均僅採計現職職級，上一職級之教學貢獻不得計入。

C. 服務績效 評分原則（絕對分數） 各項目採計上限 自評 審核 項目 服務評分 : （滿分 10 分） 滿分 10 分 (1) 校級會議代表 校級會議代表每學年 0.1 分 分 (2) 院級會議代表 院級會議代表每學年 0.1 分 分 (3) 校級服務 ( 由 (3-1)-(3-11) 加 總計分 ) 分 (3) 小計 (3) 小計 (3-1) 擔任編制內行政、學 術主管 (3-1) 擔任編制內行政、學術主管 : 擔任編制內一級主管每學期加 1 分，二級主管每學期加 0.5 分 ( 未滿一學期，以一 學期計算 ) 。如同時擔任二個以上行政或學術主管者，依上開標準分別採計計 分。 分 (3-2) 支援推廣教育課程 (3-2) 開設推廣教育課程，由全球產學營運及推廣處認定。 (a) 教師以講授推廣教育課程，累積收入達 100 萬元或累積貢獻校管理費達 10 萬元，得 0.5 分。收入超過 50 萬元或管理費超過 10 萬元，依比例計算。 (b) 教師開設隨班附讀課程且有學生修習者，每門課得計 0.1 分。 每門推廣教育課程不得重複計分，若為共授課程，必須由所有參與教師 簽名確認個人貢獻，依比例分配計分。 分 (3-3) 支援高中生多元學習 (3-3) 支援高中生多元學習 : 由教務處認定。 (a) 協助招生專業化相關事項，如擔任學系種子教師、於高中端交流活動擔 任主講人、審查高中學生自主學習計畫等，每件 0.1 分。 (b) 開放本校實驗室指導高中學生並有實際指導事實者 ( 若未透過教務處媒 介，則經系所認定，教務處複查 ) ，每學期 0.2 分。 ( 該項最多 2 分 ) (c) 教師支援高中特色課程（含 6 週以上之微課程），每開一門加計 0.5 分， 多人合授一門合計給 0.5 分。 ( 該項最多 2 分 ) 分

C. 服務績效 (3-4) 指導學生參與競賽獲 獎 (3-4) (a) 國際競賽 : 指導本校學生參加國際競賽獲前三名，每件加 3 分，獲佳 作及得獎者每 件加 0.5 分。 (b) 政府單位舉辦之國內學術、產學與展演等競賽 : 指導本校學生參加國內學術、產學與展演等競賽，獲前三名每件加 1.5 分，獲佳作及得獎者每件加 0.25 分。 (C) 指導本校學生參加全國大專運動會及大專校院運動聯賽，獲前三名每次加 1.5 分，進入決賽未獲前三名每次加 0.25 分。 分 (3-5) 支援招生工作 (3-5) 支援招生工作 : 由教務處認定。 (a) 擔任教務處主辦之校內外招生宣導活動主講者，每次 0.1 分。 (b) 支援大考中心或企業委辦本校招生考試或本校自辦招生考試之相關工作 ( 含命題、入闈、監考、審查、口試等 ) ，每次 0.1 分。 分 (3-6) 推動性別平等教育 (3-6) 推動性別平等教育 : 由學務處認定。 推動性別平等教育工作，友善校園，每學年 0.2 分。 分 (3-7) 本校優良導師獎 (3-7) 本校優良導師獎，每次 1 分。 分 (3-8) 推動社團活動 : (3-8) 輔導社團活動及學生自治性組織 : 由學務處認定。 (a) 擔任學生會、宿委會、校內社團之指導老師或學生運動代表隊教練，每學 年 0.3 分。 (b) 擔任國際化和英語化學生社團之指導老師，每學年 0.4 分。 分 (3-9) 推動雙語校園 (3-9) 推動雙語校園， (a) 指標由教務處認定，其餘由國際處認定。 (a) 推動 English Corner 計畫，成效良好者。 ( 每學期 0.4 分 ) (b) 代表本校接洽校級國際合作聯盟 ( 例如 AIT 、 BRITISH COUNCIL 、 OSUN) 有 定期參與及合作成果者，可依其擔任本校代表之時間給予獎勵，每學期 0.5 分。 (c) 擔任校院系雙語化公文及會議資料之行政窗口，每學期 0.5 分。 分 （ 3-10 ） 推動校園藝文活動 (3-10) 主辦校級大型藝文活動（如：校慶等） ：由秘書室認定。 每次加 0.5 分。 分

C. 服務績效 (3-11) 國際化指標 (3-11) 國際化指標，由國際處認定。 (a) 促成本校與外國學校洽簽雙聯學位教師 I. 外國學校排名在本校之前者， 每校 1 分。 II. 外國學校排名在本校之後者，每校 0.5 分。 (b) 國際招生活動 I. 教師自行聯繫參訪，每次 0.5 分。 II. 教師參與國際處安排招生展或參訪，每次 0.2 分。 III. 教師參與線上招生 Webinar ，每次 0.1 分。 (c) 指導外籍碩博士學位生 I. 每位博士生畢業，每人 0.5 分。 II. 每位畢業碩士生畢業，每人 0.2 分。 (d) 其他國際合作 I. 辦理跨國研習活動 ( 如 workshop, training 等 ) ，每場 0.2 分。 II. 參與國際合作計畫 ( 非研究類，如參與辦理國際大型活動、帶領學生 參與國際志工或活動等 ) ，每場 0.2 分。 III. 選送學生至國外合作單位學習，每人 0.2 分。 分 (4) 大型會議或活動 之籌備小組成員 大型會議或活動之籌備小組成員 每次 0.1-0.2 分（院教評會評定，至多 1 分） 1 分 (5) 院優良導師獎 院優良導師獎，每次 0.5 分 分 (6) 校外服務 校外服務（至多 0.8 分，院教評會評定） 0.8 分 C. 服務績效小計 C. 服務績效 (1)-(6) 及各類跨域活動參與至多 7 分 ( 依「國立中山大學文學 院教師升等審查評分細則」達基本門檻者 ) ，滿分 10 分 分 小計 小計 總分 (=A+B+C) 分","<2-hop>  [202005141641090311.md]

國立中山大學中國文學系教師升等審查辦法

83.01.14 82 學年度中文系所教師評審委員會議通過 85.12.11 85 學年度第 4 次系務會議修正通過 89.10.04 89 學年度第 1 次系務會議修正通過 89.12.13 89 學年度第 2 次系務會議修正通過 89.12.21 89 學年度第 6 次院教評會通過 90.09.26 90 學年度第 1 次系務會議修正通過 91.03.26 90 學年度第 6 次院教評會通過 93.04.21 92 學年度第 4 次系務會議修正通過 93.06.01 92 學年度第 5 次系務會議修正通過 93.06.08 92 學年度第 11 次院教評會通過 97.06.19 96 學年度第 6 次系務會議修正通過 97.10.02 97 學年度第 1 次院教評會通過 102.09.25 102 學年度第 1 次系務會議修正通過 102.10.18 102 學年度第 2 次院教評會修正通過 103.02.27 102 學年度第 6 次院教評會修正通過 103.05.21 102 學年度第 8 次院教評會修正通過 106.03.01 105 學年度第 5 次系教評會修正通過 學年度第 6 次系務會議修正通過 106.04.20 105 學年度第 6 次院教評會修正通過 107.05.15 105 學年度第 7 次系教評會修正通過 107.05.16 106 學年度第 8 次系務會議修正通過 107.06.14 106 學年度第 8 次院教評會修正通過 107.07.06 陳核通過

一、本系為辦理教師升等，依據本校「教師評審委員會設置辦法」第二條之規定及本校、本 院教師升等審查相關法規，訂定本辦法。

二、凡符合本校與文學院教師升等審查辦法規定之教師，得於每學期正式上課日一週前向 系主任申請升等，並提交下列資料：

（一） 「國立中山大學教師升等送審資料項目表」所列初審應繳資料及表件。

（二）文學院教師升等初審作業規定之表件。

（三） 「國立中山大學中國文學系教師升等計分表」 （學術研究類或教學研究類）及相 關資料。

（四）送審著作一式四份。

三、系主任接獲教師升等之申請後，將上述資料公開陳列（一週） ，供全系教師閱覽，隨後召 開系教師評審委員會進行資格審查。並於當學期正式上課後十日內，將通過資格審查者 資料彙送文學院教師評審委員會辦理著作審查。

四、擬升等教師所提送審著作應符合文學院教師升等審查辦法第二條之規定。著作審查由院 長聘請校外適格之學者專家三人審查。審查人選由系教評會擬提具有充分專業能力之校 外學者專家七人以上（院長得增列審查人選） ，簽請院長召集院教評會委員若幹人圈定三 人後，由文學院辦理著作外審，外審成績結果送回本系初審。外審學者應迴避申請人原 畢業學校之教授。

五、依據本校「教師及研究人員升等審查辦法」第四條規定，本系教師評審委員會應就升 等教師之學術研究或教學研究、教學、服務等三項評定成績，成績總分達七十分（含） 以上者通過初審。本系教師升等初審其計分比例與項目如下：

（一）學術研究類：學術研究佔百分之七十、教學績效佔百分之二十、服務成績佔百分 之十。

學術研究與教學績效計分方式依「國立中山大學文學院教師升等計分表－學術研 究類」所列項目計分。服務成績計分方式依「國立中山大學中國文學系教師升等 服務成績評分原則」所列項目計分。

（二）教學研究類：教學研究佔百分之六十、教學績效佔百分之三十、服務成績佔百分 之十。

教學研究與教學績效計分方式依「國立中山大學文學院教師升等計分表－教學研 究類」所列項目計分。服務成績計分方式依「國立中山大學中國文學系教師升等 服務成績評分原則」所列項目計分。

六、初審結果若不通過，系教師評審委員會召集人應以書面敘明理由通知申請人。申請人對 於初審結果若有異議，得依本校相關辦法及程序提出申復（或申訴） 。

七、本辦法經系務會議通過，送院教評會審議通過，送請校長核定後實施，修正時亦同。",202509142218250731.md,202005141641090311.md,['教師升等計分表'],文學院↔文學院,教師升等計分表↔教師升等計分表,5.0,2.67,3.92,3.86,3.99,2.0,5.0
根據國立中山大學管理學院的規定，校友代表在校長遴選委員會中的推選條件與程序是什麼？此外，院務諮詢委員會中校友代表的組成與任期有何規定？,根據國立中山大學管理學院校長遴選委員會的規定，校友代表候選人必須具有本校畢業證書，且本院得推選兩名校友代表候選人，且兩人應為不同性別。各系（所、學程）可推薦校友至多兩人（且兩人應為不同性別），優先考慮曾獲本院傑出校友獎的校友，經院主管會議討論後，提送校務會議代表以無記名限制連記法推選為代表。全校選出校友代表三人，任一性別至少一人，每學院至多一人當選，以在本校之最高學歷認定。至於院務諮詢委員會，該委員會由本院教師代表、校友代表及具名望之社會人士共計十至二十五人組成，由院長敦聘擔任。院務諮詢委員為榮譽職，不支領薪資但酌予支給出席費，任期以一年為一任，連聘得連任。院務諮詢委員會設召集人一人，由院長擔任，每學期至少開會一次，必要時得召集臨時會議，並舉行不定期諮詢會議。,"['<1-hop>  [201909101347010540.md]\n\n國立中山大學管理學院校長遴選委員會 學校教師代表、校友代表及社會公正人士代表遴選作業要點\n\n96 年 09 月 19 日 96 學年度第 2 次主管會議通過 96 年 10 月 02 日 96 學年度第 1 次院務會議通過 104 年 10 月 13 日 104 學年度第 2 次主管會議修正通過 104 年 10 月 14 日 104 學年度第 1 次臨時院務會議修正通過\n\n一、本辦法依「校長遴選續聘及去職辦法」及「辦理校長遴選作業應行注意事項」訂定 之。\n\n二、教師代表候選人之推選：\n\n（1）本院得推選「學校教師代表」候選人二人，二人應為不同性別。\n\n（2）候選人由全院專任教師投票互選之，依得票高低次序產生。得票數相同時，抽 籤決定之。\n\n（3）全校選出教師代表六人，任一性別至少二人。本院推選之候選人提送校務會議 代表以無記名限制連記法推選為代表。本院代表至少一人，其餘為候補代表。 若教師代表因故出缺，按得票高低依序遞補，惟遞補後之教師代表人數若不符 合性別比例時，則不受本院至少一人之限制。\n\n三、校友代表候選人之推選：\n\n（1）本院得推選具有本校畢業證書之「校友代表」候選人二人，二人應為不同性別。\n\n（2）本院推選之候選人，本院各系（所、學程）得推薦校友至多二人（二人應為不 同性別） ，以曾獲本院傑出校友獎之校友為優先，經院主管會議討論後，提送 校務會議代表以無記名限制連記法推選為代表。\n\n（3）全校選出校友代表三人，任一性別至少一人。每學院至多一人當選，以在本校 之最高學歷認定。\n\n四、社會公正人士代表候選人之推選：\n\n（1）本院得推選不具本校校友身分之「社會公正人士代表」候選人二人，二人應為 不同性別。\n\n（2）本院推選之候選人，由本院各系(所、學程)推薦，各單位至多推薦二人（二人 應為不同性別） ，經院主管會議討論後，提送校務會議代表以無記名限制連記 法推選為代表。\n\n（3）全校選出社會公正人士代表四人，任一性別至少一人。\n\n本院「校長遴選委員會\n\n學校教師代表、校友代表及社會公正人士代表遴選作業要點」修正對照表\n\n修正後條文 現行條文 說明 本院「校長遴選委員會學校教師 代表、校友代表及社會公正人士 代表遴選作業要點」 本院「校長遴選委員會學校教師 代表及社會公正人士代表遴選作 業要點」 法規名稱修正 一、本辦法依「校長遴選續聘及 去職辦法」及「辦理校長遴 選作業應行注意事項」訂定 之。 一、本辦法依「國立中山大學校 長遴選委員會學校代表委員 遴選作業細則」及「國立中 山大學校長遴選委員會社會 公正人士代表委員遴選作業 細則」訂定之。 配合學校法規名 稱修正 二、教師代表候選人之推選： （1）本院得推選「學校教師代表」 候選人二人，二人應為不同 性別。 （2）候選人由全院專任教師投票 互選之，依得票高低次序產 生。得票數相同時，抽籤決 定之。 （3）全校選出教師代表六人，任 一性別至少二人。本院推選 之候選人提送校務會議代表 以無記名限制連記法推選為 代表。本院代表至少一人， 其餘為候補代表。若教師代 表因故出缺，按得票高低依 序遞補，惟遞補後之教師代 表人數若不符合性別比例 時，則不受本院至少一人之 限制。 二、教師代表之推選： （1）本院應推選「學校教師代表」 一名，同時可推薦一名為跨 院代表候選人。 （2）候選人由全院專任教師投票 互選之，依得票高低次序產 生。 （3）最高票者為本院當然代表， 次高票者為候補之當然委 員，並為跨院代表之候選 人，其他候選人依得票高低 依序候補。得票數相同時， 抽籤決定之。 （4）本院教師代表因故出缺時， 由候補委員依得票數高低依 序遞補。 配合學校法規修 正 三、校友代表候選人之推選： （1）本院得推選具有本校畢業證 書之「校友代表」候選人二 人，二人應為不同性別。 （2）本院推選之候選人，本院各 系（所、學程）得推薦校友 至多二人（二人應為不同性 別） ，以曾獲本院傑出校友獎 之校友為優先，經院主管會 議討論後，提送校務會議代 新增 原則上由曾獲本 院傑出校友獎名 單中推選，另各系 所學程得另推薦 人選。\n\n表以無記名限制連記法推選 為代表。 （3）全校選出校友代表三人，任 一性別至少一人。每學院至 多一人當選，以在本校之最 高學歷認定。 四、社會公正人士代表候選人之 推選： （1）本院得推選不具本校校友身 分之「社會公正人士代表」 候選人二人，二人應為不同 性別。 （2）本院推選之候選人，由本院 各系(所、學程)推薦，各單位 至多推薦二人（二人應為不 同性別） ，經院主管會議討論 後，提送校務會議代表以無 記名限制連記法推選為代 表。 （3）全校選出社會公正人士代表 四人，任一性別至少一人。 三、社會公正人士代表之推選： （1）本院應推薦「社會公正人士 代表」候選人二名以上，供 校務會議投票，全校選出四 位代表。 （2）本院推薦之候選人，由本院 教師推薦候選人，再經院主 管會議討論後，推薦供校務 會議投票。 配合學校法規修 正 五、本要點經主管會議及院務會 議通過後實施，修正時亦同。 四、本要點經主管會議及院務會 議通過後實施，修正時亦同。 條次修正\n\n國立中山大學管理學院校長遴選委員會\n\n「校友代表」及「社會公正人士代表」推薦表\n\n姓 名\n\n性別\n\n生日\n\n聯絡地址\n\n電話/手機\n\nEmail\n\n推薦類別\n\n[ ] □校友代表（畢業單位：________________ ;畢業年度：________）\n\n[ ] □社會公正人士\n\n現職單位/職稱\n\n（請載明各學歷單位及起迄時間）\n\n（請條列說明各經歷之單位、起迄時間、與所負責之工作內容）\n\n（請條列說明各項事績之內容與時間，並檢附相關證明文件）\n\n推薦單位\n\n推薦單位\n\n主管簽章', '<2-hop>  [201909101401370573.md]\n\n國立中山大學管理學院院務諮詢委員會設立要點\n\nAdvisory Board for College of Management National Sun Yat-sen University\n\n83.10.14 院務會議通過\n\n93.9.9 九十三學年度第一次院主管會議修正通過 93.10.12 九十三學年度第一次院務會議修正通過\n\n一、管理學院（以下簡稱本院）院務諮詢委員會之設立，為提供本院 院務發展建言，並提升本院學術研究與教學績效為宗旨。\n\n二、院務諮詢委員會由本院教師代表、校友代表，及具名望之社會人 士共計十至二十五人組成，由院長敦聘擔任。\n\n三、院務諮詢委員為榮譽職，不支領薪資但酌予支給出席費，任期以\n\n一年為一任，連聘得連任。\n\n四、院務諮詢委員會設召集人一人，由院長擔任。\n\n五、院務諮詢委員會每學期至少開會一次，必要時得召集臨時會議， 並舉行不定期諮詢會議。\n\n六、本要點經院務會議通過後施行，修正時亦同。\n\n國立中山大學管理學院院務諮詢委員會設立要點 修改說明\n\n修正後條文 原條文 修正說明 要點名稱 國立中山大學 管理學院院務諮詢委員會 設立要點 要點名稱 管理學院院務 諮詢委員會設立要點 條文名稱完整化 第一條 管理學院 （以下 簡稱本院） 院務諮詢委員會 之設立，為提供本院院務發 展建言，並提升本院學術研 究與教學績效為宗旨。 第一條 諮詢委員會之 設立以強化管理學院企業 界之連繫，落實院內教學與 研究工作，培養兼具理論與 實務之學生為宗旨。 修改設立宗旨 第二條 院務諮詢委員 會由本院教師代表、校友代 表，及具名望之社會人士共 計十至二十五人組成，由院 長敦聘擔任。 第二條 諮詢委員會由 25位院務顧問所組成，對管 理學院教學研究與長期發 展之相關事項提供建言，供 院長參考。院務顧問由院長 聘請產官學研有聲望之人 士擔任。 修改委員組成及人 數 第三條 .. 院務諮詢委 員為榮譽職，不支領薪資但 酌予支給出席費，任期以一 年為一任，連聘得連任。 第三條 .. 院務顧問為榮 譽職，不支領任何薪資或車 馬費，任期以二年為一任， 連聘得連任。 修改委員任期 第四條 院務諮詢委員 會設召集人一人，由院長擔 任。 第四條 諮詢委員會設主 任委員一人，由院務顧問互 相推選擔任，主任委員之任 期為二年。 確認院長為召集人 第五條 院務諮詢委員 會每學期至少開會一次，必 要時得召集臨時會議，並舉 行不定期諮詢會議。 第五條 諮詢委員會每年 由主任委員召集諮詢會議 至少一次，必要時得召集臨 時會議。 修改開會時間\n\n管理學院院務諮詢委員會設立要點\n\n83.10.14 院務會議通過\n\n一、諮詢委員會之設立以強化管理學院企業界之連繫，落實院 內教學與研究工作，培養兼具理論與實務之學生為宗旨。\n\n二、諮詢委員會由 25 位院務顧問所組成，對管理學院教學研 究與長期發展之相關事項提供建言，供院長參考。院務顧 問由院長聘請產官學研有聲望之人士擔任。\n\n三、院務顧問為榮譽職，不支領任何薪資或車馬費，任期以二 年為一任，連聘得連任。\n\n四、諮詢委員會設主任委員一人，由院務顧問互相推選擔任， 主任委員之任期為二年。\n\n五、諮詢委員會每年由主任委員召集諮詢會議至少一次，必要時得召 集臨時會議。\n\n六、本要點經院務會議通過後施行，修正時亦同。']",curious student,Web search like queries,long,"<1-hop>  [201909101347010540.md]

國立中山大學管理學院校長遴選委員會 學校教師代表、校友代表及社會公正人士代表遴選作業要點

96 年 09 月 19 日 96 學年度第 2 次主管會議通過 96 年 10 月 02 日 96 學年度第 1 次院務會議通過 104 年 10 月 13 日 104 學年度第 2 次主管會議修正通過 104 年 10 月 14 日 104 學年度第 1 次臨時院務會議修正通過

一、本辦法依「校長遴選續聘及去職辦法」及「辦理校長遴選作業應行注意事項」訂定 之。

二、教師代表候選人之推選：

（1）本院得推選「學校教師代表」候選人二人，二人應為不同性別。

（2）候選人由全院專任教師投票互選之，依得票高低次序產生。得票數相同時，抽 籤決定之。

（3）全校選出教師代表六人，任一性別至少二人。本院推選之候選人提送校務會議 代表以無記名限制連記法推選為代表。本院代表至少一人，其餘為候補代表。 若教師代表因故出缺，按得票高低依序遞補，惟遞補後之教師代表人數若不符 合性別比例時，則不受本院至少一人之限制。

三、校友代表候選人之推選：

（1）本院得推選具有本校畢業證書之「校友代表」候選人二人，二人應為不同性別。

（2）本院推選之候選人，本院各系（所、學程）得推薦校友至多二人（二人應為不 同性別） ，以曾獲本院傑出校友獎之校友為優先，經院主管會議討論後，提送 校務會議代表以無記名限制連記法推選為代表。

（3）全校選出校友代表三人，任一性別至少一人。每學院至多一人當選，以在本校 之最高學歷認定。

四、社會公正人士代表候選人之推選：

（1）本院得推選不具本校校友身分之「社會公正人士代表」候選人二人，二人應為 不同性別。

（2）本院推選之候選人，由本院各系(所、學程)推薦，各單位至多推薦二人（二人 應為不同性別） ，經院主管會議討論後，提送校務會議代表以無記名限制連記 法推選為代表。

（3）全校選出社會公正人士代表四人，任一性別至少一人。

本院「校長遴選委員會

學校教師代表、校友代表及社會公正人士代表遴選作業要點」修正對照表

修正後條文 現行條文 說明 本院「校長遴選委員會學校教師 代表、校友代表及社會公正人士 代表遴選作業要點」 本院「校長遴選委員會學校教師 代表及社會公正人士代表遴選作 業要點」 法規名稱修正 一、本辦法依「校長遴選續聘及 去職辦法」及「辦理校長遴 選作業應行注意事項」訂定 之。 一、本辦法依「國立中山大學校 長遴選委員會學校代表委員 遴選作業細則」及「國立中 山大學校長遴選委員會社會 公正人士代表委員遴選作業 細則」訂定之。 配合學校法規名 稱修正 二、教師代表候選人之推選： （1）本院得推選「學校教師代表」 候選人二人，二人應為不同 性別。 （2）候選人由全院專任教師投票 互選之，依得票高低次序產 生。得票數相同時，抽籤決 定之。 （3）全校選出教師代表六人，任 一性別至少二人。本院推選 之候選人提送校務會議代表 以無記名限制連記法推選為 代表。本院代表至少一人， 其餘為候補代表。若教師代 表因故出缺，按得票高低依 序遞補，惟遞補後之教師代 表人數若不符合性別比例 時，則不受本院至少一人之 限制。 二、教師代表之推選： （1）本院應推選「學校教師代表」 一名，同時可推薦一名為跨 院代表候選人。 （2）候選人由全院專任教師投票 互選之，依得票高低次序產 生。 （3）最高票者為本院當然代表， 次高票者為候補之當然委 員，並為跨院代表之候選 人，其他候選人依得票高低 依序候補。得票數相同時， 抽籤決定之。 （4）本院教師代表因故出缺時， 由候補委員依得票數高低依 序遞補。 配合學校法規修 正 三、校友代表候選人之推選： （1）本院得推選具有本校畢業證 書之「校友代表」候選人二 人，二人應為不同性別。 （2）本院推選之候選人，本院各 系（所、學程）得推薦校友 至多二人（二人應為不同性 別） ，以曾獲本院傑出校友獎 之校友為優先，經院主管會 議討論後，提送校務會議代 新增 原則上由曾獲本 院傑出校友獎名 單中推選，另各系 所學程得另推薦 人選。

表以無記名限制連記法推選 為代表。 （3）全校選出校友代表三人，任 一性別至少一人。每學院至 多一人當選，以在本校之最 高學歷認定。 四、社會公正人士代表候選人之 推選： （1）本院得推選不具本校校友身 分之「社會公正人士代表」 候選人二人，二人應為不同 性別。 （2）本院推選之候選人，由本院 各系(所、學程)推薦，各單位 至多推薦二人（二人應為不 同性別） ，經院主管會議討論 後，提送校務會議代表以無 記名限制連記法推選為代 表。 （3）全校選出社會公正人士代表 四人，任一性別至少一人。 三、社會公正人士代表之推選： （1）本院應推薦「社會公正人士 代表」候選人二名以上，供 校務會議投票，全校選出四 位代表。 （2）本院推薦之候選人，由本院 教師推薦候選人，再經院主 管會議討論後，推薦供校務 會議投票。 配合學校法規修 正 五、本要點經主管會議及院務會 議通過後實施，修正時亦同。 四、本要點經主管會議及院務會 議通過後實施，修正時亦同。 條次修正

國立中山大學管理學院校長遴選委員會

「校友代表」及「社會公正人士代表」推薦表

姓 名

性別

生日

聯絡地址

電話/手機

Email

推薦類別

[ ] □校友代表（畢業單位：________________ ;畢業年度：________）

[ ] □社會公正人士

現職單位/職稱

（請載明各學歷單位及起迄時間）

（請條列說明各經歷之單位、起迄時間、與所負責之工作內容）

（請條列說明各項事績之內容與時間，並檢附相關證明文件）

推薦單位

推薦單位

主管簽章","<2-hop>  [201909101401370573.md]

國立中山大學管理學院院務諮詢委員會設立要點

Advisory Board for College of Management National Sun Yat-sen University

83.10.14 院務會議通過

93.9.9 九十三學年度第一次院主管會議修正通過 93.10.12 九十三學年度第一次院務會議修正通過

一、管理學院（以下簡稱本院）院務諮詢委員會之設立，為提供本院 院務發展建言，並提升本院學術研究與教學績效為宗旨。

二、院務諮詢委員會由本院教師代表、校友代表，及具名望之社會人 士共計十至二十五人組成，由院長敦聘擔任。

三、院務諮詢委員為榮譽職，不支領薪資但酌予支給出席費，任期以

一年為一任，連聘得連任。

四、院務諮詢委員會設召集人一人，由院長擔任。

五、院務諮詢委員會每學期至少開會一次，必要時得召集臨時會議， 並舉行不定期諮詢會議。

六、本要點經院務會議通過後施行，修正時亦同。

國立中山大學管理學院院務諮詢委員會設立要點 修改說明

修正後條文 原條文 修正說明 要點名稱 國立中山大學 管理學院院務諮詢委員會 設立要點 要點名稱 管理學院院務 諮詢委員會設立要點 條文名稱完整化 第一條 管理學院 （以下 簡稱本院） 院務諮詢委員會 之設立，為提供本院院務發 展建言，並提升本院學術研 究與教學績效為宗旨。 第一條 諮詢委員會之 設立以強化管理學院企業 界之連繫，落實院內教學與 研究工作，培養兼具理論與 實務之學生為宗旨。 修改設立宗旨 第二條 院務諮詢委員 會由本院教師代表、校友代 表，及具名望之社會人士共 計十至二十五人組成，由院 長敦聘擔任。 第二條 諮詢委員會由 25位院務顧問所組成，對管 理學院教學研究與長期發 展之相關事項提供建言，供 院長參考。院務顧問由院長 聘請產官學研有聲望之人 士擔任。 修改委員組成及人 數 第三條 .. 院務諮詢委 員為榮譽職，不支領薪資但 酌予支給出席費，任期以一 年為一任，連聘得連任。 第三條 .. 院務顧問為榮 譽職，不支領任何薪資或車 馬費，任期以二年為一任， 連聘得連任。 修改委員任期 第四條 院務諮詢委員 會設召集人一人，由院長擔 任。 第四條 諮詢委員會設主 任委員一人，由院務顧問互 相推選擔任，主任委員之任 期為二年。 確認院長為召集人 第五條 院務諮詢委員 會每學期至少開會一次，必 要時得召集臨時會議，並舉 行不定期諮詢會議。 第五條 諮詢委員會每年 由主任委員召集諮詢會議 至少一次，必要時得召集臨 時會議。 修改開會時間

管理學院院務諮詢委員會設立要點

83.10.14 院務會議通過

一、諮詢委員會之設立以強化管理學院企業界之連繫，落實院 內教學與研究工作，培養兼具理論與實務之學生為宗旨。

二、諮詢委員會由 25 位院務顧問所組成，對管理學院教學研 究與長期發展之相關事項提供建言，供院長參考。院務顧 問由院長聘請產官學研有聲望之人士擔任。

三、院務顧問為榮譽職，不支領任何薪資或車馬費，任期以二 年為一任，連聘得連任。

四、諮詢委員會設主任委員一人，由院務顧問互相推選擔任， 主任委員之任期為二年。

五、諮詢委員會每年由主任委員召集諮詢會議至少一次，必要時得召 集臨時會議。

六、本要點經院務會議通過後施行，修正時亦同。",201909101347010540.md,201909101401370573.md,['校友代表'],管理學院↔管理學院,校友代表↔校友代表,5.0,4.81,4.98,5.0,5.0,2.0,5.0
文學院院長在文學院僑外學生獎學金遴審委員會和文學院課程委員會中分別扮演什麼角色？,根據文學院僑外學生獎學金施行辦法，文學院院長是遴審委員會的召集人，該委員會負責審查僑外學生獎學金的申請與發放事宜。根據文學院課程委員會設置要點，文學院院長同樣擔任課程委員會的召集人，該委員會負責覆審系所課程結構與發展方向、協調課程開設、審查新開設課程及必修科目表等相關事宜。由此可見，文學院院長在兩個委員會中皆擔任召集人，負責主持會議並領導相關審查與決策工作。,"['<1-hop>  [202106281235150427.md]\n\n國立中山大學文學院僑外學生獎學金施行辦法\n\n102 年 10 月 16 日 102 學年度文學院第 5 次系所主管會議訂定 105 年 6 月 8 日 104 學年度文學院第 14 次系所主管會議修定\n\n第一條 宗旨： 為促進本學院國際化，獎勵就讀本學院之僑外學生能 安心向學，特設 立「國立中山大學文學院僑外學生獎學金」 （以下簡稱本獎學金）。\n\n第二條 申請對象：\n\n本校文學院各系所在學僑外學生 ( 大學部及碩士生 ) ，且未獲國際 處提供獎助學金者。\n\n第三條 獎助名額與金額：\n\n( 一） 經費來源：「本校鼓勵學術單位招收及照顧境外學生補助 專款核定經費」\n\n二）每年提供文學院僑外學生獎學金若干名，每名獎助金額 以新臺幣 10,000 元為原則。\n\n( 三）本獎學金發放之金額及名額，得由遴選委員會視當年度\n\n經費及申請學生人數彈性調整。\n\n第四條 申請資格： 在本院就讀一學期以上，具有正式學籍之僑外學生， 並符合下列規定：\n\n一）碩士生 :\n\n前一學期至少須修習一門課，前一學年學業平均 GPA 3.38 (80 分 ) 以上，行為表現無不良紀錄者。\n\n若於撰寫論文期間，無前一學期成績者，則須另提供指\n\n導教授推 薦函及論文撰寫計畫。\n\n( 二）大學部生：前一學期至少須修習 9 學分，前一學年歷年學 業平均成績大學部 (GPA 3.38) 80 分以上，行為表現無不\n\n良紀錄者。\n\n第五條 申請程序： 申請者應 檢附下列文件：\n\n申請表乙份。\n\n自傳乙份（ 1 頁 A4 紙張內）。\n\n前一學期或前一學年成績單乙份，或碩士班指導教授推薦函\n\n及論文撰寫計畫。由系所進行初審並將推薦名單於 5 月 10 日 前送文學院，由遴審委員會進行決審。\n\n第六條 獎學金取消：\n\n獲獎後當學年度辦理休學者，應取消其受獎資格。\n\n第七條 組織運作及審查程序：\n\n( 一 ) 本獎學金每學年辦理一次，由「國立中山大學文學院僑 外獎學金遴審委員會」（簡稱「遴審委員會」）審查。\n\n( 二 ) 遴審委員會成員由文學院院長、各系所主管組成，文學院 院長為召集人，需有二分之一以上委員出席，始可決議。\n\n第八條 本辦法若有未盡事宜，悉依相關法令規定辦理。\n\n第九條 本辦法經本校文學院主管會議通過，簽請校長核定後實施，修正時 亦同。', '<2-hop>  [201908161726060212.md]\n\n國立中山大學文學院課程委員會設置要點\n\n99.03.25 本院 98 學年度第 3 次院務會議訂定 99.5.31 98 學年度第 4 次校課程委員會通過 99.6.15 第 124 次教務會議核備 105.12.26 本院 105 學年度第 1 次院務會議修訂 106.05.15 105 學年度 105 學年度第 4 次校課程委員會\n\n106.5.31 第 152 次教務會議核備\n\n第一條 文學院為辦理各單位開設課程審查及其他相關事宜， 依據大學法施行細 則相關規定及國立中山大學「課程委員會設置要點」訂定「國立中山大學 文學院課程委員會設置要點」 。\n\n第二條 本委員會之主要職掌包括：\n\n( 一 ) 覆審系所級課程委員會規劃之課程結構與發展方向。\n\n( 二 ) 整合並協調院內系所課程之開設，避免重複與資源之浪費。\n\n( 三 ) 覆審並查核各系所新開設課程。\n\n( 四 ) 覆審各系所必修科目表相關之事宜。\n\n( 五 ) 課程相關問題之審議。\n\n第三條 本委員會由文學院院長、系所主管為當然代表、各系所推派教師代表各 1 人（需為系所課程委員會代表）、學生代表各 1 人（需為系所課程委員會 代表），院長遴聘之校外專家學者 ( 含業界代表 )1 至 2 人組成，由院長擔 任召集人。\n\n視需要請系所承辦業務助理參與會議。\n\n第四條 本委員會委員任期為二年，委員連選得連任。\n\n第五條 本委員會有關課程審查之決議事項，須提校課程委員會及教務會議審議。\n\n第六條 本委員會每學期至少召開會議 2 次，必要時得召開臨時會議。\n\n第七條 本要點未盡事宜，悉依相關法令規定辦理。\n\n第八條 本要點經院務會議通過，校課程委員會、教務會議核備後實施，修正時亦 同。']",curious student,Poor grammar,medium,"<1-hop>  [202106281235150427.md]

國立中山大學文學院僑外學生獎學金施行辦法

102 年 10 月 16 日 102 學年度文學院第 5 次系所主管會議訂定 105 年 6 月 8 日 104 學年度文學院第 14 次系所主管會議修定

第一條 宗旨： 為促進本學院國際化，獎勵就讀本學院之僑外學生能 安心向學，特設 立「國立中山大學文學院僑外學生獎學金」 （以下簡稱本獎學金）。

第二條 申請對象：

本校文學院各系所在學僑外學生 ( 大學部及碩士生 ) ，且未獲國際 處提供獎助學金者。

第三條 獎助名額與金額：

( 一） 經費來源：「本校鼓勵學術單位招收及照顧境外學生補助 專款核定經費」

二）每年提供文學院僑外學生獎學金若干名，每名獎助金額 以新臺幣 10,000 元為原則。

( 三）本獎學金發放之金額及名額，得由遴選委員會視當年度

經費及申請學生人數彈性調整。

第四條 申請資格： 在本院就讀一學期以上，具有正式學籍之僑外學生， 並符合下列規定：

一）碩士生 :

前一學期至少須修習一門課，前一學年學業平均 GPA 3.38 (80 分 ) 以上，行為表現無不良紀錄者。

若於撰寫論文期間，無前一學期成績者，則須另提供指

導教授推 薦函及論文撰寫計畫。

( 二）大學部生：前一學期至少須修習 9 學分，前一學年歷年學 業平均成績大學部 (GPA 3.38) 80 分以上，行為表現無不

良紀錄者。

第五條 申請程序： 申請者應 檢附下列文件：

申請表乙份。

自傳乙份（ 1 頁 A4 紙張內）。

前一學期或前一學年成績單乙份，或碩士班指導教授推薦函

及論文撰寫計畫。由系所進行初審並將推薦名單於 5 月 10 日 前送文學院，由遴審委員會進行決審。

第六條 獎學金取消：

獲獎後當學年度辦理休學者，應取消其受獎資格。

第七條 組織運作及審查程序：

( 一 ) 本獎學金每學年辦理一次，由「國立中山大學文學院僑 外獎學金遴審委員會」（簡稱「遴審委員會」）審查。

( 二 ) 遴審委員會成員由文學院院長、各系所主管組成，文學院 院長為召集人，需有二分之一以上委員出席，始可決議。

第八條 本辦法若有未盡事宜，悉依相關法令規定辦理。

第九條 本辦法經本校文學院主管會議通過，簽請校長核定後實施，修正時 亦同。","<2-hop>  [201908161726060212.md]

國立中山大學文學院課程委員會設置要點

99.03.25 本院 98 學年度第 3 次院務會議訂定 99.5.31 98 學年度第 4 次校課程委員會通過 99.6.15 第 124 次教務會議核備 105.12.26 本院 105 學年度第 1 次院務會議修訂 106.05.15 105 學年度 105 學年度第 4 次校課程委員會

106.5.31 第 152 次教務會議核備

第一條 文學院為辦理各單位開設課程審查及其他相關事宜， 依據大學法施行細 則相關規定及國立中山大學「課程委員會設置要點」訂定「國立中山大學 文學院課程委員會設置要點」 。

第二條 本委員會之主要職掌包括：

( 一 ) 覆審系所級課程委員會規劃之課程結構與發展方向。

( 二 ) 整合並協調院內系所課程之開設，避免重複與資源之浪費。

( 三 ) 覆審並查核各系所新開設課程。

( 四 ) 覆審各系所必修科目表相關之事宜。

( 五 ) 課程相關問題之審議。

第三條 本委員會由文學院院長、系所主管為當然代表、各系所推派教師代表各 1 人（需為系所課程委員會代表）、學生代表各 1 人（需為系所課程委員會 代表），院長遴聘之校外專家學者 ( 含業界代表 )1 至 2 人組成，由院長擔 任召集人。

視需要請系所承辦業務助理參與會議。

第四條 本委員會委員任期為二年，委員連選得連任。

第五條 本委員會有關課程審查之決議事項，須提校課程委員會及教務會議審議。

第六條 本委員會每學期至少召開會議 2 次，必要時得召開臨時會議。

第七條 本要點未盡事宜，悉依相關法令規定辦理。

第八條 本要點經院務會議通過，校課程委員會、教務會議核備後實施，修正時亦 同。",202106281235150427.md,201908161726060212.md,['文學院院長'],文學院↔文學院,文學院院長↔文學院院長,5.0,5.0,5.0,5.0,5.0,2.0,5.0
根據國立中山大學文學院教師升等的規定，申請教授職級晉升時，申請者需要提交哪些代表著作的條件？此外，申請者在升等期間參與哪些跨域活動，且至少需參加多少場次？,根據國立中山大學文學院教師升等的規定，申請教授職級晉升時，申請者需提交的代表著作必須符合本校「教師升等審查辦法」及「文學院教師升等審查要點」第二條規定：教師所提外審之學術研究成果件數至多10件，代表著作或論文應於提出申請時已經出版公開發行或在國內外知名學術刊物發表，且為升等前一職級出版或發表者為限。申請者若有專門著作已被接受將定期發表，需出具證明。申請者在升等期間，需參加本學院辦理之跨系所跨領域對話座談、跨校際對話座談、跨國際學術交流對話、文苑沙龍及院相關學程開設等相關活動，至少7場次，每場次以1分計，最高可得7分，未達7場次者依實際參與場次計分。,"[""<1-hop>  [202509142236500733.md]\n\n國立中山大學文學院教師升等初審作業著作送審資料目錄表\n\nCatalog of the Applicant' s Works for Initial Review of Professorship Rank Promotion in the College of Liberal Arts\n\n單位 affiliated department/ institute 教師姓名 applicant's name 填表日期 date 年 月 日 YYYY/MM/DD 現任職級 current rank 擬升等職級 intended promotion rank 申請升等期別 academic year and semester when applying 學年度第 學期 Fall/Spring semester in 20___ (year)\n\n代表著作及參考著作目錄（注意事項如下說明）\n\nCatalog of representative work and reference works (Please refer to the following notes.):\n\n[ 說明 Notes ：\n\n需符合本校「教師升等審查辦法」及「文學院教師升等審查要點」第二條規定：「教師所提 外審之學術研究成果件數至多 10 件。代表著作或論文，應於提出申請時已經出版公開發行或 在國內外知名學術刊物發表且為升等前一職級出版或發表者為限。\n\nApplicants shall comply with the University's Regulations for the Evaluation of Professorship Rank Promotion and meet the requirement stipulated in Article 2 of Guidelines on the Evaluation of Professorship Rank Promotion in the College of Liberal Arts : The faculty applying for rank promotion shall submit up to ten academic works for the external evaluation. The representative work submitted for rank promotion shall be published and publicly distributed, or published in renowned domestic or international academic journals within the applicant's current rank.\n\n依教育部「專科以上學校教師資格審定辦法」規定辦理。\n\nApplications shall be handled in accordance with Regulations Governing Accreditation of Teacher Qualifications at Junior Colleges and Institutions of Higher Education formulated by the Ministry of Education.\n\n教師所提專門著作若有屬於「已為接受將定期發表」，請出具證明。\n\nApplicants shall provide the proof of acceptance of any submitted works for rank promotion that are accepted and scheduled for publication.\n\n請參照科技部規定之學術著作目錄格式列出。\n\nPlease compile academic works in the format specified by the National Science and Technology Council.]\n\n（一）代表著作 representative work ：\n\n（二）參考著作 reference works ：\n\n（請依下列方式分類：專書、期刊論文、專書論文、研討會論文、其他）\n\n(Please categorize published works as follows: books, journals papers, book chapters, conference papers, and others.)\n\n本欄如不敷填寫，請另紙繕附 )\n\n(Attached additional A4 pages if necessary.)\n\n申請者簽名確認 Applicant's signature ："", ""<2-hop>  [202509142240120737.md]\n\n國立中山大學文學院教師升等服務績效之各類跨域活動參與一覽表\n\nParticipation Form of Interdisciplinary Activities for Service Performance of Professorship Rank Promotion in the College of Liberal Arts\n\n系所（組） ：\n\n姓名：\n\n擬升等職級：\n\nDepartment/Institute Applicant's name Intended rank promotion\n\n場次 No. 活動日期 date (yyyy/mm/dd) 活動名稱 / 主辦 ( 協辦、參加 ) title of activity (organizer/co- organizer/participant) 系審核 approved by the department/institute 院審核 approved by the College 1 2 3 4 5 6 7\n\n申請教師簽章 Applicant's signature ：\n\n( 日期\n\nYYYY 年 MM 月 DD 日）\n\n註 Notes :\n\n一、 依國立中山大學文學院教師升等審查評分細則辦理，教師申請升等職級期間應完成 參與本學院辦理之「跨系所跨領域對話座談」 、 「跨校際對話座談」 、 「跨國際國際學 術交流對話」 、文苑沙龍及院相關學程開設等相關活動，至少 7 場次，每場次以 1 分 計，至多 7 分 ; 未達者 7 場次者，依實際參與場次數計算。\n\nAccording to Guidelines on the Detailed Implementation of the Evaluation of Professorship Rank Promotion , the faculty applying for rank promotion shall participate in at least seven College-organized activities at their current rank, such as interdepartmental or interdisciplinary dialogue forums, inter-university forums, international academic exchange events, and other related activities held by the College's affiliated units. Points shall be calculated based on the actual number of activities attended (one point each), with a maximum of 7 points granted.\n\n二、 本表請申請升等教師自行填列檢附，俾利計分。\n\nThe faculty applying for rank promotion shall complete and submit this form for accurate calculation.""]",staff,Misspelled queries,medium,"<1-hop>  [202509142236500733.md]

國立中山大學文學院教師升等初審作業著作送審資料目錄表

Catalog of the Applicant' s Works for Initial Review of Professorship Rank Promotion in the College of Liberal Arts

單位 affiliated department/ institute 教師姓名 applicant's name 填表日期 date 年 月 日 YYYY/MM/DD 現任職級 current rank 擬升等職級 intended promotion rank 申請升等期別 academic year and semester when applying 學年度第 學期 Fall/Spring semester in 20___ (year)

代表著作及參考著作目錄（注意事項如下說明）

Catalog of representative work and reference works (Please refer to the following notes.):

[ 說明 Notes ：

需符合本校「教師升等審查辦法」及「文學院教師升等審查要點」第二條規定：「教師所提 外審之學術研究成果件數至多 10 件。代表著作或論文，應於提出申請時已經出版公開發行或 在國內外知名學術刊物發表且為升等前一職級出版或發表者為限。

Applicants shall comply with the University's Regulations for the Evaluation of Professorship Rank Promotion and meet the requirement stipulated in Article 2 of Guidelines on the Evaluation of Professorship Rank Promotion in the College of Liberal Arts : The faculty applying for rank promotion shall submit up to ten academic works for the external evaluation. The representative work submitted for rank promotion shall be published and publicly distributed, or published in renowned domestic or international academic journals within the applicant's current rank.

依教育部「專科以上學校教師資格審定辦法」規定辦理。

Applications shall be handled in accordance with Regulations Governing Accreditation of Teacher Qualifications at Junior Colleges and Institutions of Higher Education formulated by the Ministry of Education.

教師所提專門著作若有屬於「已為接受將定期發表」，請出具證明。

Applicants shall provide the proof of acceptance of any submitted works for rank promotion that are accepted and scheduled for publication.

請參照科技部規定之學術著作目錄格式列出。

Please compile academic works in the format specified by the National Science and Technology Council.]

（一）代表著作 representative work ：

（二）參考著作 reference works ：

（請依下列方式分類：專書、期刊論文、專書論文、研討會論文、其他）

(Please categorize published works as follows: books, journals papers, book chapters, conference papers, and others.)

本欄如不敷填寫，請另紙繕附 )

(Attached additional A4 pages if necessary.)

申請者簽名確認 Applicant's signature ：","<2-hop>  [202509142240120737.md]

國立中山大學文學院教師升等服務績效之各類跨域活動參與一覽表

Participation Form of Interdisciplinary Activities for Service Performance of Professorship Rank Promotion in the College of Liberal Arts

系所（組） ：

姓名：

擬升等職級：

Department/Institute Applicant's name Intended rank promotion

場次 No. 活動日期 date (yyyy/mm/dd) 活動名稱 / 主辦 ( 協辦、參加 ) title of activity (organizer/co- organizer/participant) 系審核 approved by the department/institute 院審核 approved by the College 1 2 3 4 5 6 7

申請教師簽章 Applicant's signature ：

( 日期

YYYY 年 MM 月 DD 日）

註 Notes :

一、 依國立中山大學文學院教師升等審查評分細則辦理，教師申請升等職級期間應完成 參與本學院辦理之「跨系所跨領域對話座談」 、 「跨校際對話座談」 、 「跨國際國際學 術交流對話」 、文苑沙龍及院相關學程開設等相關活動，至少 7 場次，每場次以 1 分 計，至多 7 分 ; 未達者 7 場次者，依實際參與場次數計算。

According to Guidelines on the Detailed Implementation of the Evaluation of Professorship Rank Promotion , the faculty applying for rank promotion shall participate in at least seven College-organized activities at their current rank, such as interdepartmental or interdisciplinary dialogue forums, inter-university forums, international academic exchange events, and other related activities held by the College's affiliated units. Points shall be calculated based on the actual number of activities attended (one point each), with a maximum of 7 points granted.

二、 本表請申請升等教師自行填列檢附，俾利計分。

The faculty applying for rank promotion shall complete and submit this form for accurate calculation.",202509142236500733.md,202509142240120737.md,"['教授職級晉升', '教授職級升等']",文學院↔文學院,教授職級晉升↔教授職級升等,5.0,4.39,5.0,5.0,5.0,2.02,5.0
國立中山大學管理學院如何透過獎補助政策支持學生的職涯發展活動及國際碩士專業課程學生參加華語文能力測驗？,國立中山大學管理學院透過獎補助政策支持學生職涯發展活動，包括補助系所開課及辦理職涯探索業務費用、職涯發展活動（如企業參訪、職涯講座、模擬面試、學生分享會等）、建置學生職涯導航專區網頁，以及開設產業/實務模組課程和國際化模組課程。這些活動和課程均有明確的補助金額上限，並需依規定程序申請及提交成果報告。此外，國立中山大學管理學院國際碩士專業課程（IBMBA及GHRM MBA）學生可申請華語文能力測驗（TOCFL）報名費補助，補助對象為在學期間參加TOCFL測驗的學生，補助一次，申請需提交相關文件並於指定期間內申請，補助經費來源為該碩士專業課程的學費收入。,"[""<1-hop>  [202509161512430742.md]\n\n一、 目的\n\n國立中山大學管理學院 ( 以下簡稱本院 ) 為鼓勵本院學生應用專業學科知 識於實際工作場所，培養學術及實務經驗兼備之人才增進與企業的互 動關係，特訂定本要點。\n\nI. Purpose\n\nThis Regulation was put in place to encourage students of the National Sun Yat-sen University College of Management (hereon referred to as the 'College') to apply their professional knowledge in the workplace, to cultivate talents with both academic and practical experiences and to build relationships with firms(organizations).\n\n國立中山大學管理學院\n\n鼓勵系所辦理職涯發展活動獎補助要點\n\nNational Sun Yat-sen University College of Management Regulation Governing the Subsidy for Promoting Departmental Career Development Activities\n\n104.11.11. 104 學年度第 6 次主管會議通過\n\nApproved by the 6th Directors' Council on November 11, 2015\n\n104.11.24 104 學年度第 2 次院務會議通過\n\nApproved by the 2nd College Affairs Council on November 24, 2015\n\n104.12.3. 校長核定\n\nApproved by the University President on December 3, 2015\n\n105.12.28. 105 學年度第 6 次主管會議修正通過\n\nAmended and Approved by the 6th Directors' Council on December 28, 2016 106.3.01 105 學年度第 3 次院務會議修正通過\n\nAmended and Approved by the 3rd College Affairs Council on March\n\n1, 2017\n\n106.03.06 校長修正核定\n\nApproved by the University President on March 6, 2017 108.5.8 107 學年度第 4 次院務會議修正通過\n\nAmended and Approved by the 4th College Affairs Council on May 8, 2019\n\n108.5.16 校長修正核定\n\nApproved by the University President on May 16, 2019 108.10.1 108 學年度第 1 次院務會議修正通過\n\nAmended and Approved by the 1st College Affairs Council on October 1, 2019 108.10.7 校長修正核定\n\nApproved by the University President on October 7, 2019\n\n109.05.12 108 學年度第 4 次院務會議修正通過\n\nAmended and Approved by the 4th College Affairs Council on May 12, 2020 109.05.15 校長修正核定\n\nApproved by the University President on May 15, 2020\n\n110.03.09 109 學年度第 3 次院務會議修正通過\n\nAmended and Approved by the 3rd College Affairs Council on March 9, 2021 110.04.01 校長修正核定\n\nApproved by the University President on April 1, 2021\n\n二、 獎補助對象及名詞定義\n\n本要點獎補助本院系所或學程所屬專任教師（含約聘教師）及於實習 期間具有本院正式學籍之學生。\n\n本要點所稱校外實習 ( 不含海外實習 ) ，係指非為從事志工服務、校外打 工，且與學生在本校所學之專業學科有關者。\n\n所稱校外實習機構，係提供學生實習機會之企業、機構，並與系所簽 訂實習合約、實習計畫或正式文件者。\n\nII. Reward recipients and definition of terms\n\nThis Regulation is to support full-time faculty (including contracted faculty) of the College's departments and programs, as well as students of the College who maintain student-status during their internships.\n\nOff-campus internships (not including internships abroad) mentioned in this Regulation are defined as non-volunteer work, non-off-campus part-time work AND work that is related to the student's major during his/her time in the university.\n\nOff-campus internship institutions are defined as firms or institutions that provide students with internship opportunities AND have signed internship agreements, internship plans or formal documentation with departments.\n\n三、 奬補助項目\n\nIII. Reward funded items\n\n( 一 )\n\n補助系所（學程）開課及辦理相關職涯探索業務費用，修課人數 達 10 人以上 ( 含 ) 者，補助 5 學年補助二門課程為限；所或學程開課者，每學年補助一門課程 為限。\n\n給予學分之校外實習課程： 萬元業務費。本院所屬系開課者，每\n\nOff-campus internships for credit:\n\n(1)\n\nA funding amount of NTD $50,000 will be provided to support departments (programs) in offering courses and hosting career discovering events. Ten or more students must be enrolled in each course. For courses offered by departments, a maximum of two courses can receive support each academic year; for courses offered by institutes or programs, a maximum of one course can receive support each academic year.\n\n( 二 ) 系所辦理職涯發展活動： 為增進本院學生對未來產業、職場環境之瞭解，配合本院規劃時 程（如附件 1 ）辦理企業參訪、職涯講座、企業模擬面試或實習學 生分享會等增進學生探索職涯相關活動，事先提出計畫書，依每 系所（學程）活動內容及次數補助業務費上限 5 萬元。\n\n(2) Career development activities held by the Department:\n\n(3)\n\nDepartment-created student career navigation websites shall be and share renowned industry alumni information, or other provided according to the outcome.\n\nTo further students' understanding of future industries and work environments, departments shall host company visits, career development seminars, mock job interviews, internship experience sharing or other student career discovering activities, in tandem with the College's event schedule (see Attachment 1). Departments shall submit proposals. A maximum support funding of NTD $50,000 shall be provided, according to each department, institute or program's proposed activities and number of events.\n\n( 三 ) 建置學生職涯導航專區網頁：\n\n系所建置學生進路專區，並定期更新學生流向及就業分析、至知 名企業任職校友資訊及分享等資訊者，依成果補助業務費上限 2\n\n萬元。\n\nThe creation of a student career navigation website: regularly updated to provide student career placement information information. A maximum support funding of NTD $20,000 will be\n\n( 四 ) 開設產業 / 實務（ Action Learning ）模組課程 : 課程中與產業 / 實務合作，由合作企業、法人或政府單位參與，每 一合作單位有專人擔任輔導窗口，課程設計由學生個人或組隊， 利用課程教授之專業知識和技術替合作單位解決問題，最後提出 報告，並回饋予合作企業、法人或政府單位。每門課程補助上限 10 萬元。\n\nIn partnership with companies, public/private legal entities and government agencies, each partnering unit shall have a designated communication liaison to provide guidance. The course shall be designed by the student or team of students and shall utilize the professional knowledge and skills taught by the course professor to help solve the partnering institution's problems. At the end of the course, the students shall give a presentation and contribute to the partnering company, public/private legal entity or government agency. Each course shall receive a maximum support funding of\n\n(4) Offering Action Learning Courses NTD $100,000.\n\n( 五 ) 開設國際化模組課程： 課程中設計有讓學生與國外大學學生互動之跨文化學習（如共同 計實際至國外企業、法人或政府單位，用課程教授之專業知識和\n\n參與線上課程，二地學生分組合作，共同完成專案） ；或課程設 技術替合作單位解決問題並提出報告書（非單純海外參訪） 。每 門課程補助上限 20 萬元。\n\n(5) Offering Global Courses\n\nCourses designed to provide an opportunity for students to interact with students from foreign universities and engage in cross-country culture exchange (for example, participating in online courses, teamwork between students from different locations, and working together to complete a project); or courses designed to visit companies, legal entities or government agencies abroad in- person and utilize the professional knowledge and skills taught by the course professor to help solve the partnering institution's problems (not solely for the purpose of academic visits abroad). Each course shall receive a maximum support funding of NTD $200,000.\n\n四、 申請程序及義務\n\n當學期審當學期案子 ( 含暑假 ) ，並於開學二週內提交至院辦公室，經院 長召集院內教師 3 至 5 人組成審查小組後公告核定金額。\n\n申請本要點補助者，系所須配合院規劃時程 ( 如附件 1) 辦理職涯發展活 動，並於活動前一個月通知院辦公室，以公告於網頁周知。\n\n於學期結束或活動結束後提交相關成果報告予院辦公室彙整上網公告。\n\n前項所稱成果報告，屬第 3 條第 1 項之校外實習課程及第 4 項開設產業 / 實務\n\n（ Action Learning ）模組課程，須包含「機構對學生滿意度調查表」 ( 如附件 2) 及「學生對機構滿意度調查表」 ( 如附件 3) 。\n\nIV. Application Process and Responsibilities\n\nApplication process is only opened to the applications of current semester (including summer vacation). Applications shall be submitted to the Dean's Office within the first two weeks of each new semester. The funding amount will be announced upon review and approval by the review committee formed by the Dean and 3-5 College faculty members.\n\nFor applicants of this Regulation, affiliated-departments should set up career development events in tandem with the College's event schedule (see Attachment 1) and shall notify the Dean's\n\nOffice one month prior to the event so that event details can be shared on the College website.\n\nUpon conclusion of the academic semester or of the event, recipients shall submit outcome reports to the Dean's Office for compiling and announcement on the College website.\n\nThe aforementioned performance report belonging to Article 3 Item 1 of the off-campus internship course and Item 4 of the establishment of action learning courses should include 'Student Action Learning- Company\n\nSatisfaction Survey of Students' (see Attachment 2) and 'Student Action Learning- Student Satisfaction Survey of Company' (see Attachment 3).\n\n五、 獎補助限制\n\n系所若已獲得校內外其他單位獎補助者，僅以本要點規定額度與已獲校 內外單位額度之差額予以獎補助。\n\nV. Reward Restrictions\n\nDepartments that are recipients of other on-campus/off-campus funding are only eligible to receive a support amount of the difference between the maximum amount as listed in this Regulation and the already-received amount.\n\n六、 經費來源\n\n本要點所須經費由本院之在職專班結餘款項下或教育部高教深耕計畫或 其他相關經費支應。\n\nVI. Source of Funding\n\nThe source of funding for this Regulation will be supported by the remaining funds of the College's part-time programs or by the Ministry of Education's Higher Education Sprout Project or other related-funding.\n\n七、 施行與修正\n\n本要點經院務會議通過，陳請校長核定後施行，修正時亦同。\n\nVII. Implementation and Amendments\n\nThis Regulation, as well as its amendments, is effective upon review and approval of the College Affairs Council and the University President.\n\nAttachment 1: Event Planning\n\nI.\n\nDepartmental Career Development\n\nSeminars Time: October to November of each academic year\n\nTargeted to: Undergraduate freshmen and first-year graduate students Description: Departments shall invite alumni and industry experts (senior management personnel) to share experience regarding industrial development and environment. Events hosted by individual departments shall be made open to students outside of the hosting department.\n\nHosting party: Individual departments\n\nScope of funding: Attendance and transportation fees of off-campus experts; faculty hourly pay and other event-related fees\n\nApplication period: Available each first semester\n\nII. Company Visits\n\nTime: No restrictions\n\nTargeted to: No restrictions\n\nDescription: Departments shall schedule company visits during class/non-class hours\n\nHosting party: Individual departments\n\nScore of funding: Bus transportation and insurance fees\n\nIII. Resume and Mock Interviews\n\nTime: April to May of the 2nd academic semester\n\nTargeted to: Undergraduate Seniors or 2nd year Master students/soon- to-be graduates\n\nDescription: Alumni, personnel who hold senior management positions, or faculty of the College are invited to serve as mock-interviewers\n\nHosting party: College of Management Dean's Office or individual departments/institutes\n\nCompany recruitment and career fair\n\nIV. events\n\nTime: March to May of the 2nd academic semester\n\nTargeted to: Undergraduate Seniors or 2nd year Master students/soonto-be graduates\n\nDescription: Starting from December, departments shall actively invite large firms to participate in company recruitment and career fair events (scheduled by the College to take place in April and May). Discount for space fees and assistance in event promotion will be provided.\n\nHosting party: College of Management Dean's Office"", '<2-hop>  [202202211350450073.md]\n\nInternational Master Programs, College of Management, National Sun Yat-sen University\n\nRegulations Governing Awards & Subsidies for the Test of Chinese as a Foreign Language\n\nApproved by the 3 rd Program Affairs Meeting for the 2 nd Semester of Academic Year 2 0 1 8 / 1 9 on May 2 nd 2019.\n\nI. Aim:\n\nThese Regulations are enacted to encourage students studying the International Master Programs (IBMBA and GHRM MBA) to take the Test of Chinese as a Foreign Language (TOCFL), so as to strengthen and improve their Chinese proficiency.\n\nII.\n\nSource of funding: Tuition revenue for the IBMBA and GHRM MBA\n\nIII. Application criteria:\n\nIt is a one-time subsidy for IBMBA or GHRM MBA students who take the TOCFL at any level (preferably A2) during their studies.\n\nIV. Application documents:\n\n(1) TOCFL Registration Fee Subsidy Application Form\n\n(2) An original copy and a photocopy of the transcript (the original copy will be returned after verification)\n\n(3) Payment receipt (such as remittance or credit card payment details)\n\n(4) A photocopy of student ID\n\n(5) A photocopy of passport. Also, a photocopy entry/exit stamp on a passport is required if the applicant has been resided in the Republic of China for 183 days in the current year.\n\n(6) A photocopy of Alien Resident Certificate (ARC)\n\n(7) A photocopy of postal or bank passbook\n\nV. Item eligible for a subsidy:\n\nCategory Level Amount of Subsidy TOCFL Any level (preferably A2) Registration fee for Listening and Reading Tests\n\nVI. Application dates:\n\nFirst semester: From November 1 st to November 15 th every year\n\nSecond semester: From May 1 st\n\nto May 15 th every year\n\nVII. Number of subsidies given and method by which they are granted: Subsidies will only be given once to test takers, regardless of the level and the result of the test. Please download the application form from IBMBA and GHRM MBA website, fill in the form within the application period and submit the completed form to the Office of the IBMBA and GHRM MBA for review. The list of subsidy recipients will be announced after their applications have been approved.\n\nVIII. These Regulations will be implemented upon approval by the Program Affairs Meeting. Amendments to the Regulations shall be processed accordingly.']",teacher,Misspelled queries,short,"<1-hop>  [202509161512430742.md]

一、 目的

國立中山大學管理學院 ( 以下簡稱本院 ) 為鼓勵本院學生應用專業學科知 識於實際工作場所，培養學術及實務經驗兼備之人才增進與企業的互 動關係，特訂定本要點。

I. Purpose

This Regulation was put in place to encourage students of the National Sun Yat-sen University College of Management (hereon referred to as the 'College') to apply their professional knowledge in the workplace, to cultivate talents with both academic and practical experiences and to build relationships with firms(organizations).

國立中山大學管理學院

鼓勵系所辦理職涯發展活動獎補助要點

National Sun Yat-sen University College of Management Regulation Governing the Subsidy for Promoting Departmental Career Development Activities

104.11.11. 104 學年度第 6 次主管會議通過

Approved by the 6th Directors' Council on November 11, 2015

104.11.24 104 學年度第 2 次院務會議通過

Approved by the 2nd College Affairs Council on November 24, 2015

104.12.3. 校長核定

Approved by the University President on December 3, 2015

105.12.28. 105 學年度第 6 次主管會議修正通過

Amended and Approved by the 6th Directors' Council on December 28, 2016 106.3.01 105 學年度第 3 次院務會議修正通過

Amended and Approved by the 3rd College Affairs Council on March

1, 2017

106.03.06 校長修正核定

Approved by the University President on March 6, 2017 108.5.8 107 學年度第 4 次院務會議修正通過

Amended and Approved by the 4th College Affairs Council on May 8, 2019

108.5.16 校長修正核定

Approved by the University President on May 16, 2019 108.10.1 108 學年度第 1 次院務會議修正通過

Amended and Approved by the 1st College Affairs Council on October 1, 2019 108.10.7 校長修正核定

Approved by the University President on October 7, 2019

109.05.12 108 學年度第 4 次院務會議修正通過

Amended and Approved by the 4th College Affairs Council on May 12, 2020 109.05.15 校長修正核定

Approved by the University President on May 15, 2020

110.03.09 109 學年度第 3 次院務會議修正通過

Amended and Approved by the 3rd College Affairs Council on March 9, 2021 110.04.01 校長修正核定

Approved by the University President on April 1, 2021

二、 獎補助對象及名詞定義

本要點獎補助本院系所或學程所屬專任教師（含約聘教師）及於實習 期間具有本院正式學籍之學生。

本要點所稱校外實習 ( 不含海外實習 ) ，係指非為從事志工服務、校外打 工，且與學生在本校所學之專業學科有關者。

所稱校外實習機構，係提供學生實習機會之企業、機構，並與系所簽 訂實習合約、實習計畫或正式文件者。

II. Reward recipients and definition of terms

This Regulation is to support full-time faculty (including contracted faculty) of the College's departments and programs, as well as students of the College who maintain student-status during their internships.

Off-campus internships (not including internships abroad) mentioned in this Regulation are defined as non-volunteer work, non-off-campus part-time work AND work that is related to the student's major during his/her time in the university.

Off-campus internship institutions are defined as firms or institutions that provide students with internship opportunities AND have signed internship agreements, internship plans or formal documentation with departments.

三、 奬補助項目

III. Reward funded items

( 一 )

補助系所（學程）開課及辦理相關職涯探索業務費用，修課人數 達 10 人以上 ( 含 ) 者，補助 5 學年補助二門課程為限；所或學程開課者，每學年補助一門課程 為限。

給予學分之校外實習課程： 萬元業務費。本院所屬系開課者，每

Off-campus internships for credit:

(1)

A funding amount of NTD $50,000 will be provided to support departments (programs) in offering courses and hosting career discovering events. Ten or more students must be enrolled in each course. For courses offered by departments, a maximum of two courses can receive support each academic year; for courses offered by institutes or programs, a maximum of one course can receive support each academic year.

( 二 ) 系所辦理職涯發展活動： 為增進本院學生對未來產業、職場環境之瞭解，配合本院規劃時 程（如附件 1 ）辦理企業參訪、職涯講座、企業模擬面試或實習學 生分享會等增進學生探索職涯相關活動，事先提出計畫書，依每 系所（學程）活動內容及次數補助業務費上限 5 萬元。

(2) Career development activities held by the Department:

(3)

Department-created student career navigation websites shall be and share renowned industry alumni information, or other provided according to the outcome.

To further students' understanding of future industries and work environments, departments shall host company visits, career development seminars, mock job interviews, internship experience sharing or other student career discovering activities, in tandem with the College's event schedule (see Attachment 1). Departments shall submit proposals. A maximum support funding of NTD $50,000 shall be provided, according to each department, institute or program's proposed activities and number of events.

( 三 ) 建置學生職涯導航專區網頁：

系所建置學生進路專區，並定期更新學生流向及就業分析、至知 名企業任職校友資訊及分享等資訊者，依成果補助業務費上限 2

萬元。

The creation of a student career navigation website: regularly updated to provide student career placement information information. A maximum support funding of NTD $20,000 will be

( 四 ) 開設產業 / 實務（ Action Learning ）模組課程 : 課程中與產業 / 實務合作，由合作企業、法人或政府單位參與，每 一合作單位有專人擔任輔導窗口，課程設計由學生個人或組隊， 利用課程教授之專業知識和技術替合作單位解決問題，最後提出 報告，並回饋予合作企業、法人或政府單位。每門課程補助上限 10 萬元。

In partnership with companies, public/private legal entities and government agencies, each partnering unit shall have a designated communication liaison to provide guidance. The course shall be designed by the student or team of students and shall utilize the professional knowledge and skills taught by the course professor to help solve the partnering institution's problems. At the end of the course, the students shall give a presentation and contribute to the partnering company, public/private legal entity or government agency. Each course shall receive a maximum support funding of

(4) Offering Action Learning Courses NTD $100,000.

( 五 ) 開設國際化模組課程： 課程中設計有讓學生與國外大學學生互動之跨文化學習（如共同 計實際至國外企業、法人或政府單位，用課程教授之專業知識和

參與線上課程，二地學生分組合作，共同完成專案） ；或課程設 技術替合作單位解決問題並提出報告書（非單純海外參訪） 。每 門課程補助上限 20 萬元。

(5) Offering Global Courses

Courses designed to provide an opportunity for students to interact with students from foreign universities and engage in cross-country culture exchange (for example, participating in online courses, teamwork between students from different locations, and working together to complete a project); or courses designed to visit companies, legal entities or government agencies abroad in- person and utilize the professional knowledge and skills taught by the course professor to help solve the partnering institution's problems (not solely for the purpose of academic visits abroad). Each course shall receive a maximum support funding of NTD $200,000.

四、 申請程序及義務

當學期審當學期案子 ( 含暑假 ) ，並於開學二週內提交至院辦公室，經院 長召集院內教師 3 至 5 人組成審查小組後公告核定金額。

申請本要點補助者，系所須配合院規劃時程 ( 如附件 1) 辦理職涯發展活 動，並於活動前一個月通知院辦公室，以公告於網頁周知。

於學期結束或活動結束後提交相關成果報告予院辦公室彙整上網公告。

前項所稱成果報告，屬第 3 條第 1 項之校外實習課程及第 4 項開設產業 / 實務

（ Action Learning ）模組課程，須包含「機構對學生滿意度調查表」 ( 如附件 2) 及「學生對機構滿意度調查表」 ( 如附件 3) 。

IV. Application Process and Responsibilities

Application process is only opened to the applications of current semester (including summer vacation). Applications shall be submitted to the Dean's Office within the first two weeks of each new semester. The funding amount will be announced upon review and approval by the review committee formed by the Dean and 3-5 College faculty members.

For applicants of this Regulation, affiliated-departments should set up career development events in tandem with the College's event schedule (see Attachment 1) and shall notify the Dean's

Office one month prior to the event so that event details can be shared on the College website.

Upon conclusion of the academic semester or of the event, recipients shall submit outcome reports to the Dean's Office for compiling and announcement on the College website.

The aforementioned performance report belonging to Article 3 Item 1 of the off-campus internship course and Item 4 of the establishment of action learning courses should include 'Student Action Learning- Company

Satisfaction Survey of Students' (see Attachment 2) and 'Student Action Learning- Student Satisfaction Survey of Company' (see Attachment 3).

五、 獎補助限制

系所若已獲得校內外其他單位獎補助者，僅以本要點規定額度與已獲校 內外單位額度之差額予以獎補助。

V. Reward Restrictions

Departments that are recipients of other on-campus/off-campus funding are only eligible to receive a support amount of the difference between the maximum amount as listed in this Regulation and the already-received amount.

六、 經費來源

本要點所須經費由本院之在職專班結餘款項下或教育部高教深耕計畫或 其他相關經費支應。

VI. Source of Funding

The source of funding for this Regulation will be supported by the remaining funds of the College's part-time programs or by the Ministry of Education's Higher Education Sprout Project or other related-funding.

七、 施行與修正

本要點經院務會議通過，陳請校長核定後施行，修正時亦同。

VII. Implementation and Amendments

This Regulation, as well as its amendments, is effective upon review and approval of the College Affairs Council and the University President.

Attachment 1: Event Planning

I.

Departmental Career Development

Seminars Time: October to November of each academic year

Targeted to: Undergraduate freshmen and first-year graduate students Description: Departments shall invite alumni and industry experts (senior management personnel) to share experience regarding industrial development and environment. Events hosted by individual departments shall be made open to students outside of the hosting department.

Hosting party: Individual departments

Scope of funding: Attendance and transportation fees of off-campus experts; faculty hourly pay and other event-related fees

Application period: Available each first semester

II. Company Visits

Time: No restrictions

Targeted to: No restrictions

Description: Departments shall schedule company visits during class/non-class hours

Hosting party: Individual departments

Score of funding: Bus transportation and insurance fees

III. Resume and Mock Interviews

Time: April to May of the 2nd academic semester

Targeted to: Undergraduate Seniors or 2nd year Master students/soon- to-be graduates

Description: Alumni, personnel who hold senior management positions, or faculty of the College are invited to serve as mock-interviewers

Hosting party: College of Management Dean's Office or individual departments/institutes

Company recruitment and career fair

IV. events

Time: March to May of the 2nd academic semester

Targeted to: Undergraduate Seniors or 2nd year Master students/soonto-be graduates

Description: Starting from December, departments shall actively invite large firms to participate in company recruitment and career fair events (scheduled by the College to take place in April and May). Discount for space fees and assistance in event promotion will be provided.

Hosting party: College of Management Dean's Office","<2-hop>  [202202211350450073.md]

International Master Programs, College of Management, National Sun Yat-sen University

Regulations Governing Awards & Subsidies for the Test of Chinese as a Foreign Language

Approved by the 3 rd Program Affairs Meeting for the 2 nd Semester of Academic Year 2 0 1 8 / 1 9 on May 2 nd 2019.

I. Aim:

These Regulations are enacted to encourage students studying the International Master Programs (IBMBA and GHRM MBA) to take the Test of Chinese as a Foreign Language (TOCFL), so as to strengthen and improve their Chinese proficiency.

II.

Source of funding: Tuition revenue for the IBMBA and GHRM MBA

III. Application criteria:

It is a one-time subsidy for IBMBA or GHRM MBA students who take the TOCFL at any level (preferably A2) during their studies.

IV. Application documents:

(1) TOCFL Registration Fee Subsidy Application Form

(2) An original copy and a photocopy of the transcript (the original copy will be returned after verification)

(3) Payment receipt (such as remittance or credit card payment details)

(4) A photocopy of student ID

(5) A photocopy of passport. Also, a photocopy entry/exit stamp on a passport is required if the applicant has been resided in the Republic of China for 183 days in the current year.

(6) A photocopy of Alien Resident Certificate (ARC)

(7) A photocopy of postal or bank passbook

V. Item eligible for a subsidy:

Category Level Amount of Subsidy TOCFL Any level (preferably A2) Registration fee for Listening and Reading Tests

VI. Application dates:

First semester: From November 1 st to November 15 th every year

Second semester: From May 1 st

to May 15 th every year

VII. Number of subsidies given and method by which they are granted: Subsidies will only be given once to test takers, regardless of the level and the result of the test. Please download the application form from IBMBA and GHRM MBA website, fill in the form within the application period and submit the completed form to the Office of the IBMBA and GHRM MBA for review. The list of subsidy recipients will be announced after their applications have been approved.

VIII. These Regulations will be implemented upon approval by the Program Affairs Meeting. Amendments to the Regulations shall be processed accordingly.",202509161512430742.md,202202211350450073.md,"['National Sun Yat-sen University', 'National Sun Yat-sen University College of Management']",管理學院↔管理學院,National Sun Yat-sen University College of Management↔National Sun Yat-sen University,5.0,5.0,5.0,5.0,5.0,2.0,5.0
請問國立中山大學如何透過特殊教育推行委員會與學生事務處諮商與健康促進組資源教室，協同推動無障礙環境設置及改善，並制定個別化支持計畫以支持特殊教育學生？,國立中山大學設有特殊教育推行委員會，該委員會負責督導改善校園無障礙環境及學校無障礙網頁，並審查特殊個案之個別化支持計畫。此外，學生事務處諮商與健康促進組設置資源教室，專責辦理特殊教育學生各項輔導業務，包括訂定個別化支持計畫及提供支持服務，並協助辦理無障礙環境之設置及改善。兩者透過協調各處室、院、系所行政分工合作，整合校內外特殊教育資源，共同推動無障礙環境設置及改善，並落實特殊教育學生的個別化支持計畫。,"['<1-hop>  [202411271405560461.md]\n\n國立中山大學特殊教育推行委員會組成與運作要點\n\n102 年 10 月 16 日本校 102 學年度第 1 學期學務處第 3 次組長會議通過 102 年 11 月 27 日本校 102 學年度第 1 學期第 1 次行政協調會報修正通過 102 年 12 月 11 日本校 102 學年度第 1 學期第 8 次行政會議通過 111 年 3 月 30 日本校 110 學年度第 2 學期第 4 次行政會議修正通過 113 年 11 月 13 日本校 113 學年度第 1 學期第 3 次協調會報通過 113 年 11 月 20 日本校 113 學年度第 1 學期第 7 次行政會議通過\n\n一、 本校為推動特殊教育學生之學習輔導等事宜，依據特殊教育 法及大專校院特殊教育推行委員會組成與運作方式參考原則， 訂定本要點。\n\n二、 本校為辦理特殊教育學生學習輔導工作，並落實各項支持性 服務，成立特殊教育推行委員會 ( 以下簡稱本會 ) ，其任務如下：\n\n( 一 ) 審議特殊教育方案或年度工作計畫。\n\n( 二 ) 審議特殊教育經費編列、運用與執行情形。\n\n(\n\n三 ) 審查特殊個案之個別化支持計畫、交通車或交通補助費 及學期最低修課學分數等事宜。\n\n四 ) 協調各處室、院、系所行政分工合作，並整合校內外特\n\n( 殊教育資源。\n\n( 五 ) 協調各系提供身心障礙學生甄試及單招名額。\n\n( 六 )\n\n督導改善校園無障礙環境及學校無障礙網頁。\n\n( 七 ) 督導特殊教育自我評鑑及定期追蹤。\n\n( 八 )\n\n其他特殊教育相關業務。\n\n三、 本會置委員十三人，其中學生事務長為召集人，除當然委員 外，其餘委員由學生事務長推薦、經校長同意後聘（派）兼 之：\n\n( 一 ) 教務長、總務長、圖書與資訊處處長、西灣學院院長、 學生事務處諮商與健康促進組組長為當然委員。\n\n( 二 ) 教師與學生代表。 委員任期一年，期滿得續聘（派）之。\n\n委員之組成，任一性別委員應佔委員總數三分之一以上。 本會置執行秘書一人，由學生事務處諮商與健康促進組\n\n組長兼任。\n\n四、 本會每學期應召開會議一次，必要時，得召開臨時會，由召集人 擔任主席；召集人不能出席會議時，由其指派委員或由委員互 推一人擔任主席。本會之決議，以過半數委員出席，出席委員 過半數同意行之。\n\n本會必要時，得邀請專家學者或民間團體出席指導，或請相關 系、所、學生或家長列席說明。\n\n五、 本會委員之開會及表決，有關利益迴避之規定，適用或準用 行政程序法第三十二條及第三十三條之規定。\n\n六、 本要點經行政會議通過，陳請校長核定後實施，修正時亦同。', '<2-hop>  [202204201147110152.md]\n\n國立中山大學學生事務處諮商與健康促進組資源教室設置要點\n\n104.10.20 本校 104 學年度第 1 學期特殊教育推行委員會會議修訂通過 111.03.30 本校 110 學年度第 2 學期第 4 次行政會議修正通過\n\n一、 國立中山大學 ( 以下簡稱本校 ) 為落實在校特殊教育學生輔導與支持服務，協助其校園學 習、生活之適應，特依據「特殊教育法」設置資源教室，並制定「國立中山大學學生事 務處諮商與健康促進組資源教室設置要點」 ( 以下簡稱本要點 ) 。\n\n二、 本校學生事務處諮商與健康促進組設置資源教室，專責辦理本校特殊教育學生各項輔導 業務。\n\n三、 資源教室依據教育部「高等教育階段學校特殊教育專責單位設置及人員進用辦法」 、 「教 育部補助大專校院招收及輔導身心障礙學生實施要點」 ，向教育部申請補助聘用輔導人員 若干名，薪資標準依「國立中山大學約用行政人員薪點報酬標準表」敘薪。\n\n四、 資源教室服務與輔導項目如下：\n\n( 一 ) 訂定及實施特殊教育方案相關事項。\n\n( 二 ) 訂定及執行學校年度特殊教育工作計畫。\n\n( 三 ) 協助身心障礙學生申請鑑定等相關事項。\n\n( 四 ) 訂定個別化支持計畫及提供支持服務等相關事項。\n\n( 五 ) 協助辦理無障礙環境之設置及改善。\n\n( 六 ) 其他特殊教育相關業務。\n\n五、 資源教室經費來源為「教育部補助大專校院輔導身心障礙學生工作計畫」專案補助、本 校身心障礙獎勵金及其他補助。\n\n六、 本要點經本校特殊教育推行委員會會議通過後，陳請校長核定後實施，修訂時亦同。']",teacher,Perfect grammar,long,"<1-hop>  [202411271405560461.md]

國立中山大學特殊教育推行委員會組成與運作要點

102 年 10 月 16 日本校 102 學年度第 1 學期學務處第 3 次組長會議通過 102 年 11 月 27 日本校 102 學年度第 1 學期第 1 次行政協調會報修正通過 102 年 12 月 11 日本校 102 學年度第 1 學期第 8 次行政會議通過 111 年 3 月 30 日本校 110 學年度第 2 學期第 4 次行政會議修正通過 113 年 11 月 13 日本校 113 學年度第 1 學期第 3 次協調會報通過 113 年 11 月 20 日本校 113 學年度第 1 學期第 7 次行政會議通過

一、 本校為推動特殊教育學生之學習輔導等事宜，依據特殊教育 法及大專校院特殊教育推行委員會組成與運作方式參考原則， 訂定本要點。

二、 本校為辦理特殊教育學生學習輔導工作，並落實各項支持性 服務，成立特殊教育推行委員會 ( 以下簡稱本會 ) ，其任務如下：

( 一 ) 審議特殊教育方案或年度工作計畫。

( 二 ) 審議特殊教育經費編列、運用與執行情形。

(

三 ) 審查特殊個案之個別化支持計畫、交通車或交通補助費 及學期最低修課學分數等事宜。

四 ) 協調各處室、院、系所行政分工合作，並整合校內外特

( 殊教育資源。

( 五 ) 協調各系提供身心障礙學生甄試及單招名額。

( 六 )

督導改善校園無障礙環境及學校無障礙網頁。

( 七 ) 督導特殊教育自我評鑑及定期追蹤。

( 八 )

其他特殊教育相關業務。

三、 本會置委員十三人，其中學生事務長為召集人，除當然委員 外，其餘委員由學生事務長推薦、經校長同意後聘（派）兼 之：

( 一 ) 教務長、總務長、圖書與資訊處處長、西灣學院院長、 學生事務處諮商與健康促進組組長為當然委員。

( 二 ) 教師與學生代表。 委員任期一年，期滿得續聘（派）之。

委員之組成，任一性別委員應佔委員總數三分之一以上。 本會置執行秘書一人，由學生事務處諮商與健康促進組

組長兼任。

四、 本會每學期應召開會議一次，必要時，得召開臨時會，由召集人 擔任主席；召集人不能出席會議時，由其指派委員或由委員互 推一人擔任主席。本會之決議，以過半數委員出席，出席委員 過半數同意行之。

本會必要時，得邀請專家學者或民間團體出席指導，或請相關 系、所、學生或家長列席說明。

五、 本會委員之開會及表決，有關利益迴避之規定，適用或準用 行政程序法第三十二條及第三十三條之規定。

六、 本要點經行政會議通過，陳請校長核定後實施，修正時亦同。","<2-hop>  [202204201147110152.md]

國立中山大學學生事務處諮商與健康促進組資源教室設置要點

104.10.20 本校 104 學年度第 1 學期特殊教育推行委員會會議修訂通過 111.03.30 本校 110 學年度第 2 學期第 4 次行政會議修正通過

一、 國立中山大學 ( 以下簡稱本校 ) 為落實在校特殊教育學生輔導與支持服務，協助其校園學 習、生活之適應，特依據「特殊教育法」設置資源教室，並制定「國立中山大學學生事 務處諮商與健康促進組資源教室設置要點」 ( 以下簡稱本要點 ) 。

二、 本校學生事務處諮商與健康促進組設置資源教室，專責辦理本校特殊教育學生各項輔導 業務。

三、 資源教室依據教育部「高等教育階段學校特殊教育專責單位設置及人員進用辦法」 、 「教 育部補助大專校院招收及輔導身心障礙學生實施要點」 ，向教育部申請補助聘用輔導人員 若干名，薪資標準依「國立中山大學約用行政人員薪點報酬標準表」敘薪。

四、 資源教室服務與輔導項目如下：

( 一 ) 訂定及實施特殊教育方案相關事項。

( 二 ) 訂定及執行學校年度特殊教育工作計畫。

( 三 ) 協助身心障礙學生申請鑑定等相關事項。

( 四 ) 訂定個別化支持計畫及提供支持服務等相關事項。

( 五 ) 協助辦理無障礙環境之設置及改善。

( 六 ) 其他特殊教育相關業務。

五、 資源教室經費來源為「教育部補助大專校院輔導身心障礙學生工作計畫」專案補助、本 校身心障礙獎勵金及其他補助。

六、 本要點經本校特殊教育推行委員會會議通過後，陳請校長核定後實施，修訂時亦同。",202411271405560461.md,202204201147110152.md,"['無障礙環境設置及改善', '特殊教育方案', '個別化支持計畫', '無障礙環境']",學生事務處↔學生事務處,特殊教育方案↔特殊教育方案 | 個別化支持計畫↔個別化支持計畫 | 無障礙環境↔無障礙環境設置及改善,5.0,5.0,5.0,5.0,5.0,2.46,5.0
國立中山大學光電工程學系碩士班與資訊工程學系博士班在修業年限與學分要求上有何不同？,根據提供的規定，國立中山大學資訊工程學系博士班的修業年限依教育部規定為二至七年（不含保留入學及休學期間），博士生畢業前必須至少修滿碩士班或博士班課程22學分，其中本系開授課程至少19學分；逕讀博士學位者須修滿40學分，其中本系開授課程至少30學分。博士生前二年每學期必須選修書報討論，每學期至少選修一門三學分課程。相較之下，國立中山大學光電工程學系碩士班的修業年限為一般生一至四年（不含保留入學及休學期間），在職生三至四年，成績優異者可申請兩年畢業。碩士班學生入學後二年內須修畢規定的應修科目及最低畢業學分數26學分，其中需修滿本系開設之光電專業課程15學分（不含專題課程），包含4門必修課程及1門必選修核心課程。學生選課須經指導教授及系主任認可。兩系在修業年限與學分要求上有明顯差異，博士班修業年限較長且學分要求較高，碩士班則有較短的修業年限與較低的學分要求。,"['<1-hop>  [201909101834230665.md]\n\n國立中山大學資訊工程學系 博士班研究生資格考核及學位考試相關規定\n\n103 學年度起入學新生適用\n\n92 年 2 月 26 日系務會議修正通過 92 年 3 月 25 日工學院院務會議修正通過 93 年 12 月 29 日系務會議修正通過 94 年 1 月 25 日工學院院務會議修正通過 94 年 3 月 9 日系務會議修正通過 94 年 3 月 23 日工學院院務會議修正通過 95 年 9 月 27 日系務會議修正通過 95 年 11 月 1 日工學院院務會議修正通過 96 年 3 月 30 日系務會議修正通過 96 年 6 月 15 日工學院院務會議修正通過 97 年 6 月 9 日系務會議修正通過 97 年 6 月 10 日工學院院務會議修正通過 98 年 5 月 20 日系務會議修正通過 98 年 6 月 10 日工學院院務會議修正通過 98 年 9 月 23 日系務會議修正通過 99 年 6 月 28 日工學院院務會議修正通過 101 年 12 月 25 日系務會議修正通過 102 年 3 月 5 日工學院院務會議修正通過 102 年 3 月 29 日系務會議修正通過 102 年 5 月 29 日工學院院務會議修正通過 103 年 2 月 20 日系務會議修正通過 103 年 6 月 6 日系務會議修正通過 103 年 6 月 13 日工學院院務會議修正通過\n\n一、依據教育部頒「學位授予法」暨其施行細則、本校「學則」及「研究生學位 考試施行細則」訂定之。\n\n二、在學期間相關事項：\n\n( 一 ) 修業年限：依教育部規定二至七年 ( 不含保留入學及休學期間 ) 。\n\n( 二 ) 學分制度及修課要求：\n\n本系博士生畢業之前必須至少修滿碩士班或博士班課程 22 學分， 其中本系開授課程至少 19 學分，其餘課程經本系同意後，得選修 相關碩、博士班開授之課程。逕讀博士學位者，至少須修滿 40 學 分，其中本系開授課程至少 30 學分。其碩士班一年級所修之學分， 最多可取三分之二的學分計入博士學位學分，且至多以 12 學分為 限。\n\n申請逕讀博士學位者，於申請前須修畢碩士班必修課程（書報討論 除外）。\n\n本系博士生修業的前二年，每學期必須選修 「書報討論」 （ seminar ） ； 另外，每學期至少須選修一門三學分課程。\n\n本系博士生每學期修讀課程，須經指導教授同意後確定之。如無指 導教授，則須經導師或系主任同意後確定之。\n\n本系博士班研究生畢業英文成績最低標準以通過下列任一檢定標 準且通過之測驗檢定日期應以入學前 2 年之後取得為限：\n\n(1) 多益測驗 TOEIC 成績達 750 分以上。\n\n(2) 全民英檢 (GEPT) 中高級複試 ( 含 ) 以上。\n\n(3) 託福紙筆測驗 (TOFEL ITP)527 分 ( 含 ) 以上\n\n(4) 託福網路化測驗 (TOFEL-iBT)71 分 ( 含 ) 以上。\n\n(5) 國際英語能力測驗 (IELTS)5.5 級 ( 含 ) 以上。\n\n如測驗上述檢定項目二次以上仍未達標準，得修習本系課程委員會 指定之英文相關課程取代且修課成績需及格且為該科全部修課人 數之前二分之一。若以修習英文相關課程方式取代英文成績者，該 學分則不納入畢業學分。\n\n為加強本系博士生的學識能力、研究能力或英文能力，本系得指定 其補修相關課程。\n\n須達本系博士班研究生規定之英文成績標準後，始得以申請學位考 試。\n\n( 三 ) 指導教授選派：\n\n本系博士生以選擇本系助理教授 ( 含 ) 以上專任教師擔任博士論文指 導教授為原則。\n\n若有特殊原因，得選擇非本系之指導教授，但必須選擇一位本系助 理教授 ( 含 ) 以上專任教師為共同指導教授。若需由系外老師共同指 導時，需經指導教授同意後，向繫上提出申請，如共同指導教授指 導學生至其畢業時未達一年以上者，取消其共同指導資格。\n\n本系博士生應於入學後一年內決定其論文指導教授。同學未於期限 內決定指導教授者，將由繫上協調指派指導教授。\n\n若因特殊原因需更換指導教授時，應先徵得原指導教授及新指導教 授同意，並以書面向本系報備。\n\n三、博士學位候選人資格考核：\n\n學期之定義：上學期自每年八月一日至次年一月三十一日、下學期自每年二 月一日至七月三十一日。\n\n( 一 ) 資格考試：\n\n資格考試以筆試行之。各科考試結果由本系系務會議議決「通過」 或「不通過」。\n\n資格考試時間每年分兩梯次，分別於上學期與下學期期末考後一個 月內舉行，本系博士生必須每次資格考試前三星期以前提出申請參 加資格考試的科目。除有特殊原因經本系專案核准外，否則申請後 而缺考者，該科目以零分計（不通過一次）。\n\n每位博士生初次申請資格考試時，必須於下列六科中自行選定四科 做為其「資格考試科目」，確定後不得再更改，且必須通過三科， 每科至多可參加二次考試：\n\n計算機結構（研究所課程）、電腦網路（大學部課程）、作業系統 （大學部課程）、演算法分析與設計（研究所課程）、數位電子學 （大學部課程）、機率學（大學部課程）\n\n資格考試科目至少需以考試方式通過一科（含）以上，未通過考試\n\n之科目，可以修課來抵免 ( 科目若有變更，將於一學期前於繫上網頁 公告 ) ，修課或考試二者可並行。抵免資格考之科目，每科修課以 一次為限，以修課申請抵免之科目，成績必須及格且需為該科全部 修課人數之前二分之一。\n\n本系博士生應在入學後一年半內 （休學期間不計） 通過資格考試 ( 含 修課扺免程序完成 ) 。未通過者應令退學。\n\n本系碩士班在學學生經指導教授簽署同意後，得申請參加資格考 試。該生若於碩士班畢業當年進入本系博士班就讀或逕讀博士班， 則資格考試之結果（含「通過」科目、「不通過」次數），均為有 效。該生若於碩士班畢業二年內未進入本系博士班就讀，則資格考 試之結果全部取消。\n\n( 二 ) 論文計畫書審查：\n\n本系博士生論文諮議委員會成員如下：指導教授、指導教授推薦相 關系所助理教授 ( 含 ) 以上二人、本系推薦一人。其中本系委員應佔 二分之一（含）以上。\n\n本系博士生在通過資格考試後一年內（休學期間不計）必須通過論 文計畫書諮議委員會之口試審查。經委員會全數委員通過，始為通 過。第一次未通過者重提論文計畫審查不受前述資格考後一年內完 成之限制，但仍須於資格考試後一年半內完成，重提論文計畫審查 以一次為限，仍不及格者，應令退學。論文計晝審查通過六個月後， 始可申請博士學位考試。\n\n四、博士班論文發表相關規定：\n\n( 一 ) 本系博士生發表之論文，至少需達到下列兩項最低標準之一，始可申請 博士學位考試：\n\n申請學位考試時，修業時間已逾四年者： 至少一篇 SCIE 期刊論文代表作，以及至少一篇 IEEE/IET Electronic Library 收錄、或 ACM Digtal Library 收錄、或 B\n\n級以上之國際會 議論文 ( 或一個與畢業論文相關之實作系統 ) 。\n\n申請學位考試時，修業時間未滿四年者： 除需符合上述條件之外，其中需有一篇 A 級 SCIE 期刊長篇論文， 或需有一篇 A 級國際會議論文，或畢業論文相關之實作系統參加 全國或國際性之競賽獲獎前三名者。 ( 期刊和會議論文等級另公佈\n\n於本系網頁 ) 。\n\n上述期刊論文代表作中，該博士生須在至少一篇 SCIE 論文，於所有作者 （指導教授除外）中列名第一位。代表作不得為其他博士生（含已畢業或 未畢業者）之代表作。\n\n( 二 ) 本系博士生發表之論文必須是在本系碩士班、博士班就讀期間，利用本 系全銜 ( 或在本系之後加列其服務單位 ) 刊登，且其指導教授需列名其上， 本系始承認其為在學期間之研究結果，並列入上述之計算標準。\n\n( 三 ) 本系博士生於申請博士學位考試資格審查前參加至少一次國際性會議，\n\n並於會議上以英文報告論文 ( 需提出佐證資料 ) 。\n\n五、博士班學位考試：\n\n本系博士生於完成論文後，經其指導教授簽字同意，認定其論文成果具原 創性及完整性，並已達博士論文水準，始可申請博士學位考試。申請博士 學位考試者，須於考試前至少一個月提出申請並經系學術委員會審查通過 （審查項目包含修業年限、修習學分、博士候選人資格考核、英文能力、 論文計畫是否於期限內通過審查、是否符合論文發表相關規定，及依學校 相關法規規定應審查之事項），始得進行博士學位考試。\n\n已達修業年限，於應提出學位考試申請之時，其修習課程或英文能力仍未 達規定者，得以切結方式申請先行審查其它畢業要項，但仍須於滿足所有 修業規定後，方得提出學位考試申請。\n\n博士學位考試悉依本校「研究生學位考試施行細則」之規定辦理。\n\n六、畢業：符合上述之各項規定者，得提出畢業之申請。\n\n七、本辦法經系務會議、院務會議通過，簽請校長核定後施行，修正時亦同。', '<2-hop>  [202107061427180763.md]\n\n國立中山大學光電工程學系 碩士班研究生學位考試相關規定\n\n110 學年度入學新生適用\n\n經 91 年 11 月 25 日系務會議修正通過 經 92 年 3 月 25 日院務會議修正通過 經 96 年 1 月 31 日系務會議修正通過 經 97 年 9 月 11 日 97 學年度第一學期系務會議修正通過 經 97 年 10 月 8 日 97 學年度第一學期第一次院務會議修正通過 經 98 年 10 月 09 日 98 學年度第一學期第一次系務會議修正通過 經 98 年 11 月 09 日 98 學年度第一學期第一次院務會議修正通過 經 99 年 11 月 10 日 99 學年度第一學期第三次系務會議修正通過 經 99 年 12 月 15 日 99 學年度第一學期第二次院務會議修正通過 經 100 年 9 月 22 日 100 學年度第二次系務會議修正通過 經 100 年 11 月 2 日 100 學年度第一次院務會議修正通過 經 100 年 11 月 04 簽準奉核 經 101.09.19 101 學年度第 2 次系務會議修正通過 經 101 年 10 月 25 日 101 學年度第 1 次院務會議修正通過 經 101 年 11 月 02 簽準奉核 經 102 年 03 月 05 日 101 學年度第 2 次院務會議修正通過 經 102 年 05 月 01 日 101 學年度第 6 次系務會議修正通過 經 102 年 05 月 15 日 101 學年度第 7 次系務會議修正通過 經 102 年 05 月 29 日 101 學年度第 3 次院務會議修正通過 經 102 年 6 月 6 日簽準奉核 經 104 年 04 月 22 日 103 學年度第 7 次系務會議修正通過 經 104 年 08 月 11 日 104 學年度第 1 次院務會議修正通過 經 104 年 9 月 2 日簽準奉核 經 108 年 11 月 20 日 108 學年度第 4 次系務會議修正通過 經 109 年 01 月 20 日 108 學年度第 2 次院務會議修正通過 經 109 年 2 月 11 日簽準奉核\n\n經 110 年 3 月 31 日 109 學年度第 7 次系務會議修正通過\n\n一、依據教育部頒「學位授予法」 、本校「學則」及「研究生學位考試施行細則」訂定之。\n\n二、在學期間相關事項：\n\n( 一 ) 每週在校時間：\n\n未修畢本系規定之碩士班最低畢業學分數前，一般生每週至少需在校五天 ( 每日至少八 小時 ) ，在職生每週至少四次半天 ( 共二天 ) ，從事研究或課堂上課。\n\n( 二 ) 修業年限：一般生一至四年 ( 不含保留入學及休學期間 ) ，在職生三至四年，但在職生 成績或研究成果卓越者，可申請修業為兩年畢業。\n\n( 三 ) 學分制度及修課要求：\n\n學生選課均須經指導教授及系主任認可。\n\n碩士班學生入學後二年內，須修畢規定之應修科目及最低畢業學分數 26 學分，其 中需修滿本系開設之光電專業課程滿 15 學分（不含專題課程） 「包含 4 門必修課程 及 1 門必選修核心課程」 。\n\n（ a ）必修課：光電電磁學、光電子學、書報討論一及書報討論二。\n\n（ b ）三大領域必選修核心課程如下表：\n\n「光電工程學系碩士班必選修核心課程選課確認表」需經指導教授簽名同意後，最 遲於畢業當學年度上學期前送交本系辦理畢業學分審核事務人員存查。\n\n( 四 ) 自 100 學年度起，最高承認選修 2 門大學部課程（該課程需於選課系統備註其學分可 承認於研究所）為其畢業學分。\n\n光電子材料與元件 光通訊與光資訊 顯示與替代能源 光電材料 光纖通信系統 有機光電材料原理及應用 半導體光電元件 現代通訊原理 液晶顯示技術\n\n( 五 ) 指導教授選派：\n\n研究生倘因故須更改已選定之指導教授，必須獲得原指導教授及新指導教授之書面同 意後，始得更改。\n\n( 六 ) 其他：\n\n若需由系外老師共同指導時，需經指導教授同意後，於論文計劃書提審前，填妥本系 共同指導表繳交系辦備查。\n\n三、碩士學位考試：\n\n學期之定義：上學期自每年八月一日至次年一月三十一日、下學期自每年二月一日至七月 三十一日。\n\n( 一 ) 論文發表相關規定（需符合下列條件之一） ：\n\n碩士班研究生於畢業離校前至少投稿一篇論文（論文係指期刊論文或國內外會議 論文，同年級學生只算碩士班排名第一作者） ，同一篇論文只限一位作者提出， 且需與指導教授共同掛名提出。\n\n提交一篇由指導教授簽名依光電年會格式寫作之第一作者會議論文，且同一篇會 議論文只限一位作者提出。\n\n( 二 ) 其他：\n\n研究生需符合修業規定及通過論文發表相關規定後，由指導教授推薦，始得舉行 學位考試。\n\n學位考試成績不及格而其修業年限尚未屆滿者，得於次學期或次學年舉行重考， 重考以一次為限，經重考一次仍不及格者，依本校學則規定應令退學。\n\n四、碩士畢業論文：\n\n1.學生繳交學位論文定稿時需檢附防抄襲之分數證明。\n\n2.防論文抄襲以中山大學當年度之論文原創性比對系統為主。排除引言、參考文獻、目 錄、 附件等，論文原創性比對系統分數需 12%（含)以下才通過，若超過需詳敘具體 原因，經指導教授簽名確認未有抄襲疑慮，始得通過。\n\n五、畢業：符合上述之各項規定者，得提出畢業之申請。\n\n六、本規定經系務會議、院務會議通過，簽請校長核定後施行，修正時亦同。']",teacher,Poor grammar,short,"<1-hop>  [201909101834230665.md]

國立中山大學資訊工程學系 博士班研究生資格考核及學位考試相關規定

103 學年度起入學新生適用

92 年 2 月 26 日系務會議修正通過 92 年 3 月 25 日工學院院務會議修正通過 93 年 12 月 29 日系務會議修正通過 94 年 1 月 25 日工學院院務會議修正通過 94 年 3 月 9 日系務會議修正通過 94 年 3 月 23 日工學院院務會議修正通過 95 年 9 月 27 日系務會議修正通過 95 年 11 月 1 日工學院院務會議修正通過 96 年 3 月 30 日系務會議修正通過 96 年 6 月 15 日工學院院務會議修正通過 97 年 6 月 9 日系務會議修正通過 97 年 6 月 10 日工學院院務會議修正通過 98 年 5 月 20 日系務會議修正通過 98 年 6 月 10 日工學院院務會議修正通過 98 年 9 月 23 日系務會議修正通過 99 年 6 月 28 日工學院院務會議修正通過 101 年 12 月 25 日系務會議修正通過 102 年 3 月 5 日工學院院務會議修正通過 102 年 3 月 29 日系務會議修正通過 102 年 5 月 29 日工學院院務會議修正通過 103 年 2 月 20 日系務會議修正通過 103 年 6 月 6 日系務會議修正通過 103 年 6 月 13 日工學院院務會議修正通過

一、依據教育部頒「學位授予法」暨其施行細則、本校「學則」及「研究生學位 考試施行細則」訂定之。

二、在學期間相關事項：

( 一 ) 修業年限：依教育部規定二至七年 ( 不含保留入學及休學期間 ) 。

( 二 ) 學分制度及修課要求：

本系博士生畢業之前必須至少修滿碩士班或博士班課程 22 學分， 其中本系開授課程至少 19 學分，其餘課程經本系同意後，得選修 相關碩、博士班開授之課程。逕讀博士學位者，至少須修滿 40 學 分，其中本系開授課程至少 30 學分。其碩士班一年級所修之學分， 最多可取三分之二的學分計入博士學位學分，且至多以 12 學分為 限。

申請逕讀博士學位者，於申請前須修畢碩士班必修課程（書報討論 除外）。

本系博士生修業的前二年，每學期必須選修 「書報討論」 （ seminar ） ； 另外，每學期至少須選修一門三學分課程。

本系博士生每學期修讀課程，須經指導教授同意後確定之。如無指 導教授，則須經導師或系主任同意後確定之。

本系博士班研究生畢業英文成績最低標準以通過下列任一檢定標 準且通過之測驗檢定日期應以入學前 2 年之後取得為限：

(1) 多益測驗 TOEIC 成績達 750 分以上。

(2) 全民英檢 (GEPT) 中高級複試 ( 含 ) 以上。

(3) 託福紙筆測驗 (TOFEL ITP)527 分 ( 含 ) 以上

(4) 託福網路化測驗 (TOFEL-iBT)71 分 ( 含 ) 以上。

(5) 國際英語能力測驗 (IELTS)5.5 級 ( 含 ) 以上。

如測驗上述檢定項目二次以上仍未達標準，得修習本系課程委員會 指定之英文相關課程取代且修課成績需及格且為該科全部修課人 數之前二分之一。若以修習英文相關課程方式取代英文成績者，該 學分則不納入畢業學分。

為加強本系博士生的學識能力、研究能力或英文能力，本系得指定 其補修相關課程。

須達本系博士班研究生規定之英文成績標準後，始得以申請學位考 試。

( 三 ) 指導教授選派：

本系博士生以選擇本系助理教授 ( 含 ) 以上專任教師擔任博士論文指 導教授為原則。

若有特殊原因，得選擇非本系之指導教授，但必須選擇一位本系助 理教授 ( 含 ) 以上專任教師為共同指導教授。若需由系外老師共同指 導時，需經指導教授同意後，向繫上提出申請，如共同指導教授指 導學生至其畢業時未達一年以上者，取消其共同指導資格。

本系博士生應於入學後一年內決定其論文指導教授。同學未於期限 內決定指導教授者，將由繫上協調指派指導教授。

若因特殊原因需更換指導教授時，應先徵得原指導教授及新指導教 授同意，並以書面向本系報備。

三、博士學位候選人資格考核：

學期之定義：上學期自每年八月一日至次年一月三十一日、下學期自每年二 月一日至七月三十一日。

( 一 ) 資格考試：

資格考試以筆試行之。各科考試結果由本系系務會議議決「通過」 或「不通過」。

資格考試時間每年分兩梯次，分別於上學期與下學期期末考後一個 月內舉行，本系博士生必須每次資格考試前三星期以前提出申請參 加資格考試的科目。除有特殊原因經本系專案核准外，否則申請後 而缺考者，該科目以零分計（不通過一次）。

每位博士生初次申請資格考試時，必須於下列六科中自行選定四科 做為其「資格考試科目」，確定後不得再更改，且必須通過三科， 每科至多可參加二次考試：

計算機結構（研究所課程）、電腦網路（大學部課程）、作業系統 （大學部課程）、演算法分析與設計（研究所課程）、數位電子學 （大學部課程）、機率學（大學部課程）

資格考試科目至少需以考試方式通過一科（含）以上，未通過考試

之科目，可以修課來抵免 ( 科目若有變更，將於一學期前於繫上網頁 公告 ) ，修課或考試二者可並行。抵免資格考之科目，每科修課以 一次為限，以修課申請抵免之科目，成績必須及格且需為該科全部 修課人數之前二分之一。

本系博士生應在入學後一年半內 （休學期間不計） 通過資格考試 ( 含 修課扺免程序完成 ) 。未通過者應令退學。

本系碩士班在學學生經指導教授簽署同意後，得申請參加資格考 試。該生若於碩士班畢業當年進入本系博士班就讀或逕讀博士班， 則資格考試之結果（含「通過」科目、「不通過」次數），均為有 效。該生若於碩士班畢業二年內未進入本系博士班就讀，則資格考 試之結果全部取消。

( 二 ) 論文計畫書審查：

本系博士生論文諮議委員會成員如下：指導教授、指導教授推薦相 關系所助理教授 ( 含 ) 以上二人、本系推薦一人。其中本系委員應佔 二分之一（含）以上。

本系博士生在通過資格考試後一年內（休學期間不計）必須通過論 文計畫書諮議委員會之口試審查。經委員會全數委員通過，始為通 過。第一次未通過者重提論文計畫審查不受前述資格考後一年內完 成之限制，但仍須於資格考試後一年半內完成，重提論文計畫審查 以一次為限，仍不及格者，應令退學。論文計晝審查通過六個月後， 始可申請博士學位考試。

四、博士班論文發表相關規定：

( 一 ) 本系博士生發表之論文，至少需達到下列兩項最低標準之一，始可申請 博士學位考試：

申請學位考試時，修業時間已逾四年者： 至少一篇 SCIE 期刊論文代表作，以及至少一篇 IEEE/IET Electronic Library 收錄、或 ACM Digtal Library 收錄、或 B

級以上之國際會 議論文 ( 或一個與畢業論文相關之實作系統 ) 。

申請學位考試時，修業時間未滿四年者： 除需符合上述條件之外，其中需有一篇 A 級 SCIE 期刊長篇論文， 或需有一篇 A 級國際會議論文，或畢業論文相關之實作系統參加 全國或國際性之競賽獲獎前三名者。 ( 期刊和會議論文等級另公佈

於本系網頁 ) 。

上述期刊論文代表作中，該博士生須在至少一篇 SCIE 論文，於所有作者 （指導教授除外）中列名第一位。代表作不得為其他博士生（含已畢業或 未畢業者）之代表作。

( 二 ) 本系博士生發表之論文必須是在本系碩士班、博士班就讀期間，利用本 系全銜 ( 或在本系之後加列其服務單位 ) 刊登，且其指導教授需列名其上， 本系始承認其為在學期間之研究結果，並列入上述之計算標準。

( 三 ) 本系博士生於申請博士學位考試資格審查前參加至少一次國際性會議，

並於會議上以英文報告論文 ( 需提出佐證資料 ) 。

五、博士班學位考試：

本系博士生於完成論文後，經其指導教授簽字同意，認定其論文成果具原 創性及完整性，並已達博士論文水準，始可申請博士學位考試。申請博士 學位考試者，須於考試前至少一個月提出申請並經系學術委員會審查通過 （審查項目包含修業年限、修習學分、博士候選人資格考核、英文能力、 論文計畫是否於期限內通過審查、是否符合論文發表相關規定，及依學校 相關法規規定應審查之事項），始得進行博士學位考試。

已達修業年限，於應提出學位考試申請之時，其修習課程或英文能力仍未 達規定者，得以切結方式申請先行審查其它畢業要項，但仍須於滿足所有 修業規定後，方得提出學位考試申請。

博士學位考試悉依本校「研究生學位考試施行細則」之規定辦理。

六、畢業：符合上述之各項規定者，得提出畢業之申請。

七、本辦法經系務會議、院務會議通過，簽請校長核定後施行，修正時亦同。","<2-hop>  [202107061427180763.md]

國立中山大學光電工程學系 碩士班研究生學位考試相關規定

110 學年度入學新生適用

經 91 年 11 月 25 日系務會議修正通過 經 92 年 3 月 25 日院務會議修正通過 經 96 年 1 月 31 日系務會議修正通過 經 97 年 9 月 11 日 97 學年度第一學期系務會議修正通過 經 97 年 10 月 8 日 97 學年度第一學期第一次院務會議修正通過 經 98 年 10 月 09 日 98 學年度第一學期第一次系務會議修正通過 經 98 年 11 月 09 日 98 學年度第一學期第一次院務會議修正通過 經 99 年 11 月 10 日 99 學年度第一學期第三次系務會議修正通過 經 99 年 12 月 15 日 99 學年度第一學期第二次院務會議修正通過 經 100 年 9 月 22 日 100 學年度第二次系務會議修正通過 經 100 年 11 月 2 日 100 學年度第一次院務會議修正通過 經 100 年 11 月 04 簽準奉核 經 101.09.19 101 學年度第 2 次系務會議修正通過 經 101 年 10 月 25 日 101 學年度第 1 次院務會議修正通過 經 101 年 11 月 02 簽準奉核 經 102 年 03 月 05 日 101 學年度第 2 次院務會議修正通過 經 102 年 05 月 01 日 101 學年度第 6 次系務會議修正通過 經 102 年 05 月 15 日 101 學年度第 7 次系務會議修正通過 經 102 年 05 月 29 日 101 學年度第 3 次院務會議修正通過 經 102 年 6 月 6 日簽準奉核 經 104 年 04 月 22 日 103 學年度第 7 次系務會議修正通過 經 104 年 08 月 11 日 104 學年度第 1 次院務會議修正通過 經 104 年 9 月 2 日簽準奉核 經 108 年 11 月 20 日 108 學年度第 4 次系務會議修正通過 經 109 年 01 月 20 日 108 學年度第 2 次院務會議修正通過 經 109 年 2 月 11 日簽準奉核

經 110 年 3 月 31 日 109 學年度第 7 次系務會議修正通過

一、依據教育部頒「學位授予法」 、本校「學則」及「研究生學位考試施行細則」訂定之。

二、在學期間相關事項：

( 一 ) 每週在校時間：

未修畢本系規定之碩士班最低畢業學分數前，一般生每週至少需在校五天 ( 每日至少八 小時 ) ，在職生每週至少四次半天 ( 共二天 ) ，從事研究或課堂上課。

( 二 ) 修業年限：一般生一至四年 ( 不含保留入學及休學期間 ) ，在職生三至四年，但在職生 成績或研究成果卓越者，可申請修業為兩年畢業。

( 三 ) 學分制度及修課要求：

學生選課均須經指導教授及系主任認可。

碩士班學生入學後二年內，須修畢規定之應修科目及最低畢業學分數 26 學分，其 中需修滿本系開設之光電專業課程滿 15 學分（不含專題課程） 「包含 4 門必修課程 及 1 門必選修核心課程」 。

（ a ）必修課：光電電磁學、光電子學、書報討論一及書報討論二。

（ b ）三大領域必選修核心課程如下表：

「光電工程學系碩士班必選修核心課程選課確認表」需經指導教授簽名同意後，最 遲於畢業當學年度上學期前送交本系辦理畢業學分審核事務人員存查。

( 四 ) 自 100 學年度起，最高承認選修 2 門大學部課程（該課程需於選課系統備註其學分可 承認於研究所）為其畢業學分。

光電子材料與元件 光通訊與光資訊 顯示與替代能源 光電材料 光纖通信系統 有機光電材料原理及應用 半導體光電元件 現代通訊原理 液晶顯示技術

( 五 ) 指導教授選派：

研究生倘因故須更改已選定之指導教授，必須獲得原指導教授及新指導教授之書面同 意後，始得更改。

( 六 ) 其他：

若需由系外老師共同指導時，需經指導教授同意後，於論文計劃書提審前，填妥本系 共同指導表繳交系辦備查。

三、碩士學位考試：

學期之定義：上學期自每年八月一日至次年一月三十一日、下學期自每年二月一日至七月 三十一日。

( 一 ) 論文發表相關規定（需符合下列條件之一） ：

碩士班研究生於畢業離校前至少投稿一篇論文（論文係指期刊論文或國內外會議 論文，同年級學生只算碩士班排名第一作者） ，同一篇論文只限一位作者提出， 且需與指導教授共同掛名提出。

提交一篇由指導教授簽名依光電年會格式寫作之第一作者會議論文，且同一篇會 議論文只限一位作者提出。

( 二 ) 其他：

研究生需符合修業規定及通過論文發表相關規定後，由指導教授推薦，始得舉行 學位考試。

學位考試成績不及格而其修業年限尚未屆滿者，得於次學期或次學年舉行重考， 重考以一次為限，經重考一次仍不及格者，依本校學則規定應令退學。

四、碩士畢業論文：

1.學生繳交學位論文定稿時需檢附防抄襲之分數證明。

2.防論文抄襲以中山大學當年度之論文原創性比對系統為主。排除引言、參考文獻、目 錄、 附件等，論文原創性比對系統分數需 12%（含)以下才通過，若超過需詳敘具體 原因，經指導教授簽名確認未有抄襲疑慮，始得通過。

五、畢業：符合上述之各項規定者，得提出畢業之申請。

六、本規定經系務會議、院務會議通過，簽請校長核定後施行，修正時亦同。",201909101834230665.md,202107061427180763.md,"['國立中山大學光電工程學系', '國立中山大學資訊工程學系博士班']",工學院↔工學院,國立中山大學資訊工程學系博士班↔國立中山大學光電工程學系,5.0,5.0,5.0,5.0,5.0,2.0,5.0
國立中山大學資訊工程學系碩士班的必修課程有哪些？學生畢業前必須修畢哪些專業必修課程？,根據103學年度起入學新生適用的規定，資訊工程學系碩士班的共同必修課程為四個學期的「書報討論」（各1學分）。專業必修課程包括「超大型積體電路設計」、「計算機結構」、「高等電腦網路」、「演算法設計與分析」、「高等作業系統」等，學生畢業前至少需擇二科修畢通過。根據108學年度起入學新生適用的規定，資訊工程碩士班的共同必修課程仍為四個學期「書報討論」（各1學分），專業必修課程同樣包括上述五科，學生畢業前至少需擇2科修畢通過。,"['<1-hop>  [201909112105460682.md]\n\n國立中山大學資訊工程學系 碩士班研究生學位考試相關規定\n\n103 學年度起入學新生適用\n\n92 年 1 月 8 日系務會議修正通過\n\n92 年 3 月 25 日工學院院務會議修正通過 94 年 5 月 4 日系務會議修正通過 95 年 6 月 29 日工學院院務會議修正通過 99 年 10 月 27 日系務會議修正通過 99 年 12 月 15 日工學院院務會議修正通過 101 年 2 月 15 日系務會議修正通過 101 年 3 月 14 日系務會議修正通過 101 年 3 月 28 日工學院院務會議修正通過 103 年 4 月 18 日系務會議修正通過 103 年 6 月 6 日系務會議修正通過 103 年 6 月 13 日工學院院務會議修正通過\n\n一、依據教育部頒「學位授予法」暨其施行細則、本校「學則」及「研究生學位考試施 行細則」訂定之。\n\n二、在學期間相關事項：\n\n(一)修業年限：依教育部規定一至四年(不含保留入學及休學期間)。\n\n(二)須修畢最低畢業學分數 28 學分 ( 含必修課程 ) 。\n\n(三)學分制度及修課要求：\n\n共同必修課程：四個學期「書報討論」（各 1 學分）。\n\n專業必修課程：「超大型積體電路設計」、「計算機結構」、「高等電腦網 路」、「演算法設計與分析」、「高等作業系統」等專業課程，學生畢業前 至少需擇二科修畢通過。\n\n專題或專題研究課程最多採計 6 學分為畢業學分。\n\n本系英文相關課程最多採計 3 學分為畢業學分。\n\n本系碩士班研究生畢業英文成績至少須達下列兩項標準之一：\n\n(1) 須通過下列任一檢定標準且通過之測驗檢定日期應以入學前 2 年之後取 得為限：\n\n(a) 多益測驗 TOEIC 成績達 600 分以上。\n\n(b) 全民英檢 (GEPT) 中高級初試 ( 含 ) 以上。\n\n(c) 託福紙筆測驗 (TOFEL ITP)500 分 ( 含 ) 以上\n\n(d) 託福網路化測驗 (TOFEL-iBT)61 分 ( 含 ) 以上。\n\n(e) 國際英語能力測驗 (IELTS)5 級 ( 含 ) 以上。\n\n(2) 修習本系課程委員會指定之英文相關課程且及格。若以修習英文相關課 程方式取代英文成績者，該學分則不納入畢業學分。\n\n須達本系碩士班研究生規定之英文成績標準後，得以申請學位口試。 (四)指導教授選派：\n\n本系碩士生以選擇本系助理教授 ( 含 ) 以上專任教師擔任指導教授為原則。\n\n若有特殊原因，得選擇非本系之指導教授，但必須選擇一位本系助理教授 ( 含 ) 以上專任教師為共同指導教授。若需由系外教師共同指導時，需經指導教授 同意後，以書面向本系報備。\n\n若因特殊原因需更換指導教授時，應先徵得原指導教授同意，並經學術委員\n\n會審核通過。更換指導教授一年後才可以提出學位論文考試申請。\n\n三、碩士學位考試：\n\n學期之定義：上學期自每年八月一日至次年一月三十一日、下學期自每年二月一日 至七月三十一日。\n\n(一)論文提審：\n\n碩士班學生於學位論文口試前，須繳交論文提審報告，並通過論文提審。報 告內容含研究題目、動機、相關研究探討、研究目標、方法及進行步驟、研 究成果及貢獻與參考文獻等等。\n\n指導教授就各申請案組成提審委員會，由三至五位繫上教師組成，或外系、 外校教師組成。\n\n提審委員會針對申請者之書面報告決定申請者是否通過提審；必要時，提審 委員會得要求申請者進行口頭報告。提審時，需有三分之二（含）以上提審 委員評定為合格者才為通過。\n\n應屆畢業生須於當年三月三十一日前通過論文提審，否則畢業論文口試時間 至少須延後一學期。延後畢業之學生須於論文口試前至少一個月通過論文提 審。\n\n(二)學位論文口試：\n\n學位考試委員會置委員三至五人，其中系外委員以至少一人為原則。\n\n學位考試（論文口試）成績不及格而其修業年限尚未屆滿者，得於次學期 或次學年舉行重考，重考以一次為限，經重考一次仍不及格者，依本校學 則應令退學。\n\n四、畢業：符合上述之各項規定者，得提出畢業之申請。\n\n五、本辦法經系務會議、院務會議通過，簽請校長核定後施行，修正時亦同。', '<2-hop>  [202005141018580162.md]\n\n國立中山大學資訊工程學系 碩士班暨資訊安全碩士班研究生學位考試相關規定\n\n108 學年度起入學新生適用\n\n92 年 1 月 8 日系務會議修正通過\n\n92 年 3 月 25 日工學院院務會議修正通過\n\n94 年 5 月 4 日系務會議修正通過\n\n95 年 6 月 29 日工學院院務會議修正通過\n\n99 年 10 月 27 日系務會議修正通過\n\n99 年 12 月 15 日工學院院務會議修正通過\n\n101 年 2 月 15 日系務會議修正通過\n\n101 年 3 月 14 日系務會議修正通過\n\n101 年 3 月 28 日工學院院務會議修正通過\n\n103 年 4 月 18 日系務會議修正通過\n\n103 年 6 月 6 日系務會議修正通過\n\n103 年 6 月 13 日工學院院務會議修正通過\n\n106 年 6 月 19 日系務會議修正通過\n\n106 年 6 月 28 日工學院院務會議修正通過\n\n108 年 8 月 23 日系務會議修正通過\n\n108 年 8 月 27 日工學院院務會議修正通過\n\n一、依據教育部頒「學位授予法」 、本校「學則」及「研究生學位考試施行細則」訂定 之。\n\n二、在學期間相關事項：\n\n(一)修業年限：依教育部規定一至四年(不含保留入學及休學期間)。\n\n(二)須修畢最低畢業學分數 28 學分 ( 含必修課程 ) 。\n\n(三)學分制度及修課要求：\n\n共同必修課程：\n\n(1) 資訊工程碩士班：四個學期「書報討論」（各 1 學分）。\n\n(2) 資訊安全碩士班：四個學期「書報討論（一）」至「書報討論（四）」 （各 1 學分）。\n\n專業必修課程：\n\n(1) 資訊工程碩士班：「超大型積體電路設計」、「計算機結構」、「高等 電腦網路」、「演算法設計與分析」、「高等作業系統」等專業課程， 學生畢業前至少需擇 2 科修畢通過。\n\n(2) 資訊安全碩士班：基礎必修「計算機結構」、「高等電腦網路」、「演算 法設計與分析」、「高等作業系統」等專業課程，學生畢業前至少需擇 1 科修畢通過；核心必修「安全密碼協定」、「數位簽章機制與應用」、「密 碼學」、「安全程式設計」、「駭客攻防與電腦鑑識技術」、「網路安全」 等專業課程，學生畢業前至少需擇 3 科修畢通過。\n\n專題或專題研究課程最多採計 6 學分為畢業學分。\n\n本系英文相關課程最多採計 3 學分為畢業學分。\n\n本系學生畢業英文成績至少須達下列兩項標準之一：\n\n(1) 須通過下列任一檢定標準且通過之測驗檢定日期應以入學前 2 年之後取 得為限：\n\n(a) 多益測驗 TOEIC 成績達 600 分以上。\n\n(b) 全民英檢 (GEPT) 中高級初試 ( 含 ) 以上。\n\n(c) 託福紙筆測驗 (TOFEL ITP)500 分 ( 含 ) 以上\n\n(d) 託福網路化測驗 (TOFEL-iBT)61 分 ( 含 ) 以上。\n\n(e) 國際英語能力測驗 (IELTS)5 級 ( 含 ) 以上。\n\n(2) 修習本系課程委員會指定之英文相關課程且及格。若以修習英文相關課 程方式取代英文成績者，該學分則不納入畢業學分。\n\n須達本系規定之英文成績標準後，得以申請學位口試。\n\n(四)指導教授選派：\n\n本系學生以選擇本系助理教授 ( 含 ) 以上專任教師擔任指導教授為原則。\n\n若有特殊原因，得選擇非本系之指導教授，但必須選擇一位本系助理教授 ( 含 ) 以上專任教師為共同指導教授。若需由系外教師共同指導時，需經指導教授 同意後，以書面向本系報備。\n\n若因特殊原因需更換指導教授時，應先徵得原指導教授同意，並經學術委員 會審核通過。更換指導教授一年後才可以提出學位論文考試申請。\n\n三、碩士學位考試：\n\n學期之定義：上學期自每年八月一日至次年一月三十一日、下學期自每年二月一日 至七月三十一日。\n\n(一)論文提審：\n\n本系學生於學位論文口試前，須繳交論文提審報告，並通過論文提審：\n\n報告內容含研究題目、動機、相關研究探討、研究目標、方法及進行步驟、 研究成果及貢獻與參考文獻等等。\n\n指導教授就各申請案組成提審委員會，由三至五位系內教師組成，或外系、 外校教師組成，提審委員會針對申請者之書面報告決定申請者是否通過提 審；必要時，提審委員會得要求申請者進行口頭報告。提審時，需有三分之 二（含）以上提審委員評定為合格者才為通過。\n\n應屆畢業生須於當年三月三十一日前通過論文提審，否則畢業論文口試時間 至少須延後一學期。延後畢業之學生須於論文口試前至少一個月通過論文提 審。\n\n(二)學位論文口試：\n\n學位考試委員會置委員三至五人，其中系外委員以至少一人為原則。\n\n學位考試（論文口試）成績不及格而其修業年限尚未屆滿者，得於次學期或次 學年舉行重考，重考以一次為限，經重考一次仍不及格者，依本校學則應令退 學。\n\n四、畢業：符合上述之各項規定者，得提出畢業之申請。\n\n五、本辦法經系務會議、院務會議通過，簽請校長核定後施行，修正時亦同。']",staff,Poor grammar,short,"<1-hop>  [201909112105460682.md]

國立中山大學資訊工程學系 碩士班研究生學位考試相關規定

103 學年度起入學新生適用

92 年 1 月 8 日系務會議修正通過

92 年 3 月 25 日工學院院務會議修正通過 94 年 5 月 4 日系務會議修正通過 95 年 6 月 29 日工學院院務會議修正通過 99 年 10 月 27 日系務會議修正通過 99 年 12 月 15 日工學院院務會議修正通過 101 年 2 月 15 日系務會議修正通過 101 年 3 月 14 日系務會議修正通過 101 年 3 月 28 日工學院院務會議修正通過 103 年 4 月 18 日系務會議修正通過 103 年 6 月 6 日系務會議修正通過 103 年 6 月 13 日工學院院務會議修正通過

一、依據教育部頒「學位授予法」暨其施行細則、本校「學則」及「研究生學位考試施 行細則」訂定之。

二、在學期間相關事項：

(一)修業年限：依教育部規定一至四年(不含保留入學及休學期間)。

(二)須修畢最低畢業學分數 28 學分 ( 含必修課程 ) 。

(三)學分制度及修課要求：

共同必修課程：四個學期「書報討論」（各 1 學分）。

專業必修課程：「超大型積體電路設計」、「計算機結構」、「高等電腦網 路」、「演算法設計與分析」、「高等作業系統」等專業課程，學生畢業前 至少需擇二科修畢通過。

專題或專題研究課程最多採計 6 學分為畢業學分。

本系英文相關課程最多採計 3 學分為畢業學分。

本系碩士班研究生畢業英文成績至少須達下列兩項標準之一：

(1) 須通過下列任一檢定標準且通過之測驗檢定日期應以入學前 2 年之後取 得為限：

(a) 多益測驗 TOEIC 成績達 600 分以上。

(b) 全民英檢 (GEPT) 中高級初試 ( 含 ) 以上。

(c) 託福紙筆測驗 (TOFEL ITP)500 分 ( 含 ) 以上

(d) 託福網路化測驗 (TOFEL-iBT)61 分 ( 含 ) 以上。

(e) 國際英語能力測驗 (IELTS)5 級 ( 含 ) 以上。

(2) 修習本系課程委員會指定之英文相關課程且及格。若以修習英文相關課 程方式取代英文成績者，該學分則不納入畢業學分。

須達本系碩士班研究生規定之英文成績標準後，得以申請學位口試。 (四)指導教授選派：

本系碩士生以選擇本系助理教授 ( 含 ) 以上專任教師擔任指導教授為原則。

若有特殊原因，得選擇非本系之指導教授，但必須選擇一位本系助理教授 ( 含 ) 以上專任教師為共同指導教授。若需由系外教師共同指導時，需經指導教授 同意後，以書面向本系報備。

若因特殊原因需更換指導教授時，應先徵得原指導教授同意，並經學術委員

會審核通過。更換指導教授一年後才可以提出學位論文考試申請。

三、碩士學位考試：

學期之定義：上學期自每年八月一日至次年一月三十一日、下學期自每年二月一日 至七月三十一日。

(一)論文提審：

碩士班學生於學位論文口試前，須繳交論文提審報告，並通過論文提審。報 告內容含研究題目、動機、相關研究探討、研究目標、方法及進行步驟、研 究成果及貢獻與參考文獻等等。

指導教授就各申請案組成提審委員會，由三至五位繫上教師組成，或外系、 外校教師組成。

提審委員會針對申請者之書面報告決定申請者是否通過提審；必要時，提審 委員會得要求申請者進行口頭報告。提審時，需有三分之二（含）以上提審 委員評定為合格者才為通過。

應屆畢業生須於當年三月三十一日前通過論文提審，否則畢業論文口試時間 至少須延後一學期。延後畢業之學生須於論文口試前至少一個月通過論文提 審。

(二)學位論文口試：

學位考試委員會置委員三至五人，其中系外委員以至少一人為原則。

學位考試（論文口試）成績不及格而其修業年限尚未屆滿者，得於次學期 或次學年舉行重考，重考以一次為限，經重考一次仍不及格者，依本校學 則應令退學。

四、畢業：符合上述之各項規定者，得提出畢業之申請。

五、本辦法經系務會議、院務會議通過，簽請校長核定後施行，修正時亦同。","<2-hop>  [202005141018580162.md]

國立中山大學資訊工程學系 碩士班暨資訊安全碩士班研究生學位考試相關規定

108 學年度起入學新生適用

92 年 1 月 8 日系務會議修正通過

92 年 3 月 25 日工學院院務會議修正通過

94 年 5 月 4 日系務會議修正通過

95 年 6 月 29 日工學院院務會議修正通過

99 年 10 月 27 日系務會議修正通過

99 年 12 月 15 日工學院院務會議修正通過

101 年 2 月 15 日系務會議修正通過

101 年 3 月 14 日系務會議修正通過

101 年 3 月 28 日工學院院務會議修正通過

103 年 4 月 18 日系務會議修正通過

103 年 6 月 6 日系務會議修正通過

103 年 6 月 13 日工學院院務會議修正通過

106 年 6 月 19 日系務會議修正通過

106 年 6 月 28 日工學院院務會議修正通過

108 年 8 月 23 日系務會議修正通過

108 年 8 月 27 日工學院院務會議修正通過

一、依據教育部頒「學位授予法」 、本校「學則」及「研究生學位考試施行細則」訂定 之。

二、在學期間相關事項：

(一)修業年限：依教育部規定一至四年(不含保留入學及休學期間)。

(二)須修畢最低畢業學分數 28 學分 ( 含必修課程 ) 。

(三)學分制度及修課要求：

共同必修課程：

(1) 資訊工程碩士班：四個學期「書報討論」（各 1 學分）。

(2) 資訊安全碩士班：四個學期「書報討論（一）」至「書報討論（四）」 （各 1 學分）。

專業必修課程：

(1) 資訊工程碩士班：「超大型積體電路設計」、「計算機結構」、「高等 電腦網路」、「演算法設計與分析」、「高等作業系統」等專業課程， 學生畢業前至少需擇 2 科修畢通過。

(2) 資訊安全碩士班：基礎必修「計算機結構」、「高等電腦網路」、「演算 法設計與分析」、「高等作業系統」等專業課程，學生畢業前至少需擇 1 科修畢通過；核心必修「安全密碼協定」、「數位簽章機制與應用」、「密 碼學」、「安全程式設計」、「駭客攻防與電腦鑑識技術」、「網路安全」 等專業課程，學生畢業前至少需擇 3 科修畢通過。

專題或專題研究課程最多採計 6 學分為畢業學分。

本系英文相關課程最多採計 3 學分為畢業學分。

本系學生畢業英文成績至少須達下列兩項標準之一：

(1) 須通過下列任一檢定標準且通過之測驗檢定日期應以入學前 2 年之後取 得為限：

(a) 多益測驗 TOEIC 成績達 600 分以上。

(b) 全民英檢 (GEPT) 中高級初試 ( 含 ) 以上。

(c) 託福紙筆測驗 (TOFEL ITP)500 分 ( 含 ) 以上

(d) 託福網路化測驗 (TOFEL-iBT)61 分 ( 含 ) 以上。

(e) 國際英語能力測驗 (IELTS)5 級 ( 含 ) 以上。

(2) 修習本系課程委員會指定之英文相關課程且及格。若以修習英文相關課 程方式取代英文成績者，該學分則不納入畢業學分。

須達本系規定之英文成績標準後，得以申請學位口試。

(四)指導教授選派：

本系學生以選擇本系助理教授 ( 含 ) 以上專任教師擔任指導教授為原則。

若有特殊原因，得選擇非本系之指導教授，但必須選擇一位本系助理教授 ( 含 ) 以上專任教師為共同指導教授。若需由系外教師共同指導時，需經指導教授 同意後，以書面向本系報備。

若因特殊原因需更換指導教授時，應先徵得原指導教授同意，並經學術委員 會審核通過。更換指導教授一年後才可以提出學位論文考試申請。

三、碩士學位考試：

學期之定義：上學期自每年八月一日至次年一月三十一日、下學期自每年二月一日 至七月三十一日。

(一)論文提審：

本系學生於學位論文口試前，須繳交論文提審報告，並通過論文提審：

報告內容含研究題目、動機、相關研究探討、研究目標、方法及進行步驟、 研究成果及貢獻與參考文獻等等。

指導教授就各申請案組成提審委員會，由三至五位系內教師組成，或外系、 外校教師組成，提審委員會針對申請者之書面報告決定申請者是否通過提 審；必要時，提審委員會得要求申請者進行口頭報告。提審時，需有三分之 二（含）以上提審委員評定為合格者才為通過。

應屆畢業生須於當年三月三十一日前通過論文提審，否則畢業論文口試時間 至少須延後一學期。延後畢業之學生須於論文口試前至少一個月通過論文提 審。

(二)學位論文口試：

學位考試委員會置委員三至五人，其中系外委員以至少一人為原則。

學位考試（論文口試）成績不及格而其修業年限尚未屆滿者，得於次學期或次 學年舉行重考，重考以一次為限，經重考一次仍不及格者，依本校學則應令退 學。

四、畢業：符合上述之各項規定者，得提出畢業之申請。

五、本辦法經系務會議、院務會議通過，簽請校長核定後施行，修正時亦同。",201909112105460682.md,202005141018580162.md,['必修課程'],工學院↔工學院 | 資訊工程學系↔資訊工程學系,必修課程↔必修課程,5.0,5.0,4.56,5.0,5.0,2.0,4.19
請問根據國立中山大學文學院教師評審委員會設置辦法與中國文學系教師升等審查辦法，教師申請升等時需要經過哪些審查程序？並且在初審中，學術研究類與教學研究類的計分比例分別是如何規定的？,根據國立中山大學文學院教師評審委員會設置辦法，教師升等申請須先由各系、所教評會通過，再送院教評會審議。院教評會由院長、各系、研究所主管及教授代表組成，會議需有三分之二以上委員出席，並經三分之二以上贊同方可通過。根據中國文學系教師升等審查辦法，教師得於每學期正式上課日一週前向系主任申請升等，提交相關資料後，系主任將資料公開陳列一週，召開系教師評審委員會進行資格審查，通過者資料送文學院教師評審委員會辦理著作審查。著作審查由院長聘請三名校外學者專家審查，外審結果送回系初審。初審成績須達七十分以上方通過。學術研究類初審計分比例為學術研究佔70%、教學績效佔20%、服務成績佔10%；教學研究類初審計分比例為教學研究佔60%、教學績效佔30%、服務成績佔10%。若初審不通過，系教師評審委員會召集人應書面通知申請人理由，申請人可依相關辦法提出申復或申訴。,"['<1-hop>  [201908161721320211.md]\n\n國立中山大學文學院教師評審委員會設置辦法\n\n84 學年度第6 次院務會議通過（85.06.04）\n\n本校第175次校教評會准予核備（85.09.18）\n\n87 學年度第3 次院務會議修正通過（88.01.06）\n\n第210 次校教評會准予核備（88.01.20）\n\n94 學年度第1 次院務會議修正通過（94.10.05）\n\n本校第297次校教評會通過（94.10.20）\n\n100 學年度第 7 次院教評會議修正通過（101.5.24）\n\n101 學年度第 1 次院務會議通過（101.10.24）\n\n本校第348次校教評會議修正通過（101.11.22）\n\n第一條 為審議有關本院教師之聘任、聘期、升等、停聘、解聘、不續聘、延長服務、 借調、出國講學、研究、進修、教授休假研究、講座教授之推薦等事項，依據 大學法第二十條、本校組織規程第五十八條暨本校教師評審委員會設置辦法第\n\n二條之規定，設置文學院教師評審委員會（以下簡稱院教評會） 。\n\n第二條 院教評會之成員為：\n\n(一)院長（兼召集人） 。\n\n(二)本院各系、研究所主管 （未具教授資格者，處理升等案時無投票權） 。 (三)、 各系教授代表二人、研究所教授代表一人，由各系、研究所專任教師票 選產生，任期一年。票選辦法，各系、研究所自訂。\n\n(四)如系、研究所無教授代表或系教授代表不足二人時，得由各系、研究所召 集人提名由院長敦聘本校或他校專長領域相近或本校行政經驗豐富之專任 教授代表出席。\n\n(五)各系、所之教授代表兩次未出席者，由各系、所於兩週內另行改選或改聘。\n\n第三條 院教評會會議不定期舉行，委員應親自出席，不得由他人代理。開會時應有委 員三分之二以上之出席，並經有投票權之出席委員三分之二以上之贊同，始得 通過。如遇重大事件時，則必須經必須經有投票權之出席委員四分之三以上之 同意，始得通過。\n\n第四條 院教評會開會時，得邀請有關人員列席說明。\n\n第五條 院教評會審議事項依據「教育人員任用條例」 、 「教育人員任用條例施行細則」 、 「大學及獨立學院教師聘任待遇規程」 、 「大學及獨立學院及專科學校教師審查 辦法」 、本校「教師及研究人員聘任規則」暨「教師及研究人員升等審查辦法」 、 「本院教師任聘要點」 、 「本院教師升等審查要點」等有關法令規定辦理。本院\n\n教師聘任要點暨本院教師升等審查要點另訂之。\n\n第六條 有關本辦法第一條所訂定審議之事項，須先由各系、所教評會通過，再送院教 評會審議。\n\n第七條 本辦法經院務會議通過，送校教評會核備，經校長核定後施行，修正時亦同。', '<2-hop>  [202005141641090311.md]\n\n國立中山大學中國文學系教師升等審查辦法\n\n83.01.14 82 學年度中文系所教師評審委員會議通過 85.12.11 85 學年度第 4 次系務會議修正通過 89.10.04 89 學年度第 1 次系務會議修正通過 89.12.13 89 學年度第 2 次系務會議修正通過 89.12.21 89 學年度第 6 次院教評會通過 90.09.26 90 學年度第 1 次系務會議修正通過 91.03.26 90 學年度第 6 次院教評會通過 93.04.21 92 學年度第 4 次系務會議修正通過 93.06.01 92 學年度第 5 次系務會議修正通過 93.06.08 92 學年度第 11 次院教評會通過 97.06.19 96 學年度第 6 次系務會議修正通過 97.10.02 97 學年度第 1 次院教評會通過 102.09.25 102 學年度第 1 次系務會議修正通過 102.10.18 102 學年度第 2 次院教評會修正通過 103.02.27 102 學年度第 6 次院教評會修正通過 103.05.21 102 學年度第 8 次院教評會修正通過 106.03.01 105 學年度第 5 次系教評會修正通過 學年度第 6 次系務會議修正通過 106.04.20 105 學年度第 6 次院教評會修正通過 107.05.15 105 學年度第 7 次系教評會修正通過 107.05.16 106 學年度第 8 次系務會議修正通過 107.06.14 106 學年度第 8 次院教評會修正通過 107.07.06 陳核通過\n\n一、本系為辦理教師升等，依據本校「教師評審委員會設置辦法」第二條之規定及本校、本 院教師升等審查相關法規，訂定本辦法。\n\n二、凡符合本校與文學院教師升等審查辦法規定之教師，得於每學期正式上課日一週前向 系主任申請升等，並提交下列資料：\n\n（一） 「國立中山大學教師升等送審資料項目表」所列初審應繳資料及表件。\n\n（二）文學院教師升等初審作業規定之表件。\n\n（三） 「國立中山大學中國文學系教師升等計分表」 （學術研究類或教學研究類）及相 關資料。\n\n（四）送審著作一式四份。\n\n三、系主任接獲教師升等之申請後，將上述資料公開陳列（一週） ，供全系教師閱覽，隨後召 開系教師評審委員會進行資格審查。並於當學期正式上課後十日內，將通過資格審查者 資料彙送文學院教師評審委員會辦理著作審查。\n\n四、擬升等教師所提送審著作應符合文學院教師升等審查辦法第二條之規定。著作審查由院 長聘請校外適格之學者專家三人審查。審查人選由系教評會擬提具有充分專業能力之校 外學者專家七人以上（院長得增列審查人選） ，簽請院長召集院教評會委員若幹人圈定三 人後，由文學院辦理著作外審，外審成績結果送回本系初審。外審學者應迴避申請人原 畢業學校之教授。\n\n五、依據本校「教師及研究人員升等審查辦法」第四條規定，本系教師評審委員會應就升 等教師之學術研究或教學研究、教學、服務等三項評定成績，成績總分達七十分（含） 以上者通過初審。本系教師升等初審其計分比例與項目如下：\n\n（一）學術研究類：學術研究佔百分之七十、教學績效佔百分之二十、服務成績佔百分 之十。\n\n學術研究與教學績效計分方式依「國立中山大學文學院教師升等計分表－學術研 究類」所列項目計分。服務成績計分方式依「國立中山大學中國文學系教師升等 服務成績評分原則」所列項目計分。\n\n（二）教學研究類：教學研究佔百分之六十、教學績效佔百分之三十、服務成績佔百分 之十。\n\n教學研究與教學績效計分方式依「國立中山大學文學院教師升等計分表－教學研 究類」所列項目計分。服務成績計分方式依「國立中山大學中國文學系教師升等 服務成績評分原則」所列項目計分。\n\n六、初審結果若不通過，系教師評審委員會召集人應以書面敘明理由通知申請人。申請人對 於初審結果若有異議，得依本校相關辦法及程序提出申復（或申訴） 。\n\n七、本辦法經系務會議通過，送院教評會審議通過，送請校長核定後實施，修正時亦同。']",teacher,Poor grammar,long,"<1-hop>  [201908161721320211.md]

國立中山大學文學院教師評審委員會設置辦法

84 學年度第6 次院務會議通過（85.06.04）

本校第175次校教評會准予核備（85.09.18）

87 學年度第3 次院務會議修正通過（88.01.06）

第210 次校教評會准予核備（88.01.20）

94 學年度第1 次院務會議修正通過（94.10.05）

本校第297次校教評會通過（94.10.20）

100 學年度第 7 次院教評會議修正通過（101.5.24）

101 學年度第 1 次院務會議通過（101.10.24）

本校第348次校教評會議修正通過（101.11.22）

第一條 為審議有關本院教師之聘任、聘期、升等、停聘、解聘、不續聘、延長服務、 借調、出國講學、研究、進修、教授休假研究、講座教授之推薦等事項，依據 大學法第二十條、本校組織規程第五十八條暨本校教師評審委員會設置辦法第

二條之規定，設置文學院教師評審委員會（以下簡稱院教評會） 。

第二條 院教評會之成員為：

(一)院長（兼召集人） 。

(二)本院各系、研究所主管 （未具教授資格者，處理升等案時無投票權） 。 (三)、 各系教授代表二人、研究所教授代表一人，由各系、研究所專任教師票 選產生，任期一年。票選辦法，各系、研究所自訂。

(四)如系、研究所無教授代表或系教授代表不足二人時，得由各系、研究所召 集人提名由院長敦聘本校或他校專長領域相近或本校行政經驗豐富之專任 教授代表出席。

(五)各系、所之教授代表兩次未出席者，由各系、所於兩週內另行改選或改聘。

第三條 院教評會會議不定期舉行，委員應親自出席，不得由他人代理。開會時應有委 員三分之二以上之出席，並經有投票權之出席委員三分之二以上之贊同，始得 通過。如遇重大事件時，則必須經必須經有投票權之出席委員四分之三以上之 同意，始得通過。

第四條 院教評會開會時，得邀請有關人員列席說明。

第五條 院教評會審議事項依據「教育人員任用條例」 、 「教育人員任用條例施行細則」 、 「大學及獨立學院教師聘任待遇規程」 、 「大學及獨立學院及專科學校教師審查 辦法」 、本校「教師及研究人員聘任規則」暨「教師及研究人員升等審查辦法」 、 「本院教師任聘要點」 、 「本院教師升等審查要點」等有關法令規定辦理。本院

教師聘任要點暨本院教師升等審查要點另訂之。

第六條 有關本辦法第一條所訂定審議之事項，須先由各系、所教評會通過，再送院教 評會審議。

第七條 本辦法經院務會議通過，送校教評會核備，經校長核定後施行，修正時亦同。","<2-hop>  [202005141641090311.md]

國立中山大學中國文學系教師升等審查辦法

83.01.14 82 學年度中文系所教師評審委員會議通過 85.12.11 85 學年度第 4 次系務會議修正通過 89.10.04 89 學年度第 1 次系務會議修正通過 89.12.13 89 學年度第 2 次系務會議修正通過 89.12.21 89 學年度第 6 次院教評會通過 90.09.26 90 學年度第 1 次系務會議修正通過 91.03.26 90 學年度第 6 次院教評會通過 93.04.21 92 學年度第 4 次系務會議修正通過 93.06.01 92 學年度第 5 次系務會議修正通過 93.06.08 92 學年度第 11 次院教評會通過 97.06.19 96 學年度第 6 次系務會議修正通過 97.10.02 97 學年度第 1 次院教評會通過 102.09.25 102 學年度第 1 次系務會議修正通過 102.10.18 102 學年度第 2 次院教評會修正通過 103.02.27 102 學年度第 6 次院教評會修正通過 103.05.21 102 學年度第 8 次院教評會修正通過 106.03.01 105 學年度第 5 次系教評會修正通過 學年度第 6 次系務會議修正通過 106.04.20 105 學年度第 6 次院教評會修正通過 107.05.15 105 學年度第 7 次系教評會修正通過 107.05.16 106 學年度第 8 次系務會議修正通過 107.06.14 106 學年度第 8 次院教評會修正通過 107.07.06 陳核通過

一、本系為辦理教師升等，依據本校「教師評審委員會設置辦法」第二條之規定及本校、本 院教師升等審查相關法規，訂定本辦法。

二、凡符合本校與文學院教師升等審查辦法規定之教師，得於每學期正式上課日一週前向 系主任申請升等，並提交下列資料：

（一） 「國立中山大學教師升等送審資料項目表」所列初審應繳資料及表件。

（二）文學院教師升等初審作業規定之表件。

（三） 「國立中山大學中國文學系教師升等計分表」 （學術研究類或教學研究類）及相 關資料。

（四）送審著作一式四份。

三、系主任接獲教師升等之申請後，將上述資料公開陳列（一週） ，供全系教師閱覽，隨後召 開系教師評審委員會進行資格審查。並於當學期正式上課後十日內，將通過資格審查者 資料彙送文學院教師評審委員會辦理著作審查。

四、擬升等教師所提送審著作應符合文學院教師升等審查辦法第二條之規定。著作審查由院 長聘請校外適格之學者專家三人審查。審查人選由系教評會擬提具有充分專業能力之校 外學者專家七人以上（院長得增列審查人選） ，簽請院長召集院教評會委員若幹人圈定三 人後，由文學院辦理著作外審，外審成績結果送回本系初審。外審學者應迴避申請人原 畢業學校之教授。

五、依據本校「教師及研究人員升等審查辦法」第四條規定，本系教師評審委員會應就升 等教師之學術研究或教學研究、教學、服務等三項評定成績，成績總分達七十分（含） 以上者通過初審。本系教師升等初審其計分比例與項目如下：

（一）學術研究類：學術研究佔百分之七十、教學績效佔百分之二十、服務成績佔百分 之十。

學術研究與教學績效計分方式依「國立中山大學文學院教師升等計分表－學術研 究類」所列項目計分。服務成績計分方式依「國立中山大學中國文學系教師升等 服務成績評分原則」所列項目計分。

（二）教學研究類：教學研究佔百分之六十、教學績效佔百分之三十、服務成績佔百分 之十。

教學研究與教學績效計分方式依「國立中山大學文學院教師升等計分表－教學研 究類」所列項目計分。服務成績計分方式依「國立中山大學中國文學系教師升等 服務成績評分原則」所列項目計分。

六、初審結果若不通過，系教師評審委員會召集人應以書面敘明理由通知申請人。申請人對 於初審結果若有異議，得依本校相關辦法及程序提出申復（或申訴） 。

七、本辦法經系務會議通過，送院教評會審議通過，送請校長核定後實施，修正時亦同。",201908161721320211.md,202005141641090311.md,"['教師升等申請', '教師升等', '教師升等計分表']",文學院↔文學院,教師升等↔教師升等申請 | 教師升等↔教師升等計分表,5.0,2.01,5.0,5.0,5.0,3.81,5.0
根據國立中山大學資源教室的規定，身心障礙學生如何申請學生助理人員協助服務及課業輔導？申請流程和資格條件有哪些？,根據國立中山大學資源教室學生助理人員協助服務申請暨實施要點，身心障礙學生需持有教育部特殊教育學生鑑定及就學輔導會特殊教育學生鑑定證明書，且其障礙影響課業或在校生活者為優先申請資格。申請者需填寫申請表，經資源教室輔導人員審定，通過審核後成為學生助理人員。學生助理人員包括協助同學、手語翻譯服務等，並需檢附相關資料。課業輔導方面，學生需向資源教室輔導人員說明課業加強輔導科目及學習困難，填寫課業輔導申請表並附上選課課表。資源教室評估審核申請案，並由系所任課老師或助教推薦課輔人選。申請期限為一年級新生開學後2個月內，二年級以上學生開學後1個月內，特殊需求者不受限。申請標準包括必修或重修科目、前一學期不及格學分達二分之一、身心障礙影響學習能力或其他特殊需求。學生需遵守課輔規則，如準時出席、主動完成作業，缺席達3次將終止服務。,"['<1-hop>  [202212151146490571.md]\n\n國立中山大學資源教室學生助理人員協助服務申請暨實施要點\n\n104.06.23\n\n一、依據：\n\n依「教育部補助大專校院招收及輔導身心障礙學生實施要點」 ，特訂定「國立中山大學資\n\n源教室學生助理人員協助服務申請暨實施要點」 ，以下稱本要點。\n\n二、目的：\n\n為落實協助身心障礙學生適應校園，提供生活及課業上的協助，增強同儕之社會支持，\n\n特設立資源教室學生助理人員一職。\n\n三、資源教室學生助理人員包括：協助同學、在學助理、手語翻譯服務、同步聽打員、筆抄 員等。\n\n四、申請資格條件與審核流程：\n\n（一）本校學生領有教育部特殊教育學生鑑定及就學輔導會特殊教育學生鑑定證明書，其障\n\n礙影響課業或在校生活者為優先，得申請資源教室學生助理人員。\n\n（二）申請者需填寫「國立中山大學資源教室學生助理人員申請表」 （附件一） ，經資源教室\n\n輔導人員審定。\n\n（三）資源教室輔導人員依申請者推薦人選進行審核，通過即為資源教室學生助理人員。若 推薦人選無法通過審核，則由輔導人員與系所協助遴選資源教室學生助理人員。\n\n（四）資源教室學生助理人員需檢附下列相關資料：\n\n依本校經費核銷規定檢附相關資料。\n\n若為手語翻譯員需符合教育部規定之任用資格，並檢附證明。\n\n五、資源教室學生助理人員考核辦法：\n\n（一）協助期間，資源教室學生助理人員若無法提供申請者適當之需求協助，經資源教室輔\n\n導人員評估後，得取消資格，並經由輔導老師遴選其他適任學生遞補。\n\n（二）資源教室學生助理人員需於每月填寫「國立中山大學資源教室學生助理人員工作紀錄 日前繳交至資源教室並經檢核後，始計算並發放協助\n\n表」 （附件二）一份，並於次月 5 同學之當月工作費。\n\n六、資源教室學生助理人員薪資給付標準：\n\n依「大專校院輔導身心障礙學生工作計畫經常門經費補助基準表項目一」核定標準核計 發放。\n\n七、本要點經本校特殊教育推行委員會會議通過後實施，修正時亦同。\n\n本校 103 學年度第 2 學期特殊教育推行委員會 會議修訂通過\n\n國立中山大學資源教室協助同學申請表\n\n104.06.23\n\n本校 103 學年度第 2 學期特殊教育推行委員會 會議修訂通過\n\n申請人姓名\n\n系級\n\n申請日期\n\n年 月 日\n\n障礙別 / 程度\n\n申請協助項目\n\n協助同學\n\n姓 名\n\n聯絡電話\n\n系所 / 級\n\n學 號\n\nFB 帳號\n\n繳交資料\n\n[ ] □聘僱建議表\n\n[ ] □學生證影本\n\n[ ] □身份證影本\n\n[ ] □郵局存簿 ( 金融卡 ) 帳號影本 ( 首次申請校內工讀必 需 )\n\n協助時程\n\n起訖時間\n\n年 月 日 至 年 月 日\n\n協助時段\n\n申請人簽名\n\n申請評估 ( 輔導老師填寫 )\n\n資源教室輔導老師：\n\n附件二\n\n國立中山大學 年度資源教室學生助 理人員工作紀錄表\n\n104.06.23\n\n本校 103 學年度第 2 學期特殊教育推行委員會 會議修訂通過\n\n姓 名 系 級 被協助同學 聯絡電話 購案編號 備 註\n\n月 / 日 工讀時間 工作內容 學生簽名 時數 單位主管 簽 章 全月工讀 時 數 金額', '<2-hop>  [202212151141250569.md]\n\n國立中山大學資源教室課業輔導實施要點\n\n104.06.23\n\n本校 103 學年度第 2 學期特殊教育推行委員會 會議修訂通過 105.06.17 本校 104 學年度第 2 學期特殊教育推行委員會\n\n會議修正通過\n\n一、依據：依「教育部補助大專校院招收及輔導身心障礙學生實施要點」 ，特訂定「國立中山大學資 源教室課業輔導申請暨實施要點」 ，以下稱本要點。\n\n二、目的：本要點主要針對本校身心障礙學生於必 ( 選 ) 修科目之學習上，因其障礙而導致的學習困難\n\n或學習成就低落所提供之課業輔導服務。\n\n三、申請程序：\n\n( 一 ) 學生有課業輔導需求者，需向資源教室輔導人員具體說明欲進行課業加強輔導之科目及所遭 遇之學習困難，並填寫「國立中山大學資源教室課業輔導申請表」 ( 附件一 ) 。\n\n( 二 ) 學生需自行檢附加 ( 退 ) 選完成後已確定之該學期選課課表。\n\n( 三 ) 資源教室彙整所有申請案件，評估、審核各申請案之必要性、服務方式和時數，審核結果以\n\n書面、電話或 E-mail 的方式通知申請人。\n\n( 四 ) 資源教室商請系所任課老師或助教推薦適當課輔人選名單。\n\n四、申請期限：\n\n( 一 ) 一年級新生應於每學期開學日後 2 個月內，填寫「國立中山大學資源教室課業輔導申請表」 ( 附件一 ) 提出申請，經評估有特殊需求者，不在此限。\n\n( 二 ) 二年級以上學生應於每學期開學日後 1 個月內完成申請，經評估有特殊需求者，不在此限。\n\n五、評估審核標準： ( 需符合其中一項 )\n\n( 一 ) 學生申請之科目以學生就讀學系規定之必 ( 選 ) 修科目為主，且該科目為重修之科目。\n\n( 二 ) 申請課業輔導之學生前一學期不及格學分達二分之一者。\n\n( 三 ) 學生因身心障礙顯著影響該科目學習能力。\n\n( 四 ) 其他經輔導員評估有特殊需求者。\n\n六、學生課輔之規則：\n\n( 一 ) 每位學生每學期接受課業輔導時間，不宜超過每週 6 小時、每月 24 小時。\n\n( 二 ) 學生應準時上下課，態度主動認真積極，並能確實完成課輔老師指定之作業。\n\n( 三 ) 學生因故無法出席時，應提早一日向課輔老師及資源教室老師請假，若未完成請假程序累計 達 3 次，本學期將終止本項服務，且將列入未來申請該項服務之審核考量。\n\n( 四 ) 學生無故缺席或遲到超過 20 分鐘，累計達 3 次，資源教室將終止本項服務。\n\n( 五 ) 針對不同學生申請相同科目之課業輔導，將以共同開課為優先原則。\n\n( 六 ) 課輔老師需於每月填寫「資源教室學生課業輔導紀錄表」 ( 附件二 ) 一份，並於次月 5 日前繳\n\n交至資源教室，始計算並發放當月課輔鐘點費。\n\n七、本要點經本校特殊教育推行委員會會議通過後實施，修正時亦同。\n\n國立中山大學資源教室課業輔導申請表\n\n104.06.23\n\n本校 103 學年度第 2 學期特殊教育推行委員會 會議修訂通過 105.06.17 本校 104 學年度第 2 學期特殊教育推行委員會\n\n會議修正通過\n\n申請人姓名\n\n系級\n\n障礙別 / 程度\n\n申請日期\n\n年 月 日\n\n課輔科目\n\n課輔老師\n\n姓名\n\n系所 / 級\n\n聯絡電話\n\nFB 暱稱\n\n課業輔導鐘點費\n\n[ ] □學士畢\n\n[ ] □碩士畢\n\n[ ] □ 博士畢\n\n[ ] □講師\n\n[ ] □助理教授\n\n[ ] □副教授\n\n[ ] □教授\n\n資料備註\n\n授課時間\n\n（ 以下請填時段）\n\n星期四\n\n星期一\n\n星期五\n\n星期二\n\n星期六\n\n星期三\n\n星期日\n\n授課地點 ( 勾選 )\n\n[ ] □資源教室\n\n[ ] □個諮室\n\n[ ] □研究室\n\n[ ] □其他\n\n申請評估 ( 輔導老師填寫 )\n\n[ ] □ 申請之科目為就讀學系規定之必 ( 選 ) 修科目，且該科目為重修之科目。\n\n[ ] □ 前一學期不及格學分達二分之一。\n\n[ ] □ 學生因身心障礙顯著影響該科目學習能力。\n\n[ ] □ 其他經輔導員評估有特殊需求者。\n\n[ ] □ 未符合上述任何一項。\n\n< 特殊需求說明 >\n\n課輔申請結果：□通過\n\n[ ] □不通過\n\n課輔規約\n\n上課認真、態度主動積極，確實完成課輔老師指定之作業。\n\n準時出席、不遲到、不早退。\n\n若出席情況不佳、未能配合課輔老師之要求，將作為資源教室是否繼續提 供相關服務之評估依據。\n\n若於約定上課時間未事先告知而無故缺席 ( 超過 20 分鐘 ) ，累計達 3 次以 上者，資源教室得取消課輔服務。\n\n同意以上約定，學生簽名：']",staff,Misspelled queries,medium,"<1-hop>  [202212151146490571.md]

國立中山大學資源教室學生助理人員協助服務申請暨實施要點

104.06.23

一、依據：

依「教育部補助大專校院招收及輔導身心障礙學生實施要點」 ，特訂定「國立中山大學資

源教室學生助理人員協助服務申請暨實施要點」 ，以下稱本要點。

二、目的：

為落實協助身心障礙學生適應校園，提供生活及課業上的協助，增強同儕之社會支持，

特設立資源教室學生助理人員一職。

三、資源教室學生助理人員包括：協助同學、在學助理、手語翻譯服務、同步聽打員、筆抄 員等。

四、申請資格條件與審核流程：

（一）本校學生領有教育部特殊教育學生鑑定及就學輔導會特殊教育學生鑑定證明書，其障

礙影響課業或在校生活者為優先，得申請資源教室學生助理人員。

（二）申請者需填寫「國立中山大學資源教室學生助理人員申請表」 （附件一） ，經資源教室

輔導人員審定。

（三）資源教室輔導人員依申請者推薦人選進行審核，通過即為資源教室學生助理人員。若 推薦人選無法通過審核，則由輔導人員與系所協助遴選資源教室學生助理人員。

（四）資源教室學生助理人員需檢附下列相關資料：

依本校經費核銷規定檢附相關資料。

若為手語翻譯員需符合教育部規定之任用資格，並檢附證明。

五、資源教室學生助理人員考核辦法：

（一）協助期間，資源教室學生助理人員若無法提供申請者適當之需求協助，經資源教室輔

導人員評估後，得取消資格，並經由輔導老師遴選其他適任學生遞補。

（二）資源教室學生助理人員需於每月填寫「國立中山大學資源教室學生助理人員工作紀錄 日前繳交至資源教室並經檢核後，始計算並發放協助

表」 （附件二）一份，並於次月 5 同學之當月工作費。

六、資源教室學生助理人員薪資給付標準：

依「大專校院輔導身心障礙學生工作計畫經常門經費補助基準表項目一」核定標準核計 發放。

七、本要點經本校特殊教育推行委員會會議通過後實施，修正時亦同。

本校 103 學年度第 2 學期特殊教育推行委員會 會議修訂通過

國立中山大學資源教室協助同學申請表

104.06.23

本校 103 學年度第 2 學期特殊教育推行委員會 會議修訂通過

申請人姓名

系級

申請日期

年 月 日

障礙別 / 程度

申請協助項目

協助同學

姓 名

聯絡電話

系所 / 級

學 號

FB 帳號

繳交資料

[ ] □聘僱建議表

[ ] □學生證影本

[ ] □身份證影本

[ ] □郵局存簿 ( 金融卡 ) 帳號影本 ( 首次申請校內工讀必 需 )

協助時程

起訖時間

年 月 日 至 年 月 日

協助時段

申請人簽名

申請評估 ( 輔導老師填寫 )

資源教室輔導老師：

附件二

國立中山大學 年度資源教室學生助 理人員工作紀錄表

104.06.23

本校 103 學年度第 2 學期特殊教育推行委員會 會議修訂通過

姓 名 系 級 被協助同學 聯絡電話 購案編號 備 註

月 / 日 工讀時間 工作內容 學生簽名 時數 單位主管 簽 章 全月工讀 時 數 金額","<2-hop>  [202212151141250569.md]

國立中山大學資源教室課業輔導實施要點

104.06.23

本校 103 學年度第 2 學期特殊教育推行委員會 會議修訂通過 105.06.17 本校 104 學年度第 2 學期特殊教育推行委員會

會議修正通過

一、依據：依「教育部補助大專校院招收及輔導身心障礙學生實施要點」 ，特訂定「國立中山大學資 源教室課業輔導申請暨實施要點」 ，以下稱本要點。

二、目的：本要點主要針對本校身心障礙學生於必 ( 選 ) 修科目之學習上，因其障礙而導致的學習困難

或學習成就低落所提供之課業輔導服務。

三、申請程序：

( 一 ) 學生有課業輔導需求者，需向資源教室輔導人員具體說明欲進行課業加強輔導之科目及所遭 遇之學習困難，並填寫「國立中山大學資源教室課業輔導申請表」 ( 附件一 ) 。

( 二 ) 學生需自行檢附加 ( 退 ) 選完成後已確定之該學期選課課表。

( 三 ) 資源教室彙整所有申請案件，評估、審核各申請案之必要性、服務方式和時數，審核結果以

書面、電話或 E-mail 的方式通知申請人。

( 四 ) 資源教室商請系所任課老師或助教推薦適當課輔人選名單。

四、申請期限：

( 一 ) 一年級新生應於每學期開學日後 2 個月內，填寫「國立中山大學資源教室課業輔導申請表」 ( 附件一 ) 提出申請，經評估有特殊需求者，不在此限。

( 二 ) 二年級以上學生應於每學期開學日後 1 個月內完成申請，經評估有特殊需求者，不在此限。

五、評估審核標準： ( 需符合其中一項 )

( 一 ) 學生申請之科目以學生就讀學系規定之必 ( 選 ) 修科目為主，且該科目為重修之科目。

( 二 ) 申請課業輔導之學生前一學期不及格學分達二分之一者。

( 三 ) 學生因身心障礙顯著影響該科目學習能力。

( 四 ) 其他經輔導員評估有特殊需求者。

六、學生課輔之規則：

( 一 ) 每位學生每學期接受課業輔導時間，不宜超過每週 6 小時、每月 24 小時。

( 二 ) 學生應準時上下課，態度主動認真積極，並能確實完成課輔老師指定之作業。

( 三 ) 學生因故無法出席時，應提早一日向課輔老師及資源教室老師請假，若未完成請假程序累計 達 3 次，本學期將終止本項服務，且將列入未來申請該項服務之審核考量。

( 四 ) 學生無故缺席或遲到超過 20 分鐘，累計達 3 次，資源教室將終止本項服務。

( 五 ) 針對不同學生申請相同科目之課業輔導，將以共同開課為優先原則。

( 六 ) 課輔老師需於每月填寫「資源教室學生課業輔導紀錄表」 ( 附件二 ) 一份，並於次月 5 日前繳

交至資源教室，始計算並發放當月課輔鐘點費。

七、本要點經本校特殊教育推行委員會會議通過後實施，修正時亦同。

國立中山大學資源教室課業輔導申請表

104.06.23

本校 103 學年度第 2 學期特殊教育推行委員會 會議修訂通過 105.06.17 本校 104 學年度第 2 學期特殊教育推行委員會

會議修正通過

申請人姓名

系級

障礙別 / 程度

申請日期

年 月 日

課輔科目

課輔老師

姓名

系所 / 級

聯絡電話

FB 暱稱

課業輔導鐘點費

[ ] □學士畢

[ ] □碩士畢

[ ] □ 博士畢

[ ] □講師

[ ] □助理教授

[ ] □副教授

[ ] □教授

資料備註

授課時間

（ 以下請填時段）

星期四

星期一

星期五

星期二

星期六

星期三

星期日

授課地點 ( 勾選 )

[ ] □資源教室

[ ] □個諮室

[ ] □研究室

[ ] □其他

申請評估 ( 輔導老師填寫 )

[ ] □ 申請之科目為就讀學系規定之必 ( 選 ) 修科目，且該科目為重修之科目。

[ ] □ 前一學期不及格學分達二分之一。

[ ] □ 學生因身心障礙顯著影響該科目學習能力。

[ ] □ 其他經輔導員評估有特殊需求者。

[ ] □ 未符合上述任何一項。

< 特殊需求說明 >

課輔申請結果：□通過

[ ] □不通過

課輔規約

上課認真、態度主動積極，確實完成課輔老師指定之作業。

準時出席、不遲到、不早退。

若出席情況不佳、未能配合課輔老師之要求，將作為資源教室是否繼續提 供相關服務之評估依據。

若於約定上課時間未事先告知而無故缺席 ( 超過 20 分鐘 ) ，累計達 3 次以 上者，資源教室得取消課輔服務。

同意以上約定，學生簽名：",202212151146490571.md,202212151141250569.md,['身心障礙學生'],學生事務處↔學生事務處,身心障礙學生↔身心障礙學生,5.0,5.0,5.0,5.0,5.0,2.03,5.0
請問國立中山大學資訊工程學系博士班的修業年限與學分要求是什麼？此外，國立中山大學光電工程學系碩士生就讀博士班的獎學金申請資格及違約罰則有哪些？,"根據國立中山大學資訊工程學系博士班的規定，修業年限依教育部規定為二至七年（不含保留入學及休學期間）。博士生畢業前必須至少修滿碩士班或博士班課程22學分，其中本系開授課程至少19學分；逕讀博士學位者須修滿40學分，其中本系開授課程至少30學分。碩士班一年級所修學分最多可計入博士學位學分的三分之二，且以12學分為限。博士生前兩年每學期必須選修書報討論，且每學期至少選修一門三學分課程。 

至於國立中山大學光電工程學系碩士生就讀博士班的獎學金申請資格，申請者須為本所碩士班畢業就讀本所博士班或本所碩士生通過申請逕讀博士班者。獎學金每年發放四萬元，共發放兩年，名額每年不超過五名。違約罰則包括若未能於規定修業期限內取得博士學位，或修業期間中途輟學（含自願性或非自願性退學），需將已補助之獎學金全數退回，但因健康、家庭等非自願性因素經審核同意者除外。","['<1-hop>  [201909101834230665.md]\n\n國立中山大學資訊工程學系 博士班研究生資格考核及學位考試相關規定\n\n103 學年度起入學新生適用\n\n92 年 2 月 26 日系務會議修正通過 92 年 3 月 25 日工學院院務會議修正通過 93 年 12 月 29 日系務會議修正通過 94 年 1 月 25 日工學院院務會議修正通過 94 年 3 月 9 日系務會議修正通過 94 年 3 月 23 日工學院院務會議修正通過 95 年 9 月 27 日系務會議修正通過 95 年 11 月 1 日工學院院務會議修正通過 96 年 3 月 30 日系務會議修正通過 96 年 6 月 15 日工學院院務會議修正通過 97 年 6 月 9 日系務會議修正通過 97 年 6 月 10 日工學院院務會議修正通過 98 年 5 月 20 日系務會議修正通過 98 年 6 月 10 日工學院院務會議修正通過 98 年 9 月 23 日系務會議修正通過 99 年 6 月 28 日工學院院務會議修正通過 101 年 12 月 25 日系務會議修正通過 102 年 3 月 5 日工學院院務會議修正通過 102 年 3 月 29 日系務會議修正通過 102 年 5 月 29 日工學院院務會議修正通過 103 年 2 月 20 日系務會議修正通過 103 年 6 月 6 日系務會議修正通過 103 年 6 月 13 日工學院院務會議修正通過\n\n一、依據教育部頒「學位授予法」暨其施行細則、本校「學則」及「研究生學位 考試施行細則」訂定之。\n\n二、在學期間相關事項：\n\n( 一 ) 修業年限：依教育部規定二至七年 ( 不含保留入學及休學期間 ) 。\n\n( 二 ) 學分制度及修課要求：\n\n本系博士生畢業之前必須至少修滿碩士班或博士班課程 22 學分， 其中本系開授課程至少 19 學分，其餘課程經本系同意後，得選修 相關碩、博士班開授之課程。逕讀博士學位者，至少須修滿 40 學 分，其中本系開授課程至少 30 學分。其碩士班一年級所修之學分， 最多可取三分之二的學分計入博士學位學分，且至多以 12 學分為 限。\n\n申請逕讀博士學位者，於申請前須修畢碩士班必修課程（書報討論 除外）。\n\n本系博士生修業的前二年，每學期必須選修 「書報討論」 （ seminar ） ； 另外，每學期至少須選修一門三學分課程。\n\n本系博士生每學期修讀課程，須經指導教授同意後確定之。如無指 導教授，則須經導師或系主任同意後確定之。\n\n本系博士班研究生畢業英文成績最低標準以通過下列任一檢定標 準且通過之測驗檢定日期應以入學前 2 年之後取得為限：\n\n(1) 多益測驗 TOEIC 成績達 750 分以上。\n\n(2) 全民英檢 (GEPT) 中高級複試 ( 含 ) 以上。\n\n(3) 託福紙筆測驗 (TOFEL ITP)527 分 ( 含 ) 以上\n\n(4) 託福網路化測驗 (TOFEL-iBT)71 分 ( 含 ) 以上。\n\n(5) 國際英語能力測驗 (IELTS)5.5 級 ( 含 ) 以上。\n\n如測驗上述檢定項目二次以上仍未達標準，得修習本系課程委員會 指定之英文相關課程取代且修課成績需及格且為該科全部修課人 數之前二分之一。若以修習英文相關課程方式取代英文成績者，該 學分則不納入畢業學分。\n\n為加強本系博士生的學識能力、研究能力或英文能力，本系得指定 其補修相關課程。\n\n須達本系博士班研究生規定之英文成績標準後，始得以申請學位考 試。\n\n( 三 ) 指導教授選派：\n\n本系博士生以選擇本系助理教授 ( 含 ) 以上專任教師擔任博士論文指 導教授為原則。\n\n若有特殊原因，得選擇非本系之指導教授，但必須選擇一位本系助 理教授 ( 含 ) 以上專任教師為共同指導教授。若需由系外老師共同指 導時，需經指導教授同意後，向繫上提出申請，如共同指導教授指 導學生至其畢業時未達一年以上者，取消其共同指導資格。\n\n本系博士生應於入學後一年內決定其論文指導教授。同學未於期限 內決定指導教授者，將由繫上協調指派指導教授。\n\n若因特殊原因需更換指導教授時，應先徵得原指導教授及新指導教 授同意，並以書面向本系報備。\n\n三、博士學位候選人資格考核：\n\n學期之定義：上學期自每年八月一日至次年一月三十一日、下學期自每年二 月一日至七月三十一日。\n\n( 一 ) 資格考試：\n\n資格考試以筆試行之。各科考試結果由本系系務會議議決「通過」 或「不通過」。\n\n資格考試時間每年分兩梯次，分別於上學期與下學期期末考後一個 月內舉行，本系博士生必須每次資格考試前三星期以前提出申請參 加資格考試的科目。除有特殊原因經本系專案核准外，否則申請後 而缺考者，該科目以零分計（不通過一次）。\n\n每位博士生初次申請資格考試時，必須於下列六科中自行選定四科 做為其「資格考試科目」，確定後不得再更改，且必須通過三科， 每科至多可參加二次考試：\n\n計算機結構（研究所課程）、電腦網路（大學部課程）、作業系統 （大學部課程）、演算法分析與設計（研究所課程）、數位電子學 （大學部課程）、機率學（大學部課程）\n\n資格考試科目至少需以考試方式通過一科（含）以上，未通過考試\n\n之科目，可以修課來抵免 ( 科目若有變更，將於一學期前於繫上網頁 公告 ) ，修課或考試二者可並行。抵免資格考之科目，每科修課以 一次為限，以修課申請抵免之科目，成績必須及格且需為該科全部 修課人數之前二分之一。\n\n本系博士生應在入學後一年半內 （休學期間不計） 通過資格考試 ( 含 修課扺免程序完成 ) 。未通過者應令退學。\n\n本系碩士班在學學生經指導教授簽署同意後，得申請參加資格考 試。該生若於碩士班畢業當年進入本系博士班就讀或逕讀博士班， 則資格考試之結果（含「通過」科目、「不通過」次數），均為有 效。該生若於碩士班畢業二年內未進入本系博士班就讀，則資格考 試之結果全部取消。\n\n( 二 ) 論文計畫書審查：\n\n本系博士生論文諮議委員會成員如下：指導教授、指導教授推薦相 關系所助理教授 ( 含 ) 以上二人、本系推薦一人。其中本系委員應佔 二分之一（含）以上。\n\n本系博士生在通過資格考試後一年內（休學期間不計）必須通過論 文計畫書諮議委員會之口試審查。經委員會全數委員通過，始為通 過。第一次未通過者重提論文計畫審查不受前述資格考後一年內完 成之限制，但仍須於資格考試後一年半內完成，重提論文計畫審查 以一次為限，仍不及格者，應令退學。論文計晝審查通過六個月後， 始可申請博士學位考試。\n\n四、博士班論文發表相關規定：\n\n( 一 ) 本系博士生發表之論文，至少需達到下列兩項最低標準之一，始可申請 博士學位考試：\n\n申請學位考試時，修業時間已逾四年者： 至少一篇 SCIE 期刊論文代表作，以及至少一篇 IEEE/IET Electronic Library 收錄、或 ACM Digtal Library 收錄、或 B\n\n級以上之國際會 議論文 ( 或一個與畢業論文相關之實作系統 ) 。\n\n申請學位考試時，修業時間未滿四年者： 除需符合上述條件之外，其中需有一篇 A 級 SCIE 期刊長篇論文， 或需有一篇 A 級國際會議論文，或畢業論文相關之實作系統參加 全國或國際性之競賽獲獎前三名者。 ( 期刊和會議論文等級另公佈\n\n於本系網頁 ) 。\n\n上述期刊論文代表作中，該博士生須在至少一篇 SCIE 論文，於所有作者 （指導教授除外）中列名第一位。代表作不得為其他博士生（含已畢業或 未畢業者）之代表作。\n\n( 二 ) 本系博士生發表之論文必須是在本系碩士班、博士班就讀期間，利用本 系全銜 ( 或在本系之後加列其服務單位 ) 刊登，且其指導教授需列名其上， 本系始承認其為在學期間之研究結果，並列入上述之計算標準。\n\n( 三 ) 本系博士生於申請博士學位考試資格審查前參加至少一次國際性會議，\n\n並於會議上以英文報告論文 ( 需提出佐證資料 ) 。\n\n五、博士班學位考試：\n\n本系博士生於完成論文後，經其指導教授簽字同意，認定其論文成果具原 創性及完整性，並已達博士論文水準，始可申請博士學位考試。申請博士 學位考試者，須於考試前至少一個月提出申請並經系學術委員會審查通過 （審查項目包含修業年限、修習學分、博士候選人資格考核、英文能力、 論文計畫是否於期限內通過審查、是否符合論文發表相關規定，及依學校 相關法規規定應審查之事項），始得進行博士學位考試。\n\n已達修業年限，於應提出學位考試申請之時，其修習課程或英文能力仍未 達規定者，得以切結方式申請先行審查其它畢業要項，但仍須於滿足所有 修業規定後，方得提出學位考試申請。\n\n博士學位考試悉依本校「研究生學位考試施行細則」之規定辦理。\n\n六、畢業：符合上述之各項規定者，得提出畢業之申請。\n\n七、本辦法經系務會議、院務會議通過，簽請校長核定後施行，修正時亦同。', '<2-hop>  [202005141234390201.md]\n\n國立中山大學光電工程學系 碩士生就讀（含逕讀）博士班獎學金申請辦法\n\n104.05.27 103 學年度第 9 次課程委員會修正 104.06.10 103 學年度第 11 次系務會議通過\n\n第一條 獎學金申請資格\n\n本所碩士班畢業就讀本所博士班或本所碩士生通過申請逕讀博士班者。\n\n第二條 獎學金發放辦法\n\n每年發放四萬元獎學金，共發放兩年，名額每年不超過五名，此費用係\n\n為本校「菁英博士生入學獎助學金辦法」其中系所經費來源之一。\n\n第三條 權利義務\n\n乙方需於甲方規定之博士生修業期限內取得博士學位。\n\n第四條 違約罰則\n\n一、若乙方於未能於甲方規定之博士生修業期限內取得博士學位，或於 修業期間中途輟學（含自願性或非自願性退學） ，則乙方需將實際 已補助之獎學金全數退回甲方。但乙方如係因健康、家庭等非自願\n\n性因素，提出後經甲方審核同意者，不在此限。']",curious student,Perfect grammar,medium,"<1-hop>  [201909101834230665.md]

國立中山大學資訊工程學系 博士班研究生資格考核及學位考試相關規定

103 學年度起入學新生適用

92 年 2 月 26 日系務會議修正通過 92 年 3 月 25 日工學院院務會議修正通過 93 年 12 月 29 日系務會議修正通過 94 年 1 月 25 日工學院院務會議修正通過 94 年 3 月 9 日系務會議修正通過 94 年 3 月 23 日工學院院務會議修正通過 95 年 9 月 27 日系務會議修正通過 95 年 11 月 1 日工學院院務會議修正通過 96 年 3 月 30 日系務會議修正通過 96 年 6 月 15 日工學院院務會議修正通過 97 年 6 月 9 日系務會議修正通過 97 年 6 月 10 日工學院院務會議修正通過 98 年 5 月 20 日系務會議修正通過 98 年 6 月 10 日工學院院務會議修正通過 98 年 9 月 23 日系務會議修正通過 99 年 6 月 28 日工學院院務會議修正通過 101 年 12 月 25 日系務會議修正通過 102 年 3 月 5 日工學院院務會議修正通過 102 年 3 月 29 日系務會議修正通過 102 年 5 月 29 日工學院院務會議修正通過 103 年 2 月 20 日系務會議修正通過 103 年 6 月 6 日系務會議修正通過 103 年 6 月 13 日工學院院務會議修正通過

一、依據教育部頒「學位授予法」暨其施行細則、本校「學則」及「研究生學位 考試施行細則」訂定之。

二、在學期間相關事項：

( 一 ) 修業年限：依教育部規定二至七年 ( 不含保留入學及休學期間 ) 。

( 二 ) 學分制度及修課要求：

本系博士生畢業之前必須至少修滿碩士班或博士班課程 22 學分， 其中本系開授課程至少 19 學分，其餘課程經本系同意後，得選修 相關碩、博士班開授之課程。逕讀博士學位者，至少須修滿 40 學 分，其中本系開授課程至少 30 學分。其碩士班一年級所修之學分， 最多可取三分之二的學分計入博士學位學分，且至多以 12 學分為 限。

申請逕讀博士學位者，於申請前須修畢碩士班必修課程（書報討論 除外）。

本系博士生修業的前二年，每學期必須選修 「書報討論」 （ seminar ） ； 另外，每學期至少須選修一門三學分課程。

本系博士生每學期修讀課程，須經指導教授同意後確定之。如無指 導教授，則須經導師或系主任同意後確定之。

本系博士班研究生畢業英文成績最低標準以通過下列任一檢定標 準且通過之測驗檢定日期應以入學前 2 年之後取得為限：

(1) 多益測驗 TOEIC 成績達 750 分以上。

(2) 全民英檢 (GEPT) 中高級複試 ( 含 ) 以上。

(3) 託福紙筆測驗 (TOFEL ITP)527 分 ( 含 ) 以上

(4) 託福網路化測驗 (TOFEL-iBT)71 分 ( 含 ) 以上。

(5) 國際英語能力測驗 (IELTS)5.5 級 ( 含 ) 以上。

如測驗上述檢定項目二次以上仍未達標準，得修習本系課程委員會 指定之英文相關課程取代且修課成績需及格且為該科全部修課人 數之前二分之一。若以修習英文相關課程方式取代英文成績者，該 學分則不納入畢業學分。

為加強本系博士生的學識能力、研究能力或英文能力，本系得指定 其補修相關課程。

須達本系博士班研究生規定之英文成績標準後，始得以申請學位考 試。

( 三 ) 指導教授選派：

本系博士生以選擇本系助理教授 ( 含 ) 以上專任教師擔任博士論文指 導教授為原則。

若有特殊原因，得選擇非本系之指導教授，但必須選擇一位本系助 理教授 ( 含 ) 以上專任教師為共同指導教授。若需由系外老師共同指 導時，需經指導教授同意後，向繫上提出申請，如共同指導教授指 導學生至其畢業時未達一年以上者，取消其共同指導資格。

本系博士生應於入學後一年內決定其論文指導教授。同學未於期限 內決定指導教授者，將由繫上協調指派指導教授。

若因特殊原因需更換指導教授時，應先徵得原指導教授及新指導教 授同意，並以書面向本系報備。

三、博士學位候選人資格考核：

學期之定義：上學期自每年八月一日至次年一月三十一日、下學期自每年二 月一日至七月三十一日。

( 一 ) 資格考試：

資格考試以筆試行之。各科考試結果由本系系務會議議決「通過」 或「不通過」。

資格考試時間每年分兩梯次，分別於上學期與下學期期末考後一個 月內舉行，本系博士生必須每次資格考試前三星期以前提出申請參 加資格考試的科目。除有特殊原因經本系專案核准外，否則申請後 而缺考者，該科目以零分計（不通過一次）。

每位博士生初次申請資格考試時，必須於下列六科中自行選定四科 做為其「資格考試科目」，確定後不得再更改，且必須通過三科， 每科至多可參加二次考試：

計算機結構（研究所課程）、電腦網路（大學部課程）、作業系統 （大學部課程）、演算法分析與設計（研究所課程）、數位電子學 （大學部課程）、機率學（大學部課程）

資格考試科目至少需以考試方式通過一科（含）以上，未通過考試

之科目，可以修課來抵免 ( 科目若有變更，將於一學期前於繫上網頁 公告 ) ，修課或考試二者可並行。抵免資格考之科目，每科修課以 一次為限，以修課申請抵免之科目，成績必須及格且需為該科全部 修課人數之前二分之一。

本系博士生應在入學後一年半內 （休學期間不計） 通過資格考試 ( 含 修課扺免程序完成 ) 。未通過者應令退學。

本系碩士班在學學生經指導教授簽署同意後，得申請參加資格考 試。該生若於碩士班畢業當年進入本系博士班就讀或逕讀博士班， 則資格考試之結果（含「通過」科目、「不通過」次數），均為有 效。該生若於碩士班畢業二年內未進入本系博士班就讀，則資格考 試之結果全部取消。

( 二 ) 論文計畫書審查：

本系博士生論文諮議委員會成員如下：指導教授、指導教授推薦相 關系所助理教授 ( 含 ) 以上二人、本系推薦一人。其中本系委員應佔 二分之一（含）以上。

本系博士生在通過資格考試後一年內（休學期間不計）必須通過論 文計畫書諮議委員會之口試審查。經委員會全數委員通過，始為通 過。第一次未通過者重提論文計畫審查不受前述資格考後一年內完 成之限制，但仍須於資格考試後一年半內完成，重提論文計畫審查 以一次為限，仍不及格者，應令退學。論文計晝審查通過六個月後， 始可申請博士學位考試。

四、博士班論文發表相關規定：

( 一 ) 本系博士生發表之論文，至少需達到下列兩項最低標準之一，始可申請 博士學位考試：

申請學位考試時，修業時間已逾四年者： 至少一篇 SCIE 期刊論文代表作，以及至少一篇 IEEE/IET Electronic Library 收錄、或 ACM Digtal Library 收錄、或 B

級以上之國際會 議論文 ( 或一個與畢業論文相關之實作系統 ) 。

申請學位考試時，修業時間未滿四年者： 除需符合上述條件之外，其中需有一篇 A 級 SCIE 期刊長篇論文， 或需有一篇 A 級國際會議論文，或畢業論文相關之實作系統參加 全國或國際性之競賽獲獎前三名者。 ( 期刊和會議論文等級另公佈

於本系網頁 ) 。

上述期刊論文代表作中，該博士生須在至少一篇 SCIE 論文，於所有作者 （指導教授除外）中列名第一位。代表作不得為其他博士生（含已畢業或 未畢業者）之代表作。

( 二 ) 本系博士生發表之論文必須是在本系碩士班、博士班就讀期間，利用本 系全銜 ( 或在本系之後加列其服務單位 ) 刊登，且其指導教授需列名其上， 本系始承認其為在學期間之研究結果，並列入上述之計算標準。

( 三 ) 本系博士生於申請博士學位考試資格審查前參加至少一次國際性會議，

並於會議上以英文報告論文 ( 需提出佐證資料 ) 。

五、博士班學位考試：

本系博士生於完成論文後，經其指導教授簽字同意，認定其論文成果具原 創性及完整性，並已達博士論文水準，始可申請博士學位考試。申請博士 學位考試者，須於考試前至少一個月提出申請並經系學術委員會審查通過 （審查項目包含修業年限、修習學分、博士候選人資格考核、英文能力、 論文計畫是否於期限內通過審查、是否符合論文發表相關規定，及依學校 相關法規規定應審查之事項），始得進行博士學位考試。

已達修業年限，於應提出學位考試申請之時，其修習課程或英文能力仍未 達規定者，得以切結方式申請先行審查其它畢業要項，但仍須於滿足所有 修業規定後，方得提出學位考試申請。

博士學位考試悉依本校「研究生學位考試施行細則」之規定辦理。

六、畢業：符合上述之各項規定者，得提出畢業之申請。

七、本辦法經系務會議、院務會議通過，簽請校長核定後施行，修正時亦同。","<2-hop>  [202005141234390201.md]

國立中山大學光電工程學系 碩士生就讀（含逕讀）博士班獎學金申請辦法

104.05.27 103 學年度第 9 次課程委員會修正 104.06.10 103 學年度第 11 次系務會議通過

第一條 獎學金申請資格

本所碩士班畢業就讀本所博士班或本所碩士生通過申請逕讀博士班者。

第二條 獎學金發放辦法

每年發放四萬元獎學金，共發放兩年，名額每年不超過五名，此費用係

為本校「菁英博士生入學獎助學金辦法」其中系所經費來源之一。

第三條 權利義務

乙方需於甲方規定之博士生修業期限內取得博士學位。

第四條 違約罰則

一、若乙方於未能於甲方規定之博士生修業期限內取得博士學位，或於 修業期間中途輟學（含自願性或非自願性退學） ，則乙方需將實際 已補助之獎學金全數退回甲方。但乙方如係因健康、家庭等非自願

性因素，提出後經甲方審核同意者，不在此限。",201909101834230665.md,202005141234390201.md,"['國立中山大學光電工程學系', '國立中山大學資訊工程學系博士班']",工學院↔工學院,國立中山大學資訊工程學系博士班↔國立中山大學光電工程學系,5.0,5.0,5.0,5.0,5.0,2.0,5.0
請問國立中山大學海洋生物科技暨資源學系碩士與博士學位授予辦法中，修業年限、學分要求及指導教授選派有何異同？,根據國立中山大學海洋生物科技暨資源學系碩士學位授予辦法，碩士生的修業年限依教育部規定為一至四年（不含保留入學及休學期間），須修畢規定的應修科目及最低畢業學分數24學分，且學生選課須經指導教授及系主任認可。指導教授必須是本系專任教師，若需由系外教師共同指導，需經指導教授同意。博士學位授予辦法則規定博士生的修業年限為二至七年（不含保留入學及休學期間），須修畢規定的應修科目及最低畢業學分數18學分，且博士班研究生逕行修讀博士學位者，至少應修畢30學分（含必修學分，但碩士班所修畢學分最多可抵減9學分）。博士生選課同樣須經指導教授及系主任認可，指導教授也必須是本系專任教師，若需由系外教師共同指導，需經指導教授同意。總結來說，碩士與博士學位在修業年限、學分要求及指導教授選派上均有明確規定，且指導教授均需為本系專任教師，選課均須經指導教授及系主任認可，但博士學位的修業年限較長，學分要求較低（但有逕行修讀博士學位的特殊學分規定）。,"['<1-hop>  [20190915103040.md]\n\n國立中山大學海洋生物科技暨資源學系\n\n碩士學位授予辦法及相關規定\n\n一 0 四學年度入學新生起適用\n\n91 年 12 月 12 日 本系 91 學年度第 5 次系務會議通過 91 年 12 月 26 日 本院 91 學年度第 1 學期第 1 次院務會議通過 104 年 01 月 15 日 本系 103 學年度第 1 次系務會議修正通過 104 年 04 月 16 日 本院 103 學年度第 4 次院務會議修正通過\n\n第一條 國立中山大學海洋生物科技暨資源學系碩士學位授予辦法及相關規 定 ( 以下簡稱本辦法 ) 依據國立中山大學研究生學位考試施行細則」之 規定訂定之。\n\n第二條 在學期間相關事項：\n\n一、修業年限：依教育部規定一至四年 ( 不含保留入學及休學期間 ) 。\n\n二、學分制度及修課要求：\n\n( 一 ) 學生選課均須經指導教授及系主任認可。\n\n( 二 ) 學生須修畢規定之應修科目及最低畢業學分數（ 24 學分）。\n\n三、指導教授選派：\n\n學生應選本系專任教師擔任指導教授，若需由系外教師共同指 導時，需經指導教授同意。三、碩士學位考試：\n\n第三條 碩士學位考試：\n\n學期之定義：上學期自每年八月一日至隔年一月三十一日、下學期自 每年二月一日至七月三十一日。\n\n一、研究生需符合應修科目及最低畢業學分數相關規定後，由指導教\n\n授推薦，始得舉行學位考試。\n\n二、學位考試成績不及格而其延長修業年限尚未屆滿者，得於次學期 或次學年舉行重考，重考以一次為限，經重考一次仍不及格者， 依本校學則規定應令退學。\n\n第四條 畢業：符合上述之各項規定者，得提出畢業之申請。\n\n第五條 本辦法經系務會議、院務會議通過，陳請校長核定後實施，修正時亦 同。', '<2-hop>  [202403081412220203.md]\n\n國立中山大學海洋生物科技暨資源學系\n\n博士學位授予辦法及相關規定\n\n一○四學年度入學新生起適用\n\n91 年 12 月 12 日 本系 91 學年度第 5 次系務會議通過 91 年 12 月 26 日 本院 91 年度第 1 學期第 1 次院務會議通過 92 年 03 月 03 日 本院 91 學年度第 2 學期第 1 次院務會議修正通過 93 年 12 月 23 日 本系 93 學年度第 4 次系務會議通過 94 年 01 月 05 日 本院 93 學年度第 1 學期第 1 次院務會議修正通過 100 年 06 月 07 日 本系 99 學年度第 7 次系務會議修正通過 101 年 01 月 09 日 本系 100 學年度第 5 次系務會議修正通過 101 年 04 月 12 日 本系 100 學年度第 3 次院務會議通過 104 年 01 月 15 日 本系 103 學年度第 1 次系務會議通過 104 年 04 月 16 日 本院 103 學年度第 4 次院務會議修正通過\n\n第一條 國立中山大學海洋生物科技暨資源學系碩士學位授予辦法及相關規定 ( 以下 簡稱本辦法 ) 依據國立中山大學研究生學位考試施行細則」之規定訂定之。\n\n第二條 在學期間相關事項：\n\n一、修業年限：依教育部規定二至七年 ( 不含保留入學及休學期間 ) 。\n\n二、指導教授選派：研究生應選本系專任教師擔任指導教授，若需由系外教師共 同指導時，需經指導教授同意。\n\n三、學分制度及修課要求：\n\n( 一 ) 研究生選課均須經指導教授及系主任認可。\n\n( 二 ) 學生須修畢規定之應修科目及最低畢業學分數（ 18 學分） 。\n\n( 三 ) 碩士班研究生逕行修讀博士學位者，至少應修畢 30 學分（含必修學分， 但其就讀碩士班所修畢學分最多可抵減 9 學分） 。\n\n四、語文能力要求：\n\n托福考試（ TOEFL ）新制成績（ CBT ） 200 分以上；或託福（ TOEFL ）新制 成績（ CBT ） 173 分以上及參加一次以上（含）國外主辦之國際研討會；或 已參加語言檢定未通過者得修習英文相關課程（大一英文除外）滿 8 學分； 或通過全民英檢中高級。 ( 附註 )\n\n第三條 博士學位候選人資格考核：\n\n學期之定義：上學期自每年八月一日至隔年一月三十一日、下學期自每年二 月一日至七月三十一日。\n\n一、資格考試：包括必考與選考科目，成績以通過或未通過表示，每位學生每次 最多選考三科，必須在三年內（不含休學期間）至少通過三科，未達要求者 應令其退學。考試之申請應於開學後二週內提出，並由繫上統一排訂考試時 間。通過資格考試後方可申請參加論文計畫書審查。\n\n( 二 ) 選考科目：包括以下十一科，任選二科\n\n( 一 ) 必考科目：海洋學概論\n\n（ 1. ）海洋生態學 （ 2. ）生物學 （ 3. ）生理學 （ 4. ）分子生物學 （ 5. ） 海洋地質學 （ 6. ）岩石學與礦物學 （ 7. ）動力海洋學 （ 8. ）物理海洋 學（ 9. ）有機化學 （ 10. ）環境化學 （ 11. ）天然物化學\n\n二、論文計畫書審查：第四學年結束前，必須以口試方式審查研究生論文計畫書 並考核相關學識，通過後至少六個月後方可申請參加學位考試。第一次審查 未通過者，應於次學期或次學年內申請第二次審查，兩次未通過或未完成第 一次審查者，應令其退學。\n\n( 一 ) 欲參加論文計畫書審查之研究生，應於審查前四週提出申請，由系排定 日期，於三週前公佈。\n\n( 二 ) 研究生應於排定之審查日期二週以前送交論文研究計劃書一式六份至 系辦公室。\n\n( 三 ) 審查委員由三至五位助理教授 ( 含 ) 以上教師組成，但不含指導教授。\n\n( 四 ) 研究生通過論文計畫書審查，經系主任核可後，即取得博士候選人資格。\n\n三、博士班論文發表相關規定： 研究生於學位考試前，至少須發表一篇與博士論文相關之學術論文於 SCI （ Science Citation Index ）期刊上，並為第一作者，論文獲期刊接受視同發表。\n\n四、博士班學位考試：\n\n( 一 ) 研究生於通過博士候選人資格考核，並符合語文能力及論文發表相關規定 後，由指導教授推薦，始得參加博士候選人學位考試。\n\n( 二 ) 博士候選人學位考試考試委員人選，由指導教授依本校「研究生學位考試施 行細則」規定提名，經系主任同意後陳請校長核定聘任之。\n\n( 三 ) 學位考試成績不及格而其延長修業年限尚未屆滿者，得於次學期或次學年舉 行重考，重考以一次為限，經重考一次仍不及格者，依本校學則第七十五條第 三項規定應令退學。\n\n第四條 畢業：符合上述之各項規定者，得提出畢業之申請。\n\n第五條 本辦法經系務會議、院務會議通過，陳請校長核定後實施，修正時亦同。\n\n附註：第二條 ( 四 ) 語文能力要求中之託福測驗或電腦化託福測驗，亦可以其他相當 之語言測驗成績抵免之，例如： 1. 舊制託福測驗 533 分或 2. 電腦化託福測驗 (CBT TOEFL) 200 分或 3. 新制託福 (iBT-TOEFL) 77 分或 4. 多益測驗 (TOEIC) 700 分或 5.IELTS 5.0 ( 含 ) 以上；或 1. 舊制託福測驗 500 分或 2. 電腦化託福測驗 (CBT TOEFL) 173 分或 3. 新制託福 (iBT-TOEFL) 61 分或 4. 多益測驗 (TOEIC) 650 分或 5.IELTS 4.0 ( 含 ) 以上，且參加一次以上（含）之國際研討會。']",teacher,Web search like queries,long,"<1-hop>  [20190915103040.md]

國立中山大學海洋生物科技暨資源學系

碩士學位授予辦法及相關規定

一 0 四學年度入學新生起適用

91 年 12 月 12 日 本系 91 學年度第 5 次系務會議通過 91 年 12 月 26 日 本院 91 學年度第 1 學期第 1 次院務會議通過 104 年 01 月 15 日 本系 103 學年度第 1 次系務會議修正通過 104 年 04 月 16 日 本院 103 學年度第 4 次院務會議修正通過

第一條 國立中山大學海洋生物科技暨資源學系碩士學位授予辦法及相關規 定 ( 以下簡稱本辦法 ) 依據國立中山大學研究生學位考試施行細則」之 規定訂定之。

第二條 在學期間相關事項：

一、修業年限：依教育部規定一至四年 ( 不含保留入學及休學期間 ) 。

二、學分制度及修課要求：

( 一 ) 學生選課均須經指導教授及系主任認可。

( 二 ) 學生須修畢規定之應修科目及最低畢業學分數（ 24 學分）。

三、指導教授選派：

學生應選本系專任教師擔任指導教授，若需由系外教師共同指 導時，需經指導教授同意。三、碩士學位考試：

第三條 碩士學位考試：

學期之定義：上學期自每年八月一日至隔年一月三十一日、下學期自 每年二月一日至七月三十一日。

一、研究生需符合應修科目及最低畢業學分數相關規定後，由指導教

授推薦，始得舉行學位考試。

二、學位考試成績不及格而其延長修業年限尚未屆滿者，得於次學期 或次學年舉行重考，重考以一次為限，經重考一次仍不及格者， 依本校學則規定應令退學。

第四條 畢業：符合上述之各項規定者，得提出畢業之申請。

第五條 本辦法經系務會議、院務會議通過，陳請校長核定後實施，修正時亦 同。","<2-hop>  [202403081412220203.md]

國立中山大學海洋生物科技暨資源學系

博士學位授予辦法及相關規定

一○四學年度入學新生起適用

91 年 12 月 12 日 本系 91 學年度第 5 次系務會議通過 91 年 12 月 26 日 本院 91 年度第 1 學期第 1 次院務會議通過 92 年 03 月 03 日 本院 91 學年度第 2 學期第 1 次院務會議修正通過 93 年 12 月 23 日 本系 93 學年度第 4 次系務會議通過 94 年 01 月 05 日 本院 93 學年度第 1 學期第 1 次院務會議修正通過 100 年 06 月 07 日 本系 99 學年度第 7 次系務會議修正通過 101 年 01 月 09 日 本系 100 學年度第 5 次系務會議修正通過 101 年 04 月 12 日 本系 100 學年度第 3 次院務會議通過 104 年 01 月 15 日 本系 103 學年度第 1 次系務會議通過 104 年 04 月 16 日 本院 103 學年度第 4 次院務會議修正通過

第一條 國立中山大學海洋生物科技暨資源學系碩士學位授予辦法及相關規定 ( 以下 簡稱本辦法 ) 依據國立中山大學研究生學位考試施行細則」之規定訂定之。

第二條 在學期間相關事項：

一、修業年限：依教育部規定二至七年 ( 不含保留入學及休學期間 ) 。

二、指導教授選派：研究生應選本系專任教師擔任指導教授，若需由系外教師共 同指導時，需經指導教授同意。

三、學分制度及修課要求：

( 一 ) 研究生選課均須經指導教授及系主任認可。

( 二 ) 學生須修畢規定之應修科目及最低畢業學分數（ 18 學分） 。

( 三 ) 碩士班研究生逕行修讀博士學位者，至少應修畢 30 學分（含必修學分， 但其就讀碩士班所修畢學分最多可抵減 9 學分） 。

四、語文能力要求：

托福考試（ TOEFL ）新制成績（ CBT ） 200 分以上；或託福（ TOEFL ）新制 成績（ CBT ） 173 分以上及參加一次以上（含）國外主辦之國際研討會；或 已參加語言檢定未通過者得修習英文相關課程（大一英文除外）滿 8 學分； 或通過全民英檢中高級。 ( 附註 )

第三條 博士學位候選人資格考核：

學期之定義：上學期自每年八月一日至隔年一月三十一日、下學期自每年二 月一日至七月三十一日。

一、資格考試：包括必考與選考科目，成績以通過或未通過表示，每位學生每次 最多選考三科，必須在三年內（不含休學期間）至少通過三科，未達要求者 應令其退學。考試之申請應於開學後二週內提出，並由繫上統一排訂考試時 間。通過資格考試後方可申請參加論文計畫書審查。

( 二 ) 選考科目：包括以下十一科，任選二科

( 一 ) 必考科目：海洋學概論

（ 1. ）海洋生態學 （ 2. ）生物學 （ 3. ）生理學 （ 4. ）分子生物學 （ 5. ） 海洋地質學 （ 6. ）岩石學與礦物學 （ 7. ）動力海洋學 （ 8. ）物理海洋 學（ 9. ）有機化學 （ 10. ）環境化學 （ 11. ）天然物化學

二、論文計畫書審查：第四學年結束前，必須以口試方式審查研究生論文計畫書 並考核相關學識，通過後至少六個月後方可申請參加學位考試。第一次審查 未通過者，應於次學期或次學年內申請第二次審查，兩次未通過或未完成第 一次審查者，應令其退學。

( 一 ) 欲參加論文計畫書審查之研究生，應於審查前四週提出申請，由系排定 日期，於三週前公佈。

( 二 ) 研究生應於排定之審查日期二週以前送交論文研究計劃書一式六份至 系辦公室。

( 三 ) 審查委員由三至五位助理教授 ( 含 ) 以上教師組成，但不含指導教授。

( 四 ) 研究生通過論文計畫書審查，經系主任核可後，即取得博士候選人資格。

三、博士班論文發表相關規定： 研究生於學位考試前，至少須發表一篇與博士論文相關之學術論文於 SCI （ Science Citation Index ）期刊上，並為第一作者，論文獲期刊接受視同發表。

四、博士班學位考試：

( 一 ) 研究生於通過博士候選人資格考核，並符合語文能力及論文發表相關規定 後，由指導教授推薦，始得參加博士候選人學位考試。

( 二 ) 博士候選人學位考試考試委員人選，由指導教授依本校「研究生學位考試施 行細則」規定提名，經系主任同意後陳請校長核定聘任之。

( 三 ) 學位考試成績不及格而其延長修業年限尚未屆滿者，得於次學期或次學年舉 行重考，重考以一次為限，經重考一次仍不及格者，依本校學則第七十五條第 三項規定應令退學。

第四條 畢業：符合上述之各項規定者，得提出畢業之申請。

第五條 本辦法經系務會議、院務會議通過，陳請校長核定後實施，修正時亦同。

附註：第二條 ( 四 ) 語文能力要求中之託福測驗或電腦化託福測驗，亦可以其他相當 之語言測驗成績抵免之，例如： 1. 舊制託福測驗 533 分或 2. 電腦化託福測驗 (CBT TOEFL) 200 分或 3. 新制託福 (iBT-TOEFL) 77 分或 4. 多益測驗 (TOEIC) 700 分或 5.IELTS 5.0 ( 含 ) 以上；或 1. 舊制託福測驗 500 分或 2. 電腦化託福測驗 (CBT TOEFL) 173 分或 3. 新制託福 (iBT-TOEFL) 61 分或 4. 多益測驗 (TOEIC) 650 分或 5.IELTS 4.0 ( 含 ) 以上，且參加一次以上（含）之國際研討會。",20190915103040.md,202403081412220203.md,"['博士學位授予辦法', '碩士學位授予辦法']",海洋科學學院↔海洋科學學院 | 海洋生物科技暨資源學系↔海洋生物科技暨資源學系,碩士學位授予辦法↔博士學位授予辦法,5.0,2.49,5.0,5.0,5.0,2.0,5.0
碩士班預備研究生如何取得碩士班研究生資格？申請逕修讀博士學位的碩士班研究生需要符合哪些條件？,根據提供的上下文，碩士班預備研究生必須於規定修業年限內（不含延長修業）取得學士學位，並於畢業當學年度參加預修之碩士班甄試或考試，經錄取後，始正式取得碩士班研究生資格。至於申請逕修讀博士學位的碩士班研究生，需修業一年以上，成績優異，具有明顯之研究潛力，且第一學年兩學期之學業成績名次在該班前三分之一以內，方得申請逕行修讀博士學位。,"['<1-hop>  [201909121024240838.md]\n\n國立中山大學資管系碩士班研究生申請逕修讀博士學位審查辦法\n\n83.3.24 八十二學年度系務會議通過 94.4.21 九十三學年度第十一次系務會議通過\n\n第一條 本作業規定依大學法第二十二條第五項、學位授予法第九條、教育部頒大學及 本校碩士班研究生申請逕修讀博士學位作業規定訂定之。\n\n第二條 碩士班研究生修業一年以上，成績優異，具有明顯之研究潛力且第一學年兩學 期之學業成績名次在該班前三分之一以內，得申請逕行修讀博士學位。\n\n第三條 碩士班研究生每學年逕行修讀博士學位之名額，以本系當學年度教育部核定博 士班招生名額三分之一為限。\n\n第四條 符合各項標準者，應於行事曆規定時間須繳交下列各款文件向繫上提出申請 （一）申請書一份。\n\n（二）碩士班第一學年成績單一份。\n\n（三）推薦書二份。\n\n第五條 本系接到研究生申請後，由系主任召集本系助理教授（含）以上組成委員會加 以審查。依審查成績至多通知招生名額二倍學生進行口試，通過者由系主任開\n\n具推薦書向教務處提出申請。\n\n第六條 逕修讀博士學位之研究生因故中止修讀博士學位或未通過博士學位候選人資 格考核，經系務會議審查通過，簽請校長核定後，得再回原碩士班就讀。\n\n前項研究生依規定修畢碩士班應修課程，提出論文，經碩士學位考試委員會考 試通過者，授予碩士學位。\n\n第七條 本作業規定經系務會議通過後實施，修訂時亦同。', '<2-hop>  [201909121146590907.md]\n\n國立中山大學行銷傳播管理研究所\n\n五學年學、碩士學位辦法\n\n91.2.7 所務會議通過實施 98.11.4 所務會議修正通過 102.12.18 所務會議修正通過 102.12.17 第 138 次教務會議修正通過\n\n103.5.16 所務會議修正通過\n\n第一條 本辦法依本校五學年學、碩士學位辦法訂定之。\n\n第二條 大學部相關各系學生入學後，修業滿五學期，成績優異，且合於下列各 款標準者，得於三年級下學期，教務行事曆規定時間申請五學年學、碩 士學位之修讀：\n\n( 一 ) 具有明顯之研究潛力。\n\n( 二 ) 五學期之學業成績名次在該班人數之前 10% 。\n\n( 三 ) 經所務會議通過。\n\n第三條 名額以每年三名為上限。\n\n第四條 所稱相關各系指本校各系。\n\n第五條 申請者需繳交下列資料：\n\n( 一 ) 申請書。\n\n( 二 ) 研究計劃書。\n\n( 三 ) 大學前五學期之成績單與名次。\n\n( 四 ) 教授推薦函兩份。\n\n( 五 ) 其他可茲證明其研究能力之文件。\n\n第六條 錄取之學生兼具學士學位候選人及碩士班預備研究生 ( 以下簡稱預研 生 ) 資格。\n\n第七條 取得預研生資格後，必須於規定修業年限內（不含延長修業）取得學士 學位，並於畢業當學年度參加預修之碩士班甄試或考試，經錄取後，始 正式取得碩士班研究生資格。\n\n第八條 學士班期間所選修之研究所課程，可申請抵免碩士班研究生應修學分 數。但所預修之研究所課程若已計入大學部畢業學分數內，不得再申請 抵免碩士班學分數。\n\n第九條 本辦法經所務會議，教務會議通過，經校長核定後實施，修正時亦同。']",teacher,Poor grammar,short,"<1-hop>  [201909121024240838.md]

國立中山大學資管系碩士班研究生申請逕修讀博士學位審查辦法

83.3.24 八十二學年度系務會議通過 94.4.21 九十三學年度第十一次系務會議通過

第一條 本作業規定依大學法第二十二條第五項、學位授予法第九條、教育部頒大學及 本校碩士班研究生申請逕修讀博士學位作業規定訂定之。

第二條 碩士班研究生修業一年以上，成績優異，具有明顯之研究潛力且第一學年兩學 期之學業成績名次在該班前三分之一以內，得申請逕行修讀博士學位。

第三條 碩士班研究生每學年逕行修讀博士學位之名額，以本系當學年度教育部核定博 士班招生名額三分之一為限。

第四條 符合各項標準者，應於行事曆規定時間須繳交下列各款文件向繫上提出申請 （一）申請書一份。

（二）碩士班第一學年成績單一份。

（三）推薦書二份。

第五條 本系接到研究生申請後，由系主任召集本系助理教授（含）以上組成委員會加 以審查。依審查成績至多通知招生名額二倍學生進行口試，通過者由系主任開

具推薦書向教務處提出申請。

第六條 逕修讀博士學位之研究生因故中止修讀博士學位或未通過博士學位候選人資 格考核，經系務會議審查通過，簽請校長核定後，得再回原碩士班就讀。

前項研究生依規定修畢碩士班應修課程，提出論文，經碩士學位考試委員會考 試通過者，授予碩士學位。

第七條 本作業規定經系務會議通過後實施，修訂時亦同。","<2-hop>  [201909121146590907.md]

國立中山大學行銷傳播管理研究所

五學年學、碩士學位辦法

91.2.7 所務會議通過實施 98.11.4 所務會議修正通過 102.12.18 所務會議修正通過 102.12.17 第 138 次教務會議修正通過

103.5.16 所務會議修正通過

第一條 本辦法依本校五學年學、碩士學位辦法訂定之。

第二條 大學部相關各系學生入學後，修業滿五學期，成績優異，且合於下列各 款標準者，得於三年級下學期，教務行事曆規定時間申請五學年學、碩 士學位之修讀：

( 一 ) 具有明顯之研究潛力。

( 二 ) 五學期之學業成績名次在該班人數之前 10% 。

( 三 ) 經所務會議通過。

第三條 名額以每年三名為上限。

第四條 所稱相關各系指本校各系。

第五條 申請者需繳交下列資料：

( 一 ) 申請書。

( 二 ) 研究計劃書。

( 三 ) 大學前五學期之成績單與名次。

( 四 ) 教授推薦函兩份。

( 五 ) 其他可茲證明其研究能力之文件。

第六條 錄取之學生兼具學士學位候選人及碩士班預備研究生 ( 以下簡稱預研 生 ) 資格。

第七條 取得預研生資格後，必須於規定修業年限內（不含延長修業）取得學士 學位，並於畢業當學年度參加預修之碩士班甄試或考試，經錄取後，始 正式取得碩士班研究生資格。

第八條 學士班期間所選修之研究所課程，可申請抵免碩士班研究生應修學分 數。但所預修之研究所課程若已計入大學部畢業學分數內，不得再申請 抵免碩士班學分數。

第九條 本辦法經所務會議，教務會議通過，經校長核定後實施，修正時亦同。",201909121024240838.md,201909121146590907.md,"['碩士班預備研究生', '碩士班研究生']",管理學院↔管理學院,碩士班研究生↔碩士班預備研究生,5.0,5.0,4.9,5.0,5.0,2.0,5.0
國立中山大學管理學院企業管理學系的教師評鑑實施要點是如何規定教師評鑑的評分標準？另外，該系學生赴國外大學交換獎助辦法中，獲獎學生在交換期間有什麼具體的義務？,根據國立中山大學管理學院企業管理學系教師評鑑實施要點，教師評鑑包括教學、研究、輔導與服務三項，評分標準為教學佔40%、研究佔30%、輔導與服務佔30%，總計為100%。此外，根據國立中山大學企業管理學系學生赴國外大學交換獎助辦法，獲獎學生須於交換期間每月至中山企管粉絲團上傳交換活動圖文概述至少500字及照片至少6張，交換一學期者需繳交四次，交換一學年者需繳交八次，若無按時繳交將不予補助。,"['<1-hop>  [202107091423250835.md]\n\n國立中山大學管理學院企業管理學系教師評鑑實施要點\n\n95 年 06 月 1 日 94 學年度第二學期第四次臨時系務會議通過 95 年 06 月 15 日本校第 303 次校教評會修正通過 95 年 06 月 20 日本校 94 學年度第 4 次校務會議修正通過 96 年 03 月 08 日 95 學年度第 5 次系務會修正通過 100 年 02 月 24 日 99 學年度第 6 次系務會修正通過 101 年 05 月 18 日 100 學年度第 8 次系務會修正通過 101 年 05 月 29 日 100 學年第 8 次院教評 101 年 06 月 14 日 100 學年度第 344 次校教評通過 103 年 4 月 17 日 102 學年第 6 次系務會議修正通過 103 年 5 月 26 日 102 學年度第 7 次院教評會修正通過 103 年 10 月 16 日 第 363 次校教評會修正通過 103 年 12 月 26 日本校 103 學年度第 2 次校務會議通 過\n\n一、國立中山大學管理學院企業管理學系（以下簡稱本系）為提昇教師教學、 研究、輔導及服務品質，特依本校教師評鑑辦法規定訂定本系教師評鑑 實施要點（以下簡稱本要點） 。\n\n二、本系教師評鑑，包括評鑑項目、方法、標準及程序等，除本要點規定外， 悉依本校教師評鑑辦法暨其作業細則及管理學院相關規定所定辦理。 評分標準如本院教師評鑑表及教師評鑑指標表（如附件）所示，助理教授 以上教師教學 (40%) 、研究 (30%) 、輔導與服務 (30%) 等三項，總計為 100 ％。\n\n三、本要點經本系系務會議通過後，送請院教師評審委員會、校教師評審委員 會通過後實施，修正時亦同。', '<2-hop>  [202107121142460860.md]\n\n國立中山大學企業管理學系學生赴國外大學（不含大陸）交換獎助辦法\n\n105 學年度第八次系務會議通過 107 學年第 4 次系務會議修訂 (1071213)\n\n第一條 為獎助本系表現優良學生赴國外大學交換，以提升本校學生國際觀及競爭優 勢，特訂定本辦法。\n\n第二條 申請資格\n\n申請及受補助期間需為本系已註冊之在學學生（非陸生） 。\n\n第三條 獎助年限\n\n交換期間為一學年或一學期。\n\n第四條 獎助金額\n\n每年總補助金額三十萬為上限，每名獎助金額最高為一萬元整。經費來源：新 加坡南洋理工大學自費選讀生 -企管系 ( 自 102 學年度起結餘款 )\n\n第五條 申請方式及日期：\n\n（一）申請期限：依規定期限送交至系辦公室，逾期不予受理。\n\n（二）繳交表件如下：\n\n學生個人基本資料表。\n\n2.\n\n入學許可或錄取通知書。\n\n第六條 本獎助辦法審查委員會由本系系主任為召集人，邀請本系財務委員會委員組成 本獎助辦法審查委員會，負責審查、核定得獎名單等事宜。\n\n第七條 獲獎生須於交換期間每月至中山企管粉絲團上傳交換活動圖文概述至少 500 字、照片至少 6 張（交換一學期者繳四次，一學年者繳交八次） ，若無按時繳\n\n交將不予補助。\n\n本辦法經系務會議通過實施，修正時亦同。\n\n第八條\n\n附件：國立中山大學企業管理學系赴國外大學交換獎學金 申 請 書\n\n姓 名 學 號 身分證 電 話 字 號 Email 郵 號 / 帳 局 局 號 局 局 號 局 局 號 局 局 號 交 換 / 學 國 家 校 國 家 校 國 家 校 國 家 校 交 換 時 間 間 間 間 是否請領其他獎學金 □ 無 □ 有 ( 請就申請結果、金額等詳加說明 ) ＿＿＿＿＿＿＿＿＿＿＿＿＿＿＿＿＿＿＿＿＿＿＿＿ ＿＿＿＿＿＿＿＿＿＿＿＿＿＿＿＿＿＿＿＿＿＿＿＿ □ 無 □ 有 ( 請就申請結果、金額等詳加說明 ) ＿＿＿＿＿＿＿＿＿＿＿＿＿＿＿＿＿＿＿＿＿＿＿＿ ＿＿＿＿＿＿＿＿＿＿＿＿＿＿＿＿＿＿＿＿＿＿＿＿ □ 無 □ 有 ( 請就申請結果、金額等詳加說明 ) ＿＿＿＿＿＿＿＿＿＿＿＿＿＿＿＿＿＿＿＿＿＿＿＿ ＿＿＿＿＿＿＿＿＿＿＿＿＿＿＿＿＿＿＿＿＿＿＿＿ □ 無 □ 有 ( 請就申請結果、金額等詳加說明 ) ＿＿＿＿＿＿＿＿＿＿＿＿＿＿＿＿＿＿＿＿＿＿＿＿ ＿＿＿＿＿＿＿＿＿＿＿＿＿＿＿＿＿＿＿＿＿＿＿＿\n\n中山企管粉絲團 :\n\nhttps://www.facebook.com/%E4%B8%AD%E5%B1%B1%E4%BC%81%E7%AE%A1-1980280 942220433/\n\n申請人：\n\n中華民國\n\n簽章 )\n\n……………………………………………………………………………………….………\n\n審查結果：\n\n國立中山大學企業管理學系學生赴國外大學 ( 不含大陸 ) 交換獎助成果報告表\n\n姓名：\n\n學號：\n\n郵局局帳號：\n\n身分證字號：\n\n交換國家 / 時間：\n\n日期： 日期：\n\n備註：\n\n獲獎生須每個月至中山企管粉絲團上傳交換活動圖文概述，若無按時繳交將不予補 助。請將在中山企管粉絲團 po 文之截圖放至以上表格，回國後繳交本單至系辦。 ( 補 助 5000 元的請 PO 四次；補助 10000 元請 PO 八次 )\n\n應屆畢業生成果報告表，務必於畢業離校前二週繳交，未依規定者不予補助。']",teacher,Poor grammar,short,"<1-hop>  [202107091423250835.md]

國立中山大學管理學院企業管理學系教師評鑑實施要點

95 年 06 月 1 日 94 學年度第二學期第四次臨時系務會議通過 95 年 06 月 15 日本校第 303 次校教評會修正通過 95 年 06 月 20 日本校 94 學年度第 4 次校務會議修正通過 96 年 03 月 08 日 95 學年度第 5 次系務會修正通過 100 年 02 月 24 日 99 學年度第 6 次系務會修正通過 101 年 05 月 18 日 100 學年度第 8 次系務會修正通過 101 年 05 月 29 日 100 學年第 8 次院教評 101 年 06 月 14 日 100 學年度第 344 次校教評通過 103 年 4 月 17 日 102 學年第 6 次系務會議修正通過 103 年 5 月 26 日 102 學年度第 7 次院教評會修正通過 103 年 10 月 16 日 第 363 次校教評會修正通過 103 年 12 月 26 日本校 103 學年度第 2 次校務會議通 過

一、國立中山大學管理學院企業管理學系（以下簡稱本系）為提昇教師教學、 研究、輔導及服務品質，特依本校教師評鑑辦法規定訂定本系教師評鑑 實施要點（以下簡稱本要點） 。

二、本系教師評鑑，包括評鑑項目、方法、標準及程序等，除本要點規定外， 悉依本校教師評鑑辦法暨其作業細則及管理學院相關規定所定辦理。 評分標準如本院教師評鑑表及教師評鑑指標表（如附件）所示，助理教授 以上教師教學 (40%) 、研究 (30%) 、輔導與服務 (30%) 等三項，總計為 100 ％。

三、本要點經本系系務會議通過後，送請院教師評審委員會、校教師評審委員 會通過後實施，修正時亦同。","<2-hop>  [202107121142460860.md]

國立中山大學企業管理學系學生赴國外大學（不含大陸）交換獎助辦法

105 學年度第八次系務會議通過 107 學年第 4 次系務會議修訂 (1071213)

第一條 為獎助本系表現優良學生赴國外大學交換，以提升本校學生國際觀及競爭優 勢，特訂定本辦法。

第二條 申請資格

申請及受補助期間需為本系已註冊之在學學生（非陸生） 。

第三條 獎助年限

交換期間為一學年或一學期。

第四條 獎助金額

每年總補助金額三十萬為上限，每名獎助金額最高為一萬元整。經費來源：新 加坡南洋理工大學自費選讀生 -企管系 ( 自 102 學年度起結餘款 )

第五條 申請方式及日期：

（一）申請期限：依規定期限送交至系辦公室，逾期不予受理。

（二）繳交表件如下：

學生個人基本資料表。

2.

入學許可或錄取通知書。

第六條 本獎助辦法審查委員會由本系系主任為召集人，邀請本系財務委員會委員組成 本獎助辦法審查委員會，負責審查、核定得獎名單等事宜。

第七條 獲獎生須於交換期間每月至中山企管粉絲團上傳交換活動圖文概述至少 500 字、照片至少 6 張（交換一學期者繳四次，一學年者繳交八次） ，若無按時繳

交將不予補助。

本辦法經系務會議通過實施，修正時亦同。

第八條

附件：國立中山大學企業管理學系赴國外大學交換獎學金 申 請 書

姓 名 學 號 身分證 電 話 字 號 Email 郵 號 / 帳 局 局 號 局 局 號 局 局 號 局 局 號 交 換 / 學 國 家 校 國 家 校 國 家 校 國 家 校 交 換 時 間 間 間 間 是否請領其他獎學金 □ 無 □ 有 ( 請就申請結果、金額等詳加說明 ) ＿＿＿＿＿＿＿＿＿＿＿＿＿＿＿＿＿＿＿＿＿＿＿＿ ＿＿＿＿＿＿＿＿＿＿＿＿＿＿＿＿＿＿＿＿＿＿＿＿ □ 無 □ 有 ( 請就申請結果、金額等詳加說明 ) ＿＿＿＿＿＿＿＿＿＿＿＿＿＿＿＿＿＿＿＿＿＿＿＿ ＿＿＿＿＿＿＿＿＿＿＿＿＿＿＿＿＿＿＿＿＿＿＿＿ □ 無 □ 有 ( 請就申請結果、金額等詳加說明 ) ＿＿＿＿＿＿＿＿＿＿＿＿＿＿＿＿＿＿＿＿＿＿＿＿ ＿＿＿＿＿＿＿＿＿＿＿＿＿＿＿＿＿＿＿＿＿＿＿＿ □ 無 □ 有 ( 請就申請結果、金額等詳加說明 ) ＿＿＿＿＿＿＿＿＿＿＿＿＿＿＿＿＿＿＿＿＿＿＿＿ ＿＿＿＿＿＿＿＿＿＿＿＿＿＿＿＿＿＿＿＿＿＿＿＿

中山企管粉絲團 :

https://www.facebook.com/%E4%B8%AD%E5%B1%B1%E4%BC%81%E7%AE%A1-1980280 942220433/

申請人：

中華民國

簽章 )

……………………………………………………………………………………….………

審查結果：

國立中山大學企業管理學系學生赴國外大學 ( 不含大陸 ) 交換獎助成果報告表

姓名：

學號：

郵局局帳號：

身分證字號：

交換國家 / 時間：

日期： 日期：

備註：

獲獎生須每個月至中山企管粉絲團上傳交換活動圖文概述，若無按時繳交將不予補 助。請將在中山企管粉絲團 po 文之截圖放至以上表格，回國後繳交本單至系辦。 ( 補 助 5000 元的請 PO 四次；補助 10000 元請 PO 八次 )

應屆畢業生成果報告表，務必於畢業離校前二週繳交，未依規定者不予補助。",202107091423250835.md,202107121142460860.md,"['國立中山大學管理學院企業管理學系', '國立中山大學企業管理學系']",管理學院↔管理學院 | 企業管理學系↔企業管理學系,國立中山大學管理學院企業管理學系↔國立中山大學企業管理學系,5.0,5.0,5.0,5.0,5.0,2.0,5.0
國立中山大學中國文學系教師評審委員會設置辦法中，系教評會的組成與會議規定是什麼？這些規定如何與系課程委員會的設置要點相互配合？,根據國立中山大學中國文學系教師評審委員會設置辦法，系教評會由本系教師七名組成，系主任為當然委員兼召集人，教授不得少於三人，任期一年，連選得連任。會議不定期舉行，必須三分之二以上委員出席始能開會，議案須三分之二以上贊同方可通過。委員為議案當事人時須迴避討論與表決，且不同職稱教師在升等審查中有不同參與限制。系教評會審議事項依據校教評會及院教評會設置辦法及本系教師聘任、升等等相關規定辦理，通過議案須送院教評會審議。系課程委員會則由專任教師、學生代表及校外專家組成，負責檢討修正課程、初審新生必修科目及新開課程，並規劃安排授課教師。兩者分別負責教師評審與課程規劃，透過系務會議及院級委員會的審議程序相互配合，確保教師聘任與課程發展的品質與一致性。,"['<1-hop>  [202005141625120295.md]\n\n國立中山大學中國文學系「課程委員會設置要點」\n\n98.12.09 98 學年度第 3 次系務會議訂定 99.01.15 98 學年度第 3 次院課程委員會議通過 99.03.24 98 學年度第 5 次系務會議修訂通過 99.05.06 98 學年度第 6 次院課程委員會議修訂通過 99.05.31 984 校課程委員會議通過 99.06.15 第 124 次教務會議通過\n\n105.11.30 105 學年度第 3 次系務會議修訂通過\n\n第一條 依據本校課程委員會設置要點第三條之規定，訂定本要點。\n\n第二條 本系課程委員會（以下簡稱「系課程會」），由本系專任教 師5名、學生代表1 至2 人、校外專家學者(含業界代表)1 至2 人組成(系主任為當然委員兼召集人)。\n\n第三條 系課程會之職責：\n\n一、定期檢討修正系所課程、課程結構與發展方向（納入業界、 畢業校友及學生（或家長）之意見） 。\n\n二、初審入學新生必修科目表相關之事宜。\n\n三、初審新開課程下列項目：\n\n．課程名稱（中、英文） 、課程內容、課程大綱。\n\n．考量其他相關因素，如新開設課程與教師專長之配合、與 系所發展方向之配合、與現有課程之關連等。\n\n四、課程相關問題之審議。\n\n五、考量教師專長及平衡研究、教學之負擔，規劃及安排每學年 度課程授課教師。\n\n六、研議系所課程相關改善機制，作成議案提系務會議討論。\n\n七、相關決議須經系務會議通過後方可送院課程委員會審議。\n\n第四條 本要點經系務會議通過，並送院、校課程委員會及教務會議核備 後實施，其修正時亦同。', '<2-hop>  [201909051441190350.md]\n\n國立中山大學中國文學系教師評審委員會設置辦法\n\n85.11.13 85 學年度第 3 次系務會議修訂通過 85.11.27 85 學年度第 2 次院教評會准予核備 90.05.09 89 學年度第 6 次系務會議修訂通過 90.05.17 89 學年度第 9 次院教評會准予核備 95.05.23 94 學年度第 6 次系務會議修訂通過 95.05.30 94 學年度第 6 次院教評會准予核備 95.09.26 95 學年度第 1 次系務會議修訂通過 95.11.23 95 學年度第 2 次院教評會准予核備 101.12.25 101 學年度第 3 次系務會議修訂通過 102.02.27 101 學年度第 5 次院教評會審議通過 102.04.18 101 學年度第 6 次系務會議修訂通過 102.05.16 101 學年度第 8 次院教評會審議通過\n\n第一條 依據本校教師評審委員會設置辦法第二條之規定，訂定本辦法。\n\n第二條 本系教師評審委員會（以下簡稱「系教評會」），審議有關本系教師之聘任、聘 期、升等、停聘、解聘、續聘、延退等事項。\n\n第三條 系教評會由本系教師七名組成，系主任為當然委員兼召集人。票選之委員中， 教授不得少於三人，任期一年，連選得連任。凡借調、講學、進修、休假之教 師不得擔任委員。\n\n第四條 系教評會會議不定期舉行。會議必須三分之二（含）以上委員出席，始能開會。 議案必須具投票權之出席委員三分之二（含）以上贊同，始能通過。 委員為議案當事人時，必須迴避討論與表決。 副教授不得參加升等教授案之審查；助理教授不得參加升等教授、副教授案之 審查；講師不得參加升等教授、副教授、助理教授案之審查。 委員不得請人代為出席。\n\n第五條 系教評會委員兩次不能出席時，召集人須於第二次未出席日起一週內舉行補選， 補足第三條所規定之委員人數。次數之計算不含臨時召集之會議。\n\n第六條 系教評會開會時，得邀請有關人員列席說明。\n\n第七條 系教評會審議事項依據校教評會設置辦法第十條、院教評會設置辦法第五條暨本 系教師聘任要點、本系教師升等審查辦法之規定辦理。\n\n第八條 系教評會通過之議案須送院教評會審議。\n\n第九條 本辦法經系務會議通過，送院教評會審議通過，經校長核定後實施，修正時亦同。']",staff,Poor grammar,short,"<1-hop>  [202005141625120295.md]

國立中山大學中國文學系「課程委員會設置要點」

98.12.09 98 學年度第 3 次系務會議訂定 99.01.15 98 學年度第 3 次院課程委員會議通過 99.03.24 98 學年度第 5 次系務會議修訂通過 99.05.06 98 學年度第 6 次院課程委員會議修訂通過 99.05.31 984 校課程委員會議通過 99.06.15 第 124 次教務會議通過

105.11.30 105 學年度第 3 次系務會議修訂通過

第一條 依據本校課程委員會設置要點第三條之規定，訂定本要點。

第二條 本系課程委員會（以下簡稱「系課程會」），由本系專任教 師5名、學生代表1 至2 人、校外專家學者(含業界代表)1 至2 人組成(系主任為當然委員兼召集人)。

第三條 系課程會之職責：

一、定期檢討修正系所課程、課程結構與發展方向（納入業界、 畢業校友及學生（或家長）之意見） 。

二、初審入學新生必修科目表相關之事宜。

三、初審新開課程下列項目：

．課程名稱（中、英文） 、課程內容、課程大綱。

．考量其他相關因素，如新開設課程與教師專長之配合、與 系所發展方向之配合、與現有課程之關連等。

四、課程相關問題之審議。

五、考量教師專長及平衡研究、教學之負擔，規劃及安排每學年 度課程授課教師。

六、研議系所課程相關改善機制，作成議案提系務會議討論。

七、相關決議須經系務會議通過後方可送院課程委員會審議。

第四條 本要點經系務會議通過，並送院、校課程委員會及教務會議核備 後實施，其修正時亦同。","<2-hop>  [201909051441190350.md]

國立中山大學中國文學系教師評審委員會設置辦法

85.11.13 85 學年度第 3 次系務會議修訂通過 85.11.27 85 學年度第 2 次院教評會准予核備 90.05.09 89 學年度第 6 次系務會議修訂通過 90.05.17 89 學年度第 9 次院教評會准予核備 95.05.23 94 學年度第 6 次系務會議修訂通過 95.05.30 94 學年度第 6 次院教評會准予核備 95.09.26 95 學年度第 1 次系務會議修訂通過 95.11.23 95 學年度第 2 次院教評會准予核備 101.12.25 101 學年度第 3 次系務會議修訂通過 102.02.27 101 學年度第 5 次院教評會審議通過 102.04.18 101 學年度第 6 次系務會議修訂通過 102.05.16 101 學年度第 8 次院教評會審議通過

第一條 依據本校教師評審委員會設置辦法第二條之規定，訂定本辦法。

第二條 本系教師評審委員會（以下簡稱「系教評會」），審議有關本系教師之聘任、聘 期、升等、停聘、解聘、續聘、延退等事項。

第三條 系教評會由本系教師七名組成，系主任為當然委員兼召集人。票選之委員中， 教授不得少於三人，任期一年，連選得連任。凡借調、講學、進修、休假之教 師不得擔任委員。

第四條 系教評會會議不定期舉行。會議必須三分之二（含）以上委員出席，始能開會。 議案必須具投票權之出席委員三分之二（含）以上贊同，始能通過。 委員為議案當事人時，必須迴避討論與表決。 副教授不得參加升等教授案之審查；助理教授不得參加升等教授、副教授案之 審查；講師不得參加升等教授、副教授、助理教授案之審查。 委員不得請人代為出席。

第五條 系教評會委員兩次不能出席時，召集人須於第二次未出席日起一週內舉行補選， 補足第三條所規定之委員人數。次數之計算不含臨時召集之會議。

第六條 系教評會開會時，得邀請有關人員列席說明。

第七條 系教評會審議事項依據校教評會設置辦法第十條、院教評會設置辦法第五條暨本 系教師聘任要點、本系教師升等審查辦法之規定辦理。

第八條 系教評會通過之議案須送院教評會審議。

第九條 本辦法經系務會議通過，送院教評會審議通過，經校長核定後實施，修正時亦同。",202005141625120295.md,201909051441190350.md,"['國立中山大學中國文學系教師評審委員會設置辦法', '國立中山大學中國文學系']",文學院↔文學院 | 中國文學系↔中國文學系,國立中山大學中國文學系↔國立中山大學中國文學系教師評審委員會設置辦法,5.0,2.47,4.78,4.26,5.0,2.0,5.0
請問國立中山大學學生高中校友會的成立申請流程及經費補助申請需經過哪些教務處的審議與核定程序？此外，學生申請轉系時，教務處在審核過程中扮演什麼角色？,根據國立中山大學學生高中校友會輔導及經費補助原則，學生高中校友會的成立申請需填具「高中校友會成立申請表」，經教務處審議通過，報請校長核定後成立。經費補助申請方面，高中校友會應於活動前提出經費補助申請，經教務處核定後，於活動結束兩週內檢附活動成果報告表向教務處辦理撥款及核銷，超過期限者不予補助。至於學生申請轉系，學生須填具申請單並經所屬學系導師及系主任簽署，教務處進行初審後，送擬轉入學系，經系務會議或系招生相關委員會議審核，院長簽章後，將審核結果連同會議紀錄送教務處，教務處依轉入學系審查意見及學生志願序，經教務長核定後公告。由此可見，教務處在高中校友會成立及經費補助申請中負責審議與核定，在學生轉系申請中則負責初審及依審查意見核定公告，扮演重要的審核與管理角色。,"['<1-hop>  [201908161340410182.md]\n\n國立中山大學學生高中校友會輔導及經費補助原則\n\n104 年 12 月 09 日 1 0 4 學年度第 1 學期第 8\n\n次行政會議通過\n\n一、目的：\n\n國立中山大學 ( 以下簡稱本校 ) 為凝聚本校學生高中校友力量，以增 進校友間聯誼，協助本校發展，培養服務情操，特訂定本原則。\n\n二、補助對象：\n\n國立中山大學學生高中校友會。\n\n三、申請方式：\n\n填具「高中校友會成立申請表」，經教務處審議通過，報請校長核 定後成立。\n\n四、補助原則：\n\n高中校友會活動所需經費以自籌為原則，但配合參與下列第一至四 項活動之學生得依規定申請工作費用及交通費報支；參與第四至六 項活動之校友會，得申請活動補助費壹仟元，每一校友會每學年度\n\n申請補助總額以新臺幣參仟元為原則。\n\n( 一 ) 配合本校教師至高中學校演講等活動。\n\n( 二 ) 協助接待高中學生蒞校參訪。\n\n( 三 ) 至高中學校參與該校校慶活動。\n\n( 四 ) 參與本校院系博覽會。\n\n( 五 ) 辦理寒暑期營隊。\n\n(\n\n六 ) 辦理校友週活動。\n\n五、經費核銷：\n\n高中校友會應於活動前提出經費補助申請，經教務處核定後，至遲\n\n於活動結束兩週內，檢附活動成果報告表向教務處辦理撥款及核\n\n銷，超過期限者，不予補助。\n\n六、場地申請：\n\n( 一 ) 高中校友會辦理活動，如需使用校內場地，得於活動前兩週， 向教務處申請免費借用地下一樓會議室場地；亦得比照本校學 生社團，向學務處申請借用校內其他場地、物品及器材等。\n\n( 二 ) 活動場地與器材之借用，應配合出借單位相關規定及注事項：\n\n1 、 借用者須維護場地佈置及清潔，借用完畢應回復原狀。禁止 變動原有設備，擅接或改變電源線路，亦不得超載使用電器 設備，如有毀損公物之事應負損壞賠償責任。\n\n2 、 借用場地內均禁止吸煙，並禁止辦理外燴餐會，亦不得從事 其他活動如商業、廣告行為，如有違反，概依校方規定簽請 處置。\n\n七、執行管考 ：\n\n( 一 ) 近二年度曾受經費補助之高中校友會應有參與高中校友會聯 席會議之義務，以商討有關活動事宜，並溝通各高中校友會 間之聯繫，以策進指導之績效。\n\n( 二 ) 高中校友會不得自行對外行文，如有活動需要，應經教務處 同意，再依行政發文程序辦理。\n\n八、本原則經招生策略規劃委員會審議，提行政會議通過，校長核定後實 施，修正時亦同。', '<2-hop>  [202410171437130414.md]\n\n國立中山大學學士班學生轉系辦法\n\n95.12.28 第 110 次教務會議修正通過 96.01.16. 臺高 ( 二 ) 字第 0950002903 號函同意備查 97.12.11 第 118 次教務會議修正通過 98.01.08. 臺高 ( 二 ) 字第 0980002422 號函同意備查第 5 條條文 98.02.11. 臺高 ( 二 ) 字第 0980016048 號函同意備查第 8 條條文 101.06.11 第 132 次教務會議修正通過 101.08.06. 臺高 ( 二 ) 字第 1010142396 號函備查第 2,8,13 條條文 107.05.24 第 156 次教務會議修正通過 107.08.16 臺教高 ( 二 ) 字第 1070116212 號函備查 112.10.07 第 177 次教務會議修正通過 113.10.15 第 181 次教務會議修正通過\n\n第一條 本辦法依據本校學則訂定之。\n\n第二條 各學系修讀學士學位學生，得於修業滿一學年後轉入不同學系，並 依照下列規定申請轉系：\n\n( 一 ) 於第二學年開始前申請者，得轉入各學系二年級肄業。\n\n( 二 ) 於第三學年開始前申請者，得轉入性質相近學系三年級或性質 不同學系二年級肄業。\n\n( 三 ) 因特殊原因於第四學年開始前申請者，得轉入性質相近學系或 輔系三年級肄業。\n\n( 四 ) 於延長修業年限申請者，依其已修科目與學分，得轉入性質相 近學系或輔系適當年級肄業。\n\n轉系須完成轉入學系規定之畢業條件，方可畢業。\n\n降級轉系者，其應修學分數及必修科目，應依轉入年級學生入學學 年度必修科目表之規定；其在二系重複修習之年限，不列入轉入學 系之最高修業年限併計。\n\n第三條 學生有下列情形之一者，不得申請轉系：\n\n( 一 ) 依「離島地區學生保送高級中等以上學校辦法」申請保送升 學之離島地區學生。但有特殊情況報經原保送之地方政府同 意者，不在此限。\n\n( 二 ) 受各種入學方式之規定限制不得轉系者，惟情況特殊經教務 會議通過者，不在此限。\n\n第四條 轉系申請及核定時間，依照本校行事曆規定。\n\n第五條 學生申請轉系，須填具申請單（含志願表），至多可選填二個志 願，未滿十八歲者申請單須經家長或監護人簽章同意，連同成績\n\n單先經所屬學系導師及系主任簽署、教務處初審後，送擬轉入學系， 經系務會議或系招生相關之委員會議審核，院長簽章後，將審核結 果連同會議紀錄送教務處；教務處依轉入學系審查意見及學生志願 序，經教務長核定後公告。\n\n第六條 學生須符合擬轉入學系之標準，方得轉系；轉系審查標準另訂之。\n\n第七條 學生申請轉系於申請期限截止後，不得請求撤銷或變更所填之志願。 依相關規定 不得轉系之學生，事後發現轉系者撤銷其轉系資格。\n\n第八條 刪除。\n\n第九條 外國學生、僑生、陸生及身心障礙學生申請轉系者，依本辦法辦理 之。如確因不合志趣或其他因素，無法在原系繼續肄業者，外國學 生、僑生及陸生由國際事務處輔導，身心障礙學生由學生事務處輔 導，經有關系主任之同意，得從寬核准。\n\n陸生申請轉系，以教育部核定當學年度得招收陸生之學系為限。\n\n第十條\n\n轉系名單經公告後，經核准轉系學生，非經相關院系及教務長核准 者，不得請求回原系級肄業。\n\n申請回原系級肄業，應於轉入學期行事曆規定加退選開始前辦理。\n\n第十一條 同系轉組及轉學位學程者，比照本辦法規定辦理。\n\n第十二條 本辦法如有未盡事宜，悉依本校學則及有關規章規定辦理。\n\n第十三條 本辦法經本校教務會議通過，經校長核定後公告實施，修正時亦同。']",teacher,Perfect grammar,long,"<1-hop>  [201908161340410182.md]

國立中山大學學生高中校友會輔導及經費補助原則

104 年 12 月 09 日 1 0 4 學年度第 1 學期第 8

次行政會議通過

一、目的：

國立中山大學 ( 以下簡稱本校 ) 為凝聚本校學生高中校友力量，以增 進校友間聯誼，協助本校發展，培養服務情操，特訂定本原則。

二、補助對象：

國立中山大學學生高中校友會。

三、申請方式：

填具「高中校友會成立申請表」，經教務處審議通過，報請校長核 定後成立。

四、補助原則：

高中校友會活動所需經費以自籌為原則，但配合參與下列第一至四 項活動之學生得依規定申請工作費用及交通費報支；參與第四至六 項活動之校友會，得申請活動補助費壹仟元，每一校友會每學年度

申請補助總額以新臺幣參仟元為原則。

( 一 ) 配合本校教師至高中學校演講等活動。

( 二 ) 協助接待高中學生蒞校參訪。

( 三 ) 至高中學校參與該校校慶活動。

( 四 ) 參與本校院系博覽會。

( 五 ) 辦理寒暑期營隊。

(

六 ) 辦理校友週活動。

五、經費核銷：

高中校友會應於活動前提出經費補助申請，經教務處核定後，至遲

於活動結束兩週內，檢附活動成果報告表向教務處辦理撥款及核

銷，超過期限者，不予補助。

六、場地申請：

( 一 ) 高中校友會辦理活動，如需使用校內場地，得於活動前兩週， 向教務處申請免費借用地下一樓會議室場地；亦得比照本校學 生社團，向學務處申請借用校內其他場地、物品及器材等。

( 二 ) 活動場地與器材之借用，應配合出借單位相關規定及注事項：

1 、 借用者須維護場地佈置及清潔，借用完畢應回復原狀。禁止 變動原有設備，擅接或改變電源線路，亦不得超載使用電器 設備，如有毀損公物之事應負損壞賠償責任。

2 、 借用場地內均禁止吸煙，並禁止辦理外燴餐會，亦不得從事 其他活動如商業、廣告行為，如有違反，概依校方規定簽請 處置。

七、執行管考 ：

( 一 ) 近二年度曾受經費補助之高中校友會應有參與高中校友會聯 席會議之義務，以商討有關活動事宜，並溝通各高中校友會 間之聯繫，以策進指導之績效。

( 二 ) 高中校友會不得自行對外行文，如有活動需要，應經教務處 同意，再依行政發文程序辦理。

八、本原則經招生策略規劃委員會審議，提行政會議通過，校長核定後實 施，修正時亦同。","<2-hop>  [202410171437130414.md]

國立中山大學學士班學生轉系辦法

95.12.28 第 110 次教務會議修正通過 96.01.16. 臺高 ( 二 ) 字第 0950002903 號函同意備查 97.12.11 第 118 次教務會議修正通過 98.01.08. 臺高 ( 二 ) 字第 0980002422 號函同意備查第 5 條條文 98.02.11. 臺高 ( 二 ) 字第 0980016048 號函同意備查第 8 條條文 101.06.11 第 132 次教務會議修正通過 101.08.06. 臺高 ( 二 ) 字第 1010142396 號函備查第 2,8,13 條條文 107.05.24 第 156 次教務會議修正通過 107.08.16 臺教高 ( 二 ) 字第 1070116212 號函備查 112.10.07 第 177 次教務會議修正通過 113.10.15 第 181 次教務會議修正通過

第一條 本辦法依據本校學則訂定之。

第二條 各學系修讀學士學位學生，得於修業滿一學年後轉入不同學系，並 依照下列規定申請轉系：

( 一 ) 於第二學年開始前申請者，得轉入各學系二年級肄業。

( 二 ) 於第三學年開始前申請者，得轉入性質相近學系三年級或性質 不同學系二年級肄業。

( 三 ) 因特殊原因於第四學年開始前申請者，得轉入性質相近學系或 輔系三年級肄業。

( 四 ) 於延長修業年限申請者，依其已修科目與學分，得轉入性質相 近學系或輔系適當年級肄業。

轉系須完成轉入學系規定之畢業條件，方可畢業。

降級轉系者，其應修學分數及必修科目，應依轉入年級學生入學學 年度必修科目表之規定；其在二系重複修習之年限，不列入轉入學 系之最高修業年限併計。

第三條 學生有下列情形之一者，不得申請轉系：

( 一 ) 依「離島地區學生保送高級中等以上學校辦法」申請保送升 學之離島地區學生。但有特殊情況報經原保送之地方政府同 意者，不在此限。

( 二 ) 受各種入學方式之規定限制不得轉系者，惟情況特殊經教務 會議通過者，不在此限。

第四條 轉系申請及核定時間，依照本校行事曆規定。

第五條 學生申請轉系，須填具申請單（含志願表），至多可選填二個志 願，未滿十八歲者申請單須經家長或監護人簽章同意，連同成績

單先經所屬學系導師及系主任簽署、教務處初審後，送擬轉入學系， 經系務會議或系招生相關之委員會議審核，院長簽章後，將審核結 果連同會議紀錄送教務處；教務處依轉入學系審查意見及學生志願 序，經教務長核定後公告。

第六條 學生須符合擬轉入學系之標準，方得轉系；轉系審查標準另訂之。

第七條 學生申請轉系於申請期限截止後，不得請求撤銷或變更所填之志願。 依相關規定 不得轉系之學生，事後發現轉系者撤銷其轉系資格。

第八條 刪除。

第九條 外國學生、僑生、陸生及身心障礙學生申請轉系者，依本辦法辦理 之。如確因不合志趣或其他因素，無法在原系繼續肄業者，外國學 生、僑生及陸生由國際事務處輔導，身心障礙學生由學生事務處輔 導，經有關系主任之同意，得從寬核准。

陸生申請轉系，以教育部核定當學年度得招收陸生之學系為限。

第十條

轉系名單經公告後，經核准轉系學生，非經相關院系及教務長核准 者，不得請求回原系級肄業。

申請回原系級肄業，應於轉入學期行事曆規定加退選開始前辦理。

第十一條 同系轉組及轉學位學程者，比照本辦法規定辦理。

第十二條 本辦法如有未盡事宜，悉依本校學則及有關規章規定辦理。

第十三條 本辦法經本校教務會議通過，經校長核定後公告實施，修正時亦同。",201908161340410182.md,202410171437130414.md,"['教務處審議', '教務處審核']",教務處↔教務處,教務處審議↔教務處審核,5.0,5.0,5.0,5.0,5.0,2.0,5.0
根據國立中山大學中國文學系教師升等審查辦法與教師評審委員會設置辦法，教師申請升等時需要提交哪些資料？系教師評審委員會在審查過程中有哪些規定？,根據國立中山大學中國文學系教師升等審查辦法，教師申請升等時需於每學期正式上課日一週前向系主任申請，並提交以下資料：1. 「國立中山大學教師升等送審資料項目表」所列初審應繳資料及表件；2. 文學院教師升等初審作業規定之表件；3. 「國立中山大學中國文學系教師升等計分表」（學術研究類或教學研究類）及相關資料；4. 送審著作一式四份。系主任接獲申請後，將資料公開陳列一週供全系教師閱覽，並召開系教師評審委員會進行資格審查，通過者資料彙送文學院教師評審委員會辦理著作審查。著作審查由院長聘請校外適格學者三人審查，外審學者應迴避申請人原畢業學校之教授。根據教師評審委員會設置辦法，系教評會由七名教師組成，系主任為召集人，委員中教授不得少於三人，任期一年。會議必須三分之二以上委員出席，議案須三分之二以上贊同方能通過。委員為議案當事人時須迴避討論與表決，且不同職級教師不得參加特定升等案之審查。系教評會通過之議案須送院教評會審議。,"['<1-hop>  [202005141641090311.md]\n\n國立中山大學中國文學系教師升等審查辦法\n\n83.01.14 82 學年度中文系所教師評審委員會議通過 85.12.11 85 學年度第 4 次系務會議修正通過 89.10.04 89 學年度第 1 次系務會議修正通過 89.12.13 89 學年度第 2 次系務會議修正通過 89.12.21 89 學年度第 6 次院教評會通過 90.09.26 90 學年度第 1 次系務會議修正通過 91.03.26 90 學年度第 6 次院教評會通過 93.04.21 92 學年度第 4 次系務會議修正通過 93.06.01 92 學年度第 5 次系務會議修正通過 93.06.08 92 學年度第 11 次院教評會通過 97.06.19 96 學年度第 6 次系務會議修正通過 97.10.02 97 學年度第 1 次院教評會通過 102.09.25 102 學年度第 1 次系務會議修正通過 102.10.18 102 學年度第 2 次院教評會修正通過 103.02.27 102 學年度第 6 次院教評會修正通過 103.05.21 102 學年度第 8 次院教評會修正通過 106.03.01 105 學年度第 5 次系教評會修正通過 學年度第 6 次系務會議修正通過 106.04.20 105 學年度第 6 次院教評會修正通過 107.05.15 105 學年度第 7 次系教評會修正通過 107.05.16 106 學年度第 8 次系務會議修正通過 107.06.14 106 學年度第 8 次院教評會修正通過 107.07.06 陳核通過\n\n一、本系為辦理教師升等，依據本校「教師評審委員會設置辦法」第二條之規定及本校、本 院教師升等審查相關法規，訂定本辦法。\n\n二、凡符合本校與文學院教師升等審查辦法規定之教師，得於每學期正式上課日一週前向 系主任申請升等，並提交下列資料：\n\n（一） 「國立中山大學教師升等送審資料項目表」所列初審應繳資料及表件。\n\n（二）文學院教師升等初審作業規定之表件。\n\n（三） 「國立中山大學中國文學系教師升等計分表」 （學術研究類或教學研究類）及相 關資料。\n\n（四）送審著作一式四份。\n\n三、系主任接獲教師升等之申請後，將上述資料公開陳列（一週） ，供全系教師閱覽，隨後召 開系教師評審委員會進行資格審查。並於當學期正式上課後十日內，將通過資格審查者 資料彙送文學院教師評審委員會辦理著作審查。\n\n四、擬升等教師所提送審著作應符合文學院教師升等審查辦法第二條之規定。著作審查由院 長聘請校外適格之學者專家三人審查。審查人選由系教評會擬提具有充分專業能力之校 外學者專家七人以上（院長得增列審查人選） ，簽請院長召集院教評會委員若幹人圈定三 人後，由文學院辦理著作外審，外審成績結果送回本系初審。外審學者應迴避申請人原 畢業學校之教授。\n\n五、依據本校「教師及研究人員升等審查辦法」第四條規定，本系教師評審委員會應就升 等教師之學術研究或教學研究、教學、服務等三項評定成績，成績總分達七十分（含） 以上者通過初審。本系教師升等初審其計分比例與項目如下：\n\n（一）學術研究類：學術研究佔百分之七十、教學績效佔百分之二十、服務成績佔百分 之十。\n\n學術研究與教學績效計分方式依「國立中山大學文學院教師升等計分表－學術研 究類」所列項目計分。服務成績計分方式依「國立中山大學中國文學系教師升等 服務成績評分原則」所列項目計分。\n\n（二）教學研究類：教學研究佔百分之六十、教學績效佔百分之三十、服務成績佔百分 之十。\n\n教學研究與教學績效計分方式依「國立中山大學文學院教師升等計分表－教學研 究類」所列項目計分。服務成績計分方式依「國立中山大學中國文學系教師升等 服務成績評分原則」所列項目計分。\n\n六、初審結果若不通過，系教師評審委員會召集人應以書面敘明理由通知申請人。申請人對 於初審結果若有異議，得依本校相關辦法及程序提出申復（或申訴） 。\n\n七、本辦法經系務會議通過，送院教評會審議通過，送請校長核定後實施，修正時亦同。', '<2-hop>  [201909051441190350.md]\n\n國立中山大學中國文學系教師評審委員會設置辦法\n\n85.11.13 85 學年度第 3 次系務會議修訂通過 85.11.27 85 學年度第 2 次院教評會准予核備 90.05.09 89 學年度第 6 次系務會議修訂通過 90.05.17 89 學年度第 9 次院教評會准予核備 95.05.23 94 學年度第 6 次系務會議修訂通過 95.05.30 94 學年度第 6 次院教評會准予核備 95.09.26 95 學年度第 1 次系務會議修訂通過 95.11.23 95 學年度第 2 次院教評會准予核備 101.12.25 101 學年度第 3 次系務會議修訂通過 102.02.27 101 學年度第 5 次院教評會審議通過 102.04.18 101 學年度第 6 次系務會議修訂通過 102.05.16 101 學年度第 8 次院教評會審議通過\n\n第一條 依據本校教師評審委員會設置辦法第二條之規定，訂定本辦法。\n\n第二條 本系教師評審委員會（以下簡稱「系教評會」），審議有關本系教師之聘任、聘 期、升等、停聘、解聘、續聘、延退等事項。\n\n第三條 系教評會由本系教師七名組成，系主任為當然委員兼召集人。票選之委員中， 教授不得少於三人，任期一年，連選得連任。凡借調、講學、進修、休假之教 師不得擔任委員。\n\n第四條 系教評會會議不定期舉行。會議必須三分之二（含）以上委員出席，始能開會。 議案必須具投票權之出席委員三分之二（含）以上贊同，始能通過。 委員為議案當事人時，必須迴避討論與表決。 副教授不得參加升等教授案之審查；助理教授不得參加升等教授、副教授案之 審查；講師不得參加升等教授、副教授、助理教授案之審查。 委員不得請人代為出席。\n\n第五條 系教評會委員兩次不能出席時，召集人須於第二次未出席日起一週內舉行補選， 補足第三條所規定之委員人數。次數之計算不含臨時召集之會議。\n\n第六條 系教評會開會時，得邀請有關人員列席說明。\n\n第七條 系教評會審議事項依據校教評會設置辦法第十條、院教評會設置辦法第五條暨本 系教師聘任要點、本系教師升等審查辦法之規定辦理。\n\n第八條 系教評會通過之議案須送院教評會審議。\n\n第九條 本辦法經系務會議通過，送院教評會審議通過，經校長核定後實施，修正時亦同。']",curious student,Web search like queries,medium,"<1-hop>  [202005141641090311.md]

國立中山大學中國文學系教師升等審查辦法

83.01.14 82 學年度中文系所教師評審委員會議通過 85.12.11 85 學年度第 4 次系務會議修正通過 89.10.04 89 學年度第 1 次系務會議修正通過 89.12.13 89 學年度第 2 次系務會議修正通過 89.12.21 89 學年度第 6 次院教評會通過 90.09.26 90 學年度第 1 次系務會議修正通過 91.03.26 90 學年度第 6 次院教評會通過 93.04.21 92 學年度第 4 次系務會議修正通過 93.06.01 92 學年度第 5 次系務會議修正通過 93.06.08 92 學年度第 11 次院教評會通過 97.06.19 96 學年度第 6 次系務會議修正通過 97.10.02 97 學年度第 1 次院教評會通過 102.09.25 102 學年度第 1 次系務會議修正通過 102.10.18 102 學年度第 2 次院教評會修正通過 103.02.27 102 學年度第 6 次院教評會修正通過 103.05.21 102 學年度第 8 次院教評會修正通過 106.03.01 105 學年度第 5 次系教評會修正通過 學年度第 6 次系務會議修正通過 106.04.20 105 學年度第 6 次院教評會修正通過 107.05.15 105 學年度第 7 次系教評會修正通過 107.05.16 106 學年度第 8 次系務會議修正通過 107.06.14 106 學年度第 8 次院教評會修正通過 107.07.06 陳核通過

一、本系為辦理教師升等，依據本校「教師評審委員會設置辦法」第二條之規定及本校、本 院教師升等審查相關法規，訂定本辦法。

二、凡符合本校與文學院教師升等審查辦法規定之教師，得於每學期正式上課日一週前向 系主任申請升等，並提交下列資料：

（一） 「國立中山大學教師升等送審資料項目表」所列初審應繳資料及表件。

（二）文學院教師升等初審作業規定之表件。

（三） 「國立中山大學中國文學系教師升等計分表」 （學術研究類或教學研究類）及相 關資料。

（四）送審著作一式四份。

三、系主任接獲教師升等之申請後，將上述資料公開陳列（一週） ，供全系教師閱覽，隨後召 開系教師評審委員會進行資格審查。並於當學期正式上課後十日內，將通過資格審查者 資料彙送文學院教師評審委員會辦理著作審查。

四、擬升等教師所提送審著作應符合文學院教師升等審查辦法第二條之規定。著作審查由院 長聘請校外適格之學者專家三人審查。審查人選由系教評會擬提具有充分專業能力之校 外學者專家七人以上（院長得增列審查人選） ，簽請院長召集院教評會委員若幹人圈定三 人後，由文學院辦理著作外審，外審成績結果送回本系初審。外審學者應迴避申請人原 畢業學校之教授。

五、依據本校「教師及研究人員升等審查辦法」第四條規定，本系教師評審委員會應就升 等教師之學術研究或教學研究、教學、服務等三項評定成績，成績總分達七十分（含） 以上者通過初審。本系教師升等初審其計分比例與項目如下：

（一）學術研究類：學術研究佔百分之七十、教學績效佔百分之二十、服務成績佔百分 之十。

學術研究與教學績效計分方式依「國立中山大學文學院教師升等計分表－學術研 究類」所列項目計分。服務成績計分方式依「國立中山大學中國文學系教師升等 服務成績評分原則」所列項目計分。

（二）教學研究類：教學研究佔百分之六十、教學績效佔百分之三十、服務成績佔百分 之十。

教學研究與教學績效計分方式依「國立中山大學文學院教師升等計分表－教學研 究類」所列項目計分。服務成績計分方式依「國立中山大學中國文學系教師升等 服務成績評分原則」所列項目計分。

六、初審結果若不通過，系教師評審委員會召集人應以書面敘明理由通知申請人。申請人對 於初審結果若有異議，得依本校相關辦法及程序提出申復（或申訴） 。

七、本辦法經系務會議通過，送院教評會審議通過，送請校長核定後實施，修正時亦同。","<2-hop>  [201909051441190350.md]

國立中山大學中國文學系教師評審委員會設置辦法

85.11.13 85 學年度第 3 次系務會議修訂通過 85.11.27 85 學年度第 2 次院教評會准予核備 90.05.09 89 學年度第 6 次系務會議修訂通過 90.05.17 89 學年度第 9 次院教評會准予核備 95.05.23 94 學年度第 6 次系務會議修訂通過 95.05.30 94 學年度第 6 次院教評會准予核備 95.09.26 95 學年度第 1 次系務會議修訂通過 95.11.23 95 學年度第 2 次院教評會准予核備 101.12.25 101 學年度第 3 次系務會議修訂通過 102.02.27 101 學年度第 5 次院教評會審議通過 102.04.18 101 學年度第 6 次系務會議修訂通過 102.05.16 101 學年度第 8 次院教評會審議通過

第一條 依據本校教師評審委員會設置辦法第二條之規定，訂定本辦法。

第二條 本系教師評審委員會（以下簡稱「系教評會」），審議有關本系教師之聘任、聘 期、升等、停聘、解聘、續聘、延退等事項。

第三條 系教評會由本系教師七名組成，系主任為當然委員兼召集人。票選之委員中， 教授不得少於三人，任期一年，連選得連任。凡借調、講學、進修、休假之教 師不得擔任委員。

第四條 系教評會會議不定期舉行。會議必須三分之二（含）以上委員出席，始能開會。 議案必須具投票權之出席委員三分之二（含）以上贊同，始能通過。 委員為議案當事人時，必須迴避討論與表決。 副教授不得參加升等教授案之審查；助理教授不得參加升等教授、副教授案之 審查；講師不得參加升等教授、副教授、助理教授案之審查。 委員不得請人代為出席。

第五條 系教評會委員兩次不能出席時，召集人須於第二次未出席日起一週內舉行補選， 補足第三條所規定之委員人數。次數之計算不含臨時召集之會議。

第六條 系教評會開會時，得邀請有關人員列席說明。

第七條 系教評會審議事項依據校教評會設置辦法第十條、院教評會設置辦法第五條暨本 系教師聘任要點、本系教師升等審查辦法之規定辦理。

第八條 系教評會通過之議案須送院教評會審議。

第九條 本辦法經系務會議通過，送院教評會審議通過，經校長核定後實施，修正時亦同。",202005141641090311.md,201909051441190350.md,"['教師升等', '國立中山大學中國文學系教師評審委員會設置辦法', '教師升等申請', '國立中山大學中國文學系教師升等審查辦法', '教師升等計分表']",文學院↔文學院 | 中國文學系↔中國文學系,國立中山大學中國文學系教師升等審查辦法↔國立中山大學中國文學系教師評審委員會設置辦法 | 教師升等申請↔教師升等 | 教師升等計分表↔教師升等,5.0,4.64,5.0,5.0,5.0,2.0,5.0
國立中山大學管理學院企業管理學系的教師評鑑實施要點中，教師評鑑的評分標準是如何分配的？此外，該系的吳峻誠紀念獎學金申請資格有哪些具體要求？,根據國立中山大學管理學院企業管理學系教師評鑑實施要點，教師評鑑的評分標準分為三項：教學佔40%、研究佔30%、輔導與服務佔30%，總計為100%。此外，國立中山大學企業管理學系的吳峻誠紀念獎學金申請資格包括：申請人必須是本系大學部或研究所碩士班二年級以上的在學學生；前二學期學業成績大學生各達平均A以上，碩士生各達A以上，且無任何學科不及格；前二學期未曾受本校任何懲罰處分。,"['<1-hop>  [202107091423250835.md]\n\n國立中山大學管理學院企業管理學系教師評鑑實施要點\n\n95 年 06 月 1 日 94 學年度第二學期第四次臨時系務會議通過 95 年 06 月 15 日本校第 303 次校教評會修正通過 95 年 06 月 20 日本校 94 學年度第 4 次校務會議修正通過 96 年 03 月 08 日 95 學年度第 5 次系務會修正通過 100 年 02 月 24 日 99 學年度第 6 次系務會修正通過 101 年 05 月 18 日 100 學年度第 8 次系務會修正通過 101 年 05 月 29 日 100 學年第 8 次院教評 101 年 06 月 14 日 100 學年度第 344 次校教評通過 103 年 4 月 17 日 102 學年第 6 次系務會議修正通過 103 年 5 月 26 日 102 學年度第 7 次院教評會修正通過 103 年 10 月 16 日 第 363 次校教評會修正通過 103 年 12 月 26 日本校 103 學年度第 2 次校務會議通 過\n\n一、國立中山大學管理學院企業管理學系（以下簡稱本系）為提昇教師教學、 研究、輔導及服務品質，特依本校教師評鑑辦法規定訂定本系教師評鑑 實施要點（以下簡稱本要點） 。\n\n二、本系教師評鑑，包括評鑑項目、方法、標準及程序等，除本要點規定外， 悉依本校教師評鑑辦法暨其作業細則及管理學院相關規定所定辦理。 評分標準如本院教師評鑑表及教師評鑑指標表（如附件）所示，助理教授 以上教師教學 (40%) 、研究 (30%) 、輔導與服務 (30%) 等三項，總計為 100 ％。\n\n三、本要點經本系系務會議通過後，送請院教師評審委員會、校教師評審委員 會通過後實施，修正時亦同。', '<2-hop>  [202107121140360859.md]\n\n國立中山大學企業管理學系吳峻誠紀念獎學金辦法\n\n101 學年度第六次系務會議通過 102.4.18 107 學年度第四次系務會議通過 107.12.13\n\n第一條 吳敬泉先生為紀念其子即國立中山大學企業管理學系 ( 以下簡稱本系 ) 系友吳峻 誠，特捐贈新臺幣壹佰萬元整作為獎學金 ( 以下稱本獎學金 ) ，以鼓勵本系學生 努力向學，爰訂定本辦法。\n\n第二條 本獎學金名額以每學期 5 名為原則，每名新臺幣壹萬元整。\n\n第三條 申請人應符合以下資格：\n\n一、申請時為本系大學部或研究所碩士班二年級以上之在學學生；\n\n二、前二學期學業成績大學生各達平均 A以上，碩士生各達 A 以上，且無任 何學科不及格；\n\n三、前二學期未曾受本校任何懲罰處分。\n\n第四條 本獎學金之申請日期為每學期中考前。\n\n第五條 申請人應於前條期日內檢具以下證件送交系辦公室：\n\n一、申請書 ( 如附件 ) ；\n\n二、前二學期之成績單。\n\n第六條 第四條申請期限截止後由本系系主任為召集人，邀請本系財務委員會委員組成\n\n本獎學金審查委員會，負責審查、核定得獎名單等事宜。\n\n第七條 本獎學金審查委員會除應詳實審查申請者是否符合第三條所定資格外，若申請 人數超過 5 名以上時並應考量申請人是否另申請或已獲頒其他獎學金。\n\n核定獲獎者後應於本系系務會議中公開頒獎，以示鼓勵。\n\n第八條 本辦法經本系系務會議通過後實施，修正時亦同。\n\n附件：國立中山大學企業管理學系吳峻誠紀念獎學金 申 請 書\n\n姓 名\n\n班級\n\n學 號\n\n身份證\n\n字 號\n\n電 話\n\nEmail\n\n郵 局 局 號 / 帳 號\n\n前二學期成績平均各為\n\n＿＿＿＿＿＿及＿＿＿＿＿＿\n\n應檢附成績證明 )\n\n是否請領其他獎學金\n\n[ ] □ 無\n\n[ ] □ 有 ( 請就申請結果、金額等詳加說明 )\n\n＿＿＿＿＿＿＿＿＿＿＿＿＿＿＿＿＿＿＿＿＿＿＿＿\n\n＿＿＿＿＿＿＿＿＿＿＿＿＿＿＿＿＿＿＿＿＿＿＿＿\n\n申請動機（敘述）或證明\n\n申請人：\n\n簽章 )\n\n中華民國\n\n……………………………………………………………………………………….………\n\n審查結果：\n\n中華民國']",teacher,Web search like queries,medium,"<1-hop>  [202107091423250835.md]

國立中山大學管理學院企業管理學系教師評鑑實施要點

95 年 06 月 1 日 94 學年度第二學期第四次臨時系務會議通過 95 年 06 月 15 日本校第 303 次校教評會修正通過 95 年 06 月 20 日本校 94 學年度第 4 次校務會議修正通過 96 年 03 月 08 日 95 學年度第 5 次系務會修正通過 100 年 02 月 24 日 99 學年度第 6 次系務會修正通過 101 年 05 月 18 日 100 學年度第 8 次系務會修正通過 101 年 05 月 29 日 100 學年第 8 次院教評 101 年 06 月 14 日 100 學年度第 344 次校教評通過 103 年 4 月 17 日 102 學年第 6 次系務會議修正通過 103 年 5 月 26 日 102 學年度第 7 次院教評會修正通過 103 年 10 月 16 日 第 363 次校教評會修正通過 103 年 12 月 26 日本校 103 學年度第 2 次校務會議通 過

一、國立中山大學管理學院企業管理學系（以下簡稱本系）為提昇教師教學、 研究、輔導及服務品質，特依本校教師評鑑辦法規定訂定本系教師評鑑 實施要點（以下簡稱本要點） 。

二、本系教師評鑑，包括評鑑項目、方法、標準及程序等，除本要點規定外， 悉依本校教師評鑑辦法暨其作業細則及管理學院相關規定所定辦理。 評分標準如本院教師評鑑表及教師評鑑指標表（如附件）所示，助理教授 以上教師教學 (40%) 、研究 (30%) 、輔導與服務 (30%) 等三項，總計為 100 ％。

三、本要點經本系系務會議通過後，送請院教師評審委員會、校教師評審委員 會通過後實施，修正時亦同。","<2-hop>  [202107121140360859.md]

國立中山大學企業管理學系吳峻誠紀念獎學金辦法

101 學年度第六次系務會議通過 102.4.18 107 學年度第四次系務會議通過 107.12.13

第一條 吳敬泉先生為紀念其子即國立中山大學企業管理學系 ( 以下簡稱本系 ) 系友吳峻 誠，特捐贈新臺幣壹佰萬元整作為獎學金 ( 以下稱本獎學金 ) ，以鼓勵本系學生 努力向學，爰訂定本辦法。

第二條 本獎學金名額以每學期 5 名為原則，每名新臺幣壹萬元整。

第三條 申請人應符合以下資格：

一、申請時為本系大學部或研究所碩士班二年級以上之在學學生；

二、前二學期學業成績大學生各達平均 A以上，碩士生各達 A 以上，且無任 何學科不及格；

三、前二學期未曾受本校任何懲罰處分。

第四條 本獎學金之申請日期為每學期中考前。

第五條 申請人應於前條期日內檢具以下證件送交系辦公室：

一、申請書 ( 如附件 ) ；

二、前二學期之成績單。

第六條 第四條申請期限截止後由本系系主任為召集人，邀請本系財務委員會委員組成

本獎學金審查委員會，負責審查、核定得獎名單等事宜。

第七條 本獎學金審查委員會除應詳實審查申請者是否符合第三條所定資格外，若申請 人數超過 5 名以上時並應考量申請人是否另申請或已獲頒其他獎學金。

核定獲獎者後應於本系系務會議中公開頒獎，以示鼓勵。

第八條 本辦法經本系系務會議通過後實施，修正時亦同。

附件：國立中山大學企業管理學系吳峻誠紀念獎學金 申 請 書

姓 名

班級

學 號

身份證

字 號

電 話

Email

郵 局 局 號 / 帳 號

前二學期成績平均各為

＿＿＿＿＿＿及＿＿＿＿＿＿

應檢附成績證明 )

是否請領其他獎學金

[ ] □ 無

[ ] □ 有 ( 請就申請結果、金額等詳加說明 )

＿＿＿＿＿＿＿＿＿＿＿＿＿＿＿＿＿＿＿＿＿＿＿＿

＿＿＿＿＿＿＿＿＿＿＿＿＿＿＿＿＿＿＿＿＿＿＿＿

申請動機（敘述）或證明

申請人：

簽章 )

中華民國

……………………………………………………………………………………….………

審查結果：

中華民國",202107091423250835.md,202107121140360859.md,"['國立中山大學管理學院企業管理學系', '國立中山大學企業管理學系']",管理學院↔管理學院 | 企業管理學系↔企業管理學系,國立中山大學管理學院企業管理學系↔國立中山大學企業管理學系,5.0,4.58,5.0,5.0,5.0,2.0,5.0
文學院教師升等審查要點中，教師申請升等時學術產學研究績效的外審成績要求是什麼？這些外審成績如何影響升等審查的通過？,根據文學院教師升等審查要點，申請升等教授或副教授者的學術研究成果外審成績，必須至少有四位外審委員評等為「優良」以上，且外審成績總平均需達80分以上（教授）或77分以上（副教授），才能達到外審合格門檻。未達此門檻者，視為升等不通過。外審成績是升等審查中學術產學研究績效的重要評分依據，直接影響教師升等審查的通過與否。,"[""<1-hop>  [202509142203130723.md]\n\n國立中山大學文學院教師升等審查要點\n\nGuidelines on the Evaluation of Professorship Rank Promotion in the College of Liberal Arts\n\n88.6.22 八十七學年度第八次院務會議訂定\n\n88.12.28 本校第 224 次教師評審委員會通過\n\n89.4.27 八十八學年度第五次院務會議修正通過\n\n89.6.13 八十八學年度第十次院教評會修正通過 89.11.23 八十九學年度第一次院務會議通過 89.11.27 第 240 次教師評審委員會通過 93.5.25 九十二學年度第十次院教評會通過 93.6.17 九十二學年度第四次院務會議通過 93.9.30 第 291 次校教評會修正通過 94.10.05 九十四學年度第一次院務會議修正通過 94.10.20 第 297 次校教評會通過 95.04.25 九十四學年度第七次院教評會通過 95.05.02 九十四學年度第五次院務會議通過 95.06.15 第 303 次校教評會通過 97.05.22 九十六學年度第七次院教評會修正通過 97.05.29 九十六學年度第六次院務會議修正通過 97.06.18 第 315 次校教評會通過 98.06.04 九十七學年度第八次院教評會修正通過 98.06.16 第 322 次校教評會通過 105.12.22 一 o 五學年度第一次院務會議修正通過 106.1.5 第 378 次校教評會予以核備 107.3.8 、 4.19 一 o 六學年度第五、六次院教評會修正通過 107.4.11 一 o 六學年度第五次院務會議修正通過 107.5.3 一 o 六學年度第 387 次校教評會通過 111 學年度第 3 次院教評會修正通過（ 111.12.8 ） 111 學年度第 2 次院務會議修正通過（ 111.12.01 ） 本校第 420 次校教評會通過（ 111.12.29 ） 111 學年度第 6 次院教評會修正通過（ 112.4.13 ） 111 學年度第 4 次院務會議修正通過（ 112.4.20 ） 本校第 422 次校教評會通過（ 112.4.27 ）\n\nApproved at the 422nd University Faculty Evaluation Committee meeting on April 27, 2023\n\n一、 本學院為辦理教師升等，依據本校教師升等審查辦法，訂定本要點。\n\nI. These guidelines are formulated in accordance with the University's Regulations for the Evaluation of Professorship Rank Promotion to handle the evaluation of professorship rank promotion of the faculty in the College of Liberal Arts (hereinafter referred to as the 'College').\n\n二、 本學院各級教師申請升等資格及年資採計，應符合本校教師升等審查 辦法之規定。\n\nII. For the College faculty of all ranks applying for promotion, the eligibility and calculation of work seniority shall comply with the University's Regulations for the Evaluation of Professorship Rank Promotion .\n\n（一） 升等管道：分為一般研究類、技術應用類、教學研究類及展演藝 術類。申請升等教師應擇一提出申請，其中展演藝術類限適用於\n\n音樂學系及劇場藝術學系所屬教師。\n\n(1) The pathway of the faculty's rank promotion is categorized into the tracks of general research, technology application, pedagogical research, and performing arts. The faculty shall select one of the tracks to submit their application. Nevertheless, the track of performing arts shall be exclusively applicable to the faculty affiliated with the Department of Music and the Department of Theater Arts.\n\n（二） 升等審查包括學術產學研究績效 (A) 、教學績效 (B) 及服務績效 (C) 三項，學術產學研究績效分為學術研究成果外審成績 (A1) 及七年 內本職級研究計畫獎助及學術成就 (A2) 。\n\n(2) The evaluation includes three categories: academic & industryacademia research performance (A), teaching performance (B), and service performance (C). Academic & industry-academia research performance (A) includes external evaluation of academic research (A1) and research projects and other academic achievements within the past 7 years at the current rank (A2).\n\n（三） 各升等管道各項評分比重如下表 :\n\n(3) The scoring percentage of the three categories for each track is as follows:\n\n（四） 教師所提外審之學術研究成果件數至多 10 件。教師應自行擇一為 代表作，其屬系列之相關研究者，得合併為代表學術研究成果， 其餘列為參考學術研究成果。以展演藝術類提出升等者所提外審 依專科以上學校教師資格審定辦法之「附表三、以作品及成就證\n\n升等類別 tracks of promotion 學術產學研究績效 (A) academic &industry-academia research performance (A) ( 學術研究成果外審成績 A1 、七年內本職 級研究計畫獎助及學術成就 A2) (external evaluation of academic research A1, research projects and other academic achievements within the past 7 years at the current rank A2) 教學績效 (B) teaching performance (B) 服務績效 (C) service performance (C) 一般研究類 general research 70%(A1:75% 、 A2:25%) 20% 10% 技術應用類 technology application 70%(A1:40% 、 A2:60%) 20% 10% 教學研究類 pedagogical research 60%(A1:60% 、 A2:40%) 30% 10% 展演藝術 performing arts 70%(A1:75% 、 A2:25%) 20% 10%\n\n明送審教師資格審查範圍及基準」辦理。\n\n(4) The faculty applying for rank promotion shall submit up to ten academic research works for the external evaluation, and shall select one as a representative work and use the rest as reference. Related works constituting a series may be compiled into one representative work. Those applying through the track of performing arts shall have their external evaluation handled in accordance with the Scope and Criteria for Examination of Creative Works and Evidence of Achievement Submitted for Teacher Accreditation Reviews (Attachment 3) of Regulations Governing Accreditation of Teacher Qualifications at Junior Colleges and Institutions of Higher Education.\n\n（五） 學術產學研究績效、教學績效及服務績效依本學院教師升等審查 評分細則辦理 ( 另訂之 ) 。\n\n(5) Academic & industry-academia research performance, teaching performance, and service performance shall be scored in accordance with Guidelines on the Detailed Implementation of Evaluation of Professorship Rank Promotion in the College of Liberal Arts .\n\n（六） 本學院系 ( 所 ) 級及院級教師評審委員會 ( 以下簡稱教評會 ) 審議本 學院教師升等案，升等為教授或副教授者之學術研究成果外審成 績，除依本校規定至少有四位外審委員評等為「優良」以上外， 且外審成績總平均升等教授者需達 80 分以上或升等副教授者需 達 77 分以上，始達外審合格門檻。未達外審合格門檻者，視為 升等不通過。\n\n(6) Department/institute faculty evaluation committees (hereinafter referred to as the 'DFEC') and the College Faculty Evaluation Committee (CFEC) shall review rank promotion cases. Applicants applying for professorship or associate professorship shall receive the 'Good' grade from at least four reviewers. Moreover, the passing threshold of external evaluation shall be 80 and 77 for professorship and associate professorship, respectively. Those not passing the external evaluation shall be deemed unsuccessful in their application for promotion.\n\n（七） 前經教師資格審定不合格者，重新提出之學術研究成果曾作為代 表作送審時，其送審著作應增加或更換一件以上。\n\n(7) When submitting the same representative work as the one used in a prior failed application, applicants shall add at least one new reference work as a replacement or supplement.\n\n三、 各系（所）應於每學期正式上課一星期內，將通過系 ( 所 ) 級升等資格審 查之系 ( 所 ) 級教評會會議紀錄、審查資料、迴避名單與迴避理由，亦得\n\n提供不利審查之學者專家名單，送院教評會，逾期不受理。\n\nIII. Individual departments/institutes shall submit cases that pass the qualification review along with the DFEC meeting minutes, relevant documentation, the recusal list of interested person with reasons, and the list of scholars who might deemed unfavorable in the evaluation if needed to the CFEC within the first week after the class starts in each semester. Late submissions shall not be accepted.\n\n四、 各系（所）教評會下學期辦理 8 月 1 日及上學期辦理 2 月 1 日升等生效之升 等審查，除依據各系（所）教師升等審查要點外，應依本要點及本校教 師升等審查辦法由校進行外審。外審結果送回系（所）級教評會審查， 由系 ( 所 ) 級教評會召集人加註評語，連同審查成績、會議紀錄及各項表 件等申請資料，於本學院通知限期截止日前提送本學院第三次教評會辦 理院級審查。\n\nIV. In order for faculty promotions to take effect on August 1 (Fall semester) or February 1 (Spring semester), the DFEC shall review rank promotion cases in accordance with its own Guidelines on the Evaluation of Professorship Rank Promotion , and the University shall submit the applicants' case to the external reviewers for evaluation according to the University's Regulations for the Evaluation of Rank Professorship Rank . The external evaluation result shall be returned back to the DFEC for the department level review; the DFEC shall then submit the cases passing its review, along with the chairperson's comments, the score of the review, the meeting minutes, and relevant documentation to the CFEC third meeting each semester before the deadline specified by the College.\n\n五、 本學院教評會受理教師升等審查案時，其程序悉依本校教師升等審查辦 法及第四點規定辦理之。\n\nV. The College shall review rank promotion cases in accordance with Article 4 of the University's Regulations for the Evaluation of Professorship Rank Promotion .\n\n六、 本學院教評會開會審議升等案件時，得邀請有關人員列席說明。\n\nVI. When the CFEC convenes to review rank promotion cases, relevant personnel may be invited to attend and provide explanations.\n\n七、 本學院教評會審議升等案時，委員應親自出席，不得由他人代理。須有 委員三分之二以上出席，始得開會。\n\nVII. At least two-thirds of the CFEC members shall attend to review rank promotion cases, with members attending in person and no proxies allowed.\n\n八、 經本學院教評會升等審查通過之教師，由院級教評會召集人加註評語， 連同審查成績、會議紀錄及各項表件等申請資料及其升等著作，送本校 教評會進行校級審查。\n\nVIII. Cases that pass the college level review shall be submitted along with the score of the review, the CFEC meeting minutes, relevant documentation, the applicant's publications, and the chairperson's comments to the University Faculty Evaluation Committee (UFEC) for the university review.\n\n九、 本學院教師升等案，經系 ( 所 ) 級或院級教師評審委員會審查時，發現外 審意見有疑義者，得依本校教師升等審查辦法提出行政救濟。\n\nIX. Administrative remedies may be sought in accordance with the University's Regulations for the Evaluation of Professorship Rank Promotion when there are doubts regarding the result of external evaluation during the review by the DFEC or CFEC.\n\n十、 經系 ( 所 ) 級或院級教評會審議不通過，申請升等教師如不服審議結果， 得依相關規定提出申訴或申復。申請升等教師於申復期間向本校申評會 提出申訴者，申復應立即停止。\n\nX. Applicants not passing the review by the DFEC or CFEC and disagreeing with the evaluation result may file an appeal or grievance in accordance with relevant regulations. When the applicants directly appeal to the Faculty Appeal Handling Committee after filing a grievance against the DFEC or CFEC's decision, the process of the grievance shall be immediately terminated.\n\n十一、 本要點若有未盡事宜，悉依本校教師升等審查辦法及專科以上教師資格 審定辦法等相關法規處理之。\n\nXI. Matters not covered herein shall be handled in accordance with the University's Regulations for the Evaluation of Professorship Rank Promotion , Regulations Governing Accreditation of Teacher Qualifications at Junior Colleges and Institutions of Higher Education , and relevant regulations of the University.\n\n十二、 本要點經本學院教評會、院務會議及校教評會通過，陳請校長同意後實 施；修正時亦同。\n\nXII. These guidelines are approved by the CFEC, the College Council, the UFEC, and the President before implementation. Amendments to these guidelines shall follow the same procedure."", ""<2-hop>  [202509142236500733.md]\n\n國立中山大學文學院教師升等初審作業著作送審資料目錄表\n\nCatalog of the Applicant' s Works for Initial Review of Professorship Rank Promotion in the College of Liberal Arts\n\n單位 affiliated department/ institute 教師姓名 applicant's name 填表日期 date 年 月 日 YYYY/MM/DD 現任職級 current rank 擬升等職級 intended promotion rank 申請升等期別 academic year and semester when applying 學年度第 學期 Fall/Spring semester in 20___ (year)\n\n代表著作及參考著作目錄（注意事項如下說明）\n\nCatalog of representative work and reference works (Please refer to the following notes.):\n\n[ 說明 Notes ：\n\n需符合本校「教師升等審查辦法」及「文學院教師升等審查要點」第二條規定：「教師所提 外審之學術研究成果件數至多 10 件。代表著作或論文，應於提出申請時已經出版公開發行或 在國內外知名學術刊物發表且為升等前一職級出版或發表者為限。\n\nApplicants shall comply with the University's Regulations for the Evaluation of Professorship Rank Promotion and meet the requirement stipulated in Article 2 of Guidelines on the Evaluation of Professorship Rank Promotion in the College of Liberal Arts : The faculty applying for rank promotion shall submit up to ten academic works for the external evaluation. The representative work submitted for rank promotion shall be published and publicly distributed, or published in renowned domestic or international academic journals within the applicant's current rank.\n\n依教育部「專科以上學校教師資格審定辦法」規定辦理。\n\nApplications shall be handled in accordance with Regulations Governing Accreditation of Teacher Qualifications at Junior Colleges and Institutions of Higher Education formulated by the Ministry of Education.\n\n教師所提專門著作若有屬於「已為接受將定期發表」，請出具證明。\n\nApplicants shall provide the proof of acceptance of any submitted works for rank promotion that are accepted and scheduled for publication.\n\n請參照科技部規定之學術著作目錄格式列出。\n\nPlease compile academic works in the format specified by the National Science and Technology Council.]\n\n（一）代表著作 representative work ：\n\n（二）參考著作 reference works ：\n\n（請依下列方式分類：專書、期刊論文、專書論文、研討會論文、其他）\n\n(Please categorize published works as follows: books, journals papers, book chapters, conference papers, and others.)\n\n本欄如不敷填寫，請另紙繕附 )\n\n(Attached additional A4 pages if necessary.)\n\n申請者簽名確認 Applicant's signature ：""]",teacher,Poor grammar,short,"<1-hop>  [202509142203130723.md]

國立中山大學文學院教師升等審查要點

Guidelines on the Evaluation of Professorship Rank Promotion in the College of Liberal Arts

88.6.22 八十七學年度第八次院務會議訂定

88.12.28 本校第 224 次教師評審委員會通過

89.4.27 八十八學年度第五次院務會議修正通過

89.6.13 八十八學年度第十次院教評會修正通過 89.11.23 八十九學年度第一次院務會議通過 89.11.27 第 240 次教師評審委員會通過 93.5.25 九十二學年度第十次院教評會通過 93.6.17 九十二學年度第四次院務會議通過 93.9.30 第 291 次校教評會修正通過 94.10.05 九十四學年度第一次院務會議修正通過 94.10.20 第 297 次校教評會通過 95.04.25 九十四學年度第七次院教評會通過 95.05.02 九十四學年度第五次院務會議通過 95.06.15 第 303 次校教評會通過 97.05.22 九十六學年度第七次院教評會修正通過 97.05.29 九十六學年度第六次院務會議修正通過 97.06.18 第 315 次校教評會通過 98.06.04 九十七學年度第八次院教評會修正通過 98.06.16 第 322 次校教評會通過 105.12.22 一 o 五學年度第一次院務會議修正通過 106.1.5 第 378 次校教評會予以核備 107.3.8 、 4.19 一 o 六學年度第五、六次院教評會修正通過 107.4.11 一 o 六學年度第五次院務會議修正通過 107.5.3 一 o 六學年度第 387 次校教評會通過 111 學年度第 3 次院教評會修正通過（ 111.12.8 ） 111 學年度第 2 次院務會議修正通過（ 111.12.01 ） 本校第 420 次校教評會通過（ 111.12.29 ） 111 學年度第 6 次院教評會修正通過（ 112.4.13 ） 111 學年度第 4 次院務會議修正通過（ 112.4.20 ） 本校第 422 次校教評會通過（ 112.4.27 ）

Approved at the 422nd University Faculty Evaluation Committee meeting on April 27, 2023

一、 本學院為辦理教師升等，依據本校教師升等審查辦法，訂定本要點。

I. These guidelines are formulated in accordance with the University's Regulations for the Evaluation of Professorship Rank Promotion to handle the evaluation of professorship rank promotion of the faculty in the College of Liberal Arts (hereinafter referred to as the 'College').

二、 本學院各級教師申請升等資格及年資採計，應符合本校教師升等審查 辦法之規定。

II. For the College faculty of all ranks applying for promotion, the eligibility and calculation of work seniority shall comply with the University's Regulations for the Evaluation of Professorship Rank Promotion .

（一） 升等管道：分為一般研究類、技術應用類、教學研究類及展演藝 術類。申請升等教師應擇一提出申請，其中展演藝術類限適用於

音樂學系及劇場藝術學系所屬教師。

(1) The pathway of the faculty's rank promotion is categorized into the tracks of general research, technology application, pedagogical research, and performing arts. The faculty shall select one of the tracks to submit their application. Nevertheless, the track of performing arts shall be exclusively applicable to the faculty affiliated with the Department of Music and the Department of Theater Arts.

（二） 升等審查包括學術產學研究績效 (A) 、教學績效 (B) 及服務績效 (C) 三項，學術產學研究績效分為學術研究成果外審成績 (A1) 及七年 內本職級研究計畫獎助及學術成就 (A2) 。

(2) The evaluation includes three categories: academic & industryacademia research performance (A), teaching performance (B), and service performance (C). Academic & industry-academia research performance (A) includes external evaluation of academic research (A1) and research projects and other academic achievements within the past 7 years at the current rank (A2).

（三） 各升等管道各項評分比重如下表 :

(3) The scoring percentage of the three categories for each track is as follows:

（四） 教師所提外審之學術研究成果件數至多 10 件。教師應自行擇一為 代表作，其屬系列之相關研究者，得合併為代表學術研究成果， 其餘列為參考學術研究成果。以展演藝術類提出升等者所提外審 依專科以上學校教師資格審定辦法之「附表三、以作品及成就證

升等類別 tracks of promotion 學術產學研究績效 (A) academic &industry-academia research performance (A) ( 學術研究成果外審成績 A1 、七年內本職 級研究計畫獎助及學術成就 A2) (external evaluation of academic research A1, research projects and other academic achievements within the past 7 years at the current rank A2) 教學績效 (B) teaching performance (B) 服務績效 (C) service performance (C) 一般研究類 general research 70%(A1:75% 、 A2:25%) 20% 10% 技術應用類 technology application 70%(A1:40% 、 A2:60%) 20% 10% 教學研究類 pedagogical research 60%(A1:60% 、 A2:40%) 30% 10% 展演藝術 performing arts 70%(A1:75% 、 A2:25%) 20% 10%

明送審教師資格審查範圍及基準」辦理。

(4) The faculty applying for rank promotion shall submit up to ten academic research works for the external evaluation, and shall select one as a representative work and use the rest as reference. Related works constituting a series may be compiled into one representative work. Those applying through the track of performing arts shall have their external evaluation handled in accordance with the Scope and Criteria for Examination of Creative Works and Evidence of Achievement Submitted for Teacher Accreditation Reviews (Attachment 3) of Regulations Governing Accreditation of Teacher Qualifications at Junior Colleges and Institutions of Higher Education.

（五） 學術產學研究績效、教學績效及服務績效依本學院教師升等審查 評分細則辦理 ( 另訂之 ) 。

(5) Academic & industry-academia research performance, teaching performance, and service performance shall be scored in accordance with Guidelines on the Detailed Implementation of Evaluation of Professorship Rank Promotion in the College of Liberal Arts .

（六） 本學院系 ( 所 ) 級及院級教師評審委員會 ( 以下簡稱教評會 ) 審議本 學院教師升等案，升等為教授或副教授者之學術研究成果外審成 績，除依本校規定至少有四位外審委員評等為「優良」以上外， 且外審成績總平均升等教授者需達 80 分以上或升等副教授者需 達 77 分以上，始達外審合格門檻。未達外審合格門檻者，視為 升等不通過。

(6) Department/institute faculty evaluation committees (hereinafter referred to as the 'DFEC') and the College Faculty Evaluation Committee (CFEC) shall review rank promotion cases. Applicants applying for professorship or associate professorship shall receive the 'Good' grade from at least four reviewers. Moreover, the passing threshold of external evaluation shall be 80 and 77 for professorship and associate professorship, respectively. Those not passing the external evaluation shall be deemed unsuccessful in their application for promotion.

（七） 前經教師資格審定不合格者，重新提出之學術研究成果曾作為代 表作送審時，其送審著作應增加或更換一件以上。

(7) When submitting the same representative work as the one used in a prior failed application, applicants shall add at least one new reference work as a replacement or supplement.

三、 各系（所）應於每學期正式上課一星期內，將通過系 ( 所 ) 級升等資格審 查之系 ( 所 ) 級教評會會議紀錄、審查資料、迴避名單與迴避理由，亦得

提供不利審查之學者專家名單，送院教評會，逾期不受理。

III. Individual departments/institutes shall submit cases that pass the qualification review along with the DFEC meeting minutes, relevant documentation, the recusal list of interested person with reasons, and the list of scholars who might deemed unfavorable in the evaluation if needed to the CFEC within the first week after the class starts in each semester. Late submissions shall not be accepted.

四、 各系（所）教評會下學期辦理 8 月 1 日及上學期辦理 2 月 1 日升等生效之升 等審查，除依據各系（所）教師升等審查要點外，應依本要點及本校教 師升等審查辦法由校進行外審。外審結果送回系（所）級教評會審查， 由系 ( 所 ) 級教評會召集人加註評語，連同審查成績、會議紀錄及各項表 件等申請資料，於本學院通知限期截止日前提送本學院第三次教評會辦 理院級審查。

IV. In order for faculty promotions to take effect on August 1 (Fall semester) or February 1 (Spring semester), the DFEC shall review rank promotion cases in accordance with its own Guidelines on the Evaluation of Professorship Rank Promotion , and the University shall submit the applicants' case to the external reviewers for evaluation according to the University's Regulations for the Evaluation of Rank Professorship Rank . The external evaluation result shall be returned back to the DFEC for the department level review; the DFEC shall then submit the cases passing its review, along with the chairperson's comments, the score of the review, the meeting minutes, and relevant documentation to the CFEC third meeting each semester before the deadline specified by the College.

五、 本學院教評會受理教師升等審查案時，其程序悉依本校教師升等審查辦 法及第四點規定辦理之。

V. The College shall review rank promotion cases in accordance with Article 4 of the University's Regulations for the Evaluation of Professorship Rank Promotion .

六、 本學院教評會開會審議升等案件時，得邀請有關人員列席說明。

VI. When the CFEC convenes to review rank promotion cases, relevant personnel may be invited to attend and provide explanations.

七、 本學院教評會審議升等案時，委員應親自出席，不得由他人代理。須有 委員三分之二以上出席，始得開會。

VII. At least two-thirds of the CFEC members shall attend to review rank promotion cases, with members attending in person and no proxies allowed.

八、 經本學院教評會升等審查通過之教師，由院級教評會召集人加註評語， 連同審查成績、會議紀錄及各項表件等申請資料及其升等著作，送本校 教評會進行校級審查。

VIII. Cases that pass the college level review shall be submitted along with the score of the review, the CFEC meeting minutes, relevant documentation, the applicant's publications, and the chairperson's comments to the University Faculty Evaluation Committee (UFEC) for the university review.

九、 本學院教師升等案，經系 ( 所 ) 級或院級教師評審委員會審查時，發現外 審意見有疑義者，得依本校教師升等審查辦法提出行政救濟。

IX. Administrative remedies may be sought in accordance with the University's Regulations for the Evaluation of Professorship Rank Promotion when there are doubts regarding the result of external evaluation during the review by the DFEC or CFEC.

十、 經系 ( 所 ) 級或院級教評會審議不通過，申請升等教師如不服審議結果， 得依相關規定提出申訴或申復。申請升等教師於申復期間向本校申評會 提出申訴者，申復應立即停止。

X. Applicants not passing the review by the DFEC or CFEC and disagreeing with the evaluation result may file an appeal or grievance in accordance with relevant regulations. When the applicants directly appeal to the Faculty Appeal Handling Committee after filing a grievance against the DFEC or CFEC's decision, the process of the grievance shall be immediately terminated.

十一、 本要點若有未盡事宜，悉依本校教師升等審查辦法及專科以上教師資格 審定辦法等相關法規處理之。

XI. Matters not covered herein shall be handled in accordance with the University's Regulations for the Evaluation of Professorship Rank Promotion , Regulations Governing Accreditation of Teacher Qualifications at Junior Colleges and Institutions of Higher Education , and relevant regulations of the University.

十二、 本要點經本學院教評會、院務會議及校教評會通過，陳請校長同意後實 施；修正時亦同。

XII. These guidelines are approved by the CFEC, the College Council, the UFEC, and the President before implementation. Amendments to these guidelines shall follow the same procedure.","<2-hop>  [202509142236500733.md]

國立中山大學文學院教師升等初審作業著作送審資料目錄表

Catalog of the Applicant' s Works for Initial Review of Professorship Rank Promotion in the College of Liberal Arts

單位 affiliated department/ institute 教師姓名 applicant's name 填表日期 date 年 月 日 YYYY/MM/DD 現任職級 current rank 擬升等職級 intended promotion rank 申請升等期別 academic year and semester when applying 學年度第 學期 Fall/Spring semester in 20___ (year)

代表著作及參考著作目錄（注意事項如下說明）

Catalog of representative work and reference works (Please refer to the following notes.):

[ 說明 Notes ：

需符合本校「教師升等審查辦法」及「文學院教師升等審查要點」第二條規定：「教師所提 外審之學術研究成果件數至多 10 件。代表著作或論文，應於提出申請時已經出版公開發行或 在國內外知名學術刊物發表且為升等前一職級出版或發表者為限。

Applicants shall comply with the University's Regulations for the Evaluation of Professorship Rank Promotion and meet the requirement stipulated in Article 2 of Guidelines on the Evaluation of Professorship Rank Promotion in the College of Liberal Arts : The faculty applying for rank promotion shall submit up to ten academic works for the external evaluation. The representative work submitted for rank promotion shall be published and publicly distributed, or published in renowned domestic or international academic journals within the applicant's current rank.

依教育部「專科以上學校教師資格審定辦法」規定辦理。

Applications shall be handled in accordance with Regulations Governing Accreditation of Teacher Qualifications at Junior Colleges and Institutions of Higher Education formulated by the Ministry of Education.

教師所提專門著作若有屬於「已為接受將定期發表」，請出具證明。

Applicants shall provide the proof of acceptance of any submitted works for rank promotion that are accepted and scheduled for publication.

請參照科技部規定之學術著作目錄格式列出。

Please compile academic works in the format specified by the National Science and Technology Council.]

（一）代表著作 representative work ：

（二）參考著作 reference works ：

（請依下列方式分類：專書、期刊論文、專書論文、研討會論文、其他）

(Please categorize published works as follows: books, journals papers, book chapters, conference papers, and others.)

本欄如不敷填寫，請另紙繕附 )

(Attached additional A4 pages if necessary.)

申請者簽名確認 Applicant's signature ：",202509142203130723.md,202509142236500733.md,"['教師升等審查要點', '文學院教師升等審查辦法', '教師升等審查辦法']",文學院↔文學院,教師升等審查要點↔教師升等審查要點 | 教師升等審查辦法↔文學院教師升等審查辦法 | 教師升等審查辦法↔教師升等審查要點,5.0,3.05,5.0,5.0,5.0,4.97,1.1
根據本系學士班專業課程獎勵辦法，請問成績優良獎與成績進步獎的申請條件、評選方式及獎勵方式為何？此外，申請者的操行成績有何要求？,根據本系學士班專業課程獎勵辦法，成績優良獎的申請條件為當學期修讀本系學士班或研究所必、選修專業課程至少三科，且取三科名次最優專業課程（須不同授課教師），其名次百分比之平均值為0.1以內（含）。評選方式是以申請件評選出每班前七名。成績進步獎的申請條件為個人學期總成績班排名較前一學期顯著進步者，均可提出申請，並依申請件評選出每班名次進步最多前三名。獎勵方式為上述獎勵不得重覆申領，獲獎者頒予獎狀乙紙，提供獎金與否或獎金額度由系主任衡酌當年度經費狀況訂定。申請者的操行成績須達八十分以上，且當學期領有本校書香獎及重修生不適用此辦法。,"['<1-hop>  [202404151419240261.md]\n\n一、宗旨：\n\n為鼓勵本系學生勤奮向學、提高讀書風氣，並獎勵學業成績進步及優良之學 生，特訂定本辦法。\n\n二、獎勵對象：\n\n（一） 本系學士班在校生，唯當學期領有本校書香獎及重修生不適用此辦法。\n\n（二）操行成績須達八十分以上。\n\n三、獎勵辦法及名額：\n\n（一）成績優良獎（ 7 名） ：當學期修讀本系學士班或研究所必、選修專業課 程至少三科，取三科名次最優專業課程（須不同授課教師） ，其名次百 分比之平均值為 0.1 以內 ( 含 ) ，並以申請件評選出每班前七名。\n\n（二）成績進步獎（ 3 名） ：個人學期總成績班排名較前一學期顯著進步者， 均可提出申請，依申請件評選出每班名次進步最多前三名。\n\n三、獎勵方式：\n\n上述獎勵不得重覆申領，獲獎者頒予獎狀乙紙。提供獎金與否或獎金額度由 系主任衡酌當年度經費狀況訂定。\n\n四、每學期辦理一次，將合於給獎學生名單成績提交課程委員會議審議。\n\n五、本辦法由本系系務會議通過後實施，修正時亦同。\n\n國立中山大學資訊工程學系\n\n學士班專業課程獎勵辦法\n\n101\n\n年 10 月 24 日系務會議通過 104 年 2 月 12 日系務會議修正 105 年 3 月 25 日系務會議修正 107 年 3 月 27 日系務會議修正\n\n113 年 4 月 15 日系務會議修正', '<2-hop>  [202404151422100263.md]\n\n一、宗旨：\n\n為鼓勵本系學生勤奮向學、提高讀書風氣，並獎勵學業成績進步及優良之學 生，特訂定本辦法。\n\n二、獎勵對象：\n\n（一） 本系學士班在校生，唯當學期領有本校書香獎及重修生不適用此辦法。\n\n（二）操行成績須達八十分以上。\n\n三、獎勵辦法及名額：\n\n（一）成績優良獎（ 7 名） ：當學期修讀本系學士班或研究所必、選修專業課 程至少三科，取三科名次最優專業課程（須不同授課教師） ，其名次百 分比之平均值為 0.1 以內 ( 含 ) ，並以申請件評選出每班前七名。\n\n（二）成績進步獎（ 3 名） ：個人學期總成績班排名較前一學期顯著進步者， 均可提出申請，依申請件評選出每班名次進步最多前三名。\n\n三、獎勵方式：\n\n上述獎勵不得重覆申領，獲獎者頒予獎狀乙紙。提供獎金與否或獎金額度由 系主任衡酌當年度經費狀況訂定。\n\n四、每學期辦理一次，將合於給獎學生名單成績提交課程委員會議審議。\n\n五、本辦法由本系系務會議通過後實施，修正時亦同。\n\n國立中山大學資訊工程學系\n\n學士班專業課程獎勵辦法\n\n101\n\n年 10 月 24 日系務會議通過 104 年 2 月 12 日系務會議修正 105 年 3 月 25 日系務會議修正 107 年 3 月 27 日系務會議修正\n\n113 年 4 月 15 日系務會議修正']",staff,Perfect grammar,long,"<1-hop>  [202404151419240261.md]

一、宗旨：

為鼓勵本系學生勤奮向學、提高讀書風氣，並獎勵學業成績進步及優良之學 生，特訂定本辦法。

二、獎勵對象：

（一） 本系學士班在校生，唯當學期領有本校書香獎及重修生不適用此辦法。

（二）操行成績須達八十分以上。

三、獎勵辦法及名額：

（一）成績優良獎（ 7 名） ：當學期修讀本系學士班或研究所必、選修專業課 程至少三科，取三科名次最優專業課程（須不同授課教師） ，其名次百 分比之平均值為 0.1 以內 ( 含 ) ，並以申請件評選出每班前七名。

（二）成績進步獎（ 3 名） ：個人學期總成績班排名較前一學期顯著進步者， 均可提出申請，依申請件評選出每班名次進步最多前三名。

三、獎勵方式：

上述獎勵不得重覆申領，獲獎者頒予獎狀乙紙。提供獎金與否或獎金額度由 系主任衡酌當年度經費狀況訂定。

四、每學期辦理一次，將合於給獎學生名單成績提交課程委員會議審議。

五、本辦法由本系系務會議通過後實施，修正時亦同。

國立中山大學資訊工程學系

學士班專業課程獎勵辦法

101

年 10 月 24 日系務會議通過 104 年 2 月 12 日系務會議修正 105 年 3 月 25 日系務會議修正 107 年 3 月 27 日系務會議修正

113 年 4 月 15 日系務會議修正","<2-hop>  [202404151422100263.md]

一、宗旨：

為鼓勵本系學生勤奮向學、提高讀書風氣，並獎勵學業成績進步及優良之學 生，特訂定本辦法。

二、獎勵對象：

（一） 本系學士班在校生，唯當學期領有本校書香獎及重修生不適用此辦法。

（二）操行成績須達八十分以上。

三、獎勵辦法及名額：

（一）成績優良獎（ 7 名） ：當學期修讀本系學士班或研究所必、選修專業課 程至少三科，取三科名次最優專業課程（須不同授課教師） ，其名次百 分比之平均值為 0.1 以內 ( 含 ) ，並以申請件評選出每班前七名。

（二）成績進步獎（ 3 名） ：個人學期總成績班排名較前一學期顯著進步者， 均可提出申請，依申請件評選出每班名次進步最多前三名。

三、獎勵方式：

上述獎勵不得重覆申領，獲獎者頒予獎狀乙紙。提供獎金與否或獎金額度由 系主任衡酌當年度經費狀況訂定。

四、每學期辦理一次，將合於給獎學生名單成績提交課程委員會議審議。

五、本辦法由本系系務會議通過後實施，修正時亦同。

國立中山大學資訊工程學系

學士班專業課程獎勵辦法

101

年 10 月 24 日系務會議通過 104 年 2 月 12 日系務會議修正 105 年 3 月 25 日系務會議修正 107 年 3 月 27 日系務會議修正

113 年 4 月 15 日系務會議修正",202404151419240261.md,202404151422100263.md,"['獎勵辦法', '成績進步獎', '申請件評選', '獎狀', '成績優良獎', '操行成績']",工學院↔工學院 | 資訊工程學系↔資訊工程學系,獎勵辦法↔獎勵辦法 | 成績優良獎↔成績優良獎 | 成績進步獎↔成績進步獎 | 操行成績↔操行成績 | 申請件評選↔申請件評選 | 獎狀↔獎狀,5.0,4.9,5.0,5.0,5.0,2.4,1.0
請問國立中山大學管理學院校長遴選委員會中，教師代表、校友代表及社會公正人士代表的推選程序及性別比例要求為何？此外，管理學院教師評審委員會的組成及審議程序是如何規定的？,"根據國立中山大學管理學院校長遴選委員會的規定，教師代表候選人由本院推選二人，且二人應為不同性別，候選人由全院專任教師投票互選，依得票高低次序產生，得票數相同時抽籤決定。全校選出教師代表六人，任一性別至少二人，本院推選之候選人提送校務會議代表以無記名限制連記法推選為代表，本院代表至少一人，其餘為候補代表。校友代表候選人由本院推選二人，二人應為不同性別，各系所學程得推薦校友至多二人，以曾獲本院傑出校友獎之校友為優先，經院主管會議討論後提送校務會議代表以無記名限制連記法推選為代表。全校選出校友代表三人，任一性別至少一人，每學院至多一人當選，以在本校之最高學歷認定。社會公正人士代表候選人由本院推選二人，二人應為不同性別，由各系所推薦，經院主管會議討論後提送校務會議代表以無記名限制連記法推選為代表，全校選出社會公正人士代表四人，任一性別至少一人。

管理學院教師評審委員會的組成包括當然委員（院長及各系所主管）、專任教授代表（由當然委員以外之專任教授組成）及校教評會委員保障名額（當年度續任校教評會委員之教師），專任教授代表及校教評會委員保障名額合計為當然委員人數多一名，任期一年與學年同，連選得連任。主任委員由院長兼任。審議事項須先經系所教評會通過後提本會審議，會議不定期舉行，審議教師聘任、停聘、解聘、不續聘、升等等案件有明確的出席及通過比例規定。委員對涉及本人或利害關係者的案件須迴避，並可申請迴避。會議得邀請有關人員列席說明，相關要點經本會及院務會議通過，提校教評會審議通過後由校長核定實施。","['<1-hop>  [201909101347010540.md]\n\n國立中山大學管理學院校長遴選委員會 學校教師代表、校友代表及社會公正人士代表遴選作業要點\n\n96 年 09 月 19 日 96 學年度第 2 次主管會議通過 96 年 10 月 02 日 96 學年度第 1 次院務會議通過 104 年 10 月 13 日 104 學年度第 2 次主管會議修正通過 104 年 10 月 14 日 104 學年度第 1 次臨時院務會議修正通過\n\n一、本辦法依「校長遴選續聘及去職辦法」及「辦理校長遴選作業應行注意事項」訂定 之。\n\n二、教師代表候選人之推選：\n\n（1）本院得推選「學校教師代表」候選人二人，二人應為不同性別。\n\n（2）候選人由全院專任教師投票互選之，依得票高低次序產生。得票數相同時，抽 籤決定之。\n\n（3）全校選出教師代表六人，任一性別至少二人。本院推選之候選人提送校務會議 代表以無記名限制連記法推選為代表。本院代表至少一人，其餘為候補代表。 若教師代表因故出缺，按得票高低依序遞補，惟遞補後之教師代表人數若不符 合性別比例時，則不受本院至少一人之限制。\n\n三、校友代表候選人之推選：\n\n（1）本院得推選具有本校畢業證書之「校友代表」候選人二人，二人應為不同性別。\n\n（2）本院推選之候選人，本院各系（所、學程）得推薦校友至多二人（二人應為不 同性別） ，以曾獲本院傑出校友獎之校友為優先，經院主管會議討論後，提送 校務會議代表以無記名限制連記法推選為代表。\n\n（3）全校選出校友代表三人，任一性別至少一人。每學院至多一人當選，以在本校 之最高學歷認定。\n\n四、社會公正人士代表候選人之推選：\n\n（1）本院得推選不具本校校友身分之「社會公正人士代表」候選人二人，二人應為 不同性別。\n\n（2）本院推選之候選人，由本院各系(所、學程)推薦，各單位至多推薦二人（二人 應為不同性別） ，經院主管會議討論後，提送校務會議代表以無記名限制連記 法推選為代表。\n\n（3）全校選出社會公正人士代表四人，任一性別至少一人。\n\n本院「校長遴選委員會\n\n學校教師代表、校友代表及社會公正人士代表遴選作業要點」修正對照表\n\n修正後條文 現行條文 說明 本院「校長遴選委員會學校教師 代表、校友代表及社會公正人士 代表遴選作業要點」 本院「校長遴選委員會學校教師 代表及社會公正人士代表遴選作 業要點」 法規名稱修正 一、本辦法依「校長遴選續聘及 去職辦法」及「辦理校長遴 選作業應行注意事項」訂定 之。 一、本辦法依「國立中山大學校 長遴選委員會學校代表委員 遴選作業細則」及「國立中 山大學校長遴選委員會社會 公正人士代表委員遴選作業 細則」訂定之。 配合學校法規名 稱修正 二、教師代表候選人之推選： （1）本院得推選「學校教師代表」 候選人二人，二人應為不同 性別。 （2）候選人由全院專任教師投票 互選之，依得票高低次序產 生。得票數相同時，抽籤決 定之。 （3）全校選出教師代表六人，任 一性別至少二人。本院推選 之候選人提送校務會議代表 以無記名限制連記法推選為 代表。本院代表至少一人， 其餘為候補代表。若教師代 表因故出缺，按得票高低依 序遞補，惟遞補後之教師代 表人數若不符合性別比例 時，則不受本院至少一人之 限制。 二、教師代表之推選： （1）本院應推選「學校教師代表」 一名，同時可推薦一名為跨 院代表候選人。 （2）候選人由全院專任教師投票 互選之，依得票高低次序產 生。 （3）最高票者為本院當然代表， 次高票者為候補之當然委 員，並為跨院代表之候選 人，其他候選人依得票高低 依序候補。得票數相同時， 抽籤決定之。 （4）本院教師代表因故出缺時， 由候補委員依得票數高低依 序遞補。 配合學校法規修 正 三、校友代表候選人之推選： （1）本院得推選具有本校畢業證 書之「校友代表」候選人二 人，二人應為不同性別。 （2）本院推選之候選人，本院各 系（所、學程）得推薦校友 至多二人（二人應為不同性 別） ，以曾獲本院傑出校友獎 之校友為優先，經院主管會 議討論後，提送校務會議代 新增 原則上由曾獲本 院傑出校友獎名 單中推選，另各系 所學程得另推薦 人選。\n\n表以無記名限制連記法推選 為代表。 （3）全校選出校友代表三人，任 一性別至少一人。每學院至 多一人當選，以在本校之最 高學歷認定。 四、社會公正人士代表候選人之 推選： （1）本院得推選不具本校校友身 分之「社會公正人士代表」 候選人二人，二人應為不同 性別。 （2）本院推選之候選人，由本院 各系(所、學程)推薦，各單位 至多推薦二人（二人應為不 同性別） ，經院主管會議討論 後，提送校務會議代表以無 記名限制連記法推選為代 表。 （3）全校選出社會公正人士代表 四人，任一性別至少一人。 三、社會公正人士代表之推選： （1）本院應推薦「社會公正人士 代表」候選人二名以上，供 校務會議投票，全校選出四 位代表。 （2）本院推薦之候選人，由本院 教師推薦候選人，再經院主 管會議討論後，推薦供校務 會議投票。 配合學校法規修 正 五、本要點經主管會議及院務會 議通過後實施，修正時亦同。 四、本要點經主管會議及院務會 議通過後實施，修正時亦同。 條次修正\n\n國立中山大學管理學院校長遴選委員會\n\n「校友代表」及「社會公正人士代表」推薦表\n\n姓 名\n\n性別\n\n生日\n\n聯絡地址\n\n電話/手機\n\nEmail\n\n推薦類別\n\n[ ] □校友代表（畢業單位：________________ ;畢業年度：________）\n\n[ ] □社會公正人士\n\n現職單位/職稱\n\n（請載明各學歷單位及起迄時間）\n\n（請條列說明各經歷之單位、起迄時間、與所負責之工作內容）\n\n（請條列說明各項事績之內容與時間，並檢附相關證明文件）\n\n推薦單位\n\n推薦單位\n\n主管簽章', '<2-hop>  [202302080949360049.md]\n\n國立中山大學管理學院教師評審委員會設置要點\n\n85.3.20 本校管理學院 84 學年度第 4 次教評會修正通過 93.1.6 本校管理學院 94 學年度第 3 次院務會議通過 94.10.25 本校管理學院 94 學年度第 1 次院務會議修正通過 95.01.05 本校管理學院 94 學年度第 299 次校教評會修正通過 96.4.18 本校管理學院 95 學年度第 5 次院教評會修正通過 96.5.11 本校管理學院 95 學年度第 308 次校教評會議修正通過 97.11.25 本校管理學院 97 學年度第 3 次院教評會修正通過 97.12.9 本校管理學院 97 學年度第 2 次院務會議修正通過 100.9.13 本校管理學院 100 學年度第 1 次院教評會修正通過 100.9.20 本校管理學院 100 學年度第 1 次院務會議修正通過 100.11.17 本校第 337 次校教師評審委員會修正通過 111.11.29 本校管理學院111學年度第2次院務會議修正通過 111.12.29 本校第420次校教師評審委員會修正通過\n\n一、 為審議有關本院教師之聘任、聘期、升等、停聘、解聘、不續聘、延長服務、借調、出國 講學、研究、進修、教授及副教授休假研究、年資加薪、教師資遣原因之認定及其他依法 令應行審議之事項，依本校教師評審委員會設置辦法設置管理學院教師評審委員會(以下簡 稱本會)。\n\n二、 本會委員包括當然委員、專任教授代表，以及校教評會委員保障名額等。 當然委員包括院長及各系所主管；專任教授代表由當然委員以外之專任教授組成；校教評 會委員保障名額為當年度續任校教評會委員之教師。其中專任教授代表以及校教評會委員 保障名額合計為當然委員人數多一名，任期一年與學年同，連選得連任。\n\n三、 本會置主任委員一人，由院長兼任。\n\n四、 本院依第一條規定應審議之事項，均須先經由系所教評會通過後提本會審議。\n\n五、本會審議事項依據教育部頒訂暨本校訂定相關法令規定辦理。\n\n六、本會會議不定期舉行，開會時討論案議決，依下列人數比例辦理：\n\n（一）審議教師停聘、解聘、不續聘案件依教師法規定之出席及審議通 過比例辦理。\n\n（二）審議教師聘任案件應有全體委員二分之一以上出席，並經出席 委員三分之二以上同 意，始得通過。\n\n（三）審議教師升等案件應有全體委員三分之二以上出席，擬升等教師應符合本校(含系、 院)升等相關條件規定，始得通過。\n\n（四）前三款以外之議案，除法規另有規定外，應經全體委員二分之一 以上出席及出席委 員二分之一以上之審議通過。\n\n當然委員有正當理由，無法出席，得由法定職務代理人代理出席。\n\n七、 為保障教師權益，本會於審議第一條規定事項時，如以投票方式表決，其為空白票、廢票 及棄權票以不同意票處理。\n\n八、 本會委員對於評審案件涉及本人、配偶、三親等之血親、姻親、有個人利害關係者，或於 審議教師聘任、升等、延長服務等資格審查案件時，不得低階高審，應自行迴避，不得參 與評審。\n\n有具體事實足認本會委員對於評審案件有偏頗之虞者，申請人得向本會申請該委員迴避， 並應舉其原因事實。委員中有前述應行迴避之情事者，不計入出席委員人數。\n\n九、 本會開會時，得邀請有關人員列席說明。\n\n十、 本要點經本會及院務會議通過，提校教評會審議通過，陳請校長核定後實施，修正時亦同。']",staff,Perfect grammar,long,"<1-hop>  [201909101347010540.md]

國立中山大學管理學院校長遴選委員會 學校教師代表、校友代表及社會公正人士代表遴選作業要點

96 年 09 月 19 日 96 學年度第 2 次主管會議通過 96 年 10 月 02 日 96 學年度第 1 次院務會議通過 104 年 10 月 13 日 104 學年度第 2 次主管會議修正通過 104 年 10 月 14 日 104 學年度第 1 次臨時院務會議修正通過

一、本辦法依「校長遴選續聘及去職辦法」及「辦理校長遴選作業應行注意事項」訂定 之。

二、教師代表候選人之推選：

（1）本院得推選「學校教師代表」候選人二人，二人應為不同性別。

（2）候選人由全院專任教師投票互選之，依得票高低次序產生。得票數相同時，抽 籤決定之。

（3）全校選出教師代表六人，任一性別至少二人。本院推選之候選人提送校務會議 代表以無記名限制連記法推選為代表。本院代表至少一人，其餘為候補代表。 若教師代表因故出缺，按得票高低依序遞補，惟遞補後之教師代表人數若不符 合性別比例時，則不受本院至少一人之限制。

三、校友代表候選人之推選：

（1）本院得推選具有本校畢業證書之「校友代表」候選人二人，二人應為不同性別。

（2）本院推選之候選人，本院各系（所、學程）得推薦校友至多二人（二人應為不 同性別） ，以曾獲本院傑出校友獎之校友為優先，經院主管會議討論後，提送 校務會議代表以無記名限制連記法推選為代表。

（3）全校選出校友代表三人，任一性別至少一人。每學院至多一人當選，以在本校 之最高學歷認定。

四、社會公正人士代表候選人之推選：

（1）本院得推選不具本校校友身分之「社會公正人士代表」候選人二人，二人應為 不同性別。

（2）本院推選之候選人，由本院各系(所、學程)推薦，各單位至多推薦二人（二人 應為不同性別） ，經院主管會議討論後，提送校務會議代表以無記名限制連記 法推選為代表。

（3）全校選出社會公正人士代表四人，任一性別至少一人。

本院「校長遴選委員會

學校教師代表、校友代表及社會公正人士代表遴選作業要點」修正對照表

修正後條文 現行條文 說明 本院「校長遴選委員會學校教師 代表、校友代表及社會公正人士 代表遴選作業要點」 本院「校長遴選委員會學校教師 代表及社會公正人士代表遴選作 業要點」 法規名稱修正 一、本辦法依「校長遴選續聘及 去職辦法」及「辦理校長遴 選作業應行注意事項」訂定 之。 一、本辦法依「國立中山大學校 長遴選委員會學校代表委員 遴選作業細則」及「國立中 山大學校長遴選委員會社會 公正人士代表委員遴選作業 細則」訂定之。 配合學校法規名 稱修正 二、教師代表候選人之推選： （1）本院得推選「學校教師代表」 候選人二人，二人應為不同 性別。 （2）候選人由全院專任教師投票 互選之，依得票高低次序產 生。得票數相同時，抽籤決 定之。 （3）全校選出教師代表六人，任 一性別至少二人。本院推選 之候選人提送校務會議代表 以無記名限制連記法推選為 代表。本院代表至少一人， 其餘為候補代表。若教師代 表因故出缺，按得票高低依 序遞補，惟遞補後之教師代 表人數若不符合性別比例 時，則不受本院至少一人之 限制。 二、教師代表之推選： （1）本院應推選「學校教師代表」 一名，同時可推薦一名為跨 院代表候選人。 （2）候選人由全院專任教師投票 互選之，依得票高低次序產 生。 （3）最高票者為本院當然代表， 次高票者為候補之當然委 員，並為跨院代表之候選 人，其他候選人依得票高低 依序候補。得票數相同時， 抽籤決定之。 （4）本院教師代表因故出缺時， 由候補委員依得票數高低依 序遞補。 配合學校法規修 正 三、校友代表候選人之推選： （1）本院得推選具有本校畢業證 書之「校友代表」候選人二 人，二人應為不同性別。 （2）本院推選之候選人，本院各 系（所、學程）得推薦校友 至多二人（二人應為不同性 別） ，以曾獲本院傑出校友獎 之校友為優先，經院主管會 議討論後，提送校務會議代 新增 原則上由曾獲本 院傑出校友獎名 單中推選，另各系 所學程得另推薦 人選。

表以無記名限制連記法推選 為代表。 （3）全校選出校友代表三人，任 一性別至少一人。每學院至 多一人當選，以在本校之最 高學歷認定。 四、社會公正人士代表候選人之 推選： （1）本院得推選不具本校校友身 分之「社會公正人士代表」 候選人二人，二人應為不同 性別。 （2）本院推選之候選人，由本院 各系(所、學程)推薦，各單位 至多推薦二人（二人應為不 同性別） ，經院主管會議討論 後，提送校務會議代表以無 記名限制連記法推選為代 表。 （3）全校選出社會公正人士代表 四人，任一性別至少一人。 三、社會公正人士代表之推選： （1）本院應推薦「社會公正人士 代表」候選人二名以上，供 校務會議投票，全校選出四 位代表。 （2）本院推薦之候選人，由本院 教師推薦候選人，再經院主 管會議討論後，推薦供校務 會議投票。 配合學校法規修 正 五、本要點經主管會議及院務會 議通過後實施，修正時亦同。 四、本要點經主管會議及院務會 議通過後實施，修正時亦同。 條次修正

國立中山大學管理學院校長遴選委員會

「校友代表」及「社會公正人士代表」推薦表

姓 名

性別

生日

聯絡地址

電話/手機

Email

推薦類別

[ ] □校友代表（畢業單位：________________ ;畢業年度：________）

[ ] □社會公正人士

現職單位/職稱

（請載明各學歷單位及起迄時間）

（請條列說明各經歷之單位、起迄時間、與所負責之工作內容）

（請條列說明各項事績之內容與時間，並檢附相關證明文件）

推薦單位

推薦單位

主管簽章","<2-hop>  [202302080949360049.md]

國立中山大學管理學院教師評審委員會設置要點

85.3.20 本校管理學院 84 學年度第 4 次教評會修正通過 93.1.6 本校管理學院 94 學年度第 3 次院務會議通過 94.10.25 本校管理學院 94 學年度第 1 次院務會議修正通過 95.01.05 本校管理學院 94 學年度第 299 次校教評會修正通過 96.4.18 本校管理學院 95 學年度第 5 次院教評會修正通過 96.5.11 本校管理學院 95 學年度第 308 次校教評會議修正通過 97.11.25 本校管理學院 97 學年度第 3 次院教評會修正通過 97.12.9 本校管理學院 97 學年度第 2 次院務會議修正通過 100.9.13 本校管理學院 100 學年度第 1 次院教評會修正通過 100.9.20 本校管理學院 100 學年度第 1 次院務會議修正通過 100.11.17 本校第 337 次校教師評審委員會修正通過 111.11.29 本校管理學院111學年度第2次院務會議修正通過 111.12.29 本校第420次校教師評審委員會修正通過

一、 為審議有關本院教師之聘任、聘期、升等、停聘、解聘、不續聘、延長服務、借調、出國 講學、研究、進修、教授及副教授休假研究、年資加薪、教師資遣原因之認定及其他依法 令應行審議之事項，依本校教師評審委員會設置辦法設置管理學院教師評審委員會(以下簡 稱本會)。

二、 本會委員包括當然委員、專任教授代表，以及校教評會委員保障名額等。 當然委員包括院長及各系所主管；專任教授代表由當然委員以外之專任教授組成；校教評 會委員保障名額為當年度續任校教評會委員之教師。其中專任教授代表以及校教評會委員 保障名額合計為當然委員人數多一名，任期一年與學年同，連選得連任。

三、 本會置主任委員一人，由院長兼任。

四、 本院依第一條規定應審議之事項，均須先經由系所教評會通過後提本會審議。

五、本會審議事項依據教育部頒訂暨本校訂定相關法令規定辦理。

六、本會會議不定期舉行，開會時討論案議決，依下列人數比例辦理：

（一）審議教師停聘、解聘、不續聘案件依教師法規定之出席及審議通 過比例辦理。

（二）審議教師聘任案件應有全體委員二分之一以上出席，並經出席 委員三分之二以上同 意，始得通過。

（三）審議教師升等案件應有全體委員三分之二以上出席，擬升等教師應符合本校(含系、 院)升等相關條件規定，始得通過。

（四）前三款以外之議案，除法規另有規定外，應經全體委員二分之一 以上出席及出席委 員二分之一以上之審議通過。

當然委員有正當理由，無法出席，得由法定職務代理人代理出席。

七、 為保障教師權益，本會於審議第一條規定事項時，如以投票方式表決，其為空白票、廢票 及棄權票以不同意票處理。

八、 本會委員對於評審案件涉及本人、配偶、三親等之血親、姻親、有個人利害關係者，或於 審議教師聘任、升等、延長服務等資格審查案件時，不得低階高審，應自行迴避，不得參 與評審。

有具體事實足認本會委員對於評審案件有偏頗之虞者，申請人得向本會申請該委員迴避， 並應舉其原因事實。委員中有前述應行迴避之情事者，不計入出席委員人數。

九、 本會開會時，得邀請有關人員列席說明。

十、 本要點經本會及院務會議通過，提校教評會審議通過，陳請校長核定後實施，修正時亦同。",201909101347010540.md,202302080949360049.md,"['國立中山大學管理學院教師評審委員會', '國立中山大學管理學院校長遴選委員會']",管理學院↔管理學院,國立中山大學管理學院校長遴選委員會↔國立中山大學管理學院教師評審委員會,5.0,5.0,5.0,5.0,5.0,2.0,5.0
請問國立中山大學管理學院的海外交換獎助金申請資格有哪些條件？此外，國際經營管理碩士學程的學生在申請學位考試前，海外交換計畫有何相關要求？,根據國立中山大學管理學院薪傳學海圓夢國際交流獎助金要點，申請海外交換獎助金的資格包括：學士生需為本院非當學期畢業且已註冊學生，具中華民國國籍並在臺灣設有戶籍，申請前一學期學業總平均七十分以上及操行成績八十分以上，已獲國外大學入學許可或正申請赴國外大學修讀，且未獲本國政府及本校提供之出國獎助金（西灣領航及學海飛颺除外）。碩士生除上述資格外，若未修課需有指導教授推薦，雙聯學位學生可於就讀期間申請。申請期限為每年四月一日至十五日，需提交相關申請文件。根據國際經營管理碩士學程學位考試相關規定，學生在申請學位考試前，原則上須參加國際交換學生計畫，至本校認可的海外學校選讀並至少抵免取得6至9學分的管理相關專業課程；外籍生不須參加海外交換；本籍生若有國外就讀一學期以上經歷，經學程核可後可免除海外交換。,"[""<1-hop>  [202509051806010699.md]\n\n國立中山大學管理學院薪傳學海圓夢國際交流獎助金要點\n\nCollege of Management\n\nGuidelines for NSYSU-CM Alumni Study-Abroad Scholarship\n\n99 年 10 月 13 日 99 學年度第 3 次主管會議修正通過 Amended and approved by the 3 rd Directors' Council on October 13, 2010 100 年 7 月 20 日 99 學年度第 13 次主管會議修正通過 Amended and approved by the 13 th Directors' Council on July 20, 2011 102 年 3 月 27 日 104 年第 10 次主管會議修正通過 Amended and approved by the 10 th Directors' Council on March 27, 2013 105 年 3 月 23 日 104 學年度第 11 次主管會議修正通過 Amended and approved by the 11 th Directors' Council on March 23, 2016 108 年 11 月 26 日 108 學年度第 2 次院務會議修正通過 Amended and approved by the 2 nd College Affairs Council on November 26, 2019 108 年 12 月 11 日 校長核定 Approved by the University President on December 11, 2019 110 年 6 月 10 日 校長核定 Approved by the University President on June 10, 2021 113 年 9 月 11 日 113 學年度第 1 次主管會議修正通過 Amended and approved by the 1 st Directors' Council on September 11, 2024 113 年 9 月 24 日 113 學年度第 1 次院務會議修正通過 Amended and approved by the 1 st College Affairs Council on September 24, 2024 113 年 10 月 7 日 校長核定 Approved by the University President on October 7, 2024\n\n一、 宗旨為提升本院學士與碩士級學生出國交流意願，拓展其國際觀，並\n\n促進本院國際學術交流學習之目的，特訂定本要點。\n\nI. Purpose\n\nTo encourage the College's bachelor and master students' willingness to study abroad, to expand students' international perspectives, and to promote the College's international academic relations and learning, the College established the 'Guidelines for NSYSU-CM Alumni Study-Abroad Scholarship' (hereinafter referred to as 'the Guidelines').\n\n二、 獎助類別\n\nII. Award Category\n\n( 一 ) 雙聯學位\n\nDual-degree program\n\n( 二 ) 出國交換\n\nOverseas exchange\n\n( )\n\n三 為期三個月以上之短期研修且至少修習兩門專業課程\n\nShort-term study (at least three months duration and at least two professional courses enrollment)\n\n三、 申請資格\n\nIII. Eligibility Requirements\n\n( 一 ) 學士生：\n\nUndergraduate students\n\n本院非當學期畢業之學生，並於申請時已註冊者；\n\n(1) The College's students who have not graduated in the current semester and are registered at the time of application;\n\n具中華民國國籍者，並在臺灣地區設有戶籍之本國學生；\n\n(2) Students who have the nationality of Taiwan R.O.C. and have a household registration in Taiwan;\n\n申請前一學期學業總平均七十分以上及操行成績八十分以上；\n\nStudents who have an overall academic average of at least 70 points and a conduct grade of at least 80 points in the semester prior to the\n\n(3) application;\n\n已獲國外大學入學許可或正進行申請赴國外大學修讀者；\n\nStudents who have been granted admission to a foreign university or is\n\n(4) applying to study at a foreign university;\n\n未獲本國政府及本校提供之出國獎助金 ( 西灣領航及學海飛颺除 外 ) 。\n\n(5) Students who have not received scholarships from the government or the University (except for the awardee of Si Wan Trek Scholarship and awardee of MOE Study Abroad Programs)\n\n( 二 ) 碩士生除具上述資格外，尚須符合：\n\nIn addition to the above requirements, master students must also meet the following requirements:\n\n1.\n\n如未修課者，需有指導教授推薦。\n\n(1) If the students have not taken any courses, a recommendation from the supervisor is required;\n\n就讀 NTU 英國諾丁漢特倫特大學雙學位者 可於就讀期間申 請。\n\n(2) Dual-degree students of the Nottingham Trent University in the United Kingdom can apply during their study period\n\n四、 審查方式\n\nIV. Application Review\n\n( 一 ) 由副院長為召集人，召集院內教師及捐款校友代表成立審查委員會\n\n查審，審核通過後公告獎助名單。\n\nThe Associate Dean of the College will convene several members from the College faculty and alumni giving representative to form the review committee. The list of scholarships will be announced upon review and approval by the committee\n\n1.\n\n( 二 ) 本獎助學金考量申請人申請之學校、地區、學費、研修期間及家庭\n\n狀況等因素核定施行。推薦考量因素：\n\nThe scholarship decision will take applicant's exchange university, region of study, tuition, study period, and family condition into consideration. The recommended consideration factors are as follows:\n\n1.\n\n(1)\n\n符合中低收入戶條件者；\n\nStudents from low- to middle-income households\n\n參加管院重點交流學校；\n\n(2)\n\nKey partner schools exchange students\n\n3.\n\n(3)\n\n參加本院雙聯學位；\n\nDual-degree students\n\n參加本院之 ACT 學程者。\n\n(4)\n\nACT program students\n\n至本院姊妹校交換者。\n\n(5) Sister school exchange students\n\n6.\n\n(6)\n\n其他。\n\nOther categories\n\n五、 獎助金額及期間出國期間生活費及機票費補助 ( 機票費補助亞洲地區上 限一萬、其他地區上限三萬元 ) 。獎助名額、金額視當年度經費調整。獎助 期間依審查委員會決議辦理。\n\nV.\n\nA living allowance and an airfare subsidy (the airfare subsidy up to NT$10,000 in Asia or up to NT$30,000 in other continents) will be provided during the adjusted according to the annual funding. The period of the scholarship is subject to the decision of the review committee.\n\nScholarship Amount and Duration period of study abroad. The number and amount of scholarship awardees will be\n\n六、 申請期限及方式申請日期為每年四月一日至十五日止。申請者應檢具 相關申請文件，向管理學院國際交流辦公室提出申請，逾期不受理，每人 限申請乙次。\n\nVI.\n\nApplication Deadline and Process\n\nThe application period is from April 1 st to 15 th every year. Applicants shall submit relevant application documents to the College's International Relations and Accreditation Office. Each applicant is limited to one application.\n\n七、 申請文件\n\nVII. Application\n\n( 一 ) 申請表格 ( 管院網頁下載 ) ；\n\n1.\n\nApplication form (available on the College's webpage);\n\n( 二 ) 赴國外大學研讀入學許可或其他錄取佐證文件 ( 如錄取公告等 ) ；\n\nAdmission permission letter or other supporting documents (such as admission announcement) from the foreign university;\n\n( 三 ) 前一學期成績單；\n\nA copy of transcript of the prior semester;\n\n( 四 ) 身分證及學生證 ( 預加蓋註冊章 )\n\n正反面影本；\n\nA copy of both sides of the ID and a copy of the student ID (registration stamp required);\n\n( 五 ) 個人履歷 ( 一頁 A4) ；\n\n5.\n\nRésumé (one A4-size page);\n\n( 六 ) 家長同意書 ( 學士生 )\n\n6.\n\n；\n\nParental consent form (for undergraduate students);\n\n( 七 ) 如為清寒條件者，應檢附區 ( 鄉 ) 公所開立之低收入戶、或中低收入證 明；\n\nA document of low-income or low-medium income issued by district or\n\ntown office (for underprivileged students);\n\n( 八 ) 出國交流讀書計畫書\n\nA study plan during the exchange\n\n八、 領獎文件：\n\nVIII. Documents for the Scholarship\n\n( 一 ) 赴國外大學研讀入學許可影本\n\n1.\n\nA copy of admission permission letter from the foreign university;\n\n( 二 ) 機票購買證明 ( 含票價 ) ；\n\n2.\n\nA proof of airline ticket purchase (including fares);\n\n( 三 ) 簽證影本或簽證申請佐證文件 ( 如簽證繳費證明等\n\n)\n\nA copy of the visa or supporting documents for visa application (such as the visa payment);\n\n( 四 ) 切結書 ( 於公告網頁下載 ) 。\n\n4.\n\nAn affidavit (available on the announcement webpage)\n\n九、 受獎人義務\n\nIX. Obligations of the Awardees\n\n( 一 ) 頇提供詳實資料，如後經發現申請資料有虛偽情事，即取消其受獎 資格，無條件全額歸還獎助學金並負法律責任；\n\n1.\n\nThe recipients shall provide true and correct application documents, if any false information or statements were found, the recipient shall be deemed\n\nto have forfeited the scholarship and shall return the full amount of the scholarship received\n\n( 二 ) 需與本院簽訂切結書，且需配合本校 / 院舉辦之出國交流說明會及經 驗分享等相關活動。\n\nThe recipients shall sign an affidavit with the College and attend the overseas exchange seminars and experience sharing activities hosted by the University or the College\n\n( 三 ) 需服務 10 小時，協助院務之相關事宜。\n\nThe recipients are required to assist the College's exchange affairs for 10 hours\n\n( 四 ) 需撰寫感謝函感謝給獎人，並需出席公開活動。\n\nThe recipients are required to write a scholarship thank-you letter to the sponsors and attend public events upon request\n\n( 五 ) 因故變更、未履行或中斷交換計畫者，視為放棄獎助資格，頇立即 償還已領取之全額獎助學金。唯因不可抗力因素變更交換計畫者， 依審查委員會決議辦理，若有未盡事宜，得依本院國際交流辦公室 主任決行。\n\nIf the recipients change, pause, or choose to not fulfill the exchange due to personal reasons, the recipients shall be deemed to have forfeited their scholarship and shall immediately return the full amount of the scholarship received. However, if the exchange plan is changed due to force majeure factors, the decision of the review committee shall be followed. Issues not covered in the review meeting shall be managed by the International Relations and Accreditation Office Director\n\n一 〇 、 經費來源\n\n由本院募款經費專款專用、高階經營碩士學程在職專班及國際學程項下 經費支應。經費由業界捐助者，本獎學金得由捐款人冠名發給。\n\nX.\n\nFunding Resources\n\nThe funding of this scholarship is funded by the College's fundraising for the special use, supported by the Executive Master of Business Administration (EMBA) and the international programs' funding. For sponsor funds, the scholarship may be awarded in the name of the sponsor.\n\n一一、 本辦法經本院院務會議通過，陳校長核定後實施；修正時亦同。\n\nXI. Regulation and Amendments\n\nThis regulation, as well as its amendments, are effective upon approval by the College Affairs Council and the University President."", ""<2-hop>  [202106291430100475.md]\n\nNational Sun Yat-sen University\n\nRegulations Governing International Business MBA Degree Examination\n\n-Approved by the 2 nd College Affaires Meeting in Academic Year 2006-2007, January 17 th , 2007\n\n-Approved by the 4 th College Affaires Meeting in Academic Year 2013-2014, April 29 th , 2014\n\n-Approved by the 4 th College Affaires Meeting in Academic Year 2016-2017, May 9 th , 2016\n\n-Approved by the 2 nd College Affaires Meeting in Academic Year 2017-2018, December 5 th , 2017\n\n-Approved by the 4 th College Affaires Meeting in Academic Year 2019-2020, May 8 th , 2019\n\n-Approved by the 2 nd College Affaires Meeting in Academic Year 2019-2020, November 26 th , 2019\n\n-Approved by the 3 rd College Affaires Meeting in Academic Year 2019-2020, March 10 th , 2020\n\n-Approved by the 2 nd College Affaires Meeting in Academic Year 2020-2021, December 1 st , 2020\n\n-Approved by the President of NSYSU, December 14 th ,2020\n\n(For Students enrolled in academic year 2021)\n\nThis Regulations Governing International Business MBA Degree Examination (the Regulations) are enacted in accordance with 'Degree Conferral Law' and the Enforcement Rules thereof of Ministry of Education and 'Academic Regulations,' 'Implementation Bylaws for Ph. D. and Master Degree Examination' and 'Guidelines for Selection of Advisors' of National Sun Yat-sen University (NSYSU).\n\nMaximum year of study: 1 to 4 years in accordance with Ministry of Education regulations (excluding reserved admission and suspension duration).\n\nCredits and requirement for the course:\n\ni. Any course selected by the student must be approved by the Advisor or the International Business MBA (IBMBA) director (the Director).\n\nii. Before student applying for the degree examination, the student must complete all the regulated courses and have acquired more credits than the minimum graduation credits.\n\niii. Before applying for the thesis oral defense, the local students need to participate overseas exchange program: study abroad at the universities / institutes acknowledged by NSYSU, and acquire more than 6 credits from management related courses approved by IBMBA. Whereas foreign students do not need to participate overseas exchange program. However, those local students who have studied abroad in university or above for one or more semester, after approved by IBMBA, may not participate the overseas exchange program.\n\nThesis regulations and advisor selection:\n\ni. A thesis advisor must be an assistant professor or above, as well as qualified of being a master's examination committee member in accordance with the Degree Conferral Law.\n\nii. A thesis advisor should be selected within the College of Management. However, if the college lack related research area or suitable teacher, the student could select advisor from other department/college in NSYSU or experts or scholars outside of NSYSU, while arranging another College of Management faculty as co-advisor.\n\niii. The thesis advisor, after retiring or resigning from the university, may continue advising the student. However, the student must arrange another College of Management faculty as coadvisor.\n\niv. Before student applies for co-advisor from IBMBA, both advisors must approve the student's Thesis Proposal.\n\nIf the student need to change advisor, the student must acquire written consent from both original advisor and new advisor.\n\ni. Thesis and degree examination must be in English.\n\nMaster's Degree Examination:\n\ni. Regulations for Thesis Oral Defense:\n\na. Before taking the Master's Degree Examination, the student must meet the requirement for all courses, be approved by the thesis advisor and apply for the degree examination in due time according to NSYSU regulation.\n\nb. The member of Master's Degree Examination Committee should be assistant professor or higher. The committee is composed of 3 to 5 members. Members exclude the thesis advisor should account for more than 1/2 of all committee members.\n\nc. The thesis oral defense should be held during the 2 nd semester in the 2 nd year of IBMBA program.\n\nii. Other related regulations:\n\na. The students who fail the degree examination and haven't complete the year of study could take re-examination in the next semester or next academic year. The re-examination can only be taken once, and the student who fail the re-examination will be expelled according to NSYSU regulations.\n\nb. Language proficiency test: International students should reach Chinese proficiency, TOCFL score level 2 (A2) or New HSK score level 2.\n\nThe students who fail to pass TOCFL score level 2 (A2) or New HSK score level 2, may need to take the Chinese test at least once and provide at least 2 semesters or 100 hours Chinese course certificate from Chinese Learning Center which affiliated to universities in Taiwan or from Taipei Language Institute in order to exempt from the graduation requirements.\n\n(This language proficiency test can also be applied for students enrolled in (or before) academic year 2020)\n\nGraduation: Graduate students who meet the requirement of aforesaid regulations may apply for graduation, and receive degree from NSYSU.\n\nThe Regulations shall be implemented upon approval by the College Affaires Meeting, sign by the president of NSYSU and released, and the same shall apply as to amendment hereto.\n\nFor the avoidance of doubt in English version regulation, Chinese version will be prevailing.\n\n英文法規翻譯內容若有疑義 , 以中文法規為主\n\n國立中山大學管理學院\n\n國際經營管理碩士學程研究生學位考試相關規定\n\n96.1.17 九十五學年度第 2 次院務會議通過\n\n103.4.29 一 0 二學年度第 4 次院務會議通過\n\n106.5.9 一 0 五學年度第 4 次院務會議通過\n\n106.12.05 一 0 六學年度第 2 次院務會議通過\n\n106.12.28 經校長核定\n\n107.01.02 發布\n\n108.05.08 一 0 七學年度第 4 次院務會議通過\n\n108.05.28 經校長核定\n\n108.11.26 一 0 八學年度第 2 次院務會議通過\n\n108.12.20 經校長核定\n\n109.03.10 一 0 八學年度第 3 次院務會議通過\n\n109.04.10 經校長核定\n\n109.12.01 一 0 九學年度第 2 次院務會議通過\n\n109.12.14 經校長核定\n\n( 一一０學年度入學新生適用 )\n\n一、 依據教育部頒「學位授予法」 、本校「學則」 、 「研究生學位考試施行細則」 及「論文指導教授遴聘原則」訂定之。\n\n二、修業年限：依教育部規定一至四年 ( 不含保留入學及休學期間 ) 。\n\n三、學分及修課要求：\n\n1 、學生選課均須經指導教授或學程主任核可。\n\n2 、學生辦理學位考試前，須修畢規定之應修科目及最低畢業學分數。\n\n3 、學生於提出學位口試申請前，原則上須參加國際交換學生計畫，至本校所 認可之海外學校選讀並至少抵免取得 6-9 學分經本學程同意之管理相關\n\n專業課程；外籍生不須海外交換；本籍生具國外就讀一學期以上之大學 ( 含 以上 ) 經歷，經本學程核可後，可抵免海外交換。\n\n四、論文規定及指導教授選擇：\n\n、論文指導教授須為助理教授以上，並符合學位授予法學位考試委員之資\n\n1 格。\n\n2 、論文指導教授應以本院專任教師為指導原則，若因專業領域或本院師資 不足，得商請本校其他系所專任教師，或校外教師或專家學者擔任，惟須 另安排本院教師一人共同指導。\n\n3\n\n、論文指導教授若退休或離職，仍可繼續指導，惟須另安排本院教師一人 共同指導。\n\n4\n\n5\n\n6\n\n、共同指導時，論文計劃書須經兩位指導教授同意後，始得向本學程提出申 請。\n\n、研究生倘因故須更改已選定之指導教授，須獲得原指導教授及新指導教授 之書面同意後，始得更改。\n\n、碩士論文撰寫及學位考試須以英文進行，論文須附上中文摘要。\n\n五、碩士學位考試：\n\n1\n\n、論文口試規定：\n\n研究生須符合修課要求相關規定後，經指導教授同意並於學校\n\n（ 1 ） 規定期限內提出申請，始得舉行學位考試。\n\n（ 2 ） 學位考試委員應為助理教授以上教師；考試委員會置委員三至五\n\n人，委員中，指導教授以外之考試委員人數應達二分之一以上。\n\n（ 3 ） 口試時間以研二下學期為原則。\n\n2 、其他：\n\n(1) 學位考試成績不及格而其修業年限尚未屆滿者，得於次學期或次 學年舉行重考，重考以一次為限，經重考一次仍不及格者，依本 校學則規定應令退學。\n\n（ 2 ）外語能力要求：外籍生須於學位考試申請前，提出須通過 TOCFL A2 或 HSK 2 級檢核證明；若無法提出證明者，可修習臺灣任一 所大學之華語中心 ( 含中華語文研習所 ) 二學期 ( 含 ) 以上 ( 即修習時 數至少 100 小時以上 ) ，並提供修業證明，即符合畢業規定。 ( 本 條文亦適用 109 學年度 ( 含 ) 前入學學生 )\n\n六、畢業：符合上述之各項規定者，得申請畢業，由學校授予學位。\n\n七、本規定經院務會議通過，簽請校長核定後施行，修訂時亦同。""]",teacher,Misspelled queries,short,"<1-hop>  [202509051806010699.md]

國立中山大學管理學院薪傳學海圓夢國際交流獎助金要點

College of Management

Guidelines for NSYSU-CM Alumni Study-Abroad Scholarship

99 年 10 月 13 日 99 學年度第 3 次主管會議修正通過 Amended and approved by the 3 rd Directors' Council on October 13, 2010 100 年 7 月 20 日 99 學年度第 13 次主管會議修正通過 Amended and approved by the 13 th Directors' Council on July 20, 2011 102 年 3 月 27 日 104 年第 10 次主管會議修正通過 Amended and approved by the 10 th Directors' Council on March 27, 2013 105 年 3 月 23 日 104 學年度第 11 次主管會議修正通過 Amended and approved by the 11 th Directors' Council on March 23, 2016 108 年 11 月 26 日 108 學年度第 2 次院務會議修正通過 Amended and approved by the 2 nd College Affairs Council on November 26, 2019 108 年 12 月 11 日 校長核定 Approved by the University President on December 11, 2019 110 年 6 月 10 日 校長核定 Approved by the University President on June 10, 2021 113 年 9 月 11 日 113 學年度第 1 次主管會議修正通過 Amended and approved by the 1 st Directors' Council on September 11, 2024 113 年 9 月 24 日 113 學年度第 1 次院務會議修正通過 Amended and approved by the 1 st College Affairs Council on September 24, 2024 113 年 10 月 7 日 校長核定 Approved by the University President on October 7, 2024

一、 宗旨為提升本院學士與碩士級學生出國交流意願，拓展其國際觀，並

促進本院國際學術交流學習之目的，特訂定本要點。

I. Purpose

To encourage the College's bachelor and master students' willingness to study abroad, to expand students' international perspectives, and to promote the College's international academic relations and learning, the College established the 'Guidelines for NSYSU-CM Alumni Study-Abroad Scholarship' (hereinafter referred to as 'the Guidelines').

二、 獎助類別

II. Award Category

( 一 ) 雙聯學位

Dual-degree program

( 二 ) 出國交換

Overseas exchange

( )

三 為期三個月以上之短期研修且至少修習兩門專業課程

Short-term study (at least three months duration and at least two professional courses enrollment)

三、 申請資格

III. Eligibility Requirements

( 一 ) 學士生：

Undergraduate students

本院非當學期畢業之學生，並於申請時已註冊者；

(1) The College's students who have not graduated in the current semester and are registered at the time of application;

具中華民國國籍者，並在臺灣地區設有戶籍之本國學生；

(2) Students who have the nationality of Taiwan R.O.C. and have a household registration in Taiwan;

申請前一學期學業總平均七十分以上及操行成績八十分以上；

Students who have an overall academic average of at least 70 points and a conduct grade of at least 80 points in the semester prior to the

(3) application;

已獲國外大學入學許可或正進行申請赴國外大學修讀者；

Students who have been granted admission to a foreign university or is

(4) applying to study at a foreign university;

未獲本國政府及本校提供之出國獎助金 ( 西灣領航及學海飛颺除 外 ) 。

(5) Students who have not received scholarships from the government or the University (except for the awardee of Si Wan Trek Scholarship and awardee of MOE Study Abroad Programs)

( 二 ) 碩士生除具上述資格外，尚須符合：

In addition to the above requirements, master students must also meet the following requirements:

1.

如未修課者，需有指導教授推薦。

(1) If the students have not taken any courses, a recommendation from the supervisor is required;

就讀 NTU 英國諾丁漢特倫特大學雙學位者 可於就讀期間申 請。

(2) Dual-degree students of the Nottingham Trent University in the United Kingdom can apply during their study period

四、 審查方式

IV. Application Review

( 一 ) 由副院長為召集人，召集院內教師及捐款校友代表成立審查委員會

查審，審核通過後公告獎助名單。

The Associate Dean of the College will convene several members from the College faculty and alumni giving representative to form the review committee. The list of scholarships will be announced upon review and approval by the committee

1.

( 二 ) 本獎助學金考量申請人申請之學校、地區、學費、研修期間及家庭

狀況等因素核定施行。推薦考量因素：

The scholarship decision will take applicant's exchange university, region of study, tuition, study period, and family condition into consideration. The recommended consideration factors are as follows:

1.

(1)

符合中低收入戶條件者；

Students from low- to middle-income households

參加管院重點交流學校；

(2)

Key partner schools exchange students

3.

(3)

參加本院雙聯學位；

Dual-degree students

參加本院之 ACT 學程者。

(4)

ACT program students

至本院姊妹校交換者。

(5) Sister school exchange students

6.

(6)

其他。

Other categories

五、 獎助金額及期間出國期間生活費及機票費補助 ( 機票費補助亞洲地區上 限一萬、其他地區上限三萬元 ) 。獎助名額、金額視當年度經費調整。獎助 期間依審查委員會決議辦理。

V.

A living allowance and an airfare subsidy (the airfare subsidy up to NT$10,000 in Asia or up to NT$30,000 in other continents) will be provided during the adjusted according to the annual funding. The period of the scholarship is subject to the decision of the review committee.

Scholarship Amount and Duration period of study abroad. The number and amount of scholarship awardees will be

六、 申請期限及方式申請日期為每年四月一日至十五日止。申請者應檢具 相關申請文件，向管理學院國際交流辦公室提出申請，逾期不受理，每人 限申請乙次。

VI.

Application Deadline and Process

The application period is from April 1 st to 15 th every year. Applicants shall submit relevant application documents to the College's International Relations and Accreditation Office. Each applicant is limited to one application.

七、 申請文件

VII. Application

( 一 ) 申請表格 ( 管院網頁下載 ) ；

1.

Application form (available on the College's webpage);

( 二 ) 赴國外大學研讀入學許可或其他錄取佐證文件 ( 如錄取公告等 ) ；

Admission permission letter or other supporting documents (such as admission announcement) from the foreign university;

( 三 ) 前一學期成績單；

A copy of transcript of the prior semester;

( 四 ) 身分證及學生證 ( 預加蓋註冊章 )

正反面影本；

A copy of both sides of the ID and a copy of the student ID (registration stamp required);

( 五 ) 個人履歷 ( 一頁 A4) ；

5.

Résumé (one A4-size page);

( 六 ) 家長同意書 ( 學士生 )

6.

；

Parental consent form (for undergraduate students);

( 七 ) 如為清寒條件者，應檢附區 ( 鄉 ) 公所開立之低收入戶、或中低收入證 明；

A document of low-income or low-medium income issued by district or

town office (for underprivileged students);

( 八 ) 出國交流讀書計畫書

A study plan during the exchange

八、 領獎文件：

VIII. Documents for the Scholarship

( 一 ) 赴國外大學研讀入學許可影本

1.

A copy of admission permission letter from the foreign university;

( 二 ) 機票購買證明 ( 含票價 ) ；

2.

A proof of airline ticket purchase (including fares);

( 三 ) 簽證影本或簽證申請佐證文件 ( 如簽證繳費證明等

)

A copy of the visa or supporting documents for visa application (such as the visa payment);

( 四 ) 切結書 ( 於公告網頁下載 ) 。

4.

An affidavit (available on the announcement webpage)

九、 受獎人義務

IX. Obligations of the Awardees

( 一 ) 頇提供詳實資料，如後經發現申請資料有虛偽情事，即取消其受獎 資格，無條件全額歸還獎助學金並負法律責任；

1.

The recipients shall provide true and correct application documents, if any false information or statements were found, the recipient shall be deemed

to have forfeited the scholarship and shall return the full amount of the scholarship received

( 二 ) 需與本院簽訂切結書，且需配合本校 / 院舉辦之出國交流說明會及經 驗分享等相關活動。

The recipients shall sign an affidavit with the College and attend the overseas exchange seminars and experience sharing activities hosted by the University or the College

( 三 ) 需服務 10 小時，協助院務之相關事宜。

The recipients are required to assist the College's exchange affairs for 10 hours

( 四 ) 需撰寫感謝函感謝給獎人，並需出席公開活動。

The recipients are required to write a scholarship thank-you letter to the sponsors and attend public events upon request

( 五 ) 因故變更、未履行或中斷交換計畫者，視為放棄獎助資格，頇立即 償還已領取之全額獎助學金。唯因不可抗力因素變更交換計畫者， 依審查委員會決議辦理，若有未盡事宜，得依本院國際交流辦公室 主任決行。

If the recipients change, pause, or choose to not fulfill the exchange due to personal reasons, the recipients shall be deemed to have forfeited their scholarship and shall immediately return the full amount of the scholarship received. However, if the exchange plan is changed due to force majeure factors, the decision of the review committee shall be followed. Issues not covered in the review meeting shall be managed by the International Relations and Accreditation Office Director

一 〇 、 經費來源

由本院募款經費專款專用、高階經營碩士學程在職專班及國際學程項下 經費支應。經費由業界捐助者，本獎學金得由捐款人冠名發給。

X.

Funding Resources

The funding of this scholarship is funded by the College's fundraising for the special use, supported by the Executive Master of Business Administration (EMBA) and the international programs' funding. For sponsor funds, the scholarship may be awarded in the name of the sponsor.

一一、 本辦法經本院院務會議通過，陳校長核定後實施；修正時亦同。

XI. Regulation and Amendments

This regulation, as well as its amendments, are effective upon approval by the College Affairs Council and the University President.","<2-hop>  [202106291430100475.md]

National Sun Yat-sen University

Regulations Governing International Business MBA Degree Examination

-Approved by the 2 nd College Affaires Meeting in Academic Year 2006-2007, January 17 th , 2007

-Approved by the 4 th College Affaires Meeting in Academic Year 2013-2014, April 29 th , 2014

-Approved by the 4 th College Affaires Meeting in Academic Year 2016-2017, May 9 th , 2016

-Approved by the 2 nd College Affaires Meeting in Academic Year 2017-2018, December 5 th , 2017

-Approved by the 4 th College Affaires Meeting in Academic Year 2019-2020, May 8 th , 2019

-Approved by the 2 nd College Affaires Meeting in Academic Year 2019-2020, November 26 th , 2019

-Approved by the 3 rd College Affaires Meeting in Academic Year 2019-2020, March 10 th , 2020

-Approved by the 2 nd College Affaires Meeting in Academic Year 2020-2021, December 1 st , 2020

-Approved by the President of NSYSU, December 14 th ,2020

(For Students enrolled in academic year 2021)

This Regulations Governing International Business MBA Degree Examination (the Regulations) are enacted in accordance with 'Degree Conferral Law' and the Enforcement Rules thereof of Ministry of Education and 'Academic Regulations,' 'Implementation Bylaws for Ph. D. and Master Degree Examination' and 'Guidelines for Selection of Advisors' of National Sun Yat-sen University (NSYSU).

Maximum year of study: 1 to 4 years in accordance with Ministry of Education regulations (excluding reserved admission and suspension duration).

Credits and requirement for the course:

i. Any course selected by the student must be approved by the Advisor or the International Business MBA (IBMBA) director (the Director).

ii. Before student applying for the degree examination, the student must complete all the regulated courses and have acquired more credits than the minimum graduation credits.

iii. Before applying for the thesis oral defense, the local students need to participate overseas exchange program: study abroad at the universities / institutes acknowledged by NSYSU, and acquire more than 6 credits from management related courses approved by IBMBA. Whereas foreign students do not need to participate overseas exchange program. However, those local students who have studied abroad in university or above for one or more semester, after approved by IBMBA, may not participate the overseas exchange program.

Thesis regulations and advisor selection:

i. A thesis advisor must be an assistant professor or above, as well as qualified of being a master's examination committee member in accordance with the Degree Conferral Law.

ii. A thesis advisor should be selected within the College of Management. However, if the college lack related research area or suitable teacher, the student could select advisor from other department/college in NSYSU or experts or scholars outside of NSYSU, while arranging another College of Management faculty as co-advisor.

iii. The thesis advisor, after retiring or resigning from the university, may continue advising the student. However, the student must arrange another College of Management faculty as coadvisor.

iv. Before student applies for co-advisor from IBMBA, both advisors must approve the student's Thesis Proposal.

If the student need to change advisor, the student must acquire written consent from both original advisor and new advisor.

i. Thesis and degree examination must be in English.

Master's Degree Examination:

i. Regulations for Thesis Oral Defense:

a. Before taking the Master's Degree Examination, the student must meet the requirement for all courses, be approved by the thesis advisor and apply for the degree examination in due time according to NSYSU regulation.

b. The member of Master's Degree Examination Committee should be assistant professor or higher. The committee is composed of 3 to 5 members. Members exclude the thesis advisor should account for more than 1/2 of all committee members.

c. The thesis oral defense should be held during the 2 nd semester in the 2 nd year of IBMBA program.

ii. Other related regulations:

a. The students who fail the degree examination and haven't complete the year of study could take re-examination in the next semester or next academic year. The re-examination can only be taken once, and the student who fail the re-examination will be expelled according to NSYSU regulations.

b. Language proficiency test: International students should reach Chinese proficiency, TOCFL score level 2 (A2) or New HSK score level 2.

The students who fail to pass TOCFL score level 2 (A2) or New HSK score level 2, may need to take the Chinese test at least once and provide at least 2 semesters or 100 hours Chinese course certificate from Chinese Learning Center which affiliated to universities in Taiwan or from Taipei Language Institute in order to exempt from the graduation requirements.

(This language proficiency test can also be applied for students enrolled in (or before) academic year 2020)

Graduation: Graduate students who meet the requirement of aforesaid regulations may apply for graduation, and receive degree from NSYSU.

The Regulations shall be implemented upon approval by the College Affaires Meeting, sign by the president of NSYSU and released, and the same shall apply as to amendment hereto.

For the avoidance of doubt in English version regulation, Chinese version will be prevailing.

英文法規翻譯內容若有疑義 , 以中文法規為主

國立中山大學管理學院

國際經營管理碩士學程研究生學位考試相關規定

96.1.17 九十五學年度第 2 次院務會議通過

103.4.29 一 0 二學年度第 4 次院務會議通過

106.5.9 一 0 五學年度第 4 次院務會議通過

106.12.05 一 0 六學年度第 2 次院務會議通過

106.12.28 經校長核定

107.01.02 發布

108.05.08 一 0 七學年度第 4 次院務會議通過

108.05.28 經校長核定

108.11.26 一 0 八學年度第 2 次院務會議通過

108.12.20 經校長核定

109.03.10 一 0 八學年度第 3 次院務會議通過

109.04.10 經校長核定

109.12.01 一 0 九學年度第 2 次院務會議通過

109.12.14 經校長核定

( 一一０學年度入學新生適用 )

一、 依據教育部頒「學位授予法」 、本校「學則」 、 「研究生學位考試施行細則」 及「論文指導教授遴聘原則」訂定之。

二、修業年限：依教育部規定一至四年 ( 不含保留入學及休學期間 ) 。

三、學分及修課要求：

1 、學生選課均須經指導教授或學程主任核可。

2 、學生辦理學位考試前，須修畢規定之應修科目及最低畢業學分數。

3 、學生於提出學位口試申請前，原則上須參加國際交換學生計畫，至本校所 認可之海外學校選讀並至少抵免取得 6-9 學分經本學程同意之管理相關

專業課程；外籍生不須海外交換；本籍生具國外就讀一學期以上之大學 ( 含 以上 ) 經歷，經本學程核可後，可抵免海外交換。

四、論文規定及指導教授選擇：

、論文指導教授須為助理教授以上，並符合學位授予法學位考試委員之資

1 格。

2 、論文指導教授應以本院專任教師為指導原則，若因專業領域或本院師資 不足，得商請本校其他系所專任教師，或校外教師或專家學者擔任，惟須 另安排本院教師一人共同指導。

3

、論文指導教授若退休或離職，仍可繼續指導，惟須另安排本院教師一人 共同指導。

4

5

6

、共同指導時，論文計劃書須經兩位指導教授同意後，始得向本學程提出申 請。

、研究生倘因故須更改已選定之指導教授，須獲得原指導教授及新指導教授 之書面同意後，始得更改。

、碩士論文撰寫及學位考試須以英文進行，論文須附上中文摘要。

五、碩士學位考試：

1

、論文口試規定：

研究生須符合修課要求相關規定後，經指導教授同意並於學校

（ 1 ） 規定期限內提出申請，始得舉行學位考試。

（ 2 ） 學位考試委員應為助理教授以上教師；考試委員會置委員三至五

人，委員中，指導教授以外之考試委員人數應達二分之一以上。

（ 3 ） 口試時間以研二下學期為原則。

2 、其他：

(1) 學位考試成績不及格而其修業年限尚未屆滿者，得於次學期或次 學年舉行重考，重考以一次為限，經重考一次仍不及格者，依本 校學則規定應令退學。

（ 2 ）外語能力要求：外籍生須於學位考試申請前，提出須通過 TOCFL A2 或 HSK 2 級檢核證明；若無法提出證明者，可修習臺灣任一 所大學之華語中心 ( 含中華語文研習所 ) 二學期 ( 含 ) 以上 ( 即修習時 數至少 100 小時以上 ) ，並提供修業證明，即符合畢業規定。 ( 本 條文亦適用 109 學年度 ( 含 ) 前入學學生 )

六、畢業：符合上述之各項規定者，得申請畢業，由學校授予學位。

七、本規定經院務會議通過，簽請校長核定後施行，修訂時亦同。",202509051806010699.md,202106291430100475.md,"['overseas exchange', 'overseas exchange program']",管理學院↔管理學院,overseas exchange↔overseas exchange program,5.0,5.0,5.0,5.0,5.0,2.0,5.0
根據國立中山大學管理學院的規定，頂尖期刊清單中包含哪些期刊？這些期刊在學術研究績優教師審查中有何重要性？,"根據國立中山大學管理學院的規定，頂尖期刊清單中包含多種國際知名期刊，如 Academy of Management Journal、Academy of Management Review、Accounting, Organizations and Society、Administrative Science Quarterly、American Economic Review、Contemporary Accounting Research、Econometrica、Entrepreneurship Theory and Practice、Harvard Business Review、Health Service Research、Human Relations、Human Resource Management、Information Systems Research、Journal of Accounting and Economics、Journal of Accounting Research、Journal of Applied Psychology、Journal of Business Ethics、Journal of Business Venturing、Journal of Communication、Journal of Consumer Psychology、Journal of Consumer Research、Journal of Finance、Journal of Financial and Quantitative Analysis、Journal of Financial Economics、Journal of International Business Studies、Journal of Management、Journal of Management Information Systems、Journal of Management Studies、Journal of Marketing、Journal of Marketing Research、Journal of Operations Management、Journal of Political Economy、Journal of the Academy of Marketing Science、Journal on Computing、Management Science、Manufacturing and Service Operations Management、Marketing Science、MIS Quarterly、Operations Research、Organization Science、Organization Studies、Organizational Behavior and Human Decision Processes、Production and Operations Management、Public Administration Review、Quarterly Journal of Economics、Research Policy、Review of Accounting Studies、Review of Economic Studies、Review of Finance、The Review of Financial Studies、Sloan Management Review、Strategic Entrepreneurship Journal、Strategic Management Journal、The Accounting Review 等。這些頂尖期刊在學術研究績優教師審查中具有重要性，因為發表於這些期刊的論文，若作者為第一作者或通訊作者，將可獲得80點的計點，且這些論文是申請學術研究績優教師的重要評分依據之一。","[""<1-hop>  [202205161415510248.md]\n\n主旨\n\n為鼓勵本院專任教師之學術研究`教學投入與國際交流'以期提陞本院之整體研究及教\n\n二`經費\n\n每年由院視經費狀況確認獎助總額及各項分配額'本要點第三點第(一)款年度經費上限 為新臺幣150萬元'並由本院高階管理碩士在職專班項下經費支應\n\n三`支出範圍 :經費依下列範圍支應\n\n1.本院專任助理教授以上於應洽妥國外具備發錶國際頂尖期刊(如附件1)之經驗'且願赴 著作 .\n\n(一)獎助教師邀請國際學者赴本院進行短期合作研究及合著論文.\n\n2.計畫書以簡明扼要為原則'但應說明擬邀請對象之能力'與申請人合作之具體做法及 預期成效 .\n\n4.客座人員在院期間應與申請人合作完成至少一篇學術研究論文'並投稿至國際知名期\n\n3.申請案審查通過後'每件補助上限至多新臺幣30萬元'包括客座人員機票住宿諮 議`演講費及短期訪問相關學術等費用\n\n5.客座人員在院期間應進行至少一場公開學術演講\n\n7.每年度補助件數視補助總額度確認之\n\n6.論文完成接受後'本院申請教授方可再提齣申請\n\n8.本項獎助申請時間為每年四月份;而執行期間可延至隔年七月底執行完畢.\n\n(二)提陞本院整體學術發展專案 由院依發展需求'提齣專案獎助方案'本案經院主管會議報告後執行之.\n\n國立中山大學管理學院提陞學術發展管理要點\n\n93.4.15 92學年度第2次臨時院務會議通過 102.11.19 102學年度第2次院務會議修正通過 102.12.09 校長核定 107.05.08 106學年度第4次院務會議修正通過 109.05.12 108學年度第4次院務會議修正通過 111.05.10 110學年度第4次院務會議修正通過\n\n國立中山大學提陞學術發展管理要點\n\n附件1 頂尖期刊清單列示\n\n編號 期刊 FT UTD 中山管院逸仙學 者期刊獎勵 Academy ofManagement Journal 2 Academy ofManagement Review 3 Accounting, Organizations and Society 4 Administrative Science Quarterly 5 American Economic Review 6 Contemporary Accounting Research 7 Econometrica 8 Entrepreneurship Theory and Practice 9 Harvard Business Review 10 Health Service Research 11 Human Relations 12 Human Resource Management 13 Information Systems Research 14 Journal of Accounting and Economics 15 Journal of Accounting Research 16 Journal of Applied Psychology 17 Journal ofBusiness Ethics 18 Journal ofBusiness Venturing 19 Journal ofCommunication 20 Journal of Consumer Psychology 21 Journal ofConsumer Research 22 Journal ofFinance 23 Journal ofFinancial and Quantitative Analysis 24 Journal ofFinancial Economics 25 Journal ofInternational Business Studies 26 Journal ofManagement 27 Journal ofManagement Information Systems 28 Journal ofManagement Studies 29 Journal ofMarketing 30 Journal ofMarketing Research 31 Journal ofOperations Management 32 Journal ofPolitical Economy 33 Journal ofthe Academy ofMarketing Science 34 Journal on Computing 35 Management Science 36 Manufacturing and Service Operations Management 37 Marketing Science\n\n編號 期刊 FT UTD 中山管院逸仙學 者期刊獎勵 38 MIS Quarterly 39 Operations Research 40 Organization Science 41 Organization Studies 42 Organizational Behaviorand Human Decision Processes 43 Production and Operations Management 44 Public Administration Review 45 Quarterly Journal ofEconomics 46 Research Policy 47 Review of Accounting Studies 48 Review ofEconomic Studies 49 Review ofFinance 50 The Review ofFinancial Studies 51 Sloan Management Review 52 Strategic Entrepreneurship Journal 53 Strategic Management Journal 54 The Accounting Review 55 Health Affairs 醫管新增 56 Medical Care 醫管新增 57 Milbank Quarterly 醫管新增 58 Journal ofHealth Economics 醫管新增 59 行傳新增 60 Joural of Computer-Mediated Communication 行傳新增 61 MEDIA PSYCHOLOGT 行傳新增 62 行傳新增 63 Journal ofPublic Administration Research and Theory 公事新增 64 Public Management Review  PAR) 公事新增 65 Journal ofPolicy Analysis and Management GJPAM) 公事新增 66 Monprofit and Voluntary Sector Quarterly lTVSO 公事新增 67 IEEE Transactions on Knowledge and Data Engineering 資管新增 68 IEEE Transactions on Software Engineering 資管新增 69 Artificial Intelligence 資管新增"", '<2-hop>  [202503311429080298.md]\n\n國立中山大學管理學院學術研究績優教師審查要點\n\n100.04.19 99學年度第 4次院務會議通過 103.10.16 本校第 363次教師評審委員會修正通過 105.04.26 104 學年度第 4次院務會議修正通過 107.05.08106 學年度第 4次院務會議修正通過 111.03.08 lll學年度第 3次院務會議修正通過 114.02.19 113 學年度第8次主管會議修正通過 114.03.13\n\n及留住大專校院特殊優秀人才實施規範_""特訂定管理學院學術研究績優教師審查要點 (以下簡稱本要點)\n\n二本院任職滿一年以上之編製內專任教師約聘教師`約聘研究人員\'且符合第三點所列計 畫三件與論文篇數二篇以上且至少一篇 SSCI或 SCIE規定者\'得申請學術研究績優教師\n\n三` 申請教師以四年內符合下列計點項目者\'依下列計點方式計算排序:\n\n計點項目 計點方式 備註 1.國家科學及技術委員會 (以下簡稱國科會)專 題研究計畫 2.國科會國際合作計畫主 持人 3.教育部教學實踐研究計 畫主持人 4.經全球產學營運及推廣 處認定之產學合作計畫 10 點/件 學術期刊 頂尖期刊 屬第一作者或通訊作者 1.已計入頂尖期刊者(如附件 1)\' 80 點/篇 不得再重複計 30點/篇 校教師所發表論文地址欄\'如有 兩個以上單位時\'以中山大學為 24 點/篇 第一單位之名義發表者為限\'且 兩個以上的本校作者將以排名在 前之作者或通訊作者(請附證 明)為執行對象. 3.除頂尖期刊外\'須為學生以外之 第一作者或論文通訊作者 4.上述備註內容所指學生應為本校 12 點/篇 之學生\'惟適用於 ll2年起發表 之學術論文 5.論文之採計\'以申請年度往前推 學術期刊 頂尖期刊 其他作者 學術期刊 SSCI 學術期刊 SSCI 排名 1o%(不含)~30%(含)18點/篇 學術期刊 SSCI 排名 3O%(不含)~70%(含)12點/篇 學術期刊 SCIE 學術期刊 SCIE\n\n排名 3O%(不含)~70%(含)6點/篇 TSSCI 為評比第一級期刊\'且2 篇為限 6點/篇 專書 以 2本為限 中文術期刊論文發錶及專書發錶獎勵要 9點/本_點_\'通過國科會審查獲得補助之 專章 以 2篇為限 英文 5點/章 中文 專書\'或經正式審查程序通過並齣 版具有 ISBM之學術專書(須檢附審 查程序文件及通過證明)\'同一篇 3點/章 專章或專書擇優獎勵\'不予重複獎\n\n四 申請及審查方式\n\n檢附佐證資料(如無檢附則不予採計)\'經係/所審核並核章後\'提送院彙整\n\n(二)申請件由主管會議審查後\'將審查結果依研發處公告名額\'送研發處確認\n\n(三)凡發錶於本校研究發展處所列舉之加強實質審查出版社`掠奪性期刊 Predator/ Journal)及巨錄期刊 (Megajournal)清單之學術論文將不予採計\n\n五`本要點經院務會議通過後實施\'修正時亦同\n\n國立中山大學管理學院學術研究績優教師審查要點\n\n附件1!頂尖期刊清單列示\n\n編號 期刊 FT UTD 中山管院逸仙學者期刊獎勵 Academy ofManagement Journal 2 Academy ofManagement Review 3 Account Organizations and Society ing; 4 Administrative Science Quarterly 5 American Economic Review 6 Contemporary Accounti Research ing 7 Econometrica 8 Entrepreneurship Theory and Practice 9 Harvard Business Review 10 Health Service Research 11 Human Relations 12 Human Resource Management 13 Information Systems Research 14 Journal of Accounting and Economics 15 Journal of Accounting Research 16 Journal ofApplied Psycho logy 17 Journal ofBusiness Ethics 18 Journal ofBusiness Venturing 19 Journal ofCommunication 20 Journal of Consumer Psychology 21 Journal of Consumer Research 22 Journal ofFinance 23 Journal ofFinancial and Quantitative Analysis 24 Journal ofFinancial Economics 25 Journal ofInternational Business Studies 26 Journal ofManagement 27 Journal ofManagement Information Systems\n\nJournal ofManagement Studies 28 29 Journal ofMarketing 30 Journal of Marketing Research 31 Journal of Operations Management 32 Journal ofPolitical Economy 33 Journal ofthe Academy ofMarketing Science Journal on Computing 34 35 Management Science 36 Manufacturing and Service Operations Management Marketing Science 38 MIS Quarterly\n\n編號 期刊 FT UTD 中山管院逸仙學者期刊獎勵 39 Operations Research 40 Organization Science 41 Organization Studies 42 Organizational Behavior and Human Decision Processes 43 Production and Operations Management 44 Public Administration Review 45 Quarterly Journal ofEconomics 46 Research Policy 47 Review ofAccounting Studies 48 Review ofEconomic Studies 49 Review ofFinance 50 The Review ofFinancial Studies 51 Sloan Management Review 52 Strategic Entrepreneurship Journal 53 Strategic Management Journal 54 The Accounting Review']",teacher,Poor grammar,short,"<1-hop>  [202205161415510248.md]

主旨

為鼓勵本院專任教師之學術研究`教學投入與國際交流'以期提陞本院之整體研究及教

二`經費

每年由院視經費狀況確認獎助總額及各項分配額'本要點第三點第(一)款年度經費上限 為新臺幣150萬元'並由本院高階管理碩士在職專班項下經費支應

三`支出範圍 :經費依下列範圍支應

1.本院專任助理教授以上於應洽妥國外具備發錶國際頂尖期刊(如附件1)之經驗'且願赴 著作 .

(一)獎助教師邀請國際學者赴本院進行短期合作研究及合著論文.

2.計畫書以簡明扼要為原則'但應說明擬邀請對象之能力'與申請人合作之具體做法及 預期成效 .

4.客座人員在院期間應與申請人合作完成至少一篇學術研究論文'並投稿至國際知名期

3.申請案審查通過後'每件補助上限至多新臺幣30萬元'包括客座人員機票住宿諮 議`演講費及短期訪問相關學術等費用

5.客座人員在院期間應進行至少一場公開學術演講

7.每年度補助件數視補助總額度確認之

6.論文完成接受後'本院申請教授方可再提齣申請

8.本項獎助申請時間為每年四月份;而執行期間可延至隔年七月底執行完畢.

(二)提陞本院整體學術發展專案 由院依發展需求'提齣專案獎助方案'本案經院主管會議報告後執行之.

國立中山大學管理學院提陞學術發展管理要點

93.4.15 92學年度第2次臨時院務會議通過 102.11.19 102學年度第2次院務會議修正通過 102.12.09 校長核定 107.05.08 106學年度第4次院務會議修正通過 109.05.12 108學年度第4次院務會議修正通過 111.05.10 110學年度第4次院務會議修正通過

國立中山大學提陞學術發展管理要點

附件1 頂尖期刊清單列示

編號 期刊 FT UTD 中山管院逸仙學 者期刊獎勵 Academy ofManagement Journal 2 Academy ofManagement Review 3 Accounting, Organizations and Society 4 Administrative Science Quarterly 5 American Economic Review 6 Contemporary Accounting Research 7 Econometrica 8 Entrepreneurship Theory and Practice 9 Harvard Business Review 10 Health Service Research 11 Human Relations 12 Human Resource Management 13 Information Systems Research 14 Journal of Accounting and Economics 15 Journal of Accounting Research 16 Journal of Applied Psychology 17 Journal ofBusiness Ethics 18 Journal ofBusiness Venturing 19 Journal ofCommunication 20 Journal of Consumer Psychology 21 Journal ofConsumer Research 22 Journal ofFinance 23 Journal ofFinancial and Quantitative Analysis 24 Journal ofFinancial Economics 25 Journal ofInternational Business Studies 26 Journal ofManagement 27 Journal ofManagement Information Systems 28 Journal ofManagement Studies 29 Journal ofMarketing 30 Journal ofMarketing Research 31 Journal ofOperations Management 32 Journal ofPolitical Economy 33 Journal ofthe Academy ofMarketing Science 34 Journal on Computing 35 Management Science 36 Manufacturing and Service Operations Management 37 Marketing Science

編號 期刊 FT UTD 中山管院逸仙學 者期刊獎勵 38 MIS Quarterly 39 Operations Research 40 Organization Science 41 Organization Studies 42 Organizational Behaviorand Human Decision Processes 43 Production and Operations Management 44 Public Administration Review 45 Quarterly Journal ofEconomics 46 Research Policy 47 Review of Accounting Studies 48 Review ofEconomic Studies 49 Review ofFinance 50 The Review ofFinancial Studies 51 Sloan Management Review 52 Strategic Entrepreneurship Journal 53 Strategic Management Journal 54 The Accounting Review 55 Health Affairs 醫管新增 56 Medical Care 醫管新增 57 Milbank Quarterly 醫管新增 58 Journal ofHealth Economics 醫管新增 59 行傳新增 60 Joural of Computer-Mediated Communication 行傳新增 61 MEDIA PSYCHOLOGT 行傳新增 62 行傳新增 63 Journal ofPublic Administration Research and Theory 公事新增 64 Public Management Review  PAR) 公事新增 65 Journal ofPolicy Analysis and Management GJPAM) 公事新增 66 Monprofit and Voluntary Sector Quarterly lTVSO 公事新增 67 IEEE Transactions on Knowledge and Data Engineering 資管新增 68 IEEE Transactions on Software Engineering 資管新增 69 Artificial Intelligence 資管新增","<2-hop>  [202503311429080298.md]

國立中山大學管理學院學術研究績優教師審查要點

100.04.19 99學年度第 4次院務會議通過 103.10.16 本校第 363次教師評審委員會修正通過 105.04.26 104 學年度第 4次院務會議修正通過 107.05.08106 學年度第 4次院務會議修正通過 111.03.08 lll學年度第 3次院務會議修正通過 114.02.19 113 學年度第8次主管會議修正通過 114.03.13

及留住大專校院特殊優秀人才實施規範_""特訂定管理學院學術研究績優教師審查要點 (以下簡稱本要點)

二本院任職滿一年以上之編製內專任教師約聘教師`約聘研究人員'且符合第三點所列計 畫三件與論文篇數二篇以上且至少一篇 SSCI或 SCIE規定者'得申請學術研究績優教師

三` 申請教師以四年內符合下列計點項目者'依下列計點方式計算排序:

計點項目 計點方式 備註 1.國家科學及技術委員會 (以下簡稱國科會)專 題研究計畫 2.國科會國際合作計畫主 持人 3.教育部教學實踐研究計 畫主持人 4.經全球產學營運及推廣 處認定之產學合作計畫 10 點/件 學術期刊 頂尖期刊 屬第一作者或通訊作者 1.已計入頂尖期刊者(如附件 1)' 80 點/篇 不得再重複計 30點/篇 校教師所發表論文地址欄'如有 兩個以上單位時'以中山大學為 24 點/篇 第一單位之名義發表者為限'且 兩個以上的本校作者將以排名在 前之作者或通訊作者(請附證 明)為執行對象. 3.除頂尖期刊外'須為學生以外之 第一作者或論文通訊作者 4.上述備註內容所指學生應為本校 12 點/篇 之學生'惟適用於 ll2年起發表 之學術論文 5.論文之採計'以申請年度往前推 學術期刊 頂尖期刊 其他作者 學術期刊 SSCI 學術期刊 SSCI 排名 1o%(不含)~30%(含)18點/篇 學術期刊 SSCI 排名 3O%(不含)~70%(含)12點/篇 學術期刊 SCIE 學術期刊 SCIE

排名 3O%(不含)~70%(含)6點/篇 TSSCI 為評比第一級期刊'且2 篇為限 6點/篇 專書 以 2本為限 中文術期刊論文發錶及專書發錶獎勵要 9點/本_點_'通過國科會審查獲得補助之 專章 以 2篇為限 英文 5點/章 中文 專書'或經正式審查程序通過並齣 版具有 ISBM之學術專書(須檢附審 查程序文件及通過證明)'同一篇 3點/章 專章或專書擇優獎勵'不予重複獎

四 申請及審查方式

檢附佐證資料(如無檢附則不予採計)'經係/所審核並核章後'提送院彙整

(二)申請件由主管會議審查後'將審查結果依研發處公告名額'送研發處確認

(三)凡發錶於本校研究發展處所列舉之加強實質審查出版社`掠奪性期刊 Predator/ Journal)及巨錄期刊 (Megajournal)清單之學術論文將不予採計

五`本要點經院務會議通過後實施'修正時亦同

國立中山大學管理學院學術研究績優教師審查要點

附件1!頂尖期刊清單列示

編號 期刊 FT UTD 中山管院逸仙學者期刊獎勵 Academy ofManagement Journal 2 Academy ofManagement Review 3 Account Organizations and Society ing; 4 Administrative Science Quarterly 5 American Economic Review 6 Contemporary Accounti Research ing 7 Econometrica 8 Entrepreneurship Theory and Practice 9 Harvard Business Review 10 Health Service Research 11 Human Relations 12 Human Resource Management 13 Information Systems Research 14 Journal of Accounting and Economics 15 Journal of Accounting Research 16 Journal ofApplied Psycho logy 17 Journal ofBusiness Ethics 18 Journal ofBusiness Venturing 19 Journal ofCommunication 20 Journal of Consumer Psychology 21 Journal of Consumer Research 22 Journal ofFinance 23 Journal ofFinancial and Quantitative Analysis 24 Journal ofFinancial Economics 25 Journal ofInternational Business Studies 26 Journal ofManagement 27 Journal ofManagement Information Systems

Journal ofManagement Studies 28 29 Journal ofMarketing 30 Journal of Marketing Research 31 Journal of Operations Management 32 Journal ofPolitical Economy 33 Journal ofthe Academy ofMarketing Science Journal on Computing 34 35 Management Science 36 Manufacturing and Service Operations Management Marketing Science 38 MIS Quarterly

編號 期刊 FT UTD 中山管院逸仙學者期刊獎勵 39 Operations Research 40 Organization Science 41 Organization Studies 42 Organizational Behavior and Human Decision Processes 43 Production and Operations Management 44 Public Administration Review 45 Quarterly Journal ofEconomics 46 Research Policy 47 Review ofAccounting Studies 48 Review ofEconomic Studies 49 Review ofFinance 50 The Review ofFinancial Studies 51 Sloan Management Review 52 Strategic Entrepreneurship Journal 53 Strategic Management Journal 54 The Accounting Review",202205161415510248.md,202503311429080298.md,"['頂尖期刊清單', '頂尖期刊']",管理學院↔管理學院,頂尖期刊清單↔頂尖期刊,5.0,3.05,5.0,5.0,5.0,2.0,5.0
國立中山大學文學院教師升等計分表中，學術產學研究績效、教學績效與服務績效各自的滿分是多少？此外，教師在申請升等時，參與跨域活動的最低場次要求及其計分方式為何？,根據國立中山大學文學院教師升等計分表，學術產學研究績效的滿分為70分（一般研究類）、70分（技術應用類）及60分（教學研究類）；教學績效的滿分為20分（一般研究類）、20分（技術應用類）及30分（教學研究類）；服務績效的滿分為10分。此外，教師申請升等時，須參與本學院辦理之跨系所跨領域對話座談、跨校際對話座談、跨國際學術交流對話、文苑沙龍及院相關學程開設等相關活動，至少7場次，每場次以1分計，最高可得7分，未達7場次者依實際參與場次數計分。,"['<1-hop>  [202509142212570727.md]\n\n國立中山大學文學院教師升等計分表\n\n年 12 月 29 日 111 學年度第 420 次校教評會審議通過，並自 111 學年度第 2 學期生效\n\n111\n\n系所（組） ：\n\n姓名：\n\n擬升等職級：\n\n現任職級生效日：\n\n年 月 日\n\n各類升等\n\nA. 學術產學研究績效 (A1+A2):\n\n(1) 一般研究類：滿分\n\n70 分\n\n(2) 技術應用類：滿分\n\n70 分\n\n(3) 教學研究類：滿分\n\n60 分\n\nA1: 學術研究成果外審成績：\n\n(a) 一般研究類：滿分\n\n52.5 分\n\n(b) 技術應用類：滿分\n\n28 分\n\n(c) 教學研究類：滿分\n\n36 分\n\nA2: 七年內本職級研究計畫獎助及學術成就：\n\n(a) 一般研究類：滿分\n\n17.5 分\n\n(b) 技術應用類：滿分\n\n42.0 分\n\n(c) 教學研究類：滿分\n\n24 分\n\n(4) 所有積分均僅採計現職級之績效，上一職級之研究產學績效不得計入； 有跨職級之績效，只可在其中一次升等計分。\n\n(5) 以經費計分之項目，金額不含本校相關配合款及移撥至校外共同主持人 之部分經費。\n\nB. 教學績效 :\n\n(1) 一般研究類 :\n\n滿分 20 分\n\n(2) 技術應用類 :\n\n滿分 20 分\n\n(3) 教學研究類 :\n\n滿分 30 分\n\nC. 服務績效 : 滿分 10 分\n\n擬申請升等類型：□一般研究類\n\n[ ] □ 技術應用類\n\n[ ] □教學研究類\n\n申請教師簽章：\n\n[ ] （ 日期\n\n年 月 日 ）\n\n範例]\n\n不予計分\n\n案例五\n\n50分\n\n8分\n\n案例四\n\n42分 [技術應用上限]\n\n12分\n\n案例三\n\n30分\n\n12.5分\n\n案例二\n\n17.5分 [一般研究上限]\n\n7.5分\n\n案例一\n\n10分\n\n10分\n\n10\n\n20\n\n30\n\n50\n\n(累計得分)\n\nA. 學術產學研究績效 (A1+A2) A1. 學術研究成果外審成績 項目 評分原則 - 以絕對分數採計 自評 審核 A1a 外審成績：審查人員（一） 依本校教師升等計分表、教師升等審查辦法、教師升等著作審查意見表及文學院教師升等 審查要點換算 A1b 外審成績：審查人員（二） A1c 外審成績：審查人員（三） A1d 外審成績：審查人員（四） A1e 外審成績：審查人員（五） 五位審查人員外審成績總和 總平均分數 總平均分數 A1. 小計 ( 以絕對分數採計 ) □ (1) 一般研究類： A1 滿分 52.5 分（ A 佔 70 ％； A1:75% ， A2:25 ％） □ (2) 技術應用類： A1 滿分 28 分（ A 佔 70 ％； A1: 40% ， A2:60 ％） □ (3) 教學研究類： A1 滿分 36 分（ A 佔 60 ％； A1: 60% ， A2:40 ％）\n\nA2. 七年內本職級研究計畫獎助及學術成就\n\n評分原則\n\n以絕對分數採計\n\n「國家科學及技術委員會」專題研究計畫：研發處依計畫核定清單認定之。\n\n(1)\n\n(a)\n\n個別型研究計畫：計畫執行六個月\n\n(b)\n\n整合型研究計畫（多張核定清單）：\n\nI.\n\n總主持人：每件\n\n分。\n\nII.\n\n子計畫主持人\n\n(c)\n\n不包括總主持人\n\n：每件\n\n以上，每年第一件得\n\n分。\n\n單一整合型研究計畫（單張核定清單）：研發處依計畫核定清單認定之，本項總計最高\n\n補助經費累計達\n\n100\n\n萬元，得\n\n分；超過\n\n100\n\n萬元之部分，每\n\n50\n\n萬元得\n\n0.5\n\n分，第二件得\n\n分。計畫執行未達六個月，每件\n\n分。\n\n分為上限。\n\n分。每件計畫共同主持人配分必須於計畫核定後\n\n個月內，由所有主持人簽名確認個人貢獻，依比例分配計分，且不得再變更分配比例。\n\n註：同一計畫在\n\nA2\n\n之第\n\n(1)\n\n項、第\n\n(2)\n\n項、第\n\n項、第\n\n(6)\n\n(7)\n\n項僅能擇一計分。\n\n項目\n\n(1)\n\n「國家科\n\n學及技術\n\n委員會」\n\n專題計畫\n\n自評\n\n審核\n\n(2) 「國家科 學及技術 委員會」 人文社會 實踐計畫 (2) 「國家科學及技術委員會」人文社會實踐計畫 : 研發處依計畫核定清單認定之，本項總計最高 8 分為上限。 補助經費累計達 100 萬元，得 1 分；超過 100 萬元之部分，每 50 萬元得 0.5 分。每件計畫共同主持人配分必須於計畫核定後 3 個月內，由所有主持人簽名確認個人貢獻，依比例分配計分，且不得再變更分配比例。 註：同一計畫在 A2 之第 (1) 項、第 (2) 項、第 (6) 項、第 (7) 項僅能擇一計分。 (3) 教育部專 題研究計 畫 (3) 教育部專題研究計畫 : 研發處依計畫核定清單認定之。本項總計最高以 8 分為上限。 計畫執行六個月 ( 含 ) 以上，每年第一件得 2 分，第二件得 3 分。計畫執行未達六個月，每件 1 分。 註：同一計畫在 A2 之第 (3) 項與第 (12) 項、第 (13) 項僅能擇一計分。 (4) 學術榮譽 (4) 學術榮譽 : 研發處認定之。同一獎項最多採計二次 (a) 總統級及政府院級學術類獎項，每次得 15 分 (b) 教育部學術獎，每次得 14 分 (c) 「國家科學及技術委員會」傑出研究獎，每次得 12 分 (d) 年度高被引用學者，每次得 5 分 (e) 除「國家科學及技術委員會」與教育部之外，其他行政院所屬中央二級機關學術類獎項，每次得 5 分 (f) 國際知名學會 ( 會員人數 1 萬人以上 ) 獎項，每次得 5 分 (g) 中央研究院年輕學者研究著作獎，每次得 4 分 (h) 「國家科學及技術委員會」吳大猷先生紀念獎，每次得 4 分 (i) 國內財團法人獎項 ( 獎項成立 10 年以上 ) ，每次得 1~3 分 (j) 國內學會獎項 ( 學會成立 20 年以上 ) ，每次得 2 分 (k) 本校傑出教師 ( 學術研究類 ) 獎勵，每次得 2 分 (l) 本校績優教師 ( 學術研究類 ) 獎勵，每次得 1 分 (5) 出版學術 研究專書 (5) 出版學術研究專書 ( 有國際標準書號 ISBN) ：應檢附學術審查證明，經研發處召開專家審查委員會認定之。本項總計最高 4 分為上限。 (a) 個人學術著作專書：外文每一本 1~4 分、中文每一本 1~3 分 (b) 翻譯著作：每一本 1~2 分 註 : 多人著作：同一本著作依個人貢獻比例分配計分，且須由所有作者簽名確認個人貢獻，經委員會認定後不得再變更貢獻 比例。 (6) 「國家科 學及技術 委員會」 產學合作 研究計畫 (6) 「國家科學及技術委員會」產學合作研究計畫及文化部計畫：產學處依計畫核定清單認定之。 (a) 「國家科學及技術委員會」產學合作個人型研究計畫及文化部計畫 ( 限文學院 ): 計畫執行六個月 ( 含 ) 以上，每年第一件 得 2 分，第二件得 3 分。計畫執行未達六個月，每件 1 分。 (b) 「國家科學及技術委員會」產學合作整合型研究計畫 ( 多張核定清單 ): I. 總主持人 : 每件 3 分。 II. 共同主持人 ( 不包含總主持人 ): 每件 2 分。 (c) 「國家科學及技術委員會」產學合作單一整合型研究計畫 ( 單張核定清單 ) ：本項總計最高 8 分為上限。 補助經費累計達 100 萬元，得 1 分；超過 100 萬元之部分，每 50 萬元得 0.5 分。每件計畫共同主持人配分必須於計畫核定 後 3 個月內，由所有主持人簽名確認個人貢獻，依比例分配計分，且不得再變更分配比例。 註 : 同一計畫在 A2 之第 (1) 項、第 (2) 項、第 (6) 項、第 (7) 項僅能擇一計分。\n\n(7) 政府機關 產學合作 計畫 (7) 政府機關產學合作計畫 ( 不含「國家科學及技術委員會」產學計畫 ): 產學處依計畫核定清單認定之。 (a) 文 ( 劇藝系及音樂系除外 ) 、管、社、西灣學院，及海科院具有人文、法政、社經、管理專長等之政府機關委託產學合 作計畫：計畫累計金額達 40 萬元者得 1 分，超過 40 萬元之部份，每 10 萬元得 0.1 分。 (b) 文 ( 限劇藝系及音樂系 ) 之政府機關委託產學合作計畫：計畫累計金額達 20 萬元者得 0.5 分，超過 20 萬元之部份，每 5 萬 元得 0.1 分。 (c) 理、工、醫、海科院之政府機關委託產學合作計畫：計畫累計金額達 75 萬元者得 1 分，超過 75 萬元之部份，每 15 萬元 得 0.1 分。 註： I. 同一計畫在 A2 之第 (1) 項、第 (2) 項、第 (6) 項、第 (7) 項僅能擇一計分。 II. 每件計畫共同主持人配分必須於計畫核定後 3 個月內，由所有主持人簽名確認個人貢獻，依比例分配計分，且計畫執 行期間不得再變更分配比例。 (8) 非政府產 學合作計 畫 (8) 非政府機關 ( 企業與法人 ) 委託產學合作計畫 : 產學處依委託合約書認定之。 (a) 文 ( 劇藝系及音樂系除外 ) 、管、社、西灣學院，及海科院具有人文、法政、社經、管理專長等之非政府機關委託產學 合作計畫：計畫累計金額達 40 萬元者，得 1 分，超過 40 萬元之部份，每 10 萬元得 0.2 分。 (b) 文 ( 限劇藝系及音樂系 ) 之非政府機關委託產學合作計畫：計畫累計金額達 20 萬元者得 0.5 分，超過 20 萬元之部份，每 5 萬元得 0.125 分。 (c) 理、工、醫、海科院之非政府機關委託產學合作計畫：計畫累計金額達 75 萬元者得 1 分，超過 75 萬元之部份，每 15 萬 元得 0.2 分。 註：每件計畫共同主持人配分必須於計畫核定後 3 個月內，由所有主持人簽名確認個人貢獻，依比例分配計分，且計畫執 行期間不得再變更分配比例。 (9) 技術移轉 或著作授 權 (9) 技術移轉或著作授權 : 產學處依技轉合約認定之，主要發明人與產業界 ( 含企業與法人 ) 辦理技術移轉或著作授權，本項總 計最高 8 分為限。 (a) 以職務成果技術移轉或著作授權 : 累計授權金額達 20 萬元者，得 0.5 分；超過 20 萬元之部份，每 10 萬元得 0.2 分。 (b) 以中華民國獲證之發明或設計專利授權 : 累計授權金額達 20 萬元者，得 1 分；超過 20 萬元之部份，每 10 萬元得 0.2 分。 (c) 以美、日、歐盟等國外專利授權 : 累計授權金額達 20 萬元者得 1.5 分，超過 20 萬元之部份，每 10 萬元得 0.4 分。 (10) 專利 : 經產學處依發明專利證書認定之，主要發明人之研究成果以學校名義申請，獲得發明或設計專利；或以個人名義 申請，獲得之發明或設計專利讓與學校。以上與廠商共同申請者，皆不列計。本項總計最高 3 分為限。 (a) 中華民國專利 : 每件 0.5 分。 (b) 美、日、歐盟專利 : 每件 1 分。 (c) 其他國家專利，由產學處認定之，每件 0.1~0.5 分。 (10) 專利 (11) 產學榮譽 (11) 產學榮譽 : 產學處認定之。 (a) 總統級及政府院級產學類獎項；每次加 15 分。 (b) 「國家科學及技術委員會」傑出技術移轉貢獻獎，每次加 7.5 分。 (c) 經濟部國家產業創新獎，加 7.5 分。 (d) 經濟部智慧局國家發明創作獎，每次加 4 分。 (e) 除「國家科學及技術委員會」與經濟部之外，其他行政院所屬中央二級機關產學類獎項，每次得 3-4 分。 (f) 未來科技 ( 突破 ) 獎，每次加 2 分。 (g) 國家新創獎，每次加 2 分。 (h) 學術創業先鋒獎，每次加 2 分。 (i) 本校產學傑出獎或傑出教師 ( 產學研究類 ) 獎勵，每次得 2 分。 (j) 本校績優教師 ( 產學研究類 ) 獎勵，每次得 1 分。 註： I. 同一獎項最多採計二次。\n\nII. 每一獎項共同主持人配分必須於獎項核定後 3 個月內，由所有主持人簽名確認個人貢獻，依比例分配計分，且不得 再變更分配比例。 (12) 教育部教 學相關計 畫 (12) 教育部教學相關計畫 : 教務處依計畫核定清單認定之，本項總計最高以 8 分為上限。 (a) 個別型教學計畫主持人：計畫執行六個月 ( 含 ) 以上，每年第一件得 2 分，第二件得 3 分。計畫執行未達六個月，每件 1 分。 (b) 整合型教學計畫： I. 總主持人：每件 3 分。 II. 共同主持人 ( 不包括總主持人 ) ：每件 2 分。 III. 計畫參與教師（不含總主持人及共同主持人）：補助金額 600 萬元以上之計畫，每超過 50 萬元得採計 0.5 分，至多 採計 3 分，並依教師貢獻比例分配給計畫參與教師，每位至多 1.5 分。 (13) 教育部教 學實踐研 究計畫 註：同一計畫在 A2 之第 (3) 項、第 (12) 項、第 (13) 項僅能擇一計分。 (13) 教育部教學實踐研究計畫 : 教務處依計畫核定清單認定之。 每年每件得 2 分；若計畫獲教育部頒績優獎項者，再加 1 分。 註：同一計畫在 A2 之第 (3) 項、第 (12) 項、第 (13) 項僅能擇一計分。 (14) 其他 學術（含 文藝）成 就 (14) 其他學術（含文藝）成就（由院教評會審議，至多 2.1 分） A2. 小計 □ (1) 一般研究類： A2 滿分 17.5 分（ A 佔 70 ％； A1:75% ， A2:25 ％） □ (2) 技術應用類： A2 滿分 42 分（ A 佔 70 ％； A1: 40% ， A2:60 ％） □ (3) 教學研究類： A2 滿分 24 分（ A 佔 60 ％； A1: 60% ， A2:40 ％） A. 學術 產學研 究績效 小計 學術產學研究績效（ A1+A2 ）小計 □ (1) 一般研究類： A 滿分 70 分 □ (2) 技術應用類： A 滿分 70 分 □ (3) 教學研究類： A 滿分 60 分 小計 小計\n\nB. 教學績效 指標項目 評分原則（以絕對分數採計） 各項目採計上限 自評 審核 指標項目 □ (1) 一般研究類 : 滿分 20 分 □(2)技術應用類 : 滿分 20 分 □(3)教學研究類 : 滿分 30 分 □一般研究類 : □技術應用類 : 滿分 20 分 □教學研究類 : 滿分 30 分 (1) 教學年資 在本校升等時職級滿三年為 7 分；超過三年部分每增加授課一學期加 0.2 分。他校年 資及育嬰留職停薪期間之年資折半計算。 8 分 8 分 (2) 教學貢獻 度 (a) 升等時職級近五年內學期平均授課時數： 每一時數得 0.5 分，主管或其他可抵減時數應加回計算，至多 5 分。（專班課程 時數併入計算。） (b) 教學當量： 教師於現職職級之平均教學當量達各學院前 10 ％者，每學期加計 0.2 分。 (c) 開設基礎必修課程 *: 教師開設大學部必修課程 ( 不含通識課程 ) ，每開一門加計 0.2 分，多人合授依授 課比例合計給 0.2 分。 (d) 開設通識課程 * ： I. 西灣學院主聘教師開設通識課程 ( 採計跨院選修、博雅及專業服務學習、必修 運動與健康課程、語文課程 ) ，每開一門加計 0.2 分；多人合授依授課比例合 計給 0.2 分。 ( 該項最多 2 分 ) II. 非西灣學院主聘教師支援開設通識課程 ( 採計博雅及專業服務學習課程、語 文課程 ) ，每開一門加計 0.4 分；多人合授依授課比例合計給 0.4 分。 ( 該項最 多 2 分 ) III. 非西灣學院主聘教師支援開設跨院選修通識課程，每開一門加計 0.2 分；多 人合授依授課比例合計給 0.2 分。 ( 該項最多 2 分 ) (e) 出版教科書 ( 有國際標準書號 ISBN) ，經院教評會認定，每本 1-2 分。 註：多人著作：同一本著作依個人貢獻比例分配計分，且須由所有作者簽名確 認個人貢獻，經院教評會認定後不得再變更貢獻比例。 7 分 8 分 (3) 教學榮譽 教學榮譽：教務處認定之。 (a) 教育部師鐸獎，每次 7.5 分。 (b) 教育部全國傑出通識教育教師獎，每次 7.5 分。 (c) 本校傑出教學獎 ( 教學傑出教師 ) ，每次 2 分。 (d) 本校優良教學獎 ( 教學績優教師 ) ，每次 1 分。 (e) 全國教育類貢獻獎（例如：教育部教育奉獻獎、社會教育貢獻獎、藝術教育貢獻 獎等），每次 5 分。 (f) 通識教育學會： I. 「終身成就榮譽」，每次 2 分 II. 「典範通識教師」，每次 1.5 分。 註：同一獎項最多採計二次 15 分 15 分\n\nB. 教學績效 教學優良 課程 獲頒校級教學優良課程，每門課程加 0.2 分。 2 分 3 分 (4) (5) 全英語授 課課程 * (a) 外文系專任教師每開一門全英語講授類課程，加 0.2 分；多人合授依授課比例合 計給 0.2 分。 ( 該項最多 2 分 ) (b) 非外文系專任教師每開一門全英語講授類課程，加 0.4 分；多人合授依授課比例 合計給 0.4 分。 ( 該項最多 4 分 ) 4 分 4 分 (6) 數位學習 課程績效 推動數位學習課程 ( 下面各項不重複計分 ) (a) 獲得教育部數位學習教材及課程認證： 每科教材或每門課程加 1 分；多人合製一門 ( 科 ) 依授課比例合計給 1 分。 (b) 通過本校數位課程認證： 每門課程加 0.5 分；多人合製一門 ( 科 ) 依授課比例合計給 0.5 分；教師開設開放 式課程，每門課程加 0.2 分；多人合製一門 ( 科 ) 依授課比例合計給 0.2 分。 (c) 國際合作 EMI 數位課程： 與國外教師合作開設 EMI 數位學分課程，每門課 0.5 分。 3 分 4 分 (7) 指導學生 研究績效 (a) 指導研究生論文得獎 指導研究生之碩博士學位論文得獎，由教務處認定，每件加計 1 分。 (b) 指導大專學生研究計畫 指導學生獲「國家科學及技術委員會」大專學生研究計畫，由研發處認定，每 件加 0.2 分。若計畫獲大專學生研究創作獎，每件再加 0.5 分。 4 分 4 分 (8) 執行卓越 教學計畫 與高教深 耕教學創 新計畫 （含擔任 學分學程 負責人） (9) (a) 執行由教務處審查之卓越教學計畫與高教深耕教學創新計畫案，每年每件 0.2 分。 (b) 擔任學分學程負責人，每學期每學程 0.1 分。若學程當學期在校修讀人數高於平 均值，加計 0.1 分；若學程當學年度領證人數高於平均值，再加計 0.1 分。 (c) 擔任全英語微學程及學分學程負責人，以上開 2 倍計分。 2 分 4 分 協助教師 提升教學 知能 (a) 擔任教學研習、工作坊等教學活動之主講者，或領航教師有實際輔導事實者，由 教務處認定，每場次 0.2 分。 (b) 擔任全英語教學研習、工作坊等教學活動之主講者，或經教務處推薦為教學觀摩 教師且有實際觀摩事實者，每場次 0.3 分。 (c) 對本校或各學院推動教學創新貢獻卓著者（如推動本校雙語教學計畫），經校內 程序簽核通過，由教務處認定，每件加計 0.2~0.5 分。 3 分 3 分\n\nB. 教學績效\n\n(10) 自我提升 教學知能 (a) 申請觀課服務教師：（本項最高 3 分） 申請觀課服務教師（含 EMI ）經教務處核准，且實際有觀課事實者，每次 0.3 分，若同儕觀課評量平均滿意度 6 分以上（七分量表），加計 0.3 分。 (b) 於本校任職後取得 EMI 教師培訓認證，並符合本校 EMI 教師培訓計畫者，每證 書 1 分（各級證書僅可採計一次），本項最高 3 分。 (c) 參與教學知能提升：（本項最高 2 分） 參與校內教學知能研習、工作坊或教師社群有具體事實者，由教務處認定，每 場次 0.1 分。 3 分 4 分 (11) 其他明顯 教學優良 或教學不 力，有具 體證據者 (11) ：其他明顯教學優良或教學不力，有具體證據者，由教評會適度加減分，最多 不得超過限分 0.6 分 0.9 分 B. 教學績 效小計 B. 教學績效 (1)-(11) 小計 □ (1) 一般研究類 : 滿分 20 分 □(2)技術應用類 : 滿分 20 分 □(3)教學研究類 : 滿分 30 分 小計 小計 備註： 1.* 有關「通識課程」、「全英語授課課程」及「基礎必修課程」依據「本校教學意見調查追蹤改善精進教學辦法」所訂，符合下列任 一條件者，不予計分： (1) 教學意見調查滿意度在 4.2 分以下（七分量表）。 (2) 教學意見調查滿意度在 4.9 分以下（七分量表），且該課程授課教師兩年內「畢業生對系所與任課教師滿意度問卷」回收卷數達 10 份以上，其對教師滿意度在 3.5 分以下（五分量表）或 4.9 分以下（七分量表）。 2. 所有積分均僅採計現職職級，上一職級之教學貢獻不得計入。\n\nC. 服務績效\n\n評分原則（絕對分數） 各項目採計上限 自評 審核 項目 服務評分 : （滿分 10 分） 滿分 10 分 (1) 校級會議代表 校級會議代表每學年 0.1 分 分 (2) 院級會議代表 院級會議代表每學年 0.1 分 分 (3) 校級服務 ( 由 (3-1)-(3-11) 加 總計分 ) 分 (3) 小計 (3) 小計 (3-1) 擔任編制內行政、學 術主管 (3-1) 擔任編制內行政、學術主管 : 擔任編制內一級主管每學期加 1 分，二級主管每學期加 0.5 分 ( 未滿一學期，以一 學期計算 ) 。如同時擔任二個以上行政或學術主管者，依上開標準分別採計計 分。 分 (3-2) 支援推廣教育課程 (3-2) 開設推廣教育課程，由全球產學營運及推廣處認定。 (a) 教師以講授推廣教育課程，累積收入達 100 萬元或累積貢獻校管理費達 10 萬元，得 0.5 分。收入超過 50 萬元或管理費超過 10 萬元，依比例計算。 (b) 教師開設隨班附讀課程且有學生修習者，每門課得計 0.1 分。 每門推廣教育課程不得重複計分，若為共授課程，必須由所有參與教師 簽名確認個人貢獻，依比例分配計分。 分 (3-3) 支援高中生多元學習 (3-3) 支援高中生多元學習 : 由教務處認定。 (a) 協助招生專業化相關事項，如擔任學系種子教師、於高中端交流活動擔 任主講人、審查高中學生自主學習計畫等，每件 0.1 分。 (b) 開放本校實驗室指導高中學生並有實際指導事實者 ( 若未透過教務處媒 介，則經系所認定，教務處複查 ) ，每學期 0.2 分。 ( 該項最多 2 分 ) (c) 教師支援高中特色課程（含 6 週以上之微課程），每開一門加計 0.5 分， 多人合授一門合計給 0.5 分。 ( 該項最多 2 分 ) 分\n\nC. 服務績效 (3-4) 指導學生參與競賽獲 獎 (3-4) (a) 國際競賽 : 指導本校學生參加國際競賽獲前三名，每件加 3 分，獲佳 作及得獎者每 件加 0.5 分。 (b) 政府單位舉辦之國內學術、產學與展演等競賽 : 指導本校學生參加國內學術、產學與展演等競賽，獲前三名每件加 1.5 分，獲佳作及得獎者每件加 0.25 分。 (C) 指導本校學生參加全國大專運動會及大專校院運動聯賽，獲前三名每次加 1.5 分，進入決賽未獲前三名每次加 0.25 分。 分 (3-5) 支援招生工作 (3-5) 支援招生工作 : 由教務處認定。 (a) 擔任教務處主辦之校內外招生宣導活動主講者，每次 0.1 分。 (b) 支援大考中心或企業委辦本校招生考試或本校自辦招生考試之相關工作 ( 含命題、入闈、監考、審查、口試等 ) ，每次 0.1 分。 分 (3-6) 推動性別平等教育 (3-6) 推動性別平等教育 : 由學務處認定。 推動性別平等教育工作，友善校園，每學年 0.2 分。 分 (3-7) 本校優良導師獎 (3-7) 本校優良導師獎，每次 1 分。 分 (3-8) 推動社團活動 : (3-8) 輔導社團活動及學生自治性組織 : 由學務處認定。 (a) 擔任學生會、宿委會、校內社團之指導老師或學生運動代表隊教練，每學 年 0.3 分。 (b) 擔任國際化和英語化學生社團之指導老師，每學年 0.4 分。 分 (3-9) 推動雙語校園 (3-9) 推動雙語校園， (a) 指標由教務處認定，其餘由國際處認定。 (a) 推動 English Corner 計畫，成效良好者。 ( 每學期 0.4 分 ) (b) 代表本校接洽校級國際合作聯盟 ( 例如 AIT 、 BRITISH COUNCIL 、 OSUN) 有 定期參與及合作成果者，可依其擔任本校代表之時間給予獎勵，每學期 0.5 分。 (c) 擔任校院系雙語化公文及會議資料之行政窗口，每學期 0.5 分。 分 （ 3-10 ） 推動校園藝文活動 (3-10) 參與或支援校級大型藝文活動（如：校慶等） ：由秘書室認定。 每次加 0.5 分。 分\n\nC. 服務績效 (3-11) 國際化指標 (3-11) 國際化指標，由國際處認定。 (a) 促成本校與外國學校洽簽雙聯學位教師 I. 外國學校排名在本校之前者， 每校 1 分。 II. 外國學校排名在本校之後者，每校 0.5 分。 (b) 國際招生活動 I. 教師自行聯繫參訪，每次 0.5 分。 II. 教師參與國際處安排招生展或參訪，每次 0.2 分。 III. 教師參與線上招生 Webinar ，每次 0.1 分。 (c) 指導外籍碩博士學位生 I. 每位博士生畢業，每人 0.5 分。 II. 每位畢業碩士生畢業，每人 0.2 分。 (d) 其他國際合作 I. 辦理跨國研習活動 ( 如 workshop, training 等 ) ，每場 0.2 分。 II. 參與國際合作計畫 ( 非研究類，如參與辦理國際大型活動、帶領學生 參與國際志工或活動等 ) ，每場 0.2 分。 III. 選送學生至國外合作單位學習，每人 0.2 分。 分 (4) 大型會議或活動 之籌備小組成員 大型會議或活動之籌備小組成員 每次 0.1-0.2 分（院教評會評定，至多 1 分） 1 分 (5) 院優良導師獎 院優良導師獎，每次 0.5 分 分 (6) 校外服務 校外服務（至多 0.8 分，院教評會評定） 0.8 分 C. 服務績效小計 C. 服務績效 (1)-(6) 及各類跨域活動參與至多 7 分 ( 依「國立中山大學文學 院教師升等審查評分細則」達基本門檻者 ) ，滿分 10 分 分 小計 小計 總分 (=A+B+C) 分', ""<2-hop>  [202509142240120737.md]\n\n國立中山大學文學院教師升等服務績效之各類跨域活動參與一覽表\n\nParticipation Form of Interdisciplinary Activities for Service Performance of Professorship Rank Promotion in the College of Liberal Arts\n\n系所（組） ：\n\n姓名：\n\n擬升等職級：\n\nDepartment/Institute Applicant's name Intended rank promotion\n\n場次 No. 活動日期 date (yyyy/mm/dd) 活動名稱 / 主辦 ( 協辦、參加 ) title of activity (organizer/co- organizer/participant) 系審核 approved by the department/institute 院審核 approved by the College 1 2 3 4 5 6 7\n\n申請教師簽章 Applicant's signature ：\n\n( 日期\n\nYYYY 年 MM 月 DD 日）\n\n註 Notes :\n\n一、 依國立中山大學文學院教師升等審查評分細則辦理，教師申請升等職級期間應完成 參與本學院辦理之「跨系所跨領域對話座談」 、 「跨校際對話座談」 、 「跨國際國際學 術交流對話」 、文苑沙龍及院相關學程開設等相關活動，至少 7 場次，每場次以 1 分 計，至多 7 分 ; 未達者 7 場次者，依實際參與場次數計算。\n\nAccording to Guidelines on the Detailed Implementation of the Evaluation of Professorship Rank Promotion , the faculty applying for rank promotion shall participate in at least seven College-organized activities at their current rank, such as interdepartmental or interdisciplinary dialogue forums, inter-university forums, international academic exchange events, and other related activities held by the College's affiliated units. Points shall be calculated based on the actual number of activities attended (one point each), with a maximum of 7 points granted.\n\n二、 本表請申請升等教師自行填列檢附，俾利計分。\n\nThe faculty applying for rank promotion shall complete and submit this form for accurate calculation.""]",curious student,Web search like queries,medium,"<1-hop>  [202509142212570727.md]

國立中山大學文學院教師升等計分表

年 12 月 29 日 111 學年度第 420 次校教評會審議通過，並自 111 學年度第 2 學期生效

111

系所（組） ：

姓名：

擬升等職級：

現任職級生效日：

年 月 日

各類升等

A. 學術產學研究績效 (A1+A2):

(1) 一般研究類：滿分

70 分

(2) 技術應用類：滿分

70 分

(3) 教學研究類：滿分

60 分

A1: 學術研究成果外審成績：

(a) 一般研究類：滿分

52.5 分

(b) 技術應用類：滿分

28 分

(c) 教學研究類：滿分

36 分

A2: 七年內本職級研究計畫獎助及學術成就：

(a) 一般研究類：滿分

17.5 分

(b) 技術應用類：滿分

42.0 分

(c) 教學研究類：滿分

24 分

(4) 所有積分均僅採計現職級之績效，上一職級之研究產學績效不得計入； 有跨職級之績效，只可在其中一次升等計分。

(5) 以經費計分之項目，金額不含本校相關配合款及移撥至校外共同主持人 之部分經費。

B. 教學績效 :

(1) 一般研究類 :

滿分 20 分

(2) 技術應用類 :

滿分 20 分

(3) 教學研究類 :

滿分 30 分

C. 服務績效 : 滿分 10 分

擬申請升等類型：□一般研究類

[ ] □ 技術應用類

[ ] □教學研究類

申請教師簽章：

[ ] （ 日期

年 月 日 ）

範例]

不予計分

案例五

50分

8分

案例四

42分 [技術應用上限]

12分

案例三

30分

12.5分

案例二

17.5分 [一般研究上限]

7.5分

案例一

10分

10分

10

20

30

50

(累計得分)

A. 學術產學研究績效 (A1+A2) A1. 學術研究成果外審成績 項目 評分原則 - 以絕對分數採計 自評 審核 A1a 外審成績：審查人員（一） 依本校教師升等計分表、教師升等審查辦法、教師升等著作審查意見表及文學院教師升等 審查要點換算 A1b 外審成績：審查人員（二） A1c 外審成績：審查人員（三） A1d 外審成績：審查人員（四） A1e 外審成績：審查人員（五） 五位審查人員外審成績總和 總平均分數 總平均分數 A1. 小計 ( 以絕對分數採計 ) □ (1) 一般研究類： A1 滿分 52.5 分（ A 佔 70 ％； A1:75% ， A2:25 ％） □ (2) 技術應用類： A1 滿分 28 分（ A 佔 70 ％； A1: 40% ， A2:60 ％） □ (3) 教學研究類： A1 滿分 36 分（ A 佔 60 ％； A1: 60% ， A2:40 ％）

A2. 七年內本職級研究計畫獎助及學術成就

評分原則

以絕對分數採計

「國家科學及技術委員會」專題研究計畫：研發處依計畫核定清單認定之。

(1)

(a)

個別型研究計畫：計畫執行六個月

(b)

整合型研究計畫（多張核定清單）：

I.

總主持人：每件

分。

II.

子計畫主持人

(c)

不包括總主持人

：每件

以上，每年第一件得

分。

單一整合型研究計畫（單張核定清單）：研發處依計畫核定清單認定之，本項總計最高

補助經費累計達

100

萬元，得

分；超過

100

萬元之部分，每

50

萬元得

0.5

分，第二件得

分。計畫執行未達六個月，每件

分。

分為上限。

分。每件計畫共同主持人配分必須於計畫核定後

個月內，由所有主持人簽名確認個人貢獻，依比例分配計分，且不得再變更分配比例。

註：同一計畫在

A2

之第

(1)

項、第

(2)

項、第

項、第

(6)

(7)

項僅能擇一計分。

項目

(1)

「國家科

學及技術

委員會」

專題計畫

自評

審核

(2) 「國家科 學及技術 委員會」 人文社會 實踐計畫 (2) 「國家科學及技術委員會」人文社會實踐計畫 : 研發處依計畫核定清單認定之，本項總計最高 8 分為上限。 補助經費累計達 100 萬元，得 1 分；超過 100 萬元之部分，每 50 萬元得 0.5 分。每件計畫共同主持人配分必須於計畫核定後 3 個月內，由所有主持人簽名確認個人貢獻，依比例分配計分，且不得再變更分配比例。 註：同一計畫在 A2 之第 (1) 項、第 (2) 項、第 (6) 項、第 (7) 項僅能擇一計分。 (3) 教育部專 題研究計 畫 (3) 教育部專題研究計畫 : 研發處依計畫核定清單認定之。本項總計最高以 8 分為上限。 計畫執行六個月 ( 含 ) 以上，每年第一件得 2 分，第二件得 3 分。計畫執行未達六個月，每件 1 分。 註：同一計畫在 A2 之第 (3) 項與第 (12) 項、第 (13) 項僅能擇一計分。 (4) 學術榮譽 (4) 學術榮譽 : 研發處認定之。同一獎項最多採計二次 (a) 總統級及政府院級學術類獎項，每次得 15 分 (b) 教育部學術獎，每次得 14 分 (c) 「國家科學及技術委員會」傑出研究獎，每次得 12 分 (d) 年度高被引用學者，每次得 5 分 (e) 除「國家科學及技術委員會」與教育部之外，其他行政院所屬中央二級機關學術類獎項，每次得 5 分 (f) 國際知名學會 ( 會員人數 1 萬人以上 ) 獎項，每次得 5 分 (g) 中央研究院年輕學者研究著作獎，每次得 4 分 (h) 「國家科學及技術委員會」吳大猷先生紀念獎，每次得 4 分 (i) 國內財團法人獎項 ( 獎項成立 10 年以上 ) ，每次得 1~3 分 (j) 國內學會獎項 ( 學會成立 20 年以上 ) ，每次得 2 分 (k) 本校傑出教師 ( 學術研究類 ) 獎勵，每次得 2 分 (l) 本校績優教師 ( 學術研究類 ) 獎勵，每次得 1 分 (5) 出版學術 研究專書 (5) 出版學術研究專書 ( 有國際標準書號 ISBN) ：應檢附學術審查證明，經研發處召開專家審查委員會認定之。本項總計最高 4 分為上限。 (a) 個人學術著作專書：外文每一本 1~4 分、中文每一本 1~3 分 (b) 翻譯著作：每一本 1~2 分 註 : 多人著作：同一本著作依個人貢獻比例分配計分，且須由所有作者簽名確認個人貢獻，經委員會認定後不得再變更貢獻 比例。 (6) 「國家科 學及技術 委員會」 產學合作 研究計畫 (6) 「國家科學及技術委員會」產學合作研究計畫及文化部計畫：產學處依計畫核定清單認定之。 (a) 「國家科學及技術委員會」產學合作個人型研究計畫及文化部計畫 ( 限文學院 ): 計畫執行六個月 ( 含 ) 以上，每年第一件 得 2 分，第二件得 3 分。計畫執行未達六個月，每件 1 分。 (b) 「國家科學及技術委員會」產學合作整合型研究計畫 ( 多張核定清單 ): I. 總主持人 : 每件 3 分。 II. 共同主持人 ( 不包含總主持人 ): 每件 2 分。 (c) 「國家科學及技術委員會」產學合作單一整合型研究計畫 ( 單張核定清單 ) ：本項總計最高 8 分為上限。 補助經費累計達 100 萬元，得 1 分；超過 100 萬元之部分，每 50 萬元得 0.5 分。每件計畫共同主持人配分必須於計畫核定 後 3 個月內，由所有主持人簽名確認個人貢獻，依比例分配計分，且不得再變更分配比例。 註 : 同一計畫在 A2 之第 (1) 項、第 (2) 項、第 (6) 項、第 (7) 項僅能擇一計分。

(7) 政府機關 產學合作 計畫 (7) 政府機關產學合作計畫 ( 不含「國家科學及技術委員會」產學計畫 ): 產學處依計畫核定清單認定之。 (a) 文 ( 劇藝系及音樂系除外 ) 、管、社、西灣學院，及海科院具有人文、法政、社經、管理專長等之政府機關委託產學合 作計畫：計畫累計金額達 40 萬元者得 1 分，超過 40 萬元之部份，每 10 萬元得 0.1 分。 (b) 文 ( 限劇藝系及音樂系 ) 之政府機關委託產學合作計畫：計畫累計金額達 20 萬元者得 0.5 分，超過 20 萬元之部份，每 5 萬 元得 0.1 分。 (c) 理、工、醫、海科院之政府機關委託產學合作計畫：計畫累計金額達 75 萬元者得 1 分，超過 75 萬元之部份，每 15 萬元 得 0.1 分。 註： I. 同一計畫在 A2 之第 (1) 項、第 (2) 項、第 (6) 項、第 (7) 項僅能擇一計分。 II. 每件計畫共同主持人配分必須於計畫核定後 3 個月內，由所有主持人簽名確認個人貢獻，依比例分配計分，且計畫執 行期間不得再變更分配比例。 (8) 非政府產 學合作計 畫 (8) 非政府機關 ( 企業與法人 ) 委託產學合作計畫 : 產學處依委託合約書認定之。 (a) 文 ( 劇藝系及音樂系除外 ) 、管、社、西灣學院，及海科院具有人文、法政、社經、管理專長等之非政府機關委託產學 合作計畫：計畫累計金額達 40 萬元者，得 1 分，超過 40 萬元之部份，每 10 萬元得 0.2 分。 (b) 文 ( 限劇藝系及音樂系 ) 之非政府機關委託產學合作計畫：計畫累計金額達 20 萬元者得 0.5 分，超過 20 萬元之部份，每 5 萬元得 0.125 分。 (c) 理、工、醫、海科院之非政府機關委託產學合作計畫：計畫累計金額達 75 萬元者得 1 分，超過 75 萬元之部份，每 15 萬 元得 0.2 分。 註：每件計畫共同主持人配分必須於計畫核定後 3 個月內，由所有主持人簽名確認個人貢獻，依比例分配計分，且計畫執 行期間不得再變更分配比例。 (9) 技術移轉 或著作授 權 (9) 技術移轉或著作授權 : 產學處依技轉合約認定之，主要發明人與產業界 ( 含企業與法人 ) 辦理技術移轉或著作授權，本項總 計最高 8 分為限。 (a) 以職務成果技術移轉或著作授權 : 累計授權金額達 20 萬元者，得 0.5 分；超過 20 萬元之部份，每 10 萬元得 0.2 分。 (b) 以中華民國獲證之發明或設計專利授權 : 累計授權金額達 20 萬元者，得 1 分；超過 20 萬元之部份，每 10 萬元得 0.2 分。 (c) 以美、日、歐盟等國外專利授權 : 累計授權金額達 20 萬元者得 1.5 分，超過 20 萬元之部份，每 10 萬元得 0.4 分。 (10) 專利 : 經產學處依發明專利證書認定之，主要發明人之研究成果以學校名義申請，獲得發明或設計專利；或以個人名義 申請，獲得之發明或設計專利讓與學校。以上與廠商共同申請者，皆不列計。本項總計最高 3 分為限。 (a) 中華民國專利 : 每件 0.5 分。 (b) 美、日、歐盟專利 : 每件 1 分。 (c) 其他國家專利，由產學處認定之，每件 0.1~0.5 分。 (10) 專利 (11) 產學榮譽 (11) 產學榮譽 : 產學處認定之。 (a) 總統級及政府院級產學類獎項；每次加 15 分。 (b) 「國家科學及技術委員會」傑出技術移轉貢獻獎，每次加 7.5 分。 (c) 經濟部國家產業創新獎，加 7.5 分。 (d) 經濟部智慧局國家發明創作獎，每次加 4 分。 (e) 除「國家科學及技術委員會」與經濟部之外，其他行政院所屬中央二級機關產學類獎項，每次得 3-4 分。 (f) 未來科技 ( 突破 ) 獎，每次加 2 分。 (g) 國家新創獎，每次加 2 分。 (h) 學術創業先鋒獎，每次加 2 分。 (i) 本校產學傑出獎或傑出教師 ( 產學研究類 ) 獎勵，每次得 2 分。 (j) 本校績優教師 ( 產學研究類 ) 獎勵，每次得 1 分。 註： I. 同一獎項最多採計二次。

II. 每一獎項共同主持人配分必須於獎項核定後 3 個月內，由所有主持人簽名確認個人貢獻，依比例分配計分，且不得 再變更分配比例。 (12) 教育部教 學相關計 畫 (12) 教育部教學相關計畫 : 教務處依計畫核定清單認定之，本項總計最高以 8 分為上限。 (a) 個別型教學計畫主持人：計畫執行六個月 ( 含 ) 以上，每年第一件得 2 分，第二件得 3 分。計畫執行未達六個月，每件 1 分。 (b) 整合型教學計畫： I. 總主持人：每件 3 分。 II. 共同主持人 ( 不包括總主持人 ) ：每件 2 分。 III. 計畫參與教師（不含總主持人及共同主持人）：補助金額 600 萬元以上之計畫，每超過 50 萬元得採計 0.5 分，至多 採計 3 分，並依教師貢獻比例分配給計畫參與教師，每位至多 1.5 分。 (13) 教育部教 學實踐研 究計畫 註：同一計畫在 A2 之第 (3) 項、第 (12) 項、第 (13) 項僅能擇一計分。 (13) 教育部教學實踐研究計畫 : 教務處依計畫核定清單認定之。 每年每件得 2 分；若計畫獲教育部頒績優獎項者，再加 1 分。 註：同一計畫在 A2 之第 (3) 項、第 (12) 項、第 (13) 項僅能擇一計分。 (14) 其他 學術（含 文藝）成 就 (14) 其他學術（含文藝）成就（由院教評會審議，至多 2.1 分） A2. 小計 □ (1) 一般研究類： A2 滿分 17.5 分（ A 佔 70 ％； A1:75% ， A2:25 ％） □ (2) 技術應用類： A2 滿分 42 分（ A 佔 70 ％； A1: 40% ， A2:60 ％） □ (3) 教學研究類： A2 滿分 24 分（ A 佔 60 ％； A1: 60% ， A2:40 ％） A. 學術 產學研 究績效 小計 學術產學研究績效（ A1+A2 ）小計 □ (1) 一般研究類： A 滿分 70 分 □ (2) 技術應用類： A 滿分 70 分 □ (3) 教學研究類： A 滿分 60 分 小計 小計

B. 教學績效 指標項目 評分原則（以絕對分數採計） 各項目採計上限 自評 審核 指標項目 □ (1) 一般研究類 : 滿分 20 分 □(2)技術應用類 : 滿分 20 分 □(3)教學研究類 : 滿分 30 分 □一般研究類 : □技術應用類 : 滿分 20 分 □教學研究類 : 滿分 30 分 (1) 教學年資 在本校升等時職級滿三年為 7 分；超過三年部分每增加授課一學期加 0.2 分。他校年 資及育嬰留職停薪期間之年資折半計算。 8 分 8 分 (2) 教學貢獻 度 (a) 升等時職級近五年內學期平均授課時數： 每一時數得 0.5 分，主管或其他可抵減時數應加回計算，至多 5 分。（專班課程 時數併入計算。） (b) 教學當量： 教師於現職職級之平均教學當量達各學院前 10 ％者，每學期加計 0.2 分。 (c) 開設基礎必修課程 *: 教師開設大學部必修課程 ( 不含通識課程 ) ，每開一門加計 0.2 分，多人合授依授 課比例合計給 0.2 分。 (d) 開設通識課程 * ： I. 西灣學院主聘教師開設通識課程 ( 採計跨院選修、博雅及專業服務學習、必修 運動與健康課程、語文課程 ) ，每開一門加計 0.2 分；多人合授依授課比例合 計給 0.2 分。 ( 該項最多 2 分 ) II. 非西灣學院主聘教師支援開設通識課程 ( 採計博雅及專業服務學習課程、語 文課程 ) ，每開一門加計 0.4 分；多人合授依授課比例合計給 0.4 分。 ( 該項最 多 2 分 ) III. 非西灣學院主聘教師支援開設跨院選修通識課程，每開一門加計 0.2 分；多 人合授依授課比例合計給 0.2 分。 ( 該項最多 2 分 ) (e) 出版教科書 ( 有國際標準書號 ISBN) ，經院教評會認定，每本 1-2 分。 註：多人著作：同一本著作依個人貢獻比例分配計分，且須由所有作者簽名確 認個人貢獻，經院教評會認定後不得再變更貢獻比例。 7 分 8 分 (3) 教學榮譽 教學榮譽：教務處認定之。 (a) 教育部師鐸獎，每次 7.5 分。 (b) 教育部全國傑出通識教育教師獎，每次 7.5 分。 (c) 本校傑出教學獎 ( 教學傑出教師 ) ，每次 2 分。 (d) 本校優良教學獎 ( 教學績優教師 ) ，每次 1 分。 (e) 全國教育類貢獻獎（例如：教育部教育奉獻獎、社會教育貢獻獎、藝術教育貢獻 獎等），每次 5 分。 (f) 通識教育學會： I. 「終身成就榮譽」，每次 2 分 II. 「典範通識教師」，每次 1.5 分。 註：同一獎項最多採計二次 15 分 15 分

B. 教學績效 教學優良 課程 獲頒校級教學優良課程，每門課程加 0.2 分。 2 分 3 分 (4) (5) 全英語授 課課程 * (a) 外文系專任教師每開一門全英語講授類課程，加 0.2 分；多人合授依授課比例合 計給 0.2 分。 ( 該項最多 2 分 ) (b) 非外文系專任教師每開一門全英語講授類課程，加 0.4 分；多人合授依授課比例 合計給 0.4 分。 ( 該項最多 4 分 ) 4 分 4 分 (6) 數位學習 課程績效 推動數位學習課程 ( 下面各項不重複計分 ) (a) 獲得教育部數位學習教材及課程認證： 每科教材或每門課程加 1 分；多人合製一門 ( 科 ) 依授課比例合計給 1 分。 (b) 通過本校數位課程認證： 每門課程加 0.5 分；多人合製一門 ( 科 ) 依授課比例合計給 0.5 分；教師開設開放 式課程，每門課程加 0.2 分；多人合製一門 ( 科 ) 依授課比例合計給 0.2 分。 (c) 國際合作 EMI 數位課程： 與國外教師合作開設 EMI 數位學分課程，每門課 0.5 分。 3 分 4 分 (7) 指導學生 研究績效 (a) 指導研究生論文得獎 指導研究生之碩博士學位論文得獎，由教務處認定，每件加計 1 分。 (b) 指導大專學生研究計畫 指導學生獲「國家科學及技術委員會」大專學生研究計畫，由研發處認定，每 件加 0.2 分。若計畫獲大專學生研究創作獎，每件再加 0.5 分。 4 分 4 分 (8) 執行卓越 教學計畫 與高教深 耕教學創 新計畫 （含擔任 學分學程 負責人） (9) (a) 執行由教務處審查之卓越教學計畫與高教深耕教學創新計畫案，每年每件 0.2 分。 (b) 擔任學分學程負責人，每學期每學程 0.1 分。若學程當學期在校修讀人數高於平 均值，加計 0.1 分；若學程當學年度領證人數高於平均值，再加計 0.1 分。 (c) 擔任全英語微學程及學分學程負責人，以上開 2 倍計分。 2 分 4 分 協助教師 提升教學 知能 (a) 擔任教學研習、工作坊等教學活動之主講者，或領航教師有實際輔導事實者，由 教務處認定，每場次 0.2 分。 (b) 擔任全英語教學研習、工作坊等教學活動之主講者，或經教務處推薦為教學觀摩 教師且有實際觀摩事實者，每場次 0.3 分。 (c) 對本校或各學院推動教學創新貢獻卓著者（如推動本校雙語教學計畫），經校內 程序簽核通過，由教務處認定，每件加計 0.2~0.5 分。 3 分 3 分

B. 教學績效

(10) 自我提升 教學知能 (a) 申請觀課服務教師：（本項最高 3 分） 申請觀課服務教師（含 EMI ）經教務處核准，且實際有觀課事實者，每次 0.3 分，若同儕觀課評量平均滿意度 6 分以上（七分量表），加計 0.3 分。 (b) 於本校任職後取得 EMI 教師培訓認證，並符合本校 EMI 教師培訓計畫者，每證 書 1 分（各級證書僅可採計一次），本項最高 3 分。 (c) 參與教學知能提升：（本項最高 2 分） 參與校內教學知能研習、工作坊或教師社群有具體事實者，由教務處認定，每 場次 0.1 分。 3 分 4 分 (11) 其他明顯 教學優良 或教學不 力，有具 體證據者 (11) ：其他明顯教學優良或教學不力，有具體證據者，由教評會適度加減分，最多 不得超過限分 0.6 分 0.9 分 B. 教學績 效小計 B. 教學績效 (1)-(11) 小計 □ (1) 一般研究類 : 滿分 20 分 □(2)技術應用類 : 滿分 20 分 □(3)教學研究類 : 滿分 30 分 小計 小計 備註： 1.* 有關「通識課程」、「全英語授課課程」及「基礎必修課程」依據「本校教學意見調查追蹤改善精進教學辦法」所訂，符合下列任 一條件者，不予計分： (1) 教學意見調查滿意度在 4.2 分以下（七分量表）。 (2) 教學意見調查滿意度在 4.9 分以下（七分量表），且該課程授課教師兩年內「畢業生對系所與任課教師滿意度問卷」回收卷數達 10 份以上，其對教師滿意度在 3.5 分以下（五分量表）或 4.9 分以下（七分量表）。 2. 所有積分均僅採計現職職級，上一職級之教學貢獻不得計入。

C. 服務績效

評分原則（絕對分數） 各項目採計上限 自評 審核 項目 服務評分 : （滿分 10 分） 滿分 10 分 (1) 校級會議代表 校級會議代表每學年 0.1 分 分 (2) 院級會議代表 院級會議代表每學年 0.1 分 分 (3) 校級服務 ( 由 (3-1)-(3-11) 加 總計分 ) 分 (3) 小計 (3) 小計 (3-1) 擔任編制內行政、學 術主管 (3-1) 擔任編制內行政、學術主管 : 擔任編制內一級主管每學期加 1 分，二級主管每學期加 0.5 分 ( 未滿一學期，以一 學期計算 ) 。如同時擔任二個以上行政或學術主管者，依上開標準分別採計計 分。 分 (3-2) 支援推廣教育課程 (3-2) 開設推廣教育課程，由全球產學營運及推廣處認定。 (a) 教師以講授推廣教育課程，累積收入達 100 萬元或累積貢獻校管理費達 10 萬元，得 0.5 分。收入超過 50 萬元或管理費超過 10 萬元，依比例計算。 (b) 教師開設隨班附讀課程且有學生修習者，每門課得計 0.1 分。 每門推廣教育課程不得重複計分，若為共授課程，必須由所有參與教師 簽名確認個人貢獻，依比例分配計分。 分 (3-3) 支援高中生多元學習 (3-3) 支援高中生多元學習 : 由教務處認定。 (a) 協助招生專業化相關事項，如擔任學系種子教師、於高中端交流活動擔 任主講人、審查高中學生自主學習計畫等，每件 0.1 分。 (b) 開放本校實驗室指導高中學生並有實際指導事實者 ( 若未透過教務處媒 介，則經系所認定，教務處複查 ) ，每學期 0.2 分。 ( 該項最多 2 分 ) (c) 教師支援高中特色課程（含 6 週以上之微課程），每開一門加計 0.5 分， 多人合授一門合計給 0.5 分。 ( 該項最多 2 分 ) 分

C. 服務績效 (3-4) 指導學生參與競賽獲 獎 (3-4) (a) 國際競賽 : 指導本校學生參加國際競賽獲前三名，每件加 3 分，獲佳 作及得獎者每 件加 0.5 分。 (b) 政府單位舉辦之國內學術、產學與展演等競賽 : 指導本校學生參加國內學術、產學與展演等競賽，獲前三名每件加 1.5 分，獲佳作及得獎者每件加 0.25 分。 (C) 指導本校學生參加全國大專運動會及大專校院運動聯賽，獲前三名每次加 1.5 分，進入決賽未獲前三名每次加 0.25 分。 分 (3-5) 支援招生工作 (3-5) 支援招生工作 : 由教務處認定。 (a) 擔任教務處主辦之校內外招生宣導活動主講者，每次 0.1 分。 (b) 支援大考中心或企業委辦本校招生考試或本校自辦招生考試之相關工作 ( 含命題、入闈、監考、審查、口試等 ) ，每次 0.1 分。 分 (3-6) 推動性別平等教育 (3-6) 推動性別平等教育 : 由學務處認定。 推動性別平等教育工作，友善校園，每學年 0.2 分。 分 (3-7) 本校優良導師獎 (3-7) 本校優良導師獎，每次 1 分。 分 (3-8) 推動社團活動 : (3-8) 輔導社團活動及學生自治性組織 : 由學務處認定。 (a) 擔任學生會、宿委會、校內社團之指導老師或學生運動代表隊教練，每學 年 0.3 分。 (b) 擔任國際化和英語化學生社團之指導老師，每學年 0.4 分。 分 (3-9) 推動雙語校園 (3-9) 推動雙語校園， (a) 指標由教務處認定，其餘由國際處認定。 (a) 推動 English Corner 計畫，成效良好者。 ( 每學期 0.4 分 ) (b) 代表本校接洽校級國際合作聯盟 ( 例如 AIT 、 BRITISH COUNCIL 、 OSUN) 有 定期參與及合作成果者，可依其擔任本校代表之時間給予獎勵，每學期 0.5 分。 (c) 擔任校院系雙語化公文及會議資料之行政窗口，每學期 0.5 分。 分 （ 3-10 ） 推動校園藝文活動 (3-10) 參與或支援校級大型藝文活動（如：校慶等） ：由秘書室認定。 每次加 0.5 分。 分

C. 服務績效 (3-11) 國際化指標 (3-11) 國際化指標，由國際處認定。 (a) 促成本校與外國學校洽簽雙聯學位教師 I. 外國學校排名在本校之前者， 每校 1 分。 II. 外國學校排名在本校之後者，每校 0.5 分。 (b) 國際招生活動 I. 教師自行聯繫參訪，每次 0.5 分。 II. 教師參與國際處安排招生展或參訪，每次 0.2 分。 III. 教師參與線上招生 Webinar ，每次 0.1 分。 (c) 指導外籍碩博士學位生 I. 每位博士生畢業，每人 0.5 分。 II. 每位畢業碩士生畢業，每人 0.2 分。 (d) 其他國際合作 I. 辦理跨國研習活動 ( 如 workshop, training 等 ) ，每場 0.2 分。 II. 參與國際合作計畫 ( 非研究類，如參與辦理國際大型活動、帶領學生 參與國際志工或活動等 ) ，每場 0.2 分。 III. 選送學生至國外合作單位學習，每人 0.2 分。 分 (4) 大型會議或活動 之籌備小組成員 大型會議或活動之籌備小組成員 每次 0.1-0.2 分（院教評會評定，至多 1 分） 1 分 (5) 院優良導師獎 院優良導師獎，每次 0.5 分 分 (6) 校外服務 校外服務（至多 0.8 分，院教評會評定） 0.8 分 C. 服務績效小計 C. 服務績效 (1)-(6) 及各類跨域活動參與至多 7 分 ( 依「國立中山大學文學 院教師升等審查評分細則」達基本門檻者 ) ，滿分 10 分 分 小計 小計 總分 (=A+B+C) 分","<2-hop>  [202509142240120737.md]

國立中山大學文學院教師升等服務績效之各類跨域活動參與一覽表

Participation Form of Interdisciplinary Activities for Service Performance of Professorship Rank Promotion in the College of Liberal Arts

系所（組） ：

姓名：

擬升等職級：

Department/Institute Applicant's name Intended rank promotion

場次 No. 活動日期 date (yyyy/mm/dd) 活動名稱 / 主辦 ( 協辦、參加 ) title of activity (organizer/co- organizer/participant) 系審核 approved by the department/institute 院審核 approved by the College 1 2 3 4 5 6 7

申請教師簽章 Applicant's signature ：

( 日期

YYYY 年 MM 月 DD 日）

註 Notes :

一、 依國立中山大學文學院教師升等審查評分細則辦理，教師申請升等職級期間應完成 參與本學院辦理之「跨系所跨領域對話座談」 、 「跨校際對話座談」 、 「跨國際國際學 術交流對話」 、文苑沙龍及院相關學程開設等相關活動，至少 7 場次，每場次以 1 分 計，至多 7 分 ; 未達者 7 場次者，依實際參與場次數計算。

According to Guidelines on the Detailed Implementation of the Evaluation of Professorship Rank Promotion , the faculty applying for rank promotion shall participate in at least seven College-organized activities at their current rank, such as interdepartmental or interdisciplinary dialogue forums, inter-university forums, international academic exchange events, and other related activities held by the College's affiliated units. Points shall be calculated based on the actual number of activities attended (one point each), with a maximum of 7 points granted.

二、 本表請申請升等教師自行填列檢附，俾利計分。

The faculty applying for rank promotion shall complete and submit this form for accurate calculation.",202509142212570727.md,202509142240120737.md,"['國立中山大學文學院', '國立中山大學文學院教師升等計分表']",文學院↔文學院,國立中山大學文學院教師升等計分表↔國立中山大學文學院,5.0,5.0,5.0,5.0,4.94,2.0,5.0
請問國立中山大學社會科學院中國與亞太區域研究所博士班學生在通過論文計畫書口試後，接下來申請博士論文口試的條件為何？此外，碩士班學生在申請論文口試前需要通過哪些程序？,根據博士班相關規定，博士班研究生於通過博士候選人學科考試後，可選定博士論文指導教授，並經所務會議通過聘請。博士論文指導委員會應擇期舉行博士論文計畫書口試，博士候選人須於通過論文計畫書口試後6個月，方得申請博士論文口試。至於碩士班學生，申請參加論文口試前，須先通過「論文計畫書」審查與「多元學習護照」制度之規定。論文計畫書至少應包括論文研究主題、文獻檢閱、研究方法、論文架構及參考書目等部分，且由指導教授進行審查。,"['<1-hop>  [201909051742140415.md]\n\n國立中山大學社會科學院中國與亞太區域研究所\n\n博士班研究生資格考核及學位考試相關規定\n\n104 學年度入學新生起適用\n\n97.10.15 97 學年度第\n\n2 次所務會議通過\n\n97.10.30 97 學年度第\n\n2 次院務會議通過\n\n97.11.12 校長核定\n\n99.05.04 98 學年度第 10 次所務會議修正通過\n\n99.05.05 98 學年度第 4 次院務會議通過\n\n99.05.13 校長核定\n\n101.05.15 100 學年度第 13 次所務會議修正通過\n\n101.05.24 100 學年度第 5 次院務會議通過\n\n101.05.31 校長核定\n\n101.10.30 101 學年度第 3 次所務會議修正通過\n\n102.03.12 101 學年度第 2 次院務會議通過\n\n102.04.11 校長核定\n\n103.03.11 102 學年度第 6 次所務會議修正通過\n\n103.04.22 102 學年度第 3 次院務會議通過\n\n103.04.30 校長核定\n\n104.05.26 103 學年度第\n\n10\n\n次所務會議通過\n\n104.05.27 103 學年度第\n\n3 次院務會議通過\n\n104.07.22 校長核定\n\n一、依據教育部頒「學位授予法」暨其施行細則、本校「學則」及「研究生學位考 試施行細則」訂定之。\n\n二、本所博士班入學程序如下：\n\n（一）曾於公立或已立案之私立大學或獨立學院或經教育部認可之國外大學或獨 立學院相關研究所畢業，得有碩士學位者或以同等學歷報考者（見本校招生 簡章），經本校研究所博士班入學考試錄取者，得入本所博士班就讀。\n\n（二）外國學生入學程序依學校規定辦理。\n\n（三）本所學生依 「國立中山大學中國與亞太區域研究所碩士班研究生申請逕修讀 博士學位作業辦法」得申請逕讀本所博士班。\n\n三、修讀組別：\n\n本所修讀博士學位之組別分為政治組、經濟組及法律組。\n\n四、在學期間相關事項：\n\n（一）每週在校時間：\n\n未修畢本所規定之博士班最低畢業學分數前，每週在校時間依實際修課天數 從事研究或課堂上課；如有申請助學金者，則依每位老師之規定另訂之。\n\n（二）修業年限：依教育部規定二至七年 ( 不含保留入學及休學期間 ) 。\n\n（三）學分制度及修課要求：\n\n學生選課需依本所規定辦理。\n\n每學期選課學分數上限為 12 學分（含外所及學程課程）、下限為 6 學分 （含外所及學程課程）。\n\n逕修讀本所博士學位之研究生，經所務會議通過可抵免碩士班所修學 分，最多可抵十二學分。\n\n（四）提報博士論文題目與指導教授選定：\n\n博士論文指導教授與博士論文題目，需提報所務會議同意。\n\n博士研究生申請參加博士論文口試前，須先通過「論文計畫書」口試與 「多元學習護照」制度之規定。\n\n博士論文指導委員會之委員名單，經提報所務會議通過。\n\n博士研究生倘因故需變更論文指導教授與論文題目，應事先繳交本所 「變 更論文指導教授與論文題目申請表」，經提報所務會議通過後，始得變 更。惟若於通過「論文計畫書」口試後，始申請變更指導教授者，應重 新辦理「論文計畫書」口試。\n\n五、博士學位候選人資格考核：\n\n學期之定義：上學期自每年八月一日至隔年一月三十一日，下學期自每年二月 一日至七月三十一日。\n\n（一）本所博士班研究生須依本校規定，至少須修滿規定課程三十學分（不包括 博士論文），始得申請參加博士學位候選人學科考試。\n\n（二）本所博士候選人學科考試應由博士生在預定考試學期之前一個學期提出申 請。學科考試舉行時間、地點，由本所訂之，但以在學期中及在本校舉行 為原則。\n\n（三）資格考試：\n\n入學後二年內或至多不得超過五年 ( 不含休學期間 ) 須通過資格考試，未通 過者，應令退學。\n\n預計當學期修滿規定學分者，可於考試前一個學期提出博士候選人資格 學科考試申請。\n\n學科考試分為各組必考課程及選考課程，各組必考課程依入學分組選擇 政治組、經濟組或法律組為其考試科目。選考課程一經選定不得以任何 理由變更之。\n\n4. 考試科目：共分二類\n\n(1) 各組必考課程：學生應依據入學組別，提出二門曾在本所博士班該組 別修讀且成績及格之必修課程作為必考考試科目。\n\n(2) 各組選考課程：學生應提出二門曾在本所碩、博士班修讀且成績及格 之選修課程作為選考考試科目。\n\n學科考試以本所公佈之參考書目為範圍，所列書目應與本所開設課程有 關（參考書目由本所訂之）。\n\n學科考試每科以 B等第 ( 百分制成績最高為一百分，及格標準為七十分 ) 為及格（通過），不及格（不通過）之科目以重考一次為限，單科學科 考試科目兩次皆未通過者，應予以退學。\n\n學科考試各組必考課程應考兩科，選考課程應考兩科。每門考試時間上 午 8 ： 30-下午 5 ： 30 。\n\n每學期之學科考試分二次，各組必考課程之成績及格者，始得申請參加 選考課程。上學期各組必考課程於十月的第一週舉行，選考課程於十二 月的最後一週舉行；下學期各組必考課程於三月的第一週舉行，選考課 程於五月的最後一週舉行。\n\n申請學科考試之撤銷，必須於考試日期之兩週前提出。\n\n（四）論文計畫書口試：\n\n本所博士班研究生於通過博士候選人學科考試後，可選定博士論文指導 教授，應經所務會議通過聘請之。\n\n博士學位論文指導教授如中途因故不能指導論文時，得由研究生申請更 換。\n\n論文指導教授應籌組博士論文指導委員會，委員會成員至少三名，由助 理教授以上教師組成，並報經所務會議同意。\n\n博士論文指導委員會應擇期舉行博士論文計畫書口試，俟通過 6 個月後， 博士候選人始得申請博士論文口試。\n\n（五）博士班學生著作發表規定：\n\n本所博士班研究生須於申請學位考試前符合下列兩項規定之一：\n\n於修讀博士班期間發表一篇 SSCI 或 TSSCI 期刊 （單一作者或兩位作者） ；\n\n於修讀博士班期間發表於國內外相關學術期刊 ( 具匿名審查制度的非 SSCI 及非 TSSCI 期刊論文 ) 二篇 ( 第一作者及通訊作者以一篇計算；或二 人合著之文章，每篇以二分之一比例計算；或凡合著者超過 ( 含 ) 三人，每 篇皆以三分之一比例計算）。\n\n（六）外國語文能力檢定：\n\n博士班學生於提交博士論文口試 1 個月前，應提出外語能力鑑定證明， 且需提報所務會議認定通過。\n\n外語能力鑑定證明，需於入學後，修讀通過本所或社科院由不同教師及 開放自由選修的二門以外文教授之專業課程；且需參加下列擇一辦理之 外語能力鑑定： (1) 托福考試； (2) 全民英檢； (3) 多益測驗 (TOEIC) ； (4) 雅 思測驗 (IELTS) ； (5) 博士班修讀期間赴教育部所承認之國外大學或研究所 修習至少二門以外語講授為主之專業領域課程。 ( 本辦法於 104 學年度起\n\n適用。 )\n\n選擇托福考試者以通過 iBT 47 分以上為及格；選擇全民英檢者以通過中 級檢定複試為及格；選擇多益測驗 (TOEIC) 者以通過 550 分以上為及格； 選擇雅思測驗 (IELTS) 者以通過 4.0 分以上為及格；選擇赴國外修習課程 者以取得修課成績合乎標準證明為及格。\n\n（七）博士班學位考試：\n\n研究生應於本校規定年限內，修畢本所規定之應修課程與學分，且符合\n\n本所訂定之各項考核規定後，經由指導教授 ( 副教授以上 ) 推薦，得申請參 加學位考試；博士班研究生在申請參加學位考試之前，另須通過博士學 位候選人資格考核。\n\n博士論文題目經論文指導教授同意後，需提報所務會議備查。\n\n論文口試 1 個月前須先舉行論文公開發表會，由本所辦理之。\n\n論文口試得對外公開。\n\n博士候選人學位考試委員人選，由指導教授依本校「研究生學位考試施 行細則」第十、十一、十三條之規定提名，委員會成員為五至九人，校 外委員需佔三分之一以上，並由論文指導教授從委員中推舉委員一人為 召集人，但論文指導教授不得擔任召集人。\n\n論文口試答辯以三小時為準，必要時得延長一小時。\n\n論文口試答辯完畢後，應試者退出試場，由口試委員進行評分及無記名 投票。有三分之一以上委員評定不及格者以不及格論。論文被評為 "" 有條 件通過 "" （即須加修改部份章節文字）者，該博士候選人必須依規定修改 之，並經論文指導委員會同意通過；如拒絕加以修改，口試委員會可為 該論文之 "" 通過 "" 加以否決。\n\n博士學位論文以平均 B等第 ( 百分制成績最高為一百分，及格標準為七十 分 ) 為及格。通過後由指導委員會薦請本所報請學校授予社會科學博士學 位。\n\n學位考試成績不及格而其修業年限尚未屆滿者，得於次學期或次學年舉 行重考，重考以一次為限，經重考一次仍不及格者，依本校學則規定應 令退學。\n\n六、本所博士班學生在提出學位考試申請前，須參加本所至少 10 場學術專題演講 或學術研討會、及本校學術倫理之相關規定。\n\n七、畢業：符合上述之各項規定者，得提出畢業之申請。\n\n八、本規定經所、院務會議通過，簽請校長核定後施行，修訂時亦同。', '<2-hop>  [201909051758020424.md]\n\n國立中山大學社會科學院中國與亞太區域研究所 碩士班研究生學位考試相關規定\n\n101 學年度入學新生起適用\n\n97.10.15 97 學年度第 2 次所務會議通過 97.10.30 97 學年度第 2 次院務會議通過\n\n97.11.12 校長核定\n\n100.12.20 100 學年度第 7 次所務會議修正通過\n\n101.03.01 100 學年度第 3 次院務會議通過\n\n101.03.12 校長核定\n\n101.05.15 100 學年度第 13 次所務會議修正通過\n\n101.05.24 100 學年度第 5 次院務會議通過\n\n101.05.31 校長核定\n\n一、依據教育部頒「學位授予法」暨其施行細則、本校「學則」及「研究生學位考試施 行細則」訂定之。\n\n二、在學期間相關事項：\n\n( 一 ) 每週在校時間：\n\n未修畢本所規定之碩士班最低畢業學分數前，每週在校時間依實際修課天數從事 研究或課堂上課；如有申請助學金者，則依每位老師之規定另訂之。\n\n( 二 ) 修業年限：依教育部規定一至四年 ( 不含保留入學及休學期間 ) 。\n\n( 三 ) 學分制度及修課要求：\n\n學生選課應依本所規定辦理。\n\n每學期選課學分數上限為 15 學分（含外所及學程課程）、下限為 9 學分（限 本所課程），本所學生至本校外所選課，得計入本所畢業學分數，以總畢業學 分 9 學分為限。\n\n( 四 ) 提報碩士論文題目與指導教授選定：\n\n碩士研究生最遲應於第二學年上學期選定論文指導教授，並提報所務會議核 備。\n\n碩士論文口試委員之選定，應提報所務會議通過，指導教授如為本所兼任教師 或外所 ( 校 ) 教師擔任，口試委員應含一位本所專任教師。\n\n碩士研究生若因故變更論文指導教授與論文題目，應事先繳交本所「變更論文 指導教授與論文題目申請表」，經提報所務會議通過後，始得變更。惟若於通 過「論文計畫書」審查後始申請變更指導教授者，應重新辦理「論文計畫書」 審查。\n\n三、碩士學位考試：\n\n學期之定義：上學期自每年八月一日至隔年一月三十一日，下學期自每年二月一日 至七月三十一日。\n\n( 一 ) 論文計畫書：\n\n申請時間：研究生在上學期應於十二月一日前，下學期應於五月一日前，繳 交論文計畫書審查申請表。\n\n2. 相關規定：\n\n1) 研究生在通過論文計畫書三個月後，始得申請碩士論文口試。\n\n2) 論文計畫書至少應包括論文研究主題、文獻檢閱、研究方法、論文架構及 參考書目等部份。\n\n3) 論文計畫書由指導教授進行審查。\n\n( 二 ) 學位論文考試：\n\n碩士研究生申請參加論文口試前，應先通過「論文計畫書」審查與「多元學 習護照」制度之規定。\n\n碩士學位考試委員人選至少三名，考試委員至少應有一名本所教師。\n\n碩士學位論文以平均 B等第 ( 百分制成績最高為一百分，及格標準為七十分 ) 為及格，通過者授予社會科學碩士學位。\n\n學位考試成績不及格而其延長修業年限尚未屆滿者，得於次學期或次學年舉 行重考，重考以一次為限，經重考一次仍不及格者，依本校學則規定應令退 學。\n\n四、畢業：符合上述之各項規定者，得提出畢業之申請。\n\n五、本規定經所、院務會議通過，簽請校長核定後施行，修訂時亦同。']",staff,Perfect grammar,medium,"<1-hop>  [201909051742140415.md]

國立中山大學社會科學院中國與亞太區域研究所

博士班研究生資格考核及學位考試相關規定

104 學年度入學新生起適用

97.10.15 97 學年度第

2 次所務會議通過

97.10.30 97 學年度第

2 次院務會議通過

97.11.12 校長核定

99.05.04 98 學年度第 10 次所務會議修正通過

99.05.05 98 學年度第 4 次院務會議通過

99.05.13 校長核定

101.05.15 100 學年度第 13 次所務會議修正通過

101.05.24 100 學年度第 5 次院務會議通過

101.05.31 校長核定

101.10.30 101 學年度第 3 次所務會議修正通過

102.03.12 101 學年度第 2 次院務會議通過

102.04.11 校長核定

103.03.11 102 學年度第 6 次所務會議修正通過

103.04.22 102 學年度第 3 次院務會議通過

103.04.30 校長核定

104.05.26 103 學年度第

10

次所務會議通過

104.05.27 103 學年度第

3 次院務會議通過

104.07.22 校長核定

一、依據教育部頒「學位授予法」暨其施行細則、本校「學則」及「研究生學位考 試施行細則」訂定之。

二、本所博士班入學程序如下：

（一）曾於公立或已立案之私立大學或獨立學院或經教育部認可之國外大學或獨 立學院相關研究所畢業，得有碩士學位者或以同等學歷報考者（見本校招生 簡章），經本校研究所博士班入學考試錄取者，得入本所博士班就讀。

（二）外國學生入學程序依學校規定辦理。

（三）本所學生依 「國立中山大學中國與亞太區域研究所碩士班研究生申請逕修讀 博士學位作業辦法」得申請逕讀本所博士班。

三、修讀組別：

本所修讀博士學位之組別分為政治組、經濟組及法律組。

四、在學期間相關事項：

（一）每週在校時間：

未修畢本所規定之博士班最低畢業學分數前，每週在校時間依實際修課天數 從事研究或課堂上課；如有申請助學金者，則依每位老師之規定另訂之。

（二）修業年限：依教育部規定二至七年 ( 不含保留入學及休學期間 ) 。

（三）學分制度及修課要求：

學生選課需依本所規定辦理。

每學期選課學分數上限為 12 學分（含外所及學程課程）、下限為 6 學分 （含外所及學程課程）。

逕修讀本所博士學位之研究生，經所務會議通過可抵免碩士班所修學 分，最多可抵十二學分。

（四）提報博士論文題目與指導教授選定：

博士論文指導教授與博士論文題目，需提報所務會議同意。

博士研究生申請參加博士論文口試前，須先通過「論文計畫書」口試與 「多元學習護照」制度之規定。

博士論文指導委員會之委員名單，經提報所務會議通過。

博士研究生倘因故需變更論文指導教授與論文題目，應事先繳交本所 「變 更論文指導教授與論文題目申請表」，經提報所務會議通過後，始得變 更。惟若於通過「論文計畫書」口試後，始申請變更指導教授者，應重 新辦理「論文計畫書」口試。

五、博士學位候選人資格考核：

學期之定義：上學期自每年八月一日至隔年一月三十一日，下學期自每年二月 一日至七月三十一日。

（一）本所博士班研究生須依本校規定，至少須修滿規定課程三十學分（不包括 博士論文），始得申請參加博士學位候選人學科考試。

（二）本所博士候選人學科考試應由博士生在預定考試學期之前一個學期提出申 請。學科考試舉行時間、地點，由本所訂之，但以在學期中及在本校舉行 為原則。

（三）資格考試：

入學後二年內或至多不得超過五年 ( 不含休學期間 ) 須通過資格考試，未通 過者，應令退學。

預計當學期修滿規定學分者，可於考試前一個學期提出博士候選人資格 學科考試申請。

學科考試分為各組必考課程及選考課程，各組必考課程依入學分組選擇 政治組、經濟組或法律組為其考試科目。選考課程一經選定不得以任何 理由變更之。

4. 考試科目：共分二類

(1) 各組必考課程：學生應依據入學組別，提出二門曾在本所博士班該組 別修讀且成績及格之必修課程作為必考考試科目。

(2) 各組選考課程：學生應提出二門曾在本所碩、博士班修讀且成績及格 之選修課程作為選考考試科目。

學科考試以本所公佈之參考書目為範圍，所列書目應與本所開設課程有 關（參考書目由本所訂之）。

學科考試每科以 B等第 ( 百分制成績最高為一百分，及格標準為七十分 ) 為及格（通過），不及格（不通過）之科目以重考一次為限，單科學科 考試科目兩次皆未通過者，應予以退學。

學科考試各組必考課程應考兩科，選考課程應考兩科。每門考試時間上 午 8 ： 30-下午 5 ： 30 。

每學期之學科考試分二次，各組必考課程之成績及格者，始得申請參加 選考課程。上學期各組必考課程於十月的第一週舉行，選考課程於十二 月的最後一週舉行；下學期各組必考課程於三月的第一週舉行，選考課 程於五月的最後一週舉行。

申請學科考試之撤銷，必須於考試日期之兩週前提出。

（四）論文計畫書口試：

本所博士班研究生於通過博士候選人學科考試後，可選定博士論文指導 教授，應經所務會議通過聘請之。

博士學位論文指導教授如中途因故不能指導論文時，得由研究生申請更 換。

論文指導教授應籌組博士論文指導委員會，委員會成員至少三名，由助 理教授以上教師組成，並報經所務會議同意。

博士論文指導委員會應擇期舉行博士論文計畫書口試，俟通過 6 個月後， 博士候選人始得申請博士論文口試。

（五）博士班學生著作發表規定：

本所博士班研究生須於申請學位考試前符合下列兩項規定之一：

於修讀博士班期間發表一篇 SSCI 或 TSSCI 期刊 （單一作者或兩位作者） ；

於修讀博士班期間發表於國內外相關學術期刊 ( 具匿名審查制度的非 SSCI 及非 TSSCI 期刊論文 ) 二篇 ( 第一作者及通訊作者以一篇計算；或二 人合著之文章，每篇以二分之一比例計算；或凡合著者超過 ( 含 ) 三人，每 篇皆以三分之一比例計算）。

（六）外國語文能力檢定：

博士班學生於提交博士論文口試 1 個月前，應提出外語能力鑑定證明， 且需提報所務會議認定通過。

外語能力鑑定證明，需於入學後，修讀通過本所或社科院由不同教師及 開放自由選修的二門以外文教授之專業課程；且需參加下列擇一辦理之 外語能力鑑定： (1) 托福考試； (2) 全民英檢； (3) 多益測驗 (TOEIC) ； (4) 雅 思測驗 (IELTS) ； (5) 博士班修讀期間赴教育部所承認之國外大學或研究所 修習至少二門以外語講授為主之專業領域課程。 ( 本辦法於 104 學年度起

適用。 )

選擇托福考試者以通過 iBT 47 分以上為及格；選擇全民英檢者以通過中 級檢定複試為及格；選擇多益測驗 (TOEIC) 者以通過 550 分以上為及格； 選擇雅思測驗 (IELTS) 者以通過 4.0 分以上為及格；選擇赴國外修習課程 者以取得修課成績合乎標準證明為及格。

（七）博士班學位考試：

研究生應於本校規定年限內，修畢本所規定之應修課程與學分，且符合

本所訂定之各項考核規定後，經由指導教授 ( 副教授以上 ) 推薦，得申請參 加學位考試；博士班研究生在申請參加學位考試之前，另須通過博士學 位候選人資格考核。

博士論文題目經論文指導教授同意後，需提報所務會議備查。

論文口試 1 個月前須先舉行論文公開發表會，由本所辦理之。

論文口試得對外公開。

博士候選人學位考試委員人選，由指導教授依本校「研究生學位考試施 行細則」第十、十一、十三條之規定提名，委員會成員為五至九人，校 外委員需佔三分之一以上，並由論文指導教授從委員中推舉委員一人為 召集人，但論文指導教授不得擔任召集人。

論文口試答辯以三小時為準，必要時得延長一小時。

論文口試答辯完畢後，應試者退出試場，由口試委員進行評分及無記名 投票。有三分之一以上委員評定不及格者以不及格論。論文被評為 "" 有條 件通過 "" （即須加修改部份章節文字）者，該博士候選人必須依規定修改 之，並經論文指導委員會同意通過；如拒絕加以修改，口試委員會可為 該論文之 "" 通過 "" 加以否決。

博士學位論文以平均 B等第 ( 百分制成績最高為一百分，及格標準為七十 分 ) 為及格。通過後由指導委員會薦請本所報請學校授予社會科學博士學 位。

學位考試成績不及格而其修業年限尚未屆滿者，得於次學期或次學年舉 行重考，重考以一次為限，經重考一次仍不及格者，依本校學則規定應 令退學。

六、本所博士班學生在提出學位考試申請前，須參加本所至少 10 場學術專題演講 或學術研討會、及本校學術倫理之相關規定。

七、畢業：符合上述之各項規定者，得提出畢業之申請。

八、本規定經所、院務會議通過，簽請校長核定後施行，修訂時亦同。","<2-hop>  [201909051758020424.md]

國立中山大學社會科學院中國與亞太區域研究所 碩士班研究生學位考試相關規定

101 學年度入學新生起適用

97.10.15 97 學年度第 2 次所務會議通過 97.10.30 97 學年度第 2 次院務會議通過

97.11.12 校長核定

100.12.20 100 學年度第 7 次所務會議修正通過

101.03.01 100 學年度第 3 次院務會議通過

101.03.12 校長核定

101.05.15 100 學年度第 13 次所務會議修正通過

101.05.24 100 學年度第 5 次院務會議通過

101.05.31 校長核定

一、依據教育部頒「學位授予法」暨其施行細則、本校「學則」及「研究生學位考試施 行細則」訂定之。

二、在學期間相關事項：

( 一 ) 每週在校時間：

未修畢本所規定之碩士班最低畢業學分數前，每週在校時間依實際修課天數從事 研究或課堂上課；如有申請助學金者，則依每位老師之規定另訂之。

( 二 ) 修業年限：依教育部規定一至四年 ( 不含保留入學及休學期間 ) 。

( 三 ) 學分制度及修課要求：

學生選課應依本所規定辦理。

每學期選課學分數上限為 15 學分（含外所及學程課程）、下限為 9 學分（限 本所課程），本所學生至本校外所選課，得計入本所畢業學分數，以總畢業學 分 9 學分為限。

( 四 ) 提報碩士論文題目與指導教授選定：

碩士研究生最遲應於第二學年上學期選定論文指導教授，並提報所務會議核 備。

碩士論文口試委員之選定，應提報所務會議通過，指導教授如為本所兼任教師 或外所 ( 校 ) 教師擔任，口試委員應含一位本所專任教師。

碩士研究生若因故變更論文指導教授與論文題目，應事先繳交本所「變更論文 指導教授與論文題目申請表」，經提報所務會議通過後，始得變更。惟若於通 過「論文計畫書」審查後始申請變更指導教授者，應重新辦理「論文計畫書」 審查。

三、碩士學位考試：

學期之定義：上學期自每年八月一日至隔年一月三十一日，下學期自每年二月一日 至七月三十一日。

( 一 ) 論文計畫書：

申請時間：研究生在上學期應於十二月一日前，下學期應於五月一日前，繳 交論文計畫書審查申請表。

2. 相關規定：

1) 研究生在通過論文計畫書三個月後，始得申請碩士論文口試。

2) 論文計畫書至少應包括論文研究主題、文獻檢閱、研究方法、論文架構及 參考書目等部份。

3) 論文計畫書由指導教授進行審查。

( 二 ) 學位論文考試：

碩士研究生申請參加論文口試前，應先通過「論文計畫書」審查與「多元學 習護照」制度之規定。

碩士學位考試委員人選至少三名，考試委員至少應有一名本所教師。

碩士學位論文以平均 B等第 ( 百分制成績最高為一百分，及格標準為七十分 ) 為及格，通過者授予社會科學碩士學位。

學位考試成績不及格而其延長修業年限尚未屆滿者，得於次學期或次學年舉 行重考，重考以一次為限，經重考一次仍不及格者，依本校學則規定應令退 學。

四、畢業：符合上述之各項規定者，得提出畢業之申請。

五、本規定經所、院務會議通過，簽請校長核定後施行，修訂時亦同。",201909051742140415.md,201909051758020424.md,"['論文計畫書口試', '論文計畫書']",社會科學院↔社會科學院 | 中國與亞太區域研究所↔中國與亞太區域研究所,論文計畫書口試↔論文計畫書,5.0,5.0,4.98,5.0,5.0,2.0,5.0
國立中山大學學生事務處諮商與健康促進組在關懷懷孕學生及推動學生輔導工作方面，分別有哪些具體的服務措施與組織架構？,根據國立中山大學的規定，學生事務處諮商與健康促進組在關懷懷孕學生方面設置專人服務窗口，提供社政、警政、民間社會福利與心理衛生機構等聯繫網絡，並依據學生懷孕受教權維護及輔導協助要點，對未成年懷孕學生進行通報並成立工作小組，提供必要輔導與協助。工作小組分為輔導單位與行政單位，輔導單位負責召開個案討論會議並妥善保存懷孕學生資料，行政單位則負責經費編列、彈性處理出缺勤紀錄、教室安排、設施規劃及多元適性教育等。至於推動學生輔導工作，該組依據學生輔導法設立學生輔導工作委員會，推動三級輔導措施，包括發展性輔導（如演講、工作坊等活動）、介入性輔導（如個別諮商、心理測驗、精神科醫師諮詢）及處遇性輔導（連結校內外資源協助學生）。學生輔導工作委員會由校長擔任主任委員，成員包括教務長、學務長、總務長、國際長、諮商與健康促進組組長等，並由該組組長兼任執行秘書，負責審核輔導計畫、協調相關單位合作及提升校園師生健康。,"['<1-hop>  [202403151048210219.md]\n\n國立中山大學關懷懷孕學生受教權維護及輔導協助實施要點\n\n108 年 11 月 20 日 本校 108 學年度第 1 學期第 1 次性別平等教育委員會議通過 111.03.30 本校 110 學年度第 2 學期第 4 次行政會議通過修正學務處所屬組織名稱\n\n一、 為落實本校積極維護懷孕學生之受教權，並提供必要之協助，依據性別平等 教育法第十四條之一規定，訂定本要點。\n\n二、 本校為關懷懷孕學生，應秉持多元、包容之精神，積極維護並保障學生之受教 權。協助過程應嚴守專業倫理，尊重隱私，採取必要之保密措施，維護懷孕或 育有子女學生之權益，提供最大協助。\n\n三、 本校為維護懷孕學生之權益與協助管道，於學生事務處諮商與健康促進組 （以 下簡稱諮健組）設置專人服務窗口，並提供社政、警政、民間社會福利與心理 衛生機構等聯繫網絡，適時提供資源。\n\n四、 若本校學生未成年（未滿 20 歲）懷孕時，諮健組應依「學生懷孕受教權維護 及輔導協助要點」進行通報，並由校長邀集相關單位成立工作小組，提供必要 之輔導與協助。成年學生或已婚學生因懷孕而有相關需求者，得向諮健組申 請協助，並依前項規定辦理。\n\n五、 工作小組依職責劃分輔導與行政單位，並應依據下列原則分工：\n\n( 一 ) 輔導單位：\n\n不定期視懷孕學生之需求，召開個案討論會議，並將會議決議提至本 校性別平等教育委員會議報告。\n\n建立懷孕學生紀錄，並依專業倫理妥適保存及管理其資料。\n\n( 二 ) 行政單位：\n\n主計室應依據性別平等教育法第十條規定，編列懷孕學生輔導協助 相關經費。\n\n教務處、各系所，依本校學則第廿三及第廿六條之規定彈性處理懷孕 學生出缺勤紀錄、補考、補救教學，並提供合乎需要之教室安排、課 桌椅調整、母乳哺 ( 集 ) 室等相關事項。\n\n總務處應視懷孕或育有子女學生之需求，規劃停車、如廁等相關設施。\n\n體育與衛生保健組視懷孕學生需要，結合相關資源，提供其多元適性 教育，內容包含孕程及產後照顧、母乳哺乳（集） 、非預期性懷孕知 能、家庭教育等，必要時與社區及醫療資源等網絡聯繫。\n\n六、 本要點經本校性別平等教育委員會議通過，陳請校長核定後實施，修正時亦 同。', '<2-hop>  [202305231613030212.md]\n\n國立中山大學學生輔導工作委員會設置要點\n\n112 年 3 月 8 日 111 學年度第 2 次組長會議修正通過 112 年 4 月 19 日 111 學年度第 3 次協調會報修正通過 112 年 5 月 10 日 111 學年度第 7 次行政會議修正通過\n\n一、「為有效推動學生輔導工作，協調整合相關資源，以落實三級預防措 施，依據學生輔導法設立學生輔導工作委員會 ( 以下簡稱本委員會 ) 。\n\n二、本要點所稱學生輔導為依據學生輔導法第六條之規定，學校應視學生身心 狀況及需求，提供發展性輔導、介入性輔導及處遇性輔導之三級輔導，其 內容如下：\n\n( 一 ) 發展性輔導：為提升整體校園師生心理健康與校園適應能力，每學 期為全校師生舉辦演講、工作坊、讀書會、連續性團體、電影欣賞 等不同形式活動，促進全校師生在人際關係、課業壓力、情感關 係、情緒調節等不同面向的發展。\n\n( 二 ) 介入性輔導：針對提供發展性輔導後，仍有校園適應或心理困擾議 題之學生，或遭受重大創傷經驗而影響校園適應能力者，學務處諮 商與健康促進組提供個別諮商、團體諮商、心理測驗、精神科醫師 諮詢等介入性輔導資源。\n\n( 三 ) 處遇性輔導：針對提供介入性輔導後，仍有校園適應或心理困擾議 題之學生，或有嚴重適應困難者，學務處諮商與健康促進組針對個 案特殊狀況與需求，連結校內外資源，包含：學術系所單位、相關 行政單位、法定監護人等相關人員，以合作打造校園安全網絡為原 則之方式，提供多方資源，包含：轉銜、轉介醫療或政府資源，協 力協助學生。\n\n三、本委員會組織：\n\n本委員會置委員十九至二十一名，校長為主任委員，由下列人員組成：\n\n( 一 ) 當然委員：由教務長、學務長、總務長、國際長、諮商與健康促進組 組長、校安防護組組長、宿舍服務組組長擔任之。\n\n( 二 ) 遴選委員：\n\n教師代表：各學院推薦教師一人後，由校長圈選八至十人聘任\n\n之。\n\n學生代表：由學生會推選研究生代表及大學部學生代表各一人。\n\n職員工代表：由校長聘任本校具輔導理念之職員工至多二人。\n\n( 三 ) 委員聘期一年，任期中若有委員離職或出缺時，由原推薦單位補推\n\n之，繼任委員之任期至原任期屆滿之日止。\n\n( 四 ) 任一性別委員人數，不得少於委員總額三分之一。\n\n( 五 ) 本委員會執行秘書由學生事務處諮商與健康促進組組長兼任之。\n\n四、本委員會職掌如下：\n\n( 一 ) 審核全校輔導工作計畫與執行情形，評估輔導工作執行成果與績效，\n\n提供相關意見。\n\n二 協助學務處諮商與健康促進組與各學術單位、行政單位合作，執行三 級輔導之相關事宜，共同協助提升校園師生健康。\n\n( )\n\n( 三 ) 其他與學生輔導工作之相關事宜。\n\n五、本委員會每學年至少召開一次會議，必要時得召開臨時會議，並視情況邀\n\n請相關學者專家提供諮詢。\n\n六、本委員會開會應有委員二分之一以上出席，始得召開並決議，委員因故不 能出席會議時，委員得以書面委託其職務代理人代理出席。\n\n七、本要點經行政會議通過後實施，修正時亦同。']",staff,Web search like queries,long,"<1-hop>  [202403151048210219.md]

國立中山大學關懷懷孕學生受教權維護及輔導協助實施要點

108 年 11 月 20 日 本校 108 學年度第 1 學期第 1 次性別平等教育委員會議通過 111.03.30 本校 110 學年度第 2 學期第 4 次行政會議通過修正學務處所屬組織名稱

一、 為落實本校積極維護懷孕學生之受教權，並提供必要之協助，依據性別平等 教育法第十四條之一規定，訂定本要點。

二、 本校為關懷懷孕學生，應秉持多元、包容之精神，積極維護並保障學生之受教 權。協助過程應嚴守專業倫理，尊重隱私，採取必要之保密措施，維護懷孕或 育有子女學生之權益，提供最大協助。

三、 本校為維護懷孕學生之權益與協助管道，於學生事務處諮商與健康促進組 （以 下簡稱諮健組）設置專人服務窗口，並提供社政、警政、民間社會福利與心理 衛生機構等聯繫網絡，適時提供資源。

四、 若本校學生未成年（未滿 20 歲）懷孕時，諮健組應依「學生懷孕受教權維護 及輔導協助要點」進行通報，並由校長邀集相關單位成立工作小組，提供必要 之輔導與協助。成年學生或已婚學生因懷孕而有相關需求者，得向諮健組申 請協助，並依前項規定辦理。

五、 工作小組依職責劃分輔導與行政單位，並應依據下列原則分工：

( 一 ) 輔導單位：

不定期視懷孕學生之需求，召開個案討論會議，並將會議決議提至本 校性別平等教育委員會議報告。

建立懷孕學生紀錄，並依專業倫理妥適保存及管理其資料。

( 二 ) 行政單位：

主計室應依據性別平等教育法第十條規定，編列懷孕學生輔導協助 相關經費。

教務處、各系所，依本校學則第廿三及第廿六條之規定彈性處理懷孕 學生出缺勤紀錄、補考、補救教學，並提供合乎需要之教室安排、課 桌椅調整、母乳哺 ( 集 ) 室等相關事項。

總務處應視懷孕或育有子女學生之需求，規劃停車、如廁等相關設施。

體育與衛生保健組視懷孕學生需要，結合相關資源，提供其多元適性 教育，內容包含孕程及產後照顧、母乳哺乳（集） 、非預期性懷孕知 能、家庭教育等，必要時與社區及醫療資源等網絡聯繫。

六、 本要點經本校性別平等教育委員會議通過，陳請校長核定後實施，修正時亦 同。","<2-hop>  [202305231613030212.md]

國立中山大學學生輔導工作委員會設置要點

112 年 3 月 8 日 111 學年度第 2 次組長會議修正通過 112 年 4 月 19 日 111 學年度第 3 次協調會報修正通過 112 年 5 月 10 日 111 學年度第 7 次行政會議修正通過

一、「為有效推動學生輔導工作，協調整合相關資源，以落實三級預防措 施，依據學生輔導法設立學生輔導工作委員會 ( 以下簡稱本委員會 ) 。

二、本要點所稱學生輔導為依據學生輔導法第六條之規定，學校應視學生身心 狀況及需求，提供發展性輔導、介入性輔導及處遇性輔導之三級輔導，其 內容如下：

( 一 ) 發展性輔導：為提升整體校園師生心理健康與校園適應能力，每學 期為全校師生舉辦演講、工作坊、讀書會、連續性團體、電影欣賞 等不同形式活動，促進全校師生在人際關係、課業壓力、情感關 係、情緒調節等不同面向的發展。

( 二 ) 介入性輔導：針對提供發展性輔導後，仍有校園適應或心理困擾議 題之學生，或遭受重大創傷經驗而影響校園適應能力者，學務處諮 商與健康促進組提供個別諮商、團體諮商、心理測驗、精神科醫師 諮詢等介入性輔導資源。

( 三 ) 處遇性輔導：針對提供介入性輔導後，仍有校園適應或心理困擾議 題之學生，或有嚴重適應困難者，學務處諮商與健康促進組針對個 案特殊狀況與需求，連結校內外資源，包含：學術系所單位、相關 行政單位、法定監護人等相關人員，以合作打造校園安全網絡為原 則之方式，提供多方資源，包含：轉銜、轉介醫療或政府資源，協 力協助學生。

三、本委員會組織：

本委員會置委員十九至二十一名，校長為主任委員，由下列人員組成：

( 一 ) 當然委員：由教務長、學務長、總務長、國際長、諮商與健康促進組 組長、校安防護組組長、宿舍服務組組長擔任之。

( 二 ) 遴選委員：

教師代表：各學院推薦教師一人後，由校長圈選八至十人聘任

之。

學生代表：由學生會推選研究生代表及大學部學生代表各一人。

職員工代表：由校長聘任本校具輔導理念之職員工至多二人。

( 三 ) 委員聘期一年，任期中若有委員離職或出缺時，由原推薦單位補推

之，繼任委員之任期至原任期屆滿之日止。

( 四 ) 任一性別委員人數，不得少於委員總額三分之一。

( 五 ) 本委員會執行秘書由學生事務處諮商與健康促進組組長兼任之。

四、本委員會職掌如下：

( 一 ) 審核全校輔導工作計畫與執行情形，評估輔導工作執行成果與績效，

提供相關意見。

二 協助學務處諮商與健康促進組與各學術單位、行政單位合作，執行三 級輔導之相關事宜，共同協助提升校園師生健康。

( )

( 三 ) 其他與學生輔導工作之相關事宜。

五、本委員會每學年至少召開一次會議，必要時得召開臨時會議，並視情況邀

請相關學者專家提供諮詢。

六、本委員會開會應有委員二分之一以上出席，始得召開並決議，委員因故不 能出席會議時，委員得以書面委託其職務代理人代理出席。

七、本要點經行政會議通過後實施，修正時亦同。",202403151048210219.md,202305231613030212.md,"['學務處諮商與健康促進組', '學生事務處諮商與健康促進組']",學生事務處↔學生事務處,學生事務處諮商與健康促進組↔學務處諮商與健康促進組,5.0,5.0,5.0,5.0,5.0,2.0,5.0
運動績優升學輔導入學生的課業輔導辦法中，補助的原則是什麼？女子排球隊的獎勵措施中，若成績排名低於全班10%，會有什麼課業輔導安排？,根據運動績優升學輔導入學生課業輔導辦法，補助原則包括：每位學生每學年課業輔導費依據預算編列及申請人數、學門數核給，輔導費每小時500元，學生申請課輔科目須為該學系或學程必修科目（不含必修實習課），補助以六學期為限，每學期以不超過兩門課為原則，特殊狀況時學生事務處體育發展組得另案增加補助年限與科目。接受補助的同學由學生事務處體育發展組遴聘適任學生輔導課業，且需於每學期開學二週內提出申請，學生事務處體育發展組於開學後一個月內公告符合資格名單。根據女子排球隊競賽激勵實施要點，若申請砥柱獎勵的學生前一學年任一學期成績排名低於全班10%，須依本校「運動績優升學輔導入學生課業輔導辦法」，由體育組安排課輔教師進行課業輔導。,"['<1-hop>  [202302141202170065.md]\n\n國立中山大學運動績優升學輔導入學生課業輔導辦法\n\n91 年 09 月 27 日 91 學年度第 1 次行政會議通過\n\n94 年 11 月 03 日 94 學年度學生事務處組長會議修訂通過 96 年 05 月 16 日 95 學年度第 2 學期第 5 次行政會議修訂通過 101 年 11 月 28 日 101 學年度第 1 學期學生事務處第 6 次組長會議修訂通過 102 年 01 月 02 日 101 學年度第 1 學期第 3 次行政協調會報修訂通過 102 年 01 月 09 日 101 學年度第 1 學期第 10 次行政會議修訂通過 106 年 9 月 7 日本校 106 學年度第 1 學期第 1 次學生事務處組長會議修正通過 106 年 9 月 27 日本校 106 學年度第 1 次行政協調會報修正通過 106 年 10 月 25 日本校 106 學年度第 1 學期第 4 次行政會議修正通過 111 年 3 月 30 日 110 學年度第 2 學期第 4 次行政會議修正通過 111 年 9 月 7 日 111 學年度第 1 學期第 1 次學務處組長會議修正通過 111 年 10 月 12 日 111 學年度第 1 學期第 2 次協調會報修正通過 111 年 11 月 2 日 111 學年度第 1 學期第 5 次行政會議修正通過\n\n第一條 為鼓勵並輔導本校招收之『運動績優升學輔導入學生』 ，提昇其學業水 平，達到本校課業要求，得以順利完成學位，特訂定本辦法。\n\n第二條 凡本校招收之『運動績優升學輔導入學生』皆可申請接受補助。\n\n第三條 獎助原則：\n\n一、每位學生每學年課業輔導費依據預算編列及申請人數、學門數核給，輔 導費每小時 500 元。學生申請課輔科目須為該學系或學程必修科目（不 含必修實習課） 。補助以六學期為限，每學期以不超過兩門課為原則， 若有特殊狀況時，學生事務處體育發展組得另案增加補助年限與科目。 二、接受補助之同學，由學生事務處體育發展組遴聘適任之學生輔導其課 業。\n\n三、有需要課輔之同學應於每學期開學二週內提出申請，學生事務處體育發 展組於開學後一個月內公告符合資格之同學名單。\n\n第四條 本辦法經學生事務處組長會議討論，提行政會議討論通過，並簽請校長 核定後實施，修正時亦同。', '<2-hop>  [202507310940550617.md]\n\n國立中山大學女子排球隊競賽激勵實施要點\n\n111 年 11 月 7 日本校 111 學年度第 1 學期第 5 次學務處組長會議通過 111 年 12 月 7 日本校 111 學年度第 1 學期第 4 次協調會報修正通過 112 年 3 月 8 日本校 111 學年度第 2 學期第 3 次行政會議修正通過\n\n114 年 6 月 4 日本校 113 學年度第 2 學期第 8 次行政會議修正通過\n\n一、為鼓勵優秀運動員選擇本校就讀，強化本校重點運動項目並提升競技水 準，特訂定本要點。\n\n二、本要點以減免學雜費為主，不得要求換取獎金。\n\n學雜費減免每學期辦理一次，由本校校隊教練彙整名冊，經學務處召集會 議確認後，簽請校長同意。\n\n三、獎勵對象為本校女子排球隊公開組全體隊員，獎勵區分如下：\n\n（一）新秀獎勵：以運動成績優良管道（甄審、甄試及獨招）入學、曾入 選國家隊或高中聯賽最優級組正式隊員之大學部一年級隊員。\n\n（二）砥柱獎勵：以運動成績優良管道（甄審、甄試及獨招）入學、曾入 選國家隊或高中聯賽最優級組正式隊員之大學部二至四年級隊員。\n\n（三）成就獎勵：全體隊員（含碩博士生） 。\n\n四、新秀獎勵規範如下：\n\n（一）高中時期曾於國家隊或高中聯賽最優級組表現活躍，具備持續發展 潛力，符合本校提升競技水準所需，經本校校隊教練推薦之。\n\n（二）依推薦等級於入學年得享有學雜費全免、學費全免或雜費全免等。\n\n（三）本項獎勵名額最多 6 名。\n\n五、砥柱獎勵規範如下：\n\n（一）以運動成績優良管道（甄審、甄試及獨招）入學、曾入選國家隊或 高中聯賽最優級組正式隊員者，在隊期間表現活躍、積極進取，符 合團隊目標所需，經本校校隊教練推薦之。\n\n（二）依推薦等級於當學年得享有學雜費全免、學費全免或雜費全免等。\n\n（三）本項獎勵名額每年級最多 6 名。\n\n（四）欲申請本項獎勵者，若前一學年任一學期之成績排名低於全班 10% ，須依本校「運動績優升學輔導入學生課業輔導辦法」 ，由體育 組安排課輔教師進行課業輔導。\n\n六、成就獎勵規範如下：\n\n（一）該年度聯賽成績績優，獲得公開一級組前 8 名（以 12 隊為標 準） 。\n\n（二）依決賽成績得於次學年享有學雜費減免。大學部四年級於次學年續 讀本校研究所者，得享有同樣權益。\n\n獲公開一級前 1-3 名，學雜費全免\n\n獲公開一級前 4-5 名，學費全免\n\n獲公開一級前 6-7 名，雜費全免\n\n獲公開一級第 8 名，雜費減半 （三）本項獎勵對象為全體聯賽登錄隊員。 七、符合二種以上獎勵者，應擇一申請。\n\n本要點經行政會議通過，陳請校長核定後實施，修正時亦同。']",staff,Poor grammar,short,"<1-hop>  [202302141202170065.md]

國立中山大學運動績優升學輔導入學生課業輔導辦法

91 年 09 月 27 日 91 學年度第 1 次行政會議通過

94 年 11 月 03 日 94 學年度學生事務處組長會議修訂通過 96 年 05 月 16 日 95 學年度第 2 學期第 5 次行政會議修訂通過 101 年 11 月 28 日 101 學年度第 1 學期學生事務處第 6 次組長會議修訂通過 102 年 01 月 02 日 101 學年度第 1 學期第 3 次行政協調會報修訂通過 102 年 01 月 09 日 101 學年度第 1 學期第 10 次行政會議修訂通過 106 年 9 月 7 日本校 106 學年度第 1 學期第 1 次學生事務處組長會議修正通過 106 年 9 月 27 日本校 106 學年度第 1 次行政協調會報修正通過 106 年 10 月 25 日本校 106 學年度第 1 學期第 4 次行政會議修正通過 111 年 3 月 30 日 110 學年度第 2 學期第 4 次行政會議修正通過 111 年 9 月 7 日 111 學年度第 1 學期第 1 次學務處組長會議修正通過 111 年 10 月 12 日 111 學年度第 1 學期第 2 次協調會報修正通過 111 年 11 月 2 日 111 學年度第 1 學期第 5 次行政會議修正通過

第一條 為鼓勵並輔導本校招收之『運動績優升學輔導入學生』 ，提昇其學業水 平，達到本校課業要求，得以順利完成學位，特訂定本辦法。

第二條 凡本校招收之『運動績優升學輔導入學生』皆可申請接受補助。

第三條 獎助原則：

一、每位學生每學年課業輔導費依據預算編列及申請人數、學門數核給，輔 導費每小時 500 元。學生申請課輔科目須為該學系或學程必修科目（不 含必修實習課） 。補助以六學期為限，每學期以不超過兩門課為原則， 若有特殊狀況時，學生事務處體育發展組得另案增加補助年限與科目。 二、接受補助之同學，由學生事務處體育發展組遴聘適任之學生輔導其課 業。

三、有需要課輔之同學應於每學期開學二週內提出申請，學生事務處體育發 展組於開學後一個月內公告符合資格之同學名單。

第四條 本辦法經學生事務處組長會議討論，提行政會議討論通過，並簽請校長 核定後實施，修正時亦同。","<2-hop>  [202507310940550617.md]

國立中山大學女子排球隊競賽激勵實施要點

111 年 11 月 7 日本校 111 學年度第 1 學期第 5 次學務處組長會議通過 111 年 12 月 7 日本校 111 學年度第 1 學期第 4 次協調會報修正通過 112 年 3 月 8 日本校 111 學年度第 2 學期第 3 次行政會議修正通過

114 年 6 月 4 日本校 113 學年度第 2 學期第 8 次行政會議修正通過

一、為鼓勵優秀運動員選擇本校就讀，強化本校重點運動項目並提升競技水 準，特訂定本要點。

二、本要點以減免學雜費為主，不得要求換取獎金。

學雜費減免每學期辦理一次，由本校校隊教練彙整名冊，經學務處召集會 議確認後，簽請校長同意。

三、獎勵對象為本校女子排球隊公開組全體隊員，獎勵區分如下：

（一）新秀獎勵：以運動成績優良管道（甄審、甄試及獨招）入學、曾入 選國家隊或高中聯賽最優級組正式隊員之大學部一年級隊員。

（二）砥柱獎勵：以運動成績優良管道（甄審、甄試及獨招）入學、曾入 選國家隊或高中聯賽最優級組正式隊員之大學部二至四年級隊員。

（三）成就獎勵：全體隊員（含碩博士生） 。

四、新秀獎勵規範如下：

（一）高中時期曾於國家隊或高中聯賽最優級組表現活躍，具備持續發展 潛力，符合本校提升競技水準所需，經本校校隊教練推薦之。

（二）依推薦等級於入學年得享有學雜費全免、學費全免或雜費全免等。

（三）本項獎勵名額最多 6 名。

五、砥柱獎勵規範如下：

（一）以運動成績優良管道（甄審、甄試及獨招）入學、曾入選國家隊或 高中聯賽最優級組正式隊員者，在隊期間表現活躍、積極進取，符 合團隊目標所需，經本校校隊教練推薦之。

（二）依推薦等級於當學年得享有學雜費全免、學費全免或雜費全免等。

（三）本項獎勵名額每年級最多 6 名。

（四）欲申請本項獎勵者，若前一學年任一學期之成績排名低於全班 10% ，須依本校「運動績優升學輔導入學生課業輔導辦法」 ，由體育 組安排課輔教師進行課業輔導。

六、成就獎勵規範如下：

（一）該年度聯賽成績績優，獲得公開一級組前 8 名（以 12 隊為標 準） 。

（二）依決賽成績得於次學年享有學雜費減免。大學部四年級於次學年續 讀本校研究所者，得享有同樣權益。

獲公開一級前 1-3 名，學雜費全免

獲公開一級前 4-5 名，學費全免

獲公開一級前 6-7 名，雜費全免

獲公開一級第 8 名，雜費減半 （三）本項獎勵對象為全體聯賽登錄隊員。 七、符合二種以上獎勵者，應擇一申請。

本要點經行政會議通過，陳請校長核定後實施，修正時亦同。",202302141202170065.md,202507310940550617.md,"['運動績優升學輔導入學生課業輔導辦法', '運動績優升學輔導入學生']",學生事務處↔學生事務處,運動績優升學輔導入學生↔運動績優升學輔導入學生課業輔導辦法,5.0,5.0,5.0,5.0,5.0,2.0,5.0
根據國立中山大學資訊工程學系與光電工程學系博士班的規定，博士生在申請學位考試前，論文發表及資格考核有哪些具體要求？這些要求如何影響博士生的畢業申請？,根據國立中山大學資訊工程學系博士班規定，博士生申請學位考試前，必須發表至少達到兩項最低標準之一的論文，包括SCIE IEEE/IET Electronic Library收錄、ACM Digital Library收錄或B級以上國際會議論文。修業時間逾四年者需有一篇期刊論文代表作及一篇論文或實作系統；未滿四年者需有一篇A級SCIE期刊長篇論文或A級國際會議論文，或實作系統獲獎。論文須在本系就讀期間刊登，指導教授需列名，且博士生需於申請前參加至少一次國際性會議並以英文報告論文。資格考核包括筆試，博士生須在入學後二年內通過三科資格考試，未通過者將被退學。光電工程學系博士班則要求入學後四年內修畢最低畢業學分18學分，其中15學分為光電專業課程，並完成資格考試。資格考試科目包括光電電磁學、光電子學，通過標準明確規定。論文發表需達畢業論文以發表或被接受著作總點數至少4點，且論文點數計算有詳細規定。博士生需通過資格考核並符合論文發表規定後，方可參加學位考試。畢業申請需符合上述各項規定。兩系均強調論文原創性及指導教授同意，並依校內相關法規辦理學位考試。這些要求確保博士生具備足夠的學術能力與研究成果，影響其能否順利申請學位考試及畢業。,"['<1-hop>  [202109271451321039.md]\n\n國立中山大學資訊工程學系 博士班暨資訊安全博士班研究生資格考核及學位考試相關規定\n\n109 學年度起入學新生適用\n\n92 年 2 月 26 日系務會議修正通過 92 年 3 月 25 日工學院院務會議修正通過 93 年 12 月 29 日系務會議修正通過 94 年 1 月 25 日工學院院務會議修正通過 94 年 3 月 9 日系務會議修正通過 94 年 3 月 23 日工學院院務會議修正通過 95 年 9 月 27 日系務會議修正通過 95 年 11 月 1 日工學院院務會議修正通過 96 年 3 月 30 日系務會議修正通過 96 年 6 月 15 日工學院院務會議修正通過 97 年 6 月 9 日系務會議修正通過 97 年 6 月 10 日工學院院務會議修正通過 98 年 5 月 20 日系務會議修正通過 98 年 6 月 10 日工學院院務會議修正通過 98 年 9 月 23 日系務會議修正通過 99 年 6 月 28 日工學院院務會議修正通過 101 年 12 月 25 日系務會議修正通過 102 年 3 月 5 日工學院院務會議修正通過 102 年 3 月 29 日系務會議修正通過 102 年 5 月 29 日工學院院務會議修正通過 103 年 2 月 20 日系務會議修正通過 103 年 6 月 6 日系務會議修正通過 103 年 6 月 13 日工學院院務會議修正通過 106 年 6 月 19 日系務會議修正通過 106 年 6 月 28 日工學院院務會議修正通過 108 年 2 月 25 日系務會議修正通過 108 年 3 月 28 日工學院務會議修正通過 109 年 5 月 8 日系務會議修正通過\n\n109 年 5 月 25 日工學院務會議修正通過\n\n一、依據教育部頒「學位授予法」 、本校「學則」及「研究生學位考試施行細 則」訂定之。\n\n二、在學期間相關事項：\n\n( 一 ) 修業年限：依教育部規定二至七年 ( 不含保留入學及休學期間 ) 。\n\n( 二 ) 學分制度及修課要求：\n\n本系博士生畢業之前必須至少修滿碩士班或博士班課程 22 學分，其 中本系開授課程至少 19 學分，其餘課程經本系同意後，得選修相關 碩、博士班開授之課程。逕讀博士學位者，至少須修滿 40 學分，其 中本系開授課程至少 30 學分。其碩士班一年級所修之學分，最多可 取三分之二的學分計入博士學位學分，且至多以 12 學分為限。\n\n申請逕讀博士學位者，於申請前須修畢碩士班必修課程（書報討論除 外）。\n\n共同必修課程：本系博士生修業前二年須選修「書報討論（一）」至 「書報討論（四）」；且每學期至少須修習一門 3 學分課程。\n\n專業必修課程：\n\n資訊安全博士班：「安全密碼協定」、「數位簽章機制與應用」、「密 碼學」、「安全程式設計」、「駭客攻防與電腦鑑識技術」、「網路 安全」、「計算機結構」等專業課程，學生畢業前至少需擇 2 科修畢\n\n通過。\n\n本系博士生每學期修讀課程，須經指導教授同意後確定之。如無指導 教授，則須經導師或系主任同意後確定之。\n\n本系博士班研究生畢業英文成績最低標準以通過下列任一檢定標準 且通過之測驗檢定日期應以入學前 2 年之後取得為限：\n\n(1) 多益測驗 TOEIC 成績達 750 分以上。\n\n(2) 全民英檢 (GEPT) 中高級複試 ( 含 ) 以上。\n\n(3) 託福紙筆測驗 (TOFEL ITP)527 分 ( 含 ) 以上\n\n(4) 託福網路化測驗 (TOFEL-iBT)71 分 ( 含 ) 以上。\n\n(5) 國際英語能力測驗 (IELTS)5.5 級 ( 含 ) 以上。\n\n如測驗上述檢定項目二次以上仍未達標準，得修習本系課程委員會 指定之英文相關課程取代且修課成績需及格且為該科全部修課人數 之前二分之一。若以修習英文相關課程方式取代英文成績者，該學分 則不納入畢業學分。\n\n為加強本系博士生的學識能力、研究能力或英文能力，本系得指定其 補修相關課程。\n\n須達本系博士班研究生規定之英文成績標準後，始得以申請學位考 試。\n\n( 三 ) 指導教授選派：\n\n本系博士生以選擇本系助理教授 ( 含 ) 以上專任教師擔任博士論文指 導教授為原則。\n\n若有特殊原因，得選擇非本系之指導教授，但必須選擇一位本系助理 教授 ( 含 ) 以上專任教師為共同指導教授。若需由系外老師共同指導時， 需經指導教授同意後，向繫上提出申請，如共同指導教授指導學生至 其畢業時未達一年以上者，取消其共同指導資格。\n\n本系博士生應於入學後一年內決定其論文指導教授。同學未於期限 內決定指導教授者，將由繫上協調指派指導教授。\n\n若因特殊原因需更換指導教授時，應先徵得原指導教授及新指導教 授同意，並以書面向本系報備。\n\n三、博士學位候選人資格考核：\n\n學期之定義：上學期自每年八月一日至次年一月三十一日、下學期自每年 二月一日至七月三十一日。\n\n( 一 ) 資格考試：\n\n資格考試以筆試行之。各科考試結果由本系系務會議議決「通過」或 「不通過」。\n\n資格考試時間每年分兩梯次，分別於上學期與下學期期末考後一個 月內舉行。\n\n資格考試科目為計算機結構、電腦網路、作業系統、演算法、電子電 路學、機率學、密碼學，每科考試次數不限。\n\n本系博士生應在入學後二年內（休學期間不計）通過資格考試科目中 的三科，未通過者應令退學。\n\n本系碩士班在學學生經指導教授簽署同意後，得申請參加資格考試。 該生若於碩士班畢業當年進入本系博士班就讀或逕讀博士班，則資 格考試之結果（含「通過」科目、「不通過」次數），均為有效。該 生若於碩士班畢業二年內未進入本系博士班就讀，則資格考試之結 果全部取消。\n\n( 二 ) 論文計畫書審查：\n\n本系博士生論文諮議委員會成員如下：指導教授、指導教授推薦相關 系所助理教授 ( 含 ) 以上二人、本系推薦一人。其中本系委員應佔二分 之一（含）以上。\n\n本系博士生在通過資格考試後一年內（休學期間不計）必須通過論文 計畫書諮議委員會之口試審查。經委員會全數委員通過，始為通過。 第一次未通過者重提論文計畫審查不受前述資格考後一年內完成之 限制，但仍須於資格考試後一年半內完成，重提論文計畫審查以一次 為限，仍不及格者，應令退學。論文計晝審查通過六個月後，始可申 請博士學位考試。\n\n四、博士班論文發表相關規定：\n\n( 一 ) 本系博士生發表之論文，至少需達到下列兩項最低標準之一，始可申請 博士學位考試：\n\n1.\n\nSCIE IEEE/IET Electronic Library 收錄、或 ACM Digtal Library 收錄、或 B 級以上之國際會議\n\n申請學位考試時，修業時間已逾四年者： 至少一篇 期刊論文代表作，以及至少一篇 論文 ( 或一個與畢業論文相關之實作系統 ) 。\n\n申請學位考試時，修業時間未滿四年者： 除需符合上述條件之外，其中需有一篇 A 級 SCIE 期刊長篇論文， 或需有一篇 A 級國際會議論文，或畢業論文相關之實作系統參加全 國或國際性之競賽獲獎前三名者。 ( 期刊和會議論文等級另公佈於本 系網頁 ) 。\n\n上述期刊論文代表作中，該博士生須在至少一篇 SCIE 論文，於所有作 者（指導教授除外）中列名第一位。代表作不得為其他博士生（含已畢 業或未畢業者）之代表作。\n\n( 二 ) 本系博士生發表之論文必須是在本系碩士班、博士班就讀期間，利用本 系全銜 ( 或在本系之後加列其服務單位 ) 刊登，且其指導教授需列名其上， 本系始承認其為在學期間之研究結果，並列入上述之計算標準。\n\n( 三 ) 本系博士生於申請博士學位考試資格審查前參加至少一次國際性會議， 並於會議上以英文報告論文 ( 需提出佐證資料 ) 。\n\n五、博士班學位考試：\n\n( 一 ) 本系博士生於完成論文後，經其指導教授簽字同意，認定其論文成果具 原創性及完整性，並已達博士論文水準，始可申請博士學位考試。申請博 士學位考試者，須於考試前至少一個月提出申請，並由系學術委員會委 員進行書面審查，如有疑義，得召開系學術委員會會議審查之（審查項目\n\n包含修業年限、修習學分、博士候選人資格考核、英文能力、論文計畫是 否於期限內通過審查、是否符合論文發表相關規定，及依學校相關法規 規定應審查之事項），始得進行博士學位考試。\n\n( 二 ) 已達修業年限，於應提出學位考試申請之時，其修習課程或英文能力仍未 達規定者，得以切結方式申請先行審查其它畢業要項，但仍須於滿足所有 修業規定後，方得提出學位考試申請。\n\n( 三 ) 本系博士班學生之學位論文須與資訊工程領域相關；資訊安全博士班學 生之學位論文須與資訊安全領域相關。\n\n( 四 ) 博士學位考試悉依本校「研究生學位考試施行細則」之規定辦理。\n\n六、畢業：符合上述之各項規定者，得提出畢業之申請。\n\n七、本辦法經系務會議、院務會議通過，簽請校長核定後施行，修正時亦同。', '<2-hop>  [202107061416040758.md]\n\n國立中山大學光電工程學系 博士班研究生資格考核及學位考試相關規定\n\n110 學年度起入學新生適用\n\n經 91 年 11 月 25 日所務會議修正通過 經 92 年 3 月 25 日院務會議修正通過 經 93 年 12 月 14 日 93 學年度第一學期所務會議修正通過 經 94 年 1 月 25 日 93 學年度第一次院務會議修正通過 經 95 年 11 月 29 日 95 學年度第一學期所務會議修正通過 經 97 年 1 月 16 日 96 學年度第一學期所務會議修正通過 經 97 年 3 月 6 日 96 學年度第二學期第二次院務會議修正通過 經 97 年 9 月 11 日 97 學年度第一學期系務會議修正通過 經 97 年 10 月 8 日 97 學年度第一學期第一次院務會議修正通過 經 98 年 10 月 09 日 98 學年度第一學期第一次系務會議修正通過 經 98 年 11 月 09 日 98 學年度第一學期第一次院務會議修正通過 經 99 年 11 月 10 日 99 學年度第一學期第三次系務會議修正通過 經 99 年 12 月 15 日 99 學年度第一學期第二次院務會議修正通過 經 100 年 9 月 22 日 100 學年度第二次系務會議修正通過 經 100 年 11 月 2 日 100 學年度第一次院務會議修正通過 經 100 年 11 月 04 簽準奉核 經 101 年 9 月 19 日 101 學年度第 2 次系務會議修正通過 經 101 年 10 月 25 日 101 學年度第 1 次院務會議修正通過 經 101 年 11 月 02 簽準奉核 經 102 年 5 月 15 日 101 學年度第 7 次系務會議修正通過 經 102 年 05 月 29 日 101 學年度第 3 次院務會議修正通過 經 102 年 6 月 6 日簽準奉核 經 102 年 10 月 9 日 102 學年度第 4 次系務會議修正通過\n\n經 102 年 11 月 19 日 102 學年度第 2 次院務會議修正通過 經 102 年 11 月 22 日簽準奉核 經 106 年 2 月 22 日 105 學年度第 5 次系務會議修正通過 經 106 年 5 月 25 日 105 學年度第 3 次院務會議修正通過 經 106 年 6 月 3 日簽準奉核 經 108 年 5 月 29 日 107 學年度第 8 次系務會議修正通過 經 108 年 7 月 2 日 107 學年度第 10 次系務會議修正通過 經 108 年 7 月 5 日 107 學年度臨時院務會議修正通過 經 108 年 7 月 22 日簽準奉核 經 109 年 4 月 1 日 108 學年度第 9 次系務會議修正通過 經 109 年 5 月 25 日 108 學年度第 3 次院務會議修正通過 經 109 年 6 月 16 日簽準奉核 經 109 年 5 月 27 日 108 學年度第 11 次系務會議修正通過 經 109 年 7 月 1 日 108 學年度第 12 次系務會議修正通過 經 110 年 2 月 19 日 109 學年度第 1 次院務會議修正通過 經 110 年 3 月 15 日簽準奉核 經 110 年 3 月 31 日 109 學年度第 7 次系務會議修正通過\n\n一、依據教育部頒「學位授予法」 、本校「學則」及「研究生學位考試施行細則」訂定之。\n\n二、在學期間相關事項：\n\n( 一 ) 每週在校時間：\n\n未修畢本系規定之博士班最低畢業學分數前，一般生每週至少需在校 4 天 ( 每日至少 須 8 小時 ) ，在職生每週至少在校 2 天（四次半天） ，從事研究或課堂上課。\n\n( 二 ) 修業年限：每位學生修業年限為 2 至 7 年 ( 不含保留入學及休學期間 ) 。\n\n( 三 ) 學分制度及修課要求：\n\n學生選課均須經指導教授及系主任認可。\n\n博士班學生入學後 4 年內 ( 不含休學期間 ) ，須修畢規定之最低畢業學分數 18 學分， 其中需修滿本系開設之光電專業課程滿 15 學分（包含二門必修課：書報討論（一） （二） ）並完成博士學位候選人資格考試。\n\n( 四 ) 自 100 學年度起，最高承認選修 2 門大學部課程（該課程需於選課系統備註其學分可 承認於研究所）為其畢業學分。\n\n( 五 ) 指導教授選派：\n\n研究生倘因故須更改已選定之指導教授，必須獲得原指導教授及新指導教授之書面同 意後，始得更改。\n\n( 六 ) 需通過託福測驗 550 分或託福電腦化測驗 (TOFEL CBT)213 分、或全民英語能力分級 檢定考試 (GEPT) 中高級初試、或多益測驗（ TOEIC ） 750 分，或依規定修畢『語文課 程：英語文』 領域 4 學分（相關語文課程須滿足本校英文中高級、英文高級課程） ， 修課成績達 70 分（含）以上） ，或修習本系課程委員會指定之英文相關課程取代之。\n\n( 七 ) 其他：\n\n若需由外所老師共同指導時，需經指導教授同意後，於論文計劃書提審前，填妥本系 共同指導表繳交系辦備查。\n\n三、博士學位候選人資格考核：\n\n學期之定義：上學期自每年 8 月 1 日至次年 1 月 31 日、下學期自每年 2 月 1 日至 7 月 31 日。\n\n( 一 ) 資格考試：入學後 4 年內 ( 不含休學期間 ) 須通過資格考試，未通過者，得令退學。 * 考試科目：\n\n光電電磁學、光電子學。\n\n2 門繫上公告之不同領域的必選修核心課程。\n\n* 資格考通過標準：\n\nA. 考 4 科通過 3 科，每科滿分為 100 分，而每科及格分數為 70 分\n\n一科（含）以下及格者：一律重考。\n\n二科及格者，可選擇下列一種方式：\n\n(1) 及格科目不必重考，但第二次考試時需有另外兩科及格視為通過。\n\n(2) 第二次考試時，可選擇重考四科，並以一次三科及格者視為通過。\n\n三科（含）以上及格者：通過。\n\n備註：學科考試若不及格但在及格分數以下 10% （含）以內者（即大於等於 63 分） ， 經學科考試委員會同意，得視同通過學科考試，但畢業時，依據論文已發表 （或 接受）之論文點數加重二點計分。 （於第一次報考時如符合本款之規定，即可 申請引用本款之規定） 。\n\nB. 考 4 科，其中 2 科可由修課成績達 A （含）以上抵免，另選考剩餘 2 科至少通過 1 科。 * 免學科考試辦法：博士班學生能同時滿足下列情形者，得申請免考學科考試：\n\n所修之 18 學分課程中，每門課成績排名在全班修課人數之二分之一（含）之前者。\n\n博士班期間已發表論文點數至少四點（含已接受） 。\n\n畢業論文總點數至少 12 點。 （點數計算辦法：依下列第三條規定）\n\n所發表之論文至少有兩篇是全部作者中排名第一。\n\n備註：若博士班研究生於參加資格考學科考試未通過，仍可申請採用此方式，若符合 上述 1 ～ 4 規定者，亦視為通過。\n\n本系博士班研究生通過資格考或申請免學科考試後，需本款適用自 109 學年度起通過資\n\n格考或經核准免學科考試之博士班研究生。\n\n( 二 ) 專題報告：\n\n博士班學生於書報討論提出一次專題報告，需於前一學期向系辦提出申請。\n\n報告者自行邀請繫上三位老師出席 ( 含指導教授 ) 。\n\n博士班學生必須通過專題報告後才可申請論文提審。\n\n( 三 ) 論文計畫書提審：\n\n博士班學生須於資格考通過或所修之 18 學分課程中，每門課成績排名在全班修課 人數之二分之一（含）之前者及當時已發表論文點數四點（含）以上，並經指導 教授同意後，並在修業期限內及提出學位口試申請前 6 個月通過論文計畫書提審。\n\n論文計畫審查委員三位（含）以上，以本系所屬研究領域之教師為當然委員，如 所屬研究領域教師不足額時，則由系內外助理教授以上人員組成，經由指導教授 提名，系主任同意後聘請之。\n\n論文計畫審查必須於報告前二週正式提出申請並公告。\n\n論文計畫書提審評審標準為「 2/3 （含）以上與會教師評定通過者才為通過」 。\n\n未通過論文計畫審查者，經修正並獲指導教授同意後，必須重新提出審查申請。\n\n( 四 ) 博士班論文發表相關規定：\n\n學位考試前，根據畢業論文以發表或被接受之著作總點數至少 4 點，期刊點數依下 列之規定。\n\n期刊論文之發表點數計算方式標準如下：\n\n(1) 申請畢業博士生之指導教授及共同指導教授不列入作者數。\n\n(2) 二位作者時，第一位佔 80% ，第二位佔 40% 。\n\n(3) 三位或三位以上作者時，第一位佔 70% ，第二位佔 30% ，第三位佔 20% ，第四 位以後不採計。\n\nScience Citation Index(SCI 點數採當年或最近一年資料計算 ) 收錄的期刊等級分類 為：\n\n(1) SCI Impact Factor 2.0 以上為 A + 級，每篇論文點數為 4 點。\n\n(2) SCI Impact Factor 0.9 以上為 A 級，每篇論文點數為 3 點。\n\n(3) SCI Impact Factor 0.4 以上為 B 級，每篇論文點數為 2 點。\n\n(4) SCI Impact Factor 0.4 以下為 C 級，每篇論文點數為 1 點。\n\n(5) 若 SCI Impact Factor 0.4-0.9 之間，但其排名為該領域前 20% 者，仍視為 A 級。\n\n本系博士生資格考核之論文發表點數計算，該篇發表論文發表作者必須包含指導教 授，若無，則該發表論文不得計入畢業點數。\n\n五 ) 博士班學位考試：\n\n研究生於通過博士候選人資格考核，並符合論文發表相關規定後，由指導教授推 薦，始得參加博士候選人學位考試。\n\n博士候選人學位考試考試委員人選，由指導教授依本校 「研究生學位考試施行細則」 第十、十一、十三條之規定提名，經系主任同意後陳請校長核定聘任之。\n\n學位考試成績不及格而其修業年限尚未屆滿者，得於次學期或次學年舉行重考，重 考以一次為限，經重考一次仍不及格者，依本校學則規定應令退學。\n\n（六）本系博士班之本國籍學生，畢業前需赴國外進行交流，條件包括以下各點，擇一完 成，方得提出學位考試。\n\n申請出國交換/研修( 3 個月以上)。\n\n完成系所規劃之學生（學期/暑期）國外研修課程或計畫( 3 個月以上)。\n\n取得本校合作之境外大學雙聯學位。\n\n具在職身分學生(檢具在職證明)及其他因素無法長期出國交流者，得提供相關佐 證資料，經本系課程委員會議審議通過認定之。\n\n（七）博士畢業論文：\n\n學生繳交學位論文定稿時需檢附防抄襲之分數證明。\n\n防論文抄襲以中山大學當年度之論文原創性比對系統為主。排除引言、參考文獻、 目錄、 附件等，論文原創性比對系統分數需12%（含)以下才通過，若超過需詳敘 具體原因，經指導教授簽名確認未有抄襲疑慮，始得通過。\n\n四、畢業：符合上述之各項規定者，得提出畢業之申請。\n\n五、本規定經系務會議、院務會議通過，簽請校長核定後施行，修正時亦同。']",staff,Poor grammar,medium,"<1-hop>  [202109271451321039.md]

國立中山大學資訊工程學系 博士班暨資訊安全博士班研究生資格考核及學位考試相關規定

109 學年度起入學新生適用

92 年 2 月 26 日系務會議修正通過 92 年 3 月 25 日工學院院務會議修正通過 93 年 12 月 29 日系務會議修正通過 94 年 1 月 25 日工學院院務會議修正通過 94 年 3 月 9 日系務會議修正通過 94 年 3 月 23 日工學院院務會議修正通過 95 年 9 月 27 日系務會議修正通過 95 年 11 月 1 日工學院院務會議修正通過 96 年 3 月 30 日系務會議修正通過 96 年 6 月 15 日工學院院務會議修正通過 97 年 6 月 9 日系務會議修正通過 97 年 6 月 10 日工學院院務會議修正通過 98 年 5 月 20 日系務會議修正通過 98 年 6 月 10 日工學院院務會議修正通過 98 年 9 月 23 日系務會議修正通過 99 年 6 月 28 日工學院院務會議修正通過 101 年 12 月 25 日系務會議修正通過 102 年 3 月 5 日工學院院務會議修正通過 102 年 3 月 29 日系務會議修正通過 102 年 5 月 29 日工學院院務會議修正通過 103 年 2 月 20 日系務會議修正通過 103 年 6 月 6 日系務會議修正通過 103 年 6 月 13 日工學院院務會議修正通過 106 年 6 月 19 日系務會議修正通過 106 年 6 月 28 日工學院院務會議修正通過 108 年 2 月 25 日系務會議修正通過 108 年 3 月 28 日工學院務會議修正通過 109 年 5 月 8 日系務會議修正通過

109 年 5 月 25 日工學院務會議修正通過

一、依據教育部頒「學位授予法」 、本校「學則」及「研究生學位考試施行細 則」訂定之。

二、在學期間相關事項：

( 一 ) 修業年限：依教育部規定二至七年 ( 不含保留入學及休學期間 ) 。

( 二 ) 學分制度及修課要求：

本系博士生畢業之前必須至少修滿碩士班或博士班課程 22 學分，其 中本系開授課程至少 19 學分，其餘課程經本系同意後，得選修相關 碩、博士班開授之課程。逕讀博士學位者，至少須修滿 40 學分，其 中本系開授課程至少 30 學分。其碩士班一年級所修之學分，最多可 取三分之二的學分計入博士學位學分，且至多以 12 學分為限。

申請逕讀博士學位者，於申請前須修畢碩士班必修課程（書報討論除 外）。

共同必修課程：本系博士生修業前二年須選修「書報討論（一）」至 「書報討論（四）」；且每學期至少須修習一門 3 學分課程。

專業必修課程：

資訊安全博士班：「安全密碼協定」、「數位簽章機制與應用」、「密 碼學」、「安全程式設計」、「駭客攻防與電腦鑑識技術」、「網路 安全」、「計算機結構」等專業課程，學生畢業前至少需擇 2 科修畢

通過。

本系博士生每學期修讀課程，須經指導教授同意後確定之。如無指導 教授，則須經導師或系主任同意後確定之。

本系博士班研究生畢業英文成績最低標準以通過下列任一檢定標準 且通過之測驗檢定日期應以入學前 2 年之後取得為限：

(1) 多益測驗 TOEIC 成績達 750 分以上。

(2) 全民英檢 (GEPT) 中高級複試 ( 含 ) 以上。

(3) 託福紙筆測驗 (TOFEL ITP)527 分 ( 含 ) 以上

(4) 託福網路化測驗 (TOFEL-iBT)71 分 ( 含 ) 以上。

(5) 國際英語能力測驗 (IELTS)5.5 級 ( 含 ) 以上。

如測驗上述檢定項目二次以上仍未達標準，得修習本系課程委員會 指定之英文相關課程取代且修課成績需及格且為該科全部修課人數 之前二分之一。若以修習英文相關課程方式取代英文成績者，該學分 則不納入畢業學分。

為加強本系博士生的學識能力、研究能力或英文能力，本系得指定其 補修相關課程。

須達本系博士班研究生規定之英文成績標準後，始得以申請學位考 試。

( 三 ) 指導教授選派：

本系博士生以選擇本系助理教授 ( 含 ) 以上專任教師擔任博士論文指 導教授為原則。

若有特殊原因，得選擇非本系之指導教授，但必須選擇一位本系助理 教授 ( 含 ) 以上專任教師為共同指導教授。若需由系外老師共同指導時， 需經指導教授同意後，向繫上提出申請，如共同指導教授指導學生至 其畢業時未達一年以上者，取消其共同指導資格。

本系博士生應於入學後一年內決定其論文指導教授。同學未於期限 內決定指導教授者，將由繫上協調指派指導教授。

若因特殊原因需更換指導教授時，應先徵得原指導教授及新指導教 授同意，並以書面向本系報備。

三、博士學位候選人資格考核：

學期之定義：上學期自每年八月一日至次年一月三十一日、下學期自每年 二月一日至七月三十一日。

( 一 ) 資格考試：

資格考試以筆試行之。各科考試結果由本系系務會議議決「通過」或 「不通過」。

資格考試時間每年分兩梯次，分別於上學期與下學期期末考後一個 月內舉行。

資格考試科目為計算機結構、電腦網路、作業系統、演算法、電子電 路學、機率學、密碼學，每科考試次數不限。

本系博士生應在入學後二年內（休學期間不計）通過資格考試科目中 的三科，未通過者應令退學。

本系碩士班在學學生經指導教授簽署同意後，得申請參加資格考試。 該生若於碩士班畢業當年進入本系博士班就讀或逕讀博士班，則資 格考試之結果（含「通過」科目、「不通過」次數），均為有效。該 生若於碩士班畢業二年內未進入本系博士班就讀，則資格考試之結 果全部取消。

( 二 ) 論文計畫書審查：

本系博士生論文諮議委員會成員如下：指導教授、指導教授推薦相關 系所助理教授 ( 含 ) 以上二人、本系推薦一人。其中本系委員應佔二分 之一（含）以上。

本系博士生在通過資格考試後一年內（休學期間不計）必須通過論文 計畫書諮議委員會之口試審查。經委員會全數委員通過，始為通過。 第一次未通過者重提論文計畫審查不受前述資格考後一年內完成之 限制，但仍須於資格考試後一年半內完成，重提論文計畫審查以一次 為限，仍不及格者，應令退學。論文計晝審查通過六個月後，始可申 請博士學位考試。

四、博士班論文發表相關規定：

( 一 ) 本系博士生發表之論文，至少需達到下列兩項最低標準之一，始可申請 博士學位考試：

1.

SCIE IEEE/IET Electronic Library 收錄、或 ACM Digtal Library 收錄、或 B 級以上之國際會議

申請學位考試時，修業時間已逾四年者： 至少一篇 期刊論文代表作，以及至少一篇 論文 ( 或一個與畢業論文相關之實作系統 ) 。

申請學位考試時，修業時間未滿四年者： 除需符合上述條件之外，其中需有一篇 A 級 SCIE 期刊長篇論文， 或需有一篇 A 級國際會議論文，或畢業論文相關之實作系統參加全 國或國際性之競賽獲獎前三名者。 ( 期刊和會議論文等級另公佈於本 系網頁 ) 。

上述期刊論文代表作中，該博士生須在至少一篇 SCIE 論文，於所有作 者（指導教授除外）中列名第一位。代表作不得為其他博士生（含已畢 業或未畢業者）之代表作。

( 二 ) 本系博士生發表之論文必須是在本系碩士班、博士班就讀期間，利用本 系全銜 ( 或在本系之後加列其服務單位 ) 刊登，且其指導教授需列名其上， 本系始承認其為在學期間之研究結果，並列入上述之計算標準。

( 三 ) 本系博士生於申請博士學位考試資格審查前參加至少一次國際性會議， 並於會議上以英文報告論文 ( 需提出佐證資料 ) 。

五、博士班學位考試：

( 一 ) 本系博士生於完成論文後，經其指導教授簽字同意，認定其論文成果具 原創性及完整性，並已達博士論文水準，始可申請博士學位考試。申請博 士學位考試者，須於考試前至少一個月提出申請，並由系學術委員會委 員進行書面審查，如有疑義，得召開系學術委員會會議審查之（審查項目

包含修業年限、修習學分、博士候選人資格考核、英文能力、論文計畫是 否於期限內通過審查、是否符合論文發表相關規定，及依學校相關法規 規定應審查之事項），始得進行博士學位考試。

( 二 ) 已達修業年限，於應提出學位考試申請之時，其修習課程或英文能力仍未 達規定者，得以切結方式申請先行審查其它畢業要項，但仍須於滿足所有 修業規定後，方得提出學位考試申請。

( 三 ) 本系博士班學生之學位論文須與資訊工程領域相關；資訊安全博士班學 生之學位論文須與資訊安全領域相關。

( 四 ) 博士學位考試悉依本校「研究生學位考試施行細則」之規定辦理。

六、畢業：符合上述之各項規定者，得提出畢業之申請。

七、本辦法經系務會議、院務會議通過，簽請校長核定後施行，修正時亦同。","<2-hop>  [202107061416040758.md]

國立中山大學光電工程學系 博士班研究生資格考核及學位考試相關規定

110 學年度起入學新生適用

經 91 年 11 月 25 日所務會議修正通過 經 92 年 3 月 25 日院務會議修正通過 經 93 年 12 月 14 日 93 學年度第一學期所務會議修正通過 經 94 年 1 月 25 日 93 學年度第一次院務會議修正通過 經 95 年 11 月 29 日 95 學年度第一學期所務會議修正通過 經 97 年 1 月 16 日 96 學年度第一學期所務會議修正通過 經 97 年 3 月 6 日 96 學年度第二學期第二次院務會議修正通過 經 97 年 9 月 11 日 97 學年度第一學期系務會議修正通過 經 97 年 10 月 8 日 97 學年度第一學期第一次院務會議修正通過 經 98 年 10 月 09 日 98 學年度第一學期第一次系務會議修正通過 經 98 年 11 月 09 日 98 學年度第一學期第一次院務會議修正通過 經 99 年 11 月 10 日 99 學年度第一學期第三次系務會議修正通過 經 99 年 12 月 15 日 99 學年度第一學期第二次院務會議修正通過 經 100 年 9 月 22 日 100 學年度第二次系務會議修正通過 經 100 年 11 月 2 日 100 學年度第一次院務會議修正通過 經 100 年 11 月 04 簽準奉核 經 101 年 9 月 19 日 101 學年度第 2 次系務會議修正通過 經 101 年 10 月 25 日 101 學年度第 1 次院務會議修正通過 經 101 年 11 月 02 簽準奉核 經 102 年 5 月 15 日 101 學年度第 7 次系務會議修正通過 經 102 年 05 月 29 日 101 學年度第 3 次院務會議修正通過 經 102 年 6 月 6 日簽準奉核 經 102 年 10 月 9 日 102 學年度第 4 次系務會議修正通過

經 102 年 11 月 19 日 102 學年度第 2 次院務會議修正通過 經 102 年 11 月 22 日簽準奉核 經 106 年 2 月 22 日 105 學年度第 5 次系務會議修正通過 經 106 年 5 月 25 日 105 學年度第 3 次院務會議修正通過 經 106 年 6 月 3 日簽準奉核 經 108 年 5 月 29 日 107 學年度第 8 次系務會議修正通過 經 108 年 7 月 2 日 107 學年度第 10 次系務會議修正通過 經 108 年 7 月 5 日 107 學年度臨時院務會議修正通過 經 108 年 7 月 22 日簽準奉核 經 109 年 4 月 1 日 108 學年度第 9 次系務會議修正通過 經 109 年 5 月 25 日 108 學年度第 3 次院務會議修正通過 經 109 年 6 月 16 日簽準奉核 經 109 年 5 月 27 日 108 學年度第 11 次系務會議修正通過 經 109 年 7 月 1 日 108 學年度第 12 次系務會議修正通過 經 110 年 2 月 19 日 109 學年度第 1 次院務會議修正通過 經 110 年 3 月 15 日簽準奉核 經 110 年 3 月 31 日 109 學年度第 7 次系務會議修正通過

一、依據教育部頒「學位授予法」 、本校「學則」及「研究生學位考試施行細則」訂定之。

二、在學期間相關事項：

( 一 ) 每週在校時間：

未修畢本系規定之博士班最低畢業學分數前，一般生每週至少需在校 4 天 ( 每日至少 須 8 小時 ) ，在職生每週至少在校 2 天（四次半天） ，從事研究或課堂上課。

( 二 ) 修業年限：每位學生修業年限為 2 至 7 年 ( 不含保留入學及休學期間 ) 。

( 三 ) 學分制度及修課要求：

學生選課均須經指導教授及系主任認可。

博士班學生入學後 4 年內 ( 不含休學期間 ) ，須修畢規定之最低畢業學分數 18 學分， 其中需修滿本系開設之光電專業課程滿 15 學分（包含二門必修課：書報討論（一） （二） ）並完成博士學位候選人資格考試。

( 四 ) 自 100 學年度起，最高承認選修 2 門大學部課程（該課程需於選課系統備註其學分可 承認於研究所）為其畢業學分。

( 五 ) 指導教授選派：

研究生倘因故須更改已選定之指導教授，必須獲得原指導教授及新指導教授之書面同 意後，始得更改。

( 六 ) 需通過託福測驗 550 分或託福電腦化測驗 (TOFEL CBT)213 分、或全民英語能力分級 檢定考試 (GEPT) 中高級初試、或多益測驗（ TOEIC ） 750 分，或依規定修畢『語文課 程：英語文』 領域 4 學分（相關語文課程須滿足本校英文中高級、英文高級課程） ， 修課成績達 70 分（含）以上） ，或修習本系課程委員會指定之英文相關課程取代之。

( 七 ) 其他：

若需由外所老師共同指導時，需經指導教授同意後，於論文計劃書提審前，填妥本系 共同指導表繳交系辦備查。

三、博士學位候選人資格考核：

學期之定義：上學期自每年 8 月 1 日至次年 1 月 31 日、下學期自每年 2 月 1 日至 7 月 31 日。

( 一 ) 資格考試：入學後 4 年內 ( 不含休學期間 ) 須通過資格考試，未通過者，得令退學。 * 考試科目：

光電電磁學、光電子學。

2 門繫上公告之不同領域的必選修核心課程。

* 資格考通過標準：

A. 考 4 科通過 3 科，每科滿分為 100 分，而每科及格分數為 70 分

一科（含）以下及格者：一律重考。

二科及格者，可選擇下列一種方式：

(1) 及格科目不必重考，但第二次考試時需有另外兩科及格視為通過。

(2) 第二次考試時，可選擇重考四科，並以一次三科及格者視為通過。

三科（含）以上及格者：通過。

備註：學科考試若不及格但在及格分數以下 10% （含）以內者（即大於等於 63 分） ， 經學科考試委員會同意，得視同通過學科考試，但畢業時，依據論文已發表 （或 接受）之論文點數加重二點計分。 （於第一次報考時如符合本款之規定，即可 申請引用本款之規定） 。

B. 考 4 科，其中 2 科可由修課成績達 A （含）以上抵免，另選考剩餘 2 科至少通過 1 科。 * 免學科考試辦法：博士班學生能同時滿足下列情形者，得申請免考學科考試：

所修之 18 學分課程中，每門課成績排名在全班修課人數之二分之一（含）之前者。

博士班期間已發表論文點數至少四點（含已接受） 。

畢業論文總點數至少 12 點。 （點數計算辦法：依下列第三條規定）

所發表之論文至少有兩篇是全部作者中排名第一。

備註：若博士班研究生於參加資格考學科考試未通過，仍可申請採用此方式，若符合 上述 1 ～ 4 規定者，亦視為通過。

本系博士班研究生通過資格考或申請免學科考試後，需本款適用自 109 學年度起通過資

格考或經核准免學科考試之博士班研究生。

( 二 ) 專題報告：

博士班學生於書報討論提出一次專題報告，需於前一學期向系辦提出申請。

報告者自行邀請繫上三位老師出席 ( 含指導教授 ) 。

博士班學生必須通過專題報告後才可申請論文提審。

( 三 ) 論文計畫書提審：

博士班學生須於資格考通過或所修之 18 學分課程中，每門課成績排名在全班修課 人數之二分之一（含）之前者及當時已發表論文點數四點（含）以上，並經指導 教授同意後，並在修業期限內及提出學位口試申請前 6 個月通過論文計畫書提審。

論文計畫審查委員三位（含）以上，以本系所屬研究領域之教師為當然委員，如 所屬研究領域教師不足額時，則由系內外助理教授以上人員組成，經由指導教授 提名，系主任同意後聘請之。

論文計畫審查必須於報告前二週正式提出申請並公告。

論文計畫書提審評審標準為「 2/3 （含）以上與會教師評定通過者才為通過」 。

未通過論文計畫審查者，經修正並獲指導教授同意後，必須重新提出審查申請。

( 四 ) 博士班論文發表相關規定：

學位考試前，根據畢業論文以發表或被接受之著作總點數至少 4 點，期刊點數依下 列之規定。

期刊論文之發表點數計算方式標準如下：

(1) 申請畢業博士生之指導教授及共同指導教授不列入作者數。

(2) 二位作者時，第一位佔 80% ，第二位佔 40% 。

(3) 三位或三位以上作者時，第一位佔 70% ，第二位佔 30% ，第三位佔 20% ，第四 位以後不採計。

Science Citation Index(SCI 點數採當年或最近一年資料計算 ) 收錄的期刊等級分類 為：

(1) SCI Impact Factor 2.0 以上為 A + 級，每篇論文點數為 4 點。

(2) SCI Impact Factor 0.9 以上為 A 級，每篇論文點數為 3 點。

(3) SCI Impact Factor 0.4 以上為 B 級，每篇論文點數為 2 點。

(4) SCI Impact Factor 0.4 以下為 C 級，每篇論文點數為 1 點。

(5) 若 SCI Impact Factor 0.4-0.9 之間，但其排名為該領域前 20% 者，仍視為 A 級。

本系博士生資格考核之論文發表點數計算，該篇發表論文發表作者必須包含指導教 授，若無，則該發表論文不得計入畢業點數。

五 ) 博士班學位考試：

研究生於通過博士候選人資格考核，並符合論文發表相關規定後，由指導教授推 薦，始得參加博士候選人學位考試。

博士候選人學位考試考試委員人選，由指導教授依本校 「研究生學位考試施行細則」 第十、十一、十三條之規定提名，經系主任同意後陳請校長核定聘任之。

學位考試成績不及格而其修業年限尚未屆滿者，得於次學期或次學年舉行重考，重 考以一次為限，經重考一次仍不及格者，依本校學則規定應令退學。

（六）本系博士班之本國籍學生，畢業前需赴國外進行交流，條件包括以下各點，擇一完 成，方得提出學位考試。

申請出國交換/研修( 3 個月以上)。

完成系所規劃之學生（學期/暑期）國外研修課程或計畫( 3 個月以上)。

取得本校合作之境外大學雙聯學位。

具在職身分學生(檢具在職證明)及其他因素無法長期出國交流者，得提供相關佐 證資料，經本系課程委員會議審議通過認定之。

（七）博士畢業論文：

學生繳交學位論文定稿時需檢附防抄襲之分數證明。

防論文抄襲以中山大學當年度之論文原創性比對系統為主。排除引言、參考文獻、 目錄、 附件等，論文原創性比對系統分數需12%（含)以下才通過，若超過需詳敘 具體原因，經指導教授簽名確認未有抄襲疑慮，始得通過。

四、畢業：符合上述之各項規定者，得提出畢業之申請。

五、本規定經系務會議、院務會議通過，簽請校長核定後施行，修正時亦同。",202109271451321039.md,202107061416040758.md,['博士班論文發表規定'],工學院↔工學院,博士班論文發表規定↔博士班論文發表規定,5.0,4.64,4.98,5.0,5.0,2.0,5.0
國立中山大學中國文學系的課程委員會是如何組成的？該委員會的職責有哪些？另外，該系系主任的遴選及續聘程序是怎樣規定的？,根據國立中山大學中國文學系「課程委員會設置要點」，系課程委員會由本系專任教師5名、學生代表1至2人、校外專家學者(含業界代表)1至2人組成，系主任為當然委員兼召集人。其職責包括定期檢討修正系所課程、課程結構與發展方向，初審入學新生必修科目表相關事宜，初審新開課程的課程名稱、內容、大綱及相關因素，審議課程相關問題，考量教師專長及平衡研究、教學負擔，規劃安排每學年度課程授課教師，研議課程改善機制並提案討論，相關決議須經系務會議通過後送院課程委員會審議。至於系主任的遴選及續聘程序，依據「國立中山大學各級學術主管遴選續聘及解聘實施要點」，系主任除續任者另依規定辦理外，應於任期屆滿五個月前或因故出缺三個月內，經行政程序簽請校長同意後成立遴選委員會，遴選教授1至3名，系務會議無記名投票選出得票超過半數候選人，送院長轉請校長聘任。若無候選人得票過半，遴選委員會一個月內重新辦理遴選，仍無過半者，推舉得票最多前二人送院長轉請校長擇一聘任。系主任續任需於任期屆滿五個月前書面表示意願，提出績效報告及續任理念規劃書，經系務會議推選代表組成續任投票工作小組辦理投票，獲全體專任教師半數以上同意者通過續聘。系主任任期、解聘及相關資格依校規定辦理，且最近三年內需至少承接科技部專題研究計畫一件。,"['<1-hop>  [202005141625120295.md]\n\n國立中山大學中國文學系「課程委員會設置要點」\n\n98.12.09 98 學年度第 3 次系務會議訂定 99.01.15 98 學年度第 3 次院課程委員會議通過 99.03.24 98 學年度第 5 次系務會議修訂通過 99.05.06 98 學年度第 6 次院課程委員會議修訂通過 99.05.31 984 校課程委員會議通過 99.06.15 第 124 次教務會議通過\n\n105.11.30 105 學年度第 3 次系務會議修訂通過\n\n第一條 依據本校課程委員會設置要點第三條之規定，訂定本要點。\n\n第二條 本系課程委員會（以下簡稱「系課程會」），由本系專任教 師5名、學生代表1 至2 人、校外專家學者(含業界代表)1 至2 人組成(系主任為當然委員兼召集人)。\n\n第三條 系課程會之職責：\n\n一、定期檢討修正系所課程、課程結構與發展方向（納入業界、 畢業校友及學生（或家長）之意見） 。\n\n二、初審入學新生必修科目表相關之事宜。\n\n三、初審新開課程下列項目：\n\n．課程名稱（中、英文） 、課程內容、課程大綱。\n\n．考量其他相關因素，如新開設課程與教師專長之配合、與 系所發展方向之配合、與現有課程之關連等。\n\n四、課程相關問題之審議。\n\n五、考量教師專長及平衡研究、教學之負擔，規劃及安排每學年 度課程授課教師。\n\n六、研議系所課程相關改善機制，作成議案提系務會議討論。\n\n七、相關決議須經系務會議通過後方可送院課程委員會審議。\n\n第四條 本要點經系務會議通過，並送院、校課程委員會及教務會議核備 後實施，其修正時亦同。', '<2-hop>  [201909051455080361.md]\n\n國立中山大學文學院中國文學系 主任遴選續聘及解聘實施要點\n\n96.09.19 96 學年度第 1 次系教評會通過 96.09.26 96 學年度第 1 次系務會議修正通過 96.10.10 陳請校長核定通過 99.10.26 99 學年度第 1 次系務會議修正通過 99.11.04 陳請校長核定通過 100.10.26 100 學年度第 1 次系務會議修正通過 100.11.01 陳請校長核定通過 102.09.25 102 學年度第 1 次系務會議修正通過 102.10.14 陳請校長核定通過 105.05.02 104 學年度第 7 次系務會議修正通過 105.5.18 陳請校長核定通過\n\n一、本要點依據「國立中山大學各級學術主管遴選續聘及解聘實施要點」訂定 之。\n\n二、本系系主任除續任者另依第三點規定辦理外，應於任期屆滿五個月前或因 故出缺三個月內，依下列程序產生之：\n\n（一）依行政程序簽請校長同意後，再成立遴選委員會，遴選教授一至三名， 於系務會議召開時，以無記名方式投票，就得票超過有投票權者二分 之一之候選人，送院長轉請校長圈選一人聘請兼任之。\n\n（二）候選人無一人得票超過二分之一時，遴選委員會應於一個月內依前項 程序重新辦理遴選。如仍無一人得票超過二分之一時，遴選委員會得 推舉得票最多之前二人，送院長轉請校長擇一聘任之。\n\n三、本系系主任應於第一任任期屆滿五個月前，以書面向系務會議表示是否願 意續任，並向全系教師提出第一任系務績效報告及續任理念規劃書，依行 政程序簽核後辦理續任投票作業。\n\n系主任之續任投票，應於其任期屆滿四個月前，由系務會議推選至少三人 為代表，組成續任投票工作小組，辦理相關事宜。\n\n擬續任之系主任獲所屬全體專任教師二分之一以上同意者為通過，陳請校 長續聘之。\n\n系主任未表達續任意願或未通過續任時，依本要點第二點規定重新辦理遴 選。該系主任不得再參加新任主管遴選。\n\n四、擔任本系系主任者，最近三年內需至少承接科技部專題研究計畫一件。\n\n五、本系系主任任期、解聘及相關資格按本校規定辦理。\n\n六、本系系主任遴選委員會之組成與任期規定如下：\n\n（一）本系系主任遴選委員會置委員九人，由本系教師無記名投票互選九人 組成，召集人由委員互選之。遴選委員若為被遴選人，須辭委員職， 遺缺以得票數高低依序遞補。\n\n（二）遴選委員會委員任期至本系系主任選出之日止。\n\n七、本要點如有未盡事宜，依本校有關規定辦理。\n\n八、本要點經系務會議通過，陳請校長核定後實施，修正時亦同。']",teacher,Poor grammar,long,"<1-hop>  [202005141625120295.md]

國立中山大學中國文學系「課程委員會設置要點」

98.12.09 98 學年度第 3 次系務會議訂定 99.01.15 98 學年度第 3 次院課程委員會議通過 99.03.24 98 學年度第 5 次系務會議修訂通過 99.05.06 98 學年度第 6 次院課程委員會議修訂通過 99.05.31 984 校課程委員會議通過 99.06.15 第 124 次教務會議通過

105.11.30 105 學年度第 3 次系務會議修訂通過

第一條 依據本校課程委員會設置要點第三條之規定，訂定本要點。

第二條 本系課程委員會（以下簡稱「系課程會」），由本系專任教 師5名、學生代表1 至2 人、校外專家學者(含業界代表)1 至2 人組成(系主任為當然委員兼召集人)。

第三條 系課程會之職責：

一、定期檢討修正系所課程、課程結構與發展方向（納入業界、 畢業校友及學生（或家長）之意見） 。

二、初審入學新生必修科目表相關之事宜。

三、初審新開課程下列項目：

．課程名稱（中、英文） 、課程內容、課程大綱。

．考量其他相關因素，如新開設課程與教師專長之配合、與 系所發展方向之配合、與現有課程之關連等。

四、課程相關問題之審議。

五、考量教師專長及平衡研究、教學之負擔，規劃及安排每學年 度課程授課教師。

六、研議系所課程相關改善機制，作成議案提系務會議討論。

七、相關決議須經系務會議通過後方可送院課程委員會審議。

第四條 本要點經系務會議通過，並送院、校課程委員會及教務會議核備 後實施，其修正時亦同。","<2-hop>  [201909051455080361.md]

國立中山大學文學院中國文學系 主任遴選續聘及解聘實施要點

96.09.19 96 學年度第 1 次系教評會通過 96.09.26 96 學年度第 1 次系務會議修正通過 96.10.10 陳請校長核定通過 99.10.26 99 學年度第 1 次系務會議修正通過 99.11.04 陳請校長核定通過 100.10.26 100 學年度第 1 次系務會議修正通過 100.11.01 陳請校長核定通過 102.09.25 102 學年度第 1 次系務會議修正通過 102.10.14 陳請校長核定通過 105.05.02 104 學年度第 7 次系務會議修正通過 105.5.18 陳請校長核定通過

一、本要點依據「國立中山大學各級學術主管遴選續聘及解聘實施要點」訂定 之。

二、本系系主任除續任者另依第三點規定辦理外，應於任期屆滿五個月前或因 故出缺三個月內，依下列程序產生之：

（一）依行政程序簽請校長同意後，再成立遴選委員會，遴選教授一至三名， 於系務會議召開時，以無記名方式投票，就得票超過有投票權者二分 之一之候選人，送院長轉請校長圈選一人聘請兼任之。

（二）候選人無一人得票超過二分之一時，遴選委員會應於一個月內依前項 程序重新辦理遴選。如仍無一人得票超過二分之一時，遴選委員會得 推舉得票最多之前二人，送院長轉請校長擇一聘任之。

三、本系系主任應於第一任任期屆滿五個月前，以書面向系務會議表示是否願 意續任，並向全系教師提出第一任系務績效報告及續任理念規劃書，依行 政程序簽核後辦理續任投票作業。

系主任之續任投票，應於其任期屆滿四個月前，由系務會議推選至少三人 為代表，組成續任投票工作小組，辦理相關事宜。

擬續任之系主任獲所屬全體專任教師二分之一以上同意者為通過，陳請校 長續聘之。

系主任未表達續任意願或未通過續任時，依本要點第二點規定重新辦理遴 選。該系主任不得再參加新任主管遴選。

四、擔任本系系主任者，最近三年內需至少承接科技部專題研究計畫一件。

五、本系系主任任期、解聘及相關資格按本校規定辦理。

六、本系系主任遴選委員會之組成與任期規定如下：

（一）本系系主任遴選委員會置委員九人，由本系教師無記名投票互選九人 組成，召集人由委員互選之。遴選委員若為被遴選人，須辭委員職， 遺缺以得票數高低依序遞補。

（二）遴選委員會委員任期至本系系主任選出之日止。

七、本要點如有未盡事宜，依本校有關規定辦理。

八、本要點經系務會議通過，陳請校長核定後實施，修正時亦同。",202005141625120295.md,201909051455080361.md,"['國立中山大學文學院中國文學系', '國立中山大學中國文學系']",文學院↔文學院 | 中國文學系↔中國文學系,國立中山大學中國文學系↔國立中山大學文學院中國文學系,5.0,5.0,5.0,5.0,5.0,2.0,5.0
性別平等教育委員會議如何通過並實施關懷懷孕學生的受教權維護措施？這些措施與性別平等教育委員會在性別友善宿舍入住原則中所扮演的角色有何關聯？,根據本校108學年度第1學期第1次性別平等教育委員會議通過的《國立中山大學關懷懷孕學生受教權維護及輔導協助實施要點》，學校積極維護懷孕學生的受教權，設置專人服務窗口，提供必要的輔導與協助，並由校長邀集相關單位成立工作小組，將會議決議提報性別平等教育委員會議。此外，性別平等教育委員會也認可性別友善宿舍入住原則，要求相關宿舍服務人員參加性別講座或說明會，並由宿舍組負責規劃與執行性別友善宿舍管理業務，定期舉辦多元性別主題活動，傳遞性別友善及反歧視資訊。兩者皆體現性別平等教育委員會在保障學生權益及推動多元包容環境中的重要角色。,"['<1-hop>  [202403151048210219.md]\n\n國立中山大學關懷懷孕學生受教權維護及輔導協助實施要點\n\n108 年 11 月 20 日 本校 108 學年度第 1 學期第 1 次性別平等教育委員會議通過 111.03.30 本校 110 學年度第 2 學期第 4 次行政會議通過修正學務處所屬組織名稱\n\n一、 為落實本校積極維護懷孕學生之受教權，並提供必要之協助，依據性別平等 教育法第十四條之一規定，訂定本要點。\n\n二、 本校為關懷懷孕學生，應秉持多元、包容之精神，積極維護並保障學生之受教 權。協助過程應嚴守專業倫理，尊重隱私，採取必要之保密措施，維護懷孕或 育有子女學生之權益，提供最大協助。\n\n三、 本校為維護懷孕學生之權益與協助管道，於學生事務處諮商與健康促進組 （以 下簡稱諮健組）設置專人服務窗口，並提供社政、警政、民間社會福利與心理 衛生機構等聯繫網絡，適時提供資源。\n\n四、 若本校學生未成年（未滿 20 歲）懷孕時，諮健組應依「學生懷孕受教權維護 及輔導協助要點」進行通報，並由校長邀集相關單位成立工作小組，提供必要 之輔導與協助。成年學生或已婚學生因懷孕而有相關需求者，得向諮健組申 請協助，並依前項規定辦理。\n\n五、 工作小組依職責劃分輔導與行政單位，並應依據下列原則分工：\n\n( 一 ) 輔導單位：\n\n不定期視懷孕學生之需求，召開個案討論會議，並將會議決議提至本 校性別平等教育委員會議報告。\n\n建立懷孕學生紀錄，並依專業倫理妥適保存及管理其資料。\n\n( 二 ) 行政單位：\n\n主計室應依據性別平等教育法第十條規定，編列懷孕學生輔導協助 相關經費。\n\n教務處、各系所，依本校學則第廿三及第廿六條之規定彈性處理懷孕 學生出缺勤紀錄、補考、補救教學，並提供合乎需要之教室安排、課 桌椅調整、母乳哺 ( 集 ) 室等相關事項。\n\n總務處應視懷孕或育有子女學生之需求，規劃停車、如廁等相關設施。\n\n體育與衛生保健組視懷孕學生需要，結合相關資源，提供其多元適性 教育，內容包含孕程及產後照顧、母乳哺乳（集） 、非預期性懷孕知 能、家庭教育等，必要時與社區及醫療資源等網絡聯繫。\n\n六、 本要點經本校性別平等教育委員會議通過，陳請校長核定後實施，修正時亦 同。', '<2-hop>  [202509171642480752.md]\n\n國立中山大學性別友善宿舍入住原則\n\n113 年 5 月 8 日本校 112 學年度第 2 次學生事務會議通過\n\n一、 為提供性別友善之住宿環境，尊重及考量學生之不同生理性別、 性別特質、性別認同或性傾向，特訂定本原則。\n\n二、 跨性別者若欲入住，宜破除生理性別二分並依據其性別認同作 為性別判準。\n\n三、 申請者得個別提出申請或自行尋找室友一起申請。\n\n四、 房間安排以「男女分層」為原則，當特定性別樓層無空房時， 得安排「男女同層不同寢」。\n\n五、 有關處理學生住宿服務之相關人員，包括宿服組行政同仁、宿 舍服務員、工讀生、宿委會委員等，應參加至少一場由本校性 別平等教育委員會認可之性別講座或說明會。\n\n六、\n\n宿舍組負責規劃、執行與輔導性別友善宿舍之管理業務，並由 相關行政人員協同宿委會執行以下事項：\n\n( 一 ) 擔任宣導、處理及回應相關問題之對外窗口。\n\n( 二 ) 定期舉辦相關主題活動，以利住宿學生認識多元性別。\n\n( 三 )\n\n於宿服組網站明確傳遞性別友善、反歧視之相關資訊。\n\n七、 本原則由學務會議通過，修改時亦同。']",curious student,Misspelled queries,short,"<1-hop>  [202403151048210219.md]

國立中山大學關懷懷孕學生受教權維護及輔導協助實施要點

108 年 11 月 20 日 本校 108 學年度第 1 學期第 1 次性別平等教育委員會議通過 111.03.30 本校 110 學年度第 2 學期第 4 次行政會議通過修正學務處所屬組織名稱

一、 為落實本校積極維護懷孕學生之受教權，並提供必要之協助，依據性別平等 教育法第十四條之一規定，訂定本要點。

二、 本校為關懷懷孕學生，應秉持多元、包容之精神，積極維護並保障學生之受教 權。協助過程應嚴守專業倫理，尊重隱私，採取必要之保密措施，維護懷孕或 育有子女學生之權益，提供最大協助。

三、 本校為維護懷孕學生之權益與協助管道，於學生事務處諮商與健康促進組 （以 下簡稱諮健組）設置專人服務窗口，並提供社政、警政、民間社會福利與心理 衛生機構等聯繫網絡，適時提供資源。

四、 若本校學生未成年（未滿 20 歲）懷孕時，諮健組應依「學生懷孕受教權維護 及輔導協助要點」進行通報，並由校長邀集相關單位成立工作小組，提供必要 之輔導與協助。成年學生或已婚學生因懷孕而有相關需求者，得向諮健組申 請協助，並依前項規定辦理。

五、 工作小組依職責劃分輔導與行政單位，並應依據下列原則分工：

( 一 ) 輔導單位：

不定期視懷孕學生之需求，召開個案討論會議，並將會議決議提至本 校性別平等教育委員會議報告。

建立懷孕學生紀錄，並依專業倫理妥適保存及管理其資料。

( 二 ) 行政單位：

主計室應依據性別平等教育法第十條規定，編列懷孕學生輔導協助 相關經費。

教務處、各系所，依本校學則第廿三及第廿六條之規定彈性處理懷孕 學生出缺勤紀錄、補考、補救教學，並提供合乎需要之教室安排、課 桌椅調整、母乳哺 ( 集 ) 室等相關事項。

總務處應視懷孕或育有子女學生之需求，規劃停車、如廁等相關設施。

體育與衛生保健組視懷孕學生需要，結合相關資源，提供其多元適性 教育，內容包含孕程及產後照顧、母乳哺乳（集） 、非預期性懷孕知 能、家庭教育等，必要時與社區及醫療資源等網絡聯繫。

六、 本要點經本校性別平等教育委員會議通過，陳請校長核定後實施，修正時亦 同。","<2-hop>  [202509171642480752.md]

國立中山大學性別友善宿舍入住原則

113 年 5 月 8 日本校 112 學年度第 2 次學生事務會議通過

一、 為提供性別友善之住宿環境，尊重及考量學生之不同生理性別、 性別特質、性別認同或性傾向，特訂定本原則。

二、 跨性別者若欲入住，宜破除生理性別二分並依據其性別認同作 為性別判準。

三、 申請者得個別提出申請或自行尋找室友一起申請。

四、 房間安排以「男女分層」為原則，當特定性別樓層無空房時， 得安排「男女同層不同寢」。

五、 有關處理學生住宿服務之相關人員，包括宿服組行政同仁、宿 舍服務員、工讀生、宿委會委員等，應參加至少一場由本校性 別平等教育委員會認可之性別講座或說明會。

六、

宿舍組負責規劃、執行與輔導性別友善宿舍之管理業務，並由 相關行政人員協同宿委會執行以下事項：

( 一 ) 擔任宣導、處理及回應相關問題之對外窗口。

( 二 ) 定期舉辦相關主題活動，以利住宿學生認識多元性別。

( 三 )

於宿服組網站明確傳遞性別友善、反歧視之相關資訊。

七、 本原則由學務會議通過，修改時亦同。",202403151048210219.md,202509171642480752.md,"['性別平等教育委員會議', '性別平等教育委員會']",學生事務處↔學生事務處,性別平等教育委員會議↔性別平等教育委員會,5.0,4.99,4.04,5.0,5.0,2.0,5.0
根據國立中山大學學生參與學生社團、自治組織服務學習課程實施要點及學生社團辦公室管理辦法，學生社團幹部如何申請服務學習積點認證？此外，學生社團辦公室的申請與使用規定有哪些？,"根據國立中山大學學生參與學生社團、自治組織服務學習課程實施要點，學生社團幹部（限本校正式或觀察性社團）可申請服務學習積點認證。學生會幹部、學生議會幹部、學生社團幹部等依實際服務狀況認證積點，每學期認證上限為6點。申請者須向學生事務處校園生活與職涯發展組申請服務證明，並檢附「國立中山大學學生參與學生社團、自治組織服務學習課程積點清冊」、「學習評核表」及服務證明。申請積點認證時間為每年五月及十二月第四週，採主動申請方式，由申請人自行向相關單位申請證明並提供授課教師認證。

根據學生社團辦公室管理辦法，學生社團辦公室（社辦）指活動中心內學生自治團體所使用之辦公室。經本校學生事務處核定成立之學生社團（不含觀察性社團）得向校園生活與職涯發展組申請社辦。學生會與學生議會亦得申請會辦。社辦申請作業每學年辦理一次，申請期限為每年9月1日至9月30日，持續持有社辦者不需重新申請，但若需更換社辦仍須於期限內提出申請並說明理由。社辦使用守則包括：活動中心關閉期間未經核可不得使用社辦，不得借予校外人士使用，不得破壞建物結構或設施，嚴禁抽菸、炊煮食物及使用高功率電器，禁止存放危險物品，公共空間不得放置物品，無人使用時須關閉門窗及電源，禁止攜入寵物等。違反使用守則者將記違規點數，達一定點數將撤銷使用權。撤銷使用權者須於公告日起半個月內清除物品，逾期未清除者由校園組代為處理，且次學年度不受理申請。","['<1-hop>  [202309141531550359.md]\n\n國立中山大學學生參與學生社團、自治組織服務學習課程實施要點\n\n106 年 10 月 11 日 106 學年度第 1 學期第 3 次學生事務處組長會議通過 111 年 3 月 16 日 110 學年度第 2 學期第 3 次學生事務處組長會議修正通過\n\n一、 為鼓勵國立中山大學（以下簡稱本校）學生透過擔任校內各學生自治組織與社團幹部、 校內各委員會議學生代表，培養學生以積極正面的態度發展溝通力、組織力、問題解決 力及領導就業力，並學習參與公共事務、服務社會大眾，特訂定本要點。\n\n二、 本服務學習課程業務主管單位為通識教育中心服務學習組，學生事務處校園生活與職涯 發展組負責課程開設之相關事務。\n\n三、 適用對象（本校正式學籍之在學學生） ：\n\n( 一 ) 學生會會長、副會長及幹部。\n\n( 二 ) 學生議會議員及幹部。\n\n( 三 ) 學生宿舍自治委員會委員。\n\n( 四 ) 學生社團幹部（限本校正式或觀察性社團）。\n\n( 五 ) 學生社團經費補助審核委員會委員。\n\n( 六 ) 學生社團評鑑委員會委員。\n\n( 七 ) 校級各委員會議學生代表。\n\n( 八 ) 畢業生聯合會會長、副會長及幹部。\n\n( 九 ) 學生運動代表隊隊長。\n\n四、 本服務學習積點每人每學期以 10 點為上限，滿 18 個積點並修習課程後認證 1 學分：\n\n( 一 ) 學生會會長、學生會副會長、學生議會議長、學生議會副議長、學生社團社長、學生 社團副社長、學生宿舍自治委員會主任委員、畢業生聯合會會長、畢業生聯合會副 會長及學生運動代表隊隊長，依實際服務狀況認證積點，每學期認證上限 9 點。\n\n( 二 ) 學生會幹部、學生議會幹部、學生議會議員、學生社團幹部、學生社團經費補助審核 委員會委員、學生社團評鑑委員會委員、學生宿舍自治委員會委員及畢業生聯合會 幹部，依實際服務狀況認證積點，每學期認證上限 6 點。\n\n( 三 ) 校級各委員會議之學生代表，每一會議每學期認證積點 3 點（每一會議出席率需達 60% 以上） 。\n\n五、 學生會幹部、學生議會幹部、學生社團幹部、學生社團經費補助審核委員會委員及學生社 團評鑑委員會委員、學生宿舍自治委員會、畢業生聯合會向學生事務處校園生活與職涯 發展組申請服務證明，學生運動代表隊向學生事務處體育發展組申請服務證明，各委員會 議學生代表由學生自行向各會議行政承辦單位申請會議出席簽到證明作為服務證明，前述 服務證明由學生依個人服務情形自行向相關單位申請。申請者須檢附「國立中山大學學生 參與學生社團、自治組織服務學習課程 積點清冊」 （附件一） 、 「國立中山大學學生參與學 生社團、自治組織服務 學習課程學習評核表」 （附件二）及服務證明。\n\n本認證採主動申請，申請積點認證時間為每年五月及十二月第四週，由申請人自行向各單 位申請證明提供授課教師認證。\n\n六、 本要點經學生事務處組長會議（需有學生代表列席討論）通過後實施，修正時亦同。\n\n國立中山大學學生參與學生社團、自治組織服務學習課程積點清冊\n\n附件一\n\n聯 絡 人 資 料\n\n姓名：\n\n申請者 身份\n\n[ ] □ 一 . 學生會 / 學生議會幹部\n\n[ ] □ 二 . 宿委會幹部\n\n[ ] □ 三 . 審委會 / 評委會委員\n\n[ ] □ 四 . 學生社團幹部 ( 社 )\n\n[ ] □ 五 . 校內各委員會議學生代表\n\n[ ] □ 六 . 畢聯會幹部\n\n[ ] □ 七 . 學生運動代表隊隊長\n\n電話：\n\nE-mail ：\n\nNO.\n\n學號\n\n姓名\n\n擔任幹部名稱\n\n積點 上限\n\n認證單位填寫\n\n核定點數\n\n承辦人核章\n\n1.\n\n3 / 6 / 9\n\n2.\n\n3 / 6 / 9\n\n3.\n\n3 / 6 / 9\n\n4.\n\n3 / 6 / 9\n\n5.\n\n3 / 6 / 9\n\n6.\n\n3 / 6 / 9\n\n7.\n\n3 / 6 / 9\n\n8.\n\n3 / 6 / 9\n\n9.\n\n3 / 6 / 9\n\n10.\n\n3 / 6 / 9\n\n11.\n\n3 / 6 / 9\n\n12.\n\n3 / 6 / 9\n\n13.\n\n3 / 6 / 9\n\n14.\n\n3 / 6 / 9\n\n15.\n\n3 / 6 / 9\n\n備註： 1. 本認證申請時間為每年五月及十二月第四週。\n\n申請者需依規定檢附相關證明文件（社團或會議行政承辦單位等）提出申請。\n\n本認證之申請依「國立中山大學學生參與學生社團、自治組織服務學習課程實施要點」規定辦理。\n\n本表經本校學生事務處校園生活與職涯發展組核准後，正本送通識中心辦理，影本一份本校學生事務處校 園生活與職涯發展組存參。\n\n...................................................................................................................................................................\n\n審查 單位 簽章\n\n服務單位或 社團輔導老師\n\n學生事務處校園生活 與職涯發展組組長\n\n國立中山大學學生參與學生社團、自治組織服務學習課程學習評核表\n\n附件二\n\n學號 姓名 系所 身份 □ 一 . 學生會 / 學生議會幹部 □ 二 . 宿委會幹部 □ 三 . 審委會 / 評委會委員 □ 四 . 學生社團幹部 ( 社 ) □ 五 . 校內各委員會議學生代表 □ 六 . 畢聯會幹部 □ 七 . 學生運動代表隊隊長 服務 時間 (ex. 105-1) 擔任 幹部 名稱 手機 E-mail 準備－學習 準備－學習 ( 學長姐有沒有傳承什麼樣的交接資料 ? 注意事項等等 ) 執行－方案 （活動）參與 執行－方案 （活動）參與 ( 請條列式列出擔任期間實際辦理之活動及工作內容 ) 反思－學習心 得與檢討 其他事蹟 其他事蹟 自評點數 自評點數 ( 你覺得在過去的一段時間，你自己給你幾分呢 ?)\n\n.......................................................................................................................................................................\n\n審查 服務單位或 社團輔導老師 單位 簽章 學生事務處校園生活 與職涯發展組組長', '<2-hop>  [202204210932250162.md]\n\n國立中山大學學生社團辦公室管理辦法\n\n95 年 5 月 30 日學務長通過後開始實施 100 年 9 月 26 日學務長核可後實施 104 年 8 月學務長核可後實施 108 年 1 月學務長核可後實施\n\n111 年 3 月 30 日學務長核可後實施\n\n第一條 本辦法所稱之學生社團辦公室（以下簡稱社辦）指活動中心內學生自治團 體所使用之辦公室。\n\n第二條 社辦之申請、規劃、分配、管理由校園生活與職涯發展組（以下簡稱校園 組）統籌辦理。\n\n第三條 經本校學生事務處核定成立之學生社團 ( 不含觀察性社團 ) ，得向校園組 申請社辦。\n\n學生會與學生議會亦得向校園組申請會辦。\n\n第四條 社辦之申請與規劃：\n\n校園組得依實際所需，於每一學年初重新規劃社辦之使用。\n\n社辦之申請作業，每一學年辦理一次。\n\n每一學年度欲申請社辦之學生自治團體，須於同年 9 月 1 日至 9 月 30 日期限內，填寫社辦申請表送交校園組。\n\n持續持有社辦之學生自治團體，不需登記申請社辦，將視為已完成申 請手續。但若需更換社辦者，仍須於社辦申請期限內送交社辦申請表 以完成申請手續，且須詳述欲更換社辦之理由。\n\n每一學年度社辦之申請，將經由校園組組務會議審核，並於同年 10 月 15 日前公佈審核結果。\n\n第五條 社辦使用守則：\n\n活動中心關閉期間，未經校園組核可不得使用社辦。\n\n未經校園組核可，不得將社辦借予校外人士使用。\n\n不得破壞或改變社辦原有之建物結構或室內設施。\n\n若需更換社辦之門鎖，須經校園組同意，並交一把新鑰匙至校園組。\n\n社辦內嚴禁抽菸、炊煮食物。\n\n社辦內嚴禁使用冰箱、冷氣機、除濕機與用電消耗功率 500W 以上之電\n\n器；若欲使用，須經校園組組務會議核定通過。\n\n社辦內嚴禁存放或使用油品、瓦斯、含火藥之物品或具有腐蝕性之強 酸、強鹼物品。\n\n走廊、樓梯及交誼廳等公共空間不得放置物品。\n\n社辦無人員使用期間，須關閉門窗與暫停使用之電器的電源開關。\n\n不得遮蔽門上之小窗口。\n\n維護社辦內及周邊之環境衛生。\n\n社辦內嚴禁攜入有礙安全、環境衛生、安寧之寵物。\n\n第六條 違反本辦法第五條之學生自治團體，經查獲屬實，每次記以違規點數一點。 對於遭違規記點有異議者，可於告發日起一星期內提具書面說明向校園 組申請撤銷。\n\n第七條 社辦使用權之撤銷：\n\n依據國立中山大學學生社團評鑑實施要點第十二條，經社團評鑑列為 丁等之學生社團，撤銷其社辦之使用權一學年。\n\n任一學生社團於兩學期若因違反社辦使用守則而遭違規記點達五點， 將立即撤銷其社辦之使用權；違規情節重大者，校園組得於次一學年 度不受理該社團之社辦申請。\n\n學生會與學生議會，若於同一學年度因違反社辦使用守則遭違規記點 達五點，將立即撤銷其社辦之使用權。\n\n持有社辦之任一學生自治團體，若社辦之使用率過低，校園組得要求 該團體派代表一至二人列席校園組組務會議詳細說明，且得依實際情 形立即撤銷其社辦之使用權。\n\n第八條 遭撤銷社辦使用權之任一學生自治團體，須於撤銷公告日起半個月內，清 除所使用之社辦內屬該團體之所有物品。逾期未清除者，校園組將代為處 理，且校園組得於次一學年度不受理該團體之社辦申請。\n\n第九條 本辦法經社團長大會通過，報請學務長核可後公佈實施，修正時亦同。']",staff,Poor grammar,long,"<1-hop>  [202309141531550359.md]

國立中山大學學生參與學生社團、自治組織服務學習課程實施要點

106 年 10 月 11 日 106 學年度第 1 學期第 3 次學生事務處組長會議通過 111 年 3 月 16 日 110 學年度第 2 學期第 3 次學生事務處組長會議修正通過

一、 為鼓勵國立中山大學（以下簡稱本校）學生透過擔任校內各學生自治組織與社團幹部、 校內各委員會議學生代表，培養學生以積極正面的態度發展溝通力、組織力、問題解決 力及領導就業力，並學習參與公共事務、服務社會大眾，特訂定本要點。

二、 本服務學習課程業務主管單位為通識教育中心服務學習組，學生事務處校園生活與職涯 發展組負責課程開設之相關事務。

三、 適用對象（本校正式學籍之在學學生） ：

( 一 ) 學生會會長、副會長及幹部。

( 二 ) 學生議會議員及幹部。

( 三 ) 學生宿舍自治委員會委員。

( 四 ) 學生社團幹部（限本校正式或觀察性社團）。

( 五 ) 學生社團經費補助審核委員會委員。

( 六 ) 學生社團評鑑委員會委員。

( 七 ) 校級各委員會議學生代表。

( 八 ) 畢業生聯合會會長、副會長及幹部。

( 九 ) 學生運動代表隊隊長。

四、 本服務學習積點每人每學期以 10 點為上限，滿 18 個積點並修習課程後認證 1 學分：

( 一 ) 學生會會長、學生會副會長、學生議會議長、學生議會副議長、學生社團社長、學生 社團副社長、學生宿舍自治委員會主任委員、畢業生聯合會會長、畢業生聯合會副 會長及學生運動代表隊隊長，依實際服務狀況認證積點，每學期認證上限 9 點。

( 二 ) 學生會幹部、學生議會幹部、學生議會議員、學生社團幹部、學生社團經費補助審核 委員會委員、學生社團評鑑委員會委員、學生宿舍自治委員會委員及畢業生聯合會 幹部，依實際服務狀況認證積點，每學期認證上限 6 點。

( 三 ) 校級各委員會議之學生代表，每一會議每學期認證積點 3 點（每一會議出席率需達 60% 以上） 。

五、 學生會幹部、學生議會幹部、學生社團幹部、學生社團經費補助審核委員會委員及學生社 團評鑑委員會委員、學生宿舍自治委員會、畢業生聯合會向學生事務處校園生活與職涯 發展組申請服務證明，學生運動代表隊向學生事務處體育發展組申請服務證明，各委員會 議學生代表由學生自行向各會議行政承辦單位申請會議出席簽到證明作為服務證明，前述 服務證明由學生依個人服務情形自行向相關單位申請。申請者須檢附「國立中山大學學生 參與學生社團、自治組織服務學習課程 積點清冊」 （附件一） 、 「國立中山大學學生參與學 生社團、自治組織服務 學習課程學習評核表」 （附件二）及服務證明。

本認證採主動申請，申請積點認證時間為每年五月及十二月第四週，由申請人自行向各單 位申請證明提供授課教師認證。

六、 本要點經學生事務處組長會議（需有學生代表列席討論）通過後實施，修正時亦同。

國立中山大學學生參與學生社團、自治組織服務學習課程積點清冊

附件一

聯 絡 人 資 料

姓名：

申請者 身份

[ ] □ 一 . 學生會 / 學生議會幹部

[ ] □ 二 . 宿委會幹部

[ ] □ 三 . 審委會 / 評委會委員

[ ] □ 四 . 學生社團幹部 ( 社 )

[ ] □ 五 . 校內各委員會議學生代表

[ ] □ 六 . 畢聯會幹部

[ ] □ 七 . 學生運動代表隊隊長

電話：

E-mail ：

NO.

學號

姓名

擔任幹部名稱

積點 上限

認證單位填寫

核定點數

承辦人核章

1.

3 / 6 / 9

2.

3 / 6 / 9

3.

3 / 6 / 9

4.

3 / 6 / 9

5.

3 / 6 / 9

6.

3 / 6 / 9

7.

3 / 6 / 9

8.

3 / 6 / 9

9.

3 / 6 / 9

10.

3 / 6 / 9

11.

3 / 6 / 9

12.

3 / 6 / 9

13.

3 / 6 / 9

14.

3 / 6 / 9

15.

3 / 6 / 9

備註： 1. 本認證申請時間為每年五月及十二月第四週。

申請者需依規定檢附相關證明文件（社團或會議行政承辦單位等）提出申請。

本認證之申請依「國立中山大學學生參與學生社團、自治組織服務學習課程實施要點」規定辦理。

本表經本校學生事務處校園生活與職涯發展組核准後，正本送通識中心辦理，影本一份本校學生事務處校 園生活與職涯發展組存參。

...................................................................................................................................................................

審查 單位 簽章

服務單位或 社團輔導老師

學生事務處校園生活 與職涯發展組組長

國立中山大學學生參與學生社團、自治組織服務學習課程學習評核表

附件二

學號 姓名 系所 身份 □ 一 . 學生會 / 學生議會幹部 □ 二 . 宿委會幹部 □ 三 . 審委會 / 評委會委員 □ 四 . 學生社團幹部 ( 社 ) □ 五 . 校內各委員會議學生代表 □ 六 . 畢聯會幹部 □ 七 . 學生運動代表隊隊長 服務 時間 (ex. 105-1) 擔任 幹部 名稱 手機 E-mail 準備－學習 準備－學習 ( 學長姐有沒有傳承什麼樣的交接資料 ? 注意事項等等 ) 執行－方案 （活動）參與 執行－方案 （活動）參與 ( 請條列式列出擔任期間實際辦理之活動及工作內容 ) 反思－學習心 得與檢討 其他事蹟 其他事蹟 自評點數 自評點數 ( 你覺得在過去的一段時間，你自己給你幾分呢 ?)

.......................................................................................................................................................................

審查 服務單位或 社團輔導老師 單位 簽章 學生事務處校園生活 與職涯發展組組長","<2-hop>  [202204210932250162.md]

國立中山大學學生社團辦公室管理辦法

95 年 5 月 30 日學務長通過後開始實施 100 年 9 月 26 日學務長核可後實施 104 年 8 月學務長核可後實施 108 年 1 月學務長核可後實施

111 年 3 月 30 日學務長核可後實施

第一條 本辦法所稱之學生社團辦公室（以下簡稱社辦）指活動中心內學生自治團 體所使用之辦公室。

第二條 社辦之申請、規劃、分配、管理由校園生活與職涯發展組（以下簡稱校園 組）統籌辦理。

第三條 經本校學生事務處核定成立之學生社團 ( 不含觀察性社團 ) ，得向校園組 申請社辦。

學生會與學生議會亦得向校園組申請會辦。

第四條 社辦之申請與規劃：

校園組得依實際所需，於每一學年初重新規劃社辦之使用。

社辦之申請作業，每一學年辦理一次。

每一學年度欲申請社辦之學生自治團體，須於同年 9 月 1 日至 9 月 30 日期限內，填寫社辦申請表送交校園組。

持續持有社辦之學生自治團體，不需登記申請社辦，將視為已完成申 請手續。但若需更換社辦者，仍須於社辦申請期限內送交社辦申請表 以完成申請手續，且須詳述欲更換社辦之理由。

每一學年度社辦之申請，將經由校園組組務會議審核，並於同年 10 月 15 日前公佈審核結果。

第五條 社辦使用守則：

活動中心關閉期間，未經校園組核可不得使用社辦。

未經校園組核可，不得將社辦借予校外人士使用。

不得破壞或改變社辦原有之建物結構或室內設施。

若需更換社辦之門鎖，須經校園組同意，並交一把新鑰匙至校園組。

社辦內嚴禁抽菸、炊煮食物。

社辦內嚴禁使用冰箱、冷氣機、除濕機與用電消耗功率 500W 以上之電

器；若欲使用，須經校園組組務會議核定通過。

社辦內嚴禁存放或使用油品、瓦斯、含火藥之物品或具有腐蝕性之強 酸、強鹼物品。

走廊、樓梯及交誼廳等公共空間不得放置物品。

社辦無人員使用期間，須關閉門窗與暫停使用之電器的電源開關。

不得遮蔽門上之小窗口。

維護社辦內及周邊之環境衛生。

社辦內嚴禁攜入有礙安全、環境衛生、安寧之寵物。

第六條 違反本辦法第五條之學生自治團體，經查獲屬實，每次記以違規點數一點。 對於遭違規記點有異議者，可於告發日起一星期內提具書面說明向校園 組申請撤銷。

第七條 社辦使用權之撤銷：

依據國立中山大學學生社團評鑑實施要點第十二條，經社團評鑑列為 丁等之學生社團，撤銷其社辦之使用權一學年。

任一學生社團於兩學期若因違反社辦使用守則而遭違規記點達五點， 將立即撤銷其社辦之使用權；違規情節重大者，校園組得於次一學年 度不受理該社團之社辦申請。

學生會與學生議會，若於同一學年度因違反社辦使用守則遭違規記點 達五點，將立即撤銷其社辦之使用權。

持有社辦之任一學生自治團體，若社辦之使用率過低，校園組得要求 該團體派代表一至二人列席校園組組務會議詳細說明，且得依實際情 形立即撤銷其社辦之使用權。

第八條 遭撤銷社辦使用權之任一學生自治團體，須於撤銷公告日起半個月內，清 除所使用之社辦內屬該團體之所有物品。逾期未清除者，校園組將代為處 理，且校園組得於次一學年度不受理該團體之社辦申請。

第九條 本辦法經社團長大會通過，報請學務長核可後公佈實施，修正時亦同。",202309141531550359.md,202204210932250162.md,"['學生社團辦公室', '學生社團']",學生事務處↔學生事務處,學生社團↔學生社團辦公室,5.0,3.84,5.0,5.0,5.0,2.0,5.0
根據國立中山大學學生自治團體設置及輔導辦法與學生社團辦公室管理辦法，學生自治團體如何成立及管理？此外，學生自治團體申請及使用學生社團辦公室有哪些規定與限制？,根據國立中山大學學生自治團體設置及輔導辦法，學生自治團體得依校、院、系（所）層級成立，學生均可為會員。學生自治團體自訂組織章程經輔導單位核可後，公佈實施，正式成立。其設立、管理及解散依組織章程辦理，並須遵守校規及相關法令，接受輔導單位輔導。學生自治團體得向會員收取會費，經輔導單位同意後得對外募款或接受捐助，經費自行保管、分配並接受監督查核。學生自治團體所舉辦活動須經輔導單位核准，成員舉辦集會活動需向學生自治團體登記並由其代為申請。學生自治團體可推舉代表出席校內會議，參加研習及參訪活動，違反規定者依校規處理並負法律責任。根據學生社團辦公室管理辦法，經學生事務處核定成立之學生社團得向校園生活與職涯發展組申請社辦。申請每學年辦理一次，期限為9月1日至9月30日，持續持有者視為完成申請手續。社辦使用須遵守守則，如不得未經核可使用、借予校外人士、破壞設施、使用高功率電器等。違反守則者將記違規點數，達一定點數將撤銷使用權。使用率過低者亦可能被要求說明並撤銷使用權。撤銷使用權後須於半個月內清除物品，逾期未清除者由校園組代為處理，且次學年度不受理申請。,"['<1-hop>  [202211151316130529.md]\n\n國立中山大學學生自治團體設置及輔導辦法\n\n91 年 6 月 17 日第五次學務會議通過 92 年 6 月 06 日第四次校務會議核備 95 年 12 月 15 日第一次學務會議通過 95 年 12 月 22 日第二次校務會議通過\n\n第一條 為落實學生自治理念，建立溝通管道，增進學生自治能力及在校學 習效果，特依大學法第 33 條及本校組織規程第四章學生自治與校務 參與，訂定本辦法。\n\n第二條 本校學生得依本辦法，按校、院、系（所）層級，成立學生自治團 體，學生均可為會員。\n\n第三條 院、系（所）層級學生自治團體之輔導單位分別為院、系（所） ，校 層級學生自治團體之輔導單位為學生事務處。\n\n第四條 學生自治團體自訂組織章程經輔導單位核可後，公佈實施，正式設 立。\n\n第五條 學生自治團體之設立、管理及解散，依各該學生自治團體之組織章 程辦理。\n\n第六條 學生自治團體應遵守本校校規及相關法令，並接受輔導單位之輔導。\n\n第七條 學生自治團體得向會員收取會費；經輔導單位同意後，並得對外募 款或接受捐助。\n\n學生自治團體之經費，由其自行保管、分配，且應周詳規劃，妥善 運用，並接受輔導單位之監督查核。另應定期向會員公佈及說明經 費使用之情形，\n\n學生自治團體接受輔導單位補助經費之運用及核銷，應符合本校會 計規定及相關法令。\n\n第八條 學生自治團體所舉辦之各項活動均應經輔導單位核准後始得進行。\n\n第九條 學生自治團體成員有舉辦集會活動之需要者，應向學生自治團體登 記，並由學生自治團體代為向輔導單位申請。\n\n第十條 學生自治團體得依本校各項會議規定，推舉代表出席或列席。\n\n第十一條 學生自治團體得參加本校舉辦之各項研習及參訪活動，以充實學生 自治幹部、學生會員代 表之自治理念、管理能力及議事技能。\n\n第十二條 學生自治團體違反校規及相關法令者，其行為人及負責人依校規處 理，並應負法律責任。\n\n第十三條 本辦法經學生事務會議通過及校務會議核備，報請教育部核定後實 施，修訂時亦同。', '<2-hop>  [202204210932250162.md]\n\n國立中山大學學生社團辦公室管理辦法\n\n95 年 5 月 30 日學務長通過後開始實施 100 年 9 月 26 日學務長核可後實施 104 年 8 月學務長核可後實施 108 年 1 月學務長核可後實施\n\n111 年 3 月 30 日學務長核可後實施\n\n第一條 本辦法所稱之學生社團辦公室（以下簡稱社辦）指活動中心內學生自治團 體所使用之辦公室。\n\n第二條 社辦之申請、規劃、分配、管理由校園生活與職涯發展組（以下簡稱校園 組）統籌辦理。\n\n第三條 經本校學生事務處核定成立之學生社團 ( 不含觀察性社團 ) ，得向校園組 申請社辦。\n\n學生會與學生議會亦得向校園組申請會辦。\n\n第四條 社辦之申請與規劃：\n\n校園組得依實際所需，於每一學年初重新規劃社辦之使用。\n\n社辦之申請作業，每一學年辦理一次。\n\n每一學年度欲申請社辦之學生自治團體，須於同年 9 月 1 日至 9 月 30 日期限內，填寫社辦申請表送交校園組。\n\n持續持有社辦之學生自治團體，不需登記申請社辦，將視為已完成申 請手續。但若需更換社辦者，仍須於社辦申請期限內送交社辦申請表 以完成申請手續，且須詳述欲更換社辦之理由。\n\n每一學年度社辦之申請，將經由校園組組務會議審核，並於同年 10 月 15 日前公佈審核結果。\n\n第五條 社辦使用守則：\n\n活動中心關閉期間，未經校園組核可不得使用社辦。\n\n未經校園組核可，不得將社辦借予校外人士使用。\n\n不得破壞或改變社辦原有之建物結構或室內設施。\n\n若需更換社辦之門鎖，須經校園組同意，並交一把新鑰匙至校園組。\n\n社辦內嚴禁抽菸、炊煮食物。\n\n社辦內嚴禁使用冰箱、冷氣機、除濕機與用電消耗功率 500W 以上之電\n\n器；若欲使用，須經校園組組務會議核定通過。\n\n社辦內嚴禁存放或使用油品、瓦斯、含火藥之物品或具有腐蝕性之強 酸、強鹼物品。\n\n走廊、樓梯及交誼廳等公共空間不得放置物品。\n\n社辦無人員使用期間，須關閉門窗與暫停使用之電器的電源開關。\n\n不得遮蔽門上之小窗口。\n\n維護社辦內及周邊之環境衛生。\n\n社辦內嚴禁攜入有礙安全、環境衛生、安寧之寵物。\n\n第六條 違反本辦法第五條之學生自治團體，經查獲屬實，每次記以違規點數一點。 對於遭違規記點有異議者，可於告發日起一星期內提具書面說明向校園 組申請撤銷。\n\n第七條 社辦使用權之撤銷：\n\n依據國立中山大學學生社團評鑑實施要點第十二條，經社團評鑑列為 丁等之學生社團，撤銷其社辦之使用權一學年。\n\n任一學生社團於兩學期若因違反社辦使用守則而遭違規記點達五點， 將立即撤銷其社辦之使用權；違規情節重大者，校園組得於次一學年 度不受理該社團之社辦申請。\n\n學生會與學生議會，若於同一學年度因違反社辦使用守則遭違規記點 達五點，將立即撤銷其社辦之使用權。\n\n持有社辦之任一學生自治團體，若社辦之使用率過低，校園組得要求 該團體派代表一至二人列席校園組組務會議詳細說明，且得依實際情 形立即撤銷其社辦之使用權。\n\n第八條 遭撤銷社辦使用權之任一學生自治團體，須於撤銷公告日起半個月內，清 除所使用之社辦內屬該團體之所有物品。逾期未清除者，校園組將代為處 理，且校園組得於次一學年度不受理該團體之社辦申請。\n\n第九條 本辦法經社團長大會通過，報請學務長核可後公佈實施，修正時亦同。']",teacher,Web search like queries,long,"<1-hop>  [202211151316130529.md]

國立中山大學學生自治團體設置及輔導辦法

91 年 6 月 17 日第五次學務會議通過 92 年 6 月 06 日第四次校務會議核備 95 年 12 月 15 日第一次學務會議通過 95 年 12 月 22 日第二次校務會議通過

第一條 為落實學生自治理念，建立溝通管道，增進學生自治能力及在校學 習效果，特依大學法第 33 條及本校組織規程第四章學生自治與校務 參與，訂定本辦法。

第二條 本校學生得依本辦法，按校、院、系（所）層級，成立學生自治團 體，學生均可為會員。

第三條 院、系（所）層級學生自治團體之輔導單位分別為院、系（所） ，校 層級學生自治團體之輔導單位為學生事務處。

第四條 學生自治團體自訂組織章程經輔導單位核可後，公佈實施，正式設 立。

第五條 學生自治團體之設立、管理及解散，依各該學生自治團體之組織章 程辦理。

第六條 學生自治團體應遵守本校校規及相關法令，並接受輔導單位之輔導。

第七條 學生自治團體得向會員收取會費；經輔導單位同意後，並得對外募 款或接受捐助。

學生自治團體之經費，由其自行保管、分配，且應周詳規劃，妥善 運用，並接受輔導單位之監督查核。另應定期向會員公佈及說明經 費使用之情形，

學生自治團體接受輔導單位補助經費之運用及核銷，應符合本校會 計規定及相關法令。

第八條 學生自治團體所舉辦之各項活動均應經輔導單位核准後始得進行。

第九條 學生自治團體成員有舉辦集會活動之需要者，應向學生自治團體登 記，並由學生自治團體代為向輔導單位申請。

第十條 學生自治團體得依本校各項會議規定，推舉代表出席或列席。

第十一條 學生自治團體得參加本校舉辦之各項研習及參訪活動，以充實學生 自治幹部、學生會員代 表之自治理念、管理能力及議事技能。

第十二條 學生自治團體違反校規及相關法令者，其行為人及負責人依校規處 理，並應負法律責任。

第十三條 本辦法經學生事務會議通過及校務會議核備，報請教育部核定後實 施，修訂時亦同。","<2-hop>  [202204210932250162.md]

國立中山大學學生社團辦公室管理辦法

95 年 5 月 30 日學務長通過後開始實施 100 年 9 月 26 日學務長核可後實施 104 年 8 月學務長核可後實施 108 年 1 月學務長核可後實施

111 年 3 月 30 日學務長核可後實施

第一條 本辦法所稱之學生社團辦公室（以下簡稱社辦）指活動中心內學生自治團 體所使用之辦公室。

第二條 社辦之申請、規劃、分配、管理由校園生活與職涯發展組（以下簡稱校園 組）統籌辦理。

第三條 經本校學生事務處核定成立之學生社團 ( 不含觀察性社團 ) ，得向校園組 申請社辦。

學生會與學生議會亦得向校園組申請會辦。

第四條 社辦之申請與規劃：

校園組得依實際所需，於每一學年初重新規劃社辦之使用。

社辦之申請作業，每一學年辦理一次。

每一學年度欲申請社辦之學生自治團體，須於同年 9 月 1 日至 9 月 30 日期限內，填寫社辦申請表送交校園組。

持續持有社辦之學生自治團體，不需登記申請社辦，將視為已完成申 請手續。但若需更換社辦者，仍須於社辦申請期限內送交社辦申請表 以完成申請手續，且須詳述欲更換社辦之理由。

每一學年度社辦之申請，將經由校園組組務會議審核，並於同年 10 月 15 日前公佈審核結果。

第五條 社辦使用守則：

活動中心關閉期間，未經校園組核可不得使用社辦。

未經校園組核可，不得將社辦借予校外人士使用。

不得破壞或改變社辦原有之建物結構或室內設施。

若需更換社辦之門鎖，須經校園組同意，並交一把新鑰匙至校園組。

社辦內嚴禁抽菸、炊煮食物。

社辦內嚴禁使用冰箱、冷氣機、除濕機與用電消耗功率 500W 以上之電

器；若欲使用，須經校園組組務會議核定通過。

社辦內嚴禁存放或使用油品、瓦斯、含火藥之物品或具有腐蝕性之強 酸、強鹼物品。

走廊、樓梯及交誼廳等公共空間不得放置物品。

社辦無人員使用期間，須關閉門窗與暫停使用之電器的電源開關。

不得遮蔽門上之小窗口。

維護社辦內及周邊之環境衛生。

社辦內嚴禁攜入有礙安全、環境衛生、安寧之寵物。

第六條 違反本辦法第五條之學生自治團體，經查獲屬實，每次記以違規點數一點。 對於遭違規記點有異議者，可於告發日起一星期內提具書面說明向校園 組申請撤銷。

第七條 社辦使用權之撤銷：

依據國立中山大學學生社團評鑑實施要點第十二條，經社團評鑑列為 丁等之學生社團，撤銷其社辦之使用權一學年。

任一學生社團於兩學期若因違反社辦使用守則而遭違規記點達五點， 將立即撤銷其社辦之使用權；違規情節重大者，校園組得於次一學年 度不受理該社團之社辦申請。

學生會與學生議會，若於同一學年度因違反社辦使用守則遭違規記點 達五點，將立即撤銷其社辦之使用權。

持有社辦之任一學生自治團體，若社辦之使用率過低，校園組得要求 該團體派代表一至二人列席校園組組務會議詳細說明，且得依實際情 形立即撤銷其社辦之使用權。

第八條 遭撤銷社辦使用權之任一學生自治團體，須於撤銷公告日起半個月內，清 除所使用之社辦內屬該團體之所有物品。逾期未清除者，校園組將代為處 理，且校園組得於次一學年度不受理該團體之社辦申請。

第九條 本辦法經社團長大會通過，報請學務長核可後公佈實施，修正時亦同。",202211151316130529.md,202204210932250162.md,['學生自治團體'],學生事務處↔學生事務處,學生自治團體↔學生自治團體,5.0,5.0,5.0,5.0,5.0,2.01,5.0
根據國立中山大學學生輔導工作委員會設置要點與運動績優升學輔導入學生課業輔導辦法，學校如何透過學生輔導法推動三級輔導並具體輔導運動績優升學輔導入學生的課業？,根據國立中山大學學生輔導工作委員會設置要點，學校依據學生輔導法第六條規定，推動三級輔導，包括發展性輔導（如舉辦演講、工作坊、讀書會等活動促進師生心理健康與校園適應能力）、介入性輔導（提供個別諮商、團體諮商、心理測驗、精神科醫師諮詢等資源）及處遇性輔導（連結校內外資源協助有嚴重適應困難的學生）。此外，根據運動績優升學輔導入學生課業輔導辦法，學校鼓勵並輔導運動績優升學輔導入學生提升學業水平，提供每學年課業輔導費補助，補助以六學期為限，每學期不超過兩門必修科目，並由學生事務處體育發展組遴聘適任學生輔導其課業。學生需於開學二週內申請，體育發展組於開學後一個月內公告符合資格名單。這兩項規定結合，透過三級輔導體系與專門課業輔導，全面支持學生的心理健康與學業發展。,"['<1-hop>  [202305231613030212.md]\n\n國立中山大學學生輔導工作委員會設置要點\n\n112 年 3 月 8 日 111 學年度第 2 次組長會議修正通過 112 年 4 月 19 日 111 學年度第 3 次協調會報修正通過 112 年 5 月 10 日 111 學年度第 7 次行政會議修正通過\n\n一、「為有效推動學生輔導工作，協調整合相關資源，以落實三級預防措 施，依據學生輔導法設立學生輔導工作委員會 ( 以下簡稱本委員會 ) 。\n\n二、本要點所稱學生輔導為依據學生輔導法第六條之規定，學校應視學生身心 狀況及需求，提供發展性輔導、介入性輔導及處遇性輔導之三級輔導，其 內容如下：\n\n( 一 ) 發展性輔導：為提升整體校園師生心理健康與校園適應能力，每學 期為全校師生舉辦演講、工作坊、讀書會、連續性團體、電影欣賞 等不同形式活動，促進全校師生在人際關係、課業壓力、情感關 係、情緒調節等不同面向的發展。\n\n( 二 ) 介入性輔導：針對提供發展性輔導後，仍有校園適應或心理困擾議 題之學生，或遭受重大創傷經驗而影響校園適應能力者，學務處諮 商與健康促進組提供個別諮商、團體諮商、心理測驗、精神科醫師 諮詢等介入性輔導資源。\n\n( 三 ) 處遇性輔導：針對提供介入性輔導後，仍有校園適應或心理困擾議 題之學生，或有嚴重適應困難者，學務處諮商與健康促進組針對個 案特殊狀況與需求，連結校內外資源，包含：學術系所單位、相關 行政單位、法定監護人等相關人員，以合作打造校園安全網絡為原 則之方式，提供多方資源，包含：轉銜、轉介醫療或政府資源，協 力協助學生。\n\n三、本委員會組織：\n\n本委員會置委員十九至二十一名，校長為主任委員，由下列人員組成：\n\n( 一 ) 當然委員：由教務長、學務長、總務長、國際長、諮商與健康促進組 組長、校安防護組組長、宿舍服務組組長擔任之。\n\n( 二 ) 遴選委員：\n\n教師代表：各學院推薦教師一人後，由校長圈選八至十人聘任\n\n之。\n\n學生代表：由學生會推選研究生代表及大學部學生代表各一人。\n\n職員工代表：由校長聘任本校具輔導理念之職員工至多二人。\n\n( 三 ) 委員聘期一年，任期中若有委員離職或出缺時，由原推薦單位補推\n\n之，繼任委員之任期至原任期屆滿之日止。\n\n( 四 ) 任一性別委員人數，不得少於委員總額三分之一。\n\n( 五 ) 本委員會執行秘書由學生事務處諮商與健康促進組組長兼任之。\n\n四、本委員會職掌如下：\n\n( 一 ) 審核全校輔導工作計畫與執行情形，評估輔導工作執行成果與績效，\n\n提供相關意見。\n\n二 協助學務處諮商與健康促進組與各學術單位、行政單位合作，執行三 級輔導之相關事宜，共同協助提升校園師生健康。\n\n( )\n\n( 三 ) 其他與學生輔導工作之相關事宜。\n\n五、本委員會每學年至少召開一次會議，必要時得召開臨時會議，並視情況邀\n\n請相關學者專家提供諮詢。\n\n六、本委員會開會應有委員二分之一以上出席，始得召開並決議，委員因故不 能出席會議時，委員得以書面委託其職務代理人代理出席。\n\n七、本要點經行政會議通過後實施，修正時亦同。', '<2-hop>  [202302141202170065.md]\n\n國立中山大學運動績優升學輔導入學生課業輔導辦法\n\n91 年 09 月 27 日 91 學年度第 1 次行政會議通過\n\n94 年 11 月 03 日 94 學年度學生事務處組長會議修訂通過 96 年 05 月 16 日 95 學年度第 2 學期第 5 次行政會議修訂通過 101 年 11 月 28 日 101 學年度第 1 學期學生事務處第 6 次組長會議修訂通過 102 年 01 月 02 日 101 學年度第 1 學期第 3 次行政協調會報修訂通過 102 年 01 月 09 日 101 學年度第 1 學期第 10 次行政會議修訂通過 106 年 9 月 7 日本校 106 學年度第 1 學期第 1 次學生事務處組長會議修正通過 106 年 9 月 27 日本校 106 學年度第 1 次行政協調會報修正通過 106 年 10 月 25 日本校 106 學年度第 1 學期第 4 次行政會議修正通過 111 年 3 月 30 日 110 學年度第 2 學期第 4 次行政會議修正通過 111 年 9 月 7 日 111 學年度第 1 學期第 1 次學務處組長會議修正通過 111 年 10 月 12 日 111 學年度第 1 學期第 2 次協調會報修正通過 111 年 11 月 2 日 111 學年度第 1 學期第 5 次行政會議修正通過\n\n第一條 為鼓勵並輔導本校招收之『運動績優升學輔導入學生』 ，提昇其學業水 平，達到本校課業要求，得以順利完成學位，特訂定本辦法。\n\n第二條 凡本校招收之『運動績優升學輔導入學生』皆可申請接受補助。\n\n第三條 獎助原則：\n\n一、每位學生每學年課業輔導費依據預算編列及申請人數、學門數核給，輔 導費每小時 500 元。學生申請課輔科目須為該學系或學程必修科目（不 含必修實習課） 。補助以六學期為限，每學期以不超過兩門課為原則， 若有特殊狀況時，學生事務處體育發展組得另案增加補助年限與科目。 二、接受補助之同學，由學生事務處體育發展組遴聘適任之學生輔導其課 業。\n\n三、有需要課輔之同學應於每學期開學二週內提出申請，學生事務處體育發 展組於開學後一個月內公告符合資格之同學名單。\n\n第四條 本辦法經學生事務處組長會議討論，提行政會議討論通過，並簽請校長 核定後實施，修正時亦同。']",teacher,Poor grammar,medium,"<1-hop>  [202305231613030212.md]

國立中山大學學生輔導工作委員會設置要點

112 年 3 月 8 日 111 學年度第 2 次組長會議修正通過 112 年 4 月 19 日 111 學年度第 3 次協調會報修正通過 112 年 5 月 10 日 111 學年度第 7 次行政會議修正通過

一、「為有效推動學生輔導工作，協調整合相關資源，以落實三級預防措 施，依據學生輔導法設立學生輔導工作委員會 ( 以下簡稱本委員會 ) 。

二、本要點所稱學生輔導為依據學生輔導法第六條之規定，學校應視學生身心 狀況及需求，提供發展性輔導、介入性輔導及處遇性輔導之三級輔導，其 內容如下：

( 一 ) 發展性輔導：為提升整體校園師生心理健康與校園適應能力，每學 期為全校師生舉辦演講、工作坊、讀書會、連續性團體、電影欣賞 等不同形式活動，促進全校師生在人際關係、課業壓力、情感關 係、情緒調節等不同面向的發展。

( 二 ) 介入性輔導：針對提供發展性輔導後，仍有校園適應或心理困擾議 題之學生，或遭受重大創傷經驗而影響校園適應能力者，學務處諮 商與健康促進組提供個別諮商、團體諮商、心理測驗、精神科醫師 諮詢等介入性輔導資源。

( 三 ) 處遇性輔導：針對提供介入性輔導後，仍有校園適應或心理困擾議 題之學生，或有嚴重適應困難者，學務處諮商與健康促進組針對個 案特殊狀況與需求，連結校內外資源，包含：學術系所單位、相關 行政單位、法定監護人等相關人員，以合作打造校園安全網絡為原 則之方式，提供多方資源，包含：轉銜、轉介醫療或政府資源，協 力協助學生。

三、本委員會組織：

本委員會置委員十九至二十一名，校長為主任委員，由下列人員組成：

( 一 ) 當然委員：由教務長、學務長、總務長、國際長、諮商與健康促進組 組長、校安防護組組長、宿舍服務組組長擔任之。

( 二 ) 遴選委員：

教師代表：各學院推薦教師一人後，由校長圈選八至十人聘任

之。

學生代表：由學生會推選研究生代表及大學部學生代表各一人。

職員工代表：由校長聘任本校具輔導理念之職員工至多二人。

( 三 ) 委員聘期一年，任期中若有委員離職或出缺時，由原推薦單位補推

之，繼任委員之任期至原任期屆滿之日止。

( 四 ) 任一性別委員人數，不得少於委員總額三分之一。

( 五 ) 本委員會執行秘書由學生事務處諮商與健康促進組組長兼任之。

四、本委員會職掌如下：

( 一 ) 審核全校輔導工作計畫與執行情形，評估輔導工作執行成果與績效，

提供相關意見。

二 協助學務處諮商與健康促進組與各學術單位、行政單位合作，執行三 級輔導之相關事宜，共同協助提升校園師生健康。

( )

( 三 ) 其他與學生輔導工作之相關事宜。

五、本委員會每學年至少召開一次會議，必要時得召開臨時會議，並視情況邀

請相關學者專家提供諮詢。

六、本委員會開會應有委員二分之一以上出席，始得召開並決議，委員因故不 能出席會議時，委員得以書面委託其職務代理人代理出席。

七、本要點經行政會議通過後實施，修正時亦同。","<2-hop>  [202302141202170065.md]

國立中山大學運動績優升學輔導入學生課業輔導辦法

91 年 09 月 27 日 91 學年度第 1 次行政會議通過

94 年 11 月 03 日 94 學年度學生事務處組長會議修訂通過 96 年 05 月 16 日 95 學年度第 2 學期第 5 次行政會議修訂通過 101 年 11 月 28 日 101 學年度第 1 學期學生事務處第 6 次組長會議修訂通過 102 年 01 月 02 日 101 學年度第 1 學期第 3 次行政協調會報修訂通過 102 年 01 月 09 日 101 學年度第 1 學期第 10 次行政會議修訂通過 106 年 9 月 7 日本校 106 學年度第 1 學期第 1 次學生事務處組長會議修正通過 106 年 9 月 27 日本校 106 學年度第 1 次行政協調會報修正通過 106 年 10 月 25 日本校 106 學年度第 1 學期第 4 次行政會議修正通過 111 年 3 月 30 日 110 學年度第 2 學期第 4 次行政會議修正通過 111 年 9 月 7 日 111 學年度第 1 學期第 1 次學務處組長會議修正通過 111 年 10 月 12 日 111 學年度第 1 學期第 2 次協調會報修正通過 111 年 11 月 2 日 111 學年度第 1 學期第 5 次行政會議修正通過

第一條 為鼓勵並輔導本校招收之『運動績優升學輔導入學生』 ，提昇其學業水 平，達到本校課業要求，得以順利完成學位，特訂定本辦法。

第二條 凡本校招收之『運動績優升學輔導入學生』皆可申請接受補助。

第三條 獎助原則：

一、每位學生每學年課業輔導費依據預算編列及申請人數、學門數核給，輔 導費每小時 500 元。學生申請課輔科目須為該學系或學程必修科目（不 含必修實習課） 。補助以六學期為限，每學期以不超過兩門課為原則， 若有特殊狀況時，學生事務處體育發展組得另案增加補助年限與科目。 二、接受補助之同學，由學生事務處體育發展組遴聘適任之學生輔導其課 業。

三、有需要課輔之同學應於每學期開學二週內提出申請，學生事務處體育發 展組於開學後一個月內公告符合資格之同學名單。

第四條 本辦法經學生事務處組長會議討論，提行政會議討論通過，並簽請校長 核定後實施，修正時亦同。",202305231613030212.md,202302141202170065.md,"['學生輔導', '學生輔導法']",學生事務處↔學生事務處,學生輔導法↔學生輔導,5.0,3.29,5.0,5.0,5.0,2.0,5.0
國立中山大學中國文學系教師升等審查辦法中，教師申請升等需要提交哪些資料？此外，系課程委員會在課程設置上有哪些主要職責？,根據國立中山大學中國文學系教師升等審查辦法，教師申請升等需於每學期正式上課日一週前向系主任申請，並提交以下資料：1. 「國立中山大學教師升等送審資料項目表」所列初審應繳資料及表件；2. 文學院教師升等初審作業規定之表件；3. 「國立中山大學中國文學系教師升等計分表」（學術研究類或教學研究類）及相關資料；4. 送審著作一式四份。系主任接獲申請後，將資料公開陳列一週供全系教師閱覽，並召開系教師評審委員會進行資格審查。至於系課程委員會的主要職責包括：定期檢討修正系所課程、課程結構與發展方向（納入業界、畢業校友及學生或家長意見）；初審入學新生必修科目表相關事宜；初審新開課程的課程名稱、內容、大綱及相關因素；審議課程相關問題；考量教師專長及平衡研究、教學負擔，規劃安排每學年度課程授課教師；研議課程相關改善機制並提案系務會議討論；相關決議須經系務會議通過後送院課程委員會審議。,"['<1-hop>  [202005141625120295.md]\n\n國立中山大學中國文學系「課程委員會設置要點」\n\n98.12.09 98 學年度第 3 次系務會議訂定 99.01.15 98 學年度第 3 次院課程委員會議通過 99.03.24 98 學年度第 5 次系務會議修訂通過 99.05.06 98 學年度第 6 次院課程委員會議修訂通過 99.05.31 984 校課程委員會議通過 99.06.15 第 124 次教務會議通過\n\n105.11.30 105 學年度第 3 次系務會議修訂通過\n\n第一條 依據本校課程委員會設置要點第三條之規定，訂定本要點。\n\n第二條 本系課程委員會（以下簡稱「系課程會」），由本系專任教 師5名、學生代表1 至2 人、校外專家學者(含業界代表)1 至2 人組成(系主任為當然委員兼召集人)。\n\n第三條 系課程會之職責：\n\n一、定期檢討修正系所課程、課程結構與發展方向（納入業界、 畢業校友及學生（或家長）之意見） 。\n\n二、初審入學新生必修科目表相關之事宜。\n\n三、初審新開課程下列項目：\n\n．課程名稱（中、英文） 、課程內容、課程大綱。\n\n．考量其他相關因素，如新開設課程與教師專長之配合、與 系所發展方向之配合、與現有課程之關連等。\n\n四、課程相關問題之審議。\n\n五、考量教師專長及平衡研究、教學之負擔，規劃及安排每學年 度課程授課教師。\n\n六、研議系所課程相關改善機制，作成議案提系務會議討論。\n\n七、相關決議須經系務會議通過後方可送院課程委員會審議。\n\n第四條 本要點經系務會議通過，並送院、校課程委員會及教務會議核備 後實施，其修正時亦同。', '<2-hop>  [202005141641090311.md]\n\n國立中山大學中國文學系教師升等審查辦法\n\n83.01.14 82 學年度中文系所教師評審委員會議通過 85.12.11 85 學年度第 4 次系務會議修正通過 89.10.04 89 學年度第 1 次系務會議修正通過 89.12.13 89 學年度第 2 次系務會議修正通過 89.12.21 89 學年度第 6 次院教評會通過 90.09.26 90 學年度第 1 次系務會議修正通過 91.03.26 90 學年度第 6 次院教評會通過 93.04.21 92 學年度第 4 次系務會議修正通過 93.06.01 92 學年度第 5 次系務會議修正通過 93.06.08 92 學年度第 11 次院教評會通過 97.06.19 96 學年度第 6 次系務會議修正通過 97.10.02 97 學年度第 1 次院教評會通過 102.09.25 102 學年度第 1 次系務會議修正通過 102.10.18 102 學年度第 2 次院教評會修正通過 103.02.27 102 學年度第 6 次院教評會修正通過 103.05.21 102 學年度第 8 次院教評會修正通過 106.03.01 105 學年度第 5 次系教評會修正通過 學年度第 6 次系務會議修正通過 106.04.20 105 學年度第 6 次院教評會修正通過 107.05.15 105 學年度第 7 次系教評會修正通過 107.05.16 106 學年度第 8 次系務會議修正通過 107.06.14 106 學年度第 8 次院教評會修正通過 107.07.06 陳核通過\n\n一、本系為辦理教師升等，依據本校「教師評審委員會設置辦法」第二條之規定及本校、本 院教師升等審查相關法規，訂定本辦法。\n\n二、凡符合本校與文學院教師升等審查辦法規定之教師，得於每學期正式上課日一週前向 系主任申請升等，並提交下列資料：\n\n（一） 「國立中山大學教師升等送審資料項目表」所列初審應繳資料及表件。\n\n（二）文學院教師升等初審作業規定之表件。\n\n（三） 「國立中山大學中國文學系教師升等計分表」 （學術研究類或教學研究類）及相 關資料。\n\n（四）送審著作一式四份。\n\n三、系主任接獲教師升等之申請後，將上述資料公開陳列（一週） ，供全系教師閱覽，隨後召 開系教師評審委員會進行資格審查。並於當學期正式上課後十日內，將通過資格審查者 資料彙送文學院教師評審委員會辦理著作審查。\n\n四、擬升等教師所提送審著作應符合文學院教師升等審查辦法第二條之規定。著作審查由院 長聘請校外適格之學者專家三人審查。審查人選由系教評會擬提具有充分專業能力之校 外學者專家七人以上（院長得增列審查人選） ，簽請院長召集院教評會委員若幹人圈定三 人後，由文學院辦理著作外審，外審成績結果送回本系初審。外審學者應迴避申請人原 畢業學校之教授。\n\n五、依據本校「教師及研究人員升等審查辦法」第四條規定，本系教師評審委員會應就升 等教師之學術研究或教學研究、教學、服務等三項評定成績，成績總分達七十分（含） 以上者通過初審。本系教師升等初審其計分比例與項目如下：\n\n（一）學術研究類：學術研究佔百分之七十、教學績效佔百分之二十、服務成績佔百分 之十。\n\n學術研究與教學績效計分方式依「國立中山大學文學院教師升等計分表－學術研 究類」所列項目計分。服務成績計分方式依「國立中山大學中國文學系教師升等 服務成績評分原則」所列項目計分。\n\n（二）教學研究類：教學研究佔百分之六十、教學績效佔百分之三十、服務成績佔百分 之十。\n\n教學研究與教學績效計分方式依「國立中山大學文學院教師升等計分表－教學研 究類」所列項目計分。服務成績計分方式依「國立中山大學中國文學系教師升等 服務成績評分原則」所列項目計分。\n\n六、初審結果若不通過，系教師評審委員會召集人應以書面敘明理由通知申請人。申請人對 於初審結果若有異議，得依本校相關辦法及程序提出申復（或申訴） 。\n\n七、本辦法經系務會議通過，送院教評會審議通過，送請校長核定後實施，修正時亦同。']",staff,Web search like queries,long,"<1-hop>  [202005141625120295.md]

國立中山大學中國文學系「課程委員會設置要點」

98.12.09 98 學年度第 3 次系務會議訂定 99.01.15 98 學年度第 3 次院課程委員會議通過 99.03.24 98 學年度第 5 次系務會議修訂通過 99.05.06 98 學年度第 6 次院課程委員會議修訂通過 99.05.31 984 校課程委員會議通過 99.06.15 第 124 次教務會議通過

105.11.30 105 學年度第 3 次系務會議修訂通過

第一條 依據本校課程委員會設置要點第三條之規定，訂定本要點。

第二條 本系課程委員會（以下簡稱「系課程會」），由本系專任教 師5名、學生代表1 至2 人、校外專家學者(含業界代表)1 至2 人組成(系主任為當然委員兼召集人)。

第三條 系課程會之職責：

一、定期檢討修正系所課程、課程結構與發展方向（納入業界、 畢業校友及學生（或家長）之意見） 。

二、初審入學新生必修科目表相關之事宜。

三、初審新開課程下列項目：

．課程名稱（中、英文） 、課程內容、課程大綱。

．考量其他相關因素，如新開設課程與教師專長之配合、與 系所發展方向之配合、與現有課程之關連等。

四、課程相關問題之審議。

五、考量教師專長及平衡研究、教學之負擔，規劃及安排每學年 度課程授課教師。

六、研議系所課程相關改善機制，作成議案提系務會議討論。

七、相關決議須經系務會議通過後方可送院課程委員會審議。

第四條 本要點經系務會議通過，並送院、校課程委員會及教務會議核備 後實施，其修正時亦同。","<2-hop>  [202005141641090311.md]

國立中山大學中國文學系教師升等審查辦法

83.01.14 82 學年度中文系所教師評審委員會議通過 85.12.11 85 學年度第 4 次系務會議修正通過 89.10.04 89 學年度第 1 次系務會議修正通過 89.12.13 89 學年度第 2 次系務會議修正通過 89.12.21 89 學年度第 6 次院教評會通過 90.09.26 90 學年度第 1 次系務會議修正通過 91.03.26 90 學年度第 6 次院教評會通過 93.04.21 92 學年度第 4 次系務會議修正通過 93.06.01 92 學年度第 5 次系務會議修正通過 93.06.08 92 學年度第 11 次院教評會通過 97.06.19 96 學年度第 6 次系務會議修正通過 97.10.02 97 學年度第 1 次院教評會通過 102.09.25 102 學年度第 1 次系務會議修正通過 102.10.18 102 學年度第 2 次院教評會修正通過 103.02.27 102 學年度第 6 次院教評會修正通過 103.05.21 102 學年度第 8 次院教評會修正通過 106.03.01 105 學年度第 5 次系教評會修正通過 學年度第 6 次系務會議修正通過 106.04.20 105 學年度第 6 次院教評會修正通過 107.05.15 105 學年度第 7 次系教評會修正通過 107.05.16 106 學年度第 8 次系務會議修正通過 107.06.14 106 學年度第 8 次院教評會修正通過 107.07.06 陳核通過

一、本系為辦理教師升等，依據本校「教師評審委員會設置辦法」第二條之規定及本校、本 院教師升等審查相關法規，訂定本辦法。

二、凡符合本校與文學院教師升等審查辦法規定之教師，得於每學期正式上課日一週前向 系主任申請升等，並提交下列資料：

（一） 「國立中山大學教師升等送審資料項目表」所列初審應繳資料及表件。

（二）文學院教師升等初審作業規定之表件。

（三） 「國立中山大學中國文學系教師升等計分表」 （學術研究類或教學研究類）及相 關資料。

（四）送審著作一式四份。

三、系主任接獲教師升等之申請後，將上述資料公開陳列（一週） ，供全系教師閱覽，隨後召 開系教師評審委員會進行資格審查。並於當學期正式上課後十日內，將通過資格審查者 資料彙送文學院教師評審委員會辦理著作審查。

四、擬升等教師所提送審著作應符合文學院教師升等審查辦法第二條之規定。著作審查由院 長聘請校外適格之學者專家三人審查。審查人選由系教評會擬提具有充分專業能力之校 外學者專家七人以上（院長得增列審查人選） ，簽請院長召集院教評會委員若幹人圈定三 人後，由文學院辦理著作外審，外審成績結果送回本系初審。外審學者應迴避申請人原 畢業學校之教授。

五、依據本校「教師及研究人員升等審查辦法」第四條規定，本系教師評審委員會應就升 等教師之學術研究或教學研究、教學、服務等三項評定成績，成績總分達七十分（含） 以上者通過初審。本系教師升等初審其計分比例與項目如下：

（一）學術研究類：學術研究佔百分之七十、教學績效佔百分之二十、服務成績佔百分 之十。

學術研究與教學績效計分方式依「國立中山大學文學院教師升等計分表－學術研 究類」所列項目計分。服務成績計分方式依「國立中山大學中國文學系教師升等 服務成績評分原則」所列項目計分。

（二）教學研究類：教學研究佔百分之六十、教學績效佔百分之三十、服務成績佔百分 之十。

教學研究與教學績效計分方式依「國立中山大學文學院教師升等計分表－教學研 究類」所列項目計分。服務成績計分方式依「國立中山大學中國文學系教師升等 服務成績評分原則」所列項目計分。

六、初審結果若不通過，系教師評審委員會召集人應以書面敘明理由通知申請人。申請人對 於初審結果若有異議，得依本校相關辦法及程序提出申復（或申訴） 。

七、本辦法經系務會議通過，送院教評會審議通過，送請校長核定後實施，修正時亦同。",202005141625120295.md,202005141641090311.md,"['國立中山大學中國文學系教師升等審查辦法', '國立中山大學中國文學系']",文學院↔文學院 | 中國文學系↔中國文學系,國立中山大學中國文學系↔國立中山大學中國文學系教師升等審查辦法,5.0,5.0,5.0,5.0,5.0,2.0,5.0
根據國立中山大學文學院的規定，外籍教學人員的續聘考核標準與教師升等審查程序中，教評會（Faculty Evaluation Committee）在審核過程中扮演什麼角色？這兩者的審核程序有何異同？,根據提供的上下文，國立中山大學文學院中，教評會在外籍教學人員續聘考核中，負責審核擬續聘者的資料，考核項目包括每週授課時數、教學意見調查結果、主持計畫或發表學術論文等，考核結果須經聘用單位教評會及本學院教評會審核通過後，才送本校教評會進行續聘審議，續聘須經校教評會通過方得續聘。至於教師升等審查中，教評會分為系（所）級及院級教評會，負責審議教師升等案，審查包括學術研究、教學績效及服務績效等，升等案經系（所）級教評會審查通過後，送院級教評會審議，院級教評會通過後，再送校教評會進行校級審查。教評會在兩者中均為重要審核機構，但外籍教學人員續聘考核強調教學時數與教學滿意度及研究成果的考核，且有改善期規定；教師升等審查則涵蓋更廣泛的學術及教學評分，並有外審成績及申訴機制。兩者均需經系（所）、院及校教評會層層審核，且均須經校教評會通過後方可生效。,"[""<1-hop>  [202509110535500716.md]\n\n國立中山大學文學院進用外籍教學人員考核要點\n\nGuidelines on the Assessment of International Faculty in the College of Liberal Arts\n\n107.4.18 106 學年度第 8 次院主管會議通過 107.4.19 106 學年度第 6 次院教評會通過 107.5.3 本校第 387 次校教評會通過 109.3.5 108 學年度第 5 次院教評會通過 109.3.19 本校第 398 次校教評會通過 111.12.8 111 學年度第 3 次院教評會修正通過\n\n111.12.29 本校第 420 次校教評會通過\n\nApproved by the 420 th University Faculty Evaluation Committee Meeting on December. 29 th , 2022\n\n一、 依據本校進用外籍教學人員聘任制度實施方案 ( 以下簡稱本方案 ) 辦理。\n\nI. These guidelines are formulated in accordance with the University's Implementation of the Appointment of International Faculty .\n\n二、 本方案進用人員聘期以二年為原則，惟服務每屆滿一年前，應依本校法 規規定並配合本學院教評會 ( 以下簡稱教評會 ) 召開時間，提供符合本要 點第三點之擬續聘者資料，送本學院教評會進行考核。\n\nII. The appointment term for the faculty appointed through the University's Implementation of the Appointment of International Faculty shall be two years, in principle. Nevertheless, relevant materials specified in Article 3 herein shall be submitted to the College Faculty Evaluation Committee (CFEC) for assessment one year prior to the end of each term in accordance with the University's regulations and the CFEC's meeting schedule.\n\n三、 續聘 ( 晉薪 ) 考核項目及標準 :\n\nIII. Assessment items and criteria for appointment renewal (salary increment)\n\n( 一 ) 每週授課時數達契約約定時數及最近一學期教學意見調查結果滿 意度平均達 5.5 分以上（七分量表）。\n\n(1) fulfilling the stipulated weekly teaching hours specified in their contract and receiving an average satisfactory score of 5.5 or above (on a seven-point scale) in the teaching survey in the previous semester\n\n( 二 ) 主持國科會、政府部會、法人機構之計畫或發表學術論文。\n\n(2) serving as the principal investigator of research projects granted by National Science and Technology Council, governmental agencies or non-governmental agencies, or publishing academic papers\n\n到職第一年或因課程特殊需求者考核標準，應符合第 1 款。\n\nThe international faculty in their first year of appointment or those appointed for teaching specific courses shall fulfill the requirement of Subparagraph 1 of Paragraph 1.\n\n到職第二年 ( 含以上 ) 者考核標準，除符合第 1 款外，並應符合第 2 款之其 中一項。\n\nThose with two years of service or above shall fulfill not only the requirement of Subparagraph 1 but also at least one requirement in Subparagraph 2 of Paragraph 1.\n\n考核結果經聘用單位之教評會審議通過，且經本學院教評會審核通過後， 始得送本校教評會進行續聘審議，審議為通過後，始得續聘。\n\nAssessment results shall be approved by the faculty evaluation committee of the employing unit and the CFEC, and then submitted to the University Faculty Evaluation Committee (UFEC) for further review and approval. Appointment renewal shall take effect only after approval by the UFEC.\n\n四、 本方案進用人員每年聘用第一個學期之教學意見調查結果應送次一學期 之聘用單位教評會審議，未符合本要點規定或經本學院教評會審核未通 過者，給予次一個學期之改善期，若次二個學期評核仍未通過，不予續 聘。\n\nIV. The result of teaching survey from international faculty's first semester shall be reviewed by the faculty evaluation committee of the employing unit in the following semester each year. Those failing to meet the requirements stipulated in these guidelines or to pass the assessment approved by the CFEC may be granted one semester for improvement. Failure to pass again in the next assessment shall result in non-renewal of appointment.\n\n五、 本要點未盡事宜悉依本校進用外籍教學人員聘任制度實施方案辦理。\n\nV. Matters not covered herein shall be handled in accordance with the University's Implementation of the Appointment of International Faculty .\n\n六、 本要點經本學院教評會及本校教評會通過，陳請校長核定後實施，修正 時亦同。\n\nVI. These guidelines are approved by the CFEC and the UFEC, and submitted to the President for approval before implementation. Amendments to these guidelines shall follow the same procedure."", ""<2-hop>  [202509142203130723.md]\n\n國立中山大學文學院教師升等審查要點\n\nGuidelines on the Evaluation of Professorship Rank Promotion in the College of Liberal Arts\n\n88.6.22 八十七學年度第八次院務會議訂定\n\n88.12.28 本校第 224 次教師評審委員會通過\n\n89.4.27 八十八學年度第五次院務會議修正通過\n\n89.6.13 八十八學年度第十次院教評會修正通過 89.11.23 八十九學年度第一次院務會議通過 89.11.27 第 240 次教師評審委員會通過 93.5.25 九十二學年度第十次院教評會通過 93.6.17 九十二學年度第四次院務會議通過 93.9.30 第 291 次校教評會修正通過 94.10.05 九十四學年度第一次院務會議修正通過 94.10.20 第 297 次校教評會通過 95.04.25 九十四學年度第七次院教評會通過 95.05.02 九十四學年度第五次院務會議通過 95.06.15 第 303 次校教評會通過 97.05.22 九十六學年度第七次院教評會修正通過 97.05.29 九十六學年度第六次院務會議修正通過 97.06.18 第 315 次校教評會通過 98.06.04 九十七學年度第八次院教評會修正通過 98.06.16 第 322 次校教評會通過 105.12.22 一 o 五學年度第一次院務會議修正通過 106.1.5 第 378 次校教評會予以核備 107.3.8 、 4.19 一 o 六學年度第五、六次院教評會修正通過 107.4.11 一 o 六學年度第五次院務會議修正通過 107.5.3 一 o 六學年度第 387 次校教評會通過 111 學年度第 3 次院教評會修正通過（ 111.12.8 ） 111 學年度第 2 次院務會議修正通過（ 111.12.01 ） 本校第 420 次校教評會通過（ 111.12.29 ） 111 學年度第 6 次院教評會修正通過（ 112.4.13 ） 111 學年度第 4 次院務會議修正通過（ 112.4.20 ） 本校第 422 次校教評會通過（ 112.4.27 ）\n\nApproved at the 422nd University Faculty Evaluation Committee meeting on April 27, 2023\n\n一、 本學院為辦理教師升等，依據本校教師升等審查辦法，訂定本要點。\n\nI. These guidelines are formulated in accordance with the University's Regulations for the Evaluation of Professorship Rank Promotion to handle the evaluation of professorship rank promotion of the faculty in the College of Liberal Arts (hereinafter referred to as the 'College').\n\n二、 本學院各級教師申請升等資格及年資採計，應符合本校教師升等審查 辦法之規定。\n\nII. For the College faculty of all ranks applying for promotion, the eligibility and calculation of work seniority shall comply with the University's Regulations for the Evaluation of Professorship Rank Promotion .\n\n（一） 升等管道：分為一般研究類、技術應用類、教學研究類及展演藝 術類。申請升等教師應擇一提出申請，其中展演藝術類限適用於\n\n音樂學系及劇場藝術學系所屬教師。\n\n(1) The pathway of the faculty's rank promotion is categorized into the tracks of general research, technology application, pedagogical research, and performing arts. The faculty shall select one of the tracks to submit their application. Nevertheless, the track of performing arts shall be exclusively applicable to the faculty affiliated with the Department of Music and the Department of Theater Arts.\n\n（二） 升等審查包括學術產學研究績效 (A) 、教學績效 (B) 及服務績效 (C) 三項，學術產學研究績效分為學術研究成果外審成績 (A1) 及七年 內本職級研究計畫獎助及學術成就 (A2) 。\n\n(2) The evaluation includes three categories: academic & industryacademia research performance (A), teaching performance (B), and service performance (C). Academic & industry-academia research performance (A) includes external evaluation of academic research (A1) and research projects and other academic achievements within the past 7 years at the current rank (A2).\n\n（三） 各升等管道各項評分比重如下表 :\n\n(3) The scoring percentage of the three categories for each track is as follows:\n\n（四） 教師所提外審之學術研究成果件數至多 10 件。教師應自行擇一為 代表作，其屬系列之相關研究者，得合併為代表學術研究成果， 其餘列為參考學術研究成果。以展演藝術類提出升等者所提外審 依專科以上學校教師資格審定辦法之「附表三、以作品及成就證\n\n升等類別 tracks of promotion 學術產學研究績效 (A) academic &industry-academia research performance (A) ( 學術研究成果外審成績 A1 、七年內本職 級研究計畫獎助及學術成就 A2) (external evaluation of academic research A1, research projects and other academic achievements within the past 7 years at the current rank A2) 教學績效 (B) teaching performance (B) 服務績效 (C) service performance (C) 一般研究類 general research 70%(A1:75% 、 A2:25%) 20% 10% 技術應用類 technology application 70%(A1:40% 、 A2:60%) 20% 10% 教學研究類 pedagogical research 60%(A1:60% 、 A2:40%) 30% 10% 展演藝術 performing arts 70%(A1:75% 、 A2:25%) 20% 10%\n\n明送審教師資格審查範圍及基準」辦理。\n\n(4) The faculty applying for rank promotion shall submit up to ten academic research works for the external evaluation, and shall select one as a representative work and use the rest as reference. Related works constituting a series may be compiled into one representative work. Those applying through the track of performing arts shall have their external evaluation handled in accordance with the Scope and Criteria for Examination of Creative Works and Evidence of Achievement Submitted for Teacher Accreditation Reviews (Attachment 3) of Regulations Governing Accreditation of Teacher Qualifications at Junior Colleges and Institutions of Higher Education.\n\n（五） 學術產學研究績效、教學績效及服務績效依本學院教師升等審查 評分細則辦理 ( 另訂之 ) 。\n\n(5) Academic & industry-academia research performance, teaching performance, and service performance shall be scored in accordance with Guidelines on the Detailed Implementation of Evaluation of Professorship Rank Promotion in the College of Liberal Arts .\n\n（六） 本學院系 ( 所 ) 級及院級教師評審委員會 ( 以下簡稱教評會 ) 審議本 學院教師升等案，升等為教授或副教授者之學術研究成果外審成 績，除依本校規定至少有四位外審委員評等為「優良」以上外， 且外審成績總平均升等教授者需達 80 分以上或升等副教授者需 達 77 分以上，始達外審合格門檻。未達外審合格門檻者，視為 升等不通過。\n\n(6) Department/institute faculty evaluation committees (hereinafter referred to as the 'DFEC') and the College Faculty Evaluation Committee (CFEC) shall review rank promotion cases. Applicants applying for professorship or associate professorship shall receive the 'Good' grade from at least four reviewers. Moreover, the passing threshold of external evaluation shall be 80 and 77 for professorship and associate professorship, respectively. Those not passing the external evaluation shall be deemed unsuccessful in their application for promotion.\n\n（七） 前經教師資格審定不合格者，重新提出之學術研究成果曾作為代 表作送審時，其送審著作應增加或更換一件以上。\n\n(7) When submitting the same representative work as the one used in a prior failed application, applicants shall add at least one new reference work as a replacement or supplement.\n\n三、 各系（所）應於每學期正式上課一星期內，將通過系 ( 所 ) 級升等資格審 查之系 ( 所 ) 級教評會會議紀錄、審查資料、迴避名單與迴避理由，亦得\n\n提供不利審查之學者專家名單，送院教評會，逾期不受理。\n\nIII. Individual departments/institutes shall submit cases that pass the qualification review along with the DFEC meeting minutes, relevant documentation, the recusal list of interested person with reasons, and the list of scholars who might deemed unfavorable in the evaluation if needed to the CFEC within the first week after the class starts in each semester. Late submissions shall not be accepted.\n\n四、 各系（所）教評會下學期辦理 8 月 1 日及上學期辦理 2 月 1 日升等生效之升 等審查，除依據各系（所）教師升等審查要點外，應依本要點及本校教 師升等審查辦法由校進行外審。外審結果送回系（所）級教評會審查， 由系 ( 所 ) 級教評會召集人加註評語，連同審查成績、會議紀錄及各項表 件等申請資料，於本學院通知限期截止日前提送本學院第三次教評會辦 理院級審查。\n\nIV. In order for faculty promotions to take effect on August 1 (Fall semester) or February 1 (Spring semester), the DFEC shall review rank promotion cases in accordance with its own Guidelines on the Evaluation of Professorship Rank Promotion , and the University shall submit the applicants' case to the external reviewers for evaluation according to the University's Regulations for the Evaluation of Rank Professorship Rank . The external evaluation result shall be returned back to the DFEC for the department level review; the DFEC shall then submit the cases passing its review, along with the chairperson's comments, the score of the review, the meeting minutes, and relevant documentation to the CFEC third meeting each semester before the deadline specified by the College.\n\n五、 本學院教評會受理教師升等審查案時，其程序悉依本校教師升等審查辦 法及第四點規定辦理之。\n\nV. The College shall review rank promotion cases in accordance with Article 4 of the University's Regulations for the Evaluation of Professorship Rank Promotion .\n\n六、 本學院教評會開會審議升等案件時，得邀請有關人員列席說明。\n\nVI. When the CFEC convenes to review rank promotion cases, relevant personnel may be invited to attend and provide explanations.\n\n七、 本學院教評會審議升等案時，委員應親自出席，不得由他人代理。須有 委員三分之二以上出席，始得開會。\n\nVII. At least two-thirds of the CFEC members shall attend to review rank promotion cases, with members attending in person and no proxies allowed.\n\n八、 經本學院教評會升等審查通過之教師，由院級教評會召集人加註評語， 連同審查成績、會議紀錄及各項表件等申請資料及其升等著作，送本校 教評會進行校級審查。\n\nVIII. Cases that pass the college level review shall be submitted along with the score of the review, the CFEC meeting minutes, relevant documentation, the applicant's publications, and the chairperson's comments to the University Faculty Evaluation Committee (UFEC) for the university review.\n\n九、 本學院教師升等案，經系 ( 所 ) 級或院級教師評審委員會審查時，發現外 審意見有疑義者，得依本校教師升等審查辦法提出行政救濟。\n\nIX. Administrative remedies may be sought in accordance with the University's Regulations for the Evaluation of Professorship Rank Promotion when there are doubts regarding the result of external evaluation during the review by the DFEC or CFEC.\n\n十、 經系 ( 所 ) 級或院級教評會審議不通過，申請升等教師如不服審議結果， 得依相關規定提出申訴或申復。申請升等教師於申復期間向本校申評會 提出申訴者，申復應立即停止。\n\nX. Applicants not passing the review by the DFEC or CFEC and disagreeing with the evaluation result may file an appeal or grievance in accordance with relevant regulations. When the applicants directly appeal to the Faculty Appeal Handling Committee after filing a grievance against the DFEC or CFEC's decision, the process of the grievance shall be immediately terminated.\n\n十一、 本要點若有未盡事宜，悉依本校教師升等審查辦法及專科以上教師資格 審定辦法等相關法規處理之。\n\nXI. Matters not covered herein shall be handled in accordance with the University's Regulations for the Evaluation of Professorship Rank Promotion , Regulations Governing Accreditation of Teacher Qualifications at Junior Colleges and Institutions of Higher Education , and relevant regulations of the University.\n\n十二、 本要點經本學院教評會、院務會議及校教評會通過，陳請校長同意後實 施；修正時亦同。\n\nXII. These guidelines are approved by the CFEC, the College Council, the UFEC, and the President before implementation. Amendments to these guidelines shall follow the same procedure.""]",teacher,Misspelled queries,medium,"<1-hop>  [202509110535500716.md]

國立中山大學文學院進用外籍教學人員考核要點

Guidelines on the Assessment of International Faculty in the College of Liberal Arts

107.4.18 106 學年度第 8 次院主管會議通過 107.4.19 106 學年度第 6 次院教評會通過 107.5.3 本校第 387 次校教評會通過 109.3.5 108 學年度第 5 次院教評會通過 109.3.19 本校第 398 次校教評會通過 111.12.8 111 學年度第 3 次院教評會修正通過

111.12.29 本校第 420 次校教評會通過

Approved by the 420 th University Faculty Evaluation Committee Meeting on December. 29 th , 2022

一、 依據本校進用外籍教學人員聘任制度實施方案 ( 以下簡稱本方案 ) 辦理。

I. These guidelines are formulated in accordance with the University's Implementation of the Appointment of International Faculty .

二、 本方案進用人員聘期以二年為原則，惟服務每屆滿一年前，應依本校法 規規定並配合本學院教評會 ( 以下簡稱教評會 ) 召開時間，提供符合本要 點第三點之擬續聘者資料，送本學院教評會進行考核。

II. The appointment term for the faculty appointed through the University's Implementation of the Appointment of International Faculty shall be two years, in principle. Nevertheless, relevant materials specified in Article 3 herein shall be submitted to the College Faculty Evaluation Committee (CFEC) for assessment one year prior to the end of each term in accordance with the University's regulations and the CFEC's meeting schedule.

三、 續聘 ( 晉薪 ) 考核項目及標準 :

III. Assessment items and criteria for appointment renewal (salary increment)

( 一 ) 每週授課時數達契約約定時數及最近一學期教學意見調查結果滿 意度平均達 5.5 分以上（七分量表）。

(1) fulfilling the stipulated weekly teaching hours specified in their contract and receiving an average satisfactory score of 5.5 or above (on a seven-point scale) in the teaching survey in the previous semester

( 二 ) 主持國科會、政府部會、法人機構之計畫或發表學術論文。

(2) serving as the principal investigator of research projects granted by National Science and Technology Council, governmental agencies or non-governmental agencies, or publishing academic papers

到職第一年或因課程特殊需求者考核標準，應符合第 1 款。

The international faculty in their first year of appointment or those appointed for teaching specific courses shall fulfill the requirement of Subparagraph 1 of Paragraph 1.

到職第二年 ( 含以上 ) 者考核標準，除符合第 1 款外，並應符合第 2 款之其 中一項。

Those with two years of service or above shall fulfill not only the requirement of Subparagraph 1 but also at least one requirement in Subparagraph 2 of Paragraph 1.

考核結果經聘用單位之教評會審議通過，且經本學院教評會審核通過後， 始得送本校教評會進行續聘審議，審議為通過後，始得續聘。

Assessment results shall be approved by the faculty evaluation committee of the employing unit and the CFEC, and then submitted to the University Faculty Evaluation Committee (UFEC) for further review and approval. Appointment renewal shall take effect only after approval by the UFEC.

四、 本方案進用人員每年聘用第一個學期之教學意見調查結果應送次一學期 之聘用單位教評會審議，未符合本要點規定或經本學院教評會審核未通 過者，給予次一個學期之改善期，若次二個學期評核仍未通過，不予續 聘。

IV. The result of teaching survey from international faculty's first semester shall be reviewed by the faculty evaluation committee of the employing unit in the following semester each year. Those failing to meet the requirements stipulated in these guidelines or to pass the assessment approved by the CFEC may be granted one semester for improvement. Failure to pass again in the next assessment shall result in non-renewal of appointment.

五、 本要點未盡事宜悉依本校進用外籍教學人員聘任制度實施方案辦理。

V. Matters not covered herein shall be handled in accordance with the University's Implementation of the Appointment of International Faculty .

六、 本要點經本學院教評會及本校教評會通過，陳請校長核定後實施，修正 時亦同。

VI. These guidelines are approved by the CFEC and the UFEC, and submitted to the President for approval before implementation. Amendments to these guidelines shall follow the same procedure.","<2-hop>  [202509142203130723.md]

國立中山大學文學院教師升等審查要點

Guidelines on the Evaluation of Professorship Rank Promotion in the College of Liberal Arts

88.6.22 八十七學年度第八次院務會議訂定

88.12.28 本校第 224 次教師評審委員會通過

89.4.27 八十八學年度第五次院務會議修正通過

89.6.13 八十八學年度第十次院教評會修正通過 89.11.23 八十九學年度第一次院務會議通過 89.11.27 第 240 次教師評審委員會通過 93.5.25 九十二學年度第十次院教評會通過 93.6.17 九十二學年度第四次院務會議通過 93.9.30 第 291 次校教評會修正通過 94.10.05 九十四學年度第一次院務會議修正通過 94.10.20 第 297 次校教評會通過 95.04.25 九十四學年度第七次院教評會通過 95.05.02 九十四學年度第五次院務會議通過 95.06.15 第 303 次校教評會通過 97.05.22 九十六學年度第七次院教評會修正通過 97.05.29 九十六學年度第六次院務會議修正通過 97.06.18 第 315 次校教評會通過 98.06.04 九十七學年度第八次院教評會修正通過 98.06.16 第 322 次校教評會通過 105.12.22 一 o 五學年度第一次院務會議修正通過 106.1.5 第 378 次校教評會予以核備 107.3.8 、 4.19 一 o 六學年度第五、六次院教評會修正通過 107.4.11 一 o 六學年度第五次院務會議修正通過 107.5.3 一 o 六學年度第 387 次校教評會通過 111 學年度第 3 次院教評會修正通過（ 111.12.8 ） 111 學年度第 2 次院務會議修正通過（ 111.12.01 ） 本校第 420 次校教評會通過（ 111.12.29 ） 111 學年度第 6 次院教評會修正通過（ 112.4.13 ） 111 學年度第 4 次院務會議修正通過（ 112.4.20 ） 本校第 422 次校教評會通過（ 112.4.27 ）

Approved at the 422nd University Faculty Evaluation Committee meeting on April 27, 2023

一、 本學院為辦理教師升等，依據本校教師升等審查辦法，訂定本要點。

I. These guidelines are formulated in accordance with the University's Regulations for the Evaluation of Professorship Rank Promotion to handle the evaluation of professorship rank promotion of the faculty in the College of Liberal Arts (hereinafter referred to as the 'College').

二、 本學院各級教師申請升等資格及年資採計，應符合本校教師升等審查 辦法之規定。

II. For the College faculty of all ranks applying for promotion, the eligibility and calculation of work seniority shall comply with the University's Regulations for the Evaluation of Professorship Rank Promotion .

（一） 升等管道：分為一般研究類、技術應用類、教學研究類及展演藝 術類。申請升等教師應擇一提出申請，其中展演藝術類限適用於

音樂學系及劇場藝術學系所屬教師。

(1) The pathway of the faculty's rank promotion is categorized into the tracks of general research, technology application, pedagogical research, and performing arts. The faculty shall select one of the tracks to submit their application. Nevertheless, the track of performing arts shall be exclusively applicable to the faculty affiliated with the Department of Music and the Department of Theater Arts.

（二） 升等審查包括學術產學研究績效 (A) 、教學績效 (B) 及服務績效 (C) 三項，學術產學研究績效分為學術研究成果外審成績 (A1) 及七年 內本職級研究計畫獎助及學術成就 (A2) 。

(2) The evaluation includes three categories: academic & industryacademia research performance (A), teaching performance (B), and service performance (C). Academic & industry-academia research performance (A) includes external evaluation of academic research (A1) and research projects and other academic achievements within the past 7 years at the current rank (A2).

（三） 各升等管道各項評分比重如下表 :

(3) The scoring percentage of the three categories for each track is as follows:

（四） 教師所提外審之學術研究成果件數至多 10 件。教師應自行擇一為 代表作，其屬系列之相關研究者，得合併為代表學術研究成果， 其餘列為參考學術研究成果。以展演藝術類提出升等者所提外審 依專科以上學校教師資格審定辦法之「附表三、以作品及成就證

升等類別 tracks of promotion 學術產學研究績效 (A) academic &industry-academia research performance (A) ( 學術研究成果外審成績 A1 、七年內本職 級研究計畫獎助及學術成就 A2) (external evaluation of academic research A1, research projects and other academic achievements within the past 7 years at the current rank A2) 教學績效 (B) teaching performance (B) 服務績效 (C) service performance (C) 一般研究類 general research 70%(A1:75% 、 A2:25%) 20% 10% 技術應用類 technology application 70%(A1:40% 、 A2:60%) 20% 10% 教學研究類 pedagogical research 60%(A1:60% 、 A2:40%) 30% 10% 展演藝術 performing arts 70%(A1:75% 、 A2:25%) 20% 10%

明送審教師資格審查範圍及基準」辦理。

(4) The faculty applying for rank promotion shall submit up to ten academic research works for the external evaluation, and shall select one as a representative work and use the rest as reference. Related works constituting a series may be compiled into one representative work. Those applying through the track of performing arts shall have their external evaluation handled in accordance with the Scope and Criteria for Examination of Creative Works and Evidence of Achievement Submitted for Teacher Accreditation Reviews (Attachment 3) of Regulations Governing Accreditation of Teacher Qualifications at Junior Colleges and Institutions of Higher Education.

（五） 學術產學研究績效、教學績效及服務績效依本學院教師升等審查 評分細則辦理 ( 另訂之 ) 。

(5) Academic & industry-academia research performance, teaching performance, and service performance shall be scored in accordance with Guidelines on the Detailed Implementation of Evaluation of Professorship Rank Promotion in the College of Liberal Arts .

（六） 本學院系 ( 所 ) 級及院級教師評審委員會 ( 以下簡稱教評會 ) 審議本 學院教師升等案，升等為教授或副教授者之學術研究成果外審成 績，除依本校規定至少有四位外審委員評等為「優良」以上外， 且外審成績總平均升等教授者需達 80 分以上或升等副教授者需 達 77 分以上，始達外審合格門檻。未達外審合格門檻者，視為 升等不通過。

(6) Department/institute faculty evaluation committees (hereinafter referred to as the 'DFEC') and the College Faculty Evaluation Committee (CFEC) shall review rank promotion cases. Applicants applying for professorship or associate professorship shall receive the 'Good' grade from at least four reviewers. Moreover, the passing threshold of external evaluation shall be 80 and 77 for professorship and associate professorship, respectively. Those not passing the external evaluation shall be deemed unsuccessful in their application for promotion.

（七） 前經教師資格審定不合格者，重新提出之學術研究成果曾作為代 表作送審時，其送審著作應增加或更換一件以上。

(7) When submitting the same representative work as the one used in a prior failed application, applicants shall add at least one new reference work as a replacement or supplement.

三、 各系（所）應於每學期正式上課一星期內，將通過系 ( 所 ) 級升等資格審 查之系 ( 所 ) 級教評會會議紀錄、審查資料、迴避名單與迴避理由，亦得

提供不利審查之學者專家名單，送院教評會，逾期不受理。

III. Individual departments/institutes shall submit cases that pass the qualification review along with the DFEC meeting minutes, relevant documentation, the recusal list of interested person with reasons, and the list of scholars who might deemed unfavorable in the evaluation if needed to the CFEC within the first week after the class starts in each semester. Late submissions shall not be accepted.

四、 各系（所）教評會下學期辦理 8 月 1 日及上學期辦理 2 月 1 日升等生效之升 等審查，除依據各系（所）教師升等審查要點外，應依本要點及本校教 師升等審查辦法由校進行外審。外審結果送回系（所）級教評會審查， 由系 ( 所 ) 級教評會召集人加註評語，連同審查成績、會議紀錄及各項表 件等申請資料，於本學院通知限期截止日前提送本學院第三次教評會辦 理院級審查。

IV. In order for faculty promotions to take effect on August 1 (Fall semester) or February 1 (Spring semester), the DFEC shall review rank promotion cases in accordance with its own Guidelines on the Evaluation of Professorship Rank Promotion , and the University shall submit the applicants' case to the external reviewers for evaluation according to the University's Regulations for the Evaluation of Rank Professorship Rank . The external evaluation result shall be returned back to the DFEC for the department level review; the DFEC shall then submit the cases passing its review, along with the chairperson's comments, the score of the review, the meeting minutes, and relevant documentation to the CFEC third meeting each semester before the deadline specified by the College.

五、 本學院教評會受理教師升等審查案時，其程序悉依本校教師升等審查辦 法及第四點規定辦理之。

V. The College shall review rank promotion cases in accordance with Article 4 of the University's Regulations for the Evaluation of Professorship Rank Promotion .

六、 本學院教評會開會審議升等案件時，得邀請有關人員列席說明。

VI. When the CFEC convenes to review rank promotion cases, relevant personnel may be invited to attend and provide explanations.

七、 本學院教評會審議升等案時，委員應親自出席，不得由他人代理。須有 委員三分之二以上出席，始得開會。

VII. At least two-thirds of the CFEC members shall attend to review rank promotion cases, with members attending in person and no proxies allowed.

八、 經本學院教評會升等審查通過之教師，由院級教評會召集人加註評語， 連同審查成績、會議紀錄及各項表件等申請資料及其升等著作，送本校 教評會進行校級審查。

VIII. Cases that pass the college level review shall be submitted along with the score of the review, the CFEC meeting minutes, relevant documentation, the applicant's publications, and the chairperson's comments to the University Faculty Evaluation Committee (UFEC) for the university review.

九、 本學院教師升等案，經系 ( 所 ) 級或院級教師評審委員會審查時，發現外 審意見有疑義者，得依本校教師升等審查辦法提出行政救濟。

IX. Administrative remedies may be sought in accordance with the University's Regulations for the Evaluation of Professorship Rank Promotion when there are doubts regarding the result of external evaluation during the review by the DFEC or CFEC.

十、 經系 ( 所 ) 級或院級教評會審議不通過，申請升等教師如不服審議結果， 得依相關規定提出申訴或申復。申請升等教師於申復期間向本校申評會 提出申訴者，申復應立即停止。

X. Applicants not passing the review by the DFEC or CFEC and disagreeing with the evaluation result may file an appeal or grievance in accordance with relevant regulations. When the applicants directly appeal to the Faculty Appeal Handling Committee after filing a grievance against the DFEC or CFEC's decision, the process of the grievance shall be immediately terminated.

十一、 本要點若有未盡事宜，悉依本校教師升等審查辦法及專科以上教師資格 審定辦法等相關法規處理之。

XI. Matters not covered herein shall be handled in accordance with the University's Regulations for the Evaluation of Professorship Rank Promotion , Regulations Governing Accreditation of Teacher Qualifications at Junior Colleges and Institutions of Higher Education , and relevant regulations of the University.

十二、 本要點經本學院教評會、院務會議及校教評會通過，陳請校長同意後實 施；修正時亦同。

XII. These guidelines are approved by the CFEC, the College Council, the UFEC, and the President before implementation. Amendments to these guidelines shall follow the same procedure.",202509110535500716.md,202509142203130723.md,"['faculty evaluation committee', 'Faculty Evaluation Committee']",文學院↔文學院,faculty evaluation committee↔Faculty Evaluation Committee,5.0,4.76,5.0,5.0,5.0,2.0,5.0
國立中山大學管理學院司選委員會與國立中山大學企業管理學系招生委員會的組織成員及職責有何不同？請詳細說明兩者的組成方式、任期及主要職責。,國立中山大學管理學院司選委員會的成員由本院各建制單位助理教授以上之專任教師一名組成，任期一年，召集人由成員互選一人擔任。其職責為研訂本院各項全院性選舉之實施辦法及督導本院各項全院性選舉事務之執行。國立中山大學企業管理學系招生委員會設置委員七人，成員由系主任召集大學部協調人、企管碩士班協調人、企管博士班協調人、醫管碩博士班協調人及系務會議推選二位企管系執行委員組成。其職掌為議定招生簡章及研商其他招生相關事宜，並依權責通過各項決議案，必要時送相關會議審議。,"['<1-hop>  [202108111634490995.md]\n\n國立中山大學管理學院司選委員會組織辦法\n\n6.21 七十七學年度第五次院務議通過\n\n一、 國立中山大學管理學院司選委員會（以下簡稱本委員會）之職責 為（一）研訂本院各項全院性選舉之實施辦法，（二）督導本院 各項全院性選舉事務之執行。\n\n二、 本委員會之成員由本院各建制單位助理教授以上之專任教師一 名組成之，任期一年。本委員會召集人由成員互選一人擔任之。\n\n三、 本辦法經本院院務會議通過後實，修正時亦同。', '<2-hop>  [202108271208051020.md]\n\n一、\n\n國立中山大學企業管理學系招生委員會設置要點\n\n98 學年第 4 次系務會議(98.12.17)訂定\n\n99.11.26100 學年度碩博士班招生委會第 2 次暨學士班招生委原會第3聯席會核備\n\n109 學年第 7 次系務會議(110.4.15) 修正通過\n\n111 學年度碩博士班暨學士班第1次招生委員會聯席會會議議(11008.17) 核備\n\n依據本校「招生規定」第二條設置「企業管理學系招生委員會」(以下簡稱本會)。\n\n二、 本會設置委員七人，成員由系主任召集大學部協調人、企管碩士班協調人、企管博士班\n\n協調人、醫管碩博士班協調人及系務會議推選二位「企管系執行委員」組成。\n\n三、\n\n本會之職掌為議定招生簡章及研商其他招生相關事宜。\n\n四、 本會依權責所通過之各項決議案，必要時應送相關會議審議。\n\n五、 本會每學期召開常會一至二次，必要時得召開臨時會議。\n\n六、 本會會議須有全體委員過半數之出席，方可開會，其決議需出席委員過半數之同意方可\n\n執行。\n\n七、 本要點提經系務會議通過，送請校招生委員會備查實施，修正時亦同。']",staff,Misspelled queries,long,"<1-hop>  [202108111634490995.md]

國立中山大學管理學院司選委員會組織辦法

6.21 七十七學年度第五次院務議通過

一、 國立中山大學管理學院司選委員會（以下簡稱本委員會）之職責 為（一）研訂本院各項全院性選舉之實施辦法，（二）督導本院 各項全院性選舉事務之執行。

二、 本委員會之成員由本院各建制單位助理教授以上之專任教師一 名組成之，任期一年。本委員會召集人由成員互選一人擔任之。

三、 本辦法經本院院務會議通過後實，修正時亦同。","<2-hop>  [202108271208051020.md]

一、

國立中山大學企業管理學系招生委員會設置要點

98 學年第 4 次系務會議(98.12.17)訂定

99.11.26100 學年度碩博士班招生委會第 2 次暨學士班招生委原會第3聯席會核備

109 學年第 7 次系務會議(110.4.15) 修正通過

111 學年度碩博士班暨學士班第1次招生委員會聯席會會議議(11008.17) 核備

依據本校「招生規定」第二條設置「企業管理學系招生委員會」(以下簡稱本會)。

二、 本會設置委員七人，成員由系主任召集大學部協調人、企管碩士班協調人、企管博士班

協調人、醫管碩博士班協調人及系務會議推選二位「企管系執行委員」組成。

三、

本會之職掌為議定招生簡章及研商其他招生相關事宜。

四、 本會依權責所通過之各項決議案，必要時應送相關會議審議。

五、 本會每學期召開常會一至二次，必要時得召開臨時會議。

六、 本會會議須有全體委員過半數之出席，方可開會，其決議需出席委員過半數之同意方可

執行。

七、 本要點提經系務會議通過，送請校招生委員會備查實施，修正時亦同。",202108111634490995.md,202108271208051020.md,"['國立中山大學管理學院司選委員會', '國立中山大學企業管理學系招生委員會']",管理學院↔管理學院,國立中山大學管理學院司選委員會↔國立中山大學企業管理學系招生委員會,5.0,5.0,4.5,5.0,5.0,2.0,5.0
根據國立中山大學管理學院院務會議組織章則與企業管理學系系務會議組織章程，系主任與專任教師代表在院務會議與系務會議中各自扮演什麼角色？他們的產生方式及會議召開規則是如何規定的？,根據國立中山大學管理學院院務會議組織章則，院務會議委員分為當然委員與專任教師代表兩種。當然委員包括院長、副院長、各研究所所長、各學系系主任；專任教師代表由本院當然委員以外之專任教師計十五名組成，且由未兼任本院單位主管之專任教師互選產生，任期一年，其中各學系至少二名。若專任教師代表於學年中擔任本院單位主管或離職，其代表職權由候補代表遞補。系主任則是系務會議的召集與主持者，根據企業管理學系系務會議組織章程，系務會議由本系專任教師組成，系主任每月召開並主持會議，若系主任無法主持，則由出席教師推選臨時主席主持。會議需有教師二分之一以上出席，議案須經出席教師二分之一以上同意通過。系主任在院務會議中為當然委員，並在系務會議中負責召開與主持會議，專任教師代表則由未兼任主管的專任教師互選產生，代表本院專任教師參與院務會議。,"['<1-hop>  [201909101401070572.md]\n\n國立中山大學管理學院院務會議組織章則\n\n七十七學年度第五次院務會議通過 86.12.17 八十六學年度第一次院務會議修正通過 93.1.6 九十二學年度第三次院務會議修正通過 97.1.9 九十六學年度第二次院務會議修正通過 97.06.23 校長核備通\n\n一、本組織章則依大學法第三十六條與本校組織規程第四十二條之規 定訂定之。\n\n二、本院院務會議委員分為當然委員與專任教師代表兩種。當然委員 包括院長、副院長、各研究所所長、各學繫系主任；專任教師代 表由本院當然委員以外之專任教師計十五名組成之。\n\n三、院務會議專任教師代表由未兼任本院單位主管之專任教師互選產 生，任期一年，其中各學系至少二名，各研究所至少一名。\n\n四、各系所代表人數(包括單位主管與專任教師代表，但不包括院長、 副院長)最多不得超過十名。\n\n五、院務會議專任教師代表若於學年當中擔任本院單位主管或離職 者，其代表職權由候補代表遞補之。候補代表名單於正代表選舉 時同時產生。\n\n六、本章則經院務會議通過並陳請校長核備後實施之，修正時亦同。', '<2-hop>  [202107091407060828.md]\n\n第四條\n\n國立中山大學企業管理學系\n\n系務會議組織章程\n\n89.9.28 八十九學年度第一次系務會議通過\n\n第一條 本章程依大學法第十六條與本校組織章程第四十一條之規定訂\n\n定之。\n\n第二條 本會議由本系專任教師組成。\n\n第三條 本會議由系主任召開並主持，以每個月開會一次為原則；亦得由 全體教師三分之一以上之連署要求召開。系主任應於開會要求成 立後二星期內召開會議。系主任無法主持會議時，由出席教師推\n\n選臨時主席主持之。\n\n開會時應有教師二分之一以上出席。議案須經出席教師二分之一 以上同意，始得通過；若未能出席者可出具委託書委託其他教師 代理。\n\n第五條 本會開會時，得邀請相關人員列席。\n\n第六條 本章程經系務會議通過後實施，修正時亦同。']",teacher,Poor grammar,long,"<1-hop>  [201909101401070572.md]

國立中山大學管理學院院務會議組織章則

七十七學年度第五次院務會議通過 86.12.17 八十六學年度第一次院務會議修正通過 93.1.6 九十二學年度第三次院務會議修正通過 97.1.9 九十六學年度第二次院務會議修正通過 97.06.23 校長核備通

一、本組織章則依大學法第三十六條與本校組織規程第四十二條之規 定訂定之。

二、本院院務會議委員分為當然委員與專任教師代表兩種。當然委員 包括院長、副院長、各研究所所長、各學繫系主任；專任教師代 表由本院當然委員以外之專任教師計十五名組成之。

三、院務會議專任教師代表由未兼任本院單位主管之專任教師互選產 生，任期一年，其中各學系至少二名，各研究所至少一名。

四、各系所代表人數(包括單位主管與專任教師代表，但不包括院長、 副院長)最多不得超過十名。

五、院務會議專任教師代表若於學年當中擔任本院單位主管或離職 者，其代表職權由候補代表遞補之。候補代表名單於正代表選舉 時同時產生。

六、本章則經院務會議通過並陳請校長核備後實施之，修正時亦同。","<2-hop>  [202107091407060828.md]

第四條

國立中山大學企業管理學系

系務會議組織章程

89.9.28 八十九學年度第一次系務會議通過

第一條 本章程依大學法第十六條與本校組織章程第四十一條之規定訂

定之。

第二條 本會議由本系專任教師組成。

第三條 本會議由系主任召開並主持，以每個月開會一次為原則；亦得由 全體教師三分之一以上之連署要求召開。系主任應於開會要求成 立後二星期內召開會議。系主任無法主持會議時，由出席教師推

選臨時主席主持之。

開會時應有教師二分之一以上出席。議案須經出席教師二分之一 以上同意，始得通過；若未能出席者可出具委託書委託其他教師 代理。

第五條 本會開會時，得邀請相關人員列席。

第六條 本章程經系務會議通過後實施，修正時亦同。",201909101401070572.md,202107091407060828.md,"['系主任', '專任教師', '學系主任', '專任教師代表']",管理學院↔管理學院,專任教師代表↔專任教師 | 學系主任↔系主任,5.0,3.65,5.0,5.0,5.0,2.0,5.0
國立中山大學中國文學系的導師制度實施細則中，導師的聘用方式及職責是如何規定的？此外，系課程委員會的組成與職責又是什麼？,根據國立中山大學中國文學系導師制度實施細則，導師的聘用方式包括：大一學生由系上安排導師，大二至大四學生由學生選擇本系教師為導師，每位導師每學年最多輔導30名學生；研究生由學生自由選擇導師，原則上由論文指導教授擔任，未選指導教授者由系上安排；本系亦可商請本校共同科教師或具有輔導知能的師母、職員等擔任一般導師人選；導師因特殊原因無法執行職責時，由系主任導師另聘適當人選。導師的職責包括：充分了解學生的性向、興趣、特長、學習態度及家庭環境；輔導學生註冊選課及參加課外活動，協助解決課業、生活、人際及心理適應問題；利用時間參加導生的各種活動並予以指導；每學期與導生個別談話兩次以上並記錄要點；完成學生操行成績考評並登錄至學生綜合資訊平台；出席個案會議及導師會議；對學生優良事蹟或嚴重過失簽請獎懲；指導學生完成導生活動申請及成果表；參加導師輔導知能研習活動；維護學生權益等。至於系課程委員會的組成，由本系專任教師5名、學生代表1至2人、校外專家學者(含業界代表)1至2人組成，系主任為當然委員兼召集人。其職責包括：定期檢討修正系所課程、課程結構與發展方向，納入業界、畢業校友及學生（或家長）意見；初審入學新生必修科目表相關事宜；初審新開課程的課程名稱、內容、大綱及相關因素；審議課程相關問題；考量教師專長及教學負擔，規劃安排每學年度課程授課教師；研議課程改善機制並提議系務會議討論；相關決議須經系務會議通過後送院課程委員會審議。,"['<1-hop>  [202005141625120295.md]\n\n國立中山大學中國文學系「課程委員會設置要點」\n\n98.12.09 98 學年度第 3 次系務會議訂定 99.01.15 98 學年度第 3 次院課程委員會議通過 99.03.24 98 學年度第 5 次系務會議修訂通過 99.05.06 98 學年度第 6 次院課程委員會議修訂通過 99.05.31 984 校課程委員會議通過 99.06.15 第 124 次教務會議通過\n\n105.11.30 105 學年度第 3 次系務會議修訂通過\n\n第一條 依據本校課程委員會設置要點第三條之規定，訂定本要點。\n\n第二條 本系課程委員會（以下簡稱「系課程會」），由本系專任教 師5名、學生代表1 至2 人、校外專家學者(含業界代表)1 至2 人組成(系主任為當然委員兼召集人)。\n\n第三條 系課程會之職責：\n\n一、定期檢討修正系所課程、課程結構與發展方向（納入業界、 畢業校友及學生（或家長）之意見） 。\n\n二、初審入學新生必修科目表相關之事宜。\n\n三、初審新開課程下列項目：\n\n．課程名稱（中、英文） 、課程內容、課程大綱。\n\n．考量其他相關因素，如新開設課程與教師專長之配合、與 系所發展方向之配合、與現有課程之關連等。\n\n四、課程相關問題之審議。\n\n五、考量教師專長及平衡研究、教學之負擔，規劃及安排每學年 度課程授課教師。\n\n六、研議系所課程相關改善機制，作成議案提系務會議討論。\n\n七、相關決議須經系務會議通過後方可送院課程委員會審議。\n\n第四條 本要點經系務會議通過，並送院、校課程委員會及教務會議核備 後實施，其修正時亦同。', '<2-hop>  [201909051454270360.md]\n\n國立中山大學中國文學系導師制度實施細則\n\n90.05.09 八十九學年度中國文學系第六次系務會議通過 99.03.24 九十八學年度中國文學系第五次系務會議修訂通過\n\n第一條 本細則依據「國立中山大學導師制度實施辦法」第十三條之規定，訂定 本細則。\n\n第二條 本系導師編制：\n\n一、系主任導師。\n\n二、導師。\n\n第三條 導師之聘用方式如下：\n\n一、大一由繫上安排，大二、三、四學生由學生選擇本系教師為該學 年度之導師，每位導師每學年至多輔導30名學生為原則。\n\n二、研究生亦由學生自由選擇導師，原則上由論文指導教授擔任導師； 學生尚未選指導教授者由繫上安排導師人選。\n\n三、本系得依實際需要商請本校共同科教師或具有輔導知能之師母、 職員等擔任一般導師人選，供學生選擇。\n\n四、導師因特殊原因未能按本辦法執行導師職責時，由系所主任導師 另聘適當人選擔任之。\n\n第四條 每位導師輔導學生之固定時間為每週導師時間，並列入課程表公告實施。 第五條 系主任導師之職責如下：\n\n一、協調導師輔導工作之實施，檢討並改進院、系、所導師之工作。\n\n二、出席本校召開之導師會議及輔導工作之相關研習會。 第六條 導師之職責如下：\n\n一、導師對於學生之性向、興趣、特長、學習態度及家庭環境等，應 有充分之瞭解。\n\n二、輔導學生註冊選課及參加課外活動，協助學生解決有關課業、生 活、人際及心理等適應問題。\n\n三、除「導師時間」外，導師宜利用時間參加導生之旅行、露營、參 觀、訪問、野餐、交誼、討論、座談、社會服務等活動，並隨機 予以指導。\n\n四、導師每學期應與導生個別談話兩次以上，並將要點記載於「學生 綜合資訊平臺」。學生發生重大問題，應立即依據「諮商輔導組 危機個案與導師合作處理流程」會同學務處安排個案處理。\n\n五、應於每學期學期考試前，依規定完成學生操行成績考評並登錄至 「學生綜合資訊平臺」。\n\n六、出席所屬導生之個案會議及各項導師會議。\n\n七、導師對學生之優良事蹟或嚴重過失，可簽請學務處獎懲。\n\n八、導師於辦理導生活動前後應指導學生完成「導生活動申請表」及 「導生活動成果表」，並送學務處諮商輔導組彙辦。\n\n九、導師應參加教育部或本校辦理之導師輔導知能研習活動，以增加 輔導專業智能。\n\n十、為維護學生權益之其他交辦事項。\n\n第七條 每學年由本系學生票選本系優良導師，薦選至文學院優良導師甄選委員 會議，依本校「優良導師獎勵辦法」予以獎勵。\n\n第八條 本細則經系務會議通過，並送學務處核備後實施，其修正時亦同。']",teacher,Misspelled queries,short,"<1-hop>  [202005141625120295.md]

國立中山大學中國文學系「課程委員會設置要點」

98.12.09 98 學年度第 3 次系務會議訂定 99.01.15 98 學年度第 3 次院課程委員會議通過 99.03.24 98 學年度第 5 次系務會議修訂通過 99.05.06 98 學年度第 6 次院課程委員會議修訂通過 99.05.31 984 校課程委員會議通過 99.06.15 第 124 次教務會議通過

105.11.30 105 學年度第 3 次系務會議修訂通過

第一條 依據本校課程委員會設置要點第三條之規定，訂定本要點。

第二條 本系課程委員會（以下簡稱「系課程會」），由本系專任教 師5名、學生代表1 至2 人、校外專家學者(含業界代表)1 至2 人組成(系主任為當然委員兼召集人)。

第三條 系課程會之職責：

一、定期檢討修正系所課程、課程結構與發展方向（納入業界、 畢業校友及學生（或家長）之意見） 。

二、初審入學新生必修科目表相關之事宜。

三、初審新開課程下列項目：

．課程名稱（中、英文） 、課程內容、課程大綱。

．考量其他相關因素，如新開設課程與教師專長之配合、與 系所發展方向之配合、與現有課程之關連等。

四、課程相關問題之審議。

五、考量教師專長及平衡研究、教學之負擔，規劃及安排每學年 度課程授課教師。

六、研議系所課程相關改善機制，作成議案提系務會議討論。

七、相關決議須經系務會議通過後方可送院課程委員會審議。

第四條 本要點經系務會議通過，並送院、校課程委員會及教務會議核備 後實施，其修正時亦同。","<2-hop>  [201909051454270360.md]

國立中山大學中國文學系導師制度實施細則

90.05.09 八十九學年度中國文學系第六次系務會議通過 99.03.24 九十八學年度中國文學系第五次系務會議修訂通過

第一條 本細則依據「國立中山大學導師制度實施辦法」第十三條之規定，訂定 本細則。

第二條 本系導師編制：

一、系主任導師。

二、導師。

第三條 導師之聘用方式如下：

一、大一由繫上安排，大二、三、四學生由學生選擇本系教師為該學 年度之導師，每位導師每學年至多輔導30名學生為原則。

二、研究生亦由學生自由選擇導師，原則上由論文指導教授擔任導師； 學生尚未選指導教授者由繫上安排導師人選。

三、本系得依實際需要商請本校共同科教師或具有輔導知能之師母、 職員等擔任一般導師人選，供學生選擇。

四、導師因特殊原因未能按本辦法執行導師職責時，由系所主任導師 另聘適當人選擔任之。

第四條 每位導師輔導學生之固定時間為每週導師時間，並列入課程表公告實施。 第五條 系主任導師之職責如下：

一、協調導師輔導工作之實施，檢討並改進院、系、所導師之工作。

二、出席本校召開之導師會議及輔導工作之相關研習會。 第六條 導師之職責如下：

一、導師對於學生之性向、興趣、特長、學習態度及家庭環境等，應 有充分之瞭解。

二、輔導學生註冊選課及參加課外活動，協助學生解決有關課業、生 活、人際及心理等適應問題。

三、除「導師時間」外，導師宜利用時間參加導生之旅行、露營、參 觀、訪問、野餐、交誼、討論、座談、社會服務等活動，並隨機 予以指導。

四、導師每學期應與導生個別談話兩次以上，並將要點記載於「學生 綜合資訊平臺」。學生發生重大問題，應立即依據「諮商輔導組 危機個案與導師合作處理流程」會同學務處安排個案處理。

五、應於每學期學期考試前，依規定完成學生操行成績考評並登錄至 「學生綜合資訊平臺」。

六、出席所屬導生之個案會議及各項導師會議。

七、導師對學生之優良事蹟或嚴重過失，可簽請學務處獎懲。

八、導師於辦理導生活動前後應指導學生完成「導生活動申請表」及 「導生活動成果表」，並送學務處諮商輔導組彙辦。

九、導師應參加教育部或本校辦理之導師輔導知能研習活動，以增加 輔導專業智能。

十、為維護學生權益之其他交辦事項。

第七條 每學年由本系學生票選本系優良導師，薦選至文學院優良導師甄選委員 會議，依本校「優良導師獎勵辦法」予以獎勵。

第八條 本細則經系務會議通過，並送學務處核備後實施，其修正時亦同。",202005141625120295.md,201909051454270360.md,"['國立中山大學中國文學系導師制度實施細則', '國立中山大學中國文學系']",文學院↔文學院 | 中國文學系↔中國文學系,國立中山大學中國文學系↔國立中山大學中國文學系導師制度實施細則,5.0,5.0,5.0,5.0,5.0,2.0,5.0
根據學生事務處組長會議的決議，國立中山大學如何規定學生運動代表隊的住宿申請作業要點及運動績優升學輔導入學生的課業輔導辦法？這些規定是如何通過及修訂的？,根據學生事務處組長會議的決議，國立中山大學訂定了學生運動代表隊住宿申請作業要點，該要點於100學年度第1學期學務處第8次組長會議修正通過，並於106學年度第1學期第1次學生事務處組長會議修正通過，內容包括獎勵有功運動代表隊隊員住宿免抽籤的條件、住宿人數依項目人數訂定、不得轉讓床位、由體育發展組統計人數並提出名單，以及寒暑訓申請及住宿費減免的規定。另一方面，運動績優升學輔導入學生的課業輔導辦法於91學年度第1次行政會議通過，並於94學年度學生事務處組長會議修訂通過，後續多次於學生事務處組長會議及行政會議修訂通過，最新修訂於111學年度第1學期學生事務處組長會議通過。該辦法規定運動績優升學輔導入學生可申請課業輔導補助，補助費用依預算及申請人數核給，輔導費每小時500元，補助以六學期為限，每學期不超過兩門課，並由學生事務處體育發展組遴聘適任學生輔導課業。這些規定均經學生事務處組長會議討論，提送行政會議通過，並簽請校長核定後實施，修正時亦同。,"['<1-hop>  [202211300840390548.md]\n\n國立中山大學學生運動代表隊住宿申請作業要點\n\n100 年 11 月 09 日本校 100 學年度第 1 學期學務處第 8 次組長會議修正通過 101 年 01 月 02 日本校「學生宿舍管理執行委員會 100 年 12 月份常會」會議修正通過 106 年 9 月 7 日 106 學年度第 1 學期第 1 次本校學生事務處組長會議修正通過 106 年 10 月 17 日 106 學年度第 1 次本校宿舍管理執行委員會議修正通過 111 年 3 月 30 日 110 學年度第 2 學期第 4 次行政會議修正通過\n\n一、 本校為積極推展體育運動，獎勵有功運動代表隊（含一般生） ，為校（國）爭光，特訂 定「學生運動代表隊住宿申請作業要點」 。\n\n二、 學生運動代表隊隊員或團隊符合下條件者得提出免抽籤申請：\n\n( 一 ) 榮獲國光或中正體育獎章者，註冊期間提供住宿免抽籤（最多以四年為限） 。\n\n( 二 ) 榮獲全國運動會比賽前八名、全國大專校院運動會、大專單項錦標賽及大專校院運動聯 賽最優組前四名，提供下學年起兩年住宿免抽籤。\n\n( 三 ) 榮獲全國大專校院運動會、大專單項錦標賽及大專校院運動聯賽最優組第五～八名；一 般組前三名，提供下學年起一年住宿免抽籤。\n\n( 四 ) 團隊項目因項目不同，依照先發上場比賽人數訂定入住人數 ( 例如：籃球共五名隊員 ) ， 如遇上場人數有更換獲遞補情形，則由該教練擇優五名隊員入住名單。\n\n( 五 ) 獲選入住期間學生須為代表隊身分，依照本校住宿生規定辦理。\n\n( 六 ) 不得擅自轉讓床位予他人，如有發生以退宿處理。\n\n( 七 ) 由體育發展組依本要點統計人數，並於每年二月底前提出名單。\n\n三、學生寒、暑訓申請及住宿費減免：\n\n( 一 ) 申請作業：寒訓提送時間為每年 1 月 10 日前，暑訓提送時間為 6 月 10 日前，申請代表 隊將訓練時間、參加人員、集訓內容、減免證明文件等送教練簽名後送體育發展組審核 簽辦。\n\n( 二 ) 住宿費減免規定：\n\n1 、前一年參加全國大專校院運動會或大專校院運動聯賽成績優異，提出相關證明文件，可 提出寒、暑訓住宿費減免申請，減免規定如下：\n\n（ 1 ）全國大專校院運動會或大專校院運動聯賽最優級組團體免收費。\n\n（ 2 ）全國大專校院運動會個人或團體前四名、及大專校院運動聯賽前四名免收費。\n\n（ 3 ）全國大專校院運動會或大專校院運動聯賽項目進入決賽階段而未獲前四名，減半收費 2 、不符合前項減免規定者，依宿舍服務組所訂寒、暑假收費標準收費。\n\n四、 本要點經學生事務處組長會議討論後，提送宿舍管理執行委員會議通過，簽請校長核定 後實施，修正時亦同。', '<2-hop>  [202302141202170065.md]\n\n國立中山大學運動績優升學輔導入學生課業輔導辦法\n\n91 年 09 月 27 日 91 學年度第 1 次行政會議通過\n\n94 年 11 月 03 日 94 學年度學生事務處組長會議修訂通過 96 年 05 月 16 日 95 學年度第 2 學期第 5 次行政會議修訂通過 101 年 11 月 28 日 101 學年度第 1 學期學生事務處第 6 次組長會議修訂通過 102 年 01 月 02 日 101 學年度第 1 學期第 3 次行政協調會報修訂通過 102 年 01 月 09 日 101 學年度第 1 學期第 10 次行政會議修訂通過 106 年 9 月 7 日本校 106 學年度第 1 學期第 1 次學生事務處組長會議修正通過 106 年 9 月 27 日本校 106 學年度第 1 次行政協調會報修正通過 106 年 10 月 25 日本校 106 學年度第 1 學期第 4 次行政會議修正通過 111 年 3 月 30 日 110 學年度第 2 學期第 4 次行政會議修正通過 111 年 9 月 7 日 111 學年度第 1 學期第 1 次學務處組長會議修正通過 111 年 10 月 12 日 111 學年度第 1 學期第 2 次協調會報修正通過 111 年 11 月 2 日 111 學年度第 1 學期第 5 次行政會議修正通過\n\n第一條 為鼓勵並輔導本校招收之『運動績優升學輔導入學生』 ，提昇其學業水 平，達到本校課業要求，得以順利完成學位，特訂定本辦法。\n\n第二條 凡本校招收之『運動績優升學輔導入學生』皆可申請接受補助。\n\n第三條 獎助原則：\n\n一、每位學生每學年課業輔導費依據預算編列及申請人數、學門數核給，輔 導費每小時 500 元。學生申請課輔科目須為該學系或學程必修科目（不 含必修實習課） 。補助以六學期為限，每學期以不超過兩門課為原則， 若有特殊狀況時，學生事務處體育發展組得另案增加補助年限與科目。 二、接受補助之同學，由學生事務處體育發展組遴聘適任之學生輔導其課 業。\n\n三、有需要課輔之同學應於每學期開學二週內提出申請，學生事務處體育發 展組於開學後一個月內公告符合資格之同學名單。\n\n第四條 本辦法經學生事務處組長會議討論，提行政會議討論通過，並簽請校長 核定後實施，修正時亦同。']",staff,Misspelled queries,long,"<1-hop>  [202211300840390548.md]

國立中山大學學生運動代表隊住宿申請作業要點

100 年 11 月 09 日本校 100 學年度第 1 學期學務處第 8 次組長會議修正通過 101 年 01 月 02 日本校「學生宿舍管理執行委員會 100 年 12 月份常會」會議修正通過 106 年 9 月 7 日 106 學年度第 1 學期第 1 次本校學生事務處組長會議修正通過 106 年 10 月 17 日 106 學年度第 1 次本校宿舍管理執行委員會議修正通過 111 年 3 月 30 日 110 學年度第 2 學期第 4 次行政會議修正通過

一、 本校為積極推展體育運動，獎勵有功運動代表隊（含一般生） ，為校（國）爭光，特訂 定「學生運動代表隊住宿申請作業要點」 。

二、 學生運動代表隊隊員或團隊符合下條件者得提出免抽籤申請：

( 一 ) 榮獲國光或中正體育獎章者，註冊期間提供住宿免抽籤（最多以四年為限） 。

( 二 ) 榮獲全國運動會比賽前八名、全國大專校院運動會、大專單項錦標賽及大專校院運動聯 賽最優組前四名，提供下學年起兩年住宿免抽籤。

( 三 ) 榮獲全國大專校院運動會、大專單項錦標賽及大專校院運動聯賽最優組第五～八名；一 般組前三名，提供下學年起一年住宿免抽籤。

( 四 ) 團隊項目因項目不同，依照先發上場比賽人數訂定入住人數 ( 例如：籃球共五名隊員 ) ， 如遇上場人數有更換獲遞補情形，則由該教練擇優五名隊員入住名單。

( 五 ) 獲選入住期間學生須為代表隊身分，依照本校住宿生規定辦理。

( 六 ) 不得擅自轉讓床位予他人，如有發生以退宿處理。

( 七 ) 由體育發展組依本要點統計人數，並於每年二月底前提出名單。

三、學生寒、暑訓申請及住宿費減免：

( 一 ) 申請作業：寒訓提送時間為每年 1 月 10 日前，暑訓提送時間為 6 月 10 日前，申請代表 隊將訓練時間、參加人員、集訓內容、減免證明文件等送教練簽名後送體育發展組審核 簽辦。

( 二 ) 住宿費減免規定：

1 、前一年參加全國大專校院運動會或大專校院運動聯賽成績優異，提出相關證明文件，可 提出寒、暑訓住宿費減免申請，減免規定如下：

（ 1 ）全國大專校院運動會或大專校院運動聯賽最優級組團體免收費。

（ 2 ）全國大專校院運動會個人或團體前四名、及大專校院運動聯賽前四名免收費。

（ 3 ）全國大專校院運動會或大專校院運動聯賽項目進入決賽階段而未獲前四名，減半收費 2 、不符合前項減免規定者，依宿舍服務組所訂寒、暑假收費標準收費。

四、 本要點經學生事務處組長會議討論後，提送宿舍管理執行委員會議通過，簽請校長核定 後實施，修正時亦同。","<2-hop>  [202302141202170065.md]

國立中山大學運動績優升學輔導入學生課業輔導辦法

91 年 09 月 27 日 91 學年度第 1 次行政會議通過

94 年 11 月 03 日 94 學年度學生事務處組長會議修訂通過 96 年 05 月 16 日 95 學年度第 2 學期第 5 次行政會議修訂通過 101 年 11 月 28 日 101 學年度第 1 學期學生事務處第 6 次組長會議修訂通過 102 年 01 月 02 日 101 學年度第 1 學期第 3 次行政協調會報修訂通過 102 年 01 月 09 日 101 學年度第 1 學期第 10 次行政會議修訂通過 106 年 9 月 7 日本校 106 學年度第 1 學期第 1 次學生事務處組長會議修正通過 106 年 9 月 27 日本校 106 學年度第 1 次行政協調會報修正通過 106 年 10 月 25 日本校 106 學年度第 1 學期第 4 次行政會議修正通過 111 年 3 月 30 日 110 學年度第 2 學期第 4 次行政會議修正通過 111 年 9 月 7 日 111 學年度第 1 學期第 1 次學務處組長會議修正通過 111 年 10 月 12 日 111 學年度第 1 學期第 2 次協調會報修正通過 111 年 11 月 2 日 111 學年度第 1 學期第 5 次行政會議修正通過

第一條 為鼓勵並輔導本校招收之『運動績優升學輔導入學生』 ，提昇其學業水 平，達到本校課業要求，得以順利完成學位，特訂定本辦法。

第二條 凡本校招收之『運動績優升學輔導入學生』皆可申請接受補助。

第三條 獎助原則：

一、每位學生每學年課業輔導費依據預算編列及申請人數、學門數核給，輔 導費每小時 500 元。學生申請課輔科目須為該學系或學程必修科目（不 含必修實習課） 。補助以六學期為限，每學期以不超過兩門課為原則， 若有特殊狀況時，學生事務處體育發展組得另案增加補助年限與科目。 二、接受補助之同學，由學生事務處體育發展組遴聘適任之學生輔導其課 業。

三、有需要課輔之同學應於每學期開學二週內提出申請，學生事務處體育發 展組於開學後一個月內公告符合資格之同學名單。

第四條 本辦法經學生事務處組長會議討論，提行政會議討論通過，並簽請校長 核定後實施，修正時亦同。",202211300840390548.md,202302141202170065.md,['學生事務處組長會議'],學生事務處↔學生事務處,學生事務處組長會議↔學生事務處組長會議,5.0,2.0,5.0,5.0,5.0,2.0,5.0
請問國立中山大學管理學院教師評審委員會與經費稽核委員會的設置宗旨及其委員組成和會議召開規定有何不同？,國立中山大學管理學院教師評審委員會的設置宗旨是審議本院教師之聘任、聘期、升等、停聘、解聘、不續聘、延長服務、借調、出國講學、研究、進修、教授及副教授休假研究、年資加薪、教師資遣原因之認定及其他依法令應行審議之事項。其委員包括當然委員（院長及各系所主管）、專任教授代表及校教評會委員保障名額，主任委員由院長兼任。會議不定期舉行，審議事項依教育部及本校相關法令辦理，並有明確的出席及表決比例規定。另一方面，管理學院經費稽核委員會的設置宗旨是代表全院教師明瞭院內經費運用情形，對審計會計職掌不得抵觸。委員七人，由院務會議代表互推產生（院屬各單位行政主管除外），獨立所保障名額一名，任期兩年，每學年改選一半，主任委員由委員互推產生。會議至少每學期最後一次院務會議前召開一次，必要時召集臨時會議，決議需簽報院長核定並提報院務會議。兩委員會在設置宗旨、委員組成及會議召開頻率與程序上均有明顯差異。,"['<1-hop>  [202302080949360049.md]\n\n國立中山大學管理學院教師評審委員會設置要點\n\n85.3.20 本校管理學院 84 學年度第 4 次教評會修正通過 93.1.6 本校管理學院 94 學年度第 3 次院務會議通過 94.10.25 本校管理學院 94 學年度第 1 次院務會議修正通過 95.01.05 本校管理學院 94 學年度第 299 次校教評會修正通過 96.4.18 本校管理學院 95 學年度第 5 次院教評會修正通過 96.5.11 本校管理學院 95 學年度第 308 次校教評會議修正通過 97.11.25 本校管理學院 97 學年度第 3 次院教評會修正通過 97.12.9 本校管理學院 97 學年度第 2 次院務會議修正通過 100.9.13 本校管理學院 100 學年度第 1 次院教評會修正通過 100.9.20 本校管理學院 100 學年度第 1 次院務會議修正通過 100.11.17 本校第 337 次校教師評審委員會修正通過 111.11.29 本校管理學院111學年度第2次院務會議修正通過 111.12.29 本校第420次校教師評審委員會修正通過\n\n一、 為審議有關本院教師之聘任、聘期、升等、停聘、解聘、不續聘、延長服務、借調、出國 講學、研究、進修、教授及副教授休假研究、年資加薪、教師資遣原因之認定及其他依法 令應行審議之事項，依本校教師評審委員會設置辦法設置管理學院教師評審委員會(以下簡 稱本會)。\n\n二、 本會委員包括當然委員、專任教授代表，以及校教評會委員保障名額等。 當然委員包括院長及各系所主管；專任教授代表由當然委員以外之專任教授組成；校教評 會委員保障名額為當年度續任校教評會委員之教師。其中專任教授代表以及校教評會委員 保障名額合計為當然委員人數多一名，任期一年與學年同，連選得連任。\n\n三、 本會置主任委員一人，由院長兼任。\n\n四、 本院依第一條規定應審議之事項，均須先經由系所教評會通過後提本會審議。\n\n五、本會審議事項依據教育部頒訂暨本校訂定相關法令規定辦理。\n\n六、本會會議不定期舉行，開會時討論案議決，依下列人數比例辦理：\n\n（一）審議教師停聘、解聘、不續聘案件依教師法規定之出席及審議通 過比例辦理。\n\n（二）審議教師聘任案件應有全體委員二分之一以上出席，並經出席 委員三分之二以上同 意，始得通過。\n\n（三）審議教師升等案件應有全體委員三分之二以上出席，擬升等教師應符合本校(含系、 院)升等相關條件規定，始得通過。\n\n（四）前三款以外之議案，除法規另有規定外，應經全體委員二分之一 以上出席及出席委 員二分之一以上之審議通過。\n\n當然委員有正當理由，無法出席，得由法定職務代理人代理出席。\n\n七、 為保障教師權益，本會於審議第一條規定事項時，如以投票方式表決，其為空白票、廢票 及棄權票以不同意票處理。\n\n八、 本會委員對於評審案件涉及本人、配偶、三親等之血親、姻親、有個人利害關係者，或於 審議教師聘任、升等、延長服務等資格審查案件時，不得低階高審，應自行迴避，不得參 與評審。\n\n有具體事實足認本會委員對於評審案件有偏頗之虞者，申請人得向本會申請該委員迴避， 並應舉其原因事實。委員中有前述應行迴避之情事者，不計入出席委員人數。\n\n九、 本會開會時，得邀請有關人員列席說明。\n\n十、 本要點經本會及院務會議通過，提校教評會審議通過，陳請校長核定後實施，修正時亦同。', '<2-hop>  [202108111650200996.md]\n\n國立中山大學管理學院經費稽核委員會設置要點\n\n86.12.17 86 學年度第 1 次院務會議通過 90.6.20 89 學年度第 4 次院務會議修正通過 91.6.18 90 學年度第 4 次院務會議修正通過 93.6.15 92 學年度第 5 次院務會議修正通過\n\n107.11.27 107 學年度第 2 次院務會議修正通過\n\n第一條 本院經費稽核委員會(以下簡稱本委員會)置委員七人，由選舉產 生之院務會議代表互推產生(院屬各單位行政主管除外)，其中獨 立所(學程)保障名額一名。委員任期兩年，每學年改選一半。本 委員會置主任委員一人，由委員互推之。\n\n第二條 本委員會之設置，以代表全院教師明瞭院內經費運用情形為原 則，對於審計會計職掌不得抵觸，其職責規定如下：\n\n１、針對各項業務預算執行結果進行查核。\n\n２、根據查核情形給予建議。\n\n第三條 本委員會開會時，得知會主管後通知院內承辦相關業務人員列席 報告說明。\n\n第四條 本委員會於每學期最後一次院務會議前至少應召開會議乙次，必 要時得召集臨時會議。本委員會之各項決議，除簽報院長核定處 理外，並提報院務會議。\n\n第五條 本要點經院務會議通過後實施，修正時亦同。']",staff,Web search like queries,long,"<1-hop>  [202302080949360049.md]

國立中山大學管理學院教師評審委員會設置要點

85.3.20 本校管理學院 84 學年度第 4 次教評會修正通過 93.1.6 本校管理學院 94 學年度第 3 次院務會議通過 94.10.25 本校管理學院 94 學年度第 1 次院務會議修正通過 95.01.05 本校管理學院 94 學年度第 299 次校教評會修正通過 96.4.18 本校管理學院 95 學年度第 5 次院教評會修正通過 96.5.11 本校管理學院 95 學年度第 308 次校教評會議修正通過 97.11.25 本校管理學院 97 學年度第 3 次院教評會修正通過 97.12.9 本校管理學院 97 學年度第 2 次院務會議修正通過 100.9.13 本校管理學院 100 學年度第 1 次院教評會修正通過 100.9.20 本校管理學院 100 學年度第 1 次院務會議修正通過 100.11.17 本校第 337 次校教師評審委員會修正通過 111.11.29 本校管理學院111學年度第2次院務會議修正通過 111.12.29 本校第420次校教師評審委員會修正通過

一、 為審議有關本院教師之聘任、聘期、升等、停聘、解聘、不續聘、延長服務、借調、出國 講學、研究、進修、教授及副教授休假研究、年資加薪、教師資遣原因之認定及其他依法 令應行審議之事項，依本校教師評審委員會設置辦法設置管理學院教師評審委員會(以下簡 稱本會)。

二、 本會委員包括當然委員、專任教授代表，以及校教評會委員保障名額等。 當然委員包括院長及各系所主管；專任教授代表由當然委員以外之專任教授組成；校教評 會委員保障名額為當年度續任校教評會委員之教師。其中專任教授代表以及校教評會委員 保障名額合計為當然委員人數多一名，任期一年與學年同，連選得連任。

三、 本會置主任委員一人，由院長兼任。

四、 本院依第一條規定應審議之事項，均須先經由系所教評會通過後提本會審議。

五、本會審議事項依據教育部頒訂暨本校訂定相關法令規定辦理。

六、本會會議不定期舉行，開會時討論案議決，依下列人數比例辦理：

（一）審議教師停聘、解聘、不續聘案件依教師法規定之出席及審議通 過比例辦理。

（二）審議教師聘任案件應有全體委員二分之一以上出席，並經出席 委員三分之二以上同 意，始得通過。

（三）審議教師升等案件應有全體委員三分之二以上出席，擬升等教師應符合本校(含系、 院)升等相關條件規定，始得通過。

（四）前三款以外之議案，除法規另有規定外，應經全體委員二分之一 以上出席及出席委 員二分之一以上之審議通過。

當然委員有正當理由，無法出席，得由法定職務代理人代理出席。

七、 為保障教師權益，本會於審議第一條規定事項時，如以投票方式表決，其為空白票、廢票 及棄權票以不同意票處理。

八、 本會委員對於評審案件涉及本人、配偶、三親等之血親、姻親、有個人利害關係者，或於 審議教師聘任、升等、延長服務等資格審查案件時，不得低階高審，應自行迴避，不得參 與評審。

有具體事實足認本會委員對於評審案件有偏頗之虞者，申請人得向本會申請該委員迴避， 並應舉其原因事實。委員中有前述應行迴避之情事者，不計入出席委員人數。

九、 本會開會時，得邀請有關人員列席說明。

十、 本要點經本會及院務會議通過，提校教評會審議通過，陳請校長核定後實施，修正時亦同。","<2-hop>  [202108111650200996.md]

國立中山大學管理學院經費稽核委員會設置要點

86.12.17 86 學年度第 1 次院務會議通過 90.6.20 89 學年度第 4 次院務會議修正通過 91.6.18 90 學年度第 4 次院務會議修正通過 93.6.15 92 學年度第 5 次院務會議修正通過

107.11.27 107 學年度第 2 次院務會議修正通過

第一條 本院經費稽核委員會(以下簡稱本委員會)置委員七人，由選舉產 生之院務會議代表互推產生(院屬各單位行政主管除外)，其中獨 立所(學程)保障名額一名。委員任期兩年，每學年改選一半。本 委員會置主任委員一人，由委員互推之。

第二條 本委員會之設置，以代表全院教師明瞭院內經費運用情形為原 則，對於審計會計職掌不得抵觸，其職責規定如下：

１、針對各項業務預算執行結果進行查核。

２、根據查核情形給予建議。

第三條 本委員會開會時，得知會主管後通知院內承辦相關業務人員列席 報告說明。

第四條 本委員會於每學期最後一次院務會議前至少應召開會議乙次，必 要時得召集臨時會議。本委員會之各項決議，除簽報院長核定處 理外，並提報院務會議。

第五條 本要點經院務會議通過後實施，修正時亦同。",202302080949360049.md,202108111650200996.md,"['國立中山大學管理學院教師評審委員會', '國立中山大學管理學院經費稽核委員會']",管理學院↔管理學院,國立中山大學管理學院教師評審委員會↔國立中山大學管理學院經費稽核委員會,5.0,5.0,5.0,5.0,5.0,2.0,5.0
根據國立中山大學管理學院學生語文能力獎勵要點及國際經營管理碩士學位考試相關規定，學生在申請語文能力獎勵時需要符合哪些資格條件？此外，國際經營管理碩士學位考試對外語能力有何要求？,"根據國立中山大學管理學院學生語文能力獎勵要點，申請資格包括：一、本地生與非英語系國家之學位生，包括本院大學部及研究所一般學位生（不含在職生、專班生、交換生）及非英語系國家之外籍學位生與僑生、陸生，需於本校在學期間通過外國語文測驗；二、華語非母語之外籍學位生，包括本院大學部及研究所華語非母語之外籍學位生，需於本校在學期間通過華語文能力測驗。申請時需提交申請表、成績單正本及影印本、學生證影印本，外籍學位生還需繳交護照影本及外僑居留證影本。申請經承辦人驗證後，簽請院長核示予以補助。獎勵項目及金額為各測驗分數達到獎勵分數以上者，予以新臺幣5,000元獎勵金。根據國際經營管理碩士學位考試相關規定，外籍生須於學位考試申請前，提出通過TOCFL A2或HSK 2級檢核證明；若無法提出證明者，需修習臺灣任一所大學之華語中心二學期（含）以上（至少100小時）並提供修業證明，方符合畢業規定。","[""<1-hop>  [202509161524420744.md]\n\n國立中山大學管理學院學生語文能力獎勵要點\n\nCollege of Management Guidelines for Subsiding Student Language Proficiency\n\n93.04.15 本校管理學院 92 學年度第 6 次主管會議修正通過 Amended and approved by the 6 th Director's Council Meeting, April 15, 2004 95.09.26 本校管理學院 95 學年度第 4 次臨時主管會議修正通過 Amended and approved by the 7 th Interim College Affairs Council, September 26, 2005 105.03.23 本校管理學院 104 學年度第 11 次主管會議修正通過 Amended and approved by the 11 th Director's Council Meeting, March 23, 2016 107.12.26 本校管理學院 107 學年度第 5 次主管會議修正通過 Amended and approved by the 5 th Director's Council Meeting, December 26, 2018 112.02.15 本校管理學院 111 學年度第 7 次主管會議修正通過 Amended and approved by the 7 th Director's Council Meeting, February 15, 2023\n\n一、 宗旨：為強化本院學生之語文能力，促進國際競爭能力，特設此獎勵 要點，鼓勵學生參加語文測驗。\n\nI. Purpose\n\nThe Guidelines on Subsiding Student Language Proficiency (hereinafter as the 'Guideline') is put in place to encourage students to participate in language proficiency tests, following the college regulation to strengthen students' language proficiency and to promote international competitiveness.\n\n二、 申請資格\n\nII. Qualification\n\n( 一 ) 本地生與非英語系國家之學位生：\n\nDomestic degree students and non-native English-speaking degree students:\n\n本院大學部及研究所一般學位生 ( 不含在職生、專班生、交換生 ) 及 非英語系國家之外籍學位生與僑生、陸生。\n\n(1) Full-time undergraduate and graduate students (exclusion of inservice, part-time, and exchange student) and non-native Englishspeaking countries students, oversea Chinese students, and Chinese students.\n\n於本校在學期間通過外國語文測驗者。\n\n(2) Students who have passed the English proficiency exam during their study at the university\n\n( 二 ) 華語非母語之外籍學位生：\n\nNon-native Chinese-speaking international students:\n\n1.\n\n本院大學部及研究所華語非母語之外籍學位生。\n\nInternational non-native Chinese-speaking undergraduate and\n\n(1) graduate students.\n\n於本校在學期間通過華語文能力測驗者。\n\nStudents who have passed the Chinese proficiency exam during\n\n(2) their study at the university\n\n三、 申請文件\n\nIII. Application\n\n( 一 ) 「管理學院學生語文能力測驗獎勵申請表」 。\n\nLanguage Test Grant Application\n\n( 二 ) 成績單正本及影印本各乙份。 （正本於查驗後將退回）\n\nOne copy of official transcript and one copy of printed official transcript (the official transcript will return to the applicant upon review)\n\n( 三 ) 學生證影印本乙份 ( 需加蓋註冊章 )\n\n。\n\nOne copy of student identification card (stamped by the Office of Academic Affairs)\n\n( 四 ) 外籍學位生需繳交：護照影本 ( 若本年度在臺住滿 183 天，需附護 照內出入境章影本 ) 、外僑居留證影本。\n\nInternational degree students: one copy of passport (one copy of the departure/arrival stamps if stayed in Taiwan for more than 183 in the year) and one copy of ARC/APRC\n\n四、 審查程序：申請者檢具完整申請文件，經承辦人驗證後，簽請院長核 示予以補助。\n\nIV.\n\nApplication Review Process Application upon review by the contact person will be sent to the College Dean\n\nfor approval of subsidy.\n\n五、 獎勵項目及金額：各測驗分數達到獎勵分數以上者，予以新臺幣 5,000 元獎勵金。\n\nV. Subsidy Item and Awarding Amount\n\nApplicant will be awarded NTD$5,000 for meeting one of the following exam scores:\n\n獎勵項目 本地生與非英語系國家之學位生 華語文能力測 驗 (TOCFL) 新制託福 (iBT) 雅思 (IELTS) 學術 組 獎勵分數 100( 含 ) 以上 7.5( 含 ) 以上 Level 4 高階級\n\nSubsidy Item Domestic degree students and non- native TOCFL TOEFL iBT IELTS Academic Awarding score 100 or above 7.5 or above Level 4 Advanced\n\n六、 申請日期：\n\nVI. Application Time Period\n\n( 一 ) 上學期：每年十一月一日至十五日止。\n\nFirst Semester: November 1 st -November 15 th\n\n( 二 ) 下學期：每年五月一日至十五日止。\n\nSecond Semester: May 1 st - May 15 th\n\n七、 申請次數：每位學生在修讀每一學位學程期間僅可申請獎助以一次為 限。\n\nVII. Eligibility\n\nStudents may only apply for the subsidy once during each degree program\n\n八、 申請方式：於管理學院網站下載申請表格並檢附相關文件送管理學院 辦公室。\n\nVIII.\n\nHow to Apply\n\nDownload the application form from the website of the College and enclose supporting documents to submit to the College of Management Office\n\n九、 本要點經本院院務會議通過後實施，修正時亦同。\n\nIX.\n\nRegulation and Amendments\n\nThis Guideline, as well as its amendments, are effective upon approval by the College Affairs Council"", ""<2-hop>  [202106291430100475.md]\n\nNational Sun Yat-sen University\n\nRegulations Governing International Business MBA Degree Examination\n\n-Approved by the 2 nd College Affaires Meeting in Academic Year 2006-2007, January 17 th , 2007\n\n-Approved by the 4 th College Affaires Meeting in Academic Year 2013-2014, April 29 th , 2014\n\n-Approved by the 4 th College Affaires Meeting in Academic Year 2016-2017, May 9 th , 2016\n\n-Approved by the 2 nd College Affaires Meeting in Academic Year 2017-2018, December 5 th , 2017\n\n-Approved by the 4 th College Affaires Meeting in Academic Year 2019-2020, May 8 th , 2019\n\n-Approved by the 2 nd College Affaires Meeting in Academic Year 2019-2020, November 26 th , 2019\n\n-Approved by the 3 rd College Affaires Meeting in Academic Year 2019-2020, March 10 th , 2020\n\n-Approved by the 2 nd College Affaires Meeting in Academic Year 2020-2021, December 1 st , 2020\n\n-Approved by the President of NSYSU, December 14 th ,2020\n\n(For Students enrolled in academic year 2021)\n\nThis Regulations Governing International Business MBA Degree Examination (the Regulations) are enacted in accordance with 'Degree Conferral Law' and the Enforcement Rules thereof of Ministry of Education and 'Academic Regulations,' 'Implementation Bylaws for Ph. D. and Master Degree Examination' and 'Guidelines for Selection of Advisors' of National Sun Yat-sen University (NSYSU).\n\nMaximum year of study: 1 to 4 years in accordance with Ministry of Education regulations (excluding reserved admission and suspension duration).\n\nCredits and requirement for the course:\n\ni. Any course selected by the student must be approved by the Advisor or the International Business MBA (IBMBA) director (the Director).\n\nii. Before student applying for the degree examination, the student must complete all the regulated courses and have acquired more credits than the minimum graduation credits.\n\niii. Before applying for the thesis oral defense, the local students need to participate overseas exchange program: study abroad at the universities / institutes acknowledged by NSYSU, and acquire more than 6 credits from management related courses approved by IBMBA. Whereas foreign students do not need to participate overseas exchange program. However, those local students who have studied abroad in university or above for one or more semester, after approved by IBMBA, may not participate the overseas exchange program.\n\nThesis regulations and advisor selection:\n\ni. A thesis advisor must be an assistant professor or above, as well as qualified of being a master's examination committee member in accordance with the Degree Conferral Law.\n\nii. A thesis advisor should be selected within the College of Management. However, if the college lack related research area or suitable teacher, the student could select advisor from other department/college in NSYSU or experts or scholars outside of NSYSU, while arranging another College of Management faculty as co-advisor.\n\niii. The thesis advisor, after retiring or resigning from the university, may continue advising the student. However, the student must arrange another College of Management faculty as coadvisor.\n\niv. Before student applies for co-advisor from IBMBA, both advisors must approve the student's Thesis Proposal.\n\nIf the student need to change advisor, the student must acquire written consent from both original advisor and new advisor.\n\ni. Thesis and degree examination must be in English.\n\nMaster's Degree Examination:\n\ni. Regulations for Thesis Oral Defense:\n\na. Before taking the Master's Degree Examination, the student must meet the requirement for all courses, be approved by the thesis advisor and apply for the degree examination in due time according to NSYSU regulation.\n\nb. The member of Master's Degree Examination Committee should be assistant professor or higher. The committee is composed of 3 to 5 members. Members exclude the thesis advisor should account for more than 1/2 of all committee members.\n\nc. The thesis oral defense should be held during the 2 nd semester in the 2 nd year of IBMBA program.\n\nii. Other related regulations:\n\na. The students who fail the degree examination and haven't complete the year of study could take re-examination in the next semester or next academic year. The re-examination can only be taken once, and the student who fail the re-examination will be expelled according to NSYSU regulations.\n\nb. Language proficiency test: International students should reach Chinese proficiency, TOCFL score level 2 (A2) or New HSK score level 2.\n\nThe students who fail to pass TOCFL score level 2 (A2) or New HSK score level 2, may need to take the Chinese test at least once and provide at least 2 semesters or 100 hours Chinese course certificate from Chinese Learning Center which affiliated to universities in Taiwan or from Taipei Language Institute in order to exempt from the graduation requirements.\n\n(This language proficiency test can also be applied for students enrolled in (or before) academic year 2020)\n\nGraduation: Graduate students who meet the requirement of aforesaid regulations may apply for graduation, and receive degree from NSYSU.\n\nThe Regulations shall be implemented upon approval by the College Affaires Meeting, sign by the president of NSYSU and released, and the same shall apply as to amendment hereto.\n\nFor the avoidance of doubt in English version regulation, Chinese version will be prevailing.\n\n英文法規翻譯內容若有疑義 , 以中文法規為主\n\n國立中山大學管理學院\n\n國際經營管理碩士學程研究生學位考試相關規定\n\n96.1.17 九十五學年度第 2 次院務會議通過\n\n103.4.29 一 0 二學年度第 4 次院務會議通過\n\n106.5.9 一 0 五學年度第 4 次院務會議通過\n\n106.12.05 一 0 六學年度第 2 次院務會議通過\n\n106.12.28 經校長核定\n\n107.01.02 發布\n\n108.05.08 一 0 七學年度第 4 次院務會議通過\n\n108.05.28 經校長核定\n\n108.11.26 一 0 八學年度第 2 次院務會議通過\n\n108.12.20 經校長核定\n\n109.03.10 一 0 八學年度第 3 次院務會議通過\n\n109.04.10 經校長核定\n\n109.12.01 一 0 九學年度第 2 次院務會議通過\n\n109.12.14 經校長核定\n\n( 一一０學年度入學新生適用 )\n\n一、 依據教育部頒「學位授予法」 、本校「學則」 、 「研究生學位考試施行細則」 及「論文指導教授遴聘原則」訂定之。\n\n二、修業年限：依教育部規定一至四年 ( 不含保留入學及休學期間 ) 。\n\n三、學分及修課要求：\n\n1 、學生選課均須經指導教授或學程主任核可。\n\n2 、學生辦理學位考試前，須修畢規定之應修科目及最低畢業學分數。\n\n3 、學生於提出學位口試申請前，原則上須參加國際交換學生計畫，至本校所 認可之海外學校選讀並至少抵免取得 6-9 學分經本學程同意之管理相關\n\n專業課程；外籍生不須海外交換；本籍生具國外就讀一學期以上之大學 ( 含 以上 ) 經歷，經本學程核可後，可抵免海外交換。\n\n四、論文規定及指導教授選擇：\n\n、論文指導教授須為助理教授以上，並符合學位授予法學位考試委員之資\n\n1 格。\n\n2 、論文指導教授應以本院專任教師為指導原則，若因專業領域或本院師資 不足，得商請本校其他系所專任教師，或校外教師或專家學者擔任，惟須 另安排本院教師一人共同指導。\n\n3\n\n、論文指導教授若退休或離職，仍可繼續指導，惟須另安排本院教師一人 共同指導。\n\n4\n\n5\n\n6\n\n、共同指導時，論文計劃書須經兩位指導教授同意後，始得向本學程提出申 請。\n\n、研究生倘因故須更改已選定之指導教授，須獲得原指導教授及新指導教授 之書面同意後，始得更改。\n\n、碩士論文撰寫及學位考試須以英文進行，論文須附上中文摘要。\n\n五、碩士學位考試：\n\n1\n\n、論文口試規定：\n\n研究生須符合修課要求相關規定後，經指導教授同意並於學校\n\n（ 1 ） 規定期限內提出申請，始得舉行學位考試。\n\n（ 2 ） 學位考試委員應為助理教授以上教師；考試委員會置委員三至五\n\n人，委員中，指導教授以外之考試委員人數應達二分之一以上。\n\n（ 3 ） 口試時間以研二下學期為原則。\n\n2 、其他：\n\n(1) 學位考試成績不及格而其修業年限尚未屆滿者，得於次學期或次 學年舉行重考，重考以一次為限，經重考一次仍不及格者，依本 校學則規定應令退學。\n\n（ 2 ）外語能力要求：外籍生須於學位考試申請前，提出須通過 TOCFL A2 或 HSK 2 級檢核證明；若無法提出證明者，可修習臺灣任一 所大學之華語中心 ( 含中華語文研習所 ) 二學期 ( 含 ) 以上 ( 即修習時 數至少 100 小時以上 ) ，並提供修業證明，即符合畢業規定。 ( 本 條文亦適用 109 學年度 ( 含 ) 前入學學生 )\n\n六、畢業：符合上述之各項規定者，得申請畢業，由學校授予學位。\n\n七、本規定經院務會議通過，簽請校長核定後施行，修訂時亦同。""]",curious student,Misspelled queries,long,"<1-hop>  [202509161524420744.md]

國立中山大學管理學院學生語文能力獎勵要點

College of Management Guidelines for Subsiding Student Language Proficiency

93.04.15 本校管理學院 92 學年度第 6 次主管會議修正通過 Amended and approved by the 6 th Director's Council Meeting, April 15, 2004 95.09.26 本校管理學院 95 學年度第 4 次臨時主管會議修正通過 Amended and approved by the 7 th Interim College Affairs Council, September 26, 2005 105.03.23 本校管理學院 104 學年度第 11 次主管會議修正通過 Amended and approved by the 11 th Director's Council Meeting, March 23, 2016 107.12.26 本校管理學院 107 學年度第 5 次主管會議修正通過 Amended and approved by the 5 th Director's Council Meeting, December 26, 2018 112.02.15 本校管理學院 111 學年度第 7 次主管會議修正通過 Amended and approved by the 7 th Director's Council Meeting, February 15, 2023

一、 宗旨：為強化本院學生之語文能力，促進國際競爭能力，特設此獎勵 要點，鼓勵學生參加語文測驗。

I. Purpose

The Guidelines on Subsiding Student Language Proficiency (hereinafter as the 'Guideline') is put in place to encourage students to participate in language proficiency tests, following the college regulation to strengthen students' language proficiency and to promote international competitiveness.

二、 申請資格

II. Qualification

( 一 ) 本地生與非英語系國家之學位生：

Domestic degree students and non-native English-speaking degree students:

本院大學部及研究所一般學位生 ( 不含在職生、專班生、交換生 ) 及 非英語系國家之外籍學位生與僑生、陸生。

(1) Full-time undergraduate and graduate students (exclusion of inservice, part-time, and exchange student) and non-native Englishspeaking countries students, oversea Chinese students, and Chinese students.

於本校在學期間通過外國語文測驗者。

(2) Students who have passed the English proficiency exam during their study at the university

( 二 ) 華語非母語之外籍學位生：

Non-native Chinese-speaking international students:

1.

本院大學部及研究所華語非母語之外籍學位生。

International non-native Chinese-speaking undergraduate and

(1) graduate students.

於本校在學期間通過華語文能力測驗者。

Students who have passed the Chinese proficiency exam during

(2) their study at the university

三、 申請文件

III. Application

( 一 ) 「管理學院學生語文能力測驗獎勵申請表」 。

Language Test Grant Application

( 二 ) 成績單正本及影印本各乙份。 （正本於查驗後將退回）

One copy of official transcript and one copy of printed official transcript (the official transcript will return to the applicant upon review)

( 三 ) 學生證影印本乙份 ( 需加蓋註冊章 )

。

One copy of student identification card (stamped by the Office of Academic Affairs)

( 四 ) 外籍學位生需繳交：護照影本 ( 若本年度在臺住滿 183 天，需附護 照內出入境章影本 ) 、外僑居留證影本。

International degree students: one copy of passport (one copy of the departure/arrival stamps if stayed in Taiwan for more than 183 in the year) and one copy of ARC/APRC

四、 審查程序：申請者檢具完整申請文件，經承辦人驗證後，簽請院長核 示予以補助。

IV.

Application Review Process Application upon review by the contact person will be sent to the College Dean

for approval of subsidy.

五、 獎勵項目及金額：各測驗分數達到獎勵分數以上者，予以新臺幣 5,000 元獎勵金。

V. Subsidy Item and Awarding Amount

Applicant will be awarded NTD$5,000 for meeting one of the following exam scores:

獎勵項目 本地生與非英語系國家之學位生 華語文能力測 驗 (TOCFL) 新制託福 (iBT) 雅思 (IELTS) 學術 組 獎勵分數 100( 含 ) 以上 7.5( 含 ) 以上 Level 4 高階級

Subsidy Item Domestic degree students and non- native TOCFL TOEFL iBT IELTS Academic Awarding score 100 or above 7.5 or above Level 4 Advanced

六、 申請日期：

VI. Application Time Period

( 一 ) 上學期：每年十一月一日至十五日止。

First Semester: November 1 st -November 15 th

( 二 ) 下學期：每年五月一日至十五日止。

Second Semester: May 1 st - May 15 th

七、 申請次數：每位學生在修讀每一學位學程期間僅可申請獎助以一次為 限。

VII. Eligibility

Students may only apply for the subsidy once during each degree program

八、 申請方式：於管理學院網站下載申請表格並檢附相關文件送管理學院 辦公室。

VIII.

How to Apply

Download the application form from the website of the College and enclose supporting documents to submit to the College of Management Office

九、 本要點經本院院務會議通過後實施，修正時亦同。

IX.

Regulation and Amendments

This Guideline, as well as its amendments, are effective upon approval by the College Affairs Council","<2-hop>  [202106291430100475.md]

National Sun Yat-sen University

Regulations Governing International Business MBA Degree Examination

-Approved by the 2 nd College Affaires Meeting in Academic Year 2006-2007, January 17 th , 2007

-Approved by the 4 th College Affaires Meeting in Academic Year 2013-2014, April 29 th , 2014

-Approved by the 4 th College Affaires Meeting in Academic Year 2016-2017, May 9 th , 2016

-Approved by the 2 nd College Affaires Meeting in Academic Year 2017-2018, December 5 th , 2017

-Approved by the 4 th College Affaires Meeting in Academic Year 2019-2020, May 8 th , 2019

-Approved by the 2 nd College Affaires Meeting in Academic Year 2019-2020, November 26 th , 2019

-Approved by the 3 rd College Affaires Meeting in Academic Year 2019-2020, March 10 th , 2020

-Approved by the 2 nd College Affaires Meeting in Academic Year 2020-2021, December 1 st , 2020

-Approved by the President of NSYSU, December 14 th ,2020

(For Students enrolled in academic year 2021)

This Regulations Governing International Business MBA Degree Examination (the Regulations) are enacted in accordance with 'Degree Conferral Law' and the Enforcement Rules thereof of Ministry of Education and 'Academic Regulations,' 'Implementation Bylaws for Ph. D. and Master Degree Examination' and 'Guidelines for Selection of Advisors' of National Sun Yat-sen University (NSYSU).

Maximum year of study: 1 to 4 years in accordance with Ministry of Education regulations (excluding reserved admission and suspension duration).

Credits and requirement for the course:

i. Any course selected by the student must be approved by the Advisor or the International Business MBA (IBMBA) director (the Director).

ii. Before student applying for the degree examination, the student must complete all the regulated courses and have acquired more credits than the minimum graduation credits.

iii. Before applying for the thesis oral defense, the local students need to participate overseas exchange program: study abroad at the universities / institutes acknowledged by NSYSU, and acquire more than 6 credits from management related courses approved by IBMBA. Whereas foreign students do not need to participate overseas exchange program. However, those local students who have studied abroad in university or above for one or more semester, after approved by IBMBA, may not participate the overseas exchange program.

Thesis regulations and advisor selection:

i. A thesis advisor must be an assistant professor or above, as well as qualified of being a master's examination committee member in accordance with the Degree Conferral Law.

ii. A thesis advisor should be selected within the College of Management. However, if the college lack related research area or suitable teacher, the student could select advisor from other department/college in NSYSU or experts or scholars outside of NSYSU, while arranging another College of Management faculty as co-advisor.

iii. The thesis advisor, after retiring or resigning from the university, may continue advising the student. However, the student must arrange another College of Management faculty as coadvisor.

iv. Before student applies for co-advisor from IBMBA, both advisors must approve the student's Thesis Proposal.

If the student need to change advisor, the student must acquire written consent from both original advisor and new advisor.

i. Thesis and degree examination must be in English.

Master's Degree Examination:

i. Regulations for Thesis Oral Defense:

a. Before taking the Master's Degree Examination, the student must meet the requirement for all courses, be approved by the thesis advisor and apply for the degree examination in due time according to NSYSU regulation.

b. The member of Master's Degree Examination Committee should be assistant professor or higher. The committee is composed of 3 to 5 members. Members exclude the thesis advisor should account for more than 1/2 of all committee members.

c. The thesis oral defense should be held during the 2 nd semester in the 2 nd year of IBMBA program.

ii. Other related regulations:

a. The students who fail the degree examination and haven't complete the year of study could take re-examination in the next semester or next academic year. The re-examination can only be taken once, and the student who fail the re-examination will be expelled according to NSYSU regulations.

b. Language proficiency test: International students should reach Chinese proficiency, TOCFL score level 2 (A2) or New HSK score level 2.

The students who fail to pass TOCFL score level 2 (A2) or New HSK score level 2, may need to take the Chinese test at least once and provide at least 2 semesters or 100 hours Chinese course certificate from Chinese Learning Center which affiliated to universities in Taiwan or from Taipei Language Institute in order to exempt from the graduation requirements.

(This language proficiency test can also be applied for students enrolled in (or before) academic year 2020)

Graduation: Graduate students who meet the requirement of aforesaid regulations may apply for graduation, and receive degree from NSYSU.

The Regulations shall be implemented upon approval by the College Affaires Meeting, sign by the president of NSYSU and released, and the same shall apply as to amendment hereto.

For the avoidance of doubt in English version regulation, Chinese version will be prevailing.

英文法規翻譯內容若有疑義 , 以中文法規為主

國立中山大學管理學院

國際經營管理碩士學程研究生學位考試相關規定

96.1.17 九十五學年度第 2 次院務會議通過

103.4.29 一 0 二學年度第 4 次院務會議通過

106.5.9 一 0 五學年度第 4 次院務會議通過

106.12.05 一 0 六學年度第 2 次院務會議通過

106.12.28 經校長核定

107.01.02 發布

108.05.08 一 0 七學年度第 4 次院務會議通過

108.05.28 經校長核定

108.11.26 一 0 八學年度第 2 次院務會議通過

108.12.20 經校長核定

109.03.10 一 0 八學年度第 3 次院務會議通過

109.04.10 經校長核定

109.12.01 一 0 九學年度第 2 次院務會議通過

109.12.14 經校長核定

( 一一０學年度入學新生適用 )

一、 依據教育部頒「學位授予法」 、本校「學則」 、 「研究生學位考試施行細則」 及「論文指導教授遴聘原則」訂定之。

二、修業年限：依教育部規定一至四年 ( 不含保留入學及休學期間 ) 。

三、學分及修課要求：

1 、學生選課均須經指導教授或學程主任核可。

2 、學生辦理學位考試前，須修畢規定之應修科目及最低畢業學分數。

3 、學生於提出學位口試申請前，原則上須參加國際交換學生計畫，至本校所 認可之海外學校選讀並至少抵免取得 6-9 學分經本學程同意之管理相關

專業課程；外籍生不須海外交換；本籍生具國外就讀一學期以上之大學 ( 含 以上 ) 經歷，經本學程核可後，可抵免海外交換。

四、論文規定及指導教授選擇：

、論文指導教授須為助理教授以上，並符合學位授予法學位考試委員之資

1 格。

2 、論文指導教授應以本院專任教師為指導原則，若因專業領域或本院師資 不足，得商請本校其他系所專任教師，或校外教師或專家學者擔任，惟須 另安排本院教師一人共同指導。

3

、論文指導教授若退休或離職，仍可繼續指導，惟須另安排本院教師一人 共同指導。

4

5

6

、共同指導時，論文計劃書須經兩位指導教授同意後，始得向本學程提出申 請。

、研究生倘因故須更改已選定之指導教授，須獲得原指導教授及新指導教授 之書面同意後，始得更改。

、碩士論文撰寫及學位考試須以英文進行，論文須附上中文摘要。

五、碩士學位考試：

1

、論文口試規定：

研究生須符合修課要求相關規定後，經指導教授同意並於學校

（ 1 ） 規定期限內提出申請，始得舉行學位考試。

（ 2 ） 學位考試委員應為助理教授以上教師；考試委員會置委員三至五

人，委員中，指導教授以外之考試委員人數應達二分之一以上。

（ 3 ） 口試時間以研二下學期為原則。

2 、其他：

(1) 學位考試成績不及格而其修業年限尚未屆滿者，得於次學期或次 學年舉行重考，重考以一次為限，經重考一次仍不及格者，依本 校學則規定應令退學。

（ 2 ）外語能力要求：外籍生須於學位考試申請前，提出須通過 TOCFL A2 或 HSK 2 級檢核證明；若無法提出證明者，可修習臺灣任一 所大學之華語中心 ( 含中華語文研習所 ) 二學期 ( 含 ) 以上 ( 即修習時 數至少 100 小時以上 ) ，並提供修業證明，即符合畢業規定。 ( 本 條文亦適用 109 學年度 ( 含 ) 前入學學生 )

六、畢業：符合上述之各項規定者，得申請畢業，由學校授予學位。

七、本規定經院務會議通過，簽請校長核定後施行，修訂時亦同。",202509161524420744.md,202106291430100475.md,"['language proficiency tests', 'language proficiency test']",管理學院↔管理學院,language proficiency tests↔language proficiency test,5.0,4.47,5.0,5.0,5.0,2.0,5.0
國立中山大學資訊工程學系博士班學生在申請學位考試時，需符合哪些修課與英文能力的規定？此外，國立中山大學光電工程學系學生申請國際會議論文發表補助時，有哪些申請條件與限制？,根據國立中山大學資訊工程學系博士班的規定，博士生畢業前必須修滿碩士班或博士班課程22學分，其中本系開授課程至少19學分；逕讀博士者須修滿40學分，其中本系課程至少30學分。博士生每學期必須選修書報討論及至少一門三學分課程，且修課須經指導教授同意。英文成績最低標準需通過多益750分以上、全民英檢中高級複試以上、托福紙筆527分以上、托福網路71分以上或IELTS 5.5級以上，且成績須於入學前2年後取得。未達標準者可修習指定英文課程取代，但該學分不計入畢業學分。博士生須達英文標準後方可申請學位考試。至於國立中山大學光電工程學系學生申請國際會議論文發表補助，申請日期為當年度1月1日至12月31日，補助金額為每篇論文5000元，且同一場國際研討會每位學生最多申請1篇。申請時需附論文發表補助申請表、接受通知影本、註冊證明、學生請假申請單、出差申請單及一頁論文。每篇論文僅能由一位學生申請，且不限第一作者。若未於出國前完成學校請假手續，補助金額減半。申請者需確實出席國際研討會，且發表論文作者須包含本系指導教授及學系名稱。,"['<1-hop>  [201909101834230665.md]\n\n國立中山大學資訊工程學系 博士班研究生資格考核及學位考試相關規定\n\n103 學年度起入學新生適用\n\n92 年 2 月 26 日系務會議修正通過 92 年 3 月 25 日工學院院務會議修正通過 93 年 12 月 29 日系務會議修正通過 94 年 1 月 25 日工學院院務會議修正通過 94 年 3 月 9 日系務會議修正通過 94 年 3 月 23 日工學院院務會議修正通過 95 年 9 月 27 日系務會議修正通過 95 年 11 月 1 日工學院院務會議修正通過 96 年 3 月 30 日系務會議修正通過 96 年 6 月 15 日工學院院務會議修正通過 97 年 6 月 9 日系務會議修正通過 97 年 6 月 10 日工學院院務會議修正通過 98 年 5 月 20 日系務會議修正通過 98 年 6 月 10 日工學院院務會議修正通過 98 年 9 月 23 日系務會議修正通過 99 年 6 月 28 日工學院院務會議修正通過 101 年 12 月 25 日系務會議修正通過 102 年 3 月 5 日工學院院務會議修正通過 102 年 3 月 29 日系務會議修正通過 102 年 5 月 29 日工學院院務會議修正通過 103 年 2 月 20 日系務會議修正通過 103 年 6 月 6 日系務會議修正通過 103 年 6 月 13 日工學院院務會議修正通過\n\n一、依據教育部頒「學位授予法」暨其施行細則、本校「學則」及「研究生學位 考試施行細則」訂定之。\n\n二、在學期間相關事項：\n\n( 一 ) 修業年限：依教育部規定二至七年 ( 不含保留入學及休學期間 ) 。\n\n( 二 ) 學分制度及修課要求：\n\n本系博士生畢業之前必須至少修滿碩士班或博士班課程 22 學分， 其中本系開授課程至少 19 學分，其餘課程經本系同意後，得選修 相關碩、博士班開授之課程。逕讀博士學位者，至少須修滿 40 學 分，其中本系開授課程至少 30 學分。其碩士班一年級所修之學分， 最多可取三分之二的學分計入博士學位學分，且至多以 12 學分為 限。\n\n申請逕讀博士學位者，於申請前須修畢碩士班必修課程（書報討論 除外）。\n\n本系博士生修業的前二年，每學期必須選修 「書報討論」 （ seminar ） ； 另外，每學期至少須選修一門三學分課程。\n\n本系博士生每學期修讀課程，須經指導教授同意後確定之。如無指 導教授，則須經導師或系主任同意後確定之。\n\n本系博士班研究生畢業英文成績最低標準以通過下列任一檢定標 準且通過之測驗檢定日期應以入學前 2 年之後取得為限：\n\n(1) 多益測驗 TOEIC 成績達 750 分以上。\n\n(2) 全民英檢 (GEPT) 中高級複試 ( 含 ) 以上。\n\n(3) 託福紙筆測驗 (TOFEL ITP)527 分 ( 含 ) 以上\n\n(4) 託福網路化測驗 (TOFEL-iBT)71 分 ( 含 ) 以上。\n\n(5) 國際英語能力測驗 (IELTS)5.5 級 ( 含 ) 以上。\n\n如測驗上述檢定項目二次以上仍未達標準，得修習本系課程委員會 指定之英文相關課程取代且修課成績需及格且為該科全部修課人 數之前二分之一。若以修習英文相關課程方式取代英文成績者，該 學分則不納入畢業學分。\n\n為加強本系博士生的學識能力、研究能力或英文能力，本系得指定 其補修相關課程。\n\n須達本系博士班研究生規定之英文成績標準後，始得以申請學位考 試。\n\n( 三 ) 指導教授選派：\n\n本系博士生以選擇本系助理教授 ( 含 ) 以上專任教師擔任博士論文指 導教授為原則。\n\n若有特殊原因，得選擇非本系之指導教授，但必須選擇一位本系助 理教授 ( 含 ) 以上專任教師為共同指導教授。若需由系外老師共同指 導時，需經指導教授同意後，向繫上提出申請，如共同指導教授指 導學生至其畢業時未達一年以上者，取消其共同指導資格。\n\n本系博士生應於入學後一年內決定其論文指導教授。同學未於期限 內決定指導教授者，將由繫上協調指派指導教授。\n\n若因特殊原因需更換指導教授時，應先徵得原指導教授及新指導教 授同意，並以書面向本系報備。\n\n三、博士學位候選人資格考核：\n\n學期之定義：上學期自每年八月一日至次年一月三十一日、下學期自每年二 月一日至七月三十一日。\n\n( 一 ) 資格考試：\n\n資格考試以筆試行之。各科考試結果由本系系務會議議決「通過」 或「不通過」。\n\n資格考試時間每年分兩梯次，分別於上學期與下學期期末考後一個 月內舉行，本系博士生必須每次資格考試前三星期以前提出申請參 加資格考試的科目。除有特殊原因經本系專案核准外，否則申請後 而缺考者，該科目以零分計（不通過一次）。\n\n每位博士生初次申請資格考試時，必須於下列六科中自行選定四科 做為其「資格考試科目」，確定後不得再更改，且必須通過三科， 每科至多可參加二次考試：\n\n計算機結構（研究所課程）、電腦網路（大學部課程）、作業系統 （大學部課程）、演算法分析與設計（研究所課程）、數位電子學 （大學部課程）、機率學（大學部課程）\n\n資格考試科目至少需以考試方式通過一科（含）以上，未通過考試\n\n之科目，可以修課來抵免 ( 科目若有變更，將於一學期前於繫上網頁 公告 ) ，修課或考試二者可並行。抵免資格考之科目，每科修課以 一次為限，以修課申請抵免之科目，成績必須及格且需為該科全部 修課人數之前二分之一。\n\n本系博士生應在入學後一年半內 （休學期間不計） 通過資格考試 ( 含 修課扺免程序完成 ) 。未通過者應令退學。\n\n本系碩士班在學學生經指導教授簽署同意後，得申請參加資格考 試。該生若於碩士班畢業當年進入本系博士班就讀或逕讀博士班， 則資格考試之結果（含「通過」科目、「不通過」次數），均為有 效。該生若於碩士班畢業二年內未進入本系博士班就讀，則資格考 試之結果全部取消。\n\n( 二 ) 論文計畫書審查：\n\n本系博士生論文諮議委員會成員如下：指導教授、指導教授推薦相 關系所助理教授 ( 含 ) 以上二人、本系推薦一人。其中本系委員應佔 二分之一（含）以上。\n\n本系博士生在通過資格考試後一年內（休學期間不計）必須通過論 文計畫書諮議委員會之口試審查。經委員會全數委員通過，始為通 過。第一次未通過者重提論文計畫審查不受前述資格考後一年內完 成之限制，但仍須於資格考試後一年半內完成，重提論文計畫審查 以一次為限，仍不及格者，應令退學。論文計晝審查通過六個月後， 始可申請博士學位考試。\n\n四、博士班論文發表相關規定：\n\n( 一 ) 本系博士生發表之論文，至少需達到下列兩項最低標準之一，始可申請 博士學位考試：\n\n申請學位考試時，修業時間已逾四年者： 至少一篇 SCIE 期刊論文代表作，以及至少一篇 IEEE/IET Electronic Library 收錄、或 ACM Digtal Library 收錄、或 B\n\n級以上之國際會 議論文 ( 或一個與畢業論文相關之實作系統 ) 。\n\n申請學位考試時，修業時間未滿四年者： 除需符合上述條件之外，其中需有一篇 A 級 SCIE 期刊長篇論文， 或需有一篇 A 級國際會議論文，或畢業論文相關之實作系統參加 全國或國際性之競賽獲獎前三名者。 ( 期刊和會議論文等級另公佈\n\n於本系網頁 ) 。\n\n上述期刊論文代表作中，該博士生須在至少一篇 SCIE 論文，於所有作者 （指導教授除外）中列名第一位。代表作不得為其他博士生（含已畢業或 未畢業者）之代表作。\n\n( 二 ) 本系博士生發表之論文必須是在本系碩士班、博士班就讀期間，利用本 系全銜 ( 或在本系之後加列其服務單位 ) 刊登，且其指導教授需列名其上， 本系始承認其為在學期間之研究結果，並列入上述之計算標準。\n\n( 三 ) 本系博士生於申請博士學位考試資格審查前參加至少一次國際性會議，\n\n並於會議上以英文報告論文 ( 需提出佐證資料 ) 。\n\n五、博士班學位考試：\n\n本系博士生於完成論文後，經其指導教授簽字同意，認定其論文成果具原 創性及完整性，並已達博士論文水準，始可申請博士學位考試。申請博士 學位考試者，須於考試前至少一個月提出申請並經系學術委員會審查通過 （審查項目包含修業年限、修習學分、博士候選人資格考核、英文能力、 論文計畫是否於期限內通過審查、是否符合論文發表相關規定，及依學校 相關法規規定應審查之事項），始得進行博士學位考試。\n\n已達修業年限，於應提出學位考試申請之時，其修習課程或英文能力仍未 達規定者，得以切結方式申請先行審查其它畢業要項，但仍須於滿足所有 修業規定後，方得提出學位考試申請。\n\n博士學位考試悉依本校「研究生學位考試施行細則」之規定辦理。\n\n六、畢業：符合上述之各項規定者，得提出畢業之申請。\n\n七、本辦法經系務會議、院務會議通過，簽請校長核定後施行，修正時亦同。', '<2-hop>  [201910311445071275.md]\n\n國立中山大學光電工程學系 學生會議論文發表補助辦法\n\n981009 98 學年度第 1 次系務會議修正 1020501 101 學年度第 6 次系務會議修正 1030327 102 學年度第 9 次系務會議修正\n\n1051013 105 學年度第 1 次系務會議修正\n\n一、目的：為鼓勵本系研究生參與學術會議發表論文，特別是國際大型研討會。\n\n二、申請日期：採隨到隨審，惟不接受跨年度申請案。\n\n三、會議日期：當年度一月一日起至十二月三十一日期間所舉辦之會議\n\n四、補助金額：\n\n國際會議論文(補助於國外舉辦國際研討會)每篇補助五千元，同一場國際研討會議每 位學生至多申請1篇論文補助。\n\n五、檢附文件：請附論文「論文發表補助申請表」、「接受通知影本」、「註冊證明」、 「學生請假申請單、」「出差申請單」及「一頁論文」向系辦申請 。\n\n六、備註：\n\n( 一 ) 每篇論文僅能由一位學生申請，且不限為第一作者。\n\n( 二 ) 本系學生申請國內外論文發表補助，如學生未於出國前完成學校請假手續，其補助 金額減半（說明 : 國外論文原本補助 5000 元即為 2500 元）。\n\n( 三 ) 申請補助之學生需確實出席國際研討會議，補助之論文型態不限口頭或海報報告。\n\n( 四 ) 發表論文之作者須包含本系指導教授及本系學系名稱。']",teacher,Web search like queries,short,"<1-hop>  [201909101834230665.md]

國立中山大學資訊工程學系 博士班研究生資格考核及學位考試相關規定

103 學年度起入學新生適用

92 年 2 月 26 日系務會議修正通過 92 年 3 月 25 日工學院院務會議修正通過 93 年 12 月 29 日系務會議修正通過 94 年 1 月 25 日工學院院務會議修正通過 94 年 3 月 9 日系務會議修正通過 94 年 3 月 23 日工學院院務會議修正通過 95 年 9 月 27 日系務會議修正通過 95 年 11 月 1 日工學院院務會議修正通過 96 年 3 月 30 日系務會議修正通過 96 年 6 月 15 日工學院院務會議修正通過 97 年 6 月 9 日系務會議修正通過 97 年 6 月 10 日工學院院務會議修正通過 98 年 5 月 20 日系務會議修正通過 98 年 6 月 10 日工學院院務會議修正通過 98 年 9 月 23 日系務會議修正通過 99 年 6 月 28 日工學院院務會議修正通過 101 年 12 月 25 日系務會議修正通過 102 年 3 月 5 日工學院院務會議修正通過 102 年 3 月 29 日系務會議修正通過 102 年 5 月 29 日工學院院務會議修正通過 103 年 2 月 20 日系務會議修正通過 103 年 6 月 6 日系務會議修正通過 103 年 6 月 13 日工學院院務會議修正通過

一、依據教育部頒「學位授予法」暨其施行細則、本校「學則」及「研究生學位 考試施行細則」訂定之。

二、在學期間相關事項：

( 一 ) 修業年限：依教育部規定二至七年 ( 不含保留入學及休學期間 ) 。

( 二 ) 學分制度及修課要求：

本系博士生畢業之前必須至少修滿碩士班或博士班課程 22 學分， 其中本系開授課程至少 19 學分，其餘課程經本系同意後，得選修 相關碩、博士班開授之課程。逕讀博士學位者，至少須修滿 40 學 分，其中本系開授課程至少 30 學分。其碩士班一年級所修之學分， 最多可取三分之二的學分計入博士學位學分，且至多以 12 學分為 限。

申請逕讀博士學位者，於申請前須修畢碩士班必修課程（書報討論 除外）。

本系博士生修業的前二年，每學期必須選修 「書報討論」 （ seminar ） ； 另外，每學期至少須選修一門三學分課程。

本系博士生每學期修讀課程，須經指導教授同意後確定之。如無指 導教授，則須經導師或系主任同意後確定之。

本系博士班研究生畢業英文成績最低標準以通過下列任一檢定標 準且通過之測驗檢定日期應以入學前 2 年之後取得為限：

(1) 多益測驗 TOEIC 成績達 750 分以上。

(2) 全民英檢 (GEPT) 中高級複試 ( 含 ) 以上。

(3) 託福紙筆測驗 (TOFEL ITP)527 分 ( 含 ) 以上

(4) 託福網路化測驗 (TOFEL-iBT)71 分 ( 含 ) 以上。

(5) 國際英語能力測驗 (IELTS)5.5 級 ( 含 ) 以上。

如測驗上述檢定項目二次以上仍未達標準，得修習本系課程委員會 指定之英文相關課程取代且修課成績需及格且為該科全部修課人 數之前二分之一。若以修習英文相關課程方式取代英文成績者，該 學分則不納入畢業學分。

為加強本系博士生的學識能力、研究能力或英文能力，本系得指定 其補修相關課程。

須達本系博士班研究生規定之英文成績標準後，始得以申請學位考 試。

( 三 ) 指導教授選派：

本系博士生以選擇本系助理教授 ( 含 ) 以上專任教師擔任博士論文指 導教授為原則。

若有特殊原因，得選擇非本系之指導教授，但必須選擇一位本系助 理教授 ( 含 ) 以上專任教師為共同指導教授。若需由系外老師共同指 導時，需經指導教授同意後，向繫上提出申請，如共同指導教授指 導學生至其畢業時未達一年以上者，取消其共同指導資格。

本系博士生應於入學後一年內決定其論文指導教授。同學未於期限 內決定指導教授者，將由繫上協調指派指導教授。

若因特殊原因需更換指導教授時，應先徵得原指導教授及新指導教 授同意，並以書面向本系報備。

三、博士學位候選人資格考核：

學期之定義：上學期自每年八月一日至次年一月三十一日、下學期自每年二 月一日至七月三十一日。

( 一 ) 資格考試：

資格考試以筆試行之。各科考試結果由本系系務會議議決「通過」 或「不通過」。

資格考試時間每年分兩梯次，分別於上學期與下學期期末考後一個 月內舉行，本系博士生必須每次資格考試前三星期以前提出申請參 加資格考試的科目。除有特殊原因經本系專案核准外，否則申請後 而缺考者，該科目以零分計（不通過一次）。

每位博士生初次申請資格考試時，必須於下列六科中自行選定四科 做為其「資格考試科目」，確定後不得再更改，且必須通過三科， 每科至多可參加二次考試：

計算機結構（研究所課程）、電腦網路（大學部課程）、作業系統 （大學部課程）、演算法分析與設計（研究所課程）、數位電子學 （大學部課程）、機率學（大學部課程）

資格考試科目至少需以考試方式通過一科（含）以上，未通過考試

之科目，可以修課來抵免 ( 科目若有變更，將於一學期前於繫上網頁 公告 ) ，修課或考試二者可並行。抵免資格考之科目，每科修課以 一次為限，以修課申請抵免之科目，成績必須及格且需為該科全部 修課人數之前二分之一。

本系博士生應在入學後一年半內 （休學期間不計） 通過資格考試 ( 含 修課扺免程序完成 ) 。未通過者應令退學。

本系碩士班在學學生經指導教授簽署同意後，得申請參加資格考 試。該生若於碩士班畢業當年進入本系博士班就讀或逕讀博士班， 則資格考試之結果（含「通過」科目、「不通過」次數），均為有 效。該生若於碩士班畢業二年內未進入本系博士班就讀，則資格考 試之結果全部取消。

( 二 ) 論文計畫書審查：

本系博士生論文諮議委員會成員如下：指導教授、指導教授推薦相 關系所助理教授 ( 含 ) 以上二人、本系推薦一人。其中本系委員應佔 二分之一（含）以上。

本系博士生在通過資格考試後一年內（休學期間不計）必須通過論 文計畫書諮議委員會之口試審查。經委員會全數委員通過，始為通 過。第一次未通過者重提論文計畫審查不受前述資格考後一年內完 成之限制，但仍須於資格考試後一年半內完成，重提論文計畫審查 以一次為限，仍不及格者，應令退學。論文計晝審查通過六個月後， 始可申請博士學位考試。

四、博士班論文發表相關規定：

( 一 ) 本系博士生發表之論文，至少需達到下列兩項最低標準之一，始可申請 博士學位考試：

申請學位考試時，修業時間已逾四年者： 至少一篇 SCIE 期刊論文代表作，以及至少一篇 IEEE/IET Electronic Library 收錄、或 ACM Digtal Library 收錄、或 B

級以上之國際會 議論文 ( 或一個與畢業論文相關之實作系統 ) 。

申請學位考試時，修業時間未滿四年者： 除需符合上述條件之外，其中需有一篇 A 級 SCIE 期刊長篇論文， 或需有一篇 A 級國際會議論文，或畢業論文相關之實作系統參加 全國或國際性之競賽獲獎前三名者。 ( 期刊和會議論文等級另公佈

於本系網頁 ) 。

上述期刊論文代表作中，該博士生須在至少一篇 SCIE 論文，於所有作者 （指導教授除外）中列名第一位。代表作不得為其他博士生（含已畢業或 未畢業者）之代表作。

( 二 ) 本系博士生發表之論文必須是在本系碩士班、博士班就讀期間，利用本 系全銜 ( 或在本系之後加列其服務單位 ) 刊登，且其指導教授需列名其上， 本系始承認其為在學期間之研究結果，並列入上述之計算標準。

( 三 ) 本系博士生於申請博士學位考試資格審查前參加至少一次國際性會議，

並於會議上以英文報告論文 ( 需提出佐證資料 ) 。

五、博士班學位考試：

本系博士生於完成論文後，經其指導教授簽字同意，認定其論文成果具原 創性及完整性，並已達博士論文水準，始可申請博士學位考試。申請博士 學位考試者，須於考試前至少一個月提出申請並經系學術委員會審查通過 （審查項目包含修業年限、修習學分、博士候選人資格考核、英文能力、 論文計畫是否於期限內通過審查、是否符合論文發表相關規定，及依學校 相關法規規定應審查之事項），始得進行博士學位考試。

已達修業年限，於應提出學位考試申請之時，其修習課程或英文能力仍未 達規定者，得以切結方式申請先行審查其它畢業要項，但仍須於滿足所有 修業規定後，方得提出學位考試申請。

博士學位考試悉依本校「研究生學位考試施行細則」之規定辦理。

六、畢業：符合上述之各項規定者，得提出畢業之申請。

七、本辦法經系務會議、院務會議通過，簽請校長核定後施行，修正時亦同。","<2-hop>  [201910311445071275.md]

國立中山大學光電工程學系 學生會議論文發表補助辦法

981009 98 學年度第 1 次系務會議修正 1020501 101 學年度第 6 次系務會議修正 1030327 102 學年度第 9 次系務會議修正

1051013 105 學年度第 1 次系務會議修正

一、目的：為鼓勵本系研究生參與學術會議發表論文，特別是國際大型研討會。

二、申請日期：採隨到隨審，惟不接受跨年度申請案。

三、會議日期：當年度一月一日起至十二月三十一日期間所舉辦之會議

四、補助金額：

國際會議論文(補助於國外舉辦國際研討會)每篇補助五千元，同一場國際研討會議每 位學生至多申請1篇論文補助。

五、檢附文件：請附論文「論文發表補助申請表」、「接受通知影本」、「註冊證明」、 「學生請假申請單、」「出差申請單」及「一頁論文」向系辦申請 。

六、備註：

( 一 ) 每篇論文僅能由一位學生申請，且不限為第一作者。

( 二 ) 本系學生申請國內外論文發表補助，如學生未於出國前完成學校請假手續，其補助 金額減半（說明 : 國外論文原本補助 5000 元即為 2500 元）。

( 三 ) 申請補助之學生需確實出席國際研討會議，補助之論文型態不限口頭或海報報告。

( 四 ) 發表論文之作者須包含本系指導教授及本系學系名稱。",201909101834230665.md,201910311445071275.md,"['國立中山大學光電工程學系', '國立中山大學資訊工程學系博士班']",工學院↔工學院,國立中山大學資訊工程學系博士班↔國立中山大學光電工程學系,5.0,5.0,5.0,5.0,5.0,2.0,5.0
請問國立中山大學資訊工程學系碩士班學生在修業期間，最低畢業學分數是多少？此外，專業必修課程有哪些要求，學生畢業前需完成哪些專業課程？,根據國立中山大學資訊工程學系碩士班研究生學位考試相關規定，學生須修畢最低畢業學分數28學分（含必修課程）。專業必修課程包括「超大型積體電路設計」、「計算機結構」、「高等電腦網路」、「演算法設計與分析」及「高等作業系統」等專業課程，學生畢業前至少需擇二科修畢通過。,"['<1-hop>  [201909112106310683.md]\n\n國立中山大學資訊工程學系 碩士班研究生學位考試相關規定\n\n106 學年度起入學新生適用\n\n92 年 1 月 8 日系務會議修正通過 92 年 3 月 25 日工學院院務會議修正通過 94 年 5 月 4 日系務會議修正通過 95 年 6 月 29 日工學院院務會議修正通過 99 年 10 月 27 日系務會議修正通過 99 年 12 月 15 日工學院院務會議修正通過 101 年 2 月 15 日系務會議修正通過 101 年 3 月 14 日系務會議修正通過 101 年 3 月 28 日工學院院務會議修正通過 103 年 4 月 18 日系務會議修正通過 103 年 6 月 6 日系務會議修正通過 103 年 6 月 13 日工學院院務會議修正通過 106 年 6 月 19 日系務會議修正通過\n\n106 年 6 月 28 日工學院院務會議修正通過\n\n一、依據教育部頒「學位授予法」暨其施行細則、本校「學則」及「研究生學位考試施 行細則」訂定之。\n\n二、在學期間相關事項：\n\n(一)修業年限：依教育部規定一至四年(不含保留入學及休學期間)。\n\n(二)須修畢最低畢業學分數 28 學分 ( 含必修課程 ) 。\n\n(三)學分制度及修課要求：\n\n共同必修課程：四個學期「書報討論」（各 1 學分）。\n\n專業必修課程：「超大型積體電路設計」、「計算機結構」、「高等電腦 網路」、「演算法設計與分析」、「高等作業系統」等專業課程，學生畢 業前至少需擇二科修畢通過。\n\n專題或專題研究課程最多採計 6 學分為畢業學分。\n\n本系英文相關課程最多採計 3 學分為畢業學分。\n\n本系碩士班研究生畢業英文成績至少須達下列兩項標準之一：\n\n(1) 須通過下列任一檢定標準且通過之測驗檢定日期應以入學前 2 年之後取 得為限：\n\n(a) 多益測驗 TOEIC 成績達 600 分以上。\n\n(b) 全民英檢 (GEPT) 中高級初試 ( 含 ) 以上。\n\n(c) 託福紙筆測驗 (TOFEL ITP)500 分 ( 含 ) 以上\n\n(d) 託福網路化測驗 (TOFEL-iBT)61 分 ( 含 ) 以上。\n\n(e) 國際英語能力測驗 (IELTS)5 級 ( 含 ) 以上。\n\n(2) 修習本系課程委員會指定之英文相關課程且及格。若以修習英文相關課 程方式取代英文成績者，該學分則不納入畢業學分。\n\n須達本系碩士班研究生規定之英文成績標準後，得以申請學位口試。\n\n(四)指導教授選派：\n\n本系碩士生以選擇本系助理教授 ( 含 ) 以上專任教師擔任指導教授為原則。\n\n若有特殊原因，得選擇非本系之指導教授，但必須選擇一位本系助理教授 ( 含 ) 以上專任教師為共同指導教授。若需由系外教師共同指導時，需經指導教授 同意後，以書面向本系報備。\n\n若因特殊原因需更換指導教授時，應先徵得原指導教授同意，並經學術委員 會審核通過。更換指導教授一年後才可以提出學位論文考試申請。\n\n三、碩士學位考試：\n\n學期之定義：上學期自每年八月一日至次年一月三十一日、下學期自每年二月一日 至七月三十一日。\n\n(一)論文提審：\n\n本系碩士班學生於學位論文口試前，須依下列兩種方式擇一完成論文提審：\n\n於本系「書報討論」課程中進行畢業論文預講，由授課教師或指導教授評 定為合格者才為通過。\n\n繳交論文提審報告並通過下列論文提審程序：\n\n(1) 報告內容含研究題目、動機、相關研究探討、研究目標、方法及進行步 驟、研究成果及貢獻與參考文獻等等。\n\n(2) 指導教授就各申請案組成提審委員會，由三至五位系內教師組成，或外 系、外校教師組成，提審委員會針對申請者之書面報告決定申請者是否 通過提審；必要時，提審委員會得要求申請者進行口頭報告。提審時， 需有三分之二（含）以上提審委員評定為合格者才為通過。\n\n(3) 應屆畢業生須於當年三月三十一日前通過論文提審，否則畢業論文口試 時間至少須延後一學期。延後畢業之學生須於論文口試前至少一個月通 過論文提審。\n\n(二)學位論文口試：\n\n學位考試委員會置委員三至五人，其中系外委員以至少一人為原則。\n\n學位考試（論文口試）成績不及格而其修業年限尚未屆滿者，得於次學期或 次學年舉行重考，重考以一次為限，經重考一次仍不及格者，依本校學則應 令退學。\n\n四、畢業：符合上述之各項規定者，得提出畢業之申請。\n\n五、本辦法經系務會議、院務會議通過，簽請校長核定後施行，修正時亦同。', '<2-hop>  [202110041541471043.md]\n\n國立中山大學資訊工程學系 碩士班暨資訊安全碩士班研究生學位考試相關規定\n\n109 學年度起入學新生適用\n\n92 年 1 月 8 日系務會議修正通過 92 年 3 月 25 日工學院院務會議修正通過 94 年 5 月 4 日系務會議修正通過 95 年 6 月 29 日工學院院務會議修正通過 99 年 10 月 27 日系務會議修正通過 99 年 12 月 15 日工學院院務會議修正通過 101 年 2 月 15 日系務會議修正通過 101 年 3 月 14 日系務會議修正通過 101 年 3 月 28 日工學院院務會議修正通過 103 年 4 月 18 日系務會議修正通過 103 年 6 月 6 日系務會議修正通過 103 年 6 月 13 日工學院院務會議修正通過 106 年 6 月 19 日系務會議修正通過 106 年 6 月 28 日工學院院務會議修正通過 108 年 8 月 23 日系務會議修正通過 108 年 8 月 27 日工學院院務會議修正通過 109 年 5 月 8 日系務會議修正通過\n\n109 年 5 月 25 日工學院院務會議修正通過\n\n一、依據教育部頒「學位授予法」 、本校「學則」及「研究生學位考試施行細則」訂定之。\n\n二、在學期間相關事項：\n\n(一)修業年限：依教育部規定一至四年(不含保留入學及休學期間)。\n\n(二)須修畢最低畢業學分數 28 學分 ( 含必修課程 ) 。\n\n(三)學分制度及修課要求：\n\n共同必修課程：「書報討論（一）」至「書報討論（四）」。\n\n專業必修課程：\n\n(1) 資訊工程碩士班：「超大型積體電路設計」、「計算機結構」、「高等 電腦網路」、「演算法設計與分析」、「高等作業系統」等專業課程， 學生畢業前至少需擇 2 科修畢通過。\n\n(2) 資訊安全碩士班：基礎必修「計算機結構」、「高等電腦網路」、「演 算法設計與分析」、「高等作業系統」等專業課程，學生畢業前至少需 擇 1 科修畢通過；核心必修「安全密碼協定」 、 「數位簽章機制與應用」、 「密碼學」、「安全程式設計」、「駭客攻防與電腦鑑識技術」、「網 路安全」等專業課程，學生畢業前至少需擇 3 科修畢通過。\n\n專題或專題研究課程最多採計 6 學分為畢業學分。\n\n本系英文相關課程最多採計 3 學分為畢業學分。\n\n本系學生畢業英文成績至少須達下列兩項標準之一：\n\n(1) 須通過下列任一檢定標準且通過之測驗檢定日期應以入學前 2 年之後取 得為限：\n\n(a) 多益測驗 TOEIC 成績達 600 分以上。\n\n(b) 全民英檢 (GEPT) 中高級初試 ( 含 ) 以上。\n\n(c) 託福紙筆測驗 (TOFEL ITP)500 分 ( 含 ) 以上\n\n(d) 託福網路化測驗 (TOFEL-iBT)61 分 ( 含 ) 以上。\n\n(e) 國際英語能力測驗 (IELTS)5 級 ( 含 ) 以上。\n\n(2) 修習本系課程委員會指定之英文相關課程且及格。若以修習英文相關課\n\n程方式取代英文成績者，該學分則不納入畢業學分。\n\n須達本系規定之英文成績標準後，得以申請學位口試。\n\n(四)指導教授選派：\n\n本系學生以選擇本系助理教授 ( 含 ) 以上專任教師擔任指導教授為原則。\n\n若有特殊原因，得選擇非本系之指導教授，但必須選擇一位本系助理教授 ( 含 ) 以上專任教師為共同指導教授。若需由系外教師共同指導時，需經指導教授 同意後，以書面向本系報備。\n\n若因特殊原因需更換指導教授時，應先徵得原指導教授同意，並經學術委員 會審核通過。更換指導教授一年後才可以提出學位論文考試申請。\n\n三、碩士學位考試：\n\n學期之定義：上學期自每年八月一日至次年一月三十一日、下學期自每年二月一日 至七月三十一日。\n\n(一)論文提審：\n\n本系學生於學位論文口試前，須繳交論文提審報告，並通過論文提審：\n\n報告內容含研究題目、動機、相關研究探討、研究目標、方法及進行步驟、 研究成果及貢獻與參考文獻等等。\n\n指導教授就各申請案組成提審委員會，由三至五位系內教師組成，或外系、 外校教師組成，提審委員會針對申請者之書面報告決定申請者是否通過提審； 必要時，提審委員會得要求申請者進行口頭報告。提審時，需有三分之二 （含） 以上提審委員評定為合格者才為通過。\n\n應屆畢業生須於當年三月三十一日前通過論文提審，否則畢業論文口試時間 至少須延後一學期。延後畢業之學生須於論文口試前至少一個月通過論文提 審。\n\n(二)學位論文口試：\n\n學位考試委員會置委員三至五人，其中系外委員以至少一人為原則。\n\n學位考試（論文口試）成績不及格而其修業年限尚未屆滿者，得於次學期或 次學年舉行重考，重考以一次為限，經重考一次仍不及格者，依本校學則應 令退學。\n\n四、畢業：符合上述之各項規定者，得提出畢業之申請。\n\n五、本辦法經系務會議、院務會議通過，簽請校長核定後施行，修正時亦同。']",curious student,Perfect grammar,long,"<1-hop>  [201909112106310683.md]

國立中山大學資訊工程學系 碩士班研究生學位考試相關規定

106 學年度起入學新生適用

92 年 1 月 8 日系務會議修正通過 92 年 3 月 25 日工學院院務會議修正通過 94 年 5 月 4 日系務會議修正通過 95 年 6 月 29 日工學院院務會議修正通過 99 年 10 月 27 日系務會議修正通過 99 年 12 月 15 日工學院院務會議修正通過 101 年 2 月 15 日系務會議修正通過 101 年 3 月 14 日系務會議修正通過 101 年 3 月 28 日工學院院務會議修正通過 103 年 4 月 18 日系務會議修正通過 103 年 6 月 6 日系務會議修正通過 103 年 6 月 13 日工學院院務會議修正通過 106 年 6 月 19 日系務會議修正通過

106 年 6 月 28 日工學院院務會議修正通過

一、依據教育部頒「學位授予法」暨其施行細則、本校「學則」及「研究生學位考試施 行細則」訂定之。

二、在學期間相關事項：

(一)修業年限：依教育部規定一至四年(不含保留入學及休學期間)。

(二)須修畢最低畢業學分數 28 學分 ( 含必修課程 ) 。

(三)學分制度及修課要求：

共同必修課程：四個學期「書報討論」（各 1 學分）。

專業必修課程：「超大型積體電路設計」、「計算機結構」、「高等電腦 網路」、「演算法設計與分析」、「高等作業系統」等專業課程，學生畢 業前至少需擇二科修畢通過。

專題或專題研究課程最多採計 6 學分為畢業學分。

本系英文相關課程最多採計 3 學分為畢業學分。

本系碩士班研究生畢業英文成績至少須達下列兩項標準之一：

(1) 須通過下列任一檢定標準且通過之測驗檢定日期應以入學前 2 年之後取 得為限：

(a) 多益測驗 TOEIC 成績達 600 分以上。

(b) 全民英檢 (GEPT) 中高級初試 ( 含 ) 以上。

(c) 託福紙筆測驗 (TOFEL ITP)500 分 ( 含 ) 以上

(d) 託福網路化測驗 (TOFEL-iBT)61 分 ( 含 ) 以上。

(e) 國際英語能力測驗 (IELTS)5 級 ( 含 ) 以上。

(2) 修習本系課程委員會指定之英文相關課程且及格。若以修習英文相關課 程方式取代英文成績者，該學分則不納入畢業學分。

須達本系碩士班研究生規定之英文成績標準後，得以申請學位口試。

(四)指導教授選派：

本系碩士生以選擇本系助理教授 ( 含 ) 以上專任教師擔任指導教授為原則。

若有特殊原因，得選擇非本系之指導教授，但必須選擇一位本系助理教授 ( 含 ) 以上專任教師為共同指導教授。若需由系外教師共同指導時，需經指導教授 同意後，以書面向本系報備。

若因特殊原因需更換指導教授時，應先徵得原指導教授同意，並經學術委員 會審核通過。更換指導教授一年後才可以提出學位論文考試申請。

三、碩士學位考試：

學期之定義：上學期自每年八月一日至次年一月三十一日、下學期自每年二月一日 至七月三十一日。

(一)論文提審：

本系碩士班學生於學位論文口試前，須依下列兩種方式擇一完成論文提審：

於本系「書報討論」課程中進行畢業論文預講，由授課教師或指導教授評 定為合格者才為通過。

繳交論文提審報告並通過下列論文提審程序：

(1) 報告內容含研究題目、動機、相關研究探討、研究目標、方法及進行步 驟、研究成果及貢獻與參考文獻等等。

(2) 指導教授就各申請案組成提審委員會，由三至五位系內教師組成，或外 系、外校教師組成，提審委員會針對申請者之書面報告決定申請者是否 通過提審；必要時，提審委員會得要求申請者進行口頭報告。提審時， 需有三分之二（含）以上提審委員評定為合格者才為通過。

(3) 應屆畢業生須於當年三月三十一日前通過論文提審，否則畢業論文口試 時間至少須延後一學期。延後畢業之學生須於論文口試前至少一個月通 過論文提審。

(二)學位論文口試：

學位考試委員會置委員三至五人，其中系外委員以至少一人為原則。

學位考試（論文口試）成績不及格而其修業年限尚未屆滿者，得於次學期或 次學年舉行重考，重考以一次為限，經重考一次仍不及格者，依本校學則應 令退學。

四、畢業：符合上述之各項規定者，得提出畢業之申請。

五、本辦法經系務會議、院務會議通過，簽請校長核定後施行，修正時亦同。","<2-hop>  [202110041541471043.md]

國立中山大學資訊工程學系 碩士班暨資訊安全碩士班研究生學位考試相關規定

109 學年度起入學新生適用

92 年 1 月 8 日系務會議修正通過 92 年 3 月 25 日工學院院務會議修正通過 94 年 5 月 4 日系務會議修正通過 95 年 6 月 29 日工學院院務會議修正通過 99 年 10 月 27 日系務會議修正通過 99 年 12 月 15 日工學院院務會議修正通過 101 年 2 月 15 日系務會議修正通過 101 年 3 月 14 日系務會議修正通過 101 年 3 月 28 日工學院院務會議修正通過 103 年 4 月 18 日系務會議修正通過 103 年 6 月 6 日系務會議修正通過 103 年 6 月 13 日工學院院務會議修正通過 106 年 6 月 19 日系務會議修正通過 106 年 6 月 28 日工學院院務會議修正通過 108 年 8 月 23 日系務會議修正通過 108 年 8 月 27 日工學院院務會議修正通過 109 年 5 月 8 日系務會議修正通過

109 年 5 月 25 日工學院院務會議修正通過

一、依據教育部頒「學位授予法」 、本校「學則」及「研究生學位考試施行細則」訂定之。

二、在學期間相關事項：

(一)修業年限：依教育部規定一至四年(不含保留入學及休學期間)。

(二)須修畢最低畢業學分數 28 學分 ( 含必修課程 ) 。

(三)學分制度及修課要求：

共同必修課程：「書報討論（一）」至「書報討論（四）」。

專業必修課程：

(1) 資訊工程碩士班：「超大型積體電路設計」、「計算機結構」、「高等 電腦網路」、「演算法設計與分析」、「高等作業系統」等專業課程， 學生畢業前至少需擇 2 科修畢通過。

(2) 資訊安全碩士班：基礎必修「計算機結構」、「高等電腦網路」、「演 算法設計與分析」、「高等作業系統」等專業課程，學生畢業前至少需 擇 1 科修畢通過；核心必修「安全密碼協定」 、 「數位簽章機制與應用」、 「密碼學」、「安全程式設計」、「駭客攻防與電腦鑑識技術」、「網 路安全」等專業課程，學生畢業前至少需擇 3 科修畢通過。

專題或專題研究課程最多採計 6 學分為畢業學分。

本系英文相關課程最多採計 3 學分為畢業學分。

本系學生畢業英文成績至少須達下列兩項標準之一：

(1) 須通過下列任一檢定標準且通過之測驗檢定日期應以入學前 2 年之後取 得為限：

(a) 多益測驗 TOEIC 成績達 600 分以上。

(b) 全民英檢 (GEPT) 中高級初試 ( 含 ) 以上。

(c) 託福紙筆測驗 (TOFEL ITP)500 分 ( 含 ) 以上

(d) 託福網路化測驗 (TOFEL-iBT)61 分 ( 含 ) 以上。

(e) 國際英語能力測驗 (IELTS)5 級 ( 含 ) 以上。

(2) 修習本系課程委員會指定之英文相關課程且及格。若以修習英文相關課

程方式取代英文成績者，該學分則不納入畢業學分。

須達本系規定之英文成績標準後，得以申請學位口試。

(四)指導教授選派：

本系學生以選擇本系助理教授 ( 含 ) 以上專任教師擔任指導教授為原則。

若有特殊原因，得選擇非本系之指導教授，但必須選擇一位本系助理教授 ( 含 ) 以上專任教師為共同指導教授。若需由系外教師共同指導時，需經指導教授 同意後，以書面向本系報備。

若因特殊原因需更換指導教授時，應先徵得原指導教授同意，並經學術委員 會審核通過。更換指導教授一年後才可以提出學位論文考試申請。

三、碩士學位考試：

學期之定義：上學期自每年八月一日至次年一月三十一日、下學期自每年二月一日 至七月三十一日。

(一)論文提審：

本系學生於學位論文口試前，須繳交論文提審報告，並通過論文提審：

報告內容含研究題目、動機、相關研究探討、研究目標、方法及進行步驟、 研究成果及貢獻與參考文獻等等。

指導教授就各申請案組成提審委員會，由三至五位系內教師組成，或外系、 外校教師組成，提審委員會針對申請者之書面報告決定申請者是否通過提審； 必要時，提審委員會得要求申請者進行口頭報告。提審時，需有三分之二 （含） 以上提審委員評定為合格者才為通過。

應屆畢業生須於當年三月三十一日前通過論文提審，否則畢業論文口試時間 至少須延後一學期。延後畢業之學生須於論文口試前至少一個月通過論文提 審。

(二)學位論文口試：

學位考試委員會置委員三至五人，其中系外委員以至少一人為原則。

學位考試（論文口試）成績不及格而其修業年限尚未屆滿者，得於次學期或 次學年舉行重考，重考以一次為限，經重考一次仍不及格者，依本校學則應 令退學。

四、畢業：符合上述之各項規定者，得提出畢業之申請。

五、本辦法經系務會議、院務會議通過，簽請校長核定後施行，修正時亦同。",201909112106310683.md,202110041541471043.md,"['最低畢業學分數 28 學分', '專業必修課程']",工學院↔工學院 | 資訊工程學系↔資訊工程學系,最低畢業學分數 28 學分↔最低畢業學分數 28 學分 | 專業必修課程↔專業必修課程,5.0,5.0,4.96,5.0,5.0,2.0,1.0
